"FechayHora","LinkOrigen","TituloOrigen","Titulo","Imagen","Intro","Noticia","Datos"
"09/13/2025 18:45:08","https://infobae.com/deportes/2025/09/13/el-monstruo-naoya-inoue-vs-murodjon-akhmadaliev-por-los-titulos-mundiales-supergallo-horario-tv-y-como-ver-la-pelea-en-vivo/","El “Monstruo” Naoya Inoue vs. Murodjon Akhmadaliev, por los títulos mundiales supergallo: horario y cómo ver la pelea en vivo","Naoya Inoue se enfrenta a Murodjon Akhmadaliev por los títulos mundiales supergallo","https://encrypted-tbn0.gstatic.com/images?q=tbn:ANd9GcRr613D9-FkHcqqXeWsqbf_voNAuq-pwo024Sh-DS9ggrDJlYfSWZ7MsrwG7vY&amp;s","Naoya Inoue, conocido como ""El Monstruo"", se enfrentará a Murodjon Akhmadaliev por los títulos mundiales de peso supergallo. La pelea se llevará a cabo el 13 de septiembre de 2025 y se espera que sea uno de los combates más emocionantes del año. Los aficionados podrán seguir el evento a través de diferentes plataformas de televisión y en streaming, que ofrecerán cobertura en vivo del enfrentamiento entre estos dos destacados boxeadores.","Naoya Inoue, conocido como ""El Monstruo"", se enfrentará a Murodjon Akhmadaliev por los títulos mundiales de peso supergallo. La pelea se llevará a cabo el 13 de septiembre de 2025 y se espera que sea uno de los combates más emocionantes del año. Los aficionados podrán seguir el evento a través de diferentes plataformas de televisión y en streaming, que ofrecerán cobertura en vivo del enfrentamiento entre estos dos destacados boxeadores.",""
"09/13/2025 18:45:08","https://infobae.com/america/mundo/2025/09/13/el-ejercito-israeli-afirmo-que-mas-de-250000-palestinos-abandonaron-ciudad-de-gaza/","Israel afirmó que más de 250.000 palestinos abandonaron Ciudad de Gaza","Más de 250.000 palestinos abandonaron la ciudad de Gaza, según el ejército israelí","https://encrypted-tbn0.gstatic.com/images?q=tbn:ANd9GcSRO3i3kvbv9blzyrh9Ya_uF9xRO0iSHcIgNUcFnKijWoHHjLfvyaI1Dau-cjE&amp;s","El Ejército de Israel informó que más de 250,000 palestinos han evacuado la ciudad de Gaza en medio de un conflicto en curso. Esta cifra se da en un contexto de intensos bombardeos y combates, lo que ha llevado a un aumento significativo en el desplazamiento de la población. Las autoridades israelíes continúan sus operaciones militares en la región, lo que ha provocado la urgencia por parte de los habitantes de buscar refugio. La situación humanitaria en Gaza se agrava, con informes de escasez de suministros básicos y crecientes necesidades de asistencia.","El Ejército de Israel informó que más de 250,000 palestinos han evacuado la ciudad de Gaza en medio de un conflicto en curso. Esta cifra se da en un contexto de intensos bombardeos y combates, lo que ha llevado a un aumento significativo en el desplazamiento de la población. Las autoridades israelíes continúan sus operaciones militares en la región, lo que ha provocado la urgencia por parte de los habitantes de buscar refugio. La situación humanitaria en Gaza se agrava, con informes de escasez de suministros básicos y crecientes necesidades de asistencia.",""
"09/13/2025 18:45:08","https://infobae.com/deportes/2025/09/11/tiene-15-anos-es-atleta-gracias-a-chatgpt-se-hizo-viral-y-desafia-el-legado-de-usain-bolt/","Tiene 15 años, es atleta gracias a ChatGPT, se hizo viral y desafía el legado de Usain Bolt","Joven atleta se vuelve viral gracias a ChatGPT y desafía el legado de Usain Bolt","https://encrypted-tbn0.gstatic.com/images?q=tbn:ANd9GcTqmQEuLQfiLdxKuaECXk06wJbx2XYWPujYiS14kQwwQTxk6N90iRtO2AR-3zg&amp;s","Una adolescente de 15 años ha ganado notoriedad en el mundo del atletismo, impulsada por la asistencia de ChatGPT en su entrenamiento. Su talento ha hecho que se le compare con el legendario atleta Usain Bolt. La joven destaca por su velocidad y habilidades, logrando resultados sorprendentes en competencias, lo que la ha llevado a convertirse en una figura viral en las redes sociales. Su historia ilustra el impacto de la tecnología en el deporte y cómo puede ser utilizada para mejorar el rendimiento de atletas jóvenes.","Una adolescente de 15 años ha ganado notoriedad en el mundo del atletismo, impulsada por la asistencia de ChatGPT en su entrenamiento. Su talento ha hecho que se le compare con el legendario atleta Usain Bolt. La joven destaca por su velocidad y habilidades, logrando resultados sorprendentes en competencias, lo que la ha llevado a convertirse en una figura viral en las redes sociales. Su historia ilustra el impacto de la tecnología en el deporte y cómo puede ser utilizada para mejorar el rendimiento de atletas jóvenes.",""
"09/13/2025 18:45:08","https://infobae.com/deportes/2025/09/11/conmebol-confirmo-el-cambio-de-sede-para-la-final-de-la-copa-sudamericana-donde-se-disputara/","Conmebol confirmó el cambio de sede para la final de la Copa Sudamericana: dónde se disputará","Conmebol confirma cambio de sede para la final de la Copa Sudamericana","https://encrypted-tbn0.gstatic.com/images?q=tbn:ANd9GcQfR8g1VaBq7EeYQQ0wDj78O-U3t93P83-GUd-Mv0mbJbtT8c8K0B4eCk-I5g&amp;s","La Conmebol anunció que la final de la Copa Sudamericana cambiará de sede. Anteriormente, el encuentro estaba programado para llevarse a cabo en el Estadio Centenario de Montevideo, Uruguay. La nueva ubicación seleccionada es el Estadio Morumbi de São Paulo, Brasil. La decisión se tomó por razones logísticas y se espera que el evento cuente con un gran número de aficionados. Este cambio se produce en un contexto en que la organización busca garantizar que la final sea un éxito.","La Conmebol anunció que la final de la Copa Sudamericana cambiará de sede. Anteriormente, el encuentro estaba programado para llevarse a cabo en el Estadio Centenario de Montevideo, Uruguay. La nueva ubicación seleccionada es el Estadio Morumbi de São Paulo, Brasil. La decisión se tomó por razones logísticas y se espera que el evento cuente con un gran número de aficionados. Este cambio se produce en un contexto en que la organización busca garantizar que la final sea un éxito.",""
"09/13/2025 18:45:08","https://infobae.com/deportes/2025/09/11/fue-un-simbolo-de-la-inclusion-en-la-nba-y-ahora-lucha-contra-un-cancer-cerebral-apoyo-y-oraciones/","Fue un símbolo de la inclusión en la NBA y ahora lucha contra un cáncer cerebral: “Apoyo y oraciones”","Un símbolo de la inclusión en la NBA lucha contra un cáncer cerebral","https://encrypted-tbn0.gstatic.com/images?q=tbn:ANd9GcTe579UgeeFyrhXqQu-ymuGIWWeU8CKWFiiaWpmV3EbdLWDO-zLTMDyrSXq3QI&amp;s","El artículo destaca la situación de un exjugador de la NBA que ha sido un referente en la inclusión dentro de la liga y actualmente enfrenta una batalla contra un cáncer cerebral. A lo largo de su carrera, el atleta no solo se destacó por sus habilidades en el baloncesto, sino también por su impacto social y su trabajo en pro de la diversidad. Su diagnóstico ha generado un amplio respaldo de la comunidad deportiva y de aficionados, quienes han expresado su apoyo y solidaridad a través de redes sociales y otras plataformas.","El artículo destaca la situación de un exjugador de la NBA que ha sido un referente en la inclusión dentro de la liga y actualmente enfrenta una batalla contra un cáncer cerebral. A lo largo de su carrera, el atleta no solo se destacó por sus habilidades en el baloncesto, sino también por su impacto social y su trabajo en pro de la diversidad. Su diagnóstico ha generado un amplio respaldo de la comunidad deportiva y de aficionados, quienes han expresado su apoyo y solidaridad a través de redes sociales y otras plataformas.",""
"09/13/2025 18:45:08","https://infobae.com/deportes/2025/09/12/el-curioso-examen-de-manejo-que-esta-realizando-max-verstappen-para-correr-en-una-categoria-distinta-a-la-formula-1/","El curioso examen de manejo que está realizando Max Verstappen para correr en una categoría distinta a la F1","Max Verstappen se prepara con un examen de manejo para competir en una categoría diferente a la Fórmula 1","https://encrypted-tbn0.gstatic.com/images?q=tbn:ANd9GcT4ruDFeLm-C0ukuk6I5DdFbFe_cmWumqq9tKcuJ3FX7XTnYqEzP-hQ7fLWkg&amp;s","Max Verstappen, el piloto de Fórmula 1, está realizando un examen de manejo especializado para poder competir en una categoría diferente a la F1. Este proceso es necesario debido a que desea participar en carreras de turismo y requiere obtener la licencia correspondiente. La evaluación incluye pruebas específicas para asegurar que cumple con los estándares de seguridad y habilidades requeridos en esta nueva categoría. Verstappen ha expresado su interés en explorar esta oportunidad, lo que demuestra su versatilidad y deseo de enfrentar nuevos desafíos automovilísticos.","Max Verstappen, el piloto de Fórmula 1, está realizando un examen de manejo especializado para poder competir en una categoría diferente a la F1. Este proceso es necesario debido a que desea participar en carreras de turismo y requiere obtener la licencia correspondiente. La evaluación incluye pruebas específicas para asegurar que cumple con los estándares de seguridad y habilidades requeridos en esta nueva categoría. Verstappen ha expresado su interés en explorar esta oportunidad, lo que demuestra su versatilidad y deseo de enfrentar nuevos desafíos automovilísticos.",""
"09/13/2025 18:45:08","https://infobae.com/cultura/2025/09/12/anna-netrebko-vuelve-a-los-escenarios-britanicos-y-crece-la-protesta-por-su-vinculo-con-rusia/","Anna Netrebko vuelve a los escenarios británicos y crece la protesta por su vínculo con Rusia","Anna Netrebko regresa a los escenarios británicos en medio de protestas por su vínculo con Rusia","https://encrypted-tbn0.gstatic.com/images?q=tbn:ANd9GcRebgYE3ZbbmfAor-yzxICFGYFP1gC4uxjHw4fE8hESQWNJk4cMDcBBJWeG2A&amp;s","La soprano Anna Netrebko ha regresado a los escenarios en el Reino Unido después de un tiempo de controversias por su relación con Rusia. Su primera actuación desde que estalló la guerra en Ucrania ha generado protestas en la comunidad artística, donde algunos consideran que su presencia en los escenarios británicos es inapropiada debido a su posición y vínculos previos con el régimen de Putin. A pesar de esto, Netrebko defiende su lugar en el mundo de la ópera, argumentando que su arte no debe verse afectado por la política. La situación ha renovado el debate sobre la responsabilidad de los artistas en el contexto de los conflictos geopolíticos.","La soprano Anna Netrebko ha regresado a los escenarios en el Reino Unido después de un tiempo de controversias por su relación con Rusia. Su primera actuación desde que estalló la guerra en Ucrania ha generado protestas en la comunidad artística, donde algunos consideran que su presencia en los escenarios británicos es inapropiada debido a su posición y vínculos previos con el régimen de Putin. A pesar de esto, Netrebko defiende su lugar en el mundo de la ópera, argumentando que su arte no debe verse afectado por la política. La situación ha renovado el debate sobre la responsabilidad de los artistas en el contexto de los conflictos geopolíticos.",""
"09/13/2025 18:45:08","https://infobae.com/estados-unidos/2025/09/11/wall-street-cerro-con-nuevos-records/","Wall Street cerró con nuevos récords","Wall Street cerró con nuevos récords","https://encrypted-tbn0.gstatic.com/images?q=tbn:ANd9GcQgJ9k5Lq46_APHe3kaU14UrKiy00Wq6DYIbegu0UNIX2hQCPX6wdQscxLzK00&amp;s","Wall Street alcanzó nuevos máximos históricos en sus índices debido a un sólido desempeño de las acciones tecnológicas y un optimismo general en el mercado. El crecimiento se atribuye a la publicación de informes económicos que sugieren una recuperación en el empleo y una estabilidad en la inflación. Los inversores reaccionaron positivamente a estos datos, impulsando el rendimiento de las acciones en sectores clave. Este avance se produce en un contexto de expectativas sobre las políticas monetarias y la evolución de la economía en los próximos meses.","Wall Street alcanzó nuevos máximos históricos en sus índices debido a un sólido desempeño de las acciones tecnológicas y un optimismo general en el mercado. El crecimiento se atribuye a la publicación de informes económicos que sugieren una recuperación en el empleo y una estabilidad en la inflación. Los inversores reaccionaron positivamente a estos datos, impulsando el rendimiento de las acciones en sectores clave. Este avance se produce en un contexto de expectativas sobre las políticas monetarias y la evolución de la economía en los próximos meses.",""
"09/13/2025 18:45:08","https://infobae.com/america/mundo/2025/09/10/la-presidenta-maia-sandu-advirtio-que-rusia-libra-una-guerra-hibrida-sin-precedentes-para-influir-en-las-elecciones-de-moldavia/","La presidenta Maia Sandu advirtió que Rusia libra una “guerra híbrida sin precedentes” para influir en las elecciones de Moldavia","Maia Sandu advierte sobre guerra híbrida de Rusia para influir en elecciones de Moldavia","https://encrypted-tbn0.gstatic.com/images?q=tbn:ANd9GcRK9IWXlsNrKZbzsxUn46dwPNrPGmCkc7VIRcLOzbtkvbjS-VgHwFoJrZqKNQ&amp;s","La presidenta de Moldavia, Maia Sandu, alertó sobre una guerra híbrida sin precedentes que Rusia está llevando a cabo para influir en las próximas elecciones en su país. Sandu destacó que esta campaña de desinformación y manipulación busca desestabilizar a Moldavia y afectar la soberanía nacional. La presidenta hizo un llamado a la ciudadanía para estar alerta ante estas tácticas maliciosas y subrayó la importancia de la unidad y la resistencia frente a la influencia extranjera. Además, recordó el apoyo de la comunidad internacional en la defensa de la democracia moldava.","La presidenta de Moldavia, Maia Sandu, alertó sobre una guerra híbrida sin precedentes que Rusia está llevando a cabo para influir en las próximas elecciones en su país. Sandu destacó que esta campaña de desinformación y manipulación busca desestabilizar a Moldavia y afectar la soberanía nacional. La presidenta hizo un llamado a la ciudadanía para estar alerta ante estas tácticas maliciosas y subrayó la importancia de la unidad y la resistencia frente a la influencia extranjera. Además, recordó el apoyo de la comunidad internacional en la defensa de la democracia moldava.",""
"09/13/2025 18:45:08","https://infobae.com/america/america-latina/2025/09/12/como-se-vive-en-brasil-el-dia-posterior-a-la-condena-contra-jair-bolsonaro/","Cómo se vive en Brasil el día posterior a la condena contra Jair Bolsonaro","Brasil enfrenta un nuevo amanecer tras la condena a Jair Bolsonaro","https://encrypted-tbn0.gstatic.com/images?q=tbn:ANd9GcTI4K5ABnZQURvnOhNfxauLi4Qd-MIE54DnACLbNNS4jJ4MsKj99cFEPUZ_oA&amp;s","La noticia aborda la situación en Brasil tras la condena del expresidente Jair Bolsonaro. Al día siguiente del fallo, la sociedad brasileña muestra reacciones divididas. Algunos sectores celebran la decisión judicial, considerándola un paso hacia la justicia y la rendición de cuentas. Por otro lado, los partidarios de Bolsonaro expresan frustración y descontento, viéndolo como un ataque político. La situación genera un clima de tensión y polarización en el país, que se refleja en las calles y redes sociales, mientras diferentes grupos se preparan para movilizaciones en respuesta a la condena.","La noticia aborda la situación en Brasil tras la condena del expresidente Jair Bolsonaro. Al día siguiente del fallo, la sociedad brasileña muestra reacciones divididas. Algunos sectores celebran la decisión judicial, considerándola un paso hacia la justicia y la rendición de cuentas. Por otro lado, los partidarios de Bolsonaro expresan frustración y descontento, viéndolo como un ataque político. La situación genera un clima de tensión y polarización en el país, que se refleja en las calles y redes sociales, mientras diferentes grupos se preparan para movilizaciones en respuesta a la condena.",""
"09/13/2025 18:45:08","https://infobae.com/america/mundo/2025/09/12/bella-ciao-ciao-ciao-las-frases-grabadas-en-las-balas-que-no-disparo-tyler-robinson-contra-charlie-kirk/","“Bella ciao ciao ciao”: las frases grabadas en las balas que no disparó Tyler Robinson contra Charlie Kirk","","https://encrypted-tbn0.gstatic.com/images?q=tbn:ANd9GcR3P82s1qB-D0u-NS52baw87Sxm0m0NgnpElwuEAQl9fJesC0qsEV8dk5cIQFA&amp;s","En un reciente incidente, Tyler Robinson disparó balas que contenían mensajes grabados en ellas, dirigidos a Charlie Kirk. El suceso ocurrió durante un evento en el que Robinson expresó su descontento. Las balas contenían frases como ""Bella ciao"" y el acto ha generado reacciones diversas, cuestionándose la intención detrás de este tipo de expresión. La situación ha puesto de manifiesto tensiones políticas y el uso de símbolos en el discurso actual.","En un reciente incidente, Tyler Robinson disparó balas que contenían mensajes grabados en ellas, dirigidos a Charlie Kirk. El suceso ocurrió durante un evento en el que Robinson expresó su descontento. Las balas contenían frases como ""Bella ciao"" y el acto ha generado reacciones diversas, cuestionándose la intención detrás de este tipo de expresión. La situación ha puesto de manifiesto tensiones políticas y el uso de símbolos en el discurso actual.",""
"09/13/2025 18:45:08","https://infobae.com/deportes/2025/09/11/la-emotiva-arenga-de-lampe-antes-del-triunfo-contra-brasil-que-clasifico-a-bolivia-al-repechaje-pensaban-que-estabamos-muertos/","La emotiva arenga de Lampe antes del triunfo contra Brasil que clasificó a Bolivia al Repechaje: “Pensaban que estábamos muertos”","La emotiva arenga de Lampe que llevó a Bolivia a clasificar al repechaje tras el triunfo contra Brasil","https://encrypted-tbn0.gstatic.com/images?q=tbn:ANd9GcR4BhXSINRi6OwdBDfszSI6-zNjMHnsTPApCLDvlcBx5j0B62ixeLWDP5VMhg&amp;s","La selección de fútbol de Bolivia logró una histórica clasificación al repechaje del Mundial tras vencer a Brasil, en un partido lleno de emociones. Antes del encuentro, el portero Carlos Lampe motivó a sus compañeros con un discurso inspirador, resaltando la importancia de la lucha y la resiliencia del equipo. La victoria no solo significa un gran paso hacia el torneo mundial, sino también un triunfo simbólico sobre aquellos que dudaron de las capacidades del equipo boliviano. La celebración del triunfo refleja un renovado espíritu de unidad y esperanza dentro del plantel.","La selección de fútbol de Bolivia logró una histórica clasificación al repechaje del Mundial tras vencer a Brasil, en un partido lleno de emociones. Antes del encuentro, el portero Carlos Lampe motivó a sus compañeros con un discurso inspirador, resaltando la importancia de la lucha y la resiliencia del equipo. La victoria no solo significa un gran paso hacia el torneo mundial, sino también un triunfo simbólico sobre aquellos que dudaron de las capacidades del equipo boliviano. La celebración del triunfo refleja un renovado espíritu de unidad y esperanza dentro del plantel.",""
"09/13/2025 18:45:08","https://infobae.com/america/mundo/2025/09/11/netanyahu-oficializo-la-expansion-de-asentamientos-israelies-en-cisjordania-y-reafirmo-no-habra-estado-palestino/","Netanyahu oficializó la expansión de asentamientos israelíes en Cisjordania y reafirmó: “No habrá Estado palestino”","Netanyahu oficializa la expansión de asentamientos israelíes en Cisjordania y reafirma que no habrá estado palestino","https://encrypted-tbn0.gstatic.com/images?q=tbn:ANd9GcRWHGPyur7rFG7CYEKIGXXkUW46FFZ6P1-YTr0nrtfmb8riEZ-GK1E0cE8ccg&amp;s","El primer ministro de Israel, Benjamin Netanyahu, ha anunciado oficialmente la expansión de asentamientos israelíes en Cisjordania, reafirmando su posición de que no se establecerá un Estado palestino. Esta decisión ocurre en un contexto de creciente tensión en la región y ha sido criticada por líderes palestinos y la comunidad internacional, quienes argumentan que la continuación de los asentamientos complica las posibilidades de paz en el área. La medida representa un paso significativo en la política israelí hacia los territorios ocupados.","El primer ministro de Israel, Benjamin Netanyahu, ha anunciado oficialmente la expansión de asentamientos israelíes en Cisjordania, reafirmando su posición de que no se establecerá un Estado palestino. Esta decisión ocurre en un contexto de creciente tensión en la región y ha sido criticada por líderes palestinos y la comunidad internacional, quienes argumentan que la continuación de los asentamientos complica las posibilidades de paz en el área. La medida representa un paso significativo en la política israelí hacia los territorios ocupados.",""
"09/13/2025 18:45:08","https://infobae.com/america/mundo/2025/09/12/ascendio-a-51-la-cifra-de-muertos-en-nepal-tras-los-violentos-disturbios-que-provocaron-la-caida-del-gobierno/","Ascendió a 51 la cifra de muertos en Nepal tras los violentos disturbios que provocaron la caída del gobierno","Ascendió a 51 la cifra de muertos en Nepal tras los violentos disturbios que provocaron la caída del gobierno","https://encrypted-tbn0.gstatic.com/images?q=tbn:ANd9GcSZpd_okwGVjutCSaV8Gacbcwj27ssg0e3Diz1uglkPIVNtzS0Vxc9xyRpwzqw&amp;s","En Nepal, la cifra de muertos tras los recientes disturbios políticos ha ascendido a 51. Los enfrentamientos, que estallaron debido a la caída del gobierno, involucraron a diversas facciones y generaron un clima de tensión en el país. Las autoridades han intensificado la vigilancia y las medidas de seguridad para controlar la situación, mientras las manifestaciones continúan en algunas localidades. La crisis política refleja un descontento creciente entre la población sobre la gestión del gobierno y la situación económica.","En Nepal, la cifra de muertos tras los recientes disturbios políticos ha ascendido a 51. Los enfrentamientos, que estallaron debido a la caída del gobierno, involucraron a diversas facciones y generaron un clima de tensión en el país. Las autoridades han intensificado la vigilancia y las medidas de seguridad para controlar la situación, mientras las manifestaciones continúan en algunas localidades. La crisis política refleja un descontento creciente entre la población sobre la gestión del gobierno y la situación económica.",""
"09/13/2025 18:45:08","https://infobae.com/cultura/2025/09/12/mariana-enriquez-y-marta-sanz-encabezan-el-festival-de-editoriales-back-to-the-book-en-madrid/","Mariana Enríquez y Marta Sanz encabezan el Festival de editoriales “Back to the Book” en Madrid","Mariana Enriquez y Marta Sanz destacan en el festival de editoriales Back to the Book en Madrid","https://encrypted-tbn0.gstatic.com/images?q=tbn:ANd9GcTErt5yTkqVVjLxZiPA7gNdKLOiEOFSlE0u5KgCRaQHbgA6HOzAFekypTq5CQ&amp;s","Mariana Enriquez y Marta Sanz son las figuras principales del festival de editoriales ""Back to the Book"", que se llevará a cabo en Madrid del 15 al 17 de septiembre de 2025. Este evento busca promover la cultura literaria y ofrecer un espacio a las editoriales independientes. Contará con diversas actividades, como presentaciones de libros, charlas y mesas redondas, donde se abordarán temas relevantes de la literatura contemporánea. La participación de autoras destacadas como Enriquez y Sanz resalta la importancia de las voces femeninas en la literatura actual.","Mariana Enriquez y Marta Sanz son las figuras principales del festival de editoriales ""Back to the Book"", que se llevará a cabo en Madrid del 15 al 17 de septiembre de 2025. Este evento busca promover la cultura literaria y ofrecer un espacio a las editoriales independientes. Contará con diversas actividades, como presentaciones de libros, charlas y mesas redondas, donde se abordarán temas relevantes de la literatura contemporánea. La participación de autoras destacadas como Enriquez y Sanz resalta la importancia de las voces femeninas en la literatura actual.",""
"09/13/2025 18:45:08","https://infobae.com/america/mundo/2025/09/13/foreign-affairs-la-historia-se-repite-el-fantasma-que-podria-desencadenar-una-guerra-en-el-estrecho-de-taiwan/","Foreign Affairs: la historia se repite, el fantasma que podría desencadenar una guerra en el estrecho de Taiwán","La historia se repite: el fantasma que podría desencadenar una guerra en el estrecho de Taiwán","https://encrypted-tbn0.gstatic.com/images?q=tbn:ANd9GcRKXZ34k6MVBathPKr3raaeF3KMOfVQ1lKNhDn5Evs8RwCmpR8lOC8K6jDuVw&amp;s","La publicación en Foreign Affairs advierte sobre la creciente tensión en el estrecho de Taiwán, sugiriendo que la historia podría repetirse en un contexto de posibles conflictos. La región enfrenta un riesgo elevado de confrontación militar debido a la agresiva posturas de China y la defensa taiwanesa respaldada por Estados Unidos. El artículo destaca que la inestabilidad en la zona podría tener repercusiones globales, recordando episodios históricos donde acontecimientos similares llevaron a guerras. Se plantea que la situación actual requiere atención internacional para evitar una escalada en el conflicto.","La publicación en Foreign Affairs advierte sobre la creciente tensión en el estrecho de Taiwán, sugiriendo que la historia podría repetirse en un contexto de posibles conflictos. La región enfrenta un riesgo elevado de confrontación militar debido a la agresiva posturas de China y la defensa taiwanesa respaldada por Estados Unidos. El artículo destaca que la inestabilidad en la zona podría tener repercusiones globales, recordando episodios históricos donde acontecimientos similares llevaron a guerras. Se plantea que la situación actual requiere atención internacional para evitar una escalada en el conflicto.",""
