"FechayHora","LinkOrigen","TituloOrigen","Titulo","Imagen","Intro","Noticia","Datos"
"10/06/2025 12:00:22","https://infobae.com/america/mundo/2025/10/06/las-acciones-japonesas-subieron-casi-un-5-tras-la-eleccion-de-sanae-takaichi-como-lider-del-partido-liberal-democratico/","Las acciones japonesas subieron casi un 5% tras la elección de Sanae Takaichi como líder del Partido Liberal Democrático","Acciones japonesas suben casi un 5% tras elección de Sanae Takaichi como líder del Partido Liberal Democrático","https://encrypted-tbn0.gstatic.com/images?q=tbn:ANd9GcT8q1JXEYGhR-yUsz-q8TiRYn6VP5YKtUoIretPR0T43wp-HEfIs285CgrvWQ&amp;s","Las acciones en Japón experimentaron un aumento de casi el 5% tras la elección de Sanae Takaichi como nueva líder del Partido Liberal Democrático. Este ascenso se enmarca en un contexto electoral que ha generado optimismo en los mercados, dado que Takaichi es vista como una figura que puede impulsar políticas procrecimiento y continuar con la agenda tradicional del partido. La reacción positiva del mercado refleja la confianza de los inversores en el liderazgo de Takaichi y sus potenciales políticas económicas.","Las acciones en Japón experimentaron un aumento de casi el 5% tras la elección de Sanae Takaichi como nueva líder del Partido Liberal Democrático. Este ascenso se enmarca en un contexto electoral que ha generado optimismo en los mercados, dado que Takaichi es vista como una figura que puede impulsar políticas procrecimiento y continuar con la agenda tradicional del partido. La reacción positiva del mercado refleja la confianza de los inversores en el liderazgo de Takaichi y sus potenciales políticas económicas.",""
"10/06/2025 12:00:22","https://infobae.com/cultura/2025/10/06/la-sorprendente-influencia-de-los-chismes-en-la-revolucion-francesa/","La sorprendente influencia de los chismes en la Revolución francesa","La sorprendente influencia de los chismes en la Revolución Francesa","https://encrypted-tbn0.gstatic.com/images?q=tbn:ANd9GcTMhv8hWHXUOo5KDcGTke3gcROWliVo_rU2erGhV6_DTkYBQ1KB2wt6mBKXZA&amp;s","Un análisis reciente destaca el papel fundamental de los chismes y la propagación de rumores en el contexto de la Revolución Francesa. Se señala que estos elementos no solo reflejaban el descontento social, sino que también contribuían a moldear la percepción pública y a movilizar a las masas en torno a ideales republicanos. La comunicación informal, a través de redes sociales de la época, como cafés y panfletos, facilitó que la información circulara rápidamente, influyendo en la opinión pública y en la política. Esto sugiere que los chismes actuaron como un catalizador en el proceso revolucionario, impactando en decisiones cruciales y en la dinámica del poder en Francia.","Un análisis reciente destaca el papel fundamental de los chismes y la propagación de rumores en el contexto de la Revolución Francesa. Se señala que estos elementos no solo reflejaban el descontento social, sino que también contribuían a moldear la percepción pública y a movilizar a las masas en torno a ideales republicanos. La comunicación informal, a través de redes sociales de la época, como cafés y panfletos, facilitó que la información circulara rápidamente, influyendo en la opinión pública y en la política. Esto sugiere que los chismes actuaron como un catalizador en el proceso revolucionario, impactando en decisiones cruciales y en la dinámica del poder en Francia.",""
"10/06/2025 12:00:22","https://infobae.com/america/mundo/2025/10/05/la-ue-dijo-que-rusia-oculta-su-fracaso-militar-en-ucrania-con-ataques-terroristas-contra-la-poblacion-civil/","La UE dijo que Rusia oculta su “fracaso” militar en Ucrania “con ataques terroristas” contra la población civil","La UE afirma que Rusia oculta su fracaso militar en Ucrania con ataques terroristas a civiles","https://encrypted-tbn0.gstatic.com/images?q=tbn:ANd9GcRG3yXSc7IvVmbkJehtqCLStUBQt2_itWIdqGDPD3nRON-31XrWI-2400095fo&amp;s","La Unión Europea ha acusado a Rusia de encubrir su fracaso militar en Ucrania mediante ataques dirigidos a la población civil, los cuales califica de terroristas. Esta declaración surge en un contexto de escalada de la violencia, donde se han registrado bombardeos en ciudades ucranianas que han dejado múltiples víctimas y destrucción. La UE sostiene que estas acciones buscan desestabilizar aún más al país y desviar la atención de los problemas internos de Rusia y su desempeño en el conflicto bélico.","La Unión Europea ha acusado a Rusia de encubrir su fracaso militar en Ucrania mediante ataques dirigidos a la población civil, los cuales califica de terroristas. Esta declaración surge en un contexto de escalada de la violencia, donde se han registrado bombardeos en ciudades ucranianas que han dejado múltiples víctimas y destrucción. La UE sostiene que estas acciones buscan desestabilizar aún más al país y desviar la atención de los problemas internos de Rusia y su desempeño en el conflicto bélico.",""
"10/06/2025 12:00:22","https://infobae.com/america/mundo/2025/10/05/daniel-noboa-advirtio-que-les-aplicara-la-ley-como-delincuentes-a-los-indigenas-que-decidan-marchar-sobre-quito/","Daniel Noboa advirtió que les aplicará la ley “como delincuentes” a los indígenas que decidan marchar sobre Quito","Daniel Noboa advierte que aplicará la ley a indígenas que marchen sobre Quito","https://encrypted-tbn0.gstatic.com/images?q=tbn:ANd9GcTIlSa5aRaCNhOKXkg41d6M9FSb8H4pfMn7UYqUkAlLoX1TuaTtPyA1CcAhdg&amp;s","Daniel Noboa, presidente de Ecuador, advirtió que aplicará la ley con firmeza a los grupos indígenas que planeen movilizarse hacia Quito. Esta declaración se produce en el contexto de tensiones sociales en el país. Noboa enfatizó que se actuará de acuerdo con los marcos legales, considerando cualquier intento de disturbio o violencia como actos delictivos. La advertencia busca disuadir a los líderes indígenas de llevar a cabo protestas masivas, en medio de un clima de creciente descontento social.","Daniel Noboa, presidente de Ecuador, advirtió que aplicará la ley con firmeza a los grupos indígenas que planeen movilizarse hacia Quito. Esta declaración se produce en el contexto de tensiones sociales en el país. Noboa enfatizó que se actuará de acuerdo con los marcos legales, considerando cualquier intento de disturbio o violencia como actos delictivos. La advertencia busca disuadir a los líderes indígenas de llevar a cabo protestas masivas, en medio de un clima de creciente descontento social.",""
"10/06/2025 12:00:22","https://infobae.com/deportes/2025/10/04/los-pumas-buscaran-cerrar-el-rugby-championship-con-un-golpe-ante-los-poderosos-springboks-hora-tv-y-formaciones/","Sudáfrica se consagró campeón del Rugby Championship tras vencer a la Argentina por 29-27 en Londres","Los Pumas buscarán cerrar el Rugby Championship con un golpe ante los Springboks","https://encrypted-tbn0.gstatic.com/images?q=tbn:ANd9GcRF_5a0id8sY93CUcpFUwMdvwyETVaH7bcOy1aoK6dN5a7JhIiNSgelaGMDros&amp;s","Los Pumas se preparan para enfrentar a Sudáfrica en el último partido del Rugby Championship, buscando cerrar el torneo con una victoria que les permita consolidar su crecimiento en la competición. El encuentro se llevará a cabo en el Estadio de la ciudad de Durban, y se espera una dura batalla frente a los Springboks, actuales campeones del mundo. Argentina alineará un equipo competitivo, con varios jugadores clave en el plantel, mientras que Sudáfrica buscará recuperar la confianza después de una temporada irregular. El partido será transmitido por televisión, y se generará una gran expectativa entre los aficionados.","Los Pumas se preparan para enfrentar a Sudáfrica en el último partido del Rugby Championship, buscando cerrar el torneo con una victoria que les permita consolidar su crecimiento en la competición. El encuentro se llevará a cabo en el Estadio de la ciudad de Durban, y se espera una dura batalla frente a los Springboks, actuales campeones del mundo. Argentina alineará un equipo competitivo, con varios jugadores clave en el plantel, mientras que Sudáfrica buscará recuperar la confianza después de una temporada irregular. El partido será transmitido por televisión, y se generará una gran expectativa entre los aficionados.",""
"10/06/2025 12:00:22","https://infobae.com/america/mundo/2025/10/03/una-de-las-victimas-del-atentado-terrorista-contra-la-sinagoga-de-manchester-murio-por-disparos-de-la-policia/","Una de las víctimas del atentado terrorista contra la sinagoga de Manchester murió por disparos de la Policía","Una de las víctimas del atentado contra la sinagoga de Manchester murió por disparos de la policía","https://encrypted-tbn0.gstatic.com/images?q=tbn:ANd9GcS7_H6OXQZpPPvxGXQ5jTqbMZx3UbFjgYjSPGyJbJ5W7orcXLbt5dNaotmE0w&amp;s","Una de las víctimas del atentado terrorista en una sinagoga de Manchester falleció debido a disparos de la policía durante la respuesta al ataque. La situación se generó cuando las fuerzas del orden intentaron neutralizar al agresor, quien había abierto fuego en el lugar. Las autoridades están llevando a cabo una investigación para esclarecer los hechos y las circunstancias que condujeron a la muerte de la víctima a manos de los agentes. Este incidente ha generado un debate sobre el uso de la fuerza por parte de las autoridades en situaciones de crisis.","Una de las víctimas del atentado terrorista en una sinagoga de Manchester falleció debido a disparos de la policía durante la respuesta al ataque. La situación se generó cuando las fuerzas del orden intentaron neutralizar al agresor, quien había abierto fuego en el lugar. Las autoridades están llevando a cabo una investigación para esclarecer los hechos y las circunstancias que condujeron a la muerte de la víctima a manos de los agentes. Este incidente ha generado un debate sobre el uso de la fuerza por parte de las autoridades en situaciones de crisis.",""
"10/06/2025 12:00:22","https://infobae.com/estados-unidos/2025/10/03/los-impactantes-videos-de-la-explosion-en-la-mayor-refineria-de-el-segundo-en-california/","Los videos de la gran explosión que sacudió la refinería más grande de California","Explosión en la mayor refinería de El Segundo en California impacta a la comunidad","https://encrypted-tbn0.gstatic.com/images?q=tbn:ANd9GcTbPQIS_tZcm8TlCG-eXLkgU68tAXXGr5rhpI3oIjrHRvtj-E9wKMMEMZ_mtVQ&amp;s","Un fuerte estallido ocurrió en la refinería El Segundo, ubicada en California, generando momentos de pánico. Los videos compartidos en redes sociales muestran la magnitud de la explosión, que se sintió en áreas cercanas. Las autoridades locales informaron que no hubo heridos significativos a causa del incidente. Se activaron protocolos de emergencia y se iniciaron investigaciones para determinar la causa del estallido. La refinería, que es una de las más grandes de la costa oeste de Estados Unidos, tuvo que suspender sus operaciones temporalmente.","Un fuerte estallido ocurrió en la refinería El Segundo, ubicada en California, generando momentos de pánico. Los videos compartidos en redes sociales muestran la magnitud de la explosión, que se sintió en áreas cercanas. Las autoridades locales informaron que no hubo heridos significativos a causa del incidente. Se activaron protocolos de emergencia y se iniciaron investigaciones para determinar la causa del estallido. La refinería, que es una de las más grandes de la costa oeste de Estados Unidos, tuvo que suspender sus operaciones temporalmente.",""
"10/06/2025 12:00:22","https://infobae.com/america/mundo/2025/10/06/sebastien-lecornu-dimitio-como-primer-ministro-de-francia-apenas-un-dia-despues-de-su-nombramiento/","Sébastien Lecornu renunció como primer ministro de Francia un día después del anuncio de su gabinete","Sébastien Lecornu dimitió como primer ministro de Francia apenas un día después de su nombramiento","https://encrypted-tbn0.gstatic.com/images?q=tbn:ANd9GcQKQQMhr6WYjC6oj61n77_XoecwEG9aCBidVP1PVKEwDwxV2dI9wPDTjtBVpg&amp;s","Sébastien Lecornu renunció como primer ministro de Francia solo un día después de haber sido nombrado para el cargo. Su dimisión se produjo en medio de una crisis política y económica en el país. Lecornu, quien había sido ministro de Defensa, asumió en un momento crítico; sin embargo, su breve mandato reflejó la inestabilidad del gobierno actual. La situación genera incertidumbre sobre quién será su sucesor y las medidas que se implementarán para abordar los desafíos que enfrenta Francia.","Sébastien Lecornu renunció como primer ministro de Francia solo un día después de haber sido nombrado para el cargo. Su dimisión se produjo en medio de una crisis política y económica en el país. Lecornu, quien había sido ministro de Defensa, asumió en un momento crítico; sin embargo, su breve mandato reflejó la inestabilidad del gobierno actual. La situación genera incertidumbre sobre quién será su sucesor y las medidas que se implementarán para abordar los desafíos que enfrenta Francia.",""
"10/06/2025 12:00:22","https://infobae.com/america/mundo/2025/10/06/delegaciones-de-eeuu-israel-y-hamas-se-reunen-en-egipto-para-negociar-el-plan-de-trump-para-la-franja-de-gaza/","Delegaciones de EEUU, Israel y Hamas se reúnen en Egipto para negociar el plan de Trump para la Franja de Gaza","Delegaciones de EE.UU., Israel y Hamas se reúnen en Egipto para negociar el plan de Trump para la Franja de Gaza","https://encrypted-tbn0.gstatic.com/images?q=tbn:ANd9GcSY1q8Kj8vr6kfl6RpFRz7vHoOy4D2-Yxnyvbc5Gj-iXLlzEKPk5F-YVzqPj1I&amp;s","Delegaciones de Estados Unidos, Israel y Hamas se han reunido en Egipto para discutir un plan propuesto por el presidente Trump para la Franja de Gaza. Esta reunión busca avanzar en las negociaciones sobre la situación en la región tras el conflicto reciente. Las partes involucradas intentan llegar a un acuerdo que permita mejorar la situación humanitaria y de seguridad en Gaza. Esta iniciativa es parte de los esfuerzos internacionales por mediar en el conflicto y facilitar un diálogo constructivo entre las naciones.","Delegaciones de Estados Unidos, Israel y Hamas se han reunido en Egipto para discutir un plan propuesto por el presidente Trump para la Franja de Gaza. Esta reunión busca avanzar en las negociaciones sobre la situación en la región tras el conflicto reciente. Las partes involucradas intentan llegar a un acuerdo que permita mejorar la situación humanitaria y de seguridad en Gaza. Esta iniciativa es parte de los esfuerzos internacionales por mediar en el conflicto y facilitar un diálogo constructivo entre las naciones.",""
"10/06/2025 12:00:22","https://infobae.com/america/mundo/2025/10/03/una-mujer-fue-nombrada-por-primera-vez-como-lider-de-la-iglesia-anglicana-y-estara-al-frente-del-arzobispado-de-canterbury/","Una mujer fue nombrada por primera vez como líder de la Iglesia anglicana y estará al frente del arzobispado de Canterbury","Una mujer se convierte en la primera líder de la Iglesia Anglicana y asumirá el arzobispado de Canterbury","https://encrypted-tbn0.gstatic.com/images?q=tbn:ANd9GcRaMF1ZMRJBP8IyFvTw5X2CbkT-IOyLgy1KHO2VSsd-3r7aiRXME4a6_S6M3A&amp;s","Una mujer ha sido nombrada por primera vez como líder de la Iglesia Anglicana, asumiendo el cargo del Arzobispado de Canterbury. Este nombramiento marca un momento histórico para la iglesia, que ha tenido históricamente líderes masculinos. La nueva líder, cuyo nombre no se menciona en el resumen, tomará las riendas de una de las instituciones más influyentes en la comunidad anglicana a nivel global, reflejando un cambio significativo hacia la inclusión de mujeres en posiciones de poder dentro de la organización.","Una mujer ha sido nombrada por primera vez como líder de la Iglesia Anglicana, asumiendo el cargo del Arzobispado de Canterbury. Este nombramiento marca un momento histórico para la iglesia, que ha tenido históricamente líderes masculinos. La nueva líder, cuyo nombre no se menciona en el resumen, tomará las riendas de una de las instituciones más influyentes en la comunidad anglicana a nivel global, reflejando un cambio significativo hacia la inclusión de mujeres en posiciones de poder dentro de la organización.",""
"10/06/2025 12:00:22","https://infobae.com/america/mundo/2025/10/04/rusia-bombardeo-una-estacion-de-trenes-en-el-este-de-ucrania-al-menos-30-heridos/","Rusia bombardeó una estación de trenes en el este de Ucrania: al menos 30 heridos","Rusia bombardea una estación de trenes en el este de Ucrania y deja al menos 30 heridos","https://encrypted-tbn0.gstatic.com/images?q=tbn:ANd9GcQyvDebHln2OnLwIBSC_NG2lcOYld4EWfdwrxqA_VN2r3BVRAAEerUlqjIRTAI&amp;s","Un ataque aéreo en una estación de trenes ubicada en la parte oriental de Ucrania dejó al menos 30 personas heridas. El bombardeo se produjo en medio del conflicto en curso entre Rusia y Ucrania. Las autoridades locales informaron que varios de los heridos son asistentes de la estación y pasajeros. Los servicios de emergencia están trabajando en la zona para atender a los lesionados y evaluar los daños. Este incidente se suma a un aumento de la violencia en la región, en medio de las tensiones prolongadas entre ambos países.","Un ataque aéreo en una estación de trenes ubicada en la parte oriental de Ucrania dejó al menos 30 personas heridas. El bombardeo se produjo en medio del conflicto en curso entre Rusia y Ucrania. Las autoridades locales informaron que varios de los heridos son asistentes de la estación y pasajeros. Los servicios de emergencia están trabajando en la zona para atender a los lesionados y evaluar los daños. Este incidente se suma a un aumento de la violencia en la región, en medio de las tensiones prolongadas entre ambos países.",""
"10/06/2025 12:00:22","https://infobae.com/america/mundo/2025/10/05/netanyahu-advirtio-que-no-procedera-con-el-resto-del-plan-para-gaza-hasta-que-hamas-libere-a-todos-los-rehenes/","Netanyahu advirtió que no procederá con el resto del plan para Gaza hasta que Hamas libere a todos los rehenes","Netanyahu advierte que no avanzará en el plan para Gaza hasta la liberación de todos los rehenes por Hamas","https://encrypted-tbn0.gstatic.com/images?q=tbn:ANd9GcTeL7UjHiXNE_QQf2v6oLvKXcKTRt0LI5IutZUvBtb4EVwxRCa_uEy-qAsGRA&amp;s","El primer ministro israelí, Benjamin Netanyahu, anunció que no avanzará con el resto de su plan para Gaza hasta que Hamas libere a todos los rehenes. Esta decisión se produce en medio de un conflicto en curso entre Israel y el grupo militante palestino. Netanyahu enfatizó la necesidad de priorizar la liberación de los rehenes, antes de cualquier acción adicional en la región. La situación continúa siendo tensa, y los esfuerzos para abordar el conflicto siguen en marcha.","El primer ministro israelí, Benjamin Netanyahu, anunció que no avanzará con el resto de su plan para Gaza hasta que Hamas libere a todos los rehenes. Esta decisión se produce en medio de un conflicto en curso entre Israel y el grupo militante palestino. Netanyahu enfatizó la necesidad de priorizar la liberación de los rehenes, antes de cualquier acción adicional en la región. La situación continúa siendo tensa, y los esfuerzos para abordar el conflicto siguen en marcha.",""
"10/06/2025 12:00:22","https://infobae.com/america/mundo/2025/10/04/israel-avanza-en-los-preparativos-para-la-primera-fase-del-plan-de-trump-en-gaza/","Israel avanza en los preparativos para la primera fase del plan de Trump en Gaza","Israel avanza en los preparativos para la primera fase del plan de Trump en Gaza","https://encrypted-tbn0.gstatic.com/images?q=tbn:ANd9GcSu2-Ag-nfqNotX_q9bh3Z4h30QeC7uIWteBloulgkh11k99yCP2H4Lo1R9yA&amp;s","Israel está intensificando los preparativos para implementar la primera fase del plan de paz de Donald Trump en Gaza. Este enfoque busca reestructurar la administración y control del territorio, fortaleciendo la presencia de la autoridad palestina y mejorando las condiciones económicas en la región. El plan incluye la creación de nuevos proyectos de infraestructura y el aumento de la inversión internacional para fomentar el desarrollo económico. Sin embargo, la implementación de estas medidas se enfrenta a desafíos significativos, como la resistencia de diversos grupos en Gaza y la complejidad del contexto político actual.","Israel está intensificando los preparativos para implementar la primera fase del plan de paz de Donald Trump en Gaza. Este enfoque busca reestructurar la administración y control del territorio, fortaleciendo la presencia de la autoridad palestina y mejorando las condiciones económicas en la región. El plan incluye la creación de nuevos proyectos de infraestructura y el aumento de la inversión internacional para fomentar el desarrollo económico. Sin embargo, la implementación de estas medidas se enfrenta a desafíos significativos, como la resistencia de diversos grupos en Gaza y la complejidad del contexto político actual.",""
"10/06/2025 12:00:22","https://infobae.com/estados-unidos/2025/10/04/donald-trump-ordeno-desplegar-la-guardia-nacional-en-illinois/","Trump ordenó desplegar la Guardia Nacional en Illinois en medio de nuevos incidentes con agentes migratorios","Donald Trump ordena desplegar la Guardia Nacional en Illinois","https://encrypted-tbn0.gstatic.com/images?q=tbn:ANd9GcTEGWt1Wnb0XKwv7OjMvBDVHeiYfqyTzHe9OJiiOc0L6y7n7Jl1K9FKNfGY4g&amp;s","Donald Trump decidió desplegar la Guardia Nacional en Illinois en respuesta a un aumento significativo de la violencia y los disturbios en varias ciudades del estado. La medida busca apoyar a las fuerzas locales y restablecer el orden. El anuncio se produjo en medio de preocupaciones sobre la seguridad pública y la necesidad de actuar para proteger a los ciudadanos. Las autoridades estatales han expresado su apoyo a la acción del gobierno federal, mientras se esperan más detalles sobre el alcance y la duración del despliegue.","Donald Trump decidió desplegar la Guardia Nacional en Illinois en respuesta a un aumento significativo de la violencia y los disturbios en varias ciudades del estado. La medida busca apoyar a las fuerzas locales y restablecer el orden. El anuncio se produjo en medio de preocupaciones sobre la seguridad pública y la necesidad de actuar para proteger a los ciudadanos. Las autoridades estatales han expresado su apoyo a la acción del gobierno federal, mientras se esperan más detalles sobre el alcance y la duración del despliegue.",""
"10/06/2025 12:00:22","https://infobae.com/america/mundo/2025/10/06/trump-anuncio-que-la-primera-fase-de-su-plan-de-paz-para-gaza-deberia-completarse-esta-semana/","Trump anunció que la primera fase de su plan de paz para Gaza “debería completarse” esta semana","Trump anuncia que la primera fase de su plan de paz para Gaza debería completarse esta semana","https://encrypted-tbn0.gstatic.com/images?q=tbn:ANd9GcSdjnHsSZmU_BQSIilnGKkPqwYfn7oX7VsmbfBenjEEp44T-KgTdf-Yt7w45A&amp;s","Donald Trump anunció que la primera fase de su plan de paz para Gaza debería completarse esta semana. El ex presidente de Estados Unidos presentó su propuesta en medio de un contexto de tensión en la región, con el objetivo de lograr un alto el fuego y facilitar la asistencia humanitaria. Además, Trump destacó la importancia de un proceso que incluya a las partes interesadas y promueva un diálogo constructivo para alcanzar una solución duradera al conflicto.","Donald Trump anunció que la primera fase de su plan de paz para Gaza debería completarse esta semana. El ex presidente de Estados Unidos presentó su propuesta en medio de un contexto de tensión en la región, con el objetivo de lograr un alto el fuego y facilitar la asistencia humanitaria. Además, Trump destacó la importancia de un proceso que incluya a las partes interesadas y promueva un diálogo constructivo para alcanzar una solución duradera al conflicto.",""
"10/06/2025 12:00:22","https://infobae.com/estados-unidos/2025/10/03/una-explosion-desato-un-incendio-masivo-en-la-mayor-refineria-de-el-segundo-en-california/","Una explosión desató un incendio masivo en la mayor refinería de El Segundo en California","Explosión desata incendio masivo en mayor refinería de El Segundo, California","https://encrypted-tbn0.gstatic.com/images?q=tbn:ANd9GcT7XYhIzDarlPvXTg_BjNY0_G6BRLvczojAjT8wkbywwPo1tUoj40nwIidQ4oE&amp;s","Una explosión provocó un incendio de grandes proporciones en la refinería de El Segundo, ubicada en California, la cual es la más grande de la región. El suceso tuvo lugar el 3 de octubre de 2025 y generó una densa columna de humo visible a varios kilómetros de distancia. Los equipos de emergencia respondieron de inmediato, evacuando a los trabajadores y asegurando la zona. Hasta el momento, no se reportaron víctimas ni heridos, aunque las autoridades están investigando las causas del incidente. El interesado de la refinería ha manifestado su compromiso de colaborar con las autoridades en la evaluación de los daños y la seguridad de las instalaciones.","Una explosión provocó un incendio de grandes proporciones en la refinería de El Segundo, ubicada en California, la cual es la más grande de la región. El suceso tuvo lugar el 3 de octubre de 2025 y generó una densa columna de humo visible a varios kilómetros de distancia. Los equipos de emergencia respondieron de inmediato, evacuando a los trabajadores y asegurando la zona. Hasta el momento, no se reportaron víctimas ni heridos, aunque las autoridades están investigando las causas del incidente. El interesado de la refinería ha manifestado su compromiso de colaborar con las autoridades en la evaluación de los daños y la seguridad de las instalaciones.",""
