"FechayHora","LinkOrigen","TituloOrigen","Titulo","Imagen","Intro","Noticia","Datos"
"10/06/2025 12:00:22","https://infobae.com/america/mundo/2025/10/02/un-nuevo-informe-de-la-oms-aseguro-que-la-guerra-en-gaza-ha-causado-42000-lesiones-graves-incluidas-5000-amputaciones/","Un nuevo informe de la OMS aseguró que la guerra en Gaza ha causado 42.000 lesiones graves, incluidas 5.000 amputaciones","Guerra en Gaza causa 42000 lesiones graves según informe de la OMS","https://encrypted-tbn0.gstatic.com/images?q=tbn:ANd9GcQKD8Lf8MXBuXoo9VBFomNKggmlX31NrhU44Y_6Cj9mXzkpV38fKRlhlDf0Kcs&amp;s","Un informe reciente de la Organización Mundial de la Salud revela que la guerra en Gaza ha provocado aproximadamente 42,000 lesiones graves desde el inicio del conflicto, incluidas cerca de 5,000 amputaciones. La situación humanitaria en la región sigue siendo crítica, con un acceso limitado a atención médica y recursos. Las autoridades de salud locales y la OMS han expresado su preocupación por el estado de los hospitales y la falta de suministros esenciales para atender a los heridos. El informe destaca la necesidad urgente de asistencia humanitaria y de medidas para mitigar los efectos del conflicto en la población civil.","Un informe reciente de la Organización Mundial de la Salud revela que la guerra en Gaza ha provocado aproximadamente 42,000 lesiones graves desde el inicio del conflicto, incluidas cerca de 5,000 amputaciones. La situación humanitaria en la región sigue siendo crítica, con un acceso limitado a atención médica y recursos. Las autoridades de salud locales y la OMS han expresado su preocupación por el estado de los hospitales y la falta de suministros esenciales para atender a los heridos. El informe destaca la necesidad urgente de asistencia humanitaria y de medidas para mitigar los efectos del conflicto en la población civil.",""
"10/06/2025 12:00:22","https://infobae.com/america/mundo/2025/10/06/crisis-de-gobierno-en-francia-cae-la-bolsa-y-la-deuda-soberana-se-encarece-tras-la-dimision-relampago-del-primer-ministro/","Crisis de gobierno en Francia: cae la bolsa y la deuda se encarece tras la dimisión del primer ministro","Crisis de gobierno en Francia tras la dimisión del primer ministro afecta la bolsa y encarece la deuda soberana","https://encrypted-tbn0.gstatic.com/images?q=tbn:ANd9GcRAvxXiAjEkZuAFoF-AQraj6oQwLZJxOOSkWWXQ1YjE4U5XHfICn8kTPqW-PRM&amp;s","En Francia, la reciente dimisión del primer ministro ha desencadenado una crisis de gobierno que ha impactado los mercados. La bolsa del país experimentó una caída significativa, mientras que la deuda soberana se volvió más costosa. La inestabilidad política generada por esta situación ha suscitado preocupaciones sobre la continuidad del gobierno actual y su capacidad para afrontar desafíos económicos y sociales. La dimisión repentina ha provocado reacciones inmediatas tanto en el ámbito político como en el financiero.","En Francia, la reciente dimisión del primer ministro ha desencadenado una crisis de gobierno que ha impactado los mercados. La bolsa del país experimentó una caída significativa, mientras que la deuda soberana se volvió más costosa. La inestabilidad política generada por esta situación ha suscitado preocupaciones sobre la continuidad del gobierno actual y su capacidad para afrontar desafíos económicos y sociales. La dimisión repentina ha provocado reacciones inmediatas tanto en el ámbito político como en el financiero.",""
"10/06/2025 12:00:22","https://infobae.com/entretenimiento/2025/10/06/martin-scorsese-recordo-la-razon-por-la-que-no-logro-convertirse-en-sacerdote-no-era-mi-lugar/","Martin Scorsese recordó la razón por la que no logró convertirse en sacerdote: “No era mi lugar”","Martin Scorsese reveló por qué no se convirtió en sacerdote","https://encrypted-tbn0.gstatic.com/images?q=tbn:ANd9GcQKIfVu0sGT0eH0aQWtedaCdjuMn09Kz9L_FnmhEDYceupcDWNZXq5WRzPrXc0&amp;s","Martin Scorsese compartió en una reciente entrevista que sus aspiraciones de convertirse en sacerdote se frustraron porque comprendió que no encajaba en ese camino. Aunque creció en un entorno católico que influyó en su vida y obra, el director se dio cuenta de que su verdadera vocación estaba en el cine. Scorsese expresó que su relación con la religión ha sido fundamental en su proceso creativo, pero finalmente decidió seguir su pasión por el cine en lugar de la vida religiosa.","Martin Scorsese compartió en una reciente entrevista que sus aspiraciones de convertirse en sacerdote se frustraron porque comprendió que no encajaba en ese camino. Aunque creció en un entorno católico que influyó en su vida y obra, el director se dio cuenta de que su verdadera vocación estaba en el cine. Scorsese expresó que su relación con la religión ha sido fundamental en su proceso creativo, pero finalmente decidió seguir su pasión por el cine en lugar de la vida religiosa.",""
"10/06/2025 12:00:22","https://infobae.com/estados-unidos/2025/10/03/the-life-of-a-showgirl-el-nuevo-album-de-taylor-swift-12-canciones-sobre-amor-exito-y-ajustes-de-cuentas/","“The Life of a Showgirl”, el nuevo álbum de Taylor Swift: 12 canciones sobre amor, éxito y ajustes de cuentas","Taylor Swift lanza su nuevo álbum The Life of a Showgirl con 12 canciones sobre amor, éxito y ajustes de cuentas","https://encrypted-tbn0.gstatic.com/images?q=tbn:ANd9GcSmFPLkZ5zAGR31RgtFyiaVtvmBvMtwaFeYaCEZLUL7iwuk07yZlJk0srcTCA&amp;s","Taylor Swift ha anunciado el lanzamiento de su nuevo álbum titulado ""The Life of a Showgirl"", que contará con 12 canciones. Este trabajo explora temas como el amor, el éxito y la resolución de conflictos personales. La artista ha destacado que las letras reflejan sus experiencias y momentos significativos en su vida. El álbum representa una evolución en su estilo musical y lírico, prometiendo ofrecer a los oyentes una profunda conexión emocional.","Taylor Swift ha anunciado el lanzamiento de su nuevo álbum titulado ""The Life of a Showgirl"", que contará con 12 canciones. Este trabajo explora temas como el amor, el éxito y la resolución de conflictos personales. La artista ha destacado que las letras reflejan sus experiencias y momentos significativos en su vida. El álbum representa una evolución en su estilo musical y lírico, prometiendo ofrecer a los oyentes una profunda conexión emocional.",""
"10/06/2025 12:00:22","https://infobae.com/america/mundo/2025/10/02/la-justicia-de-corea-del-sur-le-nego-la-libertad-condicional-al-expresidente-yoon-suk-yeol/","La Justicia de Corea del Sur le negó la libertad condicional al expresidente Yoon Suk Yeol","La justicia de Corea del Sur niega la libertad condicional al expresidente Yoon Suk-yeol","https://encrypted-tbn0.gstatic.com/images?q=tbn:ANd9GcQeDFV6LUJ9K46zrOZ55R8LuQ7rNOraBkyrSbn-BcaIus_9jICb0vDS1x4YUQ&amp;s","La justicia de Corea del Sur ha rechazado la solicitud de libertad condicional del expresidente Yoon Suk-yeol, quien se encuentra cumpliendo una condena por corrupción. El tribunal argumentó que el exmandatario no mostró remordimiento por sus actos y que la gravedad de sus crímenes no justifica la concesión de este beneficio. La decisión ha generado reacciones en el país, donde Yoon enfrenta una serie de acusaciones y su futuro político permanece incierto.","La justicia de Corea del Sur ha rechazado la solicitud de libertad condicional del expresidente Yoon Suk-yeol, quien se encuentra cumpliendo una condena por corrupción. El tribunal argumentó que el exmandatario no mostró remordimiento por sus actos y que la gravedad de sus crímenes no justifica la concesión de este beneficio. La decisión ha generado reacciones en el país, donde Yoon enfrenta una serie de acusaciones y su futuro político permanece incierto.",""
"10/06/2025 12:00:22","https://infobae.com/america/mundo/2025/10/05/donald-trump-advirtio-que-hamas-enfrentara-una-completa-destruccion-si-se-niega-a-ceder-el-poder-en-gaza/","Donald Trump advirtió que Hamas enfrentará una “completa destrucción” si se niega a ceder el poder en Gaza","Donald Trump advierte a Hamas sobre la completa destrucción si no cede el poder en Gaza","https://encrypted-tbn0.gstatic.com/images?q=tbn:ANd9GcQNijMHO40MX6sfEn7mXAaViNeSjqe2W6P_2hl5__KNXUFeIdf5S538AsM-vw&amp;s","Donald Trump emitió una advertencia sobre la situación en Gaza, indicando que Hamas enfrentará una destrucción total si no cede el control de la región. En un discurso, enfatizó la necesidad de cambiar el liderazgo en Gaza y expresó su apoyo a Israel en su lucha contra el grupo extremista. Trump también criticó a los líderes globales por su enfoque hacia el conflicto y subrayó la importancia de una respuesta firme ante la violencia de Hamas. Su mensaje aboga por una resolución que favorezca la seguridad de Israel y el bienestar de la región.","Donald Trump emitió una advertencia sobre la situación en Gaza, indicando que Hamas enfrentará una destrucción total si no cede el control de la región. En un discurso, enfatizó la necesidad de cambiar el liderazgo en Gaza y expresó su apoyo a Israel en su lucha contra el grupo extremista. Trump también criticó a los líderes globales por su enfoque hacia el conflicto y subrayó la importancia de una respuesta firme ante la violencia de Hamas. Su mensaje aboga por una resolución que favorezca la seguridad de Israel y el bienestar de la región.",""
"10/06/2025 12:00:22","https://infobae.com/america/america-latina/2025/10/02/estados-unidos-confirmo-que-le-nego-visas-a-funcionarios-del-regimen-cubano-por-razones-de-seguridad-nacional/","EEUU confirmó que le negó visas a funcionarios del régimen cubano por razones de seguridad nacional","Estados Unidos negó visas a funcionarios del régimen cubano por razones de seguridad nacional","https://encrypted-tbn0.gstatic.com/images?q=tbn:ANd9GcQ4j2pTonSMLGd7vpGt9uGMP1tBQ5bW5YHgGvPkWJcjPxjS7FbzZ1Ex2yI4Sik&amp;s","Estados Unidos ha confirmado que ha denegado visas a funcionarios del régimen cubano, citando razones de seguridad nacional. Esta decisión se enmarca en la política estadounidense hacia Cuba y refleja preocupaciones sobre la conducta de algunos funcionarios del gobierno cubano. La medida se produce en un contexto de tensiones entre ambos países, donde la administración estadounidense busca mantener una postura firme frente a acciones que considera perjudiciales para la seguridad regional.","Estados Unidos ha confirmado que ha denegado visas a funcionarios del régimen cubano, citando razones de seguridad nacional. Esta decisión se enmarca en la política estadounidense hacia Cuba y refleja preocupaciones sobre la conducta de algunos funcionarios del gobierno cubano. La medida se produce en un contexto de tensiones entre ambos países, donde la administración estadounidense busca mantener una postura firme frente a acciones que considera perjudiciales para la seguridad regional.",""
"10/06/2025 12:00:22","https://infobae.com/deportes/2025/10/05/la-tajante-decision-que-tomo-brasil-tras-la-historica-eliminacion-en-fase-de-grupos-del-mundial-sub-20/","La tajante decisión que tomó Brasil tras la histórica eliminación en fase de grupos del Mundial Sub 20","Brasil toma drástica decisión tras histórica eliminación en fase de grupos del Mundial Sub 20","https://encrypted-tbn0.gstatic.com/images?q=tbn:ANd9GcRj0dMtDDl2sCbDU1u1vxbcU_drclb4YXKWDL00Rss30hC0fNFaPc7qx73HHt4&amp;s","Brasil ha tomado una decisión drástica tras su eliminación en la fase de grupos del Mundial Sub-20. El equipo, que fue considerado favorito, no logró avanzar en el torneo, lo que ha generado críticas sobre su rendimiento. En respuesta a esta situación, la Confederación Brasileña de Fútbol decidió realizar cambios significativos en la estructura de desarrollo de talentos jóvenes, enfocados en mejorar el rendimiento futuro de la selección. Este resultado marca un punto de inflexión en la gestión del fútbol juvenil en el país, llevando a un replanteamiento de estrategias y procesos de formación.","Brasil ha tomado una decisión drástica tras su eliminación en la fase de grupos del Mundial Sub-20. El equipo, que fue considerado favorito, no logró avanzar en el torneo, lo que ha generado críticas sobre su rendimiento. En respuesta a esta situación, la Confederación Brasileña de Fútbol decidió realizar cambios significativos en la estructura de desarrollo de talentos jóvenes, enfocados en mejorar el rendimiento futuro de la selección. Este resultado marca un punto de inflexión en la gestión del fútbol juvenil en el país, llevando a un replanteamiento de estrategias y procesos de formación.",""
"10/06/2025 12:00:22","https://infobae.com/estados-unidos/2025/10/03/wall-street-cerro-una-semana-ganadora-con-mas-records/","Wall Street cerró una semana ganadora con más récords","Wall Street cerró una semana ganadora con más récords","https://encrypted-tbn0.gstatic.com/images?q=tbn:ANd9GcT098d1CEemsLp5Gz_vexjnPADB-b7o7_N1viwWtnaqA08LTfGq-2pOw6xPDw&amp;s","Wall Street concluyó una semana positiva en el mercado, marcando varios récords en índices bursátiles. El Dow Jones, el S&P 500 y el Nasdaq lograron avances significativos, impulsados por datos económicos sólidos y un optimismo creciente entre los inversores. Este desempeño se vio respaldado por la fortaleza del sector tecnológico y un aumento en las inversiones. A pesar de algunos desafíos, como la inflación y las decisiones de políticas monetarias, la tendencia alcista en las acciones parece mantenerse.","Wall Street concluyó una semana positiva en el mercado, marcando varios récords en índices bursátiles. El Dow Jones, el S&P 500 y el Nasdaq lograron avances significativos, impulsados por datos económicos sólidos y un optimismo creciente entre los inversores. Este desempeño se vio respaldado por la fortaleza del sector tecnológico y un aumento en las inversiones. A pesar de algunos desafíos, como la inflación y las decisiones de políticas monetarias, la tendencia alcista en las acciones parece mantenerse.",""
"10/06/2025 12:00:22","https://infobae.com/america/mundo/2025/10/04/pakistan-advirtio-a-india-que-una-nueva-escalada-del-conflicto-fronterizo-podria-llevar-a-una-devastacion-catastrofica/","Pakistán advirtió a India que una nueva escalada del conflicto fronterizo podría llevar a “una devastación catastrófica”","Pakistán advierte a India sobre potencial catástrofe tras escalada en conflicto fronterizo","https://encrypted-tbn0.gstatic.com/images?q=tbn:ANd9GcRqH5dwyoK9hiyDmoTGN-NZRin5-k9mj0WZj5epLQm8fi-hohXDNnt_6CSutw&amp;s","Pakistan advirtió a India sobre el riesgo de una nueva escalada en el conflicto fronterizo que podría resultar en consecuencias devastadoras. Las tensiones entre ambos países, que comparten una larga y conflictiva frontera, han aumentado en las últimas semanas. Islamabad instó a Nueva Delhi a abordar las disputas de manera pacífica y evitar acciones que puedan conducir a un conflicto armado. Esta advertencia se produce en un contexto de creciente preocupación internacional por la estabilidad en la región.","Pakistan advirtió a India sobre el riesgo de una nueva escalada en el conflicto fronterizo que podría resultar en consecuencias devastadoras. Las tensiones entre ambos países, que comparten una larga y conflictiva frontera, han aumentado en las últimas semanas. Islamabad instó a Nueva Delhi a abordar las disputas de manera pacífica y evitar acciones que puedan conducir a un conflicto armado. Esta advertencia se produce en un contexto de creciente preocupación internacional por la estabilidad en la región.",""
"10/06/2025 12:00:22","https://infobae.com/america/america-latina/2025/10/03/brasil-busca-la-modernizacion-industrial-con-una-inversion-de-usd-56270-millones/","Brasil busca la modernización industrial con una inversión de USD 56.270 millones","Brasil busca modernización industrial con inversión de USD 56.270 millones","https://encrypted-tbn0.gstatic.com/images?q=tbn:ANd9GcTGDR96U2sDwOSlhnzwl74Pb2ZKwlmLspdAOkM8xrVUzLvE_QRkn-LLezGpFbE&amp;s","Brasil planea realizar una inversión de 56,27 mil millones de dólares para modernizar su sector industrial. Este esfuerzo busca impulsar el crecimiento económico del país y mejorar su competitividad a nivel global. El gobierno ha detallado que los fondos se destinarán a diversas áreas, incluyendo tecnología y sostenibilidad, con el objetivo de transformar la industria brasileña y adaptarla a las demandas del mercado actual. Se espera que esta inversión genere un impacto positivo en la creación de empleos y en la innovación dentro del país.","Brasil planea realizar una inversión de 56,27 mil millones de dólares para modernizar su sector industrial. Este esfuerzo busca impulsar el crecimiento económico del país y mejorar su competitividad a nivel global. El gobierno ha detallado que los fondos se destinarán a diversas áreas, incluyendo tecnología y sostenibilidad, con el objetivo de transformar la industria brasileña y adaptarla a las demandas del mercado actual. Se espera que esta inversión genere un impacto positivo en la creación de empleos y en la innovación dentro del país.",""
"10/06/2025 12:00:22","https://infobae.com/america/mundo/2025/10/01/el-senado-de-estados-unidos-rechazo-un-plan-republicano-para-sacar-al-pais-de-la-paralisis-presupuestaria/","Cierre del Gobierno: el Senado de Estados Unidos rechazó dos propuestas para salir de la parálisis presupuestaria","Senado de Estados Unidos rechaza plan republicano para salir de la parálisis presupuestaria","https://encrypted-tbn0.gstatic.com/images?q=tbn:ANd9GcTC3lcmULKfh-LHfJMGfM_TSDCTruOYKbVv3T3vMu4NlITClEs7RDaGojVUiEY&amp;s","El Senado de Estados Unidos rechazó un plan presentado por los republicanos para resolver la crisis de paralización presupuestaria que enfrenta el país. La propuesta buscaba financiar diversas áreas del gobierno, pero no obtuvo el apoyo necesario. Esta situación genera preocupación sobre el impacto a largo plazo en los servicios gubernamentales y la economía del país, así como sobre la posibilidad de un cierre del gobierno si no se alcanza un acuerdo en el futuro cercano. Los líderes de ambos partidos continúan en discusiones, pero las diferencias persisten.","El Senado de Estados Unidos rechazó un plan presentado por los republicanos para resolver la crisis de paralización presupuestaria que enfrenta el país. La propuesta buscaba financiar diversas áreas del gobierno, pero no obtuvo el apoyo necesario. Esta situación genera preocupación sobre el impacto a largo plazo en los servicios gubernamentales y la economía del país, así como sobre la posibilidad de un cierre del gobierno si no se alcanza un acuerdo en el futuro cercano. Los líderes de ambos partidos continúan en discusiones, pero las diferencias persisten.",""
"10/06/2025 12:00:22","https://infobae.com/deportes/2025/10/04/no-son-sandias-no-me-molestan-para-jugar-una-tenista-se-opero-los-senos-y-explico-los-motivos/","“No son sandías, no me molestan para jugar”: una tenista se operó los senos y explicó los motivos","","https://encrypted-tbn0.gstatic.com/images?q=tbn:ANd9GcTPERmgIC5hRFswn5bso_eB-wZ75j4doCaY-UkxeQ-q-M99PQHUU_W3bd0QAIg&amp;s","Una tenista profesional se sometió a una cirugía de aumento de senos y habló sobre su decisión en una entrevista reciente. Explicó que la operación no le causa ninguna molestia y que ha tenido una experiencia positiva en el proceso de recuperación. La deportista destacó que quería sentirse más cómoda consigo misma y en su rendimiento deportivo. Aunque recibió críticas por su elección, afirmó que está satisfecha con su decisión y que esto no interferirá con su carrera.","Una tenista profesional se sometió a una cirugía de aumento de senos y habló sobre su decisión en una entrevista reciente. Explicó que la operación no le causa ninguna molestia y que ha tenido una experiencia positiva en el proceso de recuperación. La deportista destacó que quería sentirse más cómoda consigo misma y en su rendimiento deportivo. Aunque recibió críticas por su elección, afirmó que está satisfecha con su decisión y que esto no interferirá con su carrera.",""
"10/06/2025 12:00:22","https://infobae.com/deportes/2025/10/06/tension-en-mclaren-tras-el-toque-de-norris-a-piastri-en-medio-de-la-lucha-por-el-titulo-de-la-f1-esta-bien-que-me-eche-a-un-lado/","Tensión en McLaren tras el toque de Norris a Piastri en medio de la lucha por el título de la F1: “¿Está bien que me eche a un lado?”","Tensión en McLaren tras el choque de Norris con Piastri en la lucha por el título de F1","https://encrypted-tbn0.gstatic.com/images?q=tbn:ANd9GcQZ0QHQw_6IwGvRi2sRWQPrHQ5ITUbVlZ0ASU0e7MJ0vlop648vD_dQjLRjIkI&amp;s","En medio de una intensa competencia por el campeonato de Fórmula 1, surgió tensión en McLaren tras un incidente entre sus pilotos, Lando Norris y Oscar Piastri. Durante una carrera reciente, Norris tocó a Piastri mientras ambos luchaban por posiciones, lo que generó frustración en el equipo. La situación ha llevado a discusiones internas sobre la estrategia y la forma en que los pilotos deben gestionar sus disputas en pista. Ambos pilotos se manifestaron, indicando que, aunque quieren competir entre sí, también es esencial mantener la armonía dentro del equipo para lograr los mejores resultados en la temporada.","En medio de una intensa competencia por el campeonato de Fórmula 1, surgió tensión en McLaren tras un incidente entre sus pilotos, Lando Norris y Oscar Piastri. Durante una carrera reciente, Norris tocó a Piastri mientras ambos luchaban por posiciones, lo que generó frustración en el equipo. La situación ha llevado a discusiones internas sobre la estrategia y la forma en que los pilotos deben gestionar sus disputas en pista. Ambos pilotos se manifestaron, indicando que, aunque quieren competir entre sí, también es esencial mantener la armonía dentro del equipo para lograr los mejores resultados en la temporada.",""
"10/06/2025 12:00:22","https://infobae.com/america/mundo/2025/10/04/tras-la-respuesta-de-hamas-al-plan-de-trump-israel-se-prepara-para-la-implementacion-inmediata-de-la-primera-etapa-del-plan-de-paz/","Tras la respuesta de Hamas al plan de Trump, Israel se prepara para la “implementación inmediata” de la primera etapa del plan de paz","Israel se prepara para implementar la primera etapa del plan de paz tras la respuesta de Hamas al plan de Trump","https://encrypted-tbn0.gstatic.com/images?q=tbn:ANd9GcQ6p2860J8wMm2ftpsjm7zg8nXeMixKrwCvLbmf8yAoWOHwJaPde3mIlHgqYyU&amp;s","La noticia informa sobre la reacción de Hamas ante el plan de paz presentado por Donald Trump, lo que ha llevado a Israel a prepararse para implementar de inmediato la primera fase de dicho plan. A pesar de la oposición de Hamas, el gobierno israelí avanza en sus planes, considerando la situación como una oportunidad para avanzar en su agenda política. El conflicto entre ambas partes sigue siendo complejo y tenso, y la implementación del plan podría tener repercusiones significativas en la región.","La noticia informa sobre la reacción de Hamas ante el plan de paz presentado por Donald Trump, lo que ha llevado a Israel a prepararse para implementar de inmediato la primera fase de dicho plan. A pesar de la oposición de Hamas, el gobierno israelí avanza en sus planes, considerando la situación como una oportunidad para avanzar en su agenda política. El conflicto entre ambas partes sigue siendo complejo y tenso, y la implementación del plan podría tener repercusiones significativas en la región.",""
"10/06/2025 12:00:22","https://infobae.com/america/mundo/2025/09/27/los-reyes-britanicos-carlos-iii-y-camila-realizaran-una-visita-de-estado-al-vaticano-a-finales-de-octubre/","Los reyes británicos Carlos III y Camila realizarán una visita de Estado al Vaticano a finales de octubre","Los Reyes Británicos Carlos III y Camila realizarán una visita de Estado al Vaticano a finales de octubre","https://encrypted-tbn0.gstatic.com/images?q=tbn:ANd9GcT-xm35cHAecYP5ypEtr6cjmbeP2qSe3jB7oYO-ws22fKqZVlT6_NmNMIdmiw&amp;s","Los reyes británicos, Carlos III y Camila, realizarán una visita de estado al Vaticano a finales de octubre. Este viaje está destinado a fortalecer las relaciones entre el Reino Unido y la Santa Sede. Durante su estancia, se espera que los monarcas se reúnan con el Papa Francisco, con quien abordarán temas de interés mutuo y cooperación en cuestiones sociales y humanitarias. Esta visita también refleja el compromiso de la Corona británica con el diálogo interreligioso.","Los reyes británicos, Carlos III y Camila, realizarán una visita de estado al Vaticano a finales de octubre. Este viaje está destinado a fortalecer las relaciones entre el Reino Unido y la Santa Sede. Durante su estancia, se espera que los monarcas se reúnan con el Papa Francisco, con quien abordarán temas de interés mutuo y cooperación en cuestiones sociales y humanitarias. Esta visita también refleja el compromiso de la Corona británica con el diálogo interreligioso.",""
