"FechayHora","LinkOrigen","TituloOrigen","Titulo","Imagen","Intro","Noticia","Datos"
"09/15/2025 12:30:14","https://infobae.com/america/america-latina/2025/09/14/jair-bolsonaro-volvio-a-salir-de-su-prision-domiciliaria-para-someterse-a-un-procedimiento-medico-ambulatorio/","Bolsonaro volvió a salir de su prisión domiciliaria para someterse a un procedimiento médico","Jair Bolsonaro sale de prisión domiciliaria para un procedimiento médico ambulatorio","https://encrypted-tbn0.gstatic.com/images?q=tbn:ANd9GcT9O3ToP5WSbL_KWwNDZUHgRXxmAdf2A6XZFtKBo_zmpCr36kfIZdgZfaLHlw&amp;s","Jair Bolsonaro, ex presidente de Brasil, ha salido de su prisión domiciliaria para realizar un procedimiento médico ambulatorio en un hospital de Brasilia. Su salida se dio en medio de un contexto legal complicado, ya que enfrenta múltiples investigaciones y procesos judiciales que han llevado a su detención. Bolsonaro cumple una condena de prisión domiciliaria desde agosto, un cambio en su situación luego de haber estado en Estados Unidos tras dejar la presidencia. Durante su salida, estuvo acompañado por su abogado y un grupo de seguridad.","Jair Bolsonaro, ex presidente de Brasil, ha salido de su prisión domiciliaria para realizar un procedimiento médico ambulatorio en un hospital de Brasilia. Su salida se dio en medio de un contexto legal complicado, ya que enfrenta múltiples investigaciones y procesos judiciales que han llevado a su detención. Bolsonaro cumple una condena de prisión domiciliaria desde agosto, un cambio en su situación luego de haber estado en Estados Unidos tras dejar la presidencia. Durante su salida, estuvo acompañado por su abogado y un grupo de seguridad.",""
"09/15/2025 12:30:14","https://infobae.com/america/mundo/2025/09/12/estados-unidos-y-reino-unido-avanzan-en-acuerdos-tecnologicos-y-nucleares-antes-de-la-visita-de-donald-trump-a-londres/","Estados Unidos y Reino Unido avanzan en acuerdos tecnológicos y nucleares antes de la visita de Donald Trump a Londres","Estados Unidos y Reino Unido avanzan en acuerdos tecnológicos y nucleares antes de la visita de Donald Trump a Londres","https://encrypted-tbn0.gstatic.com/images?q=tbn:ANd9GcSYAH0gAv4UPriZ9BqWHQnPZqwZKyYkg50RW5Unnfbx2hqrCVD2a5nEZb379Yg&amp;s","Estados Unidos y el Reino Unido están avanzando en acuerdos en áreas tecnológicas y nucleares, justo antes de la próxima visita de Donald Trump a Londres. Estas negociaciones buscan fortalecer la colaboración entre ambos países en sectores clave, enfatizando la importancia de la innovación y la seguridad nuclear. La reunión se produce en un contexto de interés renovado en consolidar la relación bilateral y abordar desafíos globales.","Estados Unidos y el Reino Unido están avanzando en acuerdos en áreas tecnológicas y nucleares, justo antes de la próxima visita de Donald Trump a Londres. Estas negociaciones buscan fortalecer la colaboración entre ambos países en sectores clave, enfatizando la importancia de la innovación y la seguridad nuclear. La reunión se produce en un contexto de interés renovado en consolidar la relación bilateral y abordar desafíos globales.",""
"09/15/2025 12:30:14","https://infobae.com/salud/ciencia/2025/09/15/el-consumo-de-tabaco-eleva-el-riesgo-de-desarrollar-diabetes-tipo-2-segun-expertos/","El consumo de tabaco eleva el riesgo de desarrollar diabetes tipo 2, según expertos","El consumo de tabaco eleva el riesgo de desarrollar diabetes tipo 2 según expertos","https://encrypted-tbn0.gstatic.com/images?q=tbn:ANd9GcS0CxUbWx4INHW251lB3lT-_CergwbeKvThOUnCyxkjoNSu_UN4HUWdBfNeGQ&amp;s","Un estudio reciente revela que el consumo de tabaco aumenta el riesgo de desarrollar diabetes tipo 2. Expertos destacan que la relación entre el tabaquismo y la diabetes está vinculada a la resistencia a la insulina, un factor clave en la aparición de esta enfermedad. La investigación también indica que los fumadores pueden tener un mayor riesgo de complicaciones relacionadas con la diabetes en comparación con los no fumadores. Estos hallazgos subrayan la importancia de abordar el tabaquismo para mejorar la salud pública y reducir la incidencia de la diabetes tipo 2.","Un estudio reciente revela que el consumo de tabaco aumenta el riesgo de desarrollar diabetes tipo 2. Expertos destacan que la relación entre el tabaquismo y la diabetes está vinculada a la resistencia a la insulina, un factor clave en la aparición de esta enfermedad. La investigación también indica que los fumadores pueden tener un mayor riesgo de complicaciones relacionadas con la diabetes en comparación con los no fumadores. Estos hallazgos subrayan la importancia de abordar el tabaquismo para mejorar la salud pública y reducir la incidencia de la diabetes tipo 2.",""
"09/15/2025 12:30:14","https://infobae.com/deportes/2025/09/14/corrio-por-segunda-vez-una-maraton-y-cruzo-la-meta-sin-darse-cuenta-que-gano-una-historica-medalla-en-el-mundial-de-atletismo/","Corrió por segunda vez una maratón y ganó una histórica medalla para Uruguay en el Mundial de atletismo","Corrió por segunda vez una maratón y cruzó la meta sin darse cuenta que ganó una histórica medalla en el Mundial de Atletismo","https://encrypted-tbn0.gstatic.com/images?q=tbn:ANd9GcTL645B1uX7mfHDj4oUtDEY_7kaVPjojgFjeIkOcHRsdVFmkgstzwDcRiQ3V8I&amp;s","Un atleta desconocido para muchos participó en su segunda maratón y, al cruzar la meta, descubrió que había ganado una histórica medalla en el Mundial de Atletismo. A pesar de no haber sido consciente de su desempeño, su tiempo le valió el reconocimiento en una competición de alto nivel. Este acontecimiento subraya la posibilidad de que atletas menos conocidos puedan sorprender en grandes eventos deportivos.","Un atleta desconocido para muchos participó en su segunda maratón y, al cruzar la meta, descubrió que había ganado una histórica medalla en el Mundial de Atletismo. A pesar de no haber sido consciente de su desempeño, su tiempo le valió el reconocimiento en una competición de alto nivel. Este acontecimiento subraya la posibilidad de que atletas menos conocidos puedan sorprender en grandes eventos deportivos.",""
"09/15/2025 12:30:14","https://infobae.com/america/mundo/2025/09/15/entrevista-a-leon-xiv-ucrania-infancia-en-estados-unidos-y-el-antidoto-frente-a-los-desafios-de-la-iglesia/","Entrevista a León XIV: Ucrania, infancia en EEUU y “el antídoto” frente a los desafíos de la Iglesia","Entrevista a León XIV sobre Ucrania, la infancia en Estados Unidos y el futuro de la Iglesia.","https://encrypted-tbn0.gstatic.com/images?q=tbn:ANd9GcSZXgB1fyWR5AnBGSr_Kigrkukuxx2RcV825UZexI4rn1fK_hsNmWP1f5zLjw&amp;s","El artículo presenta una entrevista con el Papa León XIV, quien aborda varios temas relevantes. Entre ellos, se sitúa el conflicto en Ucrania y sus impactos en la infancia, así como su perspectiva sobre la situación de la iglesia y los desafíos que enfrenta en la actualidad. El pontífice también discute la importancia de brindar respuestas efectivas y compasivas a los problemas sociales y espirituales. Esta conversación resalta la necesidad de solidaridad y apoyo hacia los más vulnerables en tiempos difíciles.","El artículo presenta una entrevista con el Papa León XIV, quien aborda varios temas relevantes. Entre ellos, se sitúa el conflicto en Ucrania y sus impactos en la infancia, así como su perspectiva sobre la situación de la iglesia y los desafíos que enfrenta en la actualidad. El pontífice también discute la importancia de brindar respuestas efectivas y compasivas a los problemas sociales y espirituales. Esta conversación resalta la necesidad de solidaridad y apoyo hacia los más vulnerables en tiempos difíciles.",""
"09/15/2025 12:30:14","https://infobae.com/deportes/2025/09/14/el-notable-gesto-de-terence-crawford-con-canelo-alvarez-tras-su-contundente-victoria/","El notable gesto de Terence Crawford con Canelo Álvarez tras su contundente victoria","Terence Crawford elogia a Canelo Álvarez tras su contundente victoria","https://encrypted-tbn0.gstatic.com/images?q=tbn:ANd9GcQhK0d-KTOyWQl2wyrLyH_BgKI_38U6ioFrjkazQ0ZG_T0402RdD8kHGR8xpg&amp;s","Terence Crawford mostró un gesto significativo hacia Canelo Álvarez tras su reciente victoria contundente en el ring. A pesar de la rivalidad entre ambos boxeadores, Crawford utilizó sus redes sociales para felicitar a Canelo por su desempeño, destacando su admiración por él como atleta. Este acto ha sido considerado un símbolo de respeto dentro del mundo del boxeo, especialmente en un momento en que ambos se encuentran en etapas clave de sus carreras.","Terence Crawford mostró un gesto significativo hacia Canelo Álvarez tras su reciente victoria contundente en el ring. A pesar de la rivalidad entre ambos boxeadores, Crawford utilizó sus redes sociales para felicitar a Canelo por su desempeño, destacando su admiración por él como atleta. Este acto ha sido considerado un símbolo de respeto dentro del mundo del boxeo, especialmente en un momento en que ambos se encuentran en etapas clave de sus carreras.",""
"09/15/2025 12:30:14","https://infobae.com/america/mundo/2025/09/14/ucrania-golpeo-otra-refineria-clave-de-rusia-en-medio-de-la-crisis-de-combustible/","Ucrania golpeó otra refinería clave de Rusia en medio de la crisis de combustible","Ucrania atacó otra refinería clave de Rusia en medio de la crisis de combustible","https://encrypted-tbn0.gstatic.com/images?q=tbn:ANd9GcSsoAGJUBj2QFpNj4NdEj2aAXsL55277YMEPeJXN2bt-X4oLPa5ruX0Kz4gpLM&amp;s","Ucrania llevó a cabo un ataque en una refinería de petróleo en Rusia, lo que agrava la crisis de combustible en el país. Este ataque se suma a otros recientes dirigidos a instalaciones energéticas rusas, como respuesta al conflicto en curso entre ambas naciones. Las autoridades ucranianas afirmaron que estas acciones buscan debilitar la capacidad de Rusia para sostener su esfuerzo bélico. La situación en el mercado de combustibles en Rusia se torna más complicada, afectando tanto a la población como a la economía.","Ucrania llevó a cabo un ataque en una refinería de petróleo en Rusia, lo que agrava la crisis de combustible en el país. Este ataque se suma a otros recientes dirigidos a instalaciones energéticas rusas, como respuesta al conflicto en curso entre ambas naciones. Las autoridades ucranianas afirmaron que estas acciones buscan debilitar la capacidad de Rusia para sostener su esfuerzo bélico. La situación en el mercado de combustibles en Rusia se torna más complicada, afectando tanto a la población como a la economía.",""
"09/15/2025 12:30:14","https://infobae.com/deportes/2025/09/13/el-monstruo-naoya-inoue-vs-murodjon-akhmadaliev-por-los-titulos-mundiales-supergallo-horario-tv-y-como-ver-la-pelea-en-vivo/","El “Monstruo” Naoya Inoue vs. Murodjon Akhmadaliev, por los títulos mundiales supergallo: horario y cómo ver la pelea en vivo","Naoya Inoue se enfrenta a Murodjon Akhmadaliev por los títulos mundiales supergallo","https://encrypted-tbn0.gstatic.com/images?q=tbn:ANd9GcRr613D9-FkHcqqXeWsqbf_voNAuq-pwo024Sh-DS9ggrDJlYfSWZ7MsrwG7vY&amp;s","Naoya Inoue, conocido como ""El Monstruo"", se enfrentará a Murodjon Akhmadaliev por los títulos mundiales de peso supergallo. La pelea se llevará a cabo el 13 de septiembre de 2025 y se espera que sea uno de los combates más emocionantes del año. Los aficionados podrán seguir el evento a través de diferentes plataformas de televisión y en streaming, que ofrecerán cobertura en vivo del enfrentamiento entre estos dos destacados boxeadores.","Naoya Inoue, conocido como ""El Monstruo"", se enfrentará a Murodjon Akhmadaliev por los títulos mundiales de peso supergallo. La pelea se llevará a cabo el 13 de septiembre de 2025 y se espera que sea uno de los combates más emocionantes del año. Los aficionados podrán seguir el evento a través de diferentes plataformas de televisión y en streaming, que ofrecerán cobertura en vivo del enfrentamiento entre estos dos destacados boxeadores.",""
"09/15/2025 12:30:14","https://infobae.com/america/america-latina/2025/09/12/la-defensa-de-jair-bolsonaro-apelara-la-condena-de-27-anos-prision-y-llevara-el-caso-ante-instancias-internacionales/","La defensa de Jair Bolsonaro apelará la condena de 27 años de prisión y llevará el caso ante instancias internacionales","La defensa de Jair Bolsonaro apelará la condena de 27 años de prisión y llevará el caso a instancias internacionales","https://encrypted-tbn0.gstatic.com/images?q=tbn:ANd9GcTimsLP7KZwn-OP7lM4YJo1sm9Qhbcv1v4Uub9ImJ6C8nykZ_cu3e0FoRk3kQ&amp;s","La defensa de Jair Bolsonaro ha decidido apelar la sentencia que lo condena a 27 años de prisión por el intento de socavar el resultado de las elecciones presidenciales de 2020 en Brasil. Su equipo legal planea llevar el caso a instancias internacionales. La condena se deriva de la promoción de un asalto a las instituciones democráticas en el país. La apelación se basa en la argumentación de que la decisión judicial es injusta y que Bolsonaro no debería enfrentar este castigo.","La defensa de Jair Bolsonaro ha decidido apelar la sentencia que lo condena a 27 años de prisión por el intento de socavar el resultado de las elecciones presidenciales de 2020 en Brasil. Su equipo legal planea llevar el caso a instancias internacionales. La condena se deriva de la promoción de un asalto a las instituciones democráticas en el país. La apelación se basa en la argumentación de que la decisión judicial es injusta y que Bolsonaro no debería enfrentar este castigo.",""
"09/15/2025 12:30:14","https://infobae.com/america/mundo/2025/09/13/multitudinaria-marcha-en-londres-para-protestar-contra-las-politicas-migratorias/","Multitudinaria marcha en Londres para protestar contra las políticas migratorias","Multitudinaria marcha en Londres contra las políticas migratorias","https://encrypted-tbn0.gstatic.com/images?q=tbn:ANd9GcTR2sDGNFa_9nBl5DFMFb3MXDoK_4-soMv3b0s2rqkwLKmuZMWTsNKSt9AQJg&amp;s","Una gran manifestación tuvo lugar en Londres en respuesta a las políticas migratorias del gobierno británico. Miles de personas se congregaron para expresar su descontento con las medidas que, según los organizadores, afectan de manera negativa a los solicitantes de asilo y a las comunidades migrantes. Los manifestantes exigieron un cambio en la legislación actual y pidieron un enfoque más humano en el trato a los migrantes. La protesta incluyó discursos de activistas y representantes de diversas organizaciones que abogan por los derechos de los migrantes.","Una gran manifestación tuvo lugar en Londres en respuesta a las políticas migratorias del gobierno británico. Miles de personas se congregaron para expresar su descontento con las medidas que, según los organizadores, afectan de manera negativa a los solicitantes de asilo y a las comunidades migrantes. Los manifestantes exigieron un cambio en la legislación actual y pidieron un enfoque más humano en el trato a los migrantes. La protesta incluyó discursos de activistas y representantes de diversas organizaciones que abogan por los derechos de los migrantes.",""
"09/15/2025 12:30:14","https://infobae.com/america/america-latina/2025/09/11/el-interamerican-institute-for-democracy-organizo-el-foro-quienes-sostienen-la-dictadura-de-cuba/","El InterAmerican Institute for Democracy organizó el foro “¿Quiénes sostienen la dictadura de Cuba?”","Foro sobre quienes sostienen la dictadura de Cuba organizado por el Inter-American Institute for Democracy","https://encrypted-tbn0.gstatic.com/images?q=tbn:ANd9GcQrwBDM6KfoR5TboPM3f3GTEHwAursMTGLYl4QmqtDeG7d_TKT81Vbx2Awq-g&amp;s","El Instituto Interamericano para la Democracia organizó un foro titulado ""¿Quiénes sostienen la dictadura de Cuba?"", donde se discutieron los actores y factores que permiten la continuidad del régimen cubano. Durante el evento, se abordaron temas como la represión política, la situación de los derechos humanos en la isla y el papel de actores externos que apoyan al gobierno cubano. Los panelistas también destacaron la importancia de la solidaridad internacional y la necesidad de visibilizar la realidad cubana para fomentar un cambio hacia la democracia.","El Instituto Interamericano para la Democracia organizó un foro titulado ""¿Quiénes sostienen la dictadura de Cuba?"", donde se discutieron los actores y factores que permiten la continuidad del régimen cubano. Durante el evento, se abordaron temas como la represión política, la situación de los derechos humanos en la isla y el papel de actores externos que apoyan al gobierno cubano. Los panelistas también destacaron la importancia de la solidaridad internacional y la necesidad de visibilizar la realidad cubana para fomentar un cambio hacia la democracia.",""
"09/15/2025 12:30:14","https://infobae.com/deportes/2025/09/15/mondo-duplantis-hizo-historia-en-el-deporte-salto-630-metros-rompio-su-propio-record-por-14-vez-y-se-consagro-tricampeon-del-mundo/","Mondo Duplantis hizo historia: saltó 6.30 metros, rompió su propio récord por 14° vez y es tricampeón mundial","Mondo Duplantis rompe su propio récord por 14ª vez y se consagra tricampeón del mundo en salto con garrocha","https://encrypted-tbn0.gstatic.com/images?q=tbn:ANd9GcQCa6ZklCiMOKq-NSLXcjODF4tM1Oksynq1_4a_C3YDdV-UcwrDosewk6OeBCQ&amp;s","Mondo Duplantis logró un hito en el atletismo al saltar 6.30 metros, estableciendo un nuevo récord mundial y superando su propia marca por décimo cuarta vez. Este logro se produjo durante el Campeonato Mundial de Atletismo, donde Duplantis se coronó tricampeón, reafirmando su dominio en la disciplina. Su extraordinaria capacidad y consistencia lo consolidan como uno de los mejores atletas de todos los tiempos en el salto con garrocha.","Mondo Duplantis logró un hito en el atletismo al saltar 6.30 metros, estableciendo un nuevo récord mundial y superando su propia marca por décimo cuarta vez. Este logro se produjo durante el Campeonato Mundial de Atletismo, donde Duplantis se coronó tricampeón, reafirmando su dominio en la disciplina. Su extraordinaria capacidad y consistencia lo consolidan como uno de los mejores atletas de todos los tiempos en el salto con garrocha.",""
"09/15/2025 12:30:14","https://infobae.com/deportes/2025/09/14/el-impactante-golpe-de-terrence-crawford-a-canelo-alvarez-que-definio-una-historica-pelea-para-el-boxeo-lo-llevo-a-una-nueva-dimension/","El impactante golpe de Terrence Crawford a Canelo Álvarez que definió una histórica pelea para el boxeo: “Lo llevó a una nueva dimensión”","Terrence Crawford propina un golpe decisivo a Canelo Álvarez en una pelea histórica para el boxeo","https://encrypted-tbn0.gstatic.com/images?q=tbn:ANd9GcSCI5FTmRTGKtXQurv5RmwWNLOyzlthRay9vVA23QNmhT8Rmw5CSzx3UOUCSQ&amp;s","Terrence Crawford y Saúl ""Canelo"" Álvarez se enfrentaron en una pelea histórica que marcó un hito en el boxeo. Crawford, conocido por su habilidad y técnica, logró impactar un golpe decisivo que inclinó la balanza a su favor, cambiando así la narrativa de la contienda. A través de una estrategia metódica y un desempeño destacado, Crawford demostró su superioridad, llevando su carrera a un nuevo nivel y dejando una impresión duradera en el mundo del boxeo. La pelea no solo fue un evento clave en sus respectivas trayectorias, sino que también atrajo la atención de aficionados y críticos por igual, destacando la importancia de la competencia entre estos dos grandes atletas.","Terrence Crawford y Saúl ""Canelo"" Álvarez se enfrentaron en una pelea histórica que marcó un hito en el boxeo. Crawford, conocido por su habilidad y técnica, logró impactar un golpe decisivo que inclinó la balanza a su favor, cambiando así la narrativa de la contienda. A través de una estrategia metódica y un desempeño destacado, Crawford demostró su superioridad, llevando su carrera a un nuevo nivel y dejando una impresión duradera en el mundo del boxeo. La pelea no solo fue un evento clave en sus respectivas trayectorias, sino que también atrajo la atención de aficionados y críticos por igual, destacando la importancia de la competencia entre estos dos grandes atletas.",""
"09/15/2025 12:30:14","https://infobae.com/america/mundo/2025/09/12/la-otan-acuso-a-rusia-de-coordinar-un-ataque-deliberado-en-polonia-para-provocar-una-reaccion/","La OTAN acusó a Rusia de coordinar un ataque deliberado en Polonia para “provocar” una reacción","OTAN acusa a Rusia de coordinar ataque deliberado en Polonia para provocar reacción","https://encrypted-tbn0.gstatic.com/images?q=tbn:ANd9GcSPCrJRo80p4TT2sFyi_tWqXD2XthnrsNAQlO9CxFGHLNPGILrJizydy-wTZpc&amp;s","La OTAN ha señalado que Rusia estaría detrás de un ataque coordinado en Polonia, con el objetivo de provocar una respuesta internacional. Este acto se interpreta como parte de una estrategia más amplia por parte de Moscú para desestabilizar la región y desafiar la seguridad europea. Las autoridades de la OTAN han expresado su preocupación y han instado a los países miembros a estar alertas ante posibles agresiones. La situación genera tensiones en el contexto de la política de defensa colectiva y la cooperación entre los aliados.","La OTAN ha señalado que Rusia estaría detrás de un ataque coordinado en Polonia, con el objetivo de provocar una respuesta internacional. Este acto se interpreta como parte de una estrategia más amplia por parte de Moscú para desestabilizar la región y desafiar la seguridad europea. Las autoridades de la OTAN han expresado su preocupación y han instado a los países miembros a estar alertas ante posibles agresiones. La situación genera tensiones en el contexto de la política de defensa colectiva y la cooperación entre los aliados.",""
"09/15/2025 12:30:14","https://infobae.com/deportes/2025/09/10/la-dura-critica-de-un-historico-de-uruguay-a-bielsa-por-la-polemica-de-los-cambios-ante-chile-me-duele-si-soy-jugador/","La dura crítica de un histórico de Uruguay a Bielsa por la polémica de los cambios ante Chile","La dura crítica de un histórico de Uruguay a Bielsa por la polémica de los cambios ante Chile","https://encrypted-tbn0.gstatic.com/images?q=tbn:ANd9GcRO5Ji-E1Doi7yUam5_IPtItXvJ-J-eKaqv-ZHCUILY1CTxWoEl4bUt71enbp0&amp;s","La noticia destaca la crítica de un histórico del fútbol uruguayo hacia el director técnico Marcelo Bielsa, tras los polémicos cambios realizados en la selección durante el partido contra Chile. El exjugador expresó su desagrado y preocupación, enfatizando que decisiones como estas pueden afectar negativamente a los futbolistas. Su comentario refleja el malestar de algunos sectores frente a la gestión táctica del entrenador en momentos clave del encuentro.","La noticia destaca la crítica de un histórico del fútbol uruguayo hacia el director técnico Marcelo Bielsa, tras los polémicos cambios realizados en la selección durante el partido contra Chile. El exjugador expresó su desagrado y preocupación, enfatizando que decisiones como estas pueden afectar negativamente a los futbolistas. Su comentario refleja el malestar de algunos sectores frente a la gestión táctica del entrenador en momentos clave del encuentro.",""
"09/15/2025 12:30:14","https://infobae.com/estados-unidos/2025/09/13/paso-a-paso-asi-fue-la-llegada-al-campus-del-asesino-de-charlie-kirk-y-su-posterior-escape/","Paso a paso, así fue la llegada al campus del asesino de Charlie Kirk y su posterior escape","Llegada y escape del asesino de Charlie Kirk en el campus universitario","https://encrypted-tbn0.gstatic.com/images?q=tbn:ANd9GcSJruph_JbkRY2VefN2jiHea4Vq3OKkYnelwCtawyDet4q-YucjfkViEVgaUx8&amp;s","Un joven identificado como el asesino de Charlie Kirk llegó al campus universitario donde se encontraban asistentes de un evento. Tras un tiempo en el campus, se produjo su fuga, generando una intensa búsqueda por parte de las autoridades. Durante el incidente, se activaron protocolos de seguridad y se alertó a la comunidad educativa, lo que llevó a que varios estudiantes se mantuvieran en refugios seguros. La situación fue monitoreada por la policía local y más tarde se reportó que el sospechoso había logrado escapar, lo que dejó inquietud entre los ciudadanos y miembros de la universidad.","Un joven identificado como el asesino de Charlie Kirk llegó al campus universitario donde se encontraban asistentes de un evento. Tras un tiempo en el campus, se produjo su fuga, generando una intensa búsqueda por parte de las autoridades. Durante el incidente, se activaron protocolos de seguridad y se alertó a la comunidad educativa, lo que llevó a que varios estudiantes se mantuvieran en refugios seguros. La situación fue monitoreada por la policía local y más tarde se reportó que el sospechoso había logrado escapar, lo que dejó inquietud entre los ciudadanos y miembros de la universidad.",""
