"FechayHora","LinkOrigen","TituloOrigen","Titulo","Imagen","Intro","Noticia","Datos"
"09/07/2025 16:00:07","https://infobae.com/deportes/2025/09/07/asi-quedaron-las-tablas-de-la-f1-tras-el-gp-de-italia-norris-acorto-distancia-con-piastri-en-la-lucha-por-el-titulo-y-otra-decepcion-de-alpine/","Así quedaron las tablas de la F1 tras el GP de Italia: Norris acortó distancia con Piastri en la lucha por el título","Así quedaron las tablas de la F1 tras el GP de Italia: Norris acortó distancia con Piastri en la lucha por el título y otra decepción de Alpine","https://encrypted-tbn0.gstatic.com/images?q=tbn:ANd9GcQizfEO93DXBwWC80FhkHOZfimuJQbZkqM9Sm6HEHMhN9CuIDBXgeAHrH2f7w&amp;s","En el Gran Premio de Italia de Fórmula 1, Lando Norris logró acortar la distancia que lo separaba de Oscar Piastri en la lucha por el título. Por otro lado, el equipo Alpine volvió a decepcionar en esta competencia.","En el Gran Premio de Italia de Fórmula 1, Lando Norris logró acortar la distancia que lo separaba de Oscar Piastri en la lucha por el título. Por otro lado, el equipo Alpine volvió a decepcionar en esta competencia.",
"09/07/2025 16:00:07","https://infobae.com/america/mundo/2025/09/06/emmanuel-macron-buscara-agilizar-el-nombramiento-de-un-nuevo-primer-ministro-ante-el-inminente-colapso-del-gobierno-de-francois-bayrou/","Macron buscará agilizar el nombramiento de un nuevo primer ministro ante el inminente colapso del gobierno de Bayrou","Emmanuel Macron buscará agilizar el nombramiento de un nuevo primer ministro ante el inminente colapso del gobierno de Francois Bayrou","https://encrypted-tbn0.gstatic.com/images?q=tbn:ANd9GcSckF6Mx-VRkg0Cdt_aLIsvsZPwyV3NjZ3PcqYi8tk_kKReK6xu12r8rvy-aW0&amp;s","El presidente de Francia, Emmanuel Macron, buscará agilizar el nombramiento de un nuevo primer ministro ante el inminente colapso del gobierno de François Bayrou. La situación se ha vuelto insostenible debido a diferencias que han surgido en temas clave. Macron busca reorganizar el gabinete para mantener la gobernabilidad del país en medio de la crisis.","El presidente de Francia, Emmanuel Macron, buscará agilizar el nombramiento de un nuevo primer ministro ante el inminente colapso del gobierno de François Bayrou. La situación se ha vuelto insostenible debido a diferencias que han surgido en temas clave. Macron busca reorganizar el gabinete para mantener la gobernabilidad del país en medio de la crisis.",""
"09/07/2025 16:00:07","https://infobae.com/venezuela/2025/09/06/el-fiscal-general-de-la-dictadura-chavista-amenazo-a-edmundo-gonzalez-urrutia-regrese-a-venezuela-para-que-vea-lo-que-le-va-a-ocurrir/","El fiscal general de la dictadura chavista amenazó a Edmundo González Urrutia: “Regrese a Venezuela para que vea lo que le va a ocurrir”","","https://encrypted-tbn0.gstatic.com/images?q=tbn:ANd9GcRq4wkv6xWo9pKZyt_OctdREAsvGuWmNejhuRmkredFJN3fdcAXmPmWZYL8Jb0&amp;s","En el artículo se informa que el fiscal general de la dictadura chavista amenazó a Edmundo González Urrutia para que regrese a Venezuela y supuestamente enfrente consecuencias. González Urrutia es un abogado y defensor de derechos humanos que se encuentra en el exilio debido a la persecución del régimen de Nicolás Maduro.","En el artículo se informa que el fiscal general de la dictadura chavista amenazó a Edmundo González Urrutia para que regrese a Venezuela y supuestamente enfrente consecuencias. González Urrutia es un abogado y defensor de derechos humanos que se encuentra en el exilio debido a la persecución del régimen de Nicolás Maduro.",""
"09/07/2025 16:00:07","https://infobae.com/america/mundo/2025/09/07/trump-dijo-estar-listo-para-imponer-nuevas-sanciones-a-rusia-despues-del-mayor-ataque-aereo-contra-ucrania/","Trump dijo estar listo para imponer nuevas sanciones a Rusia después del mayor ataque aéreo contra Ucrania","Trump listo para imponer nuevas sanciones a Rusia después del mayor ataque aéreo contra Ucrania","https://encrypted-tbn0.gstatic.com/images?q=tbn:ANd9GcSlxE5txJHzqAVt7DF5SuCmvDXkUYE2rA3ucno5Bq-Ullxt6HtbnSFkvZnXBw&amp;s","El expresidente de Estados Unidos, Donald Trump, manifestó su disposición para implementar nuevas sanciones contra Rusia después del mayor ataque aéreo contra Ucrania. Esta medida se da en medio de las tensiones entre ambos países por la situación en la región de Crimea.","El expresidente de Estados Unidos, Donald Trump, manifestó su disposición para implementar nuevas sanciones contra Rusia después del mayor ataque aéreo contra Ucrania. Esta medida se da en medio de las tensiones entre ambos países por la situación en la región de Crimea.",""
"09/07/2025 16:00:07","https://infobae.com/america/mundo/2025/09/07/anutin-charnvirakul-asumio-como-nuevo-primer-ministro-de-tailandia/","Anutin Charnvirakul asumió como nuevo primer ministro de Tailandia","Anutin Charnvirakul asumió como nuevo primer ministro de Tailandia","https://encrypted-tbn0.gstatic.com/images?q=tbn:ANd9GcTjFlBLnbnOlSj1bq7iCXrp1_xlQY-AiAbugAk334KHbJTGADru75sw9NXRlw&amp;s","El político Anutin Charnvirakul asumió como nuevo primer ministro de Tailandia. Charnvirakul lidera el Partido de Acción Democrática, y su elección se dio tras la renuncia de Prayuth Chan-ocha, quien ocupaba el cargo desde 2019. Charnvirakul se comprometió a trabajar por el bienestar de la población y a impulsar reformas en el país.","El político Anutin Charnvirakul asumió como nuevo primer ministro de Tailandia. Charnvirakul lidera el Partido de Acción Democrática, y su elección se dio tras la renuncia de Prayuth Chan-ocha, quien ocupaba el cargo desde 2019. Charnvirakul se comprometió a trabajar por el bienestar de la población y a impulsar reformas en el país.",""
"09/07/2025 16:00:07","https://infobae.com/america/mundo/2025/09/07/los-milagros-de-carlo-acutis-cuales-son-los-dos-hechos-reconocidos-por-el-vaticano-que-lo-llevaron-a-la-canonizacion/","Los milagros de Carlo Acutis: cuáles son los dos hechos reconocidos por el Vaticano que lo llevaron a la canonización","Los milagros de Carlo Acutis: Los dos hechos reconocidos por el Vaticano que lo llevaron a la canonización","https://encrypted-tbn0.gstatic.com/images?q=tbn:ANd9GcSk-DNJJArmmaA4am7oLZX4sijyTaUDY3TzL4FBl1XX_cxqhUJuLFCUbCvektI&amp;s","El Vaticano reconoció dos milagros atribuidos a Carlo Acutis, lo que lo llevó a ser canonizado. Los milagros confirmados incluyen la curación de un niño brasileño con páncreas anormal y la remisión inexplicable de una mujer italiana con leucemia. Carlo Acutis fue un joven italiano fallecido a los 15 años en 2006, que será reconocido como santo por la Iglesia Católica.","El Vaticano reconoció dos milagros atribuidos a Carlo Acutis, lo que lo llevó a ser canonizado. Los milagros confirmados incluyen la curación de un niño brasileño con páncreas anormal y la remisión inexplicable de una mujer italiana con leucemia. Carlo Acutis fue un joven italiano fallecido a los 15 años en 2006, que será reconocido como santo por la Iglesia Católica.",""
"09/07/2025 16:00:07","https://infobae.com/america/mundo/2025/09/07/la-oleada-de-bombardeos-rusos-contra-la-ciudad-de-kiev-dano-el-edificio-del-gabinete-de-ministros-ucraniano/","La oleada de bombardeos rusos contra Ucrania dañó el edificio del Gabinete de Ministros en la ciudad de Kiev","La oleada de bombardeos rusos contra la ciudad de Kiev daño el edificio del Gabinete de Ministros ucraniano","https://encrypted-tbn0.gstatic.com/images?q=tbn:ANd9GcSS6FTBCvpbTA3tzV3iUxyxONwlMz5-POmN0vmdYkxXKvWKY4H9q7lZg240tg&amp;s","En una serie de bombardeos rusos sobre la ciudad de Kiev, el edificio del Gabinete de Ministros ucraniano resultó dañado. Los ataques causaron destrozos en la estructura del edificio, aunque hasta el momento no se informaron víctimas. Los bombardeos forman parte de la escalada del conflicto entre Rusia y Ucrania.","En una serie de bombardeos rusos sobre la ciudad de Kiev, el edificio del Gabinete de Ministros ucraniano resultó dañado. Los ataques causaron destrozos en la estructura del edificio, aunque hasta el momento no se informaron víctimas. Los bombardeos forman parte de la escalada del conflicto entre Rusia y Ucrania.",""
"09/07/2025 16:00:07","https://infobae.com/america/mundo/2025/09/07/el-ejercito-de-israel-destruyo-otro-edificio-utilizado-por-los-terroristas-de-hamas-en-ciudad-de-gaza/","El Ejército de Israel destruyó otro edificio utilizado por los terroristas de Hamas en ciudad de Gaza","El ejército de Israel destruyó otro edificio utilizado por los terroristas de Hamas en la ciudad de Gaza","https://encrypted-tbn0.gstatic.com/images?q=tbn:ANd9GcTwh7gqp80BkPQ63MO0S46_Rpu4PBmfgx9AfrvIMhiW8pb_uIEy7ta-MnzWoA&amp;s","El ejército de Israel destruyó otro edificio utilizado por los terroristas de Hamas en la ciudad de Gaza. La acción forma parte de las operaciones para desmantelar las infraestructuras del grupo extremista en la región.","El ejército de Israel destruyó otro edificio utilizado por los terroristas de Hamas en la ciudad de Gaza. La acción forma parte de las operaciones para desmantelar las infraestructuras del grupo extremista en la región.",""
"09/07/2025 16:00:07","https://infobae.com/america/mundo/2025/09/06/modi-rebaja-las-tensiones-con-trump-califico-la-relacion-entre-india-y-eeuu-como-una-asociacion-estrategica-con-vision-de-futuro/","Modi rebaja las tensiones con Trump: calificó la relación entre India y EEUU como una “asociación estratégica con visión de futuro”","Modi rebaja las tensiones con Trump: calificó la relación entre India y EEUU como una asociación estratégica con visión de futuro","https://encrypted-tbn0.gstatic.com/images?q=tbn:ANd9GcT7PmTyhZwKIlaRzkCYPP3WC7VkcQzUWx985YFpf-nRRPm-pZ7NY2t4GSNa1g&amp;s","El primer ministro de India, Narendra Modi, ha rebajado las tensiones con el expresidente de Estados Unidos, Donald Trump, al calificar la relación entre ambos países como una ""asociación estratégica con visión de futuro"". Modi resaltó la importancia de la colaboración entre India y Estados Unidos en temas como la seguridad, el comercio y la defensa.","El primer ministro de India, Narendra Modi, ha rebajado las tensiones con el expresidente de Estados Unidos, Donald Trump, al calificar la relación entre ambos países como una ""asociación estratégica con visión de futuro"". Modi resaltó la importancia de la colaboración entre India y Estados Unidos en temas como la seguridad, el comercio y la defensa.",""
"09/07/2025 16:00:07","https://infobae.com/deportes/2025/09/07/del-enojo-con-un-fanatico-a-la-emocion-de-un-nino-los-dos-episodios-de-cristiano-ronaldo-en-la-seleccion-de-portugal-que-recorren-el-mundo/","Del enojo con un fanático a la emoción de un niño: los dos episodios de Cristiano Ronaldo en la selección de Portugal","Del enojo con un fanático a la emoción de un niño: los dos episodios de Cristiano Ronaldo en la selección de Portugal que recorren el mundo","https://encrypted-tbn0.gstatic.com/images?q=tbn:ANd9GcTCVYGugI1lUMz_BwJF2BJxdCGahrTwf3tjT3OpdTGoEWxrMcNbQA6XAxDMMu8&amp;s","Cristiano Ronaldo protagonizó dos episodios en la selección de Portugal que se volvieron virales. En uno de ellos, se enojó con un aficionado durante un entrenamiento. En el otro, conmovió a un niño que invadió el campo para conocerlo. Ambos momentos fueron ampliamente difundidos en todo el mundo.","Cristiano Ronaldo protagonizó dos episodios en la selección de Portugal que se volvieron virales. En uno de ellos, se enojó con un aficionado durante un entrenamiento. En el otro, conmovió a un niño que invadió el campo para conocerlo. Ambos momentos fueron ampliamente difundidos en todo el mundo.",""
"09/07/2025 16:00:07","https://infobae.com/deportes/2025/09/04/los-pequenos-privilegios-que-deschamps-le-concedio-a-sus-jugadores-en-la-seleccion-de-francia/","Los “pequeños privilegios” que Deschamps le concedió a sus jugadores en la selección de Francia","Los pequeños privilegios que Deschamps le concedió a sus jugadores en la Selección de Francia","https://encrypted-tbn0.gstatic.com/images?q=tbn:ANd9GcTLiJLZrv_cjIQJO0nbx55V3QaCs3e5spby2L-enqdjVEDjUGmFItimTgLn-P8&amp;s","En la selección de Francia, Didier Deschamps concedió pequeños privilegios a sus jugadores para mantener la armonía dentro del equipo. Entre estos privilegios se encuentran la posibilidad de usar auriculares antes de un partido, elegir entre un menú con carne o pescado, o incluso tener acceso a una consola de videojuegos en su tiempo libre. Estas pequeñas concesiones contribuyen a mantener un ambiente positivo y competitivo entre los jugadores.","En la selección de Francia, Didier Deschamps concedió pequeños privilegios a sus jugadores para mantener la armonía dentro del equipo. Entre estos privilegios se encuentran la posibilidad de usar auriculares antes de un partido, elegir entre un menú con carne o pescado, o incluso tener acceso a una consola de videojuegos en su tiempo libre. Estas pequeñas concesiones contribuyen a mantener un ambiente positivo y competitivo entre los jugadores.",""
"09/07/2025 16:00:07","https://infobae.com/america/america-latina/2025/09/07/lula-afirmo-que-brasil-no-volvera-a-ser-colonia-de-nadie-en-su-mensaje-por-el-dia-de-la-independencia/","Lula afirmó que Brasil no volverá “a ser colonia de nadie” en su mensaje por el Día de la Independencia","Lula afirmó que Brasil no volverá a ser colonia de nadie en su mensaje por el Día de la Independencia","https://encrypted-tbn0.gstatic.com/images?q=tbn:ANd9GcRzROfdzFlSnun2VGMPq-dxYlpcG2L1RTWf5OXCxo2SOHneZVCiZuTpDX0uHeA&amp;s","En su mensaje por el Día de la Independencia, Lula afirmó que Brasil no volverá a ser colonia de nadie. El ex presidente brasileño se pronunció en contra de cualquier intento de someter al país nuevamente a intereses extranjeros, destacando la importancia de la soberanía nacional.","En su mensaje por el Día de la Independencia, Lula afirmó que Brasil no volverá a ser colonia de nadie. El ex presidente brasileño se pronunció en contra de cualquier intento de someter al país nuevamente a intereses extranjeros, destacando la importancia de la soberanía nacional.",""
"09/07/2025 16:00:07","https://infobae.com/america/mundo/2025/09/03/taiwan-denuncio-que-china-instalo-plataformas-petroleras-en-sus-aguas/","Taiwán denunció que China instaló plataformas petroleras en sus aguas","Taiwán denunció que China instaló plataformas petroleras en sus aguas","https://encrypted-tbn0.gstatic.com/images?q=tbn:ANd9GcTR7wwP-gl5-pbNoXWSd6sYJ4OrEdntTdzppF-w2yokTbAFgPMtWz0vxFy5Cw&amp;s","Taiwán denunció que China instaló plataformas petroleras en sus aguas territoriales, lo que ha incrementado la tensión entre ambos países. Esto ha generado preocupación en Taiwán debido a la posible explotación de recursos naturales en sus aguas sin su consentimiento.","Taiwán denunció que China instaló plataformas petroleras en sus aguas territoriales, lo que ha incrementado la tensión entre ambos países. Esto ha generado preocupación en Taiwán debido a la posible explotación de recursos naturales en sus aguas sin su consentimiento.",""
"09/07/2025 16:00:07","https://infobae.com/america/mundo/2025/09/05/donald-trump-tendra-control-sobre-usd-550000-millones-en-inversiones-japonesas/","Donald Trump tendrá control sobre USD 550.000 millones en inversiones japonesas","Donald Trump tendrá control sobre USD 550,000 millones en inversiones japonesas","https://encrypted-tbn0.gstatic.com/images?q=tbn:ANd9GcSvIm-oJtkIZZDK00SFR7bee3YUUdBIa99Ya225I5vYNgb1d_oT2q8iw2bViw&amp;s","El ex presidente de Estados Unidos, Donald Trump, tendrá control sobre USD 550,000 millones en inversiones japonesas. Esta decisión generó controversia debido a su historial en el gobierno y su relación con líderes extranjeros. Los analistas están atentos a cómo gestionará este importante monto.","El ex presidente de Estados Unidos, Donald Trump, tendrá control sobre USD 550,000 millones en inversiones japonesas. Esta decisión generó controversia debido a su historial en el gobierno y su relación con líderes extranjeros. Los analistas están atentos a cómo gestionará este importante monto.",""
"09/07/2025 16:00:07","https://infobae.com/america/america-latina/2025/09/07/el-presidente-irfaan-ali-fue-reelecto-para-un-segundo-mandato-consecutivo-de-guyana/","El presidente Irfaan Ali fue reelecto para un segundo mandato consecutivo de Guyana","El presidente Irfaan Ali fue reelegido para un segundo mandato consecutivo en Guyana","https://encrypted-tbn0.gstatic.com/images?q=tbn:ANd9GcTzzghXbIhix85YDFT5RAmkdQ9fDtsutLpSR98KuKsX3Fg1GBbMOEJZxl-UZYM&amp;s","El presidente Irfaan Ali fue reelecto para un segundo mandato consecutivo en Guyana. Ali obtuvo la victoria con un margen del 49.69% de los votos, asegurando su permanencia en el cargo por un período adicional.","El presidente Irfaan Ali fue reelecto para un segundo mandato consecutivo en Guyana. Ali obtuvo la victoria con un margen del 49.69% de los votos, asegurando su permanencia en el cargo por un período adicional.",""
"09/07/2025 16:00:08","https://infobae.com/america/america-latina/2025/09/06/puerto-rico-respaldo-las-operaciones-de-eeuu-contra-el-narco-y-acuso-al-regimen-de-maduro-de-haber-inundado-a-la-isla-con-drogas-peligrosas/","Puerto Rico respaldó las operaciones de EEUU contra el narco y acusó al régimen de Maduro de haber “inundado” a la isla “con drogas peligrosas”","Puerto Rico respalda operaciones de EEUU contra el narco y acusa a Maduro de inundar la isla con drogas peligrosas","https://encrypted-tbn0.gstatic.com/images?q=tbn:ANd9GcQUaNEXz7JHy2Et7Z-qqs1nYTRWB1zQshF8_oUopy-RGXQWdRctOnefhlVALDw&amp;s","Puerto Rico respaldó las operaciones de Estados Unidos contra el narcotráfico y acusó al régimen de Maduro de inundar la isla con drogas peligrosas. La gobernadora de Puerto Rico expresó su apoyo a las acciones de Estados Unidos y denunció que Venezuela está utilizando la isla como ruta para transportar drogas hacia el continente.","Puerto Rico respaldó las operaciones de Estados Unidos contra el narcotráfico y acusó al régimen de Maduro de inundar la isla con drogas peligrosas. La gobernadora de Puerto Rico expresó su apoyo a las acciones de Estados Unidos y denunció que Venezuela está utilizando la isla como ruta para transportar drogas hacia el continente.",""
"09/07/2025 16:00:08","https://infobae.com/deportes/2025/09/05/bayer-leverkusen-echo-a-su-peor-entrenador-despues-de-tres-partidos-y-pagara-una-millonaria-indemnizacion/","Bayer Leverkusen echó a su “peor entrenador” después de tres partidos y pagará una millonaria indemnización","Bayer Leverkusen despide a su peor entrenador tras tres partidos y pagará millonaria indemnización","https://encrypted-tbn0.gstatic.com/images?q=tbn:ANd9GcQLUfW9dCKUKMzFo6j1qmW0gUg-UC50wqHoZOj8sCmXDcmgaa7RmQEB_OorSA&amp;s","El Bayer Leverkusen despidió a su peor entrenador después de tres partidos y deberá pagar una millonaria indemnización. El club alemán decidió prescindir de los servicios del técnico tras los malos resultados obtenidos en el inicio de la temporada.","El Bayer Leverkusen despidió a su peor entrenador después de tres partidos y deberá pagar una millonaria indemnización. El club alemán decidió prescindir de los servicios del técnico tras los malos resultados obtenidos en el inicio de la temporada.",""
"09/07/2025 16:00:08","https://infobae.com/venezuela/2025/09/06/jd-vance-defendio-el-uso-de-la-fuerza-contra-los-narcotraficantes-que-envenenan-a-los-norteamericanos/","JD Vance defendió el uso de la fuerza contra los narcotraficantes que “envenenan” a los norteamericanos","JD Vance defendio el uso de la fuerza contra los narcotraficantes que envenenan a los norteamericanos","https://encrypted-tbn0.gstatic.com/images?q=tbn:ANd9GcRM8UQgPUWh8ONAJrPaQe-X63iVBpg2qeAeRfCKVD0_olY8UsOW_npTYHId1A&amp;s","El político JD Vance expresó su apoyo al uso de la fuerza contra los narcotraficantes que dañan a los ciudadanos estadounidenses. Vance hizo estas declaraciones durante una entrevista en la que discutió sus propuestas para combatir la crisis de drogas en el país.","El político JD Vance expresó su apoyo al uso de la fuerza contra los narcotraficantes que dañan a los ciudadanos estadounidenses. Vance hizo estas declaraciones durante una entrevista en la que discutió sus propuestas para combatir la crisis de drogas en el país.",""
"09/07/2025 16:00:08","https://infobae.com/deportes/2025/09/06/us-open-aryna-sabalenka-vencio-a-amanda-anisimova-en-la-final-y-se-consagro-campeona-por-segundo-ano-consecutivo/","Aryna Sabalenka venció a Amanda Anisimova en la final del US Open y se consagró campeona por segundo año consecutivo","US Open: Aryna Sabalenka venció a Amanda Anisimova en la final y se consagró campeona por segundo año consecutivo","https://encrypted-tbn0.gstatic.com/images?q=tbn:ANd9GcQ8wvhZLPVSD0uRLr2rbgHcP0GbmTdo9L1GhBG4LG3wFLR4hptDxrr8oox0BQ&amp;s","Aryna Sabalenka venció a Amanda Anisimova en la final del US Open y se consagró campeona por segundo año consecutivo. Sabalenka logró imponerse en dos sets y retuvo su título en el torneo de tenis.","Aryna Sabalenka venció a Amanda Anisimova en la final del US Open y se consagró campeona por segundo año consecutivo. Sabalenka logró imponerse en dos sets y retuvo su título en el torneo de tenis.",""
"09/07/2025 16:00:08","https://infobae.com/america/america-latina/2025/09/06/un-tribunal-de-bolivia-ordeno-la-prision-preventiva-para-el-ex-ministro-arturo-murillo-tras-ser-deportado-desde-estados-unidos/","Un tribunal de Bolivia ordenó la prisión preventiva para el ex ministro Murillo tras ser deportado desde EEUU","Un tribunal de Bolivia ordenó la prisión preventiva para el ex ministro Arturo Murillo tras ser deportado desde Estados Unidos","https://encrypted-tbn0.gstatic.com/images?q=tbn:ANd9GcQMwGTS-R9FfcrWKtN9xe1m5SJ6r7rA48rLiVHbTKrPrR7HDad4qHGgbBMUUE4&amp;s","Un tribunal de Bolivia ordenó la prisión preventiva para el ex ministro Arturo Murillo, luego de ser deportado desde Estados Unidos. Murillo es acusado de corrupción en la compra con sobreprecio de gases lacrimógenos durante su gestión como ministro de Gobierno.","Un tribunal de Bolivia ordenó la prisión preventiva para el ex ministro Arturo Murillo, luego de ser deportado desde Estados Unidos. Murillo es acusado de corrupción en la compra con sobreprecio de gases lacrimógenos durante su gestión como ministro de Gobierno.",""
"09/07/2025 16:00:08","https://infobae.com/america/america-latina/2025/09/07/crece-la-violencia-en-santa-cruz-de-la-sierra-una-ola-de-secuestros-y-sicariatos-sugiere-la-presencia-de-mafias-internacionales-en-bolivia/","Crece la violencia en Bolivia: una ola de secuestros y sicariatos sugiere la presencia de mafias internacionales","Crece la violencia en Santa Cruz de la Sierra: Una ola de secuestros y sicariatos sugiere la presencia de mafias internacionales en Bolivia","https://encrypted-tbn0.gstatic.com/images?q=tbn:ANd9GcS1CSce0QzhBLGoIs7e_eejmBiBjS41xdMCbxPBEahCKQZVuRblvOOTqmlnag&amp;s","La ciudad de Santa Cruz de la Sierra en Bolivia está experimentando un aumento en la violencia, con casos de secuestros y sicariatos que sugieren la presencia de mafias internacionales en la región. Los residentes se encuentran alarmados por esta situación preocupante.","La ciudad de Santa Cruz de la Sierra en Bolivia está experimentando un aumento en la violencia, con casos de secuestros y sicariatos que sugieren la presencia de mafias internacionales en la región. Los residentes se encuentran alarmados por esta situación preocupante.",""
"09/07/2025 16:00:08","https://infobae.com/america/mundo/2025/09/05/ante-la-amenaza-de-china-australia-y-japon-reforzaron-la-cooperacion-militar/","Ante la amenaza de China, Australia y Japón reforzaron la cooperación militar","""Australia y Japón refuerzan cooperación militar ante amenaza de China""","https://encrypted-tbn0.gstatic.com/images?q=tbn:ANd9GcSwnBV8czHlrpRwLhP9-OXC6if2FVh-PyzLr0XhUzT9CRoQe2amPgDvHHpkALA&amp;s","En respuesta a la amenaza que representa China en la región, Australia y Japón han decidido reforzar su cooperación militar. Esta alianza busca fortalecer la seguridad en el Indo-Pacífico y contrarrestar la expansión militar china en la zona. Ambos países han acordado aumentar los ejercicios conjuntos y compartir información de inteligencia para mantener la estabilidad en la región.","En respuesta a la amenaza que representa China en la región, Australia y Japón han decidido reforzar su cooperación militar. Esta alianza busca fortalecer la seguridad en el Indo-Pacífico y contrarrestar la expansión militar china en la zona. Ambos países han acordado aumentar los ejercicios conjuntos y compartir información de inteligencia para mantener la estabilidad en la región.",""
