"FechayHora","LinkOrigen","TituloOrigen","Titulo","Imagen","Intro","Noticia","Datos"
"08/31/2025 09:03:01","https://infobae.com/america/mundo/2025/08/18/eeuu-y-corea-del-sur-iniciaron-sus-ejercicios-militares-conjuntos-en-medio-de-las-amenazas-del-regimen-de-kim-jong-un/","EEUU y Corea del Sur iniciaron sus ejercicios militares conjuntos en medio de las amenazas del régimen de Kim Jong-un","Se consultó el Titulo a la IA","https://encrypted-tbn0.gstatic.com/images?q=tbn:ANd9GcSu9xPjZ4ZmU_1dtxi5XJYFhI4pCjX8Cgsmc3vVKhLw-Ly3ckUjUgg1BbDb7Xk&amp;s","Se consultó la Nota a la IA","Se consultó la Nota a la IA","Se consultó el Datos a la IA"
"08/31/2025 09:03:01","https://infobae.com/deportes/2025/08/15/con-racing-tigre-como-atraccion-se-pone-en-marcha-la-quinta-fecha-del-torneo-clausura-hora-tv-y-formaciones/","A la espera de Racing-Tigre, Belgrano y Aldosivi empataron 0-0 por la 5ª fecha del Torneo Clausura","Se consultó el Titulo a la IA","https://encrypted-tbn0.gstatic.com/images?q=tbn:ANd9GcTRXSlf4fskw8mc7oidD1BEvcNh_ZTlQcJWx2ZiiI9i3B3BHHtgFgnpcQkk2g&amp;s","Se consultó la Nota a la IA","Se consultó la Nota a la IA","Se consultó el Datos a la IA"
"08/31/2025 09:03:01","https://infobae.com/deportes/2025/08/17/la-acusacion-de-liam-lawson-contra-red-bull-por-su-salida-del-equipo-que-sorprendio-a-la-formula-1-lo-hicieron-para-degradarme/","La acusación de Liam Lawson contra Red Bull por su salida del equipo que sorprendió a la Fórmula 1","Se consultó el Titulo a la IA","https://encrypted-tbn0.gstatic.com/images?q=tbn:ANd9GcTB4ToRW2NO1a3yZVDRLYhzUof_tiOW8n9hF2XNdA_hTs7zQ7M8bQSD7Tmj74s&amp;s","Se consultó la Nota a la IA","Se consultó la Nota a la IA","Se consultó el Datos a la IA"
"08/31/2025 09:03:01","https://infobae.com/america/mundo/2025/08/17/macron-adelanto-que-los-lideres-europeos-interrogaran-a-trump-sobre-las-garantias-de-seguridad-para-ucrania/","Macron dijo que los líderes europeos interrogarán a Trump sobre las garantías de seguridad para Ucrania","Se consultó el Titulo a la IA","https://encrypted-tbn0.gstatic.com/images?q=tbn:ANd9GcQJKpkiy2_5_zUf6_nL2XuW7jFrU5bzsch-3rMRDH64TXaYQ--00Uonh8JQb0E&amp;s","Se consultó la Nota a la IA","Se consultó la Nota a la IA","Se consultó el Datos a la IA"
"08/31/2025 09:03:01","https://infobae.com/economia/2025/08/15/de-cuanto-seran-las-jubilaciones-de-anses-en-septiembre-2025-con-el-ultimo-ajuste-por-inflacion/","De cuánto serán las jubilaciones de ANSES en septiembre 2025 con el último ajuste por inflación","Se consultó el Titulo a la IA","https://encrypted-tbn0.gstatic.com/images?q=tbn:ANd9GcROiGztB0Vl7tL4-EGJnL8BfvHVnLwQBt7FbI6RPRKeirbAo04NenNftlTYxsg&amp;s","Se consultó la Nota a la IA","Se consultó la Nota a la IA","Se consultó el Datos a la IA"
"08/31/2025 09:03:01","https://infobae.com/politica/2025/08/15/la-actriz-karen-reichardt-sera-candidata-a-diputada-de-lla-en-la-boleta-bonaerense-que-encabezara-espert/","Karen Reichardt será candidata a diputada de LLA en la boleta bonaerense que encabezará Espert","Se consultó el Titulo a la IA","https://encrypted-tbn0.gstatic.com/images?q=tbn:ANd9GcTOmZDKysTEQ01m9QpKDMO6EyOI1fUMInkiBHs3rNhYT1d_XvpiE38qYwyP4qA&amp;s","Se consultó la Nota a la IA","Se consultó la Nota a la IA","Se consultó el Datos a la IA"
"08/31/2025 09:03:01","https://infobae.com/america/mundo/2025/08/18/la-onu-reitero-su-disposicion-a-apoyar-cualquier-esfuerzo-que-conduzca-a-la-paz-en-ucrania/","La ONU reiteró su disposición a “apoyar cualquier esfuerzo” que conduzca a la paz en Ucrania","Se consultó el Titulo a la IA","https://encrypted-tbn0.gstatic.com/images?q=tbn:ANd9GcQRxBW17GQjrRaZTLAJ1lobw7D-vxb9JnzLo8jv08qnEuJamV_K05hLiqfjtkk&amp;s","Se consultó la Nota a la IA","Se consultó la Nota a la IA","Se consultó el Datos a la IA"
"08/31/2025 09:03:01","https://infobae.com/movant/2025/08/23/senasa-establece-nuevas-condiciones-logisticas-para-envases-y-transporte-agroindustrial/","Senasa establece nuevas condiciones logísticas para envases y transporte agroindustrial","Se consultó el Titulo a la IA","https://encrypted-tbn0.gstatic.com/images?q=tbn:ANd9GcQm3ttvU721_ZgLE7LlcwPw49ReBGwJl3Xvw7eADArSys6i5RnNFTtWv_EQNw0&amp;s","Se consultó la Nota a la IA","Se consultó la Nota a la IA","Se consultó el Datos a la IA"
"08/31/2025 09:03:01","https://infobae.com/america/mundo/2025/08/18/robaron-un-diamante-rosa-valorado-en-25-millones-de-dolares-pero-la-policia-lo-encontro-en-un-refrigerador/","Robaron un diamante rosa valorado en 25 millones de dólares y la policía lo encontró en un refrigerador","Se consultó el Titulo a la IA","https://encrypted-tbn0.gstatic.com/images?q=tbn:ANd9GcT9hiwDqPT12_GMFQYCJiOMLXVmegRGr6u1Ra4fe3kfaM5Nw8MH7gv-CJFRQQ&amp;s","Se consultó la Nota a la IA","Se consultó la Nota a la IA","Se consultó el Datos a la IA"
"08/31/2025 09:03:01","https://infobae.com/estados-unidos/2025/08/18/wall-street-cerro-estable-en-el-comienzo-de-la-semana/","Wall Street cerró estable en el comienzo de la semana","Se consultó el Titulo a la IA","https://encrypted-tbn0.gstatic.com/images?q=tbn:ANd9GcTZjfB_PZ374XFgk3paRMb17XLl_xXbA8Kxh1LZoNFrJrXC-n79LqXB9-f_-g&amp;s","Se consultó la Nota a la IA","Se consultó la Nota a la IA","Se consultó el Datos a la IA"
"08/31/2025 09:03:01","https://infobae.com/sociedad/policiales/2025/08/17/detuvieron-a-la-pistolera-ex-custodia-del-clan-sena-que-estaba-profuga-tras-un-tiroteo-con-la-policia-de-chaco/","Detuvieron a “La Pistolera”, excustodia del clan Sena que estaba prófuga tras un tiroteo con la Policía","Se consultó el Titulo a la IA","https://encrypted-tbn0.gstatic.com/images?q=tbn:ANd9GcSpW_H2K7B3U3VkUwhzrEbl3rijX0RFpWeA9f1YRDKJ7O0kDKIyvDo0ztFVsBk&amp;s","Se consultó la Nota a la IA","Se consultó la Nota a la IA","Se consultó el Datos a la IA"
"08/31/2025 09:03:01","https://infobae.com/deportes/2025/08/18/sinner-se-retiro-de-la-final-de-cincinnati-cuando-perdia-5-0-la-desazon-del-italiano-y-el-gran-gesto-de-alcaraz/","Sinner se retiró de la final de Cincinnati cuando perdía 5-0: la desazón del italiano y el gran gesto de Alcaraz","Se consultó el Titulo a la IA","https://encrypted-tbn0.gstatic.com/images?q=tbn:ANd9GcTyAJROBLnGzGksp6lmqPQKpb8-LyrdvE2S82LIGGP5jSC85GCCgS7Vnda1JQ&amp;s","Se consultó la Nota a la IA","Se consultó la Nota a la IA","Se consultó el Datos a la IA"
"08/31/2025 09:03:01","https://infobae.com/america/mundo/2025/08/18/estados-unidos-pidio-a-israel-corresponder-al-plan-del-libano-para-desarmar-a-los-terroristas-de-hezbollah/","Estados Unidos pidió a Israel que respalde el plan del Líbano para desarmar a los terroristas de Hezbollah","Se consultó el Titulo a la IA","https://encrypted-tbn0.gstatic.com/images?q=tbn:ANd9GcSxASWwqvfHTYy2BOvHR693j4pe6DSSAbZ8xeeWN4mAU8r5smKc0fM1qXQD5u0&amp;s","Se consultó la Nota a la IA","Se consultó la Nota a la IA","Se consultó el Datos a la IA"
"08/31/2025 09:03:01","https://infobae.com/deportes/2025/08/18/por-que-alpine-podria-terminar-la-temporada-de-la-formula-1-como-la-peor-escuderia-con-mas-puntos-en-la-historia/","Alpine podría terminar la temporada de la F1 como la peor escudería con más puntos en la historia","Se consultó el Titulo a la IA","https://encrypted-tbn0.gstatic.com/images?q=tbn:ANd9GcRD3gkp-AJo3MA7n-TOOVydNhcja_jbd5pvoDsXGDXEnBCG-4zVucVis1vkJA&amp;s","Se consultó la Nota a la IA","Se consultó la Nota a la IA","Se consultó el Datos a la IA"
"08/31/2025 09:03:01","https://infobae.com/venezuela/2025/08/18/la-abogada-disidente-del-chavismo-maria-alejandra-diaz-aseguro-que-salio-de-venezuela-y-se-encuentra-en-colombia/","La abogada disidente María Alejandra Díaz aseguró que salió de Venezuela y se encuentra en Colombia","Se consultó el Titulo a la IA","https://encrypted-tbn0.gstatic.com/images?q=tbn:ANd9GcTKI_wXtOx91BTRSJ7VHfQ_720i2dwTcUV6NKwsFhefm1wOiEh8AcTzw7L1Hcs&amp;s","Se consultó la Nota a la IA","Se consultó la Nota a la IA","Se consultó el Datos a la IA"
"08/31/2025 09:03:01","https://infobae.com/america/mundo/2025/08/18/en-medio-de-la-mayor-iniciativa-para-conseguir-una-tregua-bombardeos-rusos-mataron-a-ocho-personas-en-ucrania/","En medio de la iniciativa para conseguir una tregua, bombardeos rusos mataron a ocho civiles ucranianos","Se consultó el Titulo a la IA","https://encrypted-tbn0.gstatic.com/images?q=tbn:ANd9GcS0F7TrXReTbR-5NuMh4NR3Ci71BwbbT0E_K7UWxUeivNQobLpHaT3TDMW3IA&amp;s","Se consultó la Nota a la IA","Se consultó la Nota a la IA","Se consultó el Datos a la IA"
"08/31/2025 09:03:01","https://infobae.com/sociedad/policiales/2025/08/24/un-jubilado-se-defendio-a-balazos-y-mato-al-ladron-que-entro-a-robar-a-su-casa-de-gonzalez-catan/","Un jubilado se defendió a balazos y mató al ladrón que entró a robar a su casa de González Catán","Se consultó el Titulo a la IA","https://encrypted-tbn0.gstatic.com/images?q=tbn:ANd9GcRGxSWtgC0mv4mXHuL-eesPlb2ztisCwuNeD694Tswva7KRDewIbMcJRpnVZeY&amp;s","Se consultó la Nota a la IA","Se consultó la Nota a la IA","Se consultó el Datos a la IA"
"08/31/2025 09:03:01","https://infobae.com/sociedad/policiales/2025/08/17/santiago-del-estero-secuestraron-25-kilos-de-milanesas-hechas-con-papel-higienico/","Santiago del Estero: secuestraron 25 kilos de milanesas hechas con papel higiénico","Se consultó el Titulo a la IA","https://encrypted-tbn0.gstatic.com/images?q=tbn:ANd9GcTgS4SuKAe8PP4ZXUiqhhw00nACmI1rUNXE9etcLtMEdULp6_PNx33qCu2bTw&amp;s","Se consultó la Nota a la IA","Se consultó la Nota a la IA","Se consultó el Datos a la IA"
"08/31/2025 09:03:01","https://infobae.com/deportes/2025/08/18/xabi-alonso-lleno-de-elogios-a-mastantuono-y-anticipo-que-podria-jugar-en-el-debut-del-real-madrid-tiene-espiritu-argentino/","Xabi Alonso llenó de elogios a Mastantuono y anticipó que podría jugar en el debut del Real Madrid: “Tiene espíritu argentino”","Se consultó el Titulo a la IA","https://encrypted-tbn0.gstatic.com/images?q=tbn:ANd9GcTwB7Av7BxA9hAFO2hdm3Vwc2VfrdnlA5tr90AALnok7xNPazgW5WQEhzeK0w&amp;s","Se consultó la Nota a la IA","Se consultó la Nota a la IA","Se consultó el Datos a la IA"
"08/31/2025 09:03:01","https://infobae.com/politica/2025/08/24/el-jefe-de-los-copitos-le-pidio-disculpas-a-cfk-y-aseguro-que-sabag-montiel-intento-matarla-para-impresionar-a-su-novia/","El jefe de “Los Copitos” le pidió disculpas a CFK y aseguró que Sabag Montiel intentó matarla para “impresionar a su novia”","Se consultó el Titulo a la IA","https://encrypted-tbn0.gstatic.com/images?q=tbn:ANd9GcSf4NrVKZKQqtQTJuAH3rqIkN5gWoMFYUMdq1rjY2GRlRS_bPPKDBwDeSc1Zw&amp;s","Se consultó la Nota a la IA","Se consultó la Nota a la IA","Se consultó el Datos a la IA"
"08/31/2025 09:03:01","https://infobae.com/judiciales/2025/08/24/cristina-kirchner-le-pedira-a-la-corte-suprema-que-le-quite-la-tobillera-y-flexibilice-el-regimen-de-visitas/","Cristina Kirchner le pedirá a la Corte Suprema que le quite la tobillera y flexibilice el régimen de visitas","Se consultó el Titulo a la IA","https://encrypted-tbn0.gstatic.com/images?q=tbn:ANd9GcR6exvQY2clgqTzApo8YAPYM6KuMOckcQNATnkTAY9WL_Jv49bUYD2cEPpk8w&amp;s","Se consultó la Nota a la IA","Se consultó la Nota a la IA","Se consultó el Datos a la IA"
"08/31/2025 09:03:01","https://infobae.com/inhouse/2025/08/28/media-maraton-de-buenos-aires-los-testimonios-de-la-carrera-mas-convocante-de-latinoamerica/","Media Maratón de Buenos Aires: los testimonios de la carrera más convocante de Latinoamérica","Se consultó el Titulo a la IA","https://encrypted-tbn0.gstatic.com/images?q=tbn:ANd9GcR8cBzi1AjLUmaHJE8dKd6coi8TQyTsPyTZxNF64oFuzthKZrxzeTDz2P5pyQ&amp;s","Se consultó la Nota a la IA","Se consultó la Nota a la IA","Se consultó el Datos a la IA"
"08/31/2025 09:03:01","https://infobae.com/movant/2025/08/22/nuevos-operadores-y-rutas-aereas-amplian-la-capacidad-logistica-en-argentina/","Nuevos operadores y rutas aéreas amplían la capacidad logística en Argentina","Se consultó el Titulo a la IA","https://encrypted-tbn0.gstatic.com/images?q=tbn:ANd9GcQBpbasJJnzYJteBr2PCu3yqP2i51sqpi1V6k1W3AWkSdUcOJDaGn5my6TZWQ&amp;s","Se consultó la Nota a la IA","Se consultó la Nota a la IA","Se consultó el Datos a la IA"
"08/31/2025 09:03:01","https://infobae.com/revista-chacra/2025/08/22/que-dejo-la-tormenta-en-el-area-agricola/","¿Qué dejó la tormenta en el área agrícola?","Se consultó el Titulo a la IA","https://encrypted-tbn0.gstatic.com/images?q=tbn:ANd9GcTpz6IB8SMNvcBiOh286cz11j_9CF3IpDh3a9mQjZzXSFY2g9F_BZsfFJJ_sw&amp;s","Se consultó la Nota a la IA","Se consultó la Nota a la IA","Se consultó el Datos a la IA"
"08/31/2025 09:03:01","https://infobae.com/deportes/2025/08/23/los-mejores-memes-de-la-victoria-de-rosario-central-ante-newells-con-el-golazo-de-di-maria-en-el-foco/","Los mejores memes de la victoria de Rosario Central ante Newell’s con el golazo de Di María en el foco","Se consultó el Titulo a la IA","https://encrypted-tbn0.gstatic.com/images?q=tbn:ANd9GcSlOWCDHXdHEh5KKlu3ieAKiDdvuevILVV2jy1Opkoo3Ia84f2hxo-dwr1pdus&amp;s","Se consultó la Nota a la IA","Se consultó la Nota a la IA","Se consultó el Datos a la IA"
"08/31/2025 09:03:01","https://infobae.com/revista-chacra/2025/08/21/asi-esta-el-mercado-global-de-la-carne-vacuna/","Así está el mercado global de la carne vacuna","Se consultó el Titulo a la IA","https://encrypted-tbn0.gstatic.com/images?q=tbn:ANd9GcRmj_7SbpPdzhoVKs4MShrwJuSNl8HBObmokoyCTvJRhamA5f3aTjUn3OkE9Q&amp;s","Se consultó la Nota a la IA","Se consultó la Nota a la IA","Se consultó el Datos a la IA"
"08/31/2025 09:03:01","https://infobae.com/cultura/2025/08/24/un-certamen-reune-arte-y-arquitectura-con-16-mil-dolares-en-premios/","Un certamen reúne arte y arquitectura con 16 mil dólares en premios","Se consultó el Titulo a la IA","https://encrypted-tbn0.gstatic.com/images?q=tbn:ANd9GcS9rBLMv1e4tJu6rl-MtunYAKRLDobhcZD6yOCUtU_VM_OOttZohUvx_Sd-DA&amp;s","Se consultó la Nota a la IA","Se consultó la Nota a la IA","Se consultó el Datos a la IA"
"08/31/2025 09:03:01","https://infobae.com/revista-chacra/2025/08/22/del-sueldo-al-plato/","Del sueldo al plato","Se consultó el Titulo a la IA","https://encrypted-tbn0.gstatic.com/images?q=tbn:ANd9GcTNQFz3OQCZun2_965DLBGRrIitJWqtspRiXn5kWHIFedrrUk5sI2Y0XfDnEA&amp;s","Se consultó la Nota a la IA","Se consultó la Nota a la IA","Se consultó el Datos a la IA"
"08/31/2025 09:03:01","https://infobae.com/deportes/2025/08/27/con-la-vuelta-de-una-figura-y-sus-titulares-la-lista-de-citados-de-river-para-el-duelo-ante-union-y-la-posible-formacion/","Con la vuelta de una figura: la lista de citados de River para el duelo ante Unión y la posible formación","Se consultó el Titulo a la IA","https://encrypted-tbn0.gstatic.com/images?q=tbn:ANd9GcT9e2ldfVc6nmmZ7UK0kf1crfxKMkY2U40akver5ybSVJNfzTT832OwM70htw&amp;s","Se consultó la Nota a la IA","Se consultó la Nota a la IA","Se consultó el Datos a la IA"
"08/31/2025 09:03:01","https://infobae.com/america/medio-ambiente/2025/08/28/el-impacto-del-cambio-climatico-en-aves-tropicales-como-el-calor-extremo-reduce-sus-poblaciones/","El impacto del cambio climático en aves tropicales: cómo el calor extremo reduce sus poblaciones","Se consultó el Titulo a la IA","https://encrypted-tbn0.gstatic.com/images?q=tbn:ANd9GcSx4TS8fCddOua1VMvDjUgsRCgq5UNDUqoJUr9lNYsckf-yL8vfmIRaRaczozI&amp;s","Se consultó la Nota a la IA","Se consultó la Nota a la IA","Se consultó el Datos a la IA"
"08/31/2025 09:03:01","https://infobae.com/america/ciencia-america/2025/08/28/flamencos-migratorios-envejecen-mas-lento-que-los-residentes/","Los flamencos migratorios envejecen más lento que los residentes","Se consultó el Titulo a la IA","https://encrypted-tbn0.gstatic.com/images?q=tbn:ANd9GcSp5drcugPQX4m-jKdIBxMWa7bcIpyW8VBICgzQo2T4wZ2Om7erqC7gf_lwXA&amp;s","Se consultó la Nota a la IA","Se consultó la Nota a la IA","Se consultó el Datos a la IA"
"08/31/2025 09:03:01","https://infobae.com/inhouse/2025/08/28/triple-impacto-la-estrategia-que-llevo-a-una-productora-de-aceros-en-santa-fe-a-convertirse-en-empresa-b/","Triple impacto: la estrategia que llevó a una productora de aceros en Santa Fe a convertirse en Empresa B","Se consultó el Titulo a la IA","https://encrypted-tbn0.gstatic.com/images?q=tbn:ANd9GcTkhYs4gdiVbk49fNlhuEmpMBIAw5QhyQsLP962UekoH-rGpbISL-j75SNHTg&amp;s","Se consultó la Nota a la IA","Se consultó la Nota a la IA","Se consultó el Datos a la IA"
"08/31/2025 09:03:01","https://infobae.com/inhouse/2025/08/28/que-hay-detras-de-la-creciente-adopcion-de-modelos-electricos-e-hibridos-en-el-mercado-local/","Qué hay detrás de la creciente adopción de modelos eléctricos e híbridos en el mercado local","Se consultó el Titulo a la IA","https://encrypted-tbn0.gstatic.com/images?q=tbn:ANd9GcQhWCsN7_chdnLjEcppBRQVQUaSuya_XLOADHt2oo5teMi5XljY4OWdrF75vyY&amp;s","Se consultó la Nota a la IA","Se consultó la Nota a la IA","Se consultó el Datos a la IA"
"08/31/2025 09:03:01","https://infobae.com/deportes/2025/08/27/recrudece-la-crisis-en-san-lorenzo-otros-dos-directivos-presentaron-la-renuncia/","Recrudece la crisis en San Lorenzo: otros dos directivos presentaron la renuncia","Se consultó el Titulo a la IA","https://encrypted-tbn0.gstatic.com/images?q=tbn:ANd9GcSfMaNJpt4TsMo_W6P6-WesdmQqWLkYq8VqCvyHevfSB01gJhdl-n5sysQzRyA&amp;s","Se consultó la Nota a la IA","Se consultó la Nota a la IA","Se consultó el Datos a la IA"
"08/31/2025 09:03:01","https://infobae.com/inhouse/2025/08/28/cinco-torres-frente-al-rio-lujan-asi-sera-el-nuevo-desarrollo-residencial-en-nordelta/","Cinco torres frente al Río Luján: así será el nuevo desarrollo residencial en Nordelta","Se consultó el Titulo a la IA","https://encrypted-tbn0.gstatic.com/images?q=tbn:ANd9GcQf6BZdbFJL-B2iu3zDHw8cXzDgM3qrRpCHqwyPMVdg6PBVHCEJInc6YcxpmaU&amp;s","Se consultó la Nota a la IA","Se consultó la Nota a la IA","Se consultó el Datos a la IA"
"08/31/2025 09:03:01","https://infobae.com/inhouse/2025/08/28/el-norte-y-el-sur-de-italia-juntos-en-una-hamburguesa-que-une-tradicion-y-sabor/","El norte y el sur de Italia, juntos en una hamburguesa que une tradición y sabor","Se consultó el Titulo a la IA","https://encrypted-tbn0.gstatic.com/images?q=tbn:ANd9GcQMO-S1dFIYgodKsFSHF9dsvpx1TNRj5_2LjQAyUpVoIIXDBXQxoHFRB8rx6jc&amp;s","Se consultó la Nota a la IA","Se consultó la Nota a la IA","Se consultó el Datos a la IA"
"08/31/2025 09:03:01","https://infobae.com/inhouse/2025/08/28/el-espacio-personal-de-juli-poggio-entre-la-conectividad-la-moda-y-la-busqueda-de-autenticidad/","El espacio personal de Juli Poggio: entre la conectividad, la moda y la búsqueda de autenticidad","Se consultó el Titulo a la IA","https://encrypted-tbn0.gstatic.com/images?q=tbn:ANd9GcQIsggJWYFqUrB397byFYMjJROnj6kfwzckP0jwhbTkW3YjQCCLjs5jvmZEUA&amp;s","Se consultó la Nota a la IA","Se consultó la Nota a la IA","Se consultó el Datos a la IA"
"08/31/2025 09:03:01","https://infobae.com/tendencias/2025/08/28/por-que-hacer-la-cama-tras-despertar-puede-ser-un-riesgo-para-la-salud-segun-expertos/","Por qué hacer la cama tras despertar puede ser un riesgo para la salud, según expertos","Se consultó el Titulo a la IA","https://encrypted-tbn0.gstatic.com/images?q=tbn:ANd9GcSvwjHZLzbxfXH9ocL93ZIIp3_trBZJPlR5qPJkoXBdHPWdeI6NlYHX5iluFYY&amp;s","Se consultó la Nota a la IA","Se consultó la Nota a la IA","Se consultó el Datos a la IA"
"08/31/2025 09:03:01","https://infobae.com/sociedad/policiales/2025/08/28/miradas-desafiantes-y-cambio-de-look-lo-que-dejo-la-primera-jornada-del-juicio-por-el-crimen-de-leon-aquino-en-berazategui/","Miradas desafiantes y cambio de look: lo que dejó la primera jornada del juicio por el crimen de León Aquino en Berazategui","Se consultó el Titulo a la IA","https://encrypted-tbn0.gstatic.com/images?q=tbn:ANd9GcTM4CiYHTEnwXjPKjOPBqu3iRP0BEvb0MDvi2P9JnzbTWdnz8sbn6E-Niv7Eg&amp;s","Se consultó la Nota a la IA","Se consultó la Nota a la IA","Se consultó el Datos a la IA"
"08/31/2025 09:03:01","https://infobae.com/politica/2025/08/28/comenzo-oficialmente-el-operativo-julio-argentino-roca-en-la-frontera-de-salta-tras-el-despliegue-de-los-militares/","Comenzó oficialmente el operativo &quot;Julio Argentino Roca&quot; en la frontera de Salta tras el despliegue de los militares","Se consultó el Titulo a la IA","https://encrypted-tbn0.gstatic.com/images?q=tbn:ANd9GcTaRRAZakVKAou1ooqEQHcuHP467NIgWtM0ii8nTnE4BF-G5mVjRr0zSyGboA&amp;s","Se consultó la Nota a la IA","Se consultó la Nota a la IA","Se consultó el Datos a la IA"
"08/31/2025 09:03:01","https://infobae.com/sociedad/policiales/2025/08/28/pidieron-llevar-a-juicio-al-hombre-en-situacion-de-calle-que-mato-a-golpes-a-un-comerciante-en-flores/","Pidieron llevar a juicio al hombre en situación de calle que mató a golpes a un comerciante en Flores","Se consultó el Titulo a la IA","https://encrypted-tbn0.gstatic.com/images?q=tbn:ANd9GcQ-TSRLeew5LcNoncUTibMCN4iljofrvz_7wRoe4Of65NpP2ISZxFhU2bR843w&amp;s","Se consultó la Nota a la IA","Se consultó la Nota a la IA","Se consultó el Datos a la IA"
"08/31/2025 09:03:01","https://infobae.com/revista-chacra/2025/08/26/proponen-un-esquema-de-vacunacion-antiaftosa-mas-ambicioso/","Proponen un esquema de vacunación antiaftosa “más ambicioso”","Se consultó el Titulo a la IA","https://encrypted-tbn0.gstatic.com/images?q=tbn:ANd9GcTpNwjL9WqcAd5tamxFW3ZtsVsFN6fVKwqfqzjnu_r6Ejg0U8472FZKS0uGng&amp;s","Se consultó la Nota a la IA","Se consultó la Nota a la IA","Se consultó el Datos a la IA"
"08/31/2025 09:03:01","https://infobae.com/sociedad/policiales/2025/08/28/atraparon-a-dibu-uno-de-los-10-delincuentes-mas-buscados-en-santa-fe/","Atraparon a &quot;Dibu&quot;, uno de los 10 delincuentes más buscados en Santa Fe","Se consultó el Titulo a la IA","https://encrypted-tbn0.gstatic.com/images?q=tbn:ANd9GcTCWz2CsD1JRwCQUlxEwnyMM7iNaqnND0NHwFLjzlTt3uR2iVdnp1cRD8a7jjE&amp;s","Se consultó la Nota a la IA","Se consultó la Nota a la IA","Se consultó el Datos a la IA"
"08/31/2025 09:03:01","https://infobae.com/deportes/2025/08/28/los-inesperados-dardos-de-esteban-ocon-contra-alpine-hoy-estoy-en-un-ambiente-sano/","Los inesperados dardos de Esteban Ocon contra Alpine: &quot;Hoy estoy en un ambiente sano&quot;","Se consultó el Titulo a la IA","https://encrypted-tbn0.gstatic.com/images?q=tbn:ANd9GcQWBIj2kUXTaZZViGKKys9VtttdxCbzfrlHqGSUX6lpwPzgn68OiSwkwd4UDTg&amp;s","Se consultó la Nota a la IA","Se consultó la Nota a la IA","Se consultó el Datos a la IA"
"08/31/2025 09:03:01","https://infobae.com/sociedad/policiales/2025/08/28/mato-a-un-jubilado-para-robarle-un-televisor-y-fue-condenado-a-perpetua/","Mató a un jubilado para robarle un televisor y fue condenado a perpetua","Se consultó el Titulo a la IA","https://encrypted-tbn0.gstatic.com/images?q=tbn:ANd9GcQj7iWNcQ-HeOlrcBladWK5v1b9NsRJqBTqcBfQIJ4rirjh0jCpUBerAGQ1xQ&amp;s","Se consultó la Nota a la IA","Se consultó la Nota a la IA","Se consultó el Datos a la IA"
"08/31/2025 09:03:01","https://infobae.com/deportes/2025/08/28/las-perlitas-de-la-entrevista-mas-relajada-a-scaloni-el-cambio-radical-despues-de-qatar-y-el-accidente-que-sufrio-en-bicicleta/","Las perlitas de la entrevista más relajada a Scaloni: el cambio radical después de Qatar y el accidente en bicicleta","Se consultó el Titulo a la IA","https://encrypted-tbn0.gstatic.com/images?q=tbn:ANd9GcQpREha0LA4jWgBU88JNP0J3oc9JfKtBG_aulPQW-Lzd9J73YlViatCT6tYKg&amp;s","Se consultó la Nota a la IA","Se consultó la Nota a la IA","Se consultó el Datos a la IA"
"08/31/2025 09:03:01","https://infobae.com/movant/2025/08/26/un-plan-estrategico-para-que-la-patagonia-exporte-con-valor-agregado-desde-origen/","Un plan estratégico para que la Patagonia exporte con valor agregado desde origen","Se consultó el Titulo a la IA","https://encrypted-tbn0.gstatic.com/images?q=tbn:ANd9GcS2UhB6cKH5LbmUNHecaMw9I4RCaDVEPNl7Oo67FqXYjkiLk0YBACLtD-2-Ww&amp;s","Se consultó la Nota a la IA","Se consultó la Nota a la IA","Se consultó el Datos a la IA"
"08/31/2025 09:03:01","https://infobae.com/movant/2025/08/26/san-juan-reunio-a-referentes-para-impulsar-la-logistica-en-mineria-y-comercio-exterior/","San Juan reunió a referentes para impulsar la logística en minería y comercio exterior","Se consultó el Titulo a la IA","https://encrypted-tbn0.gstatic.com/images?q=tbn:ANd9GcTbAh5QJH0gjeJHL43xBMrf2wy6FWqM922CuvJ8X28zS04JcpuGPHQFVxVr5A&amp;s","Se consultó la Nota a la IA","Se consultó la Nota a la IA","Se consultó el Datos a la IA"
"08/31/2025 09:03:01","https://infobae.com/movant/2025/08/25/europa-suspende-envios-de-paqueteria-a-eeuu-por-el-fin-de-la-exencion-aduanera/","Europa suspende envíos de paquetería a EEUU por el fin de la exención aduanera","Se consultó el Titulo a la IA","https://encrypted-tbn0.gstatic.com/images?q=tbn:ANd9GcSrLZxMhtfZlvO4eKom-nzzYyYX4Jwg63llM0EjPyx15FZzRYCACPWNNENPxOk&amp;s","Se consultó la Nota a la IA","Se consultó la Nota a la IA","Se consultó el Datos a la IA"
"08/31/2025 09:03:01","https://infobae.com/revista-chacra/2025/08/27/mas-problemas-para-las-carnes-no-naturales/","Más problemas para las carnes no naturales","Se consultó el Titulo a la IA","https://encrypted-tbn0.gstatic.com/images?q=tbn:ANd9GcSgg9eQ8ME4lKHnw2HwUPmcOlarU8ABo-EzY6xDfESQ7uVNTjKNXAeOqymAW1Q&amp;s","Se consultó la Nota a la IA","Se consultó la Nota a la IA","Se consultó el Datos a la IA"
"08/31/2025 09:03:01","https://infobae.com/revista-chacra/2025/08/26/la-justicia-le-devuelve-la-autarquia-al-inta/","La justicia le devuelve la autarquía al INTA","Se consultó el Titulo a la IA","https://encrypted-tbn0.gstatic.com/images?q=tbn:ANd9GcQsOvbwK3Yj2y_35CamzJcgz1_T98r7XRF23euWaWywHMIWrS2BjYDYRfO6TQ&amp;s","Se consultó la Nota a la IA","Se consultó la Nota a la IA","Se consultó el Datos a la IA"