"FechayHora","LinkOrigen","TituloOrigen","Titulo","Imagen","Intro","Noticia","Datos"
"09/09/2025 18:15:06","https://infobae.com/america/mundo/2025/09/09/israel-ordeno-la-evacuacion-total-de-ciudad-de-gaza-ante-una-inminente-operacion-terrestre-actuaremos-con-contundencia/","Israel ordenó la evacuación total de Ciudad de Gaza ante una inminente operación terrestre: “Actuaremos con contundencia”","Israel ordenó evacuación total de Ciudad de Gaza ante inminente operación terrestre: ""Actuaremos con contundencia""","https://encrypted-tbn0.gstatic.com/images?q=tbn:ANd9GcSmXme7iqZ6XAE4YTguZocNU06cTTP88axIYmW4InOHA0jLd686KBr6BV9-8dM&amp;s","Israel ordenó la evacuación total de la ciudad de Gaza ante una inminente operación terrestre. Las fuerzas israelíes advirtieron sobre la necesidad de evacuar la zona para actuar con contundencia. Aún no se han dado detalles sobre cuándo comenzará la operación terrestre.","Israel ordenó la evacuación total de la ciudad de Gaza ante una inminente operación terrestre. Las fuerzas israelíes advirtieron sobre la necesidad de evacuar la zona para actuar con contundencia. Aún no se han dado detalles sobre cuándo comenzará la operación terrestre.",
"09/09/2025 18:15:09","https://infobae.com/america/mundo/2025/09/09/la-onu-y-el-papa-leon-xiv-condenaron-el-ataque-de-israel-en-doha-una-flagrante-violacion-de-la-soberania-qatari/","Condena internacional tras el ataque de Israel en Doha: “Es una flagrante violación de la soberanía qatarí”","La ONU y el Papa León XIV condenaron el ataque de Israel en Doha, una flagrante violación de la soberanía qatarí.","https://encrypted-tbn0.gstatic.com/images?q=tbn:ANd9GcTxYI1zQcq2wfkx_mfGFl0BDmSR8K-___U548QkYqGRWU9uATzKnuI6p1f_Buc&amp;s","En una reciente noticia, la ONU y el Papa León XIV condenaron el ataque de Israel en Doha, calificándolo como una flagrante violación de la soberanía qatarí. La acción militar de Israel fue duramente criticada por ambas entidades, quienes exigieron el respeto a la soberanía de Qatar y llamaron a la comunidad internacional a tomar medidas al respecto.","En una reciente noticia, la ONU y el Papa León XIV condenaron el ataque de Israel en Doha, calificándolo como una flagrante violación de la soberanía qatarí. La acción militar de Israel fue duramente criticada por ambas entidades, quienes exigieron el respeto a la soberanía de Qatar y llamaron a la comunidad internacional a tomar medidas al respecto.",
"09/09/2025 18:15:12","https://infobae.com/america/mundo/2025/09/09/netanyahu-hablo-sobre-el-ataque-a-los-negociadores-de-hamas-israel-lo-inicio-lo-ejecuto-y-asume-toda-la-responsabilidad/","Netanyahu habló sobre el ataque a los negociadores de Hamas: “Israel lo inició, lo ejecutó y asume toda la responsabilidad”","Netanyahu habló sobre el ataque a los negociadores de Hamas: ""Israel lo inició, lo ejecutó y asume toda la responsabilidad""","https://encrypted-tbn0.gstatic.com/images?q=tbn:ANd9GcSp24wkGgmcNNQoR7lWX5wcrm4zdSa-JwC6rInsbQs1kwg7LhIN6oLy9-fVUQ&amp;s","En una entrevista, el primer ministro de Israel, Benjamin Netanyahu, afirmó que su país es responsable del ataque a los negociadores de Hamas en Gaza. Netanyahu declaró que Israel inició y ejecutó la operación, asumiendo así toda la responsabilidad por el incidente.","En una entrevista, el primer ministro de Israel, Benjamin Netanyahu, afirmó que su país es responsable del ataque a los negociadores de Hamas en Gaza. Netanyahu declaró que Israel inició y ejecutó la operación, asumiendo así toda la responsabilidad por el incidente.",
"09/09/2025 18:15:15","https://infobae.com/america/america-latina/2025/09/09/la-lider-de-las-damas-de-blanco-denuncio-que-un-operativo-policial-sitio-su-vivienda-en-la-habana/","La líder de las Damas de Blanco denunció que un operativo policial sitió su vivienda en La Habana","La líder de las Damas de Blanco denunció que un operativo policial sitió su vivienda en La Habana","https://encrypted-tbn0.gstatic.com/images?q=tbn:ANd9GcR7ZWW9HtkWJh0C-nPf-8APnUQJyhKZ0a-0Tkq65515oWxIKDc2b5fuh-LCU34&amp;s","La líder de las Damas de Blanco denunció que un operativo policial sitió su vivienda en La Habana. La activista dijo que este hecho representa un acto de acoso por parte del gobierno cubano hacia su grupo, el cual defiende los derechos humanos en la isla. Los vecinos también denunciaron la presencia de agentes de seguridad en la zona.","La líder de las Damas de Blanco denunció que un operativo policial sitió su vivienda en La Habana. La activista dijo que este hecho representa un acto de acoso por parte del gobierno cubano hacia su grupo, el cual defiende los derechos humanos en la isla. Los vecinos también denunciaron la presencia de agentes de seguridad en la zona.",
"09/09/2025 18:15:19","https://infobae.com/deportes/2025/09/09/bolivia-debera-ganarle-a-brasil-y-esperar-el-resultado-de-venezuela-para-llegar-al-repechaje-en-las-eliminatorias-hora-tv-y-formaciones/","Bolivia deberá ganarle a Brasil y esperar el resultado de Venezuela","Bolivia deberá ganarle a Brasil y esperar el resultado de Venezuela para llegar al repechaje en las Eliminatorias: hora, TV y formaciones.","https://encrypted-tbn0.gstatic.com/images?q=tbn:ANd9GcT6pWvMsNxGxaeD5JmdbFwo0gOF6UNfR72Yue9cbj0IUbnX8HykMoYVc_SIOw&amp;s","Bolivia enfrentará a Brasil en un partido crucial para sus aspiraciones de llegar al repechaje en las eliminatorias. Para lograrlo, deberá ganarle a Brasil y esperar el resultado del partido de Venezuela. El encuentro se llevará a cabo en horario a definir, y las formaciones de ambos equipos estarán en juego.","Bolivia enfrentará a Brasil en un partido crucial para sus aspiraciones de llegar al repechaje en las eliminatorias. Para lograrlo, deberá ganarle a Brasil y esperar el resultado del partido de Venezuela. El encuentro se llevará a cabo en horario a definir, y las formaciones de ambos equipos estarán en juego.",
"09/09/2025 18:15:22","https://infobae.com/deportes/2025/09/09/siete-nombres-para-tres-butacas-la-pelea-en-red-bull-que-mantendra-abierto-el-mapa-de-pilotos-en-la-f1-para-2026/","Siete nombres para tres butacas: la pelea en Red Bull que mantendrá abierto el mapa de pilotos en la F1 para 2026","Siete nombres para tres butacas: la pelea en Red Bull que mantendrá abierto el mapa de pilotos en la F1 para 2026","https://encrypted-tbn0.gstatic.com/images?q=tbn:ANd9GcS-p-toIHTARyyba0wAJQAKoVl-D3v52lzs0KtUQxBTrQCsL59ObKrJLTfTaQ&amp;s","En la lucha por los tres asientos en Red Bull para la temporada de Fórmula 1 de 2026, se barajan siete nombres de pilotos. La competencia por los lugares en el equipo se mantiene abierta, lo cual generará un intenso debate sobre quiénes serán los elegidos para formar parte del equipo en el próximo año.","En la lucha por los tres asientos en Red Bull para la temporada de Fórmula 1 de 2026, se barajan siete nombres de pilotos. La competencia por los lugares en el equipo se mantiene abierta, lo cual generará un intenso debate sobre quiénes serán los elegidos para formar parte del equipo en el próximo año.",
"09/09/2025 18:15:24","https://infobae.com/america/mundo/2025/09/09/los-aliados-europeos-de-kiev-se-comprometieron-a-intensificar-su-apoyo-militar/","Los aliados europeos de Kiev se comprometieron a intensificar su apoyo militar","Los aliados europeos de Kiev se comprometieron a intensificar su apoyo militar","https://encrypted-tbn0.gstatic.com/images?q=tbn:ANd9GcR6TkZmytZWAgVM2RsCEpuIHO9PwQzguVaUKhRWzKAH78Njn3hpVGnD8U1v_w&amp;s","Los aliados europeos de Kiev se comprometieron a intensificar su apoyo militar. Esta decisión se tomó en una reunión donde se discutieron diversas cuestiones sobre la situación en Ucrania. Los líderes europeos manifestaron su apoyo a Ucrania y se comprometieron a fortalecer su colaboración militar con el país.","Los aliados europeos de Kiev se comprometieron a intensificar su apoyo militar. Esta decisión se tomó en una reunión donde se discutieron diversas cuestiones sobre la situación en Ucrania. Los líderes europeos manifestaron su apoyo a Ucrania y se comprometieron a fortalecer su colaboración militar con el país.",
"09/09/2025 18:15:27","https://infobae.com/america/america-latina/2025/09/09/denuncian-que-el-periodismo-nicaraguense-vive-entre-la-apatridia-y-la-carcel/","Denuncian que el periodismo nicaragüense vive entre la apatridia y la cárcel","Denuncian que el periodismo nicaragüense vive entre la apatridia y la cárcel","https://encrypted-tbn0.gstatic.com/images?q=tbn:ANd9GcTJLAgRQKwltWAvL8u-TG2ZyWbSJv7F2xIsbtGRk2wZLgS_CYKrtm8Q_7DwPw&amp;s","El periodismo en Nicaragua enfrenta una situación complicada, con periodistas viviendo entre la apatridia y la cárcel debido a la represión del gobierno. Muchos comunicadores han tenido que exiliarse para asegurar su seguridad, mientras que quienes permanecen en el país enfrentan constantes ataques y amenazas por parte de las autoridades. La libertad de prensa se ve fuertemente restringida en este contexto de crisis política en Nicaragua.","El periodismo en Nicaragua enfrenta una situación complicada, con periodistas viviendo entre la apatridia y la cárcel debido a la represión del gobierno. Muchos comunicadores han tenido que exiliarse para asegurar su seguridad, mientras que quienes permanecen en el país enfrentan constantes ataques y amenazas por parte de las autoridades. La libertad de prensa se ve fuertemente restringida en este contexto de crisis política en Nicaragua.",
"09/09/2025 18:15:30","https://infobae.com/america/america-latina/2025/09/09/alexandre-de-moraes-afirmo-que-jair-bolsonaro-lidero-un-complot-para-perpetuarse-en-el-poder/","Alexandre de Moraes afirmó que Jair Bolsonaro lideró un complot para “perpetuarse en el poder”","Alexandre de Moraes afirmó que Jair Bolsonaro lideró un complot para perpetuarse en el poder","https://encrypted-tbn0.gstatic.com/images?q=tbn:ANd9GcRjQXkSrZh89k53ZW87270dHc2RhwVb6Bh0eJN-m2UG3DeP6gLZUF7Z7tvgT9M&amp;s","En el artículo se menciona que Alexandre de Moraes, ministro del Supremo Tribunal Federal de Brasil, afirmó que Jair Bolsonaro lideró un complot para perpetuarse en el poder. De acuerdo con De Moraes, el presidente brasileño buscaba socavar la democracia a través de la difusión de noticias falsas y la deslegitimación de las instituciones democráticas. Esta declaración se dio en el marco de una investigación que apunta a determinar si Bolsonaro intentó interferir en el proceso electoral de 2022.","En el artículo se menciona que Alexandre de Moraes, ministro del Supremo Tribunal Federal de Brasil, afirmó que Jair Bolsonaro lideró un complot para perpetuarse en el poder. De acuerdo con De Moraes, el presidente brasileño buscaba socavar la democracia a través de la difusión de noticias falsas y la deslegitimación de las instituciones democráticas. Esta declaración se dio en el marco de una investigación que apunta a determinar si Bolsonaro intentó interferir en el proceso electoral de 2022.",
"09/09/2025 18:15:33","https://infobae.com/america/mundo/2025/09/09/el-reino-unido-descarta-un-rescate-financiero-del-fondo-monetario-internacional-tras-debate-en-el-parlamento/","El Reino Unido descarta un rescate financiero del Fondo Monetario Internacional tras debate en el Parlamento","El Reino Unido descarta un rescate financiero del FMI tras debate en el parlamento","https://encrypted-tbn0.gstatic.com/images?q=tbn:ANd9GcRk4f6_AJckhinqXk5TIBd27vWagpoLRFbNjX_KBvwM_pu-MfBMhDMZkbUjpw&amp;s","El Reino Unido descartó un rescate financiero por parte del Fondo Monetario Internacional luego de un debate en el Parlamento.","El Reino Unido descartó un rescate financiero por parte del Fondo Monetario Internacional luego de un debate en el Parlamento.",
"09/09/2025 18:15:35","https://infobae.com/deportes/2025/09/09/la-uruguay-de-marcelo-bielsa-visitara-a-chile-en-el-cierre-de-las-eliminatorias-hora-tv-y-formaciones/","La Uruguay de Bielsa visitará a Chile en el cierre de las Eliminatorias","La Uruguay de Marcelo Bielsa visitará a Chile en el cierre de las Eliminatorias: hora, TV y formaciones.","https://encrypted-tbn0.gstatic.com/images?q=tbn:ANd9GcRViIoF8Gya9j2BFRl0mAWTdGZp0fV86FQqlSu-t57B5hopsNs0aw8VDPTNf4A&amp;s","La selección de fútbol de Uruguay, dirigida por Marcelo Bielsa, se enfrentará a Chile en el cierre de las eliminatorias. El partido se jugará en Santiago y se podrá ver por televisión. Ambos equipos ya tienen definidas sus formaciones para el encuentro.","La selección de fútbol de Uruguay, dirigida por Marcelo Bielsa, se enfrentará a Chile en el cierre de las eliminatorias. El partido se jugará en Santiago y se podrá ver por televisión. Ambos equipos ya tienen definidas sus formaciones para el encuentro.",
"09/09/2025 18:15:35","https://infobae.com/america/mundo/2025/09/09/asi-se-inicio-el-incendio-en-la-flotilla-humanitaria-de-greta-thunberg-que-va-rumbo-a-gaza/","Así se inició el incendio en la flotilla humanitaria de Greta Thunberg que va rumbo a Gaza","Así se inició el incendio en la flotilla humanitaria de Greta Thunberg que va rumbo a Gaza","https://encrypted-tbn0.gstatic.com/images?q=tbn:ANd9GcRElNeYSmlko5rXhVrKGPvyMFdrAEVOhg1ljMLKarnJshqdvS2m8s3hxbx21L8&amp;s","La flotilla humanitaria liderada por Greta Thunberg que se dirigía hacia Gaza se vio afectada por un incendio que empezó en uno de los barcos. Afortunadamente, la tripulación logró controlar la situación y no hubo heridos. El incendio aparentemente fue causado por un desperfecto eléctrico.","La flotilla humanitaria liderada por Greta Thunberg que se dirigía hacia Gaza se vio afectada por un incendio que empezó en uno de los barcos. Afortunadamente, la tripulación logró controlar la situación y no hubo heridos. El incendio aparentemente fue causado por un desperfecto eléctrico.",""
"09/09/2025 18:15:35","https://infobae.com/revista-chacra/2025/09/07/el-bambu-busca-su-lugar-en-el-delta-bonaerense/","El bambú busca su lugar en el Delta bonaerense","El Bambú busca su lugar en el Delta bonaerense","https://encrypted-tbn0.gstatic.com/images?q=tbn:ANd9GcTOvpFxYZllUzPJFtbYdT63JsAg1JaOAZHKS-10rlhuTaOxZsFe1ZMrLPdpJdY&amp;s","El bambú está siendo estudiado como una alternativa prometedora para la producción en el Delta del Río Paraná, en la Provincia de Buenos Aires. Esta planta de rápido crecimiento podría ser utilizada para la reforestación de zonas degradadas y la generación de productos como papel, alimentos y bioconstrucción.","El bambú está siendo estudiado como una alternativa prometedora para la producción en el Delta del Río Paraná, en la Provincia de Buenos Aires. Esta planta de rápido crecimiento podría ser utilizada para la reforestación de zonas degradadas y la generación de productos como papel, alimentos y bioconstrucción.",""
"09/09/2025 18:15:35","https://infobae.com/venezuela/2025/09/09/una-investigacion-periodistica-revelo-que-boris-johnson-recibio-mas-de-300-mil-dolares-tras-reunirse-con-nicolas-maduro-en-2024/","Una investigación periodística reveló que Boris Johnson recibió más de 300 mil dólares tras reunirse con Nicolás Maduro en 2024","Investigación revela que Boris Johnson recibió más de 300 mil dólares tras reunirse con Nicolás Maduro en 2024","https://encrypted-tbn0.gstatic.com/images?q=tbn:ANd9GcTeYHTEn5vWJoDwtQrrTJcXdmtFpMBbUQJ4puBeB6ZHB5sBAq5qIBlZ9J0Nl80&amp;s","Según una investigación periodística, Boris Johnson recibió más de 300 mil dólares tras reunirse con Nicolás Maduro en 2024. El motivo de la reunión y los detalles de la transacción no han sido revelados en el informe.","Según una investigación periodística, Boris Johnson recibió más de 300 mil dólares tras reunirse con Nicolás Maduro en 2024. El motivo de la reunión y los detalles de la transacción no han sido revelados en el informe.",""
"09/09/2025 18:15:35","https://infobae.com/economia/2025/09/09/quienes-son-los-bonaerenses-que-pagaran-retenciones-de-ingresos-brutos-por-sus-movimientos-con-billeteras-digitales/","Quiénes pagarán retenciones de Ingresos Brutos por movimientos con billeteras digitales en PBA","Quienes son los bonaerenses que pagarán retenciones de ingresos brutos por sus movimientos con billeteras digitales","https://encrypted-tbn0.gstatic.com/images?q=tbn:ANd9GcQw5UB_rkL8bIQCU3WE9Ncbl7Jvqxh4Fy9QcB7HKS4tRtXBgIEbDbMfkQJH_lE&amp;s","En la provincia de Buenos Aires, se implementará el cobro de retenciones de ingresos brutos a los usuarios de billeteras digitales que realicen movimientos financieros. Esta medida afectará a aquellos que superen determinados límites de operaciones mensuales, aunque se establecerá un tope máximo para no perjudicar a los pequeños contribuyentes. Esta iniciativa busca aumentar la recaudación de impuestos en la provincia.","En la provincia de Buenos Aires, se implementará el cobro de retenciones de ingresos brutos a los usuarios de billeteras digitales que realicen movimientos financieros. Esta medida afectará a aquellos que superen determinados límites de operaciones mensuales, aunque se establecerá un tope máximo para no perjudicar a los pequeños contribuyentes. Esta iniciativa busca aumentar la recaudación de impuestos en la provincia.",""
"09/09/2025 18:15:35","https://infobae.com/deportes/2025/09/09/el-nuevo-desafio-del-hijo-de-ronaldinho-tras-fichar-por-un-club-de-inglaterra-nunca-intente-ser-mi-padre/","El nuevo desafío del hijo de Ronaldinho tras fichar por un club de Inglaterra: &quot;Nunca intenté ser mi padre&quot;","El nuevo desafío del hijo de Ronaldinho tras fichar por un club de Inglaterra: ""Nunca intentes ser mi padre""","https://encrypted-tbn0.gstatic.com/images?q=tbn:ANd9GcRLyKYSFXinCo6cm5_2NHkX7u-EVghc73z-1fmnyNLW2WoiPsTnx5dYlYegjg&amp;s","El hijo de Ronaldinho asume un nuevo desafío al fichar por un club de Inglaterra. El joven jugador reconoce que nunca intentará ser como su padre, pero aspira a triunfar en su propia carrera futbolística. Ronaldinho apoya y alienta a su hijo en esta nueva etapa.","El hijo de Ronaldinho asume un nuevo desafío al fichar por un club de Inglaterra. El joven jugador reconoce que nunca intentará ser como su padre, pero aspira a triunfar en su propia carrera futbolística. Ronaldinho apoya y alienta a su hijo en esta nueva etapa.",""
"09/09/2025 18:15:35","https://infobae.com/america/mundo/2025/09/08/la-dimision-del-primer-ministro-ishiba-desato-una-carrera-por-la-sucesion-en-japon/","La dimisión del primer ministro Ishiba desató una carrera por la sucesión en Japón","Dimisión del primer ministro Ishiba desató una carrera por la sucesión en Japón","https://encrypted-tbn0.gstatic.com/images?q=tbn:ANd9GcRMG8mM6pscHrT5PIZk7XhmXsgWdKwi6Y1boefs1FWOKN3aTE5xdlZETGAPYA&amp;s","El primer ministro de Japón, Ishiba, presentó su renuncia, desencadenando una competencia por su sucesión. Diversos candidatos se postulan para ocupar el cargo, entre ellos el ministro de Finanzas Taro Aso y el ministro de Relaciones Exteriores Fumio Kishida. Se espera que la decisión final se tome en las próximas semanas.","El primer ministro de Japón, Ishiba, presentó su renuncia, desencadenando una competencia por su sucesión. Diversos candidatos se postulan para ocupar el cargo, entre ellos el ministro de Finanzas Taro Aso y el ministro de Relaciones Exteriores Fumio Kishida. Se espera que la decisión final se tome en las próximas semanas.",""
"09/09/2025 18:15:35","https://infobae.com/deportes/2025/09/08/la-dura-critica-del-jefe-de-mercedes-a-kimi-antonelli-por-sus-malos-resultados-en-la-f1-decepcionante/","La dura crítica del jefe de Mercedes a Kimi Antonelli por sus malos resultados en la F1: “Decepcionante”","La dura crítica del jefe de Mercedes a Kimi Antonelli por sus malos resultados en la F1 decepcionante","https://encrypted-tbn0.gstatic.com/images?q=tbn:ANd9GcQTWPuMs16Jw-EX_wTNhXvteW4NE75DiTkncJAiQiCSK8_u2gmUN2Rz6BLNeQ&amp;s","En el artículo se menciona que el jefe de Mercedes criticó a Kimi Antonelli por sus malos resultados en la F1, calificándolos como decepcionantes. El piloto no ha tenido un buen desempeño en la temporada y la crítica se basa en su falta de impulsividad y agresividad en las carreras.","En el artículo se menciona que el jefe de Mercedes criticó a Kimi Antonelli por sus malos resultados en la F1, calificándolos como decepcionantes. El piloto no ha tenido un buen desempeño en la temporada y la crítica se basa en su falta de impulsividad y agresividad en las carreras.",""
"09/09/2025 18:15:35","https://infobae.com/venezuela/2025/09/08/el-regimen-de-nicolas-de-maduro-anuncio-que-reforzara-la-presencia-militar-en-los-estados-caribenos-de-venezuela/","El régimen de Nicolás de Maduro anunció que reforzará la presencia militar en los estados caribeños de Venezuela","El régimen de Nicolás Maduro anunció que reforzará la presencia militar en los estados caribeños de Venezuela.","https://encrypted-tbn0.gstatic.com/images?q=tbn:ANd9GcQDlt2pkbUSXgnePHHfb8T5LbDPAsTEWcPbXbxVH5nkC_I-B-7P2Je46I1F1V8&amp;s","El régimen de Nicolás Maduro anunció que reforzará la presencia militar en los estados caribeños de Venezuela. Esta decisión busca aumentar la seguridad en la región debido a la presencia de grupos armados ilegales y el narcotráfico.","El régimen de Nicolás Maduro anunció que reforzará la presencia militar en los estados caribeños de Venezuela. Esta decisión busca aumentar la seguridad en la región debido a la presencia de grupos armados ilegales y el narcotráfico.",""
"09/09/2025 18:15:35","https://infobae.com/venezuela/2025/09/09/ex-mandatarios-iberoamericanos-alertaron-sobre-los-riesgos-para-maria-corina-machado-y-exigieron-garantias-a-su-integridad/","Ex mandatarios iberoamericanos alertaron sobre los riesgos para María Corina Machado y exigieron garantías a su integridad","Ex mandatarios iberoamericanos alertaron sobre los riesgos para María Corina Machado y exigieron garantías a su integridad","https://encrypted-tbn0.gstatic.com/images?q=tbn:ANd9GcQhc_u6WTi59gGLtpZuMScFLeUN3KjnO2BFnfu_FxNY9vLQOY1nryL5-j5m4w&amp;s","El artículo menciona que ex mandatarios iberoamericanos expresaron su preocupación por los riesgos que enfrenta María Corina Machado en Venezuela. Exigieron garantías para su integridad y manifestaron su apoyo a la líder opositora.","El artículo menciona que ex mandatarios iberoamericanos expresaron su preocupación por los riesgos que enfrenta María Corina Machado en Venezuela. Exigieron garantías para su integridad y manifestaron su apoyo a la líder opositora.",""
"09/09/2025 18:15:35","https://infobae.com/politica/2025/09/09/loris-zanatta-hay-muchos-argentinos-que-no-quieren-a-los-kirchneristas-pero-tampoco-quieren-que-la-respuesta-sea-el-milei-que-vimos-hasta-ahora/","Loris Zanatta: “Hay muchos argentinos que no quieren a los kirchneristas, pero tampoco quieren que la respuesta sea el Milei que vimos hasta ahora”","Loris Zanatta: ""Hay muchos argentinos que no quieren a los kirchneristas pero tampoco quieren que la respuesta sea el Milei que vimos hasta ahora""","https://encrypted-tbn0.gstatic.com/images?q=tbn:ANd9GcRgA883ORrPa9iBYK5VpO_LJ8lmVy2YIhrjH2LdWZK6J53ovxojzV5J-FGw1g&amp;s","En una entrevista, el politólogo Loris Zanatta expresó que hay una parte de la sociedad argentina que no simpatiza con el kirchnerismo pero tampoco apoya a figuras como Javier Milei. Se refirió a la necesidad de encontrar una alternativa política que pueda atraer a este sector de la población, sugiriendo que la polarización actual no es beneficiosa para el país.","En una entrevista, el politólogo Loris Zanatta expresó que hay una parte de la sociedad argentina que no simpatiza con el kirchnerismo pero tampoco apoya a figuras como Javier Milei. Se refirió a la necesidad de encontrar una alternativa política que pueda atraer a este sector de la población, sugiriendo que la polarización actual no es beneficiosa para el país.",""
"09/09/2025 18:15:35","https://infobae.com/politica/2025/09/08/santa-fe-entra-en-la-recta-final-para-aprobar-la-nueva-constitucion-que-modificaciones-se-hicieron-y-cuando-se-jura/","Santa Fe entra en la recta final para aprobar la nueva Constitución: modificaciones y cuándo se jura","Santa Fe entra en la recta final para aprobar la nueva constitución: ¿Qué modificaciones se hicieron y cuándo se jura?","https://encrypted-tbn0.gstatic.com/images?q=tbn:ANd9GcRgGUo08A4Jk8ZR-zWGHQKjw6x7sg7bq7hpupIGrXdc7hnm2jxzGdMYW0HnfTU&amp;s","En Santa Fe, se está por aprobar una nueva constitución provincial con modificaciones importantes. Entre los cambios se destaca la reforma en la composición de la Corte Suprema de Justicia, que ahora estará integrada por siete miembros en lugar de cinco. Además, se establece la obligatoriedad de contar con un mínimo de tres mujeres en dicho órgano. También se incluyen disposiciones relacionadas con la igualdad de género y la protección del medio ambiente. Se espera que la nueva constitución sea jurada en los próximos días.","En Santa Fe, se está por aprobar una nueva constitución provincial con modificaciones importantes. Entre los cambios se destaca la reforma en la composición de la Corte Suprema de Justicia, que ahora estará integrada por siete miembros en lugar de cinco. Además, se establece la obligatoriedad de contar con un mínimo de tres mujeres en dicho órgano. También se incluyen disposiciones relacionadas con la igualdad de género y la protección del medio ambiente. Se espera que la nueva constitución sea jurada en los próximos días.",""
