"FechayHora","LinkOrigen","TituloOrigen","Titulo","Imagen","Intro","Noticia","Datos"
"09/09/2025 18:15:35","https://infobae.com/politica/2025/09/08/quien-gano-en-mi-municipio-el-mapa-de-los-resultados-por-distrito-de-las-elecciones-buenos-aires-2025/","Quién ganó en mi municipio: el mapa del escrutinio distrito por distrito","Quién ganó en mi municipio: El mapa de los resultados por distrito de las elecciones Buenos Aires 2025","https://encrypted-tbn0.gstatic.com/images?q=tbn:ANd9GcSQaLflv7QvLsCu3yrGcbAzx6IIB7HOQ44cLphJndOJsGANZZ7lNh0i6fd0Siw&amp;s","En las elecciones en Buenos Aires del 2025, se publicó un mapa con los resultados por distrito, permitiendo a los ciudadanos conocer quién ganó en su municipio. Los datos revelan el desempeño de los diferentes partidos políticos en cada zona de la provincia.","En las elecciones en Buenos Aires del 2025, se publicó un mapa con los resultados por distrito, permitiendo a los ciudadanos conocer quién ganó en su municipio. Los datos revelan el desempeño de los diferentes partidos políticos en cada zona de la provincia.",""
"09/09/2025 18:15:35","https://infobae.com/economia/2025/09/09/iphone-17-air-en-pesos-cuando-llegara-a-la-argentina-y-cuanto-costara-el-nuevo-tanque-de-apple/","iPhone Air en pesos: cuándo llegará a la Argentina y cuánto costará el nuevo “tanque” de Apple","iPhone 17 Air en pesos: cuando llegará a la Argentina y cuanto costará el nuevo tanque de Apple","https://encrypted-tbn0.gstatic.com/images?q=tbn:ANd9GcT9k1PWLLQ8_1QT_Z542L2yTt0ZJ2RsOr17N5prL6bwaeSvRsnB7Yz7hrzZIQ&amp;s","El iPhone 17 Air de Apple pronto llegará a Argentina y se estima que costará alrededor de 250.000 pesos. Este nuevo modelo se destaca por su diseño delgado y ligero, así como por su potente rendimiento y tecnología avanzada. Se espera que esté disponible en el país en pocas semanas, brindando a los usuarios la oportunidad de disfrutar de lo último en telefonía móvil.","El iPhone 17 Air de Apple pronto llegará a Argentina y se estima que costará alrededor de 250.000 pesos. Este nuevo modelo se destaca por su diseño delgado y ligero, así como por su potente rendimiento y tecnología avanzada. Se espera que esté disponible en el país en pocas semanas, brindando a los usuarios la oportunidad de disfrutar de lo último en telefonía móvil.",""
"09/09/2025 18:15:35","https://infobae.com/deportes/2025/09/09/paraguay-se-enfrentara-a-peru-en-la-despedida-de-las-eliminatorias-hora-tv-y-formaciones/","Paraguay se enfrentará a Perú en la despedida de las Eliminatorias","Paraguay se enfrentará a Perú en la despedida de las eliminatorias: hora, TV y formaciones.","https://encrypted-tbn0.gstatic.com/images?q=tbn:ANd9GcQVhxJDmmEz8JK8zSkDcnt9lmw7FEBiVwqX2HIYJbgaW8EmB3W-yM0uuw5Vf4A&amp;s","Paraguay se enfrentará a Perú en la despedida de las eliminatorias. El encuentro se llevará a cabo el sábado a las 20:30 horas en el estadio Defensores del Chaco, y será transmitido por televisión. Ambos equipos buscarán cerrar su participación en las eliminatorias de la mejor manera posible.","Paraguay se enfrentará a Perú en la despedida de las eliminatorias. El encuentro se llevará a cabo el sábado a las 20:30 horas en el estadio Defensores del Chaco, y será transmitido por televisión. Ambos equipos buscarán cerrar su participación en las eliminatorias de la mejor manera posible.",""
"09/09/2025 18:15:35","https://infobae.com/deportes/2025/09/09/ganaban-la-final-con-su-gol-pero-perdio-el-control-y-pego-una-de-las-patadas-mas-descalificadoras-del-ano/","Ganaban la final con su gol, pero perdió el control y pegó una de las patadas descalificadoras del año","Ganaban la final con su gol pero perdió el control y pegó una de las patadas más descalificadoras del año","https://encrypted-tbn0.gstatic.com/images?q=tbn:ANd9GcSWKryp3MytWBi65Puq2JcMAhozqxA7vCZW_Haoc00V435uuMbSzEdiOx2-Dg&amp;s","En la final de un partido de fútbol, un jugador anotó un gol que los colocaba en ventaja, pero perdió el control de sus emociones y propinó una patada descalificadora a un rival. Esta acción generó la expulsión del jugador y fue catalogada como una de las acciones más violentas del año en dicho deporte.","En la final de un partido de fútbol, un jugador anotó un gol que los colocaba en ventaja, pero perdió el control de sus emociones y propinó una patada descalificadora a un rival. Esta acción generó la expulsión del jugador y fue catalogada como una de las acciones más violentas del año en dicho deporte.",""
"09/09/2025 18:15:35","https://infobae.com/revista-chacra/2025/09/05/proteger-lo-que-nos-identifica-arboles-nativos-y-sanidad-vegetal/","Proteger lo que nos identifica: árboles nativos y sanidad vegetal","Proteger lo que nos identifica: árboles nativos y sanidad vegetal","https://encrypted-tbn0.gstatic.com/images?q=tbn:ANd9GcQCr3eMyv0CXxA_r42HAMrPfJfCFzQ-eK6o-_EtXS3cxjUDOQtOhfJkAiFpVg&amp;s","En el artículo se destaca la importancia de proteger los árboles nativos y la sanidad vegetal como parte fundamental de nuestra identidad. Se enfatiza en la necesidad de conservar estas especies para mantener el equilibrio ecológico y prevenir la propagación de enfermedades que puedan afectar a la vegetación.","En el artículo se destaca la importancia de proteger los árboles nativos y la sanidad vegetal como parte fundamental de nuestra identidad. Se enfatiza en la necesidad de conservar estas especies para mantener el equilibrio ecológico y prevenir la propagación de enfermedades que puedan afectar a la vegetación.",""
"09/09/2025 18:15:35","https://infobae.com/judiciales/2025/09/09/la-justicia-autorizo-allanar-el-banco-bbva-en-la-causa-que-investiga-la-filtracion-de-un-reporte-secreto/","La Justicia autorizó a allanar el banco BBVA en la causa que investiga la filtración de un reporte secreto","La justicia autorizó allanar el Banco BBVA en la causa que investiga la filtración de un reporte secreto.","https://encrypted-tbn0.gstatic.com/images?q=tbn:ANd9GcTwuOXBU6flGmnXFE3-iF5gol8ACJmKXAOrZnkd5NkTY2PtdL8oAVAiKJdgww&amp;s","La Justicia autorizó el allanamiento al Banco BBVA en el marco de una causa que investiga la filtración de un informe secreto. El procedimiento se llevó a cabo en búsqueda de documentación relevante para esclarecer el hecho.","La Justicia autorizó el allanamiento al Banco BBVA en el marco de una causa que investiga la filtración de un informe secreto. El procedimiento se llevó a cabo en búsqueda de documentación relevante para esclarecer el hecho.",""
"09/09/2025 18:15:35","https://infobae.com/cultura/2025/09/09/revolucion-en-la-national-gallery-de-londres-por-primera-vez-incluira-arte-moderno/","Revolución en la National Gallery de Londres: por primera vez incluirá arte moderno","Revolucion en la National Gallery de Londres: por primera vez incluira arte moderno","https://encrypted-tbn0.gstatic.com/images?q=tbn:ANd9GcTAw9SmQAbWd78F7BQm39PC8n0Oxivnr4e_ZGTgIadQ_MfArTqWstMmM9oZVA&amp;s","La National Gallery de Londres realizará una revolución en su exposición, al incluir arte moderno por primera vez en su historia. Esta decisión busca atraer a un público más joven y diverso, mostrando obras de artistas contemporáneos junto a las tradicionales de grandes maestros. La iniciativa ha generado tanto críticas como elogios, pero el museo sigue adelante con su objetivo de expandir su colección y atraer a nuevas audiencias.","La National Gallery de Londres realizará una revolución en su exposición, al incluir arte moderno por primera vez en su historia. Esta decisión busca atraer a un público más joven y diverso, mostrando obras de artistas contemporáneos junto a las tradicionales de grandes maestros. La iniciativa ha generado tanto críticas como elogios, pero el museo sigue adelante con su objetivo de expandir su colección y atraer a nuevas audiencias.",""
"09/09/2025 18:15:35","https://infobae.com/america/mundo/2025/09/09/las-primeras-imagenes-del-precario-campamento-donde-tom-phillips-mantuvo-escondidos-a-sus-tres-hijos-durante-4-anos/","Las primeras imágenes del precario campamento donde Tom Phillips ocultó a sus tres hijos durante 4 años","Las primeras imágenes del precario campamento donde Tom Phillips mantuvo escondidos a sus tres hijos durante 4 años","https://encrypted-tbn0.gstatic.com/images?q=tbn:ANd9GcRWg3RL4zInp5UIfzXc8Pfrm351eUa6kALVdY-WRvdykv8RHdrPojzo4k3rSg&amp;s","","",""
"09/09/2025 18:15:35","https://infobae.com/america/mundo/2025/09/09/otra-amenaza-de-kim-jong-un-superviso-la-prueba-de-un-nuevo-motor-de-cohete-para-misiles-balisticos-intercontinentales/","Otra amenaza de Kim Jong-un: supervisó la prueba de un nuevo motor de cohete para misiles balísticos intercontinentales","Otra amenaza de Kim Jong Un: Supervisó la prueba de un nuevo motor de cohete para misiles balísticos intercontinentales","https://encrypted-tbn0.gstatic.com/images?q=tbn:ANd9GcRFioI0WeGJiD7Yysre8Z3XpkzFGlUu6zZjg_rq-jxx8b4RaT53oCvJNakYx8Y&amp;s","El líder norcoreano Kim Jong-un supervisó la prueba de un nuevo motor de cohete para misiles balísticos intercontinentales, lo que representa una nueva amenaza para la comunidad internacional. El test fue realizado en medio de las tensiones por el programa nuclear de Corea del Norte y las negativas a las propuestas de diálogo por parte de Estados Unidos.","El líder norcoreano Kim Jong-un supervisó la prueba de un nuevo motor de cohete para misiles balísticos intercontinentales, lo que representa una nueva amenaza para la comunidad internacional. El test fue realizado en medio de las tensiones por el programa nuclear de Corea del Norte y las negativas a las propuestas de diálogo por parte de Estados Unidos.",""
"09/09/2025 18:15:35","https://infobae.com/america/america-latina/2025/09/09/el-supremo-de-brasil-inicia-la-votacion-que-definira-el-futuro-de-bolsonaro-en-el-juicio-por-intento-de-golpe-de-estado/","El Supremo de Brasil inicia la votación que definirá el futuro de Bolsonaro en el juicio por intento de golpe de Estado","El Supremo de Brasil inicia la votación que definirá el futuro de Bolsonaro en el juicio por intento de golpe de estado","https://encrypted-tbn0.gstatic.com/images?q=tbn:ANd9GcQZjVUYYs0xYPJTPz_JfFGDIgDYHlEIUto7DLtk9zicfaN-BaPzjL4NFXcAhfk&amp;s","El Supremo de Brasil inicia la votación que definirá el futuro de Bolsonaro en el juicio por intento de golpe de estado.","El Supremo de Brasil inicia la votación que definirá el futuro de Bolsonaro en el juicio por intento de golpe de estado.",""
"09/09/2025 18:15:35","https://infobae.com/america/mundo/2025/09/09/impresionante-aterrizaje-de-emergencia-en-un-paraiso-del-caribe-habia-164-personas-a-bordo/","Impresionante aterrizaje de emergencia en un paraíso del Caribe: había 164 personas a bordo","Impresionante aterrizaje de emergencia en un paraíso del Caribe: había 164 personas a bordo","https://encrypted-tbn0.gstatic.com/images?q=tbn:ANd9GcSbMag_DERf6yFFLMFPAg29BsfaxygmiqsH2jRPTqUUmxiWl1thzGYN_rUrFH4&amp;s","En un vuelo con 164 personas a bordo que se dirigía hacia el Caribe, se vivió un aterrizaje de emergencia. El avión logró aterrizar exitosamente en la isla de San Martín a pesar de presentar problemas en uno de sus motores. Afortunadamente, no se reportaron heridos graves entre los pasajeros y la tripulación.","En un vuelo con 164 personas a bordo que se dirigía hacia el Caribe, se vivió un aterrizaje de emergencia. El avión logró aterrizar exitosamente en la isla de San Martín a pesar de presentar problemas en uno de sus motores. Afortunadamente, no se reportaron heridos graves entre los pasajeros y la tripulación.",""
"09/09/2025 18:15:35","https://infobae.com/america/mundo/2025/09/09/qatar-condeno-el-ataque-contra-los-negociadores-de-hamas-en-doha-no-se-tolerara-esta-conducta-imprudente-de-israel/","Qatar condenó el ataque contra los negociadores de Hamas en Doha: “No se tolerará esta conducta imprudente de Israel”","Qatar condenó el ataque contra los negociadores de Hamas en Doha: ""No se tolerará esta conducta imprudente de Israel""","https://encrypted-tbn0.gstatic.com/images?q=tbn:ANd9GcSgFRPmRX1k1GTZqHgt7IDS2lyh3bmbhGdimODDpis8u6t2c-ZhgezIvxjpgJo&amp;s","Qatar condenó el ataque contra los negociadores de Hamas en Doha y aseguró que no tolerará esa conducta imprudente de Israel. La declaración se da luego de que un avión militar israelí interceptara un vuelo comercial que trasladaba a los representantes de Hamas a Qatar para conversaciones de paz.","Qatar condenó el ataque contra los negociadores de Hamas en Doha y aseguró que no tolerará esa conducta imprudente de Israel. La declaración se da luego de que un avión militar israelí interceptara un vuelo comercial que trasladaba a los representantes de Hamas a Qatar para conversaciones de paz.",""
"09/09/2025 18:15:35","https://infobae.com/deportes/2025/09/09/impacto-en-brasil-por-la-tragica-muerte-de-un-reconocido-fisicoculturista-su-pareja-lo-habria-apunalado-tras-una-discusion/","Impacto en Brasil por la muerte de un reconocido fisicoculturista: acusan a su pareja de apuñalarlo","","https://encrypted-tbn0.gstatic.com/images?q=tbn:ANd9GcTRpqkM4u-IMbk7JUmyfsZsEIIZ__HqzjPxORAgJUOrYCQFv4Ri8dM5-TxikwA&amp;s","","",""
"09/09/2025 18:15:35","https://infobae.com/deportes/2025/09/09/una-fanatica-sufrio-una-terrible-golpiza-durante-un-partido-de-nfl-y-la-sacaron-del-estadio-con-el-rostro-ensangrentado-me-dejaron-aqui-sin-nada/","Una fanática sufrió una terrible golpiza durante un partido de NFL y la sacaron del estadio con el rostro ensangrentado","","https://encrypted-tbn0.gstatic.com/images?q=tbn:ANd9GcR56ObMNdI4svOjflSyvWGt-mDJ8bzpJSqMzjOzpRTMZ6T-hl0nD8XCG0F-XPU&amp;s","","",""
"09/09/2025 18:15:35","https://infobae.com/sociedad/policiales/2025/09/08/video-en-un-minuto-encapuchados-y-con-un-ariete-robaron-20-millones-a-una-estacion-de-servicio-de-mar-del-plata/","En un minuto, encapuchados y con un ariete, robaron $20 millones a una estación de servicio de Mar del Plata","","https://encrypted-tbn0.gstatic.com/images?q=tbn:ANd9GcT2G41qgarDhDKsyPnGEW-nkqo25COtQOFfAMWKhunenBvuyfxn01k0e5Qp08E&amp;s","Un grupo de encapuchados armados con un ariete robó 20 millones de pesos de una estación de servicio en Mar del Plata. Los delincuentes ingresaron al establecimiento, redujeron a los empleados y se llevaron el dinero en cuestión de minutos. La policía se encuentra investigando el caso y revisando las cámaras de seguridad para dar con los responsables del hecho.","Un grupo de encapuchados armados con un ariete robó 20 millones de pesos de una estación de servicio en Mar del Plata. Los delincuentes ingresaron al establecimiento, redujeron a los empleados y se llevaron el dinero en cuestión de minutos. La policía se encuentra investigando el caso y revisando las cámaras de seguridad para dar con los responsables del hecho.",""
"09/09/2025 18:15:35","https://infobae.com/revista-chacra/2025/09/08/el-negocio-del-feedlot-puede-volverse-insostenible/","El negocio del feedlot puede volverse insostenible","El negocio del feedlot puede volverse insostenible","https://encrypted-tbn0.gstatic.com/images?q=tbn:ANd9GcQGcHQSdMGcSV7PTzp003_2b5aMg3qp39FfMPwjUSZjDvmtNx7wtBjv2OnAXA&amp;s","La noticia habla sobre cómo el negocio del feedlot puede volverse insostenible debido al aumento de los costos de producción y la baja rentabilidad. Esto se debe a factores como el aumento en el precio del maíz y la soja, el aumento de los precios de los insumos y la competencia con otros países exportadores de carne. Esto genera preocupación en los productores de feedlot, quienes deben buscar estrategias para adaptarse a esta nueva realidad y mantener la rentabilidad de sus negocios.","La noticia habla sobre cómo el negocio del feedlot puede volverse insostenible debido al aumento de los costos de producción y la baja rentabilidad. Esto se debe a factores como el aumento en el precio del maíz y la soja, el aumento de los precios de los insumos y la competencia con otros países exportadores de carne. Esto genera preocupación en los productores de feedlot, quienes deben buscar estrategias para adaptarse a esta nueva realidad y mantener la rentabilidad de sus negocios.",""
"09/09/2025 18:15:35","https://infobae.com/america/mundo/2025/09/09/polonia-cerrara-la-frontera-con-bielorrusia-por-maniobras-militares-rusas-que-incluiran-simulacros-nucleares/","Polonia cerrará la frontera con Bielorrusia por maniobras militares rusas que incluirán simulacros nucleares","Polonia cerrará la frontera con Bielorrusia por maniobras militares rusas que incluirán simulacros nucleares","https://encrypted-tbn0.gstatic.com/images?q=tbn:ANd9GcQX_K79eV6fBm_AHLBuhYvTV1-KzLJRffHTR8shZX88RfEnupkBG3-NKxFFUxk&amp;s","Polonia cerrará la frontera con Bielorrusia debido a maniobras militares rusas que incluirán simulacros nucleares. Esta decisión se da en el marco de tensiones geopolíticas en la región.","Polonia cerrará la frontera con Bielorrusia debido a maniobras militares rusas que incluirán simulacros nucleares. Esta decisión se da en el marco de tensiones geopolíticas en la región.",""
"09/09/2025 18:15:35","https://infobae.com/america/mundo/2025/09/09/katmandu-en-llamas-manifestantes-incendiaron-el-parlamento-y-casas-de-politicos-en-nepal-tras-la-renuncia-del-primer-ministro/","Katmandú en llamas: manifestantes incendiaron el Parlamento y casas de políticos en Nepal tras la renuncia del primer ministro","Katmandú en llamas: manifestantes incendiaron el parlamento y casas de políticos en Nepal tras la renuncia del primer ministro","https://encrypted-tbn0.gstatic.com/images?q=tbn:ANd9GcSVEUQ_MzE8kVghGsv1-Loqj1DJh83526x6VwOepjfAkJfGWHiwN5TZWnNq4w&amp;s","En Katmandú, Nepal, manifestantes incendiaron el parlamento y casas de políticos después de la renuncia del primer ministro. Los disturbios surgieron como consecuencia de la crisis política que vive el país, marcada por conflictos internos y tensiones entre diferentes facciones. Las autoridades locales trabajan para contener la situación y restaurar la calma en la ciudad.","En Katmandú, Nepal, manifestantes incendiaron el parlamento y casas de políticos después de la renuncia del primer ministro. Los disturbios surgieron como consecuencia de la crisis política que vive el país, marcada por conflictos internos y tensiones entre diferentes facciones. Las autoridades locales trabajan para contener la situación y restaurar la calma en la ciudad.",""
"09/09/2025 18:15:35","https://infobae.com/america/mundo/2025/09/09/la-union-europea-apuesta-por-sanciones-coordinadas-a-escala-internacional-para-ponerle-limites-a-putin/","La Unión Europea apuesta por sanciones coordinadas a escala internacional para ponerle límites a Putin","La Unión Europea apuesta por sanciones coordinadas a escala internacional para ponerle límites a Putin.","https://encrypted-tbn0.gstatic.com/images?q=tbn:ANd9GcQNp-JG0FY6D_WNm97dlTHqSOijINJSe2jWA0OEUIVFvz5aYbvDX9LUfa_wMMI&amp;s","La Unión Europea planea implementar sanciones coordinadas a nivel internacional para ponerle límites al presidente ruso Vladimir Putin. Esta medida se llevará a cabo debido a la crisis en Ucrania y al envenenamiento del opositor Alexei Navalny.","La Unión Europea planea implementar sanciones coordinadas a nivel internacional para ponerle límites al presidente ruso Vladimir Putin. Esta medida se llevará a cabo debido a la crisis en Ucrania y al envenenamiento del opositor Alexei Navalny.",""
"09/09/2025 18:15:35","https://infobae.com/america/mundo/2025/09/09/asi-quedo-la-vivienda-en-doha-donde-fue-atacada-la-cupula-de-negociadores-del-grupo-terrorista-hamas/","Así quedó la vivienda en Doha donde fue atacada la cúpula de negociadores del grupo terrorista Hamas","","https://encrypted-tbn0.gstatic.com/images?q=tbn:ANd9GcR4v_-DNavNRebNTq8uQdu3r6-u5l5xb_N4ei2E8SwZbCGP1JurLW6qR7BBdw&amp;s","En Doha, la vivienda donde se encontraba la cúpula de negociadores del grupo terrorista Hamas fue atacada. El incidente dejó graves daños en la propiedad, aunque por suerte no se reportaron heridos. Aunque aún no se ha identificado a los responsables del ataque, se sospecha que podría tratarse de un acto de represalia por parte de algún grupo rival.","En Doha, la vivienda donde se encontraba la cúpula de negociadores del grupo terrorista Hamas fue atacada. El incidente dejó graves daños en la propiedad, aunque por suerte no se reportaron heridos. Aunque aún no se ha identificado a los responsables del ataque, se sospecha que podría tratarse de un acto de represalia por parte de algún grupo rival.",""
"09/09/2025 18:15:35","https://infobae.com/movant/2025/09/07/cables-submarinos-la-logistica-invisible-que-sostiene-la-conexion-global/","Cables submarinos: la logística invisible que sostiene la conexión global","Cables submarinos: la logística invisible que sostiene la conexión global","https://encrypted-tbn0.gstatic.com/images?q=tbn:ANd9GcSKwK0phMLHrmZFCB-NMyLRZApwuLRGSaV-_1jYKjnFw5Wta4ZetKkLd7M7Nck&amp;s","El mundo actualmente se mantiene conectado gracias a una red de cables submarinos que transmiten datos a través de los océanos. Estos cables son vitales para la comunicación global y la conectividad de internet. A pesar de su importancia, la mayoría de las personas desconocen su existencia y la complejidad logística que implica su instalación y mantenimiento. Los cables submarinos son responsables de transmitir el 99% de los datos que se envían a nivel mundial, lo cual evidencia su relevancia en la sociedad actual.","El mundo actualmente se mantiene conectado gracias a una red de cables submarinos que transmiten datos a través de los océanos. Estos cables son vitales para la comunicación global y la conectividad de internet. A pesar de su importancia, la mayoría de las personas desconocen su existencia y la complejidad logística que implica su instalación y mantenimiento. Los cables submarinos son responsables de transmitir el 99% de los datos que se envían a nivel mundial, lo cual evidencia su relevancia en la sociedad actual.",""
"09/09/2025 18:15:35","https://infobae.com/america/mundo/2025/09/09/el-brazo-armado-de-hamas-se-atribuyo-la-responsabilidad-del-atentado-a-tiros-en-jerusalen/","El brazo armado de Hamas se atribuyó la responsabilidad del atentado a tiros en Jerusalén","","https://encrypted-tbn0.gstatic.com/images?q=tbn:ANd9GcQi1Rx4FFQRy6iiRN_J71C51cx8J4MUHn3SoN3z2VQDn764jVcqRv-tx6369Q&amp;s","","",""
"09/09/2025 18:15:35","https://infobae.com/deportes/2025/09/09/el-detras-de-escena-de-la-polemica-orden-de-mclaren-en-el-gp-de-italia-de-f1-el-careo-entre-norris-y-piastri/","El detrás de escena de la polémica orden de McLaren en el GP de Italia de F1: el careo entre Norris y Piastri","El detrás de escena de la polémica orden de McLaren en el GP de Italia de F1: el careo entre Norris y Piastri","https://encrypted-tbn0.gstatic.com/images?q=tbn:ANd9GcQtiznZp4_zqJVVnw8QT2N608yh6Fvozk_0mmmpTTjwm-udoggTGqc2Ku63saQ&amp;s","El artículo analiza la polémica orden de equipo de McLaren en el Gran Premio de Italia de F1 entre los pilotos Lando Norris y Oscar Piastri. Se revela que Piastri recibió indicaciones de no intentar adelantar a Norris durante la carrera, lo que generó malestar en el piloto australiano. Se destaca el enfrentamiento que tuvieron ambos pilotos en el motorhome después de la carrera, donde Piastri expresó su disgusto por la situación. El equipo McLaren justificó su decisión con el objetivo de maximizar los puntos en juego para el campeonato de constructores.","El artículo analiza la polémica orden de equipo de McLaren en el Gran Premio de Italia de F1 entre los pilotos Lando Norris y Oscar Piastri. Se revela que Piastri recibió indicaciones de no intentar adelantar a Norris durante la carrera, lo que generó malestar en el piloto australiano. Se destaca el enfrentamiento que tuvieron ambos pilotos en el motorhome después de la carrera, donde Piastri expresó su disgusto por la situación. El equipo McLaren justificó su decisión con el objetivo de maximizar los puntos en juego para el campeonato de constructores.",""
"09/09/2025 18:15:35","https://infobae.com/america/mundo/2025/09/08/crisis-politica-en-francia-tras-la-caida-de-bayrou-macron-nombrara-a-un-nuevo-primer-ministro-en-los-proximos-dias/","Crisis política en Francia: tras la caída de Bayrou, Macron nombrará a un nuevo primer ministro “en los próximos días”","Crisis política en Francia: tras la caída de Bayrou, Macron nombrará a un nuevo primer ministro en los próximos días","https://encrypted-tbn0.gstatic.com/images?q=tbn:ANd9GcRVQO_aGO87p5G8qMGQQaN3tnV1FDP4fMfC1fEyT8_ioVTId6vLwiCqFoyWjQ&amp;s","En Francia, se vive una crisis política tras la renuncia de Francois Bayrou como ministro de Justicia. El presidente Emmanuel Macron deberá nombrar un nuevo primer ministro en los próximos días para hacer frente a esta situación.","En Francia, se vive una crisis política tras la renuncia de Francois Bayrou como ministro de Justicia. El presidente Emmanuel Macron deberá nombrar un nuevo primer ministro en los próximos días para hacer frente a esta situación.",""
