"FechayHora","LinkOrigen","TituloOrigen","Titulo","Imagen","Intro","Noticia","Datos"
"10/02/2025 18:00:09","https://infobae.com/cultura/2025/10/02/el-concurso-chopin-de-polonia-reune-a-los-jovenes-pianistas-mas-brillantes-en-una-batalla-musical-imperdible/","El Concurso Chopin de Polonia reúne a los jóvenes pianistas más brillantes en una batalla musical imperdible","El concurso Chopin de Polonia reúne a los jóvenes pianistas más brillantes en una batalla musical imperdible","https://encrypted-tbn0.gstatic.com/images?q=tbn:ANd9GcQXw233fnsKAW8sNqvltL4qyGa4-3XptVN3qPVKMkQgOw8xBH6b9cSl26DF0ZM&amp;s","El Concurso Chopin de Polonia reúne a destacados pianistas jóvenes de todo el mundo para competir en una serie de interpretaciones del repertorio de Frédéric Chopin. Este prestigioso evento se celebra cada cinco años y ha crecido en fama desde su primera edición en 1927. Los participantes son evaluados por un jurado internacional que busca habilidades técnicas y artísticas. La competencia no solo ofrece reconocimiento, sino también oportunidades profesionales para los ganadores, quienes pueden impulsar sus carreras en el mundo de la música clásica. El concurso atrae la atención tanto de críticos como de aficionados, convirtiéndose en un espectáculo musical notable.","El Concurso Chopin de Polonia reúne a destacados pianistas jóvenes de todo el mundo para competir en una serie de interpretaciones del repertorio de Frédéric Chopin. Este prestigioso evento se celebra cada cinco años y ha crecido en fama desde su primera edición en 1927. Los participantes son evaluados por un jurado internacional que busca habilidades técnicas y artísticas. La competencia no solo ofrece reconocimiento, sino también oportunidades profesionales para los ganadores, quienes pueden impulsar sus carreras en el mundo de la música clásica. El concurso atrae la atención tanto de críticos como de aficionados, convirtiéndose en un espectáculo musical notable.",
"10/02/2025 18:00:09","https://infobae.com/estados-unidos/2025/10/02/donald-trump-declaro-a-los-carteles-del-caribe-como-combatientes-ilegales-y-anuncio-un-conflicto-armado-no-internacional/","Trump declaró a los cárteles del Caribe como combatientes ilegales y anunció un “conflicto armado no internacional”","Donald Trump designa a los carteles del Caribe como combatientes ilegales y anuncia conflicto armado no internacional","https://encrypted-tbn0.gstatic.com/images?q=tbn:ANd9GcT_9z24oI46Kj16yRj2P2_lociXhD5gC9i9dqG7tvOhG-XjiVbJnf0u4JCY0A&amp;s","Donald Trump ha clasificado a los carteles del Caribe como combatientes ilegales, lo que marca un enfoque más agresivo hacia el crimen organizado en la región. El ex presidente anunció que esto implicará un conflicto armado no internacional, sugiriendo una intervención más directa de Estados Unidos en la lucha contra estos grupos. Esta declaración podría tener repercusiones significativas en la política exterior y la seguridad en el Caribe, así como en las relaciones entre Estados Unidos y los países de la región.","Donald Trump ha clasificado a los carteles del Caribe como combatientes ilegales, lo que marca un enfoque más agresivo hacia el crimen organizado en la región. El ex presidente anunció que esto implicará un conflicto armado no internacional, sugiriendo una intervención más directa de Estados Unidos en la lucha contra estos grupos. Esta declaración podría tener repercusiones significativas en la política exterior y la seguridad en el Caribe, así como en las relaciones entre Estados Unidos y los países de la región.",""
"10/02/2025 18:00:09","https://infobae.com/america/mundo/2025/10/02/rusia-y-ucrania-intercambiaron-370-prisioneros-de-guerra-en-un-nuevo-canje-tras-el-pacto-de-estambul/","Rusia y Ucrania intercambiaron 370 prisioneros de guerra en un nuevo canje tras el pacto de Estambul","Rusia y Ucrania intercambian 370 prisioneros de guerra en nuevo canje tras pacto de Estambul","https://encrypted-tbn0.gstatic.com/images?q=tbn:ANd9GcSonRku3yMXm_Xxqcu19KIRwbvP6rgXaNPWQM1xnsM-ny6lTSSrfuR8QbZqtw&amp;s","Rusia y Ucrania llevaron a cabo un intercambio de 370 prisioneros de guerra, marcando un nuevo paso en las negociaciones tras el acuerdo de Estambul. Este canje se enmarca en el contexto del conflicto bélico en curso entre ambos países y es parte de los esfuerzos para aliviar la situación humanitaria. Las autoridades de ambos lados destacaron la importancia de estas acciones para avanzar hacia una resolución pacífica del conflicto.","Rusia y Ucrania llevaron a cabo un intercambio de 370 prisioneros de guerra, marcando un nuevo paso en las negociaciones tras el acuerdo de Estambul. Este canje se enmarca en el contexto del conflicto bélico en curso entre ambos países y es parte de los esfuerzos para aliviar la situación humanitaria. Las autoridades de ambos lados destacaron la importancia de estas acciones para avanzar hacia una resolución pacífica del conflicto.",""
"10/02/2025 18:00:09","https://infobae.com/cultura/2025/10/02/milton-nascimento-sufre-demencia-corporal-de-lewy-confirmo-su-hijo/","Milton Nascimento sufre demencia corporal de Lewy, confirmó su hijo","Milton Nascimento padece demencia corporal de Lewy, confirma su hijo","https://encrypted-tbn0.gstatic.com/images?q=tbn:ANd9GcSJUGDIMGXGhkfOps06N0vu9I1aadgUEtRtPUylaBv7hdhjECCFtQWJa50JsQ&amp;s","El reconocido músico brasileño Milton Nascimento ha sido diagnosticado con demencia corporal de Lewy, según informó su hijo. Esta enfermedad neurodegenerativa afecta las funciones cognitivas y motoras, produciendo deterioro en la memoria y cambios en el comportamiento. A pesar de la adversidad, Nascimento sigue recibiendo el apoyo de su familia y su legado musical continúa siendo celebrado por sus admiradores.","El reconocido músico brasileño Milton Nascimento ha sido diagnosticado con demencia corporal de Lewy, según informó su hijo. Esta enfermedad neurodegenerativa afecta las funciones cognitivas y motoras, produciendo deterioro en la memoria y cambios en el comportamiento. A pesar de la adversidad, Nascimento sigue recibiendo el apoyo de su familia y su legado musical continúa siendo celebrado por sus admiradores.",""
"10/02/2025 18:00:09","https://infobae.com/america/america-latina/2025/10/01/una-vacuna-tetravalente-redujo-en-brasil-un-68-las-hospitalizaciones-de-un-brote-de-dengue/","Una vacuna tetravalente redujo en Brasil un 68% las hospitalizaciones de un brote de dengue","Vacuna tetravalente reduce en Brasil un 68% las hospitalizaciones por dengue","https://encrypted-tbn0.gstatic.com/images?q=tbn:ANd9GcREjvZ4U2xnmDDh2rNyXUWsvXMVMpClh7Jw1Y6Az9XX-I8S2K_zJXSWJmgsIA&amp;s","Un estudio en Brasil ha mostrado que una vacuna tetravalente contra el dengue logró reducir en un 68% las hospitalizaciones durante un reciente brote de la enfermedad. Esta vacuna se dirige a las cuatro serotipos del virus del dengue y se encuentra en proceso de evaluación para su posible aprobación en diferentes países de América Latina. Los investigadores destacan la importancia de la vacunación en el control de brotes epidemológicos y en la reducción de la carga hospitalaria asociada al dengue.","Un estudio en Brasil ha mostrado que una vacuna tetravalente contra el dengue logró reducir en un 68% las hospitalizaciones durante un reciente brote de la enfermedad. Esta vacuna se dirige a las cuatro serotipos del virus del dengue y se encuentra en proceso de evaluación para su posible aprobación en diferentes países de América Latina. Los investigadores destacan la importancia de la vacunación en el control de brotes epidemológicos y en la reducción de la carga hospitalaria asociada al dengue.",""
"10/02/2025 18:00:09","https://infobae.com/america/ciencia-america/2025/10/02/venus-atrapamoscas-descubren-el-secreto-de-la-planta-carnivora-mas-famosa-para-atrapar-a-sus-presas/","Venus atrapamoscas: descubren el secreto de la planta carnívora más famosa para atrapar a sus presas","Descubren el secreto de la Venus atrapamoscas para atrapar a sus presas","https://encrypted-tbn0.gstatic.com/images?q=tbn:ANd9GcTD4TPmwu-4xhGWt6NQ6KMGfK_-EtcbMfpqPk1e79moui3xwxwaa1kp3ZreAw8&amp;s","Investigadores han descubierto cómo la Venus atrapamoscas, una de las plantas carnívoras más conocidas, captura a sus presas. El mecanismo de acción implica la rápida respuesta de sus hojas, que se cierran al detectar el movimiento de insectos. Este proceso es impulsado por cambios eléctricos en la planta, lo que le permite reaccionar en milisegundos. La identificación de este sistema de comunicación interna y su eficiencia podrían abrir nuevas líneas de investigación en biología y en el entendimiento de mecanismos similares en otras especies.","Investigadores han descubierto cómo la Venus atrapamoscas, una de las plantas carnívoras más conocidas, captura a sus presas. El mecanismo de acción implica la rápida respuesta de sus hojas, que se cierran al detectar el movimiento de insectos. Este proceso es impulsado por cambios eléctricos en la planta, lo que le permite reaccionar en milisegundos. La identificación de este sistema de comunicación interna y su eficiencia podrían abrir nuevas líneas de investigación en biología y en el entendimiento de mecanismos similares en otras especies.",""
"10/02/2025 18:00:09","https://infobae.com/america/mundo/2025/10/02/europa-acelera-el-plan-para-crear-un-muro-de-drones-ante-la-amenaza-rusa-en-la-frontera-oriental/","Europa acelera el plan para crear un “muro de drones” ante la amenaza rusa en la frontera oriental","Europa acelera el plan para crear un muro de drones ante la amenaza rusa en la frontera oriental","https://encrypted-tbn0.gstatic.com/images?q=tbn:ANd9GcRNnyyXIS85iwaSc-5BC81h7wri0kV_wrqLBRo2v3bPON_ko4T9iEUNP9n0m58&amp;s","La Unión Europea está intensificando sus esfuerzos para establecer un sistema de drones en la frontera oriental, impulsada por la creciente preocupación por la amenaza de Rusia en la región. Este plan busca fortalecer la vigilancia y mejorar la capacidad de respuesta ante posibles agresiones, integrando tecnologías avanzadas de drones para monitorear y proteger las fronteras. La medida refleja un enfoque preventivo y defensivo en el contexto de tensiones geopolíticas actuales.","La Unión Europea está intensificando sus esfuerzos para establecer un sistema de drones en la frontera oriental, impulsada por la creciente preocupación por la amenaza de Rusia en la región. Este plan busca fortalecer la vigilancia y mejorar la capacidad de respuesta ante posibles agresiones, integrando tecnologías avanzadas de drones para monitorear y proteger las fronteras. La medida refleja un enfoque preventivo y defensivo en el contexto de tensiones geopolíticas actuales.",""
"10/02/2025 18:00:09","https://infobae.com/america/mundo/2025/10/02/por-que-ucrania-necesita-renovar-sus-defensas-ante-los-ataques-masivos-de-putin/","Por qué Ucrania necesita renovar sus defensas ante los ataques masivos de Putin","Ucrania necesita renovar sus defensas ante los ataques masivos de Putin","https://encrypted-tbn0.gstatic.com/images?q=tbn:ANd9GcTOn3qHUArgU2x66by3K6kyINNwg6EqTbU9ihOO9hsMKJMa_C1qT9C1pah9kg&amp;s","La noticia aborda la necesidad urgente de Ucrania de modernizar sus sistemas de defensa en respuesta a los continuos ataques masivos por parte de Rusia. A medida que el conflicto se intensifica, las fuerzas rusas han lanzado una serie de bombardeos que afectan infraestructuras críticas y provocan pérdidas humanas. Ucrania enfrenta el reto de reforzar su capacidad defensiva a través de la adquisición de tecnología militar avanzada y el fortalecimiento de sus aliados. La situación actual resalta la importancia de una defensa eficiente para proteger a la población civil y asegurar la soberanía del país frente a la agresión extranjera.","La noticia aborda la necesidad urgente de Ucrania de modernizar sus sistemas de defensa en respuesta a los continuos ataques masivos por parte de Rusia. A medida que el conflicto se intensifica, las fuerzas rusas han lanzado una serie de bombardeos que afectan infraestructuras críticas y provocan pérdidas humanas. Ucrania enfrenta el reto de reforzar su capacidad defensiva a través de la adquisición de tecnología militar avanzada y el fortalecimiento de sus aliados. La situación actual resalta la importancia de una defensa eficiente para proteger a la población civil y asegurar la soberanía del país frente a la agresión extranjera.",""
"10/02/2025 18:00:09","https://infobae.com/america/america-latina/2025/10/02/el-presidente-de-guyana-convoco-a-los-lideres-del-caribe-a-un-dialogo-maduro-sobre-el-despliegue-militar-de-estados-unidos/","El presidente de Guyana convocó a los líderes del Caribe a un “diálogo maduro” sobre el despliegue militar de Estados Unidos","El presidente de Guyana convoca a los líderes del Caribe a un diálogo sobre el despliegue militar de Estados Unidos","https://encrypted-tbn0.gstatic.com/images?q=tbn:ANd9GcTEFJnUiJd4n1dnymdJWLhdXqBvSquscy9YltVjV13yzNsmJPcBq2ZYg474EDs&amp;s","El presidente de Guyana convocó a los líderes caribeños para discutir el aumento de la presencia militar de Estados Unidos en la región, un tema que ha generado preocupación entre los países miembros. La reunión tiene como objetivo abordar las implicaciones de este despliegue y promover el diálogo sobre la seguridad y la soberanía en el Caribe. Este encuentro se da en un contexto de creciente tensión en la política internacional y ante la necesidad de fortalecer la colaboración entre los países de la región.","El presidente de Guyana convocó a los líderes caribeños para discutir el aumento de la presencia militar de Estados Unidos en la región, un tema que ha generado preocupación entre los países miembros. La reunión tiene como objetivo abordar las implicaciones de este despliegue y promover el diálogo sobre la seguridad y la soberanía en el Caribe. Este encuentro se da en un contexto de creciente tensión en la política internacional y ante la necesidad de fortalecer la colaboración entre los países de la región.",""
"10/02/2025 18:00:09","https://infobae.com/america/mundo/2025/10/02/la-policia-confirmo-dos-detenidos-tras-el-atentado-terrorista-a-la-sinagoga-en-manchester/","La Policía confirmó dos detenidos tras el atentado terrorista a la sinagoga en Mánchester","Dos detenidos tras el atentado terrorista a la sinagoga en Manchester","https://encrypted-tbn0.gstatic.com/images?q=tbn:ANd9GcSqbDKEszVfA_A74Ca8Jf9bQnDrML0SlZyq8XmwH3kZQddSjcwQ9KgB7gr9jVc&amp;s","La policía de Manchester ha confirmado la detención de dos sospechosos en relación con un atentado terrorista ocurrido en una sinagoga local. El ataque se produjo en un momento de alta tensión en la comunidad judía de la ciudad. Las autoridades están investigando el incidente y han declarado que la seguridad en la zona se ha incrementado como medida cautelar. Se espera que continúen las investigaciones para esclarecer los detalles del ataque y las motivaciones detrás de este acto violento.","La policía de Manchester ha confirmado la detención de dos sospechosos en relación con un atentado terrorista ocurrido en una sinagoga local. El ataque se produjo en un momento de alta tensión en la comunidad judía de la ciudad. Las autoridades están investigando el incidente y han declarado que la seguridad en la zona se ha incrementado como medida cautelar. Se espera que continúen las investigaciones para esclarecer los detalles del ataque y las motivaciones detrás de este acto violento.",""
"10/02/2025 18:00:09","https://infobae.com/america/mundo/2025/10/02/desapariciones-y-destituciones-sacuden-al-ejercito-popular-de-liberacion-en-china/","Desapariciones y destituciones sacuden al Ejército Popular de Liberación en China","Desapariciones y destituciones en el Ejército Popular de Liberación de China","https://encrypted-tbn0.gstatic.com/images?q=tbn:ANd9GcTVYRTTk6c0Ww4wciwazb4q4LbZGzphepmki0btH8tMy2B4D-CN5mM9MMrXGBQ&amp;s","La noticia informa sobre un período de inestabilidad en el Ejército Popular de Liberación de China, caracterizado por una serie de desapariciones y destituciones de altos mandos. Esta situación ha generado inquietud sobre el estado interno de las fuerzas armadas chinas, que son ampliamente vistas como una herramienta crucial para la defensa del país y la proyección del poder. Las acciones recientes reflejan una Purga que podría estar vinculada a la reestructuración y consolidación del control político del liderazgo chino. La falta de información oficial sobre estos eventos ha mantenido cierta opacidad en torno a las motivaciones y el impacto real de estos cambios en la estructura militar del país.","La noticia informa sobre un período de inestabilidad en el Ejército Popular de Liberación de China, caracterizado por una serie de desapariciones y destituciones de altos mandos. Esta situación ha generado inquietud sobre el estado interno de las fuerzas armadas chinas, que son ampliamente vistas como una herramienta crucial para la defensa del país y la proyección del poder. Las acciones recientes reflejan una Purga que podría estar vinculada a la reestructuración y consolidación del control político del liderazgo chino. La falta de información oficial sobre estos eventos ha mantenido cierta opacidad en torno a las motivaciones y el impacto real de estos cambios en la estructura militar del país.",""
"10/02/2025 18:00:09","https://infobae.com/deportes/2025/10/02/sorpresa-en-la-formula-1-por-la-salida-de-un-destacado-piloto-rookie-de-mclaren-el-efecto-domino-que-podria-generar-en-la-grilla-del-2026/","La sorpresiva salida de un piloto novato de McLaren que podría dar un giro a la grilla de la F1 para 2026","Sorpresa en la Fórmula 1 por la salida de un destacado piloto rookie de McLaren y su posible efecto dominó en la grilla del 2026","https://encrypted-tbn0.gstatic.com/images?q=tbn:ANd9GcSmjB-a3z_DBMu80Ssf1mcVgdIBB6Dv_J44EnPeRdnNOmtpTwWmoNt8N4vIgSQ&amp;s","Un destacado piloto novato de McLaren ha anunciado su salida del equipo de Fórmula 1, lo que ha tomado por sorpresa a la comunidad automovilística. Esta decisión podría desencadenar un efecto dominó en la parrilla para la temporada 2026, ya que varios equipos podrían reconfigurar sus alineaciones en respuesta a esta vacante. La noticia genera expectativas sobre los cambios que se producirán en la grilla, impactando tanto a pilotos actuales como a futuros aspirantes.","Un destacado piloto novato de McLaren ha anunciado su salida del equipo de Fórmula 1, lo que ha tomado por sorpresa a la comunidad automovilística. Esta decisión podría desencadenar un efecto dominó en la parrilla para la temporada 2026, ya que varios equipos podrían reconfigurar sus alineaciones en respuesta a esta vacante. La noticia genera expectativas sobre los cambios que se producirán en la grilla, impactando tanto a pilotos actuales como a futuros aspirantes.",""
"10/02/2025 18:00:09","https://infobae.com/salud/ciencia/2025/10/01/el-dano-del-tabaco-se-transmite-a-la-siguiente-generacion-los-hijos-de-padres-fumadores-envejecen-mas-rapido/","El daño del tabaco se transmite a la siguiente generación: los hijos de padres fumadores envejecen más rápido","El daño del tabaco se transmite a la siguiente generación, los hijos de padres fumadores envejecen más rápido","https://encrypted-tbn0.gstatic.com/images?q=tbn:ANd9GcSx-nNTKW5QtO_I1aoM-xzPE4tSHHxmZsKX-nM3cyvfQWywvGu4cepTnW_vKg&amp;s","Un estudio reciente ha revelado que el daño causado por el tabaquismo no solo afecta a quienes fuman, sino que también puede transmitirse a las generaciones siguientes. Los hijos de padres fumadores muestran signos de envejecimiento acelerado, evidenciando un impacto en su salud y desarrollo. Los investigadores encontraron que estos efectos pueden manifestarse a nivel celular, afectando el ADN. Este hallazgo subraya la importancia de abordar el tabaquismo, no solo como un problema individual, sino como una cuestión que también afecta el bienestar de la descendencia.","Un estudio reciente ha revelado que el daño causado por el tabaquismo no solo afecta a quienes fuman, sino que también puede transmitirse a las generaciones siguientes. Los hijos de padres fumadores muestran signos de envejecimiento acelerado, evidenciando un impacto en su salud y desarrollo. Los investigadores encontraron que estos efectos pueden manifestarse a nivel celular, afectando el ADN. Este hallazgo subraya la importancia de abordar el tabaquismo, no solo como un problema individual, sino como una cuestión que también afecta el bienestar de la descendencia.",""
"10/02/2025 18:00:09","https://infobae.com/deportes/2025/10/01/la-nueva-polemica-que-le-estallo-a-xabi-alonso-en-real-madrid-por-la-suplencia-de-federico-valverde-el-comunicado-del-uruguayo/","La nueva polémica que le estalló a Xabi Alonso en Real Madrid por la suplencia de Valverde: el comunicado del uruguayo","La polémica de Xabi Alonso en Real Madrid por la suplencia de Federico Valverde y su comunicado","https://encrypted-tbn0.gstatic.com/images?q=tbn:ANd9GcREpWq6iGu3z5IP-BA4vDVopSraMS8Ov1hmTbkBCLa8qEoDleNv35FgsuCjU9Q&amp;s","La reciente decisión de Xabi Alonso de dejar a Federico Valverde en el banquillo de suplentes ha generado controversia en el Real Madrid. La situación se agrava por un comunicado emitido por el jugador uruguayo, quien expresó su desconcierto y descontento por no haber sido titular. Esta situación ha abierto un debate sobre la gestión del entrenador y sus decisiones tácticas, así como las implicaciones que esto puede tener en el ambiente del equipo y en la relación con los jugadores.","La reciente decisión de Xabi Alonso de dejar a Federico Valverde en el banquillo de suplentes ha generado controversia en el Real Madrid. La situación se agrava por un comunicado emitido por el jugador uruguayo, quien expresó su desconcierto y descontento por no haber sido titular. Esta situación ha abierto un debate sobre la gestión del entrenador y sus decisiones tácticas, así como las implicaciones que esto puede tener en el ambiente del equipo y en la relación con los jugadores.",""
"10/02/2025 18:00:09","https://infobae.com/estados-unidos/2025/10/01/entraron-en-vigor-los-nuevos-aranceles-de-trump-sobre-medicamentos-importados-y-camiones-pesados/","Entraron en vigor los nuevos aranceles de Trump sobre medicamentos importados y camiones pesados","Entrar en vigor nuevos aranceles de Trump sobre medicamentos importados y camiones pesados","https://encrypted-tbn0.gstatic.com/images?q=tbn:ANd9GcSc6Nola029A_rm5XGACWh0DiSQ9VOz5rns56vDIsq4a-UHmRwYAb--Y9aRgvY&amp;s","Entraron en vigor nuevos aranceles impuestos por la administración de Trump sobre medicamentos importados y camiones pesados. Estas medidas buscan proteger la industria local y reducir la dependencia de productos extranjeros. Los aranceles se aplican a un amplio rango de medicamentos, lo que ha generado preocupación entre importadores y distribuidores. Además, la medida afectará significativamente la logística y los costos de transporte, complicando el panorama comercial en el sector. La administración defiende la decisión como un paso hacia la autosuficiencia y la creación de empleos en el país.","Entraron en vigor nuevos aranceles impuestos por la administración de Trump sobre medicamentos importados y camiones pesados. Estas medidas buscan proteger la industria local y reducir la dependencia de productos extranjeros. Los aranceles se aplican a un amplio rango de medicamentos, lo que ha generado preocupación entre importadores y distribuidores. Además, la medida afectará significativamente la logística y los costos de transporte, complicando el panorama comercial en el sector. La administración defiende la decisión como un paso hacia la autosuficiencia y la creación de empleos en el país.",""
"10/02/2025 18:00:09","https://infobae.com/america/mundo/2025/09/27/los-reyes-britanicos-carlos-iii-y-camila-realizaran-una-visita-de-estado-al-vaticano-a-finales-de-octubre/","Los reyes británicos Carlos III y Camila realizarán una visita de Estado al Vaticano a finales de octubre","Los Reyes Británicos Carlos III y Camila realizarán una visita de Estado al Vaticano a finales de octubre","https://encrypted-tbn0.gstatic.com/images?q=tbn:ANd9GcT-xm35cHAecYP5ypEtr6cjmbeP2qSe3jB7oYO-ws22fKqZVlT6_NmNMIdmiw&amp;s","Los reyes británicos, Carlos III y Camila, realizarán una visita de estado al Vaticano a finales de octubre. Este viaje está destinado a fortalecer las relaciones entre el Reino Unido y la Santa Sede. Durante su estancia, se espera que los monarcas se reúnan con el Papa Francisco, con quien abordarán temas de interés mutuo y cooperación en cuestiones sociales y humanitarias. Esta visita también refleja el compromiso de la Corona británica con el diálogo interreligioso.","Los reyes británicos, Carlos III y Camila, realizarán una visita de estado al Vaticano a finales de octubre. Este viaje está destinado a fortalecer las relaciones entre el Reino Unido y la Santa Sede. Durante su estancia, se espera que los monarcas se reúnan con el Papa Francisco, con quien abordarán temas de interés mutuo y cooperación en cuestiones sociales y humanitarias. Esta visita también refleja el compromiso de la Corona británica con el diálogo interreligioso.",""
