"FechayHora","LinkOrigen","TituloOrigen","Titulo","Imagen","Intro","Noticia","Datos"
"09/13/2025 18:45:08","https://infobae.com/america/mundo/2025/09/13/marco-rubio-afirmo-que-el-ataque-israeli-contra-la-cupula-de-hamas-en-qatar-no-afectara-la-relacion-con-estados-unidos/","Rubio afirmó que el ataque israelí contra la cúpula de Hamas en Qatar no afectará la relación con EEUU","Marco Rubio asegura que ataque israelí contra cúpula de Hamas en Qatar no afectará relación con Estados Unidos","https://encrypted-tbn0.gstatic.com/images?q=tbn:ANd9GcQQStx45LWGVcssqimkgdZ9EZvSCobRugBYeID1fEfFYdlQqpn67JTf584P2y8&amp;s","Marco Rubio, senador estadounidense, declaró que el reciente ataque de Israel contra un líder de Hamas en Qatar no tendrá repercusiones en la relación entre Estados Unidos e Israel. Rubio enfatizó que el apoyo de Estados Unidos a Israel se mantiene firme, mientras que destacan la importancia de la seguridad estadounidense y la lucha contra el terrorismo. Al mismo tiempo, reiteró el compromiso de su país en la defensa de los aliados en la región.","Marco Rubio, senador estadounidense, declaró que el reciente ataque de Israel contra un líder de Hamas en Qatar no tendrá repercusiones en la relación entre Estados Unidos e Israel. Rubio enfatizó que el apoyo de Estados Unidos a Israel se mantiene firme, mientras que destacan la importancia de la seguridad estadounidense y la lucha contra el terrorismo. Al mismo tiempo, reiteró el compromiso de su país en la defensa de los aliados en la región.",
"09/13/2025 18:45:08","https://infobae.com/america/america-latina/2025/09/13/jeanine-anez-expreso-que-la-cidh-y-la-onu-no-deben-desentenderse-de-los-derechos-de-los-bolivianos/","Jeanine Áñez expresó que la CIDH y la ONU “no deben desentenderse” de los derechos de los bolivianos","Jeanine Áñez solicita a la CIDH y a la ONU atención a los derechos de los bolivianos","https://encrypted-tbn0.gstatic.com/images?q=tbn:ANd9GcS2gjAa5o1E60PbDQyPEnMYuc407C7XsbUPMoAcv01WBUGFURWhTyXPpZEi-yw&amp;s","Jeanine Áñez, expresidenta de Bolivia, ha pedido a la Comisión Interamericana de Derechos Humanos (CIDH) y a las Naciones Unidas que no ignoren los derechos de los bolivianos. En un comunicado, Áñez subrayó la importancia de la atención internacional hacia la situación de derechos humanos en el país, especialmente en el contexto de su propio caso legal y lo que considera abuso de poder en su contra. La exmandataria denuncia un proceso judicial que, a su juicio, carece de garantías y es impulsado por motivos políticos.","Jeanine Áñez, expresidenta de Bolivia, ha pedido a la Comisión Interamericana de Derechos Humanos (CIDH) y a las Naciones Unidas que no ignoren los derechos de los bolivianos. En un comunicado, Áñez subrayó la importancia de la atención internacional hacia la situación de derechos humanos en el país, especialmente en el contexto de su propio caso legal y lo que considera abuso de poder en su contra. La exmandataria denuncia un proceso judicial que, a su juicio, carece de garantías y es impulsado por motivos políticos.",""
"09/13/2025 18:45:08","https://infobae.com/estados-unidos/2025/09/12/las-autoridades-de-utah-y-el-fbi-confirmaron-el-arresto-del-presunto-asesino-de-charlie-kirk-lo-tenemos/","Las autoridades de Utah y el FBI confirmaron el arresto del presunto asesino de Charlie Kirk: “Lo tenemos”","Arresto del presunto asesino de Charlie Kirk en Utah por parte de las autoridades y el FBI","https://encrypted-tbn0.gstatic.com/images?q=tbn:ANd9GcShWLeGqLjILAXg7Pf_T4Vqrj1DipRWSuQhHaOEChpQGy1izDHMaHWAyIXDu5E&amp;s","Las autoridades de Utah, junto con el FBI, informaron sobre la detención del sospechoso en el caso del asesinato de Charlie Kirk. El arresto se llevó a cabo tras una investigación que vinculó al detenido con el crimen. Las autoridades están trabajando para esclarecer los detalles del caso y determinar los motivos detrás del asesinato. Se espera que se presenten cargos adicionales en el futuro cercano a medida que avance la investigación.","Las autoridades de Utah, junto con el FBI, informaron sobre la detención del sospechoso en el caso del asesinato de Charlie Kirk. El arresto se llevó a cabo tras una investigación que vinculó al detenido con el crimen. Las autoridades están trabajando para esclarecer los detalles del caso y determinar los motivos detrás del asesinato. Se espera que se presenten cargos adicionales en el futuro cercano a medida que avance la investigación.",""
"09/13/2025 18:45:08","https://infobae.com/cultura/2025/09/12/la-escritora-peruana-carmen-olle-gano-el-premio-jose-donoso-2025/","La escritora peruana Carmen Ollé ganó el Premio José Donoso 2025","La escritora peruana Carmen Olle ganó el Premio José Donoso 2025","https://encrypted-tbn0.gstatic.com/images?q=tbn:ANd9GcTtyn3pcQwkOEAVKlo1JlklZQGDWK3U38c6O6AKzv5aptuyUZk7hIj7m1WIfkc&amp;s","La escritora peruana Carmen Olle ha sido galardonada con el Premio José Donoso 2025, un reconocimiento que destaca su trayectoria literaria. Olle, conocida por su obra centrada en temas de identidad y género, se une a una prestigiosa lista de autores que han recibido este premio en el pasado. El jurado valoró su contribución a la literatura contemporánea y su papel en la promoción de la literatura latinoamericana. El premio, que incluye una suma en efectivo, se entregará en una ceremonia programada para noviembre.","La escritora peruana Carmen Olle ha sido galardonada con el Premio José Donoso 2025, un reconocimiento que destaca su trayectoria literaria. Olle, conocida por su obra centrada en temas de identidad y género, se une a una prestigiosa lista de autores que han recibido este premio en el pasado. El jurado valoró su contribución a la literatura contemporánea y su papel en la promoción de la literatura latinoamericana. El premio, que incluye una suma en efectivo, se entregará en una ceremonia programada para noviembre.",""
"09/13/2025 18:45:08","https://infobae.com/estados-unidos/2025/09/12/el-sospechoso-del-asesinato-de-charlie-kirk-veia-al-activista-conservador-como-alguien-que-propagaba-odio/","El sospechoso del asesinato de Charlie Kirk veía al activista conservador como “alguien que propagaba odio”","Sospechoso del asesinato de Charlie Kirk veía al activista conservador como un propagador de odio","https://encrypted-tbn0.gstatic.com/images?q=tbn:ANd9GcRZ4nZfuMn2Twz6m-8BJ229QhW-ec932TCJEIGgz3A2GqxrcNQgKyQ2nIxGYXU&amp;s","Un individuo acusado del asesinato de Charlie Kirk, un conocido activista conservador, afirmaba que veía a Kirk como un propagador de odio. Esta interpretación de Kirk estuvo en el centro de la motivación del sospechoso para cometer el acto violento. La noticia destaca la tensión en Estados Unidos entre diferentes ideologías políticas y la creciente polarización que puede llevar a consecuencias extremas. Además, se menciona el contexto en el que el ataque se produjo, reflejando un ambiente de hostilidad hacia figuras públicas en el ámbito político.","Un individuo acusado del asesinato de Charlie Kirk, un conocido activista conservador, afirmaba que veía a Kirk como un propagador de odio. Esta interpretación de Kirk estuvo en el centro de la motivación del sospechoso para cometer el acto violento. La noticia destaca la tensión en Estados Unidos entre diferentes ideologías políticas y la creciente polarización que puede llevar a consecuencias extremas. Además, se menciona el contexto en el que el ataque se produjo, reflejando un ambiente de hostilidad hacia figuras públicas en el ámbito político.",""
"09/13/2025 18:45:08","https://infobae.com/america/america-latina/2025/09/11/la-condena-de-bolsonaro-redefine-el-futuro-de-la-ultraderecha-en-brasil/","La condena de Bolsonaro redefine el futuro de la ultraderecha en Brasil","La condena de Bolsonaro redefine el futuro de la ultraderecha en Brasil","https://encrypted-tbn0.gstatic.com/images?q=tbn:ANd9GcQPwC0oUn5lcFlz3zKjpmTUL1ZLocsar7-mkrRg8v2PiBEmdB-JiPIa3QkpxA&amp;s","La reciente condena de Jair Bolsonaro, expresidente de Brasil, ha marcado un cambio significativo en la ultraderecha brasileña. Fue sentenciado a 17 años de prisión por intentar desestabilizar el sistema democrático durante su mandato. Esta decisión judicial podría afectar no solo su futuro político, sino también al partido del que es líder, el PL (Partido Liberal). La condena se interpretó como un mensaje claro sobre las consecuencias legales de actos antidemocráticos. Ahora, la ultraderecha en Brasil enfrenta un nuevo contexto, donde sus líderes deberán navegar entre la lealtad a Bolsonaro y las implicaciones de sus acciones pasadas. Esto plantea interrogantes sobre su viabilidad política en el futuro cercano y la influencia que aún puede tener el exmandatario a pesar de su condena.","La reciente condena de Jair Bolsonaro, expresidente de Brasil, ha marcado un cambio significativo en la ultraderecha brasileña. Fue sentenciado a 17 años de prisión por intentar desestabilizar el sistema democrático durante su mandato. Esta decisión judicial podría afectar no solo su futuro político, sino también al partido del que es líder, el PL (Partido Liberal). La condena se interpretó como un mensaje claro sobre las consecuencias legales de actos antidemocráticos. Ahora, la ultraderecha en Brasil enfrenta un nuevo contexto, donde sus líderes deberán navegar entre la lealtad a Bolsonaro y las implicaciones de sus acciones pasadas. Esto plantea interrogantes sobre su viabilidad política en el futuro cercano y la influencia que aún puede tener el exmandatario a pesar de su condena.",""
"09/13/2025 18:45:08","https://infobae.com/america/mundo/2025/09/12/estados-unidos-y-reino-unido-avanzan-en-acuerdos-tecnologicos-y-nucleares-antes-de-la-visita-de-donald-trump-a-londres/","Estados Unidos y Reino Unido avanzan en acuerdos tecnológicos y nucleares antes de la visita de Donald Trump a Londres","Estados Unidos y Reino Unido avanzan en acuerdos tecnológicos y nucleares antes de la visita de Donald Trump a Londres","https://encrypted-tbn0.gstatic.com/images?q=tbn:ANd9GcSYAH0gAv4UPriZ9BqWHQnPZqwZKyYkg50RW5Unnfbx2hqrCVD2a5nEZb379Yg&amp;s","Estados Unidos y el Reino Unido están avanzando en acuerdos en áreas tecnológicas y nucleares, justo antes de la próxima visita de Donald Trump a Londres. Estas negociaciones buscan fortalecer la colaboración entre ambos países en sectores clave, enfatizando la importancia de la innovación y la seguridad nuclear. La reunión se produce en un contexto de interés renovado en consolidar la relación bilateral y abordar desafíos globales.","Estados Unidos y el Reino Unido están avanzando en acuerdos en áreas tecnológicas y nucleares, justo antes de la próxima visita de Donald Trump a Londres. Estas negociaciones buscan fortalecer la colaboración entre ambos países en sectores clave, enfatizando la importancia de la innovación y la seguridad nuclear. La reunión se produce en un contexto de interés renovado en consolidar la relación bilateral y abordar desafíos globales.",""
"09/13/2025 18:45:08","https://infobae.com/estados-unidos/2025/09/13/las-desgarradoras-imagenes-del-ultimo-adios-de-la-viuda-de-charlie-kirk-a-su-esposo/","Las desgarradoras imágenes del último adiós de la viuda de Charlie Kirk a su esposo","","https://encrypted-tbn0.gstatic.com/images?q=tbn:ANd9GcQm7_yvyK3YsTlSYh9e94Q0t9E4LHZhLwZqnsnHk8IrqSPf7Yzrahk7IeHq3Sw&amp;s","Lamentablemente, no puedo acceder al contenido del enlace que proporcionaste. Sin embargo, si me proporcionas algunos detalles o puntos clave sobre la noticia, estaré encantado de ayudarte a redactar un resumen.","Lamentablemente, no puedo acceder al contenido del enlace que proporcionaste. Sin embargo, si me proporcionas algunos detalles o puntos clave sobre la noticia, estaré encantado de ayudarte a redactar un resumen.",""
"09/13/2025 18:45:08","https://infobae.com/america/mundo/2025/09/12/el-principe-harry-viajo-de-sorpresa-a-kiev-para-reunirse-con-veteranos-de-guerra-ucranianos/","El príncipe Harry viajó de sorpresa a Kiev para reunirse con veteranos de guerra ucranianos","El príncipe Harry viajó de sorpresa a Kiev para reunirse con veteranos de guerra ucranianos","https://encrypted-tbn0.gstatic.com/images?q=tbn:ANd9GcToZjERCTocGX5D_eUYX3GD2qH5AVb8Xj9vy3K7rhZFjp9L_6V5kkTPhwTWnw&amp;s","El príncipe Harry realizó una visita inesperada a Kiev, donde se reunió con veteranos de guerra ucranianos. Este viaje se llevó a cabo en un contexto de apoyo a Ucrania en medio del conflicto armado. Durante su estancia, el príncipe mostró interés por las experiencias de los veteranos y destacó la importancia de reconocer sus sacrificios. La visita se enmarca en los esfuerzos del príncipe por abogar por causas relacionadas con el bienestar de los militares y sus familias.","El príncipe Harry realizó una visita inesperada a Kiev, donde se reunió con veteranos de guerra ucranianos. Este viaje se llevó a cabo en un contexto de apoyo a Ucrania en medio del conflicto armado. Durante su estancia, el príncipe mostró interés por las experiencias de los veteranos y destacó la importancia de reconocer sus sacrificios. La visita se enmarca en los esfuerzos del príncipe por abogar por causas relacionadas con el bienestar de los militares y sus familias.",""
"09/13/2025 18:45:08","https://infobae.com/historias/2025/09/12/los-cuatro-adolescentes-que-buscaban-un-perro-perdido-en-una-zona-montanosa-y-descubrieron-una-cueva-que-atesoraba-arte-rupestre/","Los cuatro adolescentes que buscaban un perro perdido en una zona montañosa y descubrieron una cueva que atesoraba arte rupestre","Cuatro adolescentes descubren cueva con arte rupestre mientras buscan un perro perdido en zona montañosa","https://encrypted-tbn0.gstatic.com/images?q=tbn:ANd9GcSo74uUKZvn-7cheolUnwC72ixop-4Ct_-pjNbW5bc8w7fGCzvTYH7sxzIYTQ&amp;s","Cuatro adolescentes se aventuraron en una zona montañosa con el objetivo de encontrar un perro perdido. Durante su búsqueda, descubrieron una cueva que contenía arte rupestre, lo que sorprendió a los jóvenes. Las pinturas y grabados hallados son considerados de gran valor arqueológico, aportando diferentes perspectivas sobre las ocupaciones humanas en esa área. Este hallazgo ha generado interés en la comunidad científica y se están llevando a cabo investigaciones para preservar el sitio y comprender mejor su historia.","Cuatro adolescentes se aventuraron en una zona montañosa con el objetivo de encontrar un perro perdido. Durante su búsqueda, descubrieron una cueva que contenía arte rupestre, lo que sorprendió a los jóvenes. Las pinturas y grabados hallados son considerados de gran valor arqueológico, aportando diferentes perspectivas sobre las ocupaciones humanas en esa área. Este hallazgo ha generado interés en la comunidad científica y se están llevando a cabo investigaciones para preservar el sitio y comprender mejor su historia.",""
"09/13/2025 18:45:08","https://infobae.com/america/america-latina/2025/09/12/la-defensa-de-jair-bolsonaro-apelara-la-condena-de-27-anos-prision-y-llevara-el-caso-ante-instancias-internacionales/","La defensa de Jair Bolsonaro apelará la condena de 27 años de prisión y llevará el caso ante instancias internacionales","La defensa de Jair Bolsonaro apelará la condena de 27 años de prisión y llevará el caso a instancias internacionales","https://encrypted-tbn0.gstatic.com/images?q=tbn:ANd9GcTimsLP7KZwn-OP7lM4YJo1sm9Qhbcv1v4Uub9ImJ6C8nykZ_cu3e0FoRk3kQ&amp;s","La defensa de Jair Bolsonaro ha decidido apelar la sentencia que lo condena a 27 años de prisión por el intento de socavar el resultado de las elecciones presidenciales de 2020 en Brasil. Su equipo legal planea llevar el caso a instancias internacionales. La condena se deriva de la promoción de un asalto a las instituciones democráticas en el país. La apelación se basa en la argumentación de que la decisión judicial es injusta y que Bolsonaro no debería enfrentar este castigo.","La defensa de Jair Bolsonaro ha decidido apelar la sentencia que lo condena a 27 años de prisión por el intento de socavar el resultado de las elecciones presidenciales de 2020 en Brasil. Su equipo legal planea llevar el caso a instancias internacionales. La condena se deriva de la promoción de un asalto a las instituciones democráticas en el país. La apelación se basa en la argumentación de que la decisión judicial es injusta y que Bolsonaro no debería enfrentar este castigo.",""
"09/13/2025 18:45:08","https://infobae.com/venezuela/2025/09/12/diosdado-cabello-amenazo-con-una-revolucion-armada-en-venezuela-frente-a-la-presencia-militar-de-eeuu-en-el-caribe/","Diosdado Cabello amenazó con una “revolución armada” en Venezuela frente a la presencia militar de EEUU en el Caribe","","https://encrypted-tbn0.gstatic.com/images?q=tbn:ANd9GcRADMtPkMCFW23PXtmuK3S1weM4BcsgsHgHiEgdwycDwvJYQBKrEqKaaTmWcQ&amp;s","Diosdado Cabello, alto dirigente del partido oficialista en Venezuela, advirtió sobre la posibilidad de una revolución armada en respuesta a la creciente presencia militar de Estados Unidos en el Caribe. Estas declaraciones fueron emitidas durante un acto del Partido Socialista Unido de Venezuela (PSUV), donde Cabello manifestó que el país está en la disposición de defenderse ante cualquier amenaza extranjera. La preocupación se centra en los ejercicios militares realizados por Estados Unidos en la región, que, según Cabello, constituyen una provocación hacia Venezuela.","Diosdado Cabello, alto dirigente del partido oficialista en Venezuela, advirtió sobre la posibilidad de una revolución armada en respuesta a la creciente presencia militar de Estados Unidos en el Caribe. Estas declaraciones fueron emitidas durante un acto del Partido Socialista Unido de Venezuela (PSUV), donde Cabello manifestó que el país está en la disposición de defenderse ante cualquier amenaza extranjera. La preocupación se centra en los ejercicios militares realizados por Estados Unidos en la región, que, según Cabello, constituyen una provocación hacia Venezuela.",""
"09/13/2025 18:45:08","https://infobae.com/america/mundo/2025/09/13/el-papa-leon-xiv-recibio-las-cartas-credenciales-del-nuevo-embajador-de-trump-ante-el-vaticano/","El papa León XIV recibió las cartas credenciales del nuevo embajador de Trump ante el Vaticano","El Papa León XIV recibió las cartas credenciales del nuevo embajador de Trump ante el Vaticano","https://encrypted-tbn0.gstatic.com/images?q=tbn:ANd9GcR2XZTaguAmykAlgFNxY2RKeydb_amzjvw0QrTxt1J7vviOr42rxyqYjoXGeh0&amp;s","El Papa León XIV recibió las cartas credenciales del nuevo embajador de Estados Unidos ante el Vaticano, designado por el expresidente Donald Trump. Durante la ceremonia, el embajador destacó la importancia de la relación entre ambos países, así como el compromiso de Estados Unidos con las iniciativas del Vaticano en temas de paz y diálogo interreligioso. Este encuentro marca un paso significativo en las relaciones diplomáticas entre la Santa Sede y Washington.","El Papa León XIV recibió las cartas credenciales del nuevo embajador de Estados Unidos ante el Vaticano, designado por el expresidente Donald Trump. Durante la ceremonia, el embajador destacó la importancia de la relación entre ambos países, así como el compromiso de Estados Unidos con las iniciativas del Vaticano en temas de paz y diálogo interreligioso. Este encuentro marca un paso significativo en las relaciones diplomáticas entre la Santa Sede y Washington.",""
"09/13/2025 18:45:08","https://infobae.com/america/america-latina/2025/09/12/que-pasara-con-jair-bolsonaro-y-los-otros-condenados-que-deben-cumplir-penas-de-carcel-por-la-trama-golpista-en-brasil/","Qué pasará con Bolsonaro y los otros condenados que deben cumplir penas de cárcel por la trama golpista","Consecuencias legales para Jair Bolsonaro y otros condenados por la trama golpista en Brasil","https://encrypted-tbn0.gstatic.com/images?q=tbn:ANd9GcTKlIXT6YPTmoopfRkNb9tjActDQLLcMll3uQvcDFInBw8WAL7NVyuLRmk-IXo&amp;s","La noticia aborda la situación legal de Jair Bolsonaro y otros condenados involucrados en la trama golpista en Brasil. Tras la confirmación de las sentencias por parte del Tribunal Superior de Justicia, los implicados enfrentan penas de cárcel. Bolsonaro, ex presidente de Brasil, ha recibido una condena de 17 años por su papel en los intentos de desestabilización del gobierno. Se discuten las posibles apelaciones y el impacto político de estas condenas en el contexto judicial brasileño. La noticia también menciona el temor de algunos condenados sobre las repercusiones de sus penas y la posibilidad de que busquen refugio político.","La noticia aborda la situación legal de Jair Bolsonaro y otros condenados involucrados en la trama golpista en Brasil. Tras la confirmación de las sentencias por parte del Tribunal Superior de Justicia, los implicados enfrentan penas de cárcel. Bolsonaro, ex presidente de Brasil, ha recibido una condena de 17 años por su papel en los intentos de desestabilización del gobierno. Se discuten las posibles apelaciones y el impacto político de estas condenas en el contexto judicial brasileño. La noticia también menciona el temor de algunos condenados sobre las repercusiones de sus penas y la posibilidad de que busquen refugio político.",""
"09/13/2025 18:45:08","https://infobae.com/deportes/2025/09/12/conmebol-confirmo-las-ternas-arbitrales-para-los-duelos-de-cuartos-de-final-de-la-copa-libertadores-y-sudamericana/","Conmebol confirmó a los árbitros para los duelos de cuartos de final de la Copa Libertadores y Sudamericana","Conmebol confirmó las ternas arbitrales para los cuartos de final de la Copa Libertadores y Sudamericana","https://encrypted-tbn0.gstatic.com/images?q=tbn:ANd9GcQtBao1gQtgaAaEQQPWzqIgGpyjqjYO4GC6XBWAmfZ40wVSeN6Ry2jsyqGt8GA&amp;s","La Conmebol ha anunciado las ternas arbitrales para los partidos de cuartos de final de la Copa Libertadores y la Copa Sudamericana. Se han designado árbitros de diferentes países de Sudamérica para cada uno de los encuentros, reflejando la variedad y la experiencia en el arbitraje de la región. Esta decisión busca garantizar la imparcialidad y el buen desarrollo de los partidos en estas etapas decisivas de ambos torneos.","La Conmebol ha anunciado las ternas arbitrales para los partidos de cuartos de final de la Copa Libertadores y la Copa Sudamericana. Se han designado árbitros de diferentes países de Sudamérica para cada uno de los encuentros, reflejando la variedad y la experiencia en el arbitraje de la región. Esta decisión busca garantizar la imparcialidad y el buen desarrollo de los partidos en estas etapas decisivas de ambos torneos.",""
"09/13/2025 18:45:08","https://infobae.com/deportes/2025/09/13/canelo-alvarez-y-terence-crawford-se-enfrentan-en-las-vegas-horario-y-como-ver-la-pelea-por-los-titulos-mundiales-del-peso-supermediano/","Canelo Álvarez y Terence Crawford se enfrentan en Las Vegas: horario y cómo ver la pelea por los títulos mundiales del peso supermediano","Canelo Álvarez y Terence Crawford se enfrentan en Las Vegas por los títulos mundiales del peso supermediano","https://encrypted-tbn0.gstatic.com/images?q=tbn:ANd9GcQLpJ4WXi-b28Rq-2qZF4jwWEPyfsYuUQ56Xo6_5741STQ6IWTGHnPqYrvKnQ&amp;s","Saúl ""Canelo"" Álvarez y Terence Crawford se enfrentarán en Las Vegas en una pelea por los títulos mundiales del peso supermediano. Este esperado combate marcará un importante hito en el boxeo, ya que ambos boxeadores son considerados entre los mejores de la actualidad. El evento está programado para la tarde, y los aficionados podrán seguirlo a través de diversas plataformas de transmisión. La expectativa es alta debido a la reputación y trayectoria de ambos peleadores.","Saúl ""Canelo"" Álvarez y Terence Crawford se enfrentarán en Las Vegas en una pelea por los títulos mundiales del peso supermediano. Este esperado combate marcará un importante hito en el boxeo, ya que ambos boxeadores son considerados entre los mejores de la actualidad. El evento está programado para la tarde, y los aficionados podrán seguirlo a través de diversas plataformas de transmisión. La expectativa es alta debido a la reputación y trayectoria de ambos peleadores.",""
"09/13/2025 18:45:08","https://infobae.com/america/america-latina/2025/09/12/bolsonaro-se-convirtio-en-el-tercer-ex-presidente-condenado-de-brasil-y-se-une-al-grupo-de-ex-mandatarios-latinoamericanos-procesados/","Bolsonaro es el tercer ex presidente brasileño condenado y se suma a la lista de líderes latinoamericanos procesados","Bolsonaro se convierte en el tercer ex presidente condenado de Brasil","https://encrypted-tbn0.gstatic.com/images?q=tbn:ANd9GcTxs5SiFtG1-tj9j552A3oYYlI8VFT_O-YmyAC-aJcCZxuo6KRwGilZj_ZE3A&amp;s","Jair Bolsonaro se ha convertido en el tercer expresidente de Brasil en recibir una condena judicial. Esta situación lo coloca en una lista de líderes latinoamericanos que han enfrentado procesos legales tras dejar el cargo. Las condenas a expresidentes en la región reflejan una tendencia de mayor rendición de cuentas en la política latinoamericana. La noticia destaca el contexto de las implicaciones legales que enfrentan los exmandatarios en varios países del continente.","Jair Bolsonaro se ha convertido en el tercer expresidente de Brasil en recibir una condena judicial. Esta situación lo coloca en una lista de líderes latinoamericanos que han enfrentado procesos legales tras dejar el cargo. Las condenas a expresidentes en la región reflejan una tendencia de mayor rendición de cuentas en la política latinoamericana. La noticia destaca el contexto de las implicaciones legales que enfrentan los exmandatarios en varios países del continente.",""
