"FechayHora","LinkOrigen","TituloOrigen","Titulo","Imagen","Intro","Noticia","Datos"
"09/13/2025 18:45:08","https://infobae.com/deportes/2025/09/09/el-lapidario-analisis-de-una-leyenda-de-la-seleccion-alemana-estamos-a-anos-luz-de-poder-hablar-de-ganar-la-copa-del-mundo/","El lapidario análisis de una leyenda de la selección alemana: “Estamos a años luz de poder hablar de ganar la Copa del Mundo”","El lapidario análisis de una leyenda de la selección alemana: estamos a años luz de poder hablar de ganar la Copa del Mundo","https://encrypted-tbn0.gstatic.com/images?q=tbn:ANd9GcTdUrBp0klmGkEyHfrlE-X09st-PU05On5lRFg5CuwVLXQhxEmJIlmtXZo5mv8&amp;s","La leyenda de la selección alemana expresó que el equipo está lejos de poder ganar la Copa del Mundo. Señaló la falta de calidad de los jugadores y la necesidad de cambiar la mentalidad en el fútbol alemán.","La leyenda de la selección alemana expresó que el equipo está lejos de poder ganar la Copa del Mundo. Señaló la falta de calidad de los jugadores y la necesidad de cambiar la mentalidad en el fútbol alemán.",""
"09/13/2025 18:45:08","https://infobae.com/america/mundo/2025/09/13/reino-unido-impuso-mas-de-cien-nuevas-sanciones-contra-rusia-para-frenar-la-financiacion-y-logistica-de-la-guerra-en-ucrania/","Reino Unido impuso más de cien nuevas sanciones contra Rusia para frenar la financiación y logística de la guerra en Ucrania","Reino Unido impone más de cien nuevas sanciones a Rusia para frenar la financiación y logística de la guerra en Ucrania","https://encrypted-tbn0.gstatic.com/images?q=tbn:ANd9GcRb_mwwjmxtIvtOrxYtSA2pcRkUTbMy_4yKMKjh_7e30c-FenKj9pkWEkt1yw&amp;s","El Reino Unido ha implementado más de cien nuevas sanciones contra Rusia con el objetivo de interrumpir la financiación y logística de la guerra en Ucrania. Estas medidas afectan a diversas entidades y individuos considerados claves en el apoyo a la invasión rusa. Las sanciones buscan aumentar la presión sobre Moscú y están en línea con las acciones de otros países occidentales, que también han reforzado sus restricciones económicas hacia Rusia. La decisión refleja el compromiso del Reino Unido de enfrentar la agresión rusa y respaldar a Ucrania en su lucha.","El Reino Unido ha implementado más de cien nuevas sanciones contra Rusia con el objetivo de interrumpir la financiación y logística de la guerra en Ucrania. Estas medidas afectan a diversas entidades y individuos considerados claves en el apoyo a la invasión rusa. Las sanciones buscan aumentar la presión sobre Moscú y están en línea con las acciones de otros países occidentales, que también han reforzado sus restricciones económicas hacia Rusia. La decisión refleja el compromiso del Reino Unido de enfrentar la agresión rusa y respaldar a Ucrania en su lucha.",""
"09/13/2025 18:45:08","https://infobae.com/america/mundo/2025/09/12/la-onu-denuncio-un-aumento-de-las-ejecuciones-publicas-en-corea-del-norte-por-consumir-contenido-extranjero/","La ONU denunció un aumento de las ejecuciones públicas en Corea del Norte por consumir contenido extranjero","Aumento de ejecuciones públicas en Corea del Norte por consumir contenido extranjero, según la ONU","https://encrypted-tbn0.gstatic.com/images?q=tbn:ANd9GcQhNMGCmuqTfwLmwBTQTiSKsh3tZVcSTtHH4ygD7YIMqvvvRFHallvXauFspd8&amp;s","La ONU ha señalado un incremento en las ejecuciones públicas en Corea del Norte, atribuyéndolo a la supuesta violación de normas relacionadas con el consumo de contenido extranjero. Los detalles reportados indican que estas ejecuciones son parte de un esfuerzo por controlar la influencia externa y reafirmar el control del régimen sobre la población. Se ha documentado que personas han sido condenadas a muerte por consumir o compartir series y películas de otros países, lo que refleja la severidad de las sanciones impuestas por el gobierno. La organización internacional ha expresado su preocupación por esta situación, considerando que representa una violación grave de los derechos humanos.","La ONU ha señalado un incremento en las ejecuciones públicas en Corea del Norte, atribuyéndolo a la supuesta violación de normas relacionadas con el consumo de contenido extranjero. Los detalles reportados indican que estas ejecuciones son parte de un esfuerzo por controlar la influencia externa y reafirmar el control del régimen sobre la población. Se ha documentado que personas han sido condenadas a muerte por consumir o compartir series y películas de otros países, lo que refleja la severidad de las sanciones impuestas por el gobierno. La organización internacional ha expresado su preocupación por esta situación, considerando que representa una violación grave de los derechos humanos.",""
"09/13/2025 18:45:08","https://infobae.com/america/mundo/2025/09/12/ataque-con-cuchillo-en-un-hotel-cerca-de-jerusalen-hay-al-menos-dos-heridos/","Ataque con cuchillo en un hotel cerca de Jerusalén: hay al menos dos heridos","Ataque con cuchillo en hotel cerca de Jerusalén deja al menos dos heridos","https://encrypted-tbn0.gstatic.com/images?q=tbn:ANd9GcQ0ClddNipNkt8ip9jT7PpQ4xss5foeBwkg3QORM8I_xtfr7dwN60XnjMUYmw&amp;s","En un hotel cercano a Jerusalén, un ataque con cuchillo dejó al menos dos heridos. La policía local detuvo a un sospechoso involucrado en el incidente, que se registró en un establecimiento turístico situado en el área de Maale Adumim, una localidad israelí. Según informes, los heridos fueron atendidos en un hospital cercano y su estado no se ha divulgado con precisión. La investigación sobre el ataque está en curso, mientras las autoridades intentan esclarecer las circunstancias del hecho y el motivo detrás del ataque.","En un hotel cercano a Jerusalén, un ataque con cuchillo dejó al menos dos heridos. La policía local detuvo a un sospechoso involucrado en el incidente, que se registró en un establecimiento turístico situado en el área de Maale Adumim, una localidad israelí. Según informes, los heridos fueron atendidos en un hospital cercano y su estado no se ha divulgado con precisión. La investigación sobre el ataque está en curso, mientras las autoridades intentan esclarecer las circunstancias del hecho y el motivo detrás del ataque.",""
"09/13/2025 18:45:08","https://infobae.com/america/mundo/2025/09/13/netanyahu-afirmo-que-eliminar-a-los-jefes-terroristas-de-hamas-que-viven-en-qatar-pondria-fin-a-la-guerra-en-gaza/","Netanyahu afirmó que eliminar a los jefes terroristas de Hamas que viven en Qatar pondría fin a la guerra en Gaza","Netanyahu propone eliminar a los jefes terroristas de Hamas en Qatar para poner fin a la guerra en Gaza","https://encrypted-tbn0.gstatic.com/images?q=tbn:ANd9GcSiGTOnSI4Km8xnhtSBHRdJhzsaBMIj9fmOTAwW4d-tbje94RXu-WmRncs3Txg&amp;s","El primer ministro de Israel, Benjamin Netanyahu, declaró que eliminar a los líderes de Hamas que se encuentran en Qatar podría ser la clave para poner fin al conflicto en Gaza. Según Netanyahu, la eliminación de estos jefes terroristas afectaría significativamente las operaciones de Hamas y contribuiría a la estabilidad en la región. La situación en Gaza ha generado un aumento de tensiones y hostilidades, y el líder israelí enfatizó que estas acciones son necesarias para garantizar la seguridad de su país.","El primer ministro de Israel, Benjamin Netanyahu, declaró que eliminar a los líderes de Hamas que se encuentran en Qatar podría ser la clave para poner fin al conflicto en Gaza. Según Netanyahu, la eliminación de estos jefes terroristas afectaría significativamente las operaciones de Hamas y contribuiría a la estabilidad en la región. La situación en Gaza ha generado un aumento de tensiones y hostilidades, y el líder israelí enfatizó que estas acciones son necesarias para garantizar la seguridad de su país.",""
"09/13/2025 18:45:08","https://infobae.com/america/mundo/2025/09/12/estados-unidos-lanzo-un-nuevo-paquete-de-sanciones-contra-los-huties-de-yemen/","Estados Unidos lanzó un nuevo paquete de sanciones contra los hutíes de Yemen","Estados Unidos lanza un nuevo paquete de sanciones contra los hutíes de Yemen","https://encrypted-tbn0.gstatic.com/images?q=tbn:ANd9GcST-cJY8GOJurMBzaQ82PBHi3KTnyYPehLPS7RPOt0Tqw8EYCvmB4pdXDTmqVQ&amp;s","Estados Unidos ha impuesto un nuevo paquete de sanciones contra los hutíes en Yemen, en un esfuerzo por limitar su capacidad de financiación y operaciones militares. Estas sanciones se centran en individuos y entidades vinculadas al grupo como parte de la política estadounidense hacia el conflicto en la región, que ha causado una profunda crisis humanitaria. La administración estadounidense también busca presionar a Irán, al que acusa de apoyar a los hutíes, para que cese su involucramiento en el conflicto.","Estados Unidos ha impuesto un nuevo paquete de sanciones contra los hutíes en Yemen, en un esfuerzo por limitar su capacidad de financiación y operaciones militares. Estas sanciones se centran en individuos y entidades vinculadas al grupo como parte de la política estadounidense hacia el conflicto en la región, que ha causado una profunda crisis humanitaria. La administración estadounidense también busca presionar a Irán, al que acusa de apoyar a los hutíes, para que cese su involucramiento en el conflicto.",""
"09/13/2025 18:45:08","https://infobae.com/deportes/2025/09/12/impacto-en-el-mundo-del-atletismo-el-velocista-estadounidense-erriyon-knighton-fue-sancionado-por-4-anos-por-doping/","Impacto en el mundo del atletismo: el velocista estadounidense Erriyon Knighton fue sancionado por 4 años por doping","Velocista estadounidense Erriyon Knighton sancionado por 4 años por doping","https://encrypted-tbn0.gstatic.com/images?q=tbn:ANd9GcScY_n5JUba4bNj8aQZ2_O5hX2vatlR5aLItgurKYQ9n2DX6mCcnIh7KL25vQ&amp;s","El velocista estadounidense Erriyon Knighton ha sido sancionado con cuatro años de inhabilitación debido a un caso de doping. La decisión fue tomada por la Unidad de Integridad del Atletismo (AIU) tras detectarse resultados anómalos en sus pruebas de dopaje. Knighton, quien se destacó la temporada pasada y es considerado una promesa en el atletismo, enfrentó esta situación tras haber sido advertido previamente sobre el uso de sustancias prohibidas. La sanción se aplicará de manera retroactiva, comenzando desde la fecha en que se iniciaron las investigaciones. Knighton ha sido una figura prominente en el atletismo juvenil y esta medida impacta su trayectoria y futuras competiciones.","El velocista estadounidense Erriyon Knighton ha sido sancionado con cuatro años de inhabilitación debido a un caso de doping. La decisión fue tomada por la Unidad de Integridad del Atletismo (AIU) tras detectarse resultados anómalos en sus pruebas de dopaje. Knighton, quien se destacó la temporada pasada y es considerado una promesa en el atletismo, enfrentó esta situación tras haber sido advertido previamente sobre el uso de sustancias prohibidas. La sanción se aplicará de manera retroactiva, comenzando desde la fecha en que se iniciaron las investigaciones. Knighton ha sido una figura prominente en el atletismo juvenil y esta medida impacta su trayectoria y futuras competiciones.",""
"09/13/2025 18:45:08","https://infobae.com/america/mundo/2025/09/13/el-emotivo-homenaje-al-papa-francisco-durante-un-concierto-en-el-vaticano-miles-de-drones-fueron-desplegados-para-formar-su-rostro/","El emotivo homenaje al papa Francisco durante un concierto en el Vaticano: miles de drones fueron desplegados para formar su rostro","Emotivo homenaje al Papa Francisco con miles de drones en el Vaticano","https://encrypted-tbn0.gstatic.com/images?q=tbn:ANd9GcSp7ENEITiJ9HcUnaDNXNEGaJ0mS8LJvkIHi55Sy5ijgOQku9NM4DDhvNo9zA&amp;s","En un concierto celebrado en el Vaticano, miles de drones fueron utilizados para rendir homenaje al Papa Francisco, formando la imagen de su rostro en el cielo. Este emotivo tributo se llevó a cabo durante un evento que reunió a numerosas personalidades y fue organizado para celebrar la vida y obra del Papa. La actuación destacó por la tecnología y la emoción, reflejando la admiración que muchos sienten por el líder religioso. El Papa Francisco, emocionado por el reconocimiento, participó brevemente en la celebración.","En un concierto celebrado en el Vaticano, miles de drones fueron utilizados para rendir homenaje al Papa Francisco, formando la imagen de su rostro en el cielo. Este emotivo tributo se llevó a cabo durante un evento que reunió a numerosas personalidades y fue organizado para celebrar la vida y obra del Papa. La actuación destacó por la tecnología y la emoción, reflejando la admiración que muchos sienten por el líder religioso. El Papa Francisco, emocionado por el reconocimiento, participó brevemente en la celebración.",""
"09/13/2025 18:45:08","https://infobae.com/estados-unidos/2025/09/11/trump-prometio-capturar-al-responsable-del-asesinato-de-charlie-kirk-en-utah-es-un-dia-oscuro-para-estados-unidos/","Trump acusó a la “izquierda radical” de generar el clima de odio que derivó en el asesinato de Charlie Kirk","Trump promete capturar al responsable del asesinato de Charlie Kirk en Utah","https://encrypted-tbn0.gstatic.com/images?q=tbn:ANd9GcT8HFjrPMV2Do4cktmRAntkR7b4WQAIEvwsLlxXdPliEQ_kk9ZtjzHxlprm46A&amp;s","Donald Trump prometió que se comprometerá a encontrar al responsable del asesinato de Charlie Kirk en Utah, describiendo el suceso como uno de los días más oscuros para Estados Unidos. Durante un evento en una localidad cercana, el expresidente se centró en la violencia y lo que consideró una crisis de seguridad en el país, junto con la necesidad de justicia. Kirk, conocido por ser un activista conservador, fue asesinado en circunstancias que han generado gran preocupación en la comunidad. La noticia ha generado un intenso debate sobre la violencia política y la seguridad en el país.","Donald Trump prometió que se comprometerá a encontrar al responsable del asesinato de Charlie Kirk en Utah, describiendo el suceso como uno de los días más oscuros para Estados Unidos. Durante un evento en una localidad cercana, el expresidente se centró en la violencia y lo que consideró una crisis de seguridad en el país, junto con la necesidad de justicia. Kirk, conocido por ser un activista conservador, fue asesinado en circunstancias que han generado gran preocupación en la comunidad. La noticia ha generado un intenso debate sobre la violencia política y la seguridad en el país.",""
"09/13/2025 18:45:08","https://infobae.com/america/ciencia-america/2025/09/12/la-increible-mariposa-con-229-pares-de-cromosomas-que-marca-records-en-el-reino-animal/","La increíble mariposa con 229 pares de cromosomas que marca récords en el reino animal","La increíble mariposa con 229 pares de cromosomas que marca récords en el reino animal","https://encrypted-tbn0.gstatic.com/images?q=tbn:ANd9GcSxoDSZipKv-IkmYje7XjhuLhDt7m8or960n7m5ZwurUA3Pd4gicA5VQBsUrx0&amp;s","Investigadores han descubierto una mariposa que posee un récord impresionante de 229 pares de cromosomas, la mayor cantidad registrada en el reino animal. Esta especie, denominada Protaetia mugruza, fue hallada en el estado de Veracruz, México. Este hallazgo desafía los conceptos previos sobre la cantidad de cromosomas en los insectos y abre nuevas líneas de investigación sobre la evolución y la diversidad genética en estas criaturas. La cantidad de cromosomas en muchas especies suele ser mucho menor, lo que hace que este descubrimiento sea particularmente notable para los científicos.","Investigadores han descubierto una mariposa que posee un récord impresionante de 229 pares de cromosomas, la mayor cantidad registrada en el reino animal. Esta especie, denominada Protaetia mugruza, fue hallada en el estado de Veracruz, México. Este hallazgo desafía los conceptos previos sobre la cantidad de cromosomas en los insectos y abre nuevas líneas de investigación sobre la evolución y la diversidad genética en estas criaturas. La cantidad de cromosomas en muchas especies suele ser mucho menor, lo que hace que este descubrimiento sea particularmente notable para los científicos.",""
"09/13/2025 18:45:08","https://infobae.com/venezuela/2025/09/13/la-dictadura-de-maduro-dijo-que-un-buque-militar-de-eeuu-intercepto-una-embarcacion-venezolana-en-el-mar-caribe/","La dictadura de Maduro dijo que un buque militar de EEUU interceptó una embarcación venezolana en el mar Caribe","Maduro denuncia interceptación de embarcación venezolana por buque militar de EE.UU. en el Caribe","https://encrypted-tbn0.gstatic.com/images?q=tbn:ANd9GcRcMLgvvDmHQOaHenptpX0WNIHNmsSVK8sbEbKWyEbcy0yS6eDjvIZER7t0_w&amp;s","La dictadura de Nicolás Maduro denunció que un buque militar de Estados Unidos interceptó una embarcación venezolana en el mar Caribe. Según las autoridades venezolanas, este acto constituye una violación de sus derechos soberanos y una provocación por parte de Estados Unidos. La situación ocurre en un contexto de tensiones crecientes entre ambos países, exacerbadas por la crisis política y económica en Venezuela. El gobierno venezolano exigió el cese de lo que considera actos agresivos por parte de fuerzas extranjeras en sus aguas territoriales.","La dictadura de Nicolás Maduro denunció que un buque militar de Estados Unidos interceptó una embarcación venezolana en el mar Caribe. Según las autoridades venezolanas, este acto constituye una violación de sus derechos soberanos y una provocación por parte de Estados Unidos. La situación ocurre en un contexto de tensiones crecientes entre ambos países, exacerbadas por la crisis política y económica en Venezuela. El gobierno venezolano exigió el cese de lo que considera actos agresivos por parte de fuerzas extranjeras en sus aguas territoriales.",""
"09/13/2025 18:45:08","https://infobae.com/america/america-latina/2025/09/13/el-gobierno-de-ecuador-elimino-el-subsidio-al-diesel-y-aseguro-destinara-los-fondos-a-la-asistencia-social/","El Gobierno de Ecuador eliminó el subsidio al diésel y aseguró destinará los fondos a la asistencia social","Gobierno de Ecuador elimina subsidio al diésel y destinará fondos a asistencia social","https://encrypted-tbn0.gstatic.com/images?q=tbn:ANd9GcTlVK-551THZcjJqOB2IcQv4EVMlDy3fkkBa_TuW1mJQQIbXT7sKBmmj2uMqS4&amp;s","El gobierno de Ecuador ha decidido eliminar el subsidio al diésel, una medida que busca redirigir los recursos hacia programas de asistencia social. Las autoridades mencionaron que el ahorro generado por esta eliminación se destinará a mejorar la calidad de vida de los ciudadanos, en un contexto de reactivación económica. Esta decisión se enmarca en un esfuerzo por reducir el déficit fiscal del país y consolidar las finanzas públicas. La medida ha generado reacciones mixtas entre la población y analistas, quienes destacan la importancia de un equilibrio entre las ayudas sociales y la estabilidad económica.","El gobierno de Ecuador ha decidido eliminar el subsidio al diésel, una medida que busca redirigir los recursos hacia programas de asistencia social. Las autoridades mencionaron que el ahorro generado por esta eliminación se destinará a mejorar la calidad de vida de los ciudadanos, en un contexto de reactivación económica. Esta decisión se enmarca en un esfuerzo por reducir el déficit fiscal del país y consolidar las finanzas públicas. La medida ha generado reacciones mixtas entre la población y analistas, quienes destacan la importancia de un equilibrio entre las ayudas sociales y la estabilidad económica.",""
"09/13/2025 18:45:08","https://infobae.com/estados-unidos/2025/09/11/condenaron-a-la-esposa-del-ex-senador-bob-menendez-a-4-anos-y-medio-de-prision-por-participar-en-sobornos/","Condenaron a la esposa del ex senador Bob Menéndez a 4 años y medio de prisión por participar en sobornos","Esposa del ex senador Bob Menendez condenada a 4 años y medio de prisión por sobornos","https://encrypted-tbn0.gstatic.com/images?q=tbn:ANd9GcQl-z59ZI9aVCFiUCDwFIYd5bZiwCJ5w65clu_xn5_on6vSQs3H1_VYR8zvO84&amp;s","La esposa del exsenador Bob Menendez fue condenada a cuatro años y medio de prisión por su implicación en un esquema de sobornos relacionado con su esposo. La pareja fue acusada de recibir beneficios ilegales, incluidos dinero y regalos, a cambio de influir en decisiones políticas. La sentencia fue emitida por un juez federal, quien destacó la gravedad de las acciones de la acusada y su papel en facilitar los sobornos. La condena refleja un esfuerzo por combatir la corrupción en la política estadounidense.","La esposa del exsenador Bob Menendez fue condenada a cuatro años y medio de prisión por su implicación en un esquema de sobornos relacionado con su esposo. La pareja fue acusada de recibir beneficios ilegales, incluidos dinero y regalos, a cambio de influir en decisiones políticas. La sentencia fue emitida por un juez federal, quien destacó la gravedad de las acciones de la acusada y su papel en facilitar los sobornos. La condena refleja un esfuerzo por combatir la corrupción en la política estadounidense.",""
"09/13/2025 18:45:08","https://infobae.com/america/mundo/2025/09/12/la-asamblea-general-de-la-onu-avalo-la-solucion-de-dos-estados-e-israel-tildo-de-vergonzosa-la-votacion/","La Asamblea General de la ONU avaló la solución de dos Estados e Israel tildó de “vergonzosa” la votación","La Asamblea General de la ONU avaló la solución de dos Estados e Israel criticó la votación","https://encrypted-tbn0.gstatic.com/images?q=tbn:ANd9GcTkQ-lfwYAyhpxDUc5BhEJj-TGrmh4mSg4QNlq4Loi7wV5eG_5whXyZMt7niw&amp;s","La Asamblea General de la ONU aprobó una resolución que respalda la solución de dos estados para el conflicto israelí-palestino, lo que implica el establecimiento de un estado palestino independiente junto a Israel. El voto fue mayormente favorable, pero el embajador israelí calificó la decisión de vergonzosa e injusta, argumentando que no contribuye a la paz en la región. La votación refleja el apoyo internacional hacia una solución negociada al conflicto.","La Asamblea General de la ONU aprobó una resolución que respalda la solución de dos estados para el conflicto israelí-palestino, lo que implica el establecimiento de un estado palestino independiente junto a Israel. El voto fue mayormente favorable, pero el embajador israelí calificó la decisión de vergonzosa e injusta, argumentando que no contribuye a la paz en la región. La votación refleja el apoyo internacional hacia una solución negociada al conflicto.",""
"09/13/2025 18:45:08","https://infobae.com/america/mundo/2025/09/13/israel-derribo-otra-torre-utilizada-por-los-terroristas-de-hamas-en-ciudad-de-gaza/","Israel derribó otra torre utilizada por los terroristas de Hamas en ciudad de Gaza","Israel derribó otra torre utilizada por los terroristas de Hamas en Gaza","https://encrypted-tbn0.gstatic.com/images?q=tbn:ANd9GcTdSlOsnmJn-J5CtymcnWc7gg1G7JbRuRBQhi7qJPzG2Nm1GjALWkGPCX9kdg&amp;s","Israel ha derribado otra torre en la ciudad de Gaza que supuestamente era utilizada por Hamas para actividades terroristas. Este ataque forma parte de una serie de operaciones militares llevadas a cabo por el ejército israelí en respuesta a la violencia en la región. El compromiso de Israel de destruir la infraestructura de Hamas continúa, mientras la tensión entre ambas partes persiste.","Israel ha derribado otra torre en la ciudad de Gaza que supuestamente era utilizada por Hamas para actividades terroristas. Este ataque forma parte de una serie de operaciones militares llevadas a cabo por el ejército israelí en respuesta a la violencia en la región. El compromiso de Israel de destruir la infraestructura de Hamas continúa, mientras la tensión entre ambas partes persiste.",""
"09/13/2025 18:45:08","https://infobae.com/estados-unidos/2025/09/11/estos-son-los-lideres-de-estados-unidos-que-han-sido-blanco-de-la-violencia-politica-en-la-ultima-decada/","Estos son los líderes de Estados Unidos que han sido blanco de la violencia política en la última década","Líderes de Estados Unidos blanco de la violencia política en la última década","https://encrypted-tbn0.gstatic.com/images?q=tbn:ANd9GcRPHEUv1zH8zJRbz0J6r-9WSPEot6TMWAWvE-BSn9OFgN49TnWlolSzvHQUmg&amp;s","El artículo de Infobae aborda la violencia política en Estados Unidos, destacando varios líderes que han sido objetivo de agresiones en la última década. Se mencionan ataques físicos y amenazas que han afectado a figuras públicas en la política, reflejando un ambiente de creciente tensión y división. El informe también resalta el contexto en el que se han producido estos hechos, incluyendo factores como el extremismo político y el uso de redes sociales para incitar la violencia. Además, se citan ejemplos concretos de incidentes que han marcado este periodo y se analiza la repercusión que esta violencia tiene en la democracia y la participación política.","El artículo de Infobae aborda la violencia política en Estados Unidos, destacando varios líderes que han sido objetivo de agresiones en la última década. Se mencionan ataques físicos y amenazas que han afectado a figuras públicas en la política, reflejando un ambiente de creciente tensión y división. El informe también resalta el contexto en el que se han producido estos hechos, incluyendo factores como el extremismo político y el uso de redes sociales para incitar la violencia. Además, se citan ejemplos concretos de incidentes que han marcado este periodo y se analiza la repercusión que esta violencia tiene en la democracia y la participación política.",""
