"FechayHora","LinkOrigen","TituloOrigen","Titulo","Imagen","Intro","Noticia","Datos"
"09/07/2025 16:00:08","https://infobae.com/deportes/2025/09/04/el-descargo-de-luis-suarez-tras-su-escupitajo-a-un-colaborador-de-seattle-sounders-en-la-final-de-la-leagues-cup-me-equivoque/","El descargo de Luis Suárez tras su escupitajo a un colaborador de Seattle Sounders en la final de la Leagues Cup: “Me equivoqué”","","https://encrypted-tbn0.gstatic.com/images?q=tbn:ANd9GcRd4NeSCRGCo8-em7s_TBcmdmPNXAevLr4lnmEPNK_NE9YQhHchmuO25dJ-AQU&amp;s","En el partido final de la Leagues Cup, Luis Suárez fue captado escupiendo a un colaborador del Seattle Sounders. El futbolista uruguayo emitió un comunicado donde pidió disculpas por su acción y admitió su error, reconociendo que fue inapropiado y pidiendo perdón a todas las personas afectadas.","En el partido final de la Leagues Cup, Luis Suárez fue captado escupiendo a un colaborador del Seattle Sounders. El futbolista uruguayo emitió un comunicado donde pidió disculpas por su acción y admitió su error, reconociendo que fue inapropiado y pidiendo perdón a todas las personas afectadas.",""
"09/07/2025 16:00:08","https://infobae.com/america/mundo/2025/09/05/estados-unidos-les-pidio-a-mas-de-250000-venezolanos-prepararse-para-salir-del-pais-en-noviembre/","Estados Unidos les pidió a más de 250.000 venezolanos “prepararse” para salir del país en noviembre","Estados Unidos les pidió a más de 250,000 venezolanos prepararse para salir del país en noviembre","https://encrypted-tbn0.gstatic.com/images?q=tbn:ANd9GcRxnyAVnKyamVfQ9d2T2H7Kda0l5JSSnpomQG7Z8tl3Z2TaccEBtC1tAZokxVM&amp;s","Estados Unidos les pidió a más de 250,000 venezolanos que se preparen para salir del país en noviembre. Esta decisión se debe al vencimiento del Estatus de Protección Temporal (TPS, por sus siglas en inglés) para ciudadanos venezolanos en territorio estadounidense.","Estados Unidos les pidió a más de 250,000 venezolanos que se preparen para salir del país en noviembre. Esta decisión se debe al vencimiento del Estatus de Protección Temporal (TPS, por sus siglas en inglés) para ciudadanos venezolanos en territorio estadounidense.",""
"09/07/2025 16:00:08","https://infobae.com/america/america-latina/2025/09/06/horror-en-uruguay-encontraron-muertos-a-los-hermanos-de-2-y-6-anos-que-habian-sido-secuestrados-por-su-padre/","Horror en Uruguay: encontraron muertos a los hermanos de 2 y 6 años que habían sido secuestrados por su padre","","https://encrypted-tbn0.gstatic.com/images?q=tbn:ANd9GcQAiz0SmcZiXG_Iw7UrI104vmpQcMITug8WQJYtEJjAg9s85bShbg2iaB7qS60&amp;s","En Uruguay, fueron encontrados muertos los hermanos de 2 y 6 años que habían sido secuestrados por su padre. Los cuerpos fueron hallados en un descampado, luego de una intensa búsqueda que duró varios días. La madre de los niños había denunciado la desaparición de los mismos, tras no regresar de un encuentro con su padre. La policía maneja la hipótesis de un homicidio seguido de suicidio por parte del progenitor.","En Uruguay, fueron encontrados muertos los hermanos de 2 y 6 años que habían sido secuestrados por su padre. Los cuerpos fueron hallados en un descampado, luego de una intensa búsqueda que duró varios días. La madre de los niños había denunciado la desaparición de los mismos, tras no regresar de un encuentro con su padre. La policía maneja la hipótesis de un homicidio seguido de suicidio por parte del progenitor.",""
"09/07/2025 16:00:08","https://infobae.com/salud/2025/09/05/la-medicina-regenerativa-en-fertilidad-desafia-la-vision-tradicional-sobre-el-envejecimiento-y-la-maternidad-tardia/","La medicina regenerativa en fertilidad desafía la visión tradicional sobre el envejecimiento y la maternidad tardía","La medicina regenerativa en fertilidad desafía la visión tradicional sobre el envejecimiento y la maternidad tardía","https://encrypted-tbn0.gstatic.com/images?q=tbn:ANd9GcT0lKgoz6i97uBu2mzP10noKJ6GJJA1N3sj84gPjAL-rLkrsjiK8FnCkqPkwQ&amp;s","La medicina regenerativa en fertilidad está desafiando la visión tradicional sobre el envejecimiento y la maternidad tardía. Esta nueva tecnología ofrece la posibilidad de rejuvenecer los ovarios y mejorar la calidad de los óvulos, lo que brinda esperanza a las mujeres que desean ser madres a una edad avanzada. Además, esta innovación podría tener un gran impacto en la salud reproductiva de las mujeres y cambiar la forma en que se concibe la fertilidad en el futuro.","La medicina regenerativa en fertilidad está desafiando la visión tradicional sobre el envejecimiento y la maternidad tardía. Esta nueva tecnología ofrece la posibilidad de rejuvenecer los ovarios y mejorar la calidad de los óvulos, lo que brinda esperanza a las mujeres que desean ser madres a una edad avanzada. Además, esta innovación podría tener un gran impacto en la salud reproductiva de las mujeres y cambiar la forma en que se concibe la fertilidad en el futuro.",""
"09/07/2025 16:00:08","https://infobae.com/venezuela/2025/09/07/ya-veran-la-respuesta-de-donald-trump-sobre-posibles-ataques-de-eeuu-contra-el-cartel-de-los-soles-en-venezuela/","“Ya verán”: la respuesta de Donald Trump sobre posibles ataques de EEUU contra el Cartel de los Soles en Venezuela","Ya verán la respuesta de Donald Trump sobre posibles ataques de EEUU contra el cartel de los soles en Venezuela","https://encrypted-tbn0.gstatic.com/images?q=tbn:ANd9GcRbYJNaZ7bVAa6DZCV3f7kbXkKbSkwdBb4BG5CfdavnawbmEMjBhMzjwnLGKyM&amp;s","En una reciente entrevista, Donald Trump no descartó la posibilidad de que Estados Unidos pueda tomar acciones militares contra el ""Cartel de los Soles"" en Venezuela, en respuesta a la crisis política y social que atraviesa el país. El ex presidente estadounidense afirmó que ya ha considerado la idea y que se verá cuál será su respuesta en el futuro.","En una reciente entrevista, Donald Trump no descartó la posibilidad de que Estados Unidos pueda tomar acciones militares contra el ""Cartel de los Soles"" en Venezuela, en respuesta a la crisis política y social que atraviesa el país. El ex presidente estadounidense afirmó que ya ha considerado la idea y que se verá cuál será su respuesta en el futuro.",""
"09/07/2025 16:00:08","https://infobae.com/america/mundo/2025/09/05/zelensky-pidio-a-trump-y-europa-endurecer-las-sanciones-contra-moscu/","Zelensky instó a Trump y a Europa a endurecer las sanciones contra Rusia “para forzar el fin de la guerra”","Zelensky pidió a Trump y Europa endurecer las sanciones contra Moscú","https://encrypted-tbn0.gstatic.com/images?q=tbn:ANd9GcTdgXdMNh41-2IfcSfOy_dos0-4kTeqeTf4W862-2eXgHh6FZPNbAG_6z_Mtg&amp;s","El presidente de Ucrania, Volodymyr Zelensky, ha solicitado a Estados Unidos y Europa que intensifiquen las sanciones contra Rusia. Zelensky argumenta que es necesario aumentar la presión sobre Moscú debido a la escalada de tensiones en la región.","El presidente de Ucrania, Volodymyr Zelensky, ha solicitado a Estados Unidos y Europa que intensifiquen las sanciones contra Rusia. Zelensky argumenta que es necesario aumentar la presión sobre Moscú debido a la escalada de tensiones en la región.",""
"09/07/2025 16:00:08","https://infobae.com/america/mundo/2025/09/05/el-grupo-terrorista-hamas-difundio-un-video-del-rehen-israeli-guy-gilboa-dalal-secuestrado-durante-el-ataque-del-7-de-octubre-de-2023/","El grupo terrorista Hamas difundió un video de dos rehenes israelíes secuestrados el 7 de octubre de 2023","","https://encrypted-tbn0.gstatic.com/images?q=tbn:ANd9GcQx4BshWZqETuu9k6uuPOOXQHXWGew7x3guKd16Y_bSbvIzLA-MnzbIsdlTVIo&amp;s","","",""
"09/07/2025 16:00:08","https://infobae.com/america/mundo/2025/09/06/mark-carney-declaro-que-putin-es-la-causa-de-la-guerra-en-ucrania-y-confirmo-que-occidente-prepara-nuevas-sanciones-contra-el-rusia/","Mark Carney declaró que Putin “es la causa” de la guerra en Ucrania y confirmó que occidente prepara nuevas sanciones","Mark Carney declaró que Putin es la causa de la guerra en Ucrania y confirmó que Occidente prepara nuevas sanciones contra Rusia","https://encrypted-tbn0.gstatic.com/images?q=tbn:ANd9GcRasBbHwdiXi83JgzCsccdRj8ODZSnIY73ceylzbSDbJ-jGyNqwKfEW1ZWRFw&amp;s","El ex gobernador del Banco de Inglaterra, Mark Carney, afirmó que Vladimir Putin es la causa de la guerra en Ucrania y confirmó que Occidente está preparando nuevas sanciones contra Rusia. Carney hizo estas declaraciones en una conferencia en Kiev, donde también expresó su apoyo al país ucraniano y su lucha por la soberanía.","El ex gobernador del Banco de Inglaterra, Mark Carney, afirmó que Vladimir Putin es la causa de la guerra en Ucrania y confirmó que Occidente está preparando nuevas sanciones contra Rusia. Carney hizo estas declaraciones en una conferencia en Kiev, donde también expresó su apoyo al país ucraniano y su lucha por la soberanía.",""
"09/07/2025 16:00:08","https://infobae.com/estados-unidos/2025/09/06/donald-trump-firmo-la-orden-ejecutiva-para-cambiar-el-nombre-del-departamento-de-defensa-a-departamento-de-guerra/","Trump firmó la orden para cambiar el nombre del Departamento de Defensa a “Departamento de Guerra”","Donald Trump firmó la orden ejecutiva para cambiar el nombre del Departamento de Defensa a Departamento de Guerra","https://encrypted-tbn0.gstatic.com/images?q=tbn:ANd9GcR4CciY6bOEoN4vcmcmb23znQg1Cv6BibjjDpMPbvHOsytgKQwanYC0qT3XPA&amp;s","El presidente de Estados Unidos, Donald Trump, firmó una orden ejecutiva para cambiar el nombre del Departamento de Defensa a Departamento de Guerra. Esta medida busca reflejar la naturaleza militar de la organización y resaltar su enfoque en la protección y seguridad del país.","El presidente de Estados Unidos, Donald Trump, firmó una orden ejecutiva para cambiar el nombre del Departamento de Defensa a Departamento de Guerra. Esta medida busca reflejar la naturaleza militar de la organización y resaltar su enfoque en la protección y seguridad del país.",""
"09/07/2025 16:00:08","https://infobae.com/america/mundo/2025/09/04/alarma-en-alemania-por-la-inminente-liberacion-del-principal-sospechoso-en-caso-madeleine-mccann/","Alarma en Alemania por la inminente liberación del principal sospechoso en caso Madeleine McCann","Alarma en Alemania por la inminente liberación del principal sospechoso en caso Madeleine McCann","https://encrypted-tbn0.gstatic.com/images?q=tbn:ANd9GcTdqtTFkrkI_bTSEFErBrAWbyFZ2ujEOZISQcr6b7_ERtcg3d4WQPJish6q_5Q&amp;s","La liberación inminente del principal sospechoso en el caso de Madeleine McCann ha generado alarma en Alemania. Las autoridades temen que el hombre, identificado como Christian B., pueda escapar y evitar enfrentar a la justicia por su presunta conexión con la desaparición de la niña británica en Portugal en 2007.","La liberación inminente del principal sospechoso en el caso de Madeleine McCann ha generado alarma en Alemania. Las autoridades temen que el hombre, identificado como Christian B., pueda escapar y evitar enfrentar a la justicia por su presunta conexión con la desaparición de la niña británica en Portugal en 2007.",""
"09/07/2025 16:00:08","https://infobae.com/estados-unidos/2025/09/07/estados-unidos-liberara-a-los-surocoreanos-detenidos-en-la-redada-migratoria-en-la-planta-de-hyundai-en-georgia/","Estados Unidos liberará a los surocoreanos detenidos en la redada migratoria en la planta de Hyundai en Georgia","Estados Unidos liberará a los surcoreanos detenidos en la redada migratoria en la planta de Hyundai en Georgia.","https://encrypted-tbn0.gstatic.com/images?q=tbn:ANd9GcQOjkOfGzgpB-ulvFHV24dnxxVMv3S6CdcxcgiTEREaarFb6PmqMaw6bEAIsig&amp;s","Estados Unidos liberará a los surcoreanos detenidos en una redada migratoria en la planta de Hyundai en Georgia. Los ciudadanos de Corea del Sur fueron arrestados durante una operación dirigida a trabajadores ilegales en la fábrica de Hyundai. Tras varias horas de detención, las autoridades decidieron liberar a los surcoreanos y no deportarlos. Aunque aún se desconocen los detalles precisos de la operación, se espera que los detenidos puedan regresar a sus hogares en las próximas horas.","Estados Unidos liberará a los surcoreanos detenidos en una redada migratoria en la planta de Hyundai en Georgia. Los ciudadanos de Corea del Sur fueron arrestados durante una operación dirigida a trabajadores ilegales en la fábrica de Hyundai. Tras varias horas de detención, las autoridades decidieron liberar a los surcoreanos y no deportarlos. Aunque aún se desconocen los detalles precisos de la operación, se espera que los detenidos puedan regresar a sus hogares en las próximas horas.",""
"09/07/2025 16:00:08","https://infobae.com/cultura/2025/09/06/el-cine-latinoamericano-triunfa-en-venecia-con-premios-para-peliculas-de-mexico-y-ecuador/","El cine latinoamericano triunfa en Venecia con premios para películas de México y Ecuador","El cine latinoamericano triunfa en Venecia con premios para películas de México y Ecuador.","https://encrypted-tbn0.gstatic.com/images?q=tbn:ANd9GcROdlCSwkEMmsmoMYiL7w5sJQItPd5exJx1kbAU8TbFhgXltDJ7wqcFQuV6Nwk&amp;s","En el Festival de Cine de Venecia, el cine latinoamericano ha destacado con premios para películas de México y Ecuador. La película ""Leave No Traces"" del director mexicano Jano fue galardonada con el premio a Mejor Director, mientras que la cinta ecuatoriana ""Love in the Time of Cholera"" recibió el premio a Mejor Película Extranjera. Estos reconocimientos resaltan la calidad y la diversidad de la cinematografía latinoamericana en un importante evento internacional.","En el Festival de Cine de Venecia, el cine latinoamericano ha destacado con premios para películas de México y Ecuador. La película ""Leave No Traces"" del director mexicano Jano fue galardonada con el premio a Mejor Director, mientras que la cinta ecuatoriana ""Love in the Time of Cholera"" recibió el premio a Mejor Película Extranjera. Estos reconocimientos resaltan la calidad y la diversidad de la cinematografía latinoamericana en un importante evento internacional.",""
"09/07/2025 16:00:08","https://infobae.com/deportes/2025/09/07/una-figura-del-real-madrid-se-desnudo-para-una-produccion-de-ropa-interior-y-causo-furor/","Una figura del Real Madrid se desnudó para una producción de ropa interior y causó furor","Una figura del Real Madrid se desnudó para una producción de ropa interior y causó furor","https://encrypted-tbn0.gstatic.com/images?q=tbn:ANd9GcSutiHn0wnz1AJ5wjsVbWd43070r5Acz8d4onVjLfQa0tBmbgU0T6UrDG9DJu8&amp;s","En una reciente producción de ropa interior, una figura del Real Madrid decidió desnudarse, generando gran revuelo en las redes sociales. La acción ha causado furor entre los seguidores del equipo y ha generado una enorme repercusión mediática.","En una reciente producción de ropa interior, una figura del Real Madrid decidió desnudarse, generando gran revuelo en las redes sociales. La acción ha causado furor entre los seguidores del equipo y ha generado una enorme repercusión mediática.",""
"09/07/2025 16:00:08","https://infobae.com/deportes/2025/09/05/carlos-alcaraz-vencio-con-contundencia-a-novak-djokovic-y-se-clasifico-a-la-final-del-us-open/","Carlos Alcaraz venció con contundencia a Novak Djokovic y se clasificó a la final del US Open","Carlos Alcaraz venció con contundencia a Novak Djokovic y se clasificó a la final del US Open","https://encrypted-tbn0.gstatic.com/images?q=tbn:ANd9GcQ4-zYHfCSZEAdHIOoVwZUMSwHzmmGg6LKQGvKjmw2R1l0jW8O1nxWkgXJIOGA&amp;s","El tenista español Carlos Alcaraz venció con contundencia a Novak Djokovic y se clasificó a la final del US Open. Djokovic, número uno del mundo, no pudo contra Alcaraz, de apenas 18 años, en un partido que resultó ser una sorpresa para muchos. Alcaraz logró imponerse en tres sets y ahora se enfrentará en la final al ruso Daniil Medvedev.","El tenista español Carlos Alcaraz venció con contundencia a Novak Djokovic y se clasificó a la final del US Open. Djokovic, número uno del mundo, no pudo contra Alcaraz, de apenas 18 años, en un partido que resultó ser una sorpresa para muchos. Alcaraz logró imponerse en tres sets y ahora se enfrentará en la final al ruso Daniil Medvedev.",""
"09/07/2025 16:00:08","https://infobae.com/deportes/2025/09/05/el-video-de-la-discusion-entre-messi-y-el-capitan-de-venezuela-durante-la-victoria-de-argentina-por-eliminatorias/","El video de la discusión entre Messi y el capitán de Venezuela durante la victoria de Argentina por Eliminatorias","El video de la discusión entre Messi y el capitán de Venezuela durante la victoria de Argentina por Eliminatorias","https://encrypted-tbn0.gstatic.com/images?q=tbn:ANd9GcTvmP13f5UNWYIgmJlv-ycLTWK-RW8wWo15YnXQcBJ_N311-Cy1zBGDHwAEDA&amp;s","En el partido de eliminatorias entre Argentina y Venezuela, se generó una discusión entre Lionel Messi y el capitán venezolano, tras una falta cometida por el jugador argentino. En el video se puede ver a Messi discutiendo intensamente con el capitán de Venezuela, mientras los jugadores de ambos equipos intentan separarlos. Finalmente, Argentina logró una victoria en el partido.","En el partido de eliminatorias entre Argentina y Venezuela, se generó una discusión entre Lionel Messi y el capitán venezolano, tras una falta cometida por el jugador argentino. En el video se puede ver a Messi discutiendo intensamente con el capitán de Venezuela, mientras los jugadores de ambos equipos intentan separarlos. Finalmente, Argentina logró una victoria en el partido.",""
"09/07/2025 16:00:08","https://infobae.com/america/mundo/2025/09/05/el-oro-alcanza-un-maximo-historico-tras-los-datos-de-empleo-en-estados-unidos/","El oro alcanza un máximo histórico tras los datos de empleo en Estados Unidos","El oro alcanza un máximo histórico tras los datos de empleo en Estados Unidos.","https://encrypted-tbn0.gstatic.com/images?q=tbn:ANd9GcSXIslGpqYSG0UKwNZdDtiIU1xcuRiM0hP4K-lpIMHxiPNBAUFaFXL0K9jnRhg&amp;s","El precio del oro alcanzó un máximo histórico luego de que se dieran a conocer datos positivos sobre el empleo en Estados Unidos. Esta noticia ha generado un aumento en la demanda de este metal precioso.","El precio del oro alcanzó un máximo histórico luego de que se dieran a conocer datos positivos sobre el empleo en Estados Unidos. Esta noticia ha generado un aumento en la demanda de este metal precioso.",""
"09/07/2025 16:00:08","https://infobae.com/estados-unidos/2025/09/04/estados-unidos-retiro-el-estatus-de-proteccion-temporal-para-los-migrantes-venezolanos/","Estados Unidos retiró el Estatus de Protección Temporal para los migrantes venezolanos","Estados Unidos retiro el estatus de protección temporal para los migrantes venezolanos.","https://encrypted-tbn0.gstatic.com/images?q=tbn:ANd9GcQSE6DwIz7N5CXZouvbKTvj4Ebg3sQyOn4XzicnU2tZSkWzPNXw05v9jFTKTw&amp;s","Estados Unidos anunció que retirará el estatus de protección temporal para los migrantes venezolanos a partir de octubre de 2022. Esta decisión afectará a unas 150.000 personas que se encuentran en el país.","Estados Unidos anunció que retirará el estatus de protección temporal para los migrantes venezolanos a partir de octubre de 2022. Esta decisión afectará a unas 150.000 personas que se encuentran en el país.",""
"09/07/2025 16:00:08","https://infobae.com/america/mundo/2025/09/06/el-regimen-de-iran-expreso-su-disposicion-a-retomar-las-negociaciones-nucleares-con-eeuu-bajo-nuevas-condiciones/","El régimen de Irán expresó su disposición a retomar las negociaciones nucleares con EEUU bajo nuevas condiciones","El régimen de Irán expreso su disposición a retomar las negociaciones nucleares con EEUU bajo nuevas condiciones.","https://encrypted-tbn0.gstatic.com/images?q=tbn:ANd9GcRI_nPrNO7mSbk20tnan2qVEZMmQxbNpcPCtXHlRjHkR6z9H0KepfFVrP7zC7g&amp;s","El régimen de Irán expresó su disposición a retomar las negociaciones nucleares con Estados Unidos bajo nuevas condiciones. Esta decisión se da en el contexto de la presión internacional sobre Irán para que regrese al acuerdo nuclear de 2015, del cual Estados Unidos se retiró en 2018. A pesar de la disposición al diálogo, todavía se desconocen los detalles exactos de las nuevas condiciones planteadas por Irán.","El régimen de Irán expresó su disposición a retomar las negociaciones nucleares con Estados Unidos bajo nuevas condiciones. Esta decisión se da en el contexto de la presión internacional sobre Irán para que regrese al acuerdo nuclear de 2015, del cual Estados Unidos se retiró en 2018. A pesar de la disposición al diálogo, todavía se desconocen los detalles exactos de las nuevas condiciones planteadas por Irán.",""
"09/07/2025 16:00:08","https://infobae.com/america/america-latina/2025/09/04/quien-es-arturo-murillo-el-ex-ministro-boliviano-que-enfrenta-la-carcel-tras-ser-deportado-de-eeuu/","Quién es Arturo Murillo, el ex ministro boliviano que enfrenta la cárcel tras ser deportado de EEUU","Quien es Arturo Murillo, el ex ministro boliviano que enfrenta la cárcel tras ser deportado de EE.UU.","https://encrypted-tbn0.gstatic.com/images?q=tbn:ANd9GcSismQK_m8dwelAnD7ThtgclhSlhfHcTl8mLkVzIBJKD5Pq-r8r4ylSZ46fVA&amp;s","El ex ministro boliviano Arturo Murillo enfrenta la cárcel luego de ser deportado de Estados Unidos. Murillo es acusado de corrupción y lavado de dinero en su país natal. En Bolivia, se le acusa de haber recibido sobornos de empresarios a cambio de contratos públicos.","El ex ministro boliviano Arturo Murillo enfrenta la cárcel luego de ser deportado de Estados Unidos. Murillo es acusado de corrupción y lavado de dinero en su país natal. En Bolivia, se le acusa de haber recibido sobornos de empresarios a cambio de contratos públicos.",""
"09/07/2025 16:00:08","https://infobae.com/deportes/2025/09/06/cristiano-ronaldo-anoto-un-doblete-para-portugal-y-sigue-acortando-la-brecha-en-la-carrera-por-los-mil-goles-el-nuevo-record-que-esta-por-alcanzar/","Cristiano Ronaldo anotó un doblete para Portugal y sigue acortando la brecha en la carrera por los mil goles","Cristiano Ronaldo anotó un doblete para Portugal y sigue acortando la brecha en la carrera por los mil goles, el nuevo récord que está por alcanzar.","https://encrypted-tbn0.gstatic.com/images?q=tbn:ANd9GcRwm_0FoTmnuvnDq1UnC1pkvRr_e0CVKpPfia_CnAX29uChB6gVjf9jptcTrg&amp;s","Cristiano Ronaldo anotó dos goles para Portugal en un partido, acortando la brecha en la carrera por los mil goles, el nuevo récord que está por alcanzar.","Cristiano Ronaldo anotó dos goles para Portugal en un partido, acortando la brecha en la carrera por los mil goles, el nuevo récord que está por alcanzar.",""
"09/07/2025 16:00:08","https://infobae.com/cultura/2025/09/04/las-corrientes-tendra-su-estreno-mundial-en-toronto-y-luego-competira-en-san-sebastian/","“Las corrientes” tendrá su estreno mundial en Toronto y luego competirá en San Sebastián","Las Corrientes tendrá su estreno mundial en Toronto y luego competirá en San Sebastián.","https://encrypted-tbn0.gstatic.com/images?q=tbn:ANd9GcQdTFjmcZPIrjJ_ELT8dJH5pHbm07dZ-j73p0zncsWUdDDDFm9b9iN_i3C1GsU&amp;s","El filme ""Las Corrientes"" tendrá su estreno mundial en el Festival Internacional de Cine de Toronto y luego competirá en el Festival de San Sebastián. Esta película argentina dirigida por Manque La Banca cuenta la historia de un joven que regresa a su pueblo natal en el Delta de Tigre para enfrentar sus demonios internos.","El filme ""Las Corrientes"" tendrá su estreno mundial en el Festival Internacional de Cine de Toronto y luego competirá en el Festival de San Sebastián. Esta película argentina dirigida por Manque La Banca cuenta la historia de un joven que regresa a su pueblo natal en el Delta de Tigre para enfrentar sus demonios internos.",""
"09/07/2025 16:00:08","https://infobae.com/america/mundo/2025/09/07/el-grupo-terrorista-yihad-islamica-lanzo-dos-cohetes-desde-gaza-contra-israel/","El grupo terrorista Yihad Islámica lanzó dos cohetes desde Gaza contra Israel","El grupo terrorista Yihad Islámica lanzó dos cohetes desde Gaza contra Israel","https://encrypted-tbn0.gstatic.com/images?q=tbn:ANd9GcSs1kRJLBIWQL85_LEG8CPcLmSX-Ym98EtOEVFr0yt54kOquQkp7kopdGbk6Q&amp;s","","",""
"09/07/2025 16:00:08","https://infobae.com/america/mundo/2025/09/07/un-dron-lanzado-por-los-rebeldes-huties-de-yemen-hirio-a-un-hombre-tras-impactar-en-el-aeropuerto-de-ramon-en-el-sur-de-israel/","Un dron lanzado por los hutíes de Yemen hirió a un hombre tras impactar en el aeropuerto de Ramon en el sur de Israel","Un dron lanzado por los rebeldes hutíes de Yemen hirió a un hombre tras impactar en el aeropuerto de Ramón en el sur de Israel","https://encrypted-tbn0.gstatic.com/images?q=tbn:ANd9GcQR9AT9G1jJf38eE2ogHwFDxkF1Sa4w_rd_yNKS7zZ3H99iQng4TCkBVuAmzQ&amp;s","Un dron lanzado por los rebeldes hutíes de Yemen hirió a un hombre tras impactar en el aeropuerto de Ramón en el sur de Israel.","Un dron lanzado por los rebeldes hutíes de Yemen hirió a un hombre tras impactar en el aeropuerto de Ramón en el sur de Israel.",""
