"FechayHora","LinkOrigen","TituloOrigen","Titulo","Imagen","Intro","Noticia","Datos"
"09/11/2025 11:25:43","https://infobae.com/venezuela/2025/09/10/se-estreno-narcoterroristas-la-miniserie-que-expone-al-cartel-de-los-soles-y-la-crisis-de-venezuela-con-la-dictadura-de-maduro/","Se estrenó Narcoterroristas, la miniserie que expone al Cartel de los Soles y la crisis de Venezuela con la dictadura de Maduro","Estreno de la miniserie Narcoterroristas que revela el cartel de los soles y la crisis en Venezuela bajo la dictadura de Maduro","https://encrypted-tbn0.gstatic.com/images?q=tbn:ANd9GcTlVCYIWML5ufUBlrNj3vAMa9PvGtxgHgv5r3-76kWPepoVOvGvZleZNgUrxg&amp;s","Se ha estrenado la miniserie ""Narcoterroristas"", que aborda la vinculación entre el Cartel de los Soles y la crisis venezolana bajo el régimen de Nicolás Maduro. La serie presenta una narrativa sobre el narcotráfico en el país, así como el impacto de la corrupción y la violación de derechos humanos. A través de testimonios y dramatizaciones, se busca arrojar luz sobre la situación actual en Venezuela, destacando las alianzas entre las autoridades y el crimen organizado. La producción ha generado interés y debate en torno a los temas tratados.","Se ha estrenado la miniserie ""Narcoterroristas"", que aborda la vinculación entre el Cartel de los Soles y la crisis venezolana bajo el régimen de Nicolás Maduro. La serie presenta una narrativa sobre el narcotráfico en el país, así como el impacto de la corrupción y la violación de derechos humanos. A través de testimonios y dramatizaciones, se busca arrojar luz sobre la situación actual en Venezuela, destacando las alianzas entre las autoridades y el crimen organizado. La producción ha generado interés y debate en torno a los temas tratados.",""
"09/11/2025 11:25:43","https://infobae.com/movant/2025/09/07/la-logistica-del-futuro-sostenible-digital-y-con-fuertes-brechas-entre-paises/","La logística del futuro: sostenible, digital y con fuertes brechas entre países","La logística del futuro: sostenible, digital y con fuertes brechas entre países","https://encrypted-tbn0.gstatic.com/images?q=tbn:ANd9GcTqG4LlGuHGuyR9tFHgX8usvm5OyLiQ5LpJ26a7rDHalXC3vc7taDxeEDVtQA&amp;s","El artículo habla sobre cómo la logística del futuro será sostenible, digital y presentará fuertes brechas entre los diferentes países. Se destaca la importancia de adaptarse a las nuevas tecnologías y prácticas sostenibles para garantizar la eficiencia en el transporte de mercancías a nivel global. Además, se menciona que existen disparidades en cuanto a la infraestructura tecnológica y las políticas de cada país, lo que puede afectar la competitividad en el mercado internacional.","El artículo habla sobre cómo la logística del futuro será sostenible, digital y presentará fuertes brechas entre los diferentes países. Se destaca la importancia de adaptarse a las nuevas tecnologías y prácticas sostenibles para garantizar la eficiencia en el transporte de mercancías a nivel global. Además, se menciona que existen disparidades en cuanto a la infraestructura tecnológica y las políticas de cada país, lo que puede afectar la competitividad en el mercado internacional.",""
"09/11/2025 11:25:43","https://infobae.com/deportes/2025/09/10/nunca-vimos-algo-asi-la-fuerte-denuncia-que-prepara-brasil-ante-conmebol-tras-la-derrota-ante-bolivia-en-el-alto/","“Nunca vimos algo así”: la fuerte denuncia que prepara Brasil ante la FIFA tras la derrota con Bolivia en El Alto","Brasil denuncia a Conmebol tras derrota ante Bolivia en el Alto","https://encrypted-tbn0.gstatic.com/images?q=tbn:ANd9GcQsMspIG4rJGR6quMDFaXd29E3Hvu5LNBJ4_mNA_5UmVV-RMTD24TXPI7JuCA&amp;s","Brasil está preparando una fuerte denuncia ante la Conmebol tras su derrota ante Bolivia en el partido de eliminatorias para el Mundial. La selección brasileña considera que hubo irregularidades en la actuación del árbitro, lo que afectó el desarrollo del juego. Esta situación ha generado un clima de frustración en el equipo y en la prensa brasileña, que ha cuestionado las decisiones arbitrales y su impacto en el resultado del encuentro. La Federación Brasileña de Fútbol está en el proceso de recopilar evidencias y testimonios para presentar su queja formal.","Brasil está preparando una fuerte denuncia ante la Conmebol tras su derrota ante Bolivia en el partido de eliminatorias para el Mundial. La selección brasileña considera que hubo irregularidades en la actuación del árbitro, lo que afectó el desarrollo del juego. Esta situación ha generado un clima de frustración en el equipo y en la prensa brasileña, que ha cuestionado las decisiones arbitrales y su impacto en el resultado del encuentro. La Federación Brasileña de Fútbol está en el proceso de recopilar evidencias y testimonios para presentar su queja formal.",""
"09/11/2025 11:25:43","https://infobae.com/sociedad/policiales/2025/09/09/video-un-conductor-de-apps-atropello-a-un-ciclista-bajo-del-auto-y-corrio-el-cuerpo-para-escapar-con-una-pasajera-a-bordo/","Un conductor de apps atropelló a un ciclista, bajó del auto y corrió el cuerpo para escapar con una pasajera a bordo","","https://encrypted-tbn0.gstatic.com/images?q=tbn:ANd9GcQP-4wIBGXhhwWw0rYJGIZThbMn88s2JCXmNA50W2DgWnF7Wi8HWZTb4g5xqA&amp;s","En un incidente impactante, un conductor de aplicaciones atropelló a un ciclista y luego bajó del auto para correr el cuerpo y escapar con una pasajera a bordo. El hecho quedó registrado en video y la policía está investigando lo ocurrido.","En un incidente impactante, un conductor de aplicaciones atropelló a un ciclista y luego bajó del auto para correr el cuerpo y escapar con una pasajera a bordo. El hecho quedó registrado en video y la policía está investigando lo ocurrido.",""
"09/11/2025 11:25:43","https://infobae.com/venezuela/2025/09/09/ex-mandatarios-iberoamericanos-alertaron-sobre-los-riesgos-para-maria-corina-machado-y-exigieron-garantias-a-su-integridad/","Ex mandatarios iberoamericanos alertaron sobre los riesgos para María Corina Machado y exigieron garantías a su integridad","Ex mandatarios iberoamericanos alertaron sobre los riesgos para María Corina Machado y exigieron garantías a su integridad","https://encrypted-tbn0.gstatic.com/images?q=tbn:ANd9GcQhc_u6WTi59gGLtpZuMScFLeUN3KjnO2BFnfu_FxNY9vLQOY1nryL5-j5m4w&amp;s","El artículo menciona que ex mandatarios iberoamericanos expresaron su preocupación por los riesgos que enfrenta María Corina Machado en Venezuela. Exigieron garantías para su integridad y manifestaron su apoyo a la líder opositora.","El artículo menciona que ex mandatarios iberoamericanos expresaron su preocupación por los riesgos que enfrenta María Corina Machado en Venezuela. Exigieron garantías para su integridad y manifestaron su apoyo a la líder opositora.",""
"09/11/2025 11:25:43","https://infobae.com/america/mundo/2025/09/09/quien-es-sebastien-lecornu-el-animal-politico-que-macron-eligio-para-estabilizar-francia/","Quién es Sébastien Lecornu, el “animal político” que Macron eligió para estabilizar Francia","Quién es Sébastien Lecornu, el animal político que Macron eligió para estabilizar Francia","https://encrypted-tbn0.gstatic.com/images?q=tbn:ANd9GcQY-qYsYgL0NickgkaYsFshfCmFBhotWNriSWkMFJYz2jxDlOe_DVEMQBWh-A&amp;s","Sebastien Lecornu, un político francés de 35 años, ha sido señalado como el elegido por Emmanuel Macron para estabilizar Francia. Lecornu ha pasado por varios cargos políticos y se le considera un ""animal político"". Macron confía en él para fortalecer su gobierno y su partido de cara a las próximas elecciones.","Sebastien Lecornu, un político francés de 35 años, ha sido señalado como el elegido por Emmanuel Macron para estabilizar Francia. Lecornu ha pasado por varios cargos políticos y se le considera un ""animal político"". Macron confía en él para fortalecer su gobierno y su partido de cara a las próximas elecciones.",""
"09/11/2025 11:25:43","https://infobae.com/economia/2025/09/10/el-fundador-de-oracle-supero-a-elon-musk-y-es-la-nueva-persona-mas-rica-del-mundo-cuales-son-sus-principales-activos/","El fundador de Oracle superó a Elon Musk y es la nueva persona más rica del mundo: cuáles son sus principales activos","El fundador de Oracle superó a Elon Musk y es la nueva persona más rica del mundo","https://encrypted-tbn0.gstatic.com/images?q=tbn:ANd9GcRFXH5qMDk-wPym_NI85woLQhQ-eqqk-yRTpcQYiEGg3X1PcIImipzz00aNcmE&amp;s","Larry Ellison, el fundador de Oracle, ha superado a Elon Musk y se ha convertido en la persona más rica del mundo, según un reciente informe. Su fortuna, estimada en 130.9 mil millones de dólares, ha crecido significativamente debido al aumento en el valor de las acciones de Oracle. Ellison posee alrededor del 42% de la compañía, y su riqueza se ha visto impulsada por la transformación de Oracle hacia servicios en la nube. En contraste, Elon Musk, con un patrimonio neto de 130.8 mil millones de dólares, ha visto fluctuar su fortuna en función del desempeño de Tesla y otras inversiones.","Larry Ellison, el fundador de Oracle, ha superado a Elon Musk y se ha convertido en la persona más rica del mundo, según un reciente informe. Su fortuna, estimada en 130.9 mil millones de dólares, ha crecido significativamente debido al aumento en el valor de las acciones de Oracle. Ellison posee alrededor del 42% de la compañía, y su riqueza se ha visto impulsada por la transformación de Oracle hacia servicios en la nube. En contraste, Elon Musk, con un patrimonio neto de 130.8 mil millones de dólares, ha visto fluctuar su fortuna en función del desempeño de Tesla y otras inversiones.",""
"09/11/2025 11:25:43","https://infobae.com/tendencias/2025/09/09/como-eliminar-los-acaros-de-casa-facilmente-lo-que-hay-que-saber/","¿Cómo eliminar los ácaros de casa fácilmente? Lo que hay que saber","Cómo eliminar los ácaros de casa fácilmente: lo que hay que saber.","https://encrypted-tbn0.gstatic.com/images?q=tbn:ANd9GcQ2w5icC4GrHHWWIYr5SLc2fq238kirB21PRpoAw_qX9NHLlw0Jw3UCUWT3fg&amp;s","El artículo ofrece consejos para eliminar los ácaros del hogar de manera efectiva. Entre las recomendaciones se incluye mantener la casa limpia, lavar la ropa de cama con regularidad, controlar la humedad y utilizar fundas anti-ácaros en colchones y almohadas. Además, se sugiere aspirar los muebles y alfombras de forma frecuente, así como ventilar la casa para reducir la presencia de estos microorganismos.","El artículo ofrece consejos para eliminar los ácaros del hogar de manera efectiva. Entre las recomendaciones se incluye mantener la casa limpia, lavar la ropa de cama con regularidad, controlar la humedad y utilizar fundas anti-ácaros en colchones y almohadas. Además, se sugiere aspirar los muebles y alfombras de forma frecuente, así como ventilar la casa para reducir la presencia de estos microorganismos.",""
"09/11/2025 11:25:43","https://infobae.com/estados-unidos/2025/09/10/wall-street-volvio-a-terminar-en-maximos-historicos-de-la-mano-de-oracle/","Wall Street volvió a terminar en máximos históricos de la mano de Oracle","Wall Street alcanzó máximos históricos impulsado por Oracle","https://encrypted-tbn0.gstatic.com/images?q=tbn:ANd9GcQ0sFBuZFjwSb8X4nkHZD6JfSOl6GvyPFgDbnZu0aY6pdgLEsr4mQ6MKzRKiXs&amp;s","Wall Street alcanzó máximos históricos impulsado por el rendimiento de Oracle, cuya fuerte presentación de resultados sorprendió a los analistas y generó un optimismo generalizado en el mercado. Las acciones de la compañía subieron considerablemente, contribuyendo al avance del índice Dow Jones y del S&P 500. Este aumento se produce en un contexto de datos económicos que sugieren una posible desaceleración en el crecimiento, pero el ánimo de los inversionistas se mantiene positivo ante las expectativas de una economía robusta.","Wall Street alcanzó máximos históricos impulsado por el rendimiento de Oracle, cuya fuerte presentación de resultados sorprendió a los analistas y generó un optimismo generalizado en el mercado. Las acciones de la compañía subieron considerablemente, contribuyendo al avance del índice Dow Jones y del S&P 500. Este aumento se produce en un contexto de datos económicos que sugieren una posible desaceleración en el crecimiento, pero el ánimo de los inversionistas se mantiene positivo ante las expectativas de una economía robusta.",""
"09/11/2025 11:25:43","https://infobae.com/america/mundo/2025/09/10/el-primer-ministro-de-qatar-dijo-que-el-ataque-de-israel-a-doha-mato-cualquier-esperanza-de-un-acuerdo-por-los-rehenes-en-gaza/","El primer ministro de Qatar dijo que el ataque de Israel a Doha “mató cualquier esperanza” de un acuerdo por los rehenes en Gaza","El primer ministro de Qatar afirma que el ataque de Israel a Doha destruyó las esperanzas de un acuerdo por los rehenes en Gaza","https://encrypted-tbn0.gstatic.com/images?q=tbn:ANd9GcRp5g3dQ-qxaoSPEb0AkfT4l_v-FGVcy5m77ATf3yRy-3i1TEh7K-RQ44QTj9M&amp;s","El primer ministro de Qatar expresó que el ataque de Israel en Doha ha aniquilado cualquier posibilidad de llegar a un acuerdo sobre la situación de los rehenes en Gaza. Esta declaración se produce en medio de crecientes tensiones por el conflicto, donde Qatar ha estado desempeñando un papel de intermediario en las negociaciones. El primer ministro también subrayó la gravedad de las acciones israelíes y su impacto en los esfuerzos diplomáticos actuales.","El primer ministro de Qatar expresó que el ataque de Israel en Doha ha aniquilado cualquier posibilidad de llegar a un acuerdo sobre la situación de los rehenes en Gaza. Esta declaración se produce en medio de crecientes tensiones por el conflicto, donde Qatar ha estado desempeñando un papel de intermediario en las negociaciones. El primer ministro también subrayó la gravedad de las acciones israelíes y su impacto en los esfuerzos diplomáticos actuales.",""
"09/11/2025 11:25:43","https://infobae.com/cultura/2025/09/09/revolucion-en-la-national-gallery-de-londres-por-primera-vez-incluira-arte-moderno/","Revolución en la National Gallery de Londres: por primera vez incluirá arte moderno","Revolucion en la National Gallery de Londres: por primera vez incluira arte moderno","https://encrypted-tbn0.gstatic.com/images?q=tbn:ANd9GcTAw9SmQAbWd78F7BQm39PC8n0Oxivnr4e_ZGTgIadQ_MfArTqWstMmM9oZVA&amp;s","La National Gallery de Londres realizará una revolución en su exposición, al incluir arte moderno por primera vez en su historia. Esta decisión busca atraer a un público más joven y diverso, mostrando obras de artistas contemporáneos junto a las tradicionales de grandes maestros. La iniciativa ha generado tanto críticas como elogios, pero el museo sigue adelante con su objetivo de expandir su colección y atraer a nuevas audiencias.","La National Gallery de Londres realizará una revolución en su exposición, al incluir arte moderno por primera vez en su historia. Esta decisión busca atraer a un público más joven y diverso, mostrando obras de artistas contemporáneos junto a las tradicionales de grandes maestros. La iniciativa ha generado tanto críticas como elogios, pero el museo sigue adelante con su objetivo de expandir su colección y atraer a nuevas audiencias.",""
"09/11/2025 11:25:43","https://infobae.com/cultura/2025/09/10/dan-brown-el-autor-de-el-codigo-da-vinci-lanza-una-novela-de-misterio-que-es-un-homenaje-al-poder-de-los-libros/","Dan Brown: el autor de “El código Da Vinci” lanza una novela de misterio que es un homenaje al poder de los libros","Dan Brown lanza una novela de misterio que rinde homenaje al poder de los libros","https://encrypted-tbn0.gstatic.com/images?q=tbn:ANd9GcQIv0Nkp7LhEGnBgLZyQt2tj_eSr_5PzBhyFvgbzKfx-Z0ganME_CIlNueB4Eg&amp;s","Dan Brown, conocido por su éxito ""El Código Da Vinci"", ha anunciado el lanzamiento de su nueva novela, que está destinada a ser un homenaje al poder de los libros. La obra, titulada ""El último símbolo"", se adentra en el misterio y explora temas relacionados con el conocimiento y su influencia en la humanidad. Brown, a lo largo de su carrera, ha enfrentado la encrucijada entre la ficción y la realidad, y esta novela promete continuar esa línea, combinando elementos históricos con tramas intrigantes. La publicación está programada para el próximo año y se anticipa que genere gran expectativa entre los lectores.","Dan Brown, conocido por su éxito ""El Código Da Vinci"", ha anunciado el lanzamiento de su nueva novela, que está destinada a ser un homenaje al poder de los libros. La obra, titulada ""El último símbolo"", se adentra en el misterio y explora temas relacionados con el conocimiento y su influencia en la humanidad. Brown, a lo largo de su carrera, ha enfrentado la encrucijada entre la ficción y la realidad, y esta novela promete continuar esa línea, combinando elementos históricos con tramas intrigantes. La publicación está programada para el próximo año y se anticipa que genere gran expectativa entre los lectores.",""
"09/11/2025 11:25:43","https://infobae.com/america/mundo/2025/09/10/tunez-prometio-investigar-el-segundo-ataque-contra-la-flotilla-sumud-que-postergo-su-salida-hacia-gaza/","Túnez prometió investigar el segundo ataque contra la flotilla Sumud, que postergó su salida hacia Gaza","Túnez prometió investigar el segundo ataque contra la flotilla Sumud que postergó su salida hacia Gaza","https://encrypted-tbn0.gstatic.com/images?q=tbn:ANd9GcS9KF1dXichffh8ZuKbEn6-PGVym2751geYP95jTParT3zyK7W2Ysig74Xrvg&amp;s","Túnez se comprometió a investigar un nuevo ataque perpetrado contra la flotilla Sumud, que tenía como objetivo llevar ayuda humanitaria a Gaza. Este incidente se produjo en medio de tensiones crecientes en la región. La flotilla, compuesta por varios barcos, había sido pospuesta en su salida debido a la amenaza de violencia. Las autoridades tunecinas han expresado su intención de esclarecer los hechos y determinar responsabilidades. La situación refleja las dificultades que enfrentan las iniciativas de ayuda humanitaria en el contexto del conflicto en Gaza.","Túnez se comprometió a investigar un nuevo ataque perpetrado contra la flotilla Sumud, que tenía como objetivo llevar ayuda humanitaria a Gaza. Este incidente se produjo en medio de tensiones crecientes en la región. La flotilla, compuesta por varios barcos, había sido pospuesta en su salida debido a la amenaza de violencia. Las autoridades tunecinas han expresado su intención de esclarecer los hechos y determinar responsabilidades. La situación refleja las dificultades que enfrentan las iniciativas de ayuda humanitaria en el contexto del conflicto en Gaza.",""
"09/11/2025 11:25:43","https://infobae.com/estados-unidos/2025/09/10/la-corte-suprema-de-estados-unidos-revisara-de-urgencia-la-legalidad-de-los-aranceles-de-trump/","La Corte Suprema de Estados Unidos revisará de urgencia la legalidad de los aranceles de Trump","La Corte Suprema de Estados Unidos revisará de urgencia la legalidad de los aranceles de Trump","https://encrypted-tbn0.gstatic.com/images?q=tbn:ANd9GcS8uLhWjeMI8P3Q7M4fwptI04i69zHr1kujVxbtC328lnH-UEgacFD6mIaaE04&amp;s","La Corte Suprema de Estados Unidos ha decidido revisar de manera urgente la legalidad de los aranceles impuestos por el expresidente Donald Trump sobre importaciones chinas. Este examen surge tras diversas impugnaciones y controversias en torno a los costos adicionales que estos aranceles han generado en el comercio y la economía. La decisión de la corte podría tener un impacto significativo en las relaciones comerciales entre Estados Unidos y China, así como en la política arancelaria del país en el futuro. La revisión se convertirá en un aspecto clave en el debate sobre comercio y economía en el contexto actual.","La Corte Suprema de Estados Unidos ha decidido revisar de manera urgente la legalidad de los aranceles impuestos por el expresidente Donald Trump sobre importaciones chinas. Este examen surge tras diversas impugnaciones y controversias en torno a los costos adicionales que estos aranceles han generado en el comercio y la economía. La decisión de la corte podría tener un impacto significativo en las relaciones comerciales entre Estados Unidos y China, así como en la política arancelaria del país en el futuro. La revisión se convertirá en un aspecto clave en el debate sobre comercio y economía en el contexto actual.",""
"09/11/2025 11:25:43","https://infobae.com/deportes/2025/09/10/comienza-la-venta-de-las-entradas-para-el-mundial-2026-los-requisitos-y-todo-lo-que-hay-que-saber/","Comienza la venta de las entradas para el Mundial 2026: los requisitos y todo lo que hay que saber","Comienza la venta de las entradas para el Mundial 2026: los requisitos y todo lo que hay que saber","https://encrypted-tbn0.gstatic.com/images?q=tbn:ANd9GcSRU0BqfUZhYt2CRsedYyJC9ciq1uzenlm4jH-5b9W2Rt0CiuezgRajRA756w&amp;s","La venta de entradas para el Mundial 2026 ha comenzado, con la particularidad de que se utilizará tecnología biométrica para garantizar la seguridad en los estadios. Los interesados deberán registrarse en la plataforma oficial y cumplir con una serie de requisitos para poder adquirir sus boletos. Se espera que sea un proceso sencillo y seguro para todos los fanáticos que quieran asistir a los partidos del próximo mundial.","La venta de entradas para el Mundial 2026 ha comenzado, con la particularidad de que se utilizará tecnología biométrica para garantizar la seguridad en los estadios. Los interesados deberán registrarse en la plataforma oficial y cumplir con una serie de requisitos para poder adquirir sus boletos. Se espera que sea un proceso sencillo y seguro para todos los fanáticos que quieran asistir a los partidos del próximo mundial.",""
"09/11/2025 11:25:43","https://infobae.com/cultura/2025/09/09/por-que-la-palabra-maquiavelico-no-significa-lo-que-muchos-creen/","Por qué la palabra “maquiavélico” no significa lo que muchos creen","Por qué la palabra maquiavélico no significa lo que muchos creen","https://encrypted-tbn0.gstatic.com/images?q=tbn:ANd9GcQ_pKeS0VfvuxKpmkvE82Qxlk7dZmcWKulfOj6-9dygnnIRuRF62gZML29A_w&amp;s","En el artículo se explica el origen y significado de la palabra ""maquiavélico"", la cual no proviene de Nicolas Maquiavelo como comúnmente se cree. Su significado se refiere a acciones astutas y manipuladoras, vinculadas al personaje Maquiavelo a partir de su obra ""El Príncipe"", pero el término se utilizaba mucho antes en la literatura. Dicha palabra se relaciona más con el ámbito político y la estrategia en vez de la maldad o la villanía.","En el artículo se explica el origen y significado de la palabra ""maquiavélico"", la cual no proviene de Nicolas Maquiavelo como comúnmente se cree. Su significado se refiere a acciones astutas y manipuladoras, vinculadas al personaje Maquiavelo a partir de su obra ""El Príncipe"", pero el término se utilizaba mucho antes en la literatura. Dicha palabra se relaciona más con el ámbito político y la estrategia en vez de la maldad o la villanía.",""
"09/11/2025 11:25:43","https://infobae.com/america/mundo/2025/09/11/el-embajador-britanico-en-estados-unidos-fue-destituido-por-sus-vinculos-con-jeffrey-epstein/","El embajador británico en Estados Unidos fue destituido por sus vínculos con Jeffrey Epstein","Embajador británico en Estados Unidos destituido por vínculos con Jeffrey Epstein","https://encrypted-tbn0.gstatic.com/images?q=tbn:ANd9GcQBtOzsQ11HbHTHY-X_0jwxBf3e00rmASqB2csKFUqZJb_4oi0OXthdTy7WUw&amp;s","El embajador británico en Estados Unidos fue destituido debido a sus vínculos con Jeffrey Epstein, el financiero acusado de trata de personas. La decisión fue confirmada por el gobierno del Reino Unido, que señaló que la relación del diplomático con Epstein generó preocupación y controversia. La destitución se produce en medio de un contexto de scrutinio sobre las conexiones de figuras públicas con Epstein, quien murió en prisión en 2019. Esta situación ha llevado a un análisis más riguroso de los antecedentes y conductas de funcionarios en puestos diplomáticos.","El embajador británico en Estados Unidos fue destituido debido a sus vínculos con Jeffrey Epstein, el financiero acusado de trata de personas. La decisión fue confirmada por el gobierno del Reino Unido, que señaló que la relación del diplomático con Epstein generó preocupación y controversia. La destitución se produce en medio de un contexto de scrutinio sobre las conexiones de figuras públicas con Epstein, quien murió en prisión en 2019. Esta situación ha llevado a un análisis más riguroso de los antecedentes y conductas de funcionarios en puestos diplomáticos.",""
