"FechayHora","LinkOrigen","TituloOrigen","Titulo","Imagen","Intro","Noticia","Datos"
"09/23/2025 21:00:19","https://infobae.com/america/mundo/2025/09/22/la-policia-de-moldavia-detuvo-a-74-personas-por-el-presunto-plan-ruso-para-desestabilizar-el-pais/","La policía de Moldavia detuvo a 74 personas por el presunto plan ruso para desestabilizar el país","Policía de Moldavia detiene a 74 personas por presunto plan ruso de desestabilización del país","https://encrypted-tbn0.gstatic.com/images?q=tbn:ANd9GcTb7YXHcLmWM2wa2D0ROpw6PoHQbZzJpzSuBf8mmVvvioZtTnyqzLzhnvWYCJk&amp;s","La policía de Moldavia arrestó a 74 personas en relación con un presunto plan coordinado por Rusia para desestabilizar el país. Las autoridades moldavas han señalado que estos individuos habrían estado involucrados en actividades destinadas a fomentar el desorden y la agitación social. Esta operación se produce en un contexto de creciente preocupación sobre la influencia de Moscú en la región y los intentos de desestabilización en varias naciones cercanas.","La policía de Moldavia arrestó a 74 personas en relación con un presunto plan coordinado por Rusia para desestabilizar el país. Las autoridades moldavas han señalado que estos individuos habrían estado involucrados en actividades destinadas a fomentar el desorden y la agitación social. Esta operación se produce en un contexto de creciente preocupación sobre la influencia de Moscú en la región y los intentos de desestabilización en varias naciones cercanas.",""
"09/23/2025 21:00:19","https://infobae.com/deportes/2025/09/21/como-se-eligieron-a-los-30-candidatos-al-balon-de-oro-2025-y-quienes-son-los-100-jurados-encargados-de-votar-al-ganador/","Cómo se eligieron a los 30 candidatos al Balón de Oro 2025 y quiénes son los 100 jurados encargados de votar al ganador","Cómo se eligieron a los 30 candidatos al Balón de Oro 2025 y quiénes son los 100 jurados encargados de votar al ganador","https://encrypted-tbn0.gstatic.com/images?q=tbn:ANd9GcSiH3hBLjYQBwNirgfJmUsX1VI3AQ-EmJYfXxruKw6nnKAQGqXZVO1O0MIVJA&amp;s","La selección de los 30 candidatos al Balón de Oro 2025 se basa en el rendimiento de los jugadores en las competiciones internacionales y nacionales durante la temporada pasada. Un jurado compuesto por 100 expertos, incluidos periodistas y exfutbolistas, es el encargado de elegir al ganador. Cada miembro del jurado tiene la responsabilidad de votar por sus cinco jugadores favoritos, otorgando puntos a cada uno según su posición. Este proceso busca reflejar de manera justa el desempeño individual de los futbolistas a lo largo del año.","La selección de los 30 candidatos al Balón de Oro 2025 se basa en el rendimiento de los jugadores en las competiciones internacionales y nacionales durante la temporada pasada. Un jurado compuesto por 100 expertos, incluidos periodistas y exfutbolistas, es el encargado de elegir al ganador. Cada miembro del jurado tiene la responsabilidad de votar por sus cinco jugadores favoritos, otorgando puntos a cada uno según su posición. Este proceso busca reflejar de manera justa el desempeño individual de los futbolistas a lo largo del año.",""
"09/23/2025 21:00:19","https://infobae.com/deportes/2025/09/23/argentina-es-el-pais-con-mas-ganadores-del-balon-de-oro-la-lista-completa-y-la-broma-viral-de-messi-y-francia-como-protagonistas/","Argentina es el país con más ganadores: la lista completa y la broma de Messi y Francia como protagonistas","Argentina lidera la lista de ganadores del Balón de Oro y Messi provoca una broma viral con Francia","https://encrypted-tbn0.gstatic.com/images?q=tbn:ANd9GcSwCQZdY3U-QJSzYCJt-jIhFd3K5GIyLXdJB6E2e96TUZb00_ILRgKiEc-Y7g&amp;s","Argentina se posiciona como el país con el mayor número de ganadores del Balón de Oro, un galardón que premia a los mejores futbolistas del mundo. En la lista de los jugadores argentinos destacados se encuentran nombres como Lionel Messi, quien ha cosechado múltiples premios a lo largo de su carrera. La reciente viralización de una broma entre Messi y el equipo de Francia ha añadido un toque humorístico al contexto del fútbol. La noticia también resalta la comparación de Argentina con otras naciones en términos de premios individuales en este prestigioso reconocimiento.","Argentina se posiciona como el país con el mayor número de ganadores del Balón de Oro, un galardón que premia a los mejores futbolistas del mundo. En la lista de los jugadores argentinos destacados se encuentran nombres como Lionel Messi, quien ha cosechado múltiples premios a lo largo de su carrera. La reciente viralización de una broma entre Messi y el equipo de Francia ha añadido un toque humorístico al contexto del fútbol. La noticia también resalta la comparación de Argentina con otras naciones en términos de premios individuales en este prestigioso reconocimiento.",""
"09/23/2025 21:00:19","https://infobae.com/deportes/2025/09/22/la-ultima-disputa-entre-lionel-messi-y-cristiano-ronaldo-cuando-podria-ser-entregado-el-super-balon-de-oro/","La disputa entre Lionel Messi y Cristiano Ronaldo: cuándo podría ser entregado el Súper Balón de Oro","La última disputa entre Lionel Messi y Cristiano Ronaldo por el Super Balón de Oro","https://encrypted-tbn0.gstatic.com/images?q=tbn:ANd9GcQgZ45xtET5hAHZgn8gfFH0zvUplV__yzyypfIv0oPxFlVFh9mwHFhsGBvx4fI&amp;s","Lionel Messi y Cristiano Ronaldo están en medio de una nueva controversia relacionada con el Super Balón de Oro, premio que se entregará en octubre de 2025. Este galardón es exclusivo para aquellos jugadores que hayan ganado el Balón de Oro en al menos tres ocasiones, y en esta edición se revelará al futbolista con mayor trayectoria y éxito en la última década. Messi, quien ha ganado el Balón de Oro en siete ocasiones, es considerado el favorito para recibir este reconocimiento. La entrega del Super Balón de Oro está generando un gran interés y especulación en el mundo del fútbol, especialmente en la posible comparación entre ambos jugadores, que han dominado la escena futbolística durante años.","Lionel Messi y Cristiano Ronaldo están en medio de una nueva controversia relacionada con el Super Balón de Oro, premio que se entregará en octubre de 2025. Este galardón es exclusivo para aquellos jugadores que hayan ganado el Balón de Oro en al menos tres ocasiones, y en esta edición se revelará al futbolista con mayor trayectoria y éxito en la última década. Messi, quien ha ganado el Balón de Oro en siete ocasiones, es considerado el favorito para recibir este reconocimiento. La entrega del Super Balón de Oro está generando un gran interés y especulación en el mundo del fútbol, especialmente en la posible comparación entre ambos jugadores, que han dominado la escena futbolística durante años.",""
"09/23/2025 21:00:19","https://infobae.com/america/mundo/2025/09/23/la-ocde-informo-que-los-aranceles-de-eeuu-subieron-41-puntos-en-tres-meses-y-alcanzaron-su-techo-desde-1934/","La OCDE informó que los aranceles de EEUU subieron 4,1 puntos en tres meses y alcanzaron su techo desde 1934","La OCDE informó que los aranceles de EEUU subieron 41 puntos en tres meses y alcanzaron su techo desde 1934","https://encrypted-tbn0.gstatic.com/images?q=tbn:ANd9GcTw0bM2yCRBqzJtaHjso17ZXPwG0ULkWmjJLVtAEuh20cN8nU5-CpTi2YZDiws&amp;s","La OCDE reportó que los aranceles impuestos por Estados Unidos han aumentado 41 puntos en un periodo de tres meses, alcanzando su nivel más alto desde 1934. Este incremento se enmarca en un contexto de tensión comercial y protección de la industria local, lo que ha generado preocupaciones sobre sus posibles efectos negativos en la economía global y en las relaciones comerciales del país.","La OCDE reportó que los aranceles impuestos por Estados Unidos han aumentado 41 puntos en un periodo de tres meses, alcanzando su nivel más alto desde 1934. Este incremento se enmarca en un contexto de tensión comercial y protección de la industria local, lo que ha generado preocupaciones sobre sus posibles efectos negativos en la economía global y en las relaciones comerciales del país.",""
"09/23/2025 21:00:19","https://infobae.com/estados-unidos/2025/09/23/wall-street-cerro-a-la-baja-tras-marcar-varios-records/","Wall Street cerró a la baja tras marcar varios récords","Wall Street cerró a la baja tras marcar varios récords","https://encrypted-tbn0.gstatic.com/images?q=tbn:ANd9GcTH2-olzVDHI1MRu0MZcvbmDi1_anq-NU-y2poX2XH_iwah4Mwrz9FQ6TCkJg&amp;s","Wall Street experimentó una caída después de alcanzar varios récords en días recientes. Los índices bursátiles principales, como el Dow Jones, el S&P 500 y el Nasdaq, sufrieron descensos significativos. Los expertos atribuyen esta baja a preocupaciones sobre la política monetaria de la Reserva Federal y la posible continuación de un aumento en las tasas de interés. Además, se mencionó la incertidumbre económica global y su efecto en el mercado. Los inversores reaccionaron ante estos factores, lo que provocó una venta masiva de acciones en diversas industrias.","Wall Street experimentó una caída después de alcanzar varios récords en días recientes. Los índices bursátiles principales, como el Dow Jones, el S&P 500 y el Nasdaq, sufrieron descensos significativos. Los expertos atribuyen esta baja a preocupaciones sobre la política monetaria de la Reserva Federal y la posible continuación de un aumento en las tasas de interés. Además, se mencionó la incertidumbre económica global y su efecto en el mercado. Los inversores reaccionaron ante estos factores, lo que provocó una venta masiva de acciones en diversas industrias.",""
"09/23/2025 21:00:19","https://infobae.com/america/mundo/2025/09/23/financial-times-putin-es-capaz-de-una-apuesta-temeraria-para-poner-a-prueba-a-la-otan/","Financial Times: Putin es capaz de una apuesta temeraria para poner a prueba a la OTAN","Putin es capaz de una apuesta temeraria para poner a prueba a la OTAN","https://encrypted-tbn0.gstatic.com/images?q=tbn:ANd9GcSFXN33UoLSZnUg-tlvevxPFyUluCje_RaW2C1D0W2zkgLiqaxejjyxAjG7Tg&amp;s","La noticia de Financial Times señala que el presidente de Rusia, Vladimir Putin, podría estar dispuesto a realizar una jugada arriesgada para desafiar a la OTAN. Analistas advierten que Putin podría intensificar sus acciones en Ucrania o en otras regiones para probar la respuesta de la Alianza Atlántica. Esta estrategia se percibe como un intento de mostrar fuerza en un momento en que las tensiones globales están en aumento, y el Kremlin busca recuperar cierta influencia en el escenario internacional. La situación es complicada y podría tener implicaciones significativas tanto para Europa como para la región euroasiática.","La noticia de Financial Times señala que el presidente de Rusia, Vladimir Putin, podría estar dispuesto a realizar una jugada arriesgada para desafiar a la OTAN. Analistas advierten que Putin podría intensificar sus acciones en Ucrania o en otras regiones para probar la respuesta de la Alianza Atlántica. Esta estrategia se percibe como un intento de mostrar fuerza en un momento en que las tensiones globales están en aumento, y el Kremlin busca recuperar cierta influencia en el escenario internacional. La situación es complicada y podría tener implicaciones significativas tanto para Europa como para la región euroasiática.",""
"09/23/2025 21:00:19","https://infobae.com/america/mundo/2025/09/23/murio-ziad-takieddine-el-empresario-que-acuso-a-nicolas-sarkozy-por-la-supuesta-financiacion-libia-de-su-campana/","Murió Ziad Takieddine, el empresario que acusó a Nicolas Sarkozy por la supuesta financiación libia de su campaña","Fallece Ziad Takieddine, empresario que acusó a Nicolas Sarkozy de financiar su campaña con dinero libio","https://encrypted-tbn0.gstatic.com/images?q=tbn:ANd9GcQxlG-B2y4dMfe5EROKizJ8fmh-i3Z7djcytAKnuXAn5uG3bUwH7NXBjM5oLw&amp;s","Ziad Takieddine, un empresario libanés conocido por sus acusaciones contra el expresidente francés Nicolas Sarkozy, ha fallecido a los 77 años. Takieddine había afirmado que Sarkozy recibió financiamiento de Libia para su campaña presidencial de 2007. Sus declaraciones llevaron a investigaciones en Francia relacionadas con corrupción y el uso indebido de fondos. A lo largo de su vida, Takieddine tuvo una carrera empresarial en el ámbito de la construcción y se vio involucrado en diversas controversias políticas. Su muerte se produce en un contexto de reactivación de los casos legales que involucran a Sarkozy.","Ziad Takieddine, un empresario libanés conocido por sus acusaciones contra el expresidente francés Nicolas Sarkozy, ha fallecido a los 77 años. Takieddine había afirmado que Sarkozy recibió financiamiento de Libia para su campaña presidencial de 2007. Sus declaraciones llevaron a investigaciones en Francia relacionadas con corrupción y el uso indebido de fondos. A lo largo de su vida, Takieddine tuvo una carrera empresarial en el ámbito de la construcción y se vio involucrado en diversas controversias políticas. Su muerte se produce en un contexto de reactivación de los casos legales que involucran a Sarkozy.",""
"09/23/2025 21:00:19","https://infobae.com/america/mundo/2025/09/20/finlandia-condeno-la-violacion-rusa-del-espacio-aereo-de-estonia-es-una-accion-totalmente-condenable-e-imprudente/","Finlandia condenó la violación rusa del espacio aéreo de Estonia: “Es una acción totalmente imprudente”","Finlandia condena la violación rusa del espacio aéreo de Estonia","https://encrypted-tbn0.gstatic.com/images?q=tbn:ANd9GcQB9MeyEylt1-gFSb_CEYfsD5P9rlCCN1f_gxPLMz1SdIh2uA6FkYDmhPEH_w&amp;s","Finlandia ha expresado su firme condena ante la reciente violación del espacio aéreo de Estonia por parte de Rusia, calificando esta acción de imprudente y totalmente inaceptable. El incidente ha generado preocupaciones sobre la seguridad en la región y refuerza la necesidad de una respuesta unida frente a acciones que amenazan la soberanía de los países bálticos. La declaración subraya la importancia de la cooperación entre los países europeos para hacer frente a estas provocaciones.","Finlandia ha expresado su firme condena ante la reciente violación del espacio aéreo de Estonia por parte de Rusia, calificando esta acción de imprudente y totalmente inaceptable. El incidente ha generado preocupaciones sobre la seguridad en la región y refuerza la necesidad de una respuesta unida frente a acciones que amenazan la soberanía de los países bálticos. La declaración subraya la importancia de la cooperación entre los países europeos para hacer frente a estas provocaciones.",""
"09/23/2025 21:00:19","https://infobae.com/america/mundo/2025/09/23/trump-critico-a-quienes-reconocen-el-estado-palestino-ante-la-onu-es-un-premio-demasiado-grande-para-los-terroristas-de-hamas/","Trump criticó a quienes reconocen el estado palestino ante la ONU: “Es un premio demasiado grande para los terroristas de Hamas”","Trump critica el reconocimiento del estado palestino ante la ONU como un premio para Hamas","https://encrypted-tbn0.gstatic.com/images?q=tbn:ANd9GcRcxonm0E5bdUDtAaM4V49R9b_ii-6XRBTJdGXTCa18QtCJAfWK8WZL_6tpJCY&amp;s","Donald Trump criticó a los países que reconocen el estado palestino en el contexto de la ONU, calificando este reconocimiento como un premio excesivo para los terroristas de Hamas. En su declaración, Trump argumentó que otorgar apoyo a Palestina podría fomentar el terrorismo y desestabilizar aún más la región. Su postura refleja una línea dura hacia el conflicto israelí-palestino y enfatiza la necesidad de acciones que no refuercen a grupos que considera extremistas.","Donald Trump criticó a los países que reconocen el estado palestino en el contexto de la ONU, calificando este reconocimiento como un premio excesivo para los terroristas de Hamas. En su declaración, Trump argumentó que otorgar apoyo a Palestina podría fomentar el terrorismo y desestabilizar aún más la región. Su postura refleja una línea dura hacia el conflicto israelí-palestino y enfatiza la necesidad de acciones que no refuercen a grupos que considera extremistas.",""
"09/23/2025 21:00:19","https://infobae.com/venezuela/2025/09/23/la-gobernadora-de-puerto-rico-dijo-que-entregaria-a-nicolas-maduro-a-eeuu-y-cobraria-la-recompensa-de-usd-50-millones/","La gobernadora de Puerto Rico dijo que entregaría a Maduro a EEUU y cobraría la millonaria recompensa","Gobernadora de Puerto Rico propone entregar a Nicolás Maduro a EE.UU. por recompensa de 50 millones de dólares","https://encrypted-tbn0.gstatic.com/images?q=tbn:ANd9GcSWziBfFwKrwvj66GHHF8dlJ9rXk2B2ZKYx04tHaVziWAx3L7xWJOJ7T06Ukg&amp;s","La gobernadora de Puerto Rico, en un evento reciente, expresó su disposición a entregar al líder venezolano Nicolás Maduro a Estados Unidos a cambio de una recompensa de 50 millones de dólares. Su declaración ha generado un amplio debate sobre la política y las relaciones entre las naciones involucradas, así como sobre el tema de la justicia internacional. La gobernadora subrayó la importancia de actuar contra la corrupción y el narcotráfico en Latinoamérica.","La gobernadora de Puerto Rico, en un evento reciente, expresó su disposición a entregar al líder venezolano Nicolás Maduro a Estados Unidos a cambio de una recompensa de 50 millones de dólares. Su declaración ha generado un amplio debate sobre la política y las relaciones entre las naciones involucradas, así como sobre el tema de la justicia internacional. La gobernadora subrayó la importancia de actuar contra la corrupción y el narcotráfico en Latinoamérica.",""
"09/23/2025 21:00:19","https://infobae.com/america/america-latina/2025/09/23/expertos-de-la-onu-pidieron-llevar-a-nicaragua-ante-la-corte-internacional-de-justicia-en-la-haya-por-el-trato-a-los-exiliados/","Expertos de la ONU pidieron llevar a Nicaragua ante la Corte Internacional de Justicia en La Haya","Expertos de la ONU piden llevar a Nicaragua ante la Corte Internacional de Justicia por el trato a los exiliados","https://encrypted-tbn0.gstatic.com/images?q=tbn:ANd9GcQRlTf-ILVHl-MFG8V-YDlK3CNAFbSHQ2MihyzCFmKUEmwbkn_c1MTZAmUrQw&amp;s","Expertos de la ONU han solicitado que Nicaragua sea llevado ante la Corte Internacional de Justicia en La Haya debido al tratamiento que reciben los exiliados. La petición se basa en las violaciones de derechos humanos que enfrentan aquellos que han huido del país, especialmente a raíz de la crisis política que comenzó en 2018. Los expertos destacan que las acciones del gobierno nicaragüense, incluyendo la represión y acoso a opositores, han creado un clima de temor que afecta la vida de los exiliados. La iniciativa busca garantizar justicia para las víctimas y presionar a las autoridades nicaragüenses a respetar los derechos humanos.","Expertos de la ONU han solicitado que Nicaragua sea llevado ante la Corte Internacional de Justicia en La Haya debido al tratamiento que reciben los exiliados. La petición se basa en las violaciones de derechos humanos que enfrentan aquellos que han huido del país, especialmente a raíz de la crisis política que comenzó en 2018. Los expertos destacan que las acciones del gobierno nicaragüense, incluyendo la represión y acoso a opositores, han creado un clima de temor que afecta la vida de los exiliados. La iniciativa busca garantizar justicia para las víctimas y presionar a las autoridades nicaragüenses a respetar los derechos humanos.",""
"09/23/2025 21:00:19","https://infobae.com/america/mundo/2025/09/22/legisladores-de-costa-rica-debaten-quitarle-la-inmunidad-al-presidente-rodrigo-chaves-implicado-en-un-caso-de-corrupcion/","Legisladores de Costa Rica debaten quitarle la inmunidad al presidente Rodrigo Chaves implicado en un caso de corrupción","Legisladores de Costa Rica discuten la posibilidad de quitar la inmunidad al presidente Rodrigo Chaves implicado en un caso de corrupción","https://encrypted-tbn0.gstatic.com/images?q=tbn:ANd9GcQlCXrO_nWXbBpuDnl1IDWI0hIjJqkbqq8RyGQYndDvHZIUZhoFmtlMBz2i1SA&amp;s","Legisladores de Costa Rica están considerando la posibilidad de retirar la inmunidad al presidente Rodrigo Chaves debido a su implicación en un caso de corrupción. Las discusiones han surgido en el contexto de una investigación que involucra irregularidades en la gestión pública. La decisión de levantar la inmunidad podría abrir la puerta a un mayor escrutinio legal hacia el mandatario. La situación ha generado divisiones entre los diferentes partidos políticos en el país, quienes han manifestado sus opiniones tanto a favor como en contra de esta medida.","Legisladores de Costa Rica están considerando la posibilidad de retirar la inmunidad al presidente Rodrigo Chaves debido a su implicación en un caso de corrupción. Las discusiones han surgido en el contexto de una investigación que involucra irregularidades en la gestión pública. La decisión de levantar la inmunidad podría abrir la puerta a un mayor escrutinio legal hacia el mandatario. La situación ha generado divisiones entre los diferentes partidos políticos en el país, quienes han manifestado sus opiniones tanto a favor como en contra de esta medida.",""
"09/23/2025 21:00:19","https://infobae.com/estados-unidos/2025/09/22/la-casa-blanca-rechazo-el-llamado-al-dialogo-de-nicolas-maduro-plagado-de-mentiras/","La Casa Blanca rechazó el llamado al diálogo de Nicolás Maduro: “Plagado de mentiras”","La Casa Blanca rechaza el llamado al diálogo de Nicolás Maduro plagado de mentiras","https://encrypted-tbn0.gstatic.com/images?q=tbn:ANd9GcSdWmWoFSwEFOJQZOdfKbR8GKGSopHFCwcxIKzgWAdeOBfKnE-fS0Nomz7fJQ&amp;s","La Casa Blanca desestimó recientemente la propuesta de diálogo hecha por Nicolás Maduro, a la que calificó como llena de falsedades. La administración estadounidense reiteró su postura de que el gobierno venezolano no es un interlocutor creíble, señalando que las acciones de Maduro no han fomentado un entorno propicio para el diálogo. Además, enfatizó su apoyo a los esfuerzos de la oposición venezolana y a la búsqueda de una solución pacífica y democrática para la crisis en el país.","La Casa Blanca desestimó recientemente la propuesta de diálogo hecha por Nicolás Maduro, a la que calificó como llena de falsedades. La administración estadounidense reiteró su postura de que el gobierno venezolano no es un interlocutor creíble, señalando que las acciones de Maduro no han fomentado un entorno propicio para el diálogo. Además, enfatizó su apoyo a los esfuerzos de la oposición venezolana y a la búsqueda de una solución pacífica y democrática para la crisis en el país.",""
"09/23/2025 21:00:19","https://infobae.com/deportes/2025/09/22/la-historia-de-amor-de-lothar-matthaus-y-su-pareja-modelo-38-anos-menor-que-se-robo-la-atencion-en-el-balon-de-oro/","La historia de amor de Lothar Matthaus y su pareja modelo 38 años menor que se robó la atención en el Balón de Oro","La historia de amor de Lothar Matthäus y su pareja modelo 38 años menor que se robó la atención en el Balón de Oro","https://encrypted-tbn0.gstatic.com/images?q=tbn:ANd9GcQrJjkV8u9OHNErbJYFVr1IWRkMDeJgYlpNQjb05hd4KBRxZdfigiZfCzt4-Q&amp;s","Lothar Matthäus, legendario futbolista alemán, ha captado la atención mediática por su relación con una modelo que es 38 años más joven que él. Su pareja se destacó en la reciente ceremonia del Balón de Oro, lo que ha generado un gran interés en su historia de amor. Matthäus, quien tiene una trayectoria destacada en el fútbol, ha sido noticia no solo por su carrera, sino también por su vida personal, especialmente en lo que respecta a su relación con su joven pareja.","Lothar Matthäus, legendario futbolista alemán, ha captado la atención mediática por su relación con una modelo que es 38 años más joven que él. Su pareja se destacó en la reciente ceremonia del Balón de Oro, lo que ha generado un gran interés en su historia de amor. Matthäus, quien tiene una trayectoria destacada en el fútbol, ha sido noticia no solo por su carrera, sino también por su vida personal, especialmente en lo que respecta a su relación con su joven pareja.",""
