"FechayHora","LinkOrigen","TituloOrigen","Titulo","Imagen","Intro","Noticia","Datos"
"08/31/2025 09:01:59","https://infobae.com/deportes/2025/08/30/el-aporte-en-el-gol-del-empate-la-magnifica-gambeta-en-una-baldosa-y-el-festejo-argentino-con-guler-el-partido-de-mastantuono-en-el-triunfo-de-real-madrid/","Aporte en el empate y festejo especial con Güler: el partido de Mastantuono en el triunfo de Real Madrid","Se consultó el Titulo a la IA","https://encrypted-tbn0.gstatic.com/images?q=tbn:ANd9GcQ7jH0V6nDW0mA1zZkGbSZaZEEoLlz-TtiPkeWs4gZO2IHiGs1IH-rN1i4OJw&amp;s","Se consultó la Nota a la IA","Se consultó la Nota a la IA","Se consultó el Datos a la IA"
"08/31/2025 09:02:01","https://infobae.com/america/mundo/2025/08/31/el-grupo-terrorista-hamas-confirmo-la-muerte-mohammed-sinwar-el-jefe-militar-en-la-franja-de-gaza/","El grupo terrorista Hamas confirmó la muerte de Mohammed Sinwar, el jefe militar en la Franja de Gaza","Se consultó el Titulo a la IA","https://encrypted-tbn0.gstatic.com/images?q=tbn:ANd9GcRe0wZybo4uf0ByJ7plqf8-T_3qOjKpswXz1YXBNVzAsgdQPdXUs3SA_M7m0Tc&amp;s","Se consultó la Nota a la IA","Se consultó la Nota a la IA","Se consultó el Datos a la IA"
"08/31/2025 09:02:03","https://infobae.com/deportes/2025/08/30/estudiantes-buscara-recuperar-la-cima-en-el-torneo-clausura-ante-central-cordoba-hora-tv-y-formaciones/","Vélez goleó 3-0 a Lanús y trepó a la cima de la tabla en la Zona B del Torneo Clausura","Se consultó el Titulo a la IA","https://encrypted-tbn0.gstatic.com/images?q=tbn:ANd9GcT72wCKY2Hwj9vev-1AqY4vmgJ_uFwyNhAno8jjvsmXYwmXxum_chDeRctC5pk&amp;s","Se consultó la Nota a la IA","Se consultó la Nota a la IA","Se consultó el Datos a la IA"
"08/31/2025 09:02:04","https://infobae.com/politica/2025/08/31/elecciones-corrientes-2025-en-vivo-las-ultimas-noticias-sobre-los-comicios-provinciales-del-31-de-agosto/","Con demoras en algunos centros de votación, se abrieron los comicios en toda la provincia","Se consultó el Titulo a la IA","https://encrypted-tbn0.gstatic.com/images?q=tbn:ANd9GcTjv7eHRGt2rkjqc38txGMlYyC3FBY-ezHG7O31h_A5yBWlNpBmaLNeBrQUTQE&amp;s","Se consultó la Nota a la IA","Se consultó la Nota a la IA","Se consultó el Datos a la IA"
"08/31/2025 09:02:05","https://infobae.com/deportes/2025/08/30/flavio-briatore-volvio-a-hablar-del-futuro-de-franco-colapinto-y-realizo-una-profunda-autocritica-sobre-el-mal-rendimiento-de-alpine-en-la-formula-1/","Flavio Briatore volvió a hablar del futuro de Franco Colapinto y realizó una profunda autocrítica sobre el mal rendimiento de Alpine","Se consultó el Titulo a la IA","https://encrypted-tbn0.gstatic.com/images?q=tbn:ANd9GcQ5px0LGRgp7gKgsriQ8wUcGMrWBhFBGCFP0NC7Tmwl8T0f9b6NJyEMmaWf&amp;s","Se consultó la Nota a la IA","Se consultó la Nota a la IA","Se consultó el Datos a la IA"
"08/31/2025 09:02:07","https://infobae.com/deportes/2025/08/30/el-enojo-de-franco-colapinto-tras-quedar-16-en-la-qualy-del-gran-premio-de-paises-bajos-me-taparon-dos-autos/","El enojo de Franco Colapinto tras quedar 16° en la qualy: “Me taparon dos autos”","Se consultó el Titulo a la IA","https://encrypted-tbn0.gstatic.com/images?q=tbn:ANd9GcRqdyJ6oRt9wMZITG3eIkpJrERbUzid4VVYjcNUWVc8Qo6IVEeuqXkuMTgfUQ&amp;s","Se consultó la Nota a la IA","Se consultó la Nota a la IA","Se consultó el Datos a la IA"
"08/31/2025 09:02:09","https://infobae.com/deportes/2025/08/31/un-ex-jugador-de-la-seleccion-argentina-entrego-el-premio-a-oscar-piastri-tras-lograr-la-pole-del-gp-de-los-paises-bajos-de-f1/","Un ex jugador de la selección argentina entregó el premio a Oscar Piastri tras lograr la pole","Se consultó el Titulo a la IA","https://encrypted-tbn0.gstatic.com/images?q=tbn:ANd9GcT5o-_LwUmL-WkXQlfJkwumig0-M38RiOfA-haxfRMTX77tiiiz6_Gu_Jz25A&amp;s","Se consultó la Nota a la IA","Se consultó la Nota a la IA","Se consultó el Datos a la IA"
"08/31/2025 09:02:10","https://infobae.com/sociedad/policiales/2025/08/31/condenaron-a-perpetua-a-cuatro-acusados-del-crimen-de-popito-zalazar-el-preso-baleado-en-venganza-de-los-monos/","Condenaron a perpetua a cuatro acusados del crimen de &quot;Popito&quot; Zalazar, el preso baleado en venganza de Los Monos","Se consultó el Titulo a la IA","https://encrypted-tbn0.gstatic.com/images?q=tbn:ANd9GcTrzJWJ_UA5-N1upIDJo0fRqjCPz662puyvGsET_pGPxMn_WzY7L-TtyHXpQw&amp;s","Se consultó la Nota a la IA","Se consultó la Nota a la IA","Se consultó el Datos a la IA"
"08/31/2025 09:02:12","https://infobae.com/deportes/2025/08/31/argentina-hizo-un-partido-perfecto-derroto-a-canada-y-jugara-la-final-de-la-americup-ante-brasil/","La selección argentina de básquet hizo un partido perfecto, derrotó a Canadá y jugará la final de la AmeriCup ante Brasil","Se consultó el Titulo a la IA","https://encrypted-tbn0.gstatic.com/images?q=tbn:ANd9GcSrsc-seDm0YVUHVUbihPsN_a-ch7D0Vn1NHZ7VMQLz2X-6Ac9JhVrzcJrpng&amp;s","Se consultó la Nota a la IA","Se consultó la Nota a la IA","Se consultó el Datos a la IA"
"08/31/2025 09:02:13","https://infobae.com/amores-reales/2025/08/31/del-adolescente-timido-al-policia-que-ama-en-silencio-hace-29-anos-una-sonrisa-un-vestido-negro-y-una-ilusion-que-nunca-muere/","Del adolescente tímido al policía que ama en silencio hace 29 años: una sonrisa, un vestido negro y una ilusión que nunca muere","Se consultó el Titulo a la IA","https://encrypted-tbn0.gstatic.com/images?q=tbn:ANd9GcStKu33_n3uOT1V5youYjyBkLCAHTl-3CVCPC8kNbYqlWlXe8kixskIKCc7vAI&amp;s","Se consultó la Nota a la IA","Se consultó la Nota a la IA","Se consultó el Datos a la IA"
"08/31/2025 09:02:15","https://infobae.com/deportes/2025/08/30/asi-estan-las-tablas-del-torneo-clausura-y-la-lucha-por-la-clasificacion-a-las-copas-internacionales/","Así están las tablas del Torneo Clausura y la lucha por la clasificación a las copas internacionales","Se consultó el Titulo a la IA","https://encrypted-tbn0.gstatic.com/images?q=tbn:ANd9GcRohjVPUeqIDDaRQEkiXpQQnKgmtaqZcBkxdHgg4aZf4eUoySONdH6VFo02jw&amp;s","Se consultó la Nota a la IA","Se consultó la Nota a la IA","Se consultó el Datos a la IA"
"08/31/2025 09:02:16","https://infobae.com/america/mundo/2025/08/31/el-papa-leon-xiv-rezo-por-las-victimas-del-tiroteo-en-una-escuela-catolica-de-eeuu-y-pidio-terminar-con-la-pandemia-de-armas/","El papa León XIV rezó por las víctimas del tiroteo en una escuela católica de EEUU y pidió terminar con la “pandemia de armas”","Se consultó el Titulo a la IA","https://encrypted-tbn0.gstatic.com/images?q=tbn:ANd9GcRN9iwhdyshd6emi9Abv_Wi1NUWo8a_Qt0MEIOFLeVm6ossqVHI0tpArvtKww&amp;s","Se consultó la Nota a la IA","Se consultó la Nota a la IA","Se consultó el Datos a la IA"
"08/31/2025 09:02:18","https://infobae.com/sociedad/2025/08/31/la-tormenta-de-santa-rosa-golpeo-fuerte-en-mendoza-y-tambien-afecto-a-provincias-del-norte-y-cuyo-evacuados-granizo-y-arboles-caidos/","La tormenta de Santa Rosa golpeó fuerte en Mendoza y también afectó a provincias del norte y Cuyo: evacuados, granizo y árboles caídos","Se consultó el Titulo a la IA","https://encrypted-tbn0.gstatic.com/images?q=tbn:ANd9GcQdjwaGP3NK9DE1qzU2Jl5gD4DsxqxYqnSqwo6H2G9u-CmcxWXeCL7BHDChOA&amp;s","Se consultó la Nota a la IA","Se consultó la Nota a la IA","Se consultó el Datos a la IA"
"08/31/2025 09:02:21","https://infobae.com/deportes/2025/08/31/el-drastico-cambio-de-look-de-una-gloria-del-futbol-argentino-que-llamo-la-atencion-de-los-fanaticos/","El drástico cambio de look de una gloria del fútbol argentino que llamó la atención de los fanáticos","Se consultó el Titulo a la IA","https://encrypted-tbn0.gstatic.com/images?q=tbn:ANd9GcQO7oUAPc6re8Q45QWsB_4r2coCTByc1Eti1uQhPSUAhZOK3gqjF9eLdMZCkw&amp;s","Se consultó la Nota a la IA","Se consultó la Nota a la IA","Se consultó el Datos a la IA"
"08/31/2025 09:02:21","https://infobae.com/deportes/2025/08/31/franco-colapinto-largara-desde-el-puesto-16-el-gran-premio-de-los-paises-bajos-de-la-formula-1-todo-lo-que-hay-que-saber/","Franco Colapinto largará desde el puesto 16 el GP de los Países Bajos de la F1: todo lo que hay que saber","Se consultó el Titulo a la IA","https://encrypted-tbn0.gstatic.com/images?q=tbn:ANd9GcTqlbeoej81rZsEX02Y-vf9qW2M3Oyz3AT6Fe2Z6DqN5-tGiZlPV0AlvXFnzA&amp;s","Se consultó la Nota a la IA","Se consultó la Nota a la IA","Se consultó el Datos a la IA"
"08/31/2025 09:02:23","https://infobae.com/sociedad/policiales/2025/08/31/detuvieron-a-dos-adolescentes-de-16-y-17-anos-por-la-violenta-entradera-al-organizador-de-la-derecha-fest/","Detuvieron a dos adolescentes de 16 y 17 años por la violenta entradera al organizador de la Derecha Fest","Se consultó el Titulo a la IA","https://encrypted-tbn0.gstatic.com/images?q=tbn:ANd9GcTS8-3U6IexoPI7YrOjT8-TddBfyo74_i96KkCbiabU2iqnKeEMHBmx1P9T&amp;s","Se consultó la Nota a la IA","Se consultó la Nota a la IA","Se consultó el Datos a la IA"
"08/31/2025 09:02:24","https://infobae.com/sociedad/policiales/2025/08/30/misterioso-crimen-en-la-matanza-las-dudas-en-torno-al-asesinato-de-la-joven-que-trabajaba-como-chofer-de-aplicacion/","El crimen de la chofer de aplicación en La Matanza: la policía descartó la hipótesis del robo y apunta al vínculo con el asesino","Se consultó el Titulo a la IA","https://encrypted-tbn0.gstatic.com/images?q=tbn:ANd9GcRprTGAmwaa1wU0oCme8hWiSbWI1_lAr4_PKd3BnwesrUEY0Un2jF9-Kqdfe6Y&amp;s","Se consultó la Nota a la IA","Se consultó la Nota a la IA","Se consultó el Datos a la IA"
"08/31/2025 09:02:25","https://infobae.com/sociedad/policiales/2025/08/31/revelaron-un-presunto-vinculo-comercial-entre-la-chofer-de-aplicacion-asesinada-en-la-matanza-y-su-supuesto-homicida/","Revelaron un presunto vínculo comercial entre la chofer de aplicación asesinada en La Matanza y su supuesto homicida","Se consultó el Titulo a la IA","https://encrypted-tbn0.gstatic.com/images?q=tbn:ANd9GcRgytq0Gy_ZeNcjVhuV1_9asdYA9OKs1aduFPqM89MB5Im_AheVnmavjG2nOQ&amp;s","Se consultó la Nota a la IA","Se consultó la Nota a la IA","Se consultó el Datos a la IA"
"08/31/2025 09:02:27","https://infobae.com/america/mundo/2025/08/31/vladimir-putin-llego-a-china-para-asistir-a-la-cumbre-de-la-organizacion-de-cooperacion-de-shanghai/","Vladimir Putin llegó a China para asistir a la cumbre de la Organización de Cooperación de Shanghái","Se consultó el Titulo a la IA","https://encrypted-tbn0.gstatic.com/images?q=tbn:ANd9GcRmLJk9P1YohJ95gr6-0PJGJicxtrW9E_swq004kRVkXl3Q6GLyopkWtKM5dg&amp;s","Se consultó la Nota a la IA","Se consultó la Nota a la IA","Se consultó el Datos a la IA"
"08/31/2025 09:02:29","https://infobae.com/sociedad/policiales/2025/08/31/estaba-profugo-por-un-homicidio-y-lo-detuvieron-en-rosario-investigan-una-presunta-saga-de-venganzas/","Estaba prófugo por un homicidio y lo detuvieron en Rosario: investigan una presunta saga de venganzas","Se consultó el Titulo a la IA","https://encrypted-tbn0.gstatic.com/images?q=tbn:ANd9GcQDGonwIxLmCfE4kLM8it0QONhJkcBq_DlPCnUArQ8-I0iZfq4d2urk8AFqEg&amp;s","Se consultó la Nota a la IA","Se consultó la Nota a la IA","Se consultó el Datos a la IA"
"08/31/2025 09:02:30","https://infobae.com/deportes/2025/08/30/dos-golazos-de-chilena-y-una-definicion-al-angulo-la-historica-actuacion-de-joao-neves-en-el-triunfo-del-psg-por-6-a-3/","Dos golazos de chilena y una definición al ángulo: la histórica actuación de Joao Neves en el triunfo del PSG por 6 a 3","Se consultó el Titulo a la IA","https://encrypted-tbn0.gstatic.com/images?q=tbn:ANd9GcQ7jH0V6nDW0mA1zZkGbSZaZEEoLlz-TtiPkeWs4gZO2IHiGs1IH-rN1i4OJw&amp;s","Se consultó la Nota a la IA","Se consultó la Nota a la IA","Se consultó el Datos a la IA"
"08/31/2025 09:02:32","https://infobae.com/revista-chacra/2025/08/29/mientras-el-trigo-mejora-su-condicion-se-demora-la-siembra-de-girasol/","Mientras el trigo mejora su condición, se demora la siembra de girasol","Se consultó el Titulo a la IA","https://encrypted-tbn0.gstatic.com/images?q=tbn:ANd9GcTtFsxcKg5ACYdbXzEfh19SCQ1_CkKYNIHuohPO63x2UyYqPHuNuIToh41sGw&amp;s","Se consultó la Nota a la IA","Se consultó la Nota a la IA","Se consultó el Datos a la IA"
"08/31/2025 09:02:35","https://infobae.com/revista-chacra/2025/08/30/de-cordoba-a-oceania-el-rol-femenino-en-la-ganaderia/","De Córdoba a Oceanía: el rol femenino en la ganadería","Se consultó el Titulo a la IA","https://encrypted-tbn0.gstatic.com/images?q=tbn:ANd9GcTTEugSMVUuGS-lMbfjhYsD09rl6ONLumPI-a7-8_UykG0VQLvbO6q3dXPPyA&amp;s","Se consultó la Nota a la IA","Se consultó la Nota a la IA","Se consultó el Datos a la IA"
"08/31/2025 09:02:37","https://infobae.com/revista-chacra/2025/08/29/la-siembra-de-trigo-alcanzo-las-68-millones-de-hectareas-y-consolida-la-recuperacion-del-cultivo/","La siembra de trigo alcanzó las 6,8 millones de hectáreas y consolida la recuperación del cultivo","Se consultó el Titulo a la IA","https://encrypted-tbn0.gstatic.com/images?q=tbn:ANd9GcSRFfBvMKAZ3h3WwzzNN4TidA0QLFKSIV-pRjEKbRQ6e0k9PE_wMFiRDMlLZAU&amp;s","Se consultó la Nota a la IA","Se consultó la Nota a la IA","Se consultó el Datos a la IA"
"08/31/2025 09:02:39","https://infobae.com/revista-chacra/2025/08/31/record-de-molienda-de-girasol/","Récord de molienda de girasol","Se consultó el Titulo a la IA","https://encrypted-tbn0.gstatic.com/images?q=tbn:ANd9GcS6mmSmV8ZcTF27LIGt4utqEl1KiBpGPTM79SHNkyW9UrCxM40Pz7DTyev0Mw&amp;s","Se consultó la Nota a la IA","Se consultó la Nota a la IA","Se consultó el Datos a la IA"
"08/31/2025 09:02:42","https://infobae.com/movant/2025/08/27/la-anpyn-avanza-con-un-paquete-normativo-para-modernizar-servicios-en-la-hidrovia-paraguayparana/","La ANPYN avanza con un paquete normativo para modernizar servicios en la hidrovía Paraguay–Paraná","Se consultó el Titulo a la IA","https://encrypted-tbn0.gstatic.com/images?q=tbn:ANd9GcSvB83gmTqALGN2unE7Xb2xmnW3YIrNfp8lN3KmQUjXw6nzLV0MAU9P6nhQBQ&amp;s","Se consultó la Nota a la IA","Se consultó la Nota a la IA","Se consultó el Datos a la IA"
"08/31/2025 09:02:44","https://infobae.com/movant/2025/08/28/la-omi-impulsa-medidas-para-garantizar-seguridad-maritima-y-reducir-emisiones-hacia-2050/","La OMI impulsa medidas para garantizar seguridad marítima y reducir emisiones hacia 2050","Se consultó el Titulo a la IA","https://encrypted-tbn0.gstatic.com/images?q=tbn:ANd9GcRRjn-uQUo9h4oTIB97BpMhMSzqCN_gnim3e-_ni4BG3iIrKWifqcOIRkzbeA&amp;s","Se consultó la Nota a la IA","Se consultó la Nota a la IA","Se consultó el Datos a la IA"
"08/31/2025 09:02:46","https://infobae.com/deportes/2025/08/30/el-central-de-di-maria-visitara-a-sarmiento-de-junin-por-la-fecha-7-del-torneo-clausura-hora-tv-y-posibles-formaciones/","Se suspendió el encuentro que igualaban Sarmiento y Rosario Central por las intensas lluvias en Junín","Se consultó el Titulo a la IA","https://encrypted-tbn0.gstatic.com/images?q=tbn:ANd9GcSUkzArZlGkED9TAR-goCd1nsLoLfQXNrqpYOzEZZLSHxRBzAf7-oDh4ix1rns&amp;s","Se consultó la Nota a la IA","Se consultó la Nota a la IA","Se consultó el Datos a la IA"
"08/31/2025 09:02:48","https://infobae.com/inhouse/2025/08/29/talento-argentino-de-clase-mundial-el-motor-del-sector-energetico-nacional/","Talento argentino de clase mundial: el motor del sector energético nacional","Se consultó el Titulo a la IA","https://encrypted-tbn0.gstatic.com/images?q=tbn:ANd9GcSRXbApdyNI2KA5BGL1CFCBQstHYqw8hAyEn8vcrQQAwvO9Md9Tq1te7YIKh_A&amp;s","Se consultó la Nota a la IA","Se consultó la Nota a la IA","Se consultó el Datos a la IA"
"08/31/2025 09:02:50","https://infobae.com/inhouse/2025/08/29/voluntariado-en-las-empresas-su-impacto-en-la-motivacion-de-los-equipos-y-en-la-comunidad/","Voluntariado en las empresas: su impacto en la motivación de los equipos y en la comunidad","Se consultó el Titulo a la IA","https://encrypted-tbn0.gstatic.com/images?q=tbn:ANd9GcRB1bOtMWkz5N76qWtE4T5vlc9gBLhEH9v1sgvXMn1WgWXVM4fnWd6JC9QZHg&amp;s","Se consultó la Nota a la IA","Se consultó la Nota a la IA","Se consultó el Datos a la IA"
"08/31/2025 09:02:51","https://infobae.com/inhouse/2025/08/30/oportunidades-para-jovenes-y-diversidad-generacional-el-nuevo-eje-del-mundo-corporativo/","Oportunidades para jóvenes y diversidad generacional: el nuevo eje del mundo corporativo","Se consultó el Titulo a la IA","https://encrypted-tbn0.gstatic.com/images?q=tbn:ANd9GcQqwz8WqyttOYImh9XbVCaRgACsNs30Ile-eSWqeD9BXUtgkN_gqVd3NhzaLWQ&amp;s","Se consultó la Nota a la IA","Se consultó la Nota a la IA","Se consultó el Datos a la IA"
"08/31/2025 09:02:53","https://infobae.com/inhouse/2025/08/29/como-logran-las-companias-construir-identidad-y-desarrollo-profesional-en-contextos-de-cambio/","Cómo logran las compañías construir identidad y desarrollo profesional en contextos de cambio","Se consultó el Titulo a la IA","https://encrypted-tbn0.gstatic.com/images?q=tbn:ANd9GcREm5uQsglUP59FCqNK_xnW82Qr02b59d2Wp6uuhXSDbLm96JnWHE_too0Ezoc&amp;s","Se consultó la Nota a la IA","Se consultó la Nota a la IA","Se consultó el Datos a la IA"
"08/31/2025 09:02:55","https://infobae.com/inhouse/2025/08/29/modelo-hibrido-y-aprendizaje-continuo-por-que-son-fundamentales-en-el-mercado-laboral-actual/","Modelo híbrido y aprendizaje continuo: por qué son fundamentales en el mercado laboral actual","Se consultó el Titulo a la IA","https://encrypted-tbn0.gstatic.com/images?q=tbn:ANd9GcTwnw6DJc8QMK6N9GmNpz7Bx6O0NyB7kZUh-30-YIKv3BTIovrJbEh6r22qhg&amp;s","Se consultó la Nota a la IA","Se consultó la Nota a la IA","Se consultó el Datos a la IA"
"08/31/2025 09:02:57","https://infobae.com/inhouse/2025/08/29/innovacion-y-liderazgo-que-rol-juegan-en-la-gestion-del-capital-humano/","Innovación y liderazgo: qué rol juegan en la gestión del capital humano","Se consultó el Titulo a la IA","https://encrypted-tbn0.gstatic.com/images?q=tbn:ANd9GcQaAcfelP3MlNHIi_Wk2iF149Mx4Hng1XbNnxf20WCxYO5wZvGTztikWW3nXA&amp;s","Se consultó la Nota a la IA","Se consultó la Nota a la IA","Se consultó el Datos a la IA"
"08/31/2025 09:02:59","https://infobae.com/movant/2025/08/28/arca-impulsa-mayor-previsibilidad-logistica-mediante-control-documental-y-reorganizacion-interna/","ARCA impulsa mayor previsibilidad logística mediante control documental y reorganización interna","Se consultó el Titulo a la IA","https://encrypted-tbn0.gstatic.com/images?q=tbn:ANd9GcTiySCiQxzQwkNw6s0Pa0NW9H0DUwHVrwOaYKruq3VeYpMOmbIBmKhJpFFR3w&amp;s","Se consultó la Nota a la IA","Se consultó la Nota a la IA","Se consultó el Datos a la IA"
"08/31/2025 09:03:01","https://infobae.com/inhouse/2025/08/29/diversidad-y-regeneracion-las-claves-para-una-transformacion-sostenida-en-el-entorno-empresarial/","Diversidad y regeneración: las claves para una transformación sostenida en el entorno empresarial","Se consultó el Titulo a la IA","https://encrypted-tbn0.gstatic.com/images?q=tbn:ANd9GcT6kvgkNiInU_BBFt287B8FVuMF_3LOFMorZsgaXUIHjWhE7f4ZL0R6e8_4Fg&amp;s","Se consultó la Nota a la IA","Se consultó la Nota a la IA","Se consultó el Datos a la IA"
"08/31/2025 09:03:01","https://infobae.com/cultura/2025/08/24/leonardo-da-vinci-y-el-sueno-de-volar-como-el-genio-y-la-ciencia-se-inspiraron-en-la-naturaleza/","Leonardo da Vinci y el sueño de volar: cómo el genio y la ciencia se inspiraron en la naturaleza","Se consultó el Titulo a la IA","https://encrypted-tbn0.gstatic.com/images?q=tbn:ANd9GcRVr90H7ueSprrDjs-me81oYfZKm7tjINIVkHh_15wPMkyP2nGUhtYZChd-Iw&amp;s","Se consultó la Nota a la IA","Se consultó la Nota a la IA","Se consultó el Datos a la IA"
"08/31/2025 09:03:01","https://infobae.com/movant/2025/08/22/puerto-nuevo-redefine-su-esquema-logistico-con-un-unico-operador-de-carga-y-terminal-de-cruceros/","Puerto Nuevo redefine su esquema logístico con un único operador de carga y terminal de cruceros","Se consultó el Titulo a la IA","https://encrypted-tbn0.gstatic.com/images?q=tbn:ANd9GcQaWXBAVwSD2BpYgI8C9U1kHvStysv4d9vvsWJbc03Q9FWj4_lNUyGpK5ZuQtw&amp;s","Se consultó la Nota a la IA","Se consultó la Nota a la IA","Se consultó el Datos a la IA"
"08/31/2025 09:03:01","https://infobae.com/politica/2025/08/15/jose-mayans-critico-la-gestion-de-javier-milei-y-hablo-sobre-la-posible-candidatura-de-maximo-kirchner/","José Mayans criticó la gestión de Javier Milei y habló sobre la posible candidatura de Máximo Kirchner","Se consultó el Titulo a la IA","https://encrypted-tbn0.gstatic.com/images?q=tbn:ANd9GcSkyUOcyOaurZyirkyOfRlfahZhLFqL1BJgiuQSgUaKKdFHSATV9tp5ARoyXg&amp;s","Se consultó la Nota a la IA","Se consultó la Nota a la IA","Se consultó el Datos a la IA"
"08/31/2025 09:03:01","https://infobae.com/sociedad/2025/08/24/video-una-familia-denuncio-que-patovicas-de-un-salon-de-fiestas-agredieron-a-su-hijo-adolescente/","Video: una familia denunció que patovicas de un salón de fiestas agredieron a su hijo adolescente","Se consultó el Titulo a la IA","https://encrypted-tbn0.gstatic.com/images?q=tbn:ANd9GcSXkLPSy0kK9_-sXXPBVOYJaifLy5o0-YDacwSO5SmTrcczMITnOtOKMkDEgQ&amp;s","Se consultó la Nota a la IA","Se consultó la Nota a la IA","Se consultó el Datos a la IA"
"08/31/2025 09:03:01","https://infobae.com/revista-chacra/2025/08/22/como-recuperar-la-fertilidad-y-potenciar-la-produccion/","¿Cómo recuperar la fertilidad y potenciar la producción?","Se consultó el Titulo a la IA","https://encrypted-tbn0.gstatic.com/images?q=tbn:ANd9GcSV2o-fEbM7FgC2MXLusfvGWYf3AaQwa6F4Dh7V6nuSog9wgE1qnvZ5L5tX5Q&amp;s","Se consultó la Nota a la IA","Se consultó la Nota a la IA","Se consultó el Datos a la IA"
"08/31/2025 09:03:01","https://infobae.com/economia/2025/08/17/el-clasico-sudamericano-en-clave-agricola-como-brasil-paso-de-igualar-a-triplicar-la-produccion-del-campo-argentino/","El clásico sudamericano, en clave agrícola: cómo Brasil pasó de igualar a triplicar la producción del campo argentino","Se consultó el Titulo a la IA","https://encrypted-tbn0.gstatic.com/images?q=tbn:ANd9GcR2NTNywevvMjYWQApHSvC8pBunw3AL6MC_OU3PlZ01SXrTNNdU7pnOSXgONw&amp;s","Se consultó la Nota a la IA","Se consultó la Nota a la IA","Se consultó el Datos a la IA"
"08/31/2025 09:03:01","https://infobae.com/deportes/2025/08/24/el-brutal-ataque-del-hijo-de-una-leyenda-de-ufc-contra-una-figura-de-lucha-libre-perdio-el-conocimiento-y-debio-ser-hospitalizada/","El brutal ataque del hijo de una leyenda de UFC contra una figura de lucha libre: perdió el conocimiento y debió ser hospitalizada","Se consultó el Titulo a la IA","https://encrypted-tbn0.gstatic.com/images?q=tbn:ANd9GcRMbu90Sp9tZGnNHoJt549nDQMSgbPwtQLbTDxF6bcO6KDXRTO4-vo_uFc2ieM&amp;s","Se consultó la Nota a la IA","Se consultó la Nota a la IA","Se consultó el Datos a la IA"
"08/31/2025 09:03:01","https://infobae.com/revista-chacra/2025/08/17/avanza-la-siembra-de-girasol/","Avanza la siembra de girasol","Se consultó el Titulo a la IA","https://encrypted-tbn0.gstatic.com/images?q=tbn:ANd9GcS-5Ej0F2LhkyUe-vzw4STDHgkWR1EkZno6akD0hqBX9Et3vjjyNS-E_3QM3L8&amp;s","Se consultó la Nota a la IA","Se consultó la Nota a la IA","Se consultó el Datos a la IA"
"08/31/2025 09:03:01","https://infobae.com/economia/2025/08/15/caida-libre-las-acciones-de-un-unicornio-argentino-se-hunden-12-en-wall-street-tras-un-mal-balance/","Las acciones de Globant se hunden 14% en Wall Street tras un mal balance","Se consultó el Titulo a la IA","https://encrypted-tbn0.gstatic.com/images?q=tbn:ANd9GcQoIepvXrDOxkb0IYzko47E_MnjLKs3jvjbeYTHAmI_e9fHEjq8MkNbYqHlHnE&amp;s","Se consultó la Nota a la IA","Se consultó la Nota a la IA","Se consultó el Datos a la IA"
"08/31/2025 09:03:01","https://infobae.com/deportes/2025/08/14/river-plate-visitara-a-libertad-en-paraguay-por-la-ida-de-los-octavos-de-final-de-la-copa-libertadores-hora-tv-y-formaciones/","River Plate empató 0-0 ante Libertad en Paraguay por la ida de los octavos de final de la Copa Libertadores","Se consultó el Titulo a la IA","https://encrypted-tbn0.gstatic.com/images?q=tbn:ANd9GcQDVGoqU-xUA9BD3_Jo2WxJoRtcb4iAK3JOWLecHkk8V1fYoPhPpg-VbCr-XA&amp;s","Se consultó la Nota a la IA","Se consultó la Nota a la IA","Se consultó el Datos a la IA"
"08/31/2025 09:03:01","https://infobae.com/venezuela/2025/08/24/maria-corina-machado-advirtio-al-regimen-de-maduro-que-trump-no-esta-jugando-tras-el-despliegue-de-buques-militares-en-el-mar-caribe/","María Corina Machado advirtió al régimen de Maduro que Trump “no está jugando” tras el despliegue de buques militares en el mar Caribe","Se consultó el Titulo a la IA","https://encrypted-tbn0.gstatic.com/images?q=tbn:ANd9GcR6AG9YmMMvBh-T7Cx9Nw2QjlkZOUoe08ZlCYes9gmg2BRoBjfsqG5LCOiL9O4&amp;s","Se consultó la Nota a la IA","Se consultó la Nota a la IA","Se consultó el Datos a la IA"
"08/31/2025 09:03:01","https://infobae.com/sociedad/policiales/2025/08/15/cayo-un-ladron-con-un-amplio-historial-penal-que-intento-robar-una-moto-en-palermo-y-fue-perseguido-por-los-vecinos/","Cayó un ladrón con un amplio historial penal que intentó robar una moto y fue perseguido por los vecinos","Se consultó el Titulo a la IA","https://encrypted-tbn0.gstatic.com/images?q=tbn:ANd9GcQwaeaPVjRPGsWpjxKOeNUuEV_7vKspz1PiqtB-9qySzzRNmsDcsj-meQVDiw&amp;s","Se consultó la Nota a la IA","Se consultó la Nota a la IA","Se consultó el Datos a la IA"
"08/31/2025 09:03:01","https://infobae.com/economia/2025/08/24/caputo-cuestiono-a-la-oposicion-por-el-rechazo-al-veto-presidencial-el-congreso-es-esencialmente-populista/","Caputo cuestionó a la oposición por el rechazo al veto presidencial: “El Congreso es esencialmente populista&quot;","Se consultó el Titulo a la IA","https://encrypted-tbn0.gstatic.com/images?q=tbn:ANd9GcQxzzTbAZnWTzO3XIaXbLVkbikx92ejwXeF4lVZ5aRvJdepewOuXOqhCGJqelg&amp;s","Se consultó la Nota a la IA","Se consultó la Nota a la IA","Se consultó el Datos a la IA"
