"FechayHora","LinkOrigen","TituloOrigen","Titulo","Imagen","Intro","Noticia","Datos"
"09/15/2025 12:30:08","https://infobae.com/america/medio-ambiente/2025/09/15/la-capa-de-ozono-muestra-senales-claras-de-recuperacion/","La capa de ozono muestra señales claras de recuperación","La capa de ozono muestra señales claras de recuperación","https://encrypted-tbn0.gstatic.com/images?q=tbn:ANd9GcTfoxKlL--ExzbOmCuNSwPMTboBlaOUZhI53bILWKjBUCAPZGOC43O5UNE-QQ&amp;s","Un reciente informe indica que la capa de ozono está mostrando signos claros de recuperación, gracias a las acciones globales para limitar el uso de sustancias que agotan este recurso. Investigaciones científicas señalan que, si se mantienen las políticas actuales, se prevé que la capa de ozono se recupere por completo para 2066 en la zona polar de la Antártida y para 2045 en otras regiones. Este avance es considerado un éxito significativo para el medio ambiente, generando optimismo en la lucha contra el cambio climático y la protección de la salud humana. Los expertos destacan la importancia de continuar con las medidas implementadas y garantizar la adherencia a los acuerdos internacionales.","Un reciente informe indica que la capa de ozono está mostrando signos claros de recuperación, gracias a las acciones globales para limitar el uso de sustancias que agotan este recurso. Investigaciones científicas señalan que, si se mantienen las políticas actuales, se prevé que la capa de ozono se recupere por completo para 2066 en la zona polar de la Antártida y para 2045 en otras regiones. Este avance es considerado un éxito significativo para el medio ambiente, generando optimismo en la lucha contra el cambio climático y la protección de la salud humana. Los expertos destacan la importancia de continuar con las medidas implementadas y garantizar la adherencia a los acuerdos internacionales.",
"09/15/2025 12:30:14","https://infobae.com/historias/2025/09/15/dos-motopolicias-con-uniformes-ajustados-y-sin-armas-el-dia-que-se-estreno-la-serie-chips-y-los-cambios-que-lo-llevaron-al-fracaso/","Dos motopolicías con uniformes ajustados y sin armas: el día que se estrenó la serie CHiPs y los cambios que la llevaron al fracaso","Dos motopolicías sin armas y con uniformes ajustados en el estreno de la serie Chips y su camino al fracaso","https://encrypted-tbn0.gstatic.com/images?q=tbn:ANd9GcQU7Q9lt7YPMjfB5mLtRGaZBYoevqNB3geGe5xIJOWrUU8k_2h8cTjR5n3-VME&amp;s","La noticia aborda el estreno de la serie ""CHiPs"" en 1977, centrada en dos motopolicías de California y su impacto en la cultura pop. Describe cómo los protagonistas, que llevan uniformes ajustados y carecen de armas, desafiaron las normas tradicionales de representación policial en la televisión. A pesar de su popularidad inicial, la serie enfrentó críticas y una disminución en la audiencia en sus posteriores temporadas, lo que llevó a su cancelación. Se destacan los cambios en las historias y la percepción del público sobre la policía en ese período. La nota examina el contexto de los años setenta, cuando la serie fue emitida y su eventual declive en popularidad.","La noticia aborda el estreno de la serie ""CHiPs"" en 1977, centrada en dos motopolicías de California y su impacto en la cultura pop. Describe cómo los protagonistas, que llevan uniformes ajustados y carecen de armas, desafiaron las normas tradicionales de representación policial en la televisión. A pesar de su popularidad inicial, la serie enfrentó críticas y una disminución en la audiencia en sus posteriores temporadas, lo que llevó a su cancelación. Se destacan los cambios en las historias y la percepción del público sobre la policía en ese período. La nota examina el contexto de los años setenta, cuando la serie fue emitida y su eventual declive en popularidad.",
"09/15/2025 12:30:14","https://infobae.com/america/america-latina/2025/09/12/como-se-vive-en-brasil-el-dia-posterior-a-la-condena-contra-jair-bolsonaro/","Cómo se vive en Brasil el día posterior a la condena contra Jair Bolsonaro","Brasil enfrenta un nuevo amanecer tras la condena a Jair Bolsonaro","https://encrypted-tbn0.gstatic.com/images?q=tbn:ANd9GcTI4K5ABnZQURvnOhNfxauLi4Qd-MIE54DnACLbNNS4jJ4MsKj99cFEPUZ_oA&amp;s","La noticia aborda la situación en Brasil tras la condena del expresidente Jair Bolsonaro. Al día siguiente del fallo, la sociedad brasileña muestra reacciones divididas. Algunos sectores celebran la decisión judicial, considerándola un paso hacia la justicia y la rendición de cuentas. Por otro lado, los partidarios de Bolsonaro expresan frustración y descontento, viéndolo como un ataque político. La situación genera un clima de tensión y polarización en el país, que se refleja en las calles y redes sociales, mientras diferentes grupos se preparan para movilizaciones en respuesta a la condena.","La noticia aborda la situación en Brasil tras la condena del expresidente Jair Bolsonaro. Al día siguiente del fallo, la sociedad brasileña muestra reacciones divididas. Algunos sectores celebran la decisión judicial, considerándola un paso hacia la justicia y la rendición de cuentas. Por otro lado, los partidarios de Bolsonaro expresan frustración y descontento, viéndolo como un ataque político. La situación genera un clima de tensión y polarización en el país, que se refleja en las calles y redes sociales, mientras diferentes grupos se preparan para movilizaciones en respuesta a la condena.",""
"09/15/2025 12:30:14","https://infobae.com/deportes/2025/09/15/conmocion-en-el-futbol-femenino-una-jugadora-colapso-en-pleno-campo-de-juego-y-el-partido-se-suspendio/","Conmoción en el fútbol femenino: una jugadora colapsó en pleno campo de juego y el partido se suspendió","Jugadora colapsa en pleno partido y se suspende el encuentro en el fútbol femenino","https://encrypted-tbn0.gstatic.com/images?q=tbn:ANd9GcSkrtooP3rAZ4UhDNSd_dgzQdj2n_DqYUOySgP-WX4vFBuB2gyQvOsvAWnf4w&amp;s","Una jugadora de fútbol colapsó durante un partido en el que participaba, lo que llevó a la suspensión del encuentro. El incidente ocurrió en un partido de fútbol femenino en España, generando preocupación entre los presentes. Los equipos y los árbitros se mostraron alarmados, y se llamó a los servicios médicos para atender a la atleta afectada. Las circunstancias de su colapso y su estado de salud no fueron detallados en la noticia.","Una jugadora de fútbol colapsó durante un partido en el que participaba, lo que llevó a la suspensión del encuentro. El incidente ocurrió en un partido de fútbol femenino en España, generando preocupación entre los presentes. Los equipos y los árbitros se mostraron alarmados, y se llamó a los servicios médicos para atender a la atleta afectada. Las circunstancias de su colapso y su estado de salud no fueron detallados en la noticia.",""
"09/15/2025 12:30:14","https://infobae.com/deportes/2025/09/14/impacto-en-el-boxeo-por-la-repentina-muerte-del-cinco-veces-campeon-mundial-ricky-hatton-tras-anunciar-su-regreso-al-ring/","Impacto en el boxeo por la repentina muerte del cinco veces campeón mundial Ricky Hatton tras anunciar su regreso al ring","Impacto en el boxeo por la repentina muerte del cinco veces campeón mundial Ricky Hatton tras anunciar su regreso al ring","https://encrypted-tbn0.gstatic.com/images?q=tbn:ANd9GcR7bhUEqEu6vwjPvHbv61eVL_MXlCnx_7r5-VoQ6ViAymkg2ybE2KEpCJo1gA&amp;s","Ricky Hatton, exboxeador británico y campeón mundial en cinco ocasiones, falleció de manera repentina a los 43 años. Su muerte ha generado un gran impacto en el mundo del boxeo, especialmente tras su reciente anuncio de regreso al ring, lo que sorprendió a muchos aficionados. Hatton fue conocido por sus emocionantes peleas y su carisma, convirtiéndose en una figura emblemática en el deporte. La comunidad del boxeo ha expresado su tristeza y condolencias, recordando su legado y contribuciones al deporte.","Ricky Hatton, exboxeador británico y campeón mundial en cinco ocasiones, falleció de manera repentina a los 43 años. Su muerte ha generado un gran impacto en el mundo del boxeo, especialmente tras su reciente anuncio de regreso al ring, lo que sorprendió a muchos aficionados. Hatton fue conocido por sus emocionantes peleas y su carisma, convirtiéndose en una figura emblemática en el deporte. La comunidad del boxeo ha expresado su tristeza y condolencias, recordando su legado y contribuciones al deporte.",""
"09/15/2025 12:30:14","https://infobae.com/estados-unidos/2025/09/15/asesinato-de-charlie-kirk-proponen-que-sistemas-de-drones-vigilen-actos-publicos-en-estados-unidos/","Proponen que sistemas de drones vigilen actos públicos en Estados Unidos para evitar nuevos asesinatos","Proponen que sistemas de drones vigilen actos públicos en Estados Unidos tras asesinato de Charlie Kirk","https://encrypted-tbn0.gstatic.com/images?q=tbn:ANd9GcRZcH2jwd4Ov1SwF8BPoGuinyZ4WK6uYCBsrROaGombaEptWTTjb79W36SCQg&amp;s","Un grupo de legisladores en Estados Unidos ha propuesto utilizar sistemas de drones para monitorear eventos públicos tras el asesinato de Charlie Kirk, un activista asociado a la derecha política. La intención es aumentar la seguridad en estos eventos y prevenir futuros incidentes violentos. Esta propuesta ha generado debate sobre la privacidad y el uso de tecnología en la vigilancia pública. Los defensores argumentan que la medida es necesaria para proteger a los ciudadanos, mientras que los críticos señalan posibles abusos y la erosión de libertades civiles. ","Un grupo de legisladores en Estados Unidos ha propuesto utilizar sistemas de drones para monitorear eventos públicos tras el asesinato de Charlie Kirk, un activista asociado a la derecha política. La intención es aumentar la seguridad en estos eventos y prevenir futuros incidentes violentos. Esta propuesta ha generado debate sobre la privacidad y el uso de tecnología en la vigilancia pública. Los defensores argumentan que la medida es necesaria para proteger a los ciudadanos, mientras que los críticos señalan posibles abusos y la erosión de libertades civiles. ",""
"09/15/2025 12:30:14","https://infobae.com/estados-unidos/2025/09/11/trump-pidio-una-respuesta-pacifica-al-asesinato-de-charlie-kirk-el-abogaba-contra-la-violencia/","Trump pidió una respuesta pacífica al asesinato de Charlie Kirk: “Él abogaba contra la violencia”","Trump solicita respuesta pacífica tras asesinato de Charlie Kirk","https://encrypted-tbn0.gstatic.com/images?q=tbn:ANd9GcRo51p4CCD-Y2oE02dywd7ZneQLxZO5IW5xpYNrZxFWrdWQDrPIzWWq4Iol4g&amp;s","Charlie Kirk, un destacado conservador y fundador de Turning Point USA, fue asesinado en un tiroteo. En respuesta a este trágico evento, Donald Trump hizo un llamado a la calma, instando a sus seguidores a reaccionar de manera pacífica y a evitar la violencia. Kirk era conocido por su activismo en defensa de principios conservadores y su postura en contra de la violencia. La noticia ha generado una ola de reacciones en la comunidad política y entre los partidarios de la ideología que promovía Kirk.","Charlie Kirk, un destacado conservador y fundador de Turning Point USA, fue asesinado en un tiroteo. En respuesta a este trágico evento, Donald Trump hizo un llamado a la calma, instando a sus seguidores a reaccionar de manera pacífica y a evitar la violencia. Kirk era conocido por su activismo en defensa de principios conservadores y su postura en contra de la violencia. La noticia ha generado una ola de reacciones en la comunidad política y entre los partidarios de la ideología que promovía Kirk.",""
"09/15/2025 12:30:14","https://infobae.com/estados-unidos/2025/09/11/a-24-anos-del-11-de-septiembre-las-heridas-del-ataque-terrorista-mas-devastador-continuan-marcando-a-estados-unidos/","A 24 años del 11 de septiembre, las heridas del ataque terrorista más devastador continúan marcando a Estados Unidos","A 24 años del 11 de septiembre las heridas del ataque terrorista más devastador continúan marcando a Estados Unidos","https://encrypted-tbn0.gstatic.com/images?q=tbn:ANd9GcThUY3Hjr0UNpSSnpoYMtky97IZlobOzViedXeNIsVITIk1USw2pzfm_jMm1Q&amp;s","A 24 años de los ataques del 11 de septiembre, Estados Unidos sigue enfrentando las secuelas de esa jornada trágica. El impacto emocional y físico de los atentados, que dejaron miles de víctimas en Nueva York, Washington D.C. y Pensilvania, se mantiene presente en la sociedad estadounidense. Se han realizado diversas conmemoraciones y se ha reflexionado sobre la importancia de la unidad y la resiliencia nacional. Además, se ha subrayado el continuo esfuerzo por honrar la memoria de los caídos y apoyar a aquellos que sufrieron las consecuencias del terrorismo. La seguridad del país ha evolucionado desde entonces, pero el recuerdo de los ataques sigue vivo en la conciencia colectiva.","A 24 años de los ataques del 11 de septiembre, Estados Unidos sigue enfrentando las secuelas de esa jornada trágica. El impacto emocional y físico de los atentados, que dejaron miles de víctimas en Nueva York, Washington D.C. y Pensilvania, se mantiene presente en la sociedad estadounidense. Se han realizado diversas conmemoraciones y se ha reflexionado sobre la importancia de la unidad y la resiliencia nacional. Además, se ha subrayado el continuo esfuerzo por honrar la memoria de los caídos y apoyar a aquellos que sufrieron las consecuencias del terrorismo. La seguridad del país ha evolucionado desde entonces, pero el recuerdo de los ataques sigue vivo en la conciencia colectiva.",""
"09/15/2025 12:30:14","https://infobae.com/america/mundo/2025/09/15/la-economia-china-se-desploma-la-produccion-industrial-y-del-consumo-registraron-sus-niveles-mas-bajos-en-casi-un-ano/","La economía china se desploma: industria y consumo registraron sus niveles más bajos en casi un año","La economía china se desploma con la producción industrial y del consumo en niveles récord bajos","https://encrypted-tbn0.gstatic.com/images?q=tbn:ANd9GcQt_jhAJZFNUiv8v-Vsz9AKF9DG4f6e2GbY_m5M-pfow0VEa98P15wV3ly5Ug&amp;s","La economía de China enfrenta una fuerte desaceleración, con la producción industrial y el consumo alcanzando niveles mínimos no vistos en casi un año. En agosto, la producción industrial creció solo un 3.7% en comparación con el año anterior, una cifra inferior a las expectativas del mercado. Además, las ventas minoristas aumentaron apenas un 2.5%, evidenciando una baja en la confianza de los consumidores. La situación se agrava por la creciente presión de la deuda y la falta de inversión, lo que plantea preocupaciones sobre la recuperación económica del país.","La economía de China enfrenta una fuerte desaceleración, con la producción industrial y el consumo alcanzando niveles mínimos no vistos en casi un año. En agosto, la producción industrial creció solo un 3.7% en comparación con el año anterior, una cifra inferior a las expectativas del mercado. Además, las ventas minoristas aumentaron apenas un 2.5%, evidenciando una baja en la confianza de los consumidores. La situación se agrava por la creciente presión de la deuda y la falta de inversión, lo que plantea preocupaciones sobre la recuperación económica del país.",""
"09/15/2025 12:30:14","https://infobae.com/america/mundo/2025/09/15/taipei-advierte-sobre-un-posible-efecto-domino-en-asia-si-el-regimen-chino-invade-taiwan/","Taipei advierte sobre un posible efecto dominó en Asia si el régimen chino invade Taiwán","Taipei advierte sobre posible efecto dominó en Asia ante una invasión china a Taiwán","https://encrypted-tbn0.gstatic.com/images?q=tbn:ANd9GcTqsg5MWUWdGHTOiT8yZQpzXas3YVEZQblyTkbQeRpfc1lNuFA-smIYrJ2Ghcs&amp;s","Taipei ha alertado sobre las posibles consecuencias en la región asiática en caso de una invasión china a Taiwán. Autoridades taiwanesas advierten que tal acción podría desencadenar un efecto dominó que afectaría a otros países en Asia y provocar tensiones geopolíticas significativas. La advertencia refuerza la preocupación existente por la creciente agresividad de China en su política exterior y sus aspiraciones de reunificación con Taiwán. La situación resalta la necesidad de una atención internacional sobre el tema y la importancia de mantener la estabilidad en la región.","Taipei ha alertado sobre las posibles consecuencias en la región asiática en caso de una invasión china a Taiwán. Autoridades taiwanesas advierten que tal acción podría desencadenar un efecto dominó que afectaría a otros países en Asia y provocar tensiones geopolíticas significativas. La advertencia refuerza la preocupación existente por la creciente agresividad de China en su política exterior y sus aspiraciones de reunificación con Taiwán. La situación resalta la necesidad de una atención internacional sobre el tema y la importancia de mantener la estabilidad en la región.",""
"09/15/2025 12:30:14","https://infobae.com/estados-unidos/2025/09/15/estados-unidos-y-china-alcanzaron-un-acuerdo-inicial-sobre-tiktok-trump-anuncio-que-hablara-con-xi-jinping-este-viernes/","EEUU y China alcanzaron un acuerdo inicial sobre TikTok: Trump anunció que hablará con Xi Jinping este viernes","Estados Unidos y China alcanzan un acuerdo inicial sobre TikTok","https://encrypted-tbn0.gstatic.com/images?q=tbn:ANd9GcRzs8wb8cbBdOYj4wSBkKySoYRGNXNJHaDHpMnllCYdPjt7QzmbRzNv9Juhwg&amp;s","Estados Unidos y China han llegado a un acuerdo inicial sobre TikTok, según anunció el expresidente Donald Trump. El acuerdo incluye medidas para abordar preocupaciones sobre la seguridad de datos y el funcionamiento de la aplicación en EE. UU. Trump también indicó que se comunicará con el presidente chino Xi Jinping para discutir detalles adicionales. Este desarrollo marca un avance en las relaciones entre ambos países en medio de tensiones comerciales y tecnológicas.","Estados Unidos y China han llegado a un acuerdo inicial sobre TikTok, según anunció el expresidente Donald Trump. El acuerdo incluye medidas para abordar preocupaciones sobre la seguridad de datos y el funcionamiento de la aplicación en EE. UU. Trump también indicó que se comunicará con el presidente chino Xi Jinping para discutir detalles adicionales. Este desarrollo marca un avance en las relaciones entre ambos países en medio de tensiones comerciales y tecnológicas.",""
"09/15/2025 12:30:14","https://infobae.com/deportes/2025/09/13/el-noble-gesto-en-el-mundial-de-atletismo-que-recorre-el-mundo-se-golpeo-en-los-ultimos-metros-y-un-rival-lo-ayudo-a-llegar-hasta-la-meta/","El noble gesto en el Mundial de Atletismo que recorre el mundo: se lastimó en los últimos metros y un rival lo ayudó a llegar hasta la meta","El gesto de deportividad que emocionó en el Mundial de Atletismo","https://encrypted-tbn0.gstatic.com/images?q=tbn:ANd9GcQiBFiiYXpQohtlwP-07y6xjfEs8wOT3INWvHjyFCq1Q-w8xaNdVD7KHgU9GWU&amp;s","En el reciente Mundial de Atletismo, un emotivo gesto de deportividad se destacó cuando un atleta se cayó cerca de la meta y recibió la ayuda de un competidor. A pesar de su propio esfuerzo por ganar, el rival se detuvo para asistirlo, impidiendo que quedara atrás. Juntos, lograron cruzar la línea de llegada, generando una fuerte impresión entre los espectadores y resaltando el espíritu de compañerismo en el deporte. Este acto ha sido ampliamente compartido y celebrad por su humanidad y solidaridad en un ambiente competitivo.","En el reciente Mundial de Atletismo, un emotivo gesto de deportividad se destacó cuando un atleta se cayó cerca de la meta y recibió la ayuda de un competidor. A pesar de su propio esfuerzo por ganar, el rival se detuvo para asistirlo, impidiendo que quedara atrás. Juntos, lograron cruzar la línea de llegada, generando una fuerte impresión entre los espectadores y resaltando el espíritu de compañerismo en el deporte. Este acto ha sido ampliamente compartido y celebrad por su humanidad y solidaridad en un ambiente competitivo.",""
"09/15/2025 12:30:14","https://infobae.com/america/mundo/2025/09/14/ucrania-ofrecio-su-apoyo-a-la-otan-tras-las-recientes-incursiones-de-drones-rusos-en-polonia-y-rumania/","Ucrania ofreció su apoyo a la OTAN tras las recientes incursiones de drones rusos en Polonia y Rumania","Ucrania ofrece su apoyo a la OTAN tras incursiones de drones rusos en Polonia y Rumania","https://encrypted-tbn0.gstatic.com/images?q=tbn:ANd9GcTqTLGR4PUrMrqHKvmlye_7Al40Auu-vta_f2HXm-vBh7BAlKC7b6G7CFuJ6pU&amp;s","Ucrania ha manifestado su disposición para apoyar a la OTAN en respuesta a los recientes ataques con drones por parte de Rusia en Polonia y Rumania. Las autoridades ucranianas expresaron su preocupación por la escalada de estas incursiones, que representan un riesgo para la seguridad en la región. En este contexto, Kiev ha ofrecido colaborar estrechamente con los países miembros de la alianza militar para abordar la amenaza rusa y fortalecer la defensa colectiva.","Ucrania ha manifestado su disposición para apoyar a la OTAN en respuesta a los recientes ataques con drones por parte de Rusia en Polonia y Rumania. Las autoridades ucranianas expresaron su preocupación por la escalada de estas incursiones, que representan un riesgo para la seguridad en la región. En este contexto, Kiev ha ofrecido colaborar estrechamente con los países miembros de la alianza militar para abordar la amenaza rusa y fortalecer la defensa colectiva.",""
"09/15/2025 12:30:14","https://infobae.com/deportes/2025/09/15/la-sorprendente-cifra-que-gano-floyd-mayweather-por-apostar-por-terence-crawford-contra-canelo-alvarez/","La sorprendente cifra que ganó Floyd Mayweather por apostar por Terence Crawford contra Canelo Álvarez","Floyd Mayweather obtiene una sorprendente ganancia al apostar por Terence Crawford contra Canelo Álvarez","https://encrypted-tbn0.gstatic.com/images?q=tbn:ANd9GcTvgq3izpnd-1cOvC7PpBnLcqYM1fNFE97tkk3BJ2-c2KF_DwiGFUyuNWFn1Qs&amp;s","Floyd Mayweather ha obtenido una ganancia significativa al apostar más de un millón de dólares por Terence Crawford en su pelea contra Canelo Álvarez. Esta apuesta se realizó ante una fuerte expectativa del público, dado el gran interés en el enfrentamiento entre ambos boxeadores. Mayweather, un reconocido ex campeón del mundo, ha destacado la habilidad de Crawford y su potencial para triunfar sobre Álvarez. La victoria de Crawford en este combate no solo reafirma su estatus en el boxeo, sino que también ha resultado en un importante beneficio económico para Mayweather debido a su apuesta.","Floyd Mayweather ha obtenido una ganancia significativa al apostar más de un millón de dólares por Terence Crawford en su pelea contra Canelo Álvarez. Esta apuesta se realizó ante una fuerte expectativa del público, dado el gran interés en el enfrentamiento entre ambos boxeadores. Mayweather, un reconocido ex campeón del mundo, ha destacado la habilidad de Crawford y su potencial para triunfar sobre Álvarez. La victoria de Crawford en este combate no solo reafirma su estatus en el boxeo, sino que también ha resultado en un importante beneficio económico para Mayweather debido a su apuesta.",""
"09/15/2025 12:30:14","https://infobae.com/venezuela/2025/09/13/nueva-amenaza-de-diosdado-cabello-a-eeuu-que-se-preparen-para-una-guerra-de-100-anos-si-ponen-un-pie-en-venezuela/","Nueva amenaza de Diosdado Cabello a EEUU: “Que se preparen para una guerra de 100 años si ponen un pie en Venezuela”","Diosdado Cabello advierte a EE. UU. sobre una guerra de 100 años si intervienen en Venezuela","https://encrypted-tbn0.gstatic.com/images?q=tbn:ANd9GcQRGW_ldCKHftrTsrawhes7xyLApayjKdMnmXkEOf5w3wRv-KWyPMDKkmeMvhY&amp;s","Diosdado Cabello, dirigente del oficialismo en Venezuela, lanzó una advertencia a Estados Unidos, señalando que si el país norteamericano interviene en Venezuela, se enfrentarán a una guerra que podría durar un siglo. Esta declaración se produjo en un contexto de tensiones políticas y sociales en la nación sudamericana, subrayando la postura beligerante del gobierno venezolano frente a cualquier amenaza percibida de intervención extranjera. Cabello enfatizó que el pueblo venezolano está preparado para defender su soberanía.","Diosdado Cabello, dirigente del oficialismo en Venezuela, lanzó una advertencia a Estados Unidos, señalando que si el país norteamericano interviene en Venezuela, se enfrentarán a una guerra que podría durar un siglo. Esta declaración se produjo en un contexto de tensiones políticas y sociales en la nación sudamericana, subrayando la postura beligerante del gobierno venezolano frente a cualquier amenaza percibida de intervención extranjera. Cabello enfatizó que el pueblo venezolano está preparado para defender su soberanía.",""
