"FechayHora","LinkOrigen","TituloOrigen","Titulo","Imagen","Intro","Noticia","Datos"
"10/06/2025 12:00:22","https://infobae.com/america/mundo/2025/10/04/ucrania-devolvio-a-sus-familias-a-22-ninos-y-adolescentes-que-estaban-en-manos-rusas/","Ucrania devolvió a sus familias a 22 niños y adolescentes que estaban en manos rusas","Ucrania devuelve a 22 niños y adolescentes que estaban en manos rusas","https://encrypted-tbn0.gstatic.com/images?q=tbn:ANd9GcSA_Pm_Y58jrc81RHMvIodn-vNunS_9ND1ONLb84-XUDRkHeO_IcnsmYslAWA&amp;s","Ucrania ha logrado devolver a 22 niños y adolescentes que se encontraban bajo el control de Rusia. Este esfuerzo forma parte de una operación más amplia para recuperar a menores que han sido separados de sus familias debido al conflicto en la región. Las autoridades ucranianas han intensificado sus esfuerzos para reunificar a estos jóvenes con sus seres queridos.","Ucrania ha logrado devolver a 22 niños y adolescentes que se encontraban bajo el control de Rusia. Este esfuerzo forma parte de una operación más amplia para recuperar a menores que han sido separados de sus familias debido al conflicto en la región. Las autoridades ucranianas han intensificado sus esfuerzos para reunificar a estos jóvenes con sus seres queridos.",""
"10/06/2025 12:00:22","https://infobae.com/america/mundo/2025/10/05/netanyahu-ordeno-pausar-ciertos-ataques-en-gaza-antes-de-las-negociaciones-con-los-terroristas-de-hamas/","Netanyahu ordenó pausar “ciertos ataques” en Gaza antes de las negociaciones con Hamas","Netanyahu ordena pausar ciertos ataques en Gaza antes de negociaciones con Hamas","https://encrypted-tbn0.gstatic.com/images?q=tbn:ANd9GcSvWBgNxjF5fC8Ua8ue6e6qxlx1c7MWH56gajgREwTQtufR_Lw0gdeBMyo0TA&amp;s","El primer ministro israelí, Benjamin Netanyahu, decidió suspender ciertas operaciones militares en Gaza con el objetivo de facilitar las negociaciones con Hamas. Esta pausa se produce en un contexto de intensas tensiones y conflictos en la región, donde las conversaciones buscan abordar la situación humanitaria y los rehenes en manos del grupo terrorista. La decisión de Netanyahu intenta abrir espacio para el diálogo, a pesar de las continuas hostilidades que han marcado el conflicto en los últimos meses.","El primer ministro israelí, Benjamin Netanyahu, decidió suspender ciertas operaciones militares en Gaza con el objetivo de facilitar las negociaciones con Hamas. Esta pausa se produce en un contexto de intensas tensiones y conflictos en la región, donde las conversaciones buscan abordar la situación humanitaria y los rehenes en manos del grupo terrorista. La decisión de Netanyahu intenta abrir espacio para el diálogo, a pesar de las continuas hostilidades que han marcado el conflicto en los últimos meses.",""
"10/06/2025 12:00:22","https://infobae.com/america/mundo/2025/10/04/el-alto-comisionado-de-la-onu-para-los-ddhh-dijo-que-el-plan-de-paz-para-gaza-representa-una-oportunidad-vital/","El Alto Comisionado de la ONU para los DDHH dijo que el plan de paz para Gaza representa una “oportunidad vital”","El Alto Comisionado de la ONU para los Derechos Humanos afirma que el plan de paz para Gaza es una oportunidad vital","https://encrypted-tbn0.gstatic.com/images?q=tbn:ANd9GcSZOGBZs_Ja5FHgXNHEloqepoIDglEvxrrSks3inqO11SwWt_X0s7h0SKWydfE&amp;s","El Alto Comisionado de las Naciones Unidas para los Derechos Humanos destacó que el plan de paz propuesto para Gaza es una oportunidad crucial para abordar la situación en la región. En su declaración, subrayó la importancia de encontrar una solución duradera que garantice el respeto a los derechos humanos y promueva la estabilidad en la zona afectada. La comunidad internacional debe unirse para apoyar iniciativas que busquen el bienestar de la población de Gaza y contribuyan a un futuro pacífico.","El Alto Comisionado de las Naciones Unidas para los Derechos Humanos destacó que el plan de paz propuesto para Gaza es una oportunidad crucial para abordar la situación en la región. En su declaración, subrayó la importancia de encontrar una solución duradera que garantice el respeto a los derechos humanos y promueva la estabilidad en la zona afectada. La comunidad internacional debe unirse para apoyar iniciativas que busquen el bienestar de la población de Gaza y contribuyan a un futuro pacífico.",""
"10/06/2025 12:00:22","https://infobae.com/deportes/2025/10/02/la-fifa-presentara-el-balon-oficial-del-mundial-2026-todas-las-pelotas-que-se-usaron-y-su-impactante-evolucion-desde-1930/","La FIFA presentará el balón oficial del Mundial 2026: la evolución de las pelotas utilizadas en el torneo","La FIFA presentará el balón oficial del Mundial 2026 y su evolución desde 1930","https://encrypted-tbn0.gstatic.com/images?q=tbn:ANd9GcS-9GUDiFBQsP83MWk-0L7WqMODIOJsEWBQFJBGM9RwMaFuANEPW4ebmcGzgw&amp;s","La FIFA está por presentar el balón oficial para el Mundial 2026, continuando una tradición que data desde el primer torneo en 1930. A lo largo de la historia, los balones han evolucionado en diseño y tecnología. En esta presentación, se destacará cómo cada balón ha reflejado los avances técnicos y estéticos en el deporte. La noticia también ofrece un repaso de los distintos balones utilizados en cada Copa del Mundo y cómo su desarrollo ha influido en el juego.","La FIFA está por presentar el balón oficial para el Mundial 2026, continuando una tradición que data desde el primer torneo en 1930. A lo largo de la historia, los balones han evolucionado en diseño y tecnología. En esta presentación, se destacará cómo cada balón ha reflejado los avances técnicos y estéticos en el deporte. La noticia también ofrece un repaso de los distintos balones utilizados en cada Copa del Mundo y cómo su desarrollo ha influido en el juego.",""
"10/06/2025 12:00:22","https://infobae.com/deportes/2025/10/05/los-rumores-de-romance-entre-vinicius-y-una-conductora-de-tv-ex-pareja-de-un-cantante-que-dan-que-hablar-en-brasil/","Los rumores de romance entre Vinícius y una conductora de TV ex pareja de un cantante que dan que hablar en Brasil","Rumores de romance entre Vinicius y conductora de TV en Brasil","https://encrypted-tbn0.gstatic.com/images?q=tbn:ANd9GcRrMh__y3GGBE_kY6_pV99goPEN-QLm7eAXFiK0sPViPkGUAeQEbtuj2j8fB9M&amp;s","La noticia informa sobre los rumores de un posible romance entre el futbolista Vinicius Junior y una presentadora de televisión brasileña, ex pareja de un conocido cantante. La interacción entre ambos ha captado la atención mediática en Brasil y ha generado diversas especulaciones en las redes sociales. Aunque ambos han desmentido cualquier relación amorosa, la cercanía entre ellos sigue siendo motivo de conversación entre los fanáticos y medios.","La noticia informa sobre los rumores de un posible romance entre el futbolista Vinicius Junior y una presentadora de televisión brasileña, ex pareja de un conocido cantante. La interacción entre ambos ha captado la atención mediática en Brasil y ha generado diversas especulaciones en las redes sociales. Aunque ambos han desmentido cualquier relación amorosa, la cercanía entre ellos sigue siendo motivo de conversación entre los fanáticos y medios.",""
"10/06/2025 12:00:22","https://infobae.com/america/america-latina/2025/10/03/china-y-nicaragua-profundizan-su-alianza-beijing-financiara-la-construccion-de-una-planta-de-energia-eolica/","China y Nicaragua profundizan su alianza: Beijing financiará la construcción de una planta de energía eólica","China y Nicaragua fortalecen su alianza con la financiación de una planta de energía eólica","https://encrypted-tbn0.gstatic.com/images?q=tbn:ANd9GcRNmc8qQQPd_2BdsGtSwRMF2Um60XCnGbDk_jVn3S7D3baqF-ooHw-aAYbhow&amp;s","China y Nicaragua han reforzado su colaboración mediante un acuerdo que contempla la construcción de una planta de energía eólica en el país centroamericano. La inversión, que asciende a aproximadamente 95 millones de dólares, tiene como objetivo potenciar la generación de energía renovable en Nicaragua. Esta iniciativa forma parte de un compromiso más amplio entre ambas naciones, que incluye el desarrollo de infraestructura y proyectos energéticos. El acuerdo refleja el creciente interés de Beijing en la región y su estrategia por fortalecer lazos con países de América Latina.","China y Nicaragua han reforzado su colaboración mediante un acuerdo que contempla la construcción de una planta de energía eólica en el país centroamericano. La inversión, que asciende a aproximadamente 95 millones de dólares, tiene como objetivo potenciar la generación de energía renovable en Nicaragua. Esta iniciativa forma parte de un compromiso más amplio entre ambas naciones, que incluye el desarrollo de infraestructura y proyectos energéticos. El acuerdo refleja el creciente interés de Beijing en la región y su estrategia por fortalecer lazos con países de América Latina.",""
"10/06/2025 12:00:22","https://infobae.com/deportes/2025/10/05/el-romance-entre-una-estrella-del-tenis-y-la-ex-pareja-de-una-figura-de-la-premier-que-revoluciona-europa/","El romance entre una estrella del tenis y la ex pareja de una figura de la Premier que revoluciona Europa","Romance entre estrella del tenis y ex pareja de figura de la Premier sacude Europa","https://encrypted-tbn0.gstatic.com/images?q=tbn:ANd9GcRU3C6f_4jixvN737JLDt5ShqHwEU5Xp9AGQWBUDf6JUrSUyNoHPHpgyPOgZDw&amp;s","Una destacada figura del tenis se ha visto envuelta en un romance con la ex pareja de un conocido futbolista de la Premier League. Esta relación ha captado la atención de los medios y ha generado especulaciones en Europa. Ambos han sido objeto de interés tanto por sus carreras como por su vida personal, lo que ha llevado a un aumento en la cobertura mediática sobre su vínculo.","Una destacada figura del tenis se ha visto envuelta en un romance con la ex pareja de un conocido futbolista de la Premier League. Esta relación ha captado la atención de los medios y ha generado especulaciones en Europa. Ambos han sido objeto de interés tanto por sus carreras como por su vida personal, lo que ha llevado a un aumento en la cobertura mediática sobre su vínculo.",""
"10/06/2025 12:00:22","https://infobae.com/america/mundo/2025/10/05/el-regimen-de-iran-anuncio-la-suspension-del-acuerdo-de-cooperacion-nuclear-con-el-oiea-tras-las-nuevas-sanciones-de-la-onu/","El régimen de Irán anunció la suspensión del acuerdo de cooperación nuclear con el OIEA tras las nuevas sanciones de la ONU","Irán suspende acuerdo de cooperación nuclear con el OIEA tras sanciones de la ONU","https://encrypted-tbn0.gstatic.com/images?q=tbn:ANd9GcTW0CwxNhRezGxJHY3VUiEmoNrGya0HqI-uyGbMYBXG3kWtFCRCN2qr5I3Fruo&amp;s","Irán ha decidido suspender el acuerdo de cooperación nuclear con el Organismo Internacional de Energía Atómica (OIEA) en respuesta a nuevas sanciones impuestas por la ONU. La medida refleja la creciente tensión entre Teherán y la comunidad internacional, en especial tras las recientes decisiones que afectan sus actividades nucleares. El régimen iraní considera que estas sanciones son injustas y perjudiciales, lo cual ha llevado a esta acción unilateral.","Irán ha decidido suspender el acuerdo de cooperación nuclear con el Organismo Internacional de Energía Atómica (OIEA) en respuesta a nuevas sanciones impuestas por la ONU. La medida refleja la creciente tensión entre Teherán y la comunidad internacional, en especial tras las recientes decisiones que afectan sus actividades nucleares. El régimen iraní considera que estas sanciones son injustas y perjudiciales, lo cual ha llevado a esta acción unilateral.",""
"10/06/2025 12:00:22","https://infobae.com/america/mundo/2025/10/05/un-veterano-israeli-de-73-anos-comparo-la-guerra-de-yom-kippur-con-gaza-esta-es-la-mas-larga-y-mas-dura-que-hemos-tenido/","Un veterano israelí de 73 años comparó la Guerra de Yom Kippur con Gaza: “Esta es la más larga y más dura que hemos tenido”","Veterano israelí de 73 años compara guerra de Yom Kipur con conflicto en Gaza","https://encrypted-tbn0.gstatic.com/images?q=tbn:ANd9GcSuMqb_uwlOrVblHdf-ONQcPEBRLIXVMSwrQlFsRubrojJK5-j2ywMjO3dMMQ&amp;s","Un veterano israelí de 73 años, que participó en la Guerra de Yom Kippur, ha comparado el conflicto actual en Gaza con esa guerra, destacando que la situación actual es la más prolongada y difícil que Israel ha enfrentado. El hombre, quien ha vivido diversas experiencias a lo largo de su vida, expresó su preocupación por la severidad de la guerra en curso y sus implicaciones para el futuro del país. Esta comparación hace eco de los sentimientos de muchos israelíes que están sintiendo el peso del conflicto de manera intensa.","Un veterano israelí de 73 años, que participó en la Guerra de Yom Kippur, ha comparado el conflicto actual en Gaza con esa guerra, destacando que la situación actual es la más prolongada y difícil que Israel ha enfrentado. El hombre, quien ha vivido diversas experiencias a lo largo de su vida, expresó su preocupación por la severidad de la guerra en curso y sus implicaciones para el futuro del país. Esta comparación hace eco de los sentimientos de muchos israelíes que están sintiendo el peso del conflicto de manera intensa.",""
"10/06/2025 12:00:22","https://infobae.com/america/mundo/2025/10/04/el-plan-de-donald-trump-para-gaza-expone-una-fractura-interna-en-el-grupo-terrorista-hamas/","El plan de Trump expone una fractura interna en el grupo terrorista Hamas","El plan de Donald Trump para Gaza revela divisiones dentro de Hamas","https://encrypted-tbn0.gstatic.com/images?q=tbn:ANd9GcQJ5oVV7gB3CGHdnrKxsvrPxilyXbyAHyFUTOPc6vO4qOHs7v4Hdg0VDY4bZ8o&amp;s","La noticia aborda un nuevo plan de Donald Trump relacionado con Gaza, que revela tensiones internas dentro de Hamas. El enfoque del ex presidente de EE.UU. busca un cambio en la dinámica de la región y pretende abordar las particularidades del conflicto. Esta estrategia ha generado divisiones dentro del grupo terrorista, donde diferentes facciones tienen visiones opuestas sobre cómo enfrentarse a la situación. Se señala que esta fragmentación podría afectar la capacidad de Hamas para unirse y responder de manera efectiva a los desafíos presentados por el plan de Trump.","La noticia aborda un nuevo plan de Donald Trump relacionado con Gaza, que revela tensiones internas dentro de Hamas. El enfoque del ex presidente de EE.UU. busca un cambio en la dinámica de la región y pretende abordar las particularidades del conflicto. Esta estrategia ha generado divisiones dentro del grupo terrorista, donde diferentes facciones tienen visiones opuestas sobre cómo enfrentarse a la situación. Se señala que esta fragmentación podría afectar la capacidad de Hamas para unirse y responder de manera efectiva a los desafíos presentados por el plan de Trump.",""
"10/06/2025 12:00:22","https://infobae.com/tendencias/2025/10/06/los-mitos-mas-comunes-sobre-el-sexo-estudios-recientes-revelan-como-despertar-y-mantener-el-deseo/","Los mitos más comunes sobre el sexo: estudios recientes revelan cómo despertar y mantener el deseo","Los mitos más comunes sobre el sexo y cómo despertar y mantener el deseo según estudios recientes","https://encrypted-tbn0.gstatic.com/images?q=tbn:ANd9GcQl2_ofNniygmcN5LtGYpdWGk3_9OxZCPeBn7BkTPAShvsYxeWzNNnLEsmL2g&amp;s","La noticia aborda mitos comunes sobre la sexualidad y cómo estos afectan el deseo sexual en las personas. Investigaciones recientes indican que ideas erróneas, como la creencia de que el deseo sexual debe ser constante, pueden llevar a insatisfacción en la vida sexual. Se destaca la importancia de reconocer que el deseo puede fluctuar y que factores emocionales, físicos y contextuales influyen en él. Además, se sugiere que una comunicación abierta entre las parejas y la exploración de nuevas experiencias pueden ser clave para despertar y mantener el deseo. La noticia subraya la necesidad de desmitificar creencias populares para mejorar la salud sexual y la intimidad en las relaciones.","La noticia aborda mitos comunes sobre la sexualidad y cómo estos afectan el deseo sexual en las personas. Investigaciones recientes indican que ideas erróneas, como la creencia de que el deseo sexual debe ser constante, pueden llevar a insatisfacción en la vida sexual. Se destaca la importancia de reconocer que el deseo puede fluctuar y que factores emocionales, físicos y contextuales influyen en él. Además, se sugiere que una comunicación abierta entre las parejas y la exploración de nuevas experiencias pueden ser clave para despertar y mantener el deseo. La noticia subraya la necesidad de desmitificar creencias populares para mejorar la salud sexual y la intimidad en las relaciones.",""
"10/06/2025 12:00:22","https://infobae.com/america/america-latina/2025/10/04/el-gobierno-de-ecuador-revoco-la-licencia-ambiental-al-proyecto-minero-loma-larga-por-riesgo-hidrico-en-azuay/","El gobierno de Ecuador revocó la licencia ambiental al proyecto minero Loma Larga por riesgo hídrico en Azuay","Gobierno de Ecuador revoca licencia ambiental al proyecto minero Loma Larga por riesgo hídrico en Azuay","https://encrypted-tbn0.gstatic.com/images?q=tbn:ANd9GcQ--IxqHEXPW534o2IQX8IWUDiXaahLArMSZ5X8RHqopxvWrbF3XGovEvgrRw&amp;s","El gobierno de Ecuador ha retirado la licencia ambiental del proyecto minero Loma Larga, ubicado en la provincia de Azuay, debido a preocupaciones sobre el impacto en los recursos hídricos de la zona. Esta decisión se basa en un análisis que señala riesgos ambientales y posibles afectaciones a las fuentes de agua locales, lo que ha llevado a la administración a priorizar la protección del medio ambiente sobre el desarrollo minero. La medida ha generado reacciones entre los grupos a favor y en contra de la minería en el país.","El gobierno de Ecuador ha retirado la licencia ambiental del proyecto minero Loma Larga, ubicado en la provincia de Azuay, debido a preocupaciones sobre el impacto en los recursos hídricos de la zona. Esta decisión se basa en un análisis que señala riesgos ambientales y posibles afectaciones a las fuentes de agua locales, lo que ha llevado a la administración a priorizar la protección del medio ambiente sobre el desarrollo minero. La medida ha generado reacciones entre los grupos a favor y en contra de la minería en el país.",""
"10/06/2025 12:00:22","https://infobae.com/america/mundo/2025/10/02/tusk-denuncio-otro-incidente-con-buques-rusos-y-sugirio-que-viktor-orban-esta-del-lado-de-putin-la-guerra-es-blanco-o-negro/","Tusk denunció otro incidente con buques rusos y sugirió que Orban está del lado de Putin: “La guerra es blanco o negro”","Tusk denuncia incidente con buques rusos y sugiere que Orban apoya a Putin","https://encrypted-tbn0.gstatic.com/images?q=tbn:ANd9GcTb6iIn5UwAWplhla8sG-pMzW5uixCT39XZ2pSKwYOnAwOhHeli57L7mY20nw&amp;s","En un reciente incidente, Donald Tusk, líder de la oposición polaca y ex primer ministro, reportó un nuevo altercado relacionado con buques rusos en el Mar Báltico. Tusk realizó estas declaraciones durante un evento en Polonia, donde también criticó al primer ministro húngaro Viktor Orbán, sugiriendo que su postura está alineada con la de Rusia y el presidente Vladimir Putin. Tusk destacó que la situación actual en Europa se presenta en términos absolutos, describiéndola como una guerra en blanco y negro, donde es necesario tomar una clara posición.","En un reciente incidente, Donald Tusk, líder de la oposición polaca y ex primer ministro, reportó un nuevo altercado relacionado con buques rusos en el Mar Báltico. Tusk realizó estas declaraciones durante un evento en Polonia, donde también criticó al primer ministro húngaro Viktor Orbán, sugiriendo que su postura está alineada con la de Rusia y el presidente Vladimir Putin. Tusk destacó que la situación actual en Europa se presenta en términos absolutos, describiéndola como una guerra en blanco y negro, donde es necesario tomar una clara posición.",""
"10/06/2025 12:00:22","https://infobae.com/america/america-latina/2025/10/04/la-union-europea-supervisara-el-historico-balotaje-en-bolivia-que-definira-al-proximo-presidente/","La Unión Europea supervisará el histórico balotaje en Bolivia que definirá al próximo presidente","La Unión Europea supervisará el histórico balotaje en Bolivia que definirá al próximo presidente","https://encrypted-tbn0.gstatic.com/images?q=tbn:ANd9GcTll360tb32Zipu_M-by4hDrQIqy4aVdI8cAKg-8pJ6Acfm87ecQm0WjRXsOaw&amp;s","La Unión Europea enviará una misión de observación para supervisar el balotaje presidencial en Bolivia, programado para el 30 de octubre de 2025. Esta será la primera vez que la UE participe en la vigilancia de un proceso electoral en este país. La misión se enfocará en garantizar la transparencia y la legalidad de la votación, un aspecto crucial en un contexto político marcado por tensiones y divisiones. La EU reafirma su compromiso hacia la democracia boliviana, resaltando la importancia de la participación ciudadana en elecciones libres y justas.","La Unión Europea enviará una misión de observación para supervisar el balotaje presidencial en Bolivia, programado para el 30 de octubre de 2025. Esta será la primera vez que la UE participe en la vigilancia de un proceso electoral en este país. La misión se enfocará en garantizar la transparencia y la legalidad de la votación, un aspecto crucial en un contexto político marcado por tensiones y divisiones. La EU reafirma su compromiso hacia la democracia boliviana, resaltando la importancia de la participación ciudadana en elecciones libres y justas.",""
"10/06/2025 12:00:22","https://infobae.com/deportes/2025/10/02/dieron-a-conocer-como-se-repartira-la-herencia-de-franz-beckenbauer-millones-de-euros-multiples-propiedades-y-un-plan-anti-conflictos/","Dieron a conocer cómo se repartirá la herencia de Franz Beckenbauer: millones de euros, múltiples propiedades y un plan anti conflictos","Herencia de Franz Beckenbauer: millones de euros, propiedades y un plan anti conflictos","https://encrypted-tbn0.gstatic.com/images?q=tbn:ANd9GcTM3qW1kVgLw1LOm871eItT5_EVuyyaH0SLp13kM-cFPB3xTNZpW-hyAcrrzQ&amp;s","La herencia de Franz Beckenbauer, el reconocido exfutbolista y entrenador, se ha dado a conocer recientemente. Se estima que su fortuna asciende a millones de euros, junto con diversas propiedades a su nombre. Para evitar conflictos entre sus herederos, Beckenbauer ha diseñado un plan que establece claramente la distribución de sus bienes. Este enfoque busca facilitar una división equitativa y minimizar disputas familiares en el futuro.","La herencia de Franz Beckenbauer, el reconocido exfutbolista y entrenador, se ha dado a conocer recientemente. Se estima que su fortuna asciende a millones de euros, junto con diversas propiedades a su nombre. Para evitar conflictos entre sus herederos, Beckenbauer ha diseñado un plan que establece claramente la distribución de sus bienes. Este enfoque busca facilitar una división equitativa y minimizar disputas familiares en el futuro.",""
"10/06/2025 12:00:22","https://infobae.com/venezuela/2025/10/05/pete-hegsteh-jefe-del-pentagono-si-estas-al-norte-de-venezuela-y-pretendes-traficar-drogas-a-eeuu-eres-un-objetivo-legitimo/","Pete Hegseth, jefe del Pentágono: “Si estás al norte de Venezuela y pretendes traficar drogas a EEUU, eres un objetivo legítimo”","Pete Hegseth advierte sobre el tráfico de drogas desde el norte de Venezuela hacia EE.UU.","https://encrypted-tbn0.gstatic.com/images?q=tbn:ANd9GcRc7rKu_z2m0CgfyHW4Xty68ibnFoKet5Yx83qf_cG5AxgQEWWslUq1cRV7hoU&amp;s","El jefe del Pentágono, Pete Hegseth, advirtió que cualquier persona que intente traficar drogas desde el norte de Venezuela hacia Estados Unidos se convierte en un objetivo legítimo para las fuerzas estadounidenses. Durante una intervención, Hegseth enfatizó la determinación de su país para enfrentar el narcotráfico, destacando la creciente preocupación por el impacto de estas actividades en la seguridad nacional. Su declaración se enmarca en un contexto de tensiones entre Estados Unidos y Venezuela, así como en la estrategia del gobierno estadounidense para combatir el tráfico de drogas en la región.","El jefe del Pentágono, Pete Hegseth, advirtió que cualquier persona que intente traficar drogas desde el norte de Venezuela hacia Estados Unidos se convierte en un objetivo legítimo para las fuerzas estadounidenses. Durante una intervención, Hegseth enfatizó la determinación de su país para enfrentar el narcotráfico, destacando la creciente preocupación por el impacto de estas actividades en la seguridad nacional. Su declaración se enmarca en un contexto de tensiones entre Estados Unidos y Venezuela, así como en la estrategia del gobierno estadounidense para combatir el tráfico de drogas en la región.",""
