"FechayHora","LinkOrigen","TituloOrigen","Titulo","Imagen","Intro","Noticia","Datos"
"09/23/2025 21:00:12","https://infobae.com/salud/2025/09/23/rinitis-alergica-como-diferenciarla-de-un-resfrio-y-cuando-consultar-a-un-especialista/","Rinitis alérgica: cómo diferenciarla de un resfrío y cuándo consultar a un especialista","Rinitis alérgica cómo diferenciarla de un resfrío y cuándo consultar a un especialista","https://encrypted-tbn0.gstatic.com/images?q=tbn:ANd9GcSXjZEcQwmmlejaYAvxNETO2gWcTUJVeI1voW2X0QvWtsgHklme5ft7lS_HZQ&amp;s","La rinitis alérgica es una condición que se presenta con síntomas como estornudos, congestión nasal y picazón en los ojos, y es frecuentemente confundida con un resfriado común. A diferencia del resfriado, que suele ser provocado por infecciones virales y dura alrededor de una semana, la rinitis alérgica puede persistir mientras la persona esté expuesta a alérgenos, como polen, ácaros o pelos de animales. Es importante consultar a un especialista si los síntomas son persistentes, afectan la calidad de vida o no mejoran con tratamientos de venta libre. Un diagnóstico adecuado puede guiar hacia un tratamiento efectivo.","La rinitis alérgica es una condición que se presenta con síntomas como estornudos, congestión nasal y picazón en los ojos, y es frecuentemente confundida con un resfriado común. A diferencia del resfriado, que suele ser provocado por infecciones virales y dura alrededor de una semana, la rinitis alérgica puede persistir mientras la persona esté expuesta a alérgenos, como polen, ácaros o pelos de animales. Es importante consultar a un especialista si los síntomas son persistentes, afectan la calidad de vida o no mejoran con tratamientos de venta libre. Un diagnóstico adecuado puede guiar hacia un tratamiento efectivo.",
"09/23/2025 21:00:16","https://infobae.com/salud/ciencia/2025/09/23/cientificos-alertan-que-la-contaminacion-del-aire-impacta-en-la-salud-ocular-de-los-ninos/","Científicos alertan que la contaminación del aire impacta en la salud ocular de los niños","Científicos alertan sobre el impacto de la contaminación del aire en la salud ocular de los niños","https://encrypted-tbn0.gstatic.com/images?q=tbn:ANd9GcRqbuphFp46_7Efs-9l0Ep3poCbcNcfBep8hWozUYLa4LZltGga_Lyl7zbgVmA&amp;s","Un grupo de científicos ha advertido sobre el impacto de la contaminación del aire en la salud ocular de los niños. Investigaciones recientes indican que la exposición a contaminantes atmosféricos puede aumentar el riesgo de desarrollar problemas visuales en la infancia. Los expertos destacan que el daño puede ser irreversible y subrayan la necesidad de medidas para reducir la contaminación ambiental, protegiendo así la salud de las generaciones más jóvenes.","Un grupo de científicos ha advertido sobre el impacto de la contaminación del aire en la salud ocular de los niños. Investigaciones recientes indican que la exposición a contaminantes atmosféricos puede aumentar el riesgo de desarrollar problemas visuales en la infancia. Los expertos destacan que el daño puede ser irreversible y subrayan la necesidad de medidas para reducir la contaminación ambiental, protegiendo así la salud de las generaciones más jóvenes.",
"09/23/2025 21:00:19","https://infobae.com/deportes/2025/09/23/giro-inesperado-en-red-bull-la-reconfiguracion-en-la-parrilla-y-quien-apunta-a-ser-el-companero-de-verstappen-en-2026/","Giro en Red Bull: la reconfiguración en la parrilla y quién apunta a ser el compañero de Verstappen en 2026","Reconfiguración en Red Bull y posible compañero de Verstappen para 2026","https://encrypted-tbn0.gstatic.com/images?q=tbn:ANd9GcScR9BMvG2a_3gSlcLtWKWdAbr4aQ-8KhtncEZSEwTOrSKYUK2m-CfAfeLyQP0&amp;s","Red Bull está experimentando cambios en su escudería de Fórmula 1, lo que ha generado especulaciones sobre la formación del equipo para la temporada 2026. Max Verstappen, actual campeón, seguirá siendo el piloto principal, pero se están evaluando diferentes candidatos para ocupar el segundo asiento. Entre los nombres que suenan hay pilotos como Lando Norris, Charles Leclerc y George Russell. La reconfiguración se da en un contexto donde el equipo busca mantener su competitividad en el campeonato. Las decisiones se tomará a lo largo de la próxima temporada, mientras Red Bull analiza las opciones disponibles.","Red Bull está experimentando cambios en su escudería de Fórmula 1, lo que ha generado especulaciones sobre la formación del equipo para la temporada 2026. Max Verstappen, actual campeón, seguirá siendo el piloto principal, pero se están evaluando diferentes candidatos para ocupar el segundo asiento. Entre los nombres que suenan hay pilotos como Lando Norris, Charles Leclerc y George Russell. La reconfiguración se da en un contexto donde el equipo busca mantener su competitividad en el campeonato. Las decisiones se tomará a lo largo de la próxima temporada, mientras Red Bull analiza las opciones disponibles.",
"09/23/2025 21:00:19","https://infobae.com/america/mundo/2025/09/23/zelensky-celebro-el-gran-cambio-en-la-postura-de-trump-al-reconocer-una-posible-victoria-de-ucrania-sobre-rusia/","Zelensky celebró el “gran cambio” en la postura de Trump al reconocer una posible victoria de Ucrania sobre Rusia","Zelensky celebra el cambio en la postura de Trump al reconocer posible victoria de Ucrania sobre Rusia","https://encrypted-tbn0.gstatic.com/images?q=tbn:ANd9GcRTUVr_jDl09xU8MsSG1PIFihbvNjcHdKRkkAOXC64aoB_mx5j8Ca-mPV7Ue9o&amp;s","El presidente de Ucrania, Volodymyr Zelensky, expresó su satisfacción por el cambio en la postura del ex presidente estadounidense Donald Trump, quien ahora reconoce la posibilidad de que Ucrania logre una victoria sobre Rusia en el conflicto actual. Zelensky interpretó este giro como un signo positivo para el apoyo internacional que su país recibe en su lucha. Esta declaración se produce en el contexto de las tensiones continuas entre Ucrania y Rusia, donde la comunidad internacional observa de cerca los desarrollos relacionados con el conflicto.","El presidente de Ucrania, Volodymyr Zelensky, expresó su satisfacción por el cambio en la postura del ex presidente estadounidense Donald Trump, quien ahora reconoce la posibilidad de que Ucrania logre una victoria sobre Rusia en el conflicto actual. Zelensky interpretó este giro como un signo positivo para el apoyo internacional que su país recibe en su lucha. Esta declaración se produce en el contexto de las tensiones continuas entre Ucrania y Rusia, donde la comunidad internacional observa de cerca los desarrollos relacionados con el conflicto.",""
"09/23/2025 21:00:19","https://infobae.com/wapo/2025/09/22/cuatro-sintomas-de-cancer-que-no-se-deben-ignorar-y-como-detectar-senales-de-alerta-segun-un-oncologo/","Cuatro síntomas de cáncer que no se deben ignorar y cómo detectar señales de alerta, según un oncólogo","Cuatro síntomas de cáncer que no se deben ignorar y señales de alerta según un oncólogo","https://encrypted-tbn0.gstatic.com/images?q=tbn:ANd9GcTzMhvF2Y01Wv5pU1AnginL9xlbxq-MKY2xkpUZdQ9TEgATOjB33kKRZjhqB6c&amp;s","Un oncólogo ha identificado cuatro síntomas del cáncer que no deben ser ignorados. Estos síntomas son la pérdida de peso inexplicada, cambios en los hábitos intestinales o urinarios, fatiga persistente y la aparición de bultos o masas anormales. El especialista enfatiza la importancia de estar atentos a estas señales y de realizarse chequeos médicos regulares, pues pueden ser indicativos de procesos más graves. Además, se menciona que la detección temprana es crucial para mejorar el pronóstico y el tratamiento de la enfermedad.","Un oncólogo ha identificado cuatro síntomas del cáncer que no deben ser ignorados. Estos síntomas son la pérdida de peso inexplicada, cambios en los hábitos intestinales o urinarios, fatiga persistente y la aparición de bultos o masas anormales. El especialista enfatiza la importancia de estar atentos a estas señales y de realizarse chequeos médicos regulares, pues pueden ser indicativos de procesos más graves. Además, se menciona que la detección temprana es crucial para mejorar el pronóstico y el tratamiento de la enfermedad.",""
"09/23/2025 21:00:19","https://infobae.com/venezuela/2025/09/22/que-revela-el-informe-de-la-mision-internacional-de-la-onu-sobre-la-represion-y-los-crimenes-de-lesa-humanidad-en-venezuela/","Qué revela el informe de la Misión Internacional de la ONU sobre la represión y los crímenes de lesa humanidad en Venezuela","Informe de la Misión Internacional de la ONU revela represión y crímenes de lesa humanidad en Venezuela","https://encrypted-tbn0.gstatic.com/images?q=tbn:ANd9GcT_V02K44OqpSMzBJDQR99hbMg9Q60LTcfj8YAxvIk198DnFif00f0XEkP0SA&amp;s","La Misión Internacional de la ONU ha presentado un informe que detalla la represión y los crímenes de lesa humanidad cometidos en Venezuela. Este documento destaca las violaciones sistemáticas de derechos humanos perpetradas por las autoridades venezolanas, incluyendo ejecuciones extrajudiciales, torturas y detenciones arbitrarias. El informe también denuncia la impunidad que prevalece en el país, evidenciando la falta de acciones por parte del Estado para investigar y enjuiciar a los responsables. La Misión insta a la comunidad internacional a tomar medidas para abordar esta crisis humanitaria y a considerar acciones que puedan llevar a una rendición de cuentas por estos crímenes.","La Misión Internacional de la ONU ha presentado un informe que detalla la represión y los crímenes de lesa humanidad cometidos en Venezuela. Este documento destaca las violaciones sistemáticas de derechos humanos perpetradas por las autoridades venezolanas, incluyendo ejecuciones extrajudiciales, torturas y detenciones arbitrarias. El informe también denuncia la impunidad que prevalece en el país, evidenciando la falta de acciones por parte del Estado para investigar y enjuiciar a los responsables. La Misión insta a la comunidad internacional a tomar medidas para abordar esta crisis humanitaria y a considerar acciones que puedan llevar a una rendición de cuentas por estos crímenes.",""
"09/23/2025 21:00:19","https://infobae.com/america/mundo/2025/09/23/europa-y-el-regimen-de-iran-acordaron-seguir-con-las-consultas-sobre-las-sanciones-por-la-cuestion-nuclear-irani/","Europa y el régimen de Irán acordaron seguir con las consultas sobre las sanciones por la cuestión nuclear iraní","Europa e Irán acuerdan continuar las consultas sobre sanciones por la cuestión nuclear iraní","https://encrypted-tbn0.gstatic.com/images?q=tbn:ANd9GcQFtmYb0zHkZQ3PwG4iYGduSVi2BMl3aYjX_4wywI7gzKBU36W4d5cjm-PnmlI&amp;s","Europa e Irán han acordado continuar las negociaciones sobre las sanciones relacionadas con el programa nuclear iraní. Las discusiones se centran en encontrar un camino para reactivar el acuerdo nuclear de 2015, que ha sido objeto de tensiones y requerirá un enfoque diplomático. Ambas partes han expresado su interés en mantener el diálogo con el fin de abordar los desafíos existentes. La situación sigue siendo compleja y está influenciada por diversas cuestiones geopolíticas en la región.","Europa e Irán han acordado continuar las negociaciones sobre las sanciones relacionadas con el programa nuclear iraní. Las discusiones se centran en encontrar un camino para reactivar el acuerdo nuclear de 2015, que ha sido objeto de tensiones y requerirá un enfoque diplomático. Ambas partes han expresado su interés en mantener el diálogo con el fin de abordar los desafíos existentes. La situación sigue siendo compleja y está influenciada por diversas cuestiones geopolíticas en la región.",""
"09/23/2025 21:00:19","https://infobae.com/america/mundo/2025/09/23/lula-da-silva-la-agresion-contra-la-independencia-del-poder-judicial-es-inaceptable/","Lula da Silva: “La agresión contra la independencia del poder judicial es inaceptable”","Lula da Silva condena agresión a la independencia del poder judicial","https://encrypted-tbn0.gstatic.com/images?q=tbn:ANd9GcS1_cTRa_dB3LDW84_xWvrycfyXVmf5pNa2NzZ-lUMuBeORaYCwbKvqKpnhWF8&amp;s","El presidente de Brasil, Luiz Inácio Lula da Silva, expresó su rechazo a cualquier intento de socavar la independencia del poder judicial en el país. Durante un evento, Lula destacó que las agresiones a la autonomía de los jueces son inaceptables y advirtió sobre los peligros que esto representa para la democracia. Además, hizo hincapié en la importancia de contar con un sistema judiciario fuerte e independiente para garantizar el equilibrio entre los poderes del Estado. La declaración surge en un contexto de tensiones políticas y cuestionamientos en torno a la labor del poder judicial en Brasil.","El presidente de Brasil, Luiz Inácio Lula da Silva, expresó su rechazo a cualquier intento de socavar la independencia del poder judicial en el país. Durante un evento, Lula destacó que las agresiones a la autonomía de los jueces son inaceptables y advirtió sobre los peligros que esto representa para la democracia. Además, hizo hincapié en la importancia de contar con un sistema judiciario fuerte e independiente para garantizar el equilibrio entre los poderes del Estado. La declaración surge en un contexto de tensiones políticas y cuestionamientos en torno a la labor del poder judicial en Brasil.",""
"09/23/2025 21:00:19","https://infobae.com/venezuela/2025/09/21/youtube-elimino-la-cuenta-del-dictador-nicolas-maduro/","YouTube eliminó la cuenta del dictador Nicolás Maduro","","https://encrypted-tbn0.gstatic.com/images?q=tbn:ANd9GcSknzPnxXMm2-r0GdYeukkGkn4pkUH9SipOo2ysiTeefFsoqFEnK3188ccGT6Y&amp;s","YouTube ha eliminado la cuenta del presidente venezolano Nicolás Maduro. La decisión se debe a la violación de las políticas de la plataforma relacionadas con la desinformación, especialmente en lo que se refiere a la pandemia de COVID-19. La eliminación de la cuenta impide que Maduro utilice esta plataforma para difundir contenido que promueva teorías infundadas sobre la enfermedad. Esta medida se suma a acciones anteriores de otras redes sociales que también han restringido o eliminado cuentas asociadas al líder venezolano por razones similares.","YouTube ha eliminado la cuenta del presidente venezolano Nicolás Maduro. La decisión se debe a la violación de las políticas de la plataforma relacionadas con la desinformación, especialmente en lo que se refiere a la pandemia de COVID-19. La eliminación de la cuenta impide que Maduro utilice esta plataforma para difundir contenido que promueva teorías infundadas sobre la enfermedad. Esta medida se suma a acciones anteriores de otras redes sociales que también han restringido o eliminado cuentas asociadas al líder venezolano por razones similares.",""
"09/23/2025 21:00:19","https://infobae.com/america/mundo/2025/09/23/iran-ejecuto-al-menos-a-1000-personas-este-ano-en-prision-es-una-campana-de-asesinatos-masivos/","Irán ejecutó al menos a 1.000 personas este año en prisión: “Es una campaña de asesinatos masivos”","Irán ejecutó al menos a 1000 personas en prisión este año en una campaña de asesinatos masivos","https://encrypted-tbn0.gstatic.com/images?q=tbn:ANd9GcQiy3TjcFMZhO6QROZE1DxRv5x6_NH2m3R4CawXwsqQ4xFaffyiZTDFwuP427g&amp;s","Irán ha llevado a cabo la ejecución de al menos mil personas en lo que va del año 2025, lo que ha generado preocupación y condena a nivel internacional. La cifra representa un aumento significativo en comparación con años anteriores y se enmarca en una campaña de eliminación sistemática de disidentes y opositores políticos. Activistas y organizaciones de derechos humanos han señalado que estas ejecuciones son parte de una estrategia más amplia del régimen para mantener el control y silenciar la disidencia. La comunidad internacional ha expresado su alarma ante esta situación y ha instado a Irán a cesar estas prácticas inhumanas.","Irán ha llevado a cabo la ejecución de al menos mil personas en lo que va del año 2025, lo que ha generado preocupación y condena a nivel internacional. La cifra representa un aumento significativo en comparación con años anteriores y se enmarca en una campaña de eliminación sistemática de disidentes y opositores políticos. Activistas y organizaciones de derechos humanos han señalado que estas ejecuciones son parte de una estrategia más amplia del régimen para mantener el control y silenciar la disidencia. La comunidad internacional ha expresado su alarma ante esta situación y ha instado a Irán a cesar estas prácticas inhumanas.",""
"09/23/2025 21:00:19","https://infobae.com/estados-unidos/2025/09/23/miles-de-iranies-se-manifestaron-frente-a-la-onu-para-exigir-el-fin-del-regimen-de-los-ayatollahs/","Miles de iraníes se manifestaron frente a la ONU para exigir el fin del régimen de los ayatollahs","Miles de iraníes se manifiestan frente a la ONU para exigir el fin del régimen de los ayatollahs","https://encrypted-tbn0.gstatic.com/images?q=tbn:ANd9GcRiYdMAd9jrCMPzD1ZN_8Wtif6uRm0NYp3jR7sTe1M6BCK1yEzvgcMMoQ-x8Q&amp;s","Miles de iraníes se realizaron una manifestación frente a la sede de la ONU para exigir el derrocamiento del régimen liderado por los ayatollahs. Los protestantes llegaron desde distintas partes del mundo, buscando visibilizar la represión que sufren en Irán y demandando un cambio político significativo en su país. La movilización se llevó a cabo coincidiendo con la apertura de la Asamblea General de la ONU, lo que subrayó la importancia del mensaje que querían transmitir a la comunidad internacional sobre la situación en Irán. Los participantes también pidieron a los líderes mundiales que tomen acciones concretas para apoyar sus demandas.","Miles de iraníes se realizaron una manifestación frente a la sede de la ONU para exigir el derrocamiento del régimen liderado por los ayatollahs. Los protestantes llegaron desde distintas partes del mundo, buscando visibilizar la represión que sufren en Irán y demandando un cambio político significativo en su país. La movilización se llevó a cabo coincidiendo con la apertura de la Asamblea General de la ONU, lo que subrayó la importancia del mensaje que querían transmitir a la comunidad internacional sobre la situación en Irán. Los participantes también pidieron a los líderes mundiales que tomen acciones concretas para apoyar sus demandas.",""
"09/23/2025 21:00:19","https://infobae.com/america/mundo/2025/09/22/putin-amenazo-a-occidente-con-responder-si-cree-que-rusia-esta-bajo-riesgo-no-sera-con-palabras-sino-con-medidas-militares/","Putin amenazó a Occidente con una respuesta militar si cree que Rusia corre riesgo: “No serán palabras”","Putin advierte a Occidente sobre respuestas militares si Rusia se siente amenazada","https://www.google.com/search?q=Putin+amenazó+a+Occidente+con+una+respuesta+militar+si+cree+que+Rusia+corre+riesgo:+“No+serán+palabras”&tbm=isch","El presidente de Rusia, Vladimir Putin, advirtió a Occidente que tomará medidas militares en respuesta a cualquier amenaza percibida hacia su país. Durante un discurso, indicó que su respuesta no sería meramente verbal, enfatizando la determinación de Rusia de defenderse si considera que está en riesgo. Estas declaraciones se inscriben en un contexto de creciente tensión entre Rusia y las potencias occidentales, en medio de conflictos geopolíticos y preocupaciones sobre la seguridad en la región.","El presidente de Rusia, Vladimir Putin, advirtió a Occidente que tomará medidas militares en respuesta a cualquier amenaza percibida hacia su país. Durante un discurso, indicó que su respuesta no sería meramente verbal, enfatizando la determinación de Rusia de defenderse si considera que está en riesgo. Estas declaraciones se inscriben en un contexto de creciente tensión entre Rusia y las potencias occidentales, en medio de conflictos geopolíticos y preocupaciones sobre la seguridad en la región.",""
"09/23/2025 21:00:19","https://infobae.com/america/mundo/2025/09/23/trump-adelanto-que-se-reunira-con-lula-la-proxima-semana-hay-una-quimica-excelente/","Trump adelantó que se reunirá con Lula la próxima semana: “Hay una química excelente”","Trump se reunirá con Lula la próxima semana tras resaltar su excelente química","https://encrypted-tbn0.gstatic.com/images?q=tbn:ANd9GcRzNF3hasZ59r_xkXXOq3JnKSjGOhkz9erJJ4vr71a2aFKG15EJZvLyWdw2jV4&amp;s","Donald Trump anunció que se reunirá con el presidente de Brasil, Luiz Inácio Lula da Silva, la próxima semana. Trump destacó que existe una buena relación entre ambos y mencionó una ""química excelente"". Esta reunión se enmarca en un momento de tensiones políticas y económicas en la región, y se espera que aborden asuntos de interés bilateral.","Donald Trump anunció que se reunirá con el presidente de Brasil, Luiz Inácio Lula da Silva, la próxima semana. Trump destacó que existe una buena relación entre ambos y mencionó una ""química excelente"". Esta reunión se enmarca en un momento de tensiones políticas y económicas en la región, y se espera que aborden asuntos de interés bilateral.",""
"09/23/2025 21:00:19","https://infobae.com/deportes/2025/09/23/los-filosos-dardos-del-padre-de-lamine-yamal-tras-la-gala-del-balon-de-oro-aqui-ha-pasado-algo-muy-raro/","Los filosos dardos del padre de Lamine Yamal tras la gala del Balón de Oro: “Aquí ha pasado algo muy raro”","El padre de Lamine Yamal lanza dardos tras la gala del Balón de Oro: algo muy raro ha sucedido","https://encrypted-tbn0.gstatic.com/images?q=tbn:ANd9GcS1IeoLSyjvDWBYMZbwHNBSiibOxs0-P1yL3FHVs5dZ7-OzpNdHDIsZEHgGCw&amp;s","En una reciente gala del Balón de Oro, el padre de Lamine Yamal expresó su descontento con los resultados, insinuando que hubo irregularidades en la selección de los ganadores. Yamal destacó que la actuación de su hijo, quien es un joven talento del fútbol, merece un reconocimiento más acorde con su desempeño. La crítica se centra en que ciertos jugadores no fueron considerados de manera justa, lo que ha generado controversia en el ámbito deportivo y ha suscitado reacciones en redes sociales.","En una reciente gala del Balón de Oro, el padre de Lamine Yamal expresó su descontento con los resultados, insinuando que hubo irregularidades en la selección de los ganadores. Yamal destacó que la actuación de su hijo, quien es un joven talento del fútbol, merece un reconocimiento más acorde con su desempeño. La crítica se centra en que ciertos jugadores no fueron considerados de manera justa, lo que ha generado controversia en el ámbito deportivo y ha suscitado reacciones en redes sociales.",""
"09/23/2025 21:00:19","https://infobae.com/america/america-latina/2025/09/23/cae-en-bolivia-una-mujer-con-10-kilos-de-cocaina-es-hermana-de-una-sindicalista-allegada-a-evo-morales/","Cayó en Bolivia una mujer con 10 kilos de cocaína: es hermana de una sindicalista allegada a Evo Morales","","https://encrypted-tbn0.gstatic.com/images?q=tbn:ANd9GcQ3Crom_EELc7oy80gynUaAEuVUCs8qQ7rx025c_69u8mdPWxeh5hjE8GH6VXI&amp;s","Una mujer en Bolivia fue detenida con 10 kilogramos de cocaína. Se ha revelado que la arrestada es hermana de una prominente sindicalista cercana a Evo Morales, expresidente del país. La operación se llevó a cabo en un control policial, donde se descubrieron los narcóticos ocultos en su vehículo. Este incidente ha generado preocupación sobre la relación entre el narcotráfico y figuras políticas en el país. Las autoridades continúan investigando el caso.","Una mujer en Bolivia fue detenida con 10 kilogramos de cocaína. Se ha revelado que la arrestada es hermana de una prominente sindicalista cercana a Evo Morales, expresidente del país. La operación se llevó a cabo en un control policial, donde se descubrieron los narcóticos ocultos en su vehículo. Este incidente ha generado preocupación sobre la relación entre el narcotráfico y figuras políticas en el país. Las autoridades continúan investigando el caso.",""
"09/23/2025 21:00:19","https://infobae.com/america/america-latina/2025/09/23/dos-presuntos-miembros-del-tren-de-aragua-fueron-detenidos-en-ecuador-durante-las-protestas-por-el-aumento-del-diesel/","Dos presuntos miembros del Tren de Aragua fueron detenidos en Ecuador durante las protestas por el aumento del precio del diésel","Detienen a dos presuntos miembros del Tren de Aragua en Ecuador durante protestas por el aumento del diésel","https://encrypted-tbn0.gstatic.com/images?q=tbn:ANd9GcSdrnC3HMq8cUpC0_R0sXwVImrbq4ZBNfwvosqiU-QPnHNCsLcmO5GTtlfYseY&amp;s","En Ecuador, durante las protestas por el aumento del precio del diésel, se detuvieron a dos presuntos miembros de la organización criminal Tren de Aragua. Las fuerzas de seguridad llevaron a cabo la captura en medio de un contexto de manifestaciones que han generado tensión en varias ciudades del país. Las autoridades han intensificado su vigilancia ante el posible involucramiento de grupos delictivos en los disturbios.","En Ecuador, durante las protestas por el aumento del precio del diésel, se detuvieron a dos presuntos miembros de la organización criminal Tren de Aragua. Las fuerzas de seguridad llevaron a cabo la captura en medio de un contexto de manifestaciones que han generado tensión en varias ciudades del país. Las autoridades han intensificado su vigilancia ante el posible involucramiento de grupos delictivos en los disturbios.",""
