"FechayHora","LinkOrigen","TituloOrigen","Titulo","Imagen","Intro","Noticia","Datos"
"09/15/2025 12:30:14","https://infobae.com/america/mundo/2025/09/10/la-presidenta-maia-sandu-advirtio-que-rusia-libra-una-guerra-hibrida-sin-precedentes-para-influir-en-las-elecciones-de-moldavia/","La presidenta Maia Sandu advirtió que Rusia libra una “guerra híbrida sin precedentes” para influir en las elecciones de Moldavia","Maia Sandu advierte sobre guerra híbrida de Rusia para influir en elecciones de Moldavia","https://encrypted-tbn0.gstatic.com/images?q=tbn:ANd9GcRK9IWXlsNrKZbzsxUn46dwPNrPGmCkc7VIRcLOzbtkvbjS-VgHwFoJrZqKNQ&amp;s","La presidenta de Moldavia, Maia Sandu, alertó sobre una guerra híbrida sin precedentes que Rusia está llevando a cabo para influir en las próximas elecciones en su país. Sandu destacó que esta campaña de desinformación y manipulación busca desestabilizar a Moldavia y afectar la soberanía nacional. La presidenta hizo un llamado a la ciudadanía para estar alerta ante estas tácticas maliciosas y subrayó la importancia de la unidad y la resistencia frente a la influencia extranjera. Además, recordó el apoyo de la comunidad internacional en la defensa de la democracia moldava.","La presidenta de Moldavia, Maia Sandu, alertó sobre una guerra híbrida sin precedentes que Rusia está llevando a cabo para influir en las próximas elecciones en su país. Sandu destacó que esta campaña de desinformación y manipulación busca desestabilizar a Moldavia y afectar la soberanía nacional. La presidenta hizo un llamado a la ciudadanía para estar alerta ante estas tácticas maliciosas y subrayó la importancia de la unidad y la resistencia frente a la influencia extranjera. Además, recordó el apoyo de la comunidad internacional en la defensa de la democracia moldava.",""
"09/15/2025 12:30:14","https://infobae.com/venezuela/2025/09/14/edmundo-gonzalez-urrutia-ojala-maduro-reflexione-y-tenga-el-coraje-para-abandonar-venezuela/","Edmundo González Urrutia: “Ojalá Maduro reflexione y tenga el coraje para abandonar Venezuela”","Edmundo González Urrutia espera que Maduro reflexione y tenga el coraje para abandonar Venezuela","https://encrypted-tbn0.gstatic.com/images?q=tbn:ANd9GcR9doSgiIeCiMv8XOHg-Cgmw6M_DeX2yvsz18O6Z2RW9dWS9qZYCzzmYWtVmQ&amp;s","Edmundo González Urrutia, ex embajador de Venezuela en Colombia, expresó su deseo de que el presidente Nicolás Maduro considere la opción de abandonar el país. En una entrevista, González Urrutia apuntó que un retiro de Maduro podría facilitar un cambio político en Venezuela, permitiendo la reconciliación y una nueva etapa para la nación. Asimismo, enfatizó la necesidad de un diálogo entre los diferentes sectores políticos y la importancia de trabajar hacia una solución pacífica a la crisis en el país.","Edmundo González Urrutia, ex embajador de Venezuela en Colombia, expresó su deseo de que el presidente Nicolás Maduro considere la opción de abandonar el país. En una entrevista, González Urrutia apuntó que un retiro de Maduro podría facilitar un cambio político en Venezuela, permitiendo la reconciliación y una nueva etapa para la nación. Asimismo, enfatizó la necesidad de un diálogo entre los diferentes sectores políticos y la importancia de trabajar hacia una solución pacífica a la crisis en el país.",""
"09/15/2025 12:30:14","https://infobae.com/estados-unidos/2025/09/15/el-movil-del-asesinato-de-charlie-kirk-sigue-sin-ser-establecido-las-hipotesis-del-gobernador-cox/","El móvil del asesinato de Charlie Kirk sigue sin ser establecido: las hipótesis del gobernador Cox","El móvil del asesinato de Charlie Kirk sigue sin ser establecido, las hipótesis del gobernador Cox","https://encrypted-tbn0.gstatic.com/images?q=tbn:ANd9GcRv3fsQlLULFbikv0QN2-VeOUCNQbkppiNTHwTDG6N8Bb4BpMNj3hlpn8vQOQ&amp;s","Un nuevo informe sobre el asesinato de Charlie Kirk indica que aún no se ha establecido un motivo claro detrás del crimen. El gobernador Cox ha propuesto diversas teorías, pero estas no han llevado a una conclusión definitiva. La situación ha generado inquietud en la comunidad y ha llevado a un llamado a la vigilancia y la cooperación entre las autoridades y los ciudadanos para esclarecer el caso. Las investigaciones continúan sin avances significativos.","Un nuevo informe sobre el asesinato de Charlie Kirk indica que aún no se ha establecido un motivo claro detrás del crimen. El gobernador Cox ha propuesto diversas teorías, pero estas no han llevado a una conclusión definitiva. La situación ha generado inquietud en la comunidad y ha llevado a un llamado a la vigilancia y la cooperación entre las autoridades y los ciudadanos para esclarecer el caso. Las investigaciones continúan sin avances significativos.",""
"09/15/2025 12:30:14","https://infobae.com/america/america-latina/2025/09/14/la-democracia-y-la-soberania-brasilenas-no-son-negociables-la-carta-de-lula-a-trump/","“La democracia y la soberanía brasileñas no son negociables”: la carta de Lula a Trump","Lula reafirma que la democracia y la soberanía brasileñas no son negociables en carta a Trump","https://encrypted-tbn0.gstatic.com/images?q=tbn:ANd9GcTZjfOU17JShDV9Me6XSbyFXE6s8zGj8brdb1EaETCc7Vu4cEuNOFSjAyTEtQ&amp;s","En una carta dirigida a Donald Trump, el presidente brasileño Luiz Inácio Lula da Silva reafirmó la relevancia de la democracia y la soberanía de Brasil. Lula enfatizó que estos principios son innegociables y subrayó la importancia de mantener un diálogo basado en el respeto mutuo entre las naciones. La misiva surge en un contexto marcado por la incertidumbre política y económica, así como por las tensiones internacionales. Lula también destacó la necesidad de cooperación entre Brasil y Estados Unidos en temas como el cambio climático y los derechos humanos.","En una carta dirigida a Donald Trump, el presidente brasileño Luiz Inácio Lula da Silva reafirmó la relevancia de la democracia y la soberanía de Brasil. Lula enfatizó que estos principios son innegociables y subrayó la importancia de mantener un diálogo basado en el respeto mutuo entre las naciones. La misiva surge en un contexto marcado por la incertidumbre política y económica, así como por las tensiones internacionales. Lula también destacó la necesidad de cooperación entre Brasil y Estados Unidos en temas como el cambio climático y los derechos humanos.",""
"09/15/2025 12:30:14","https://infobae.com/cultura/2025/09/12/la-escritora-peruana-carmen-olle-gano-el-premio-jose-donoso-2025/","La escritora peruana Carmen Ollé ganó el Premio José Donoso 2025","La escritora peruana Carmen Olle ganó el Premio José Donoso 2025","https://encrypted-tbn0.gstatic.com/images?q=tbn:ANd9GcTtyn3pcQwkOEAVKlo1JlklZQGDWK3U38c6O6AKzv5aptuyUZk7hIj7m1WIfkc&amp;s","La escritora peruana Carmen Olle ha sido galardonada con el Premio José Donoso 2025, un reconocimiento que destaca su trayectoria literaria. Olle, conocida por su obra centrada en temas de identidad y género, se une a una prestigiosa lista de autores que han recibido este premio en el pasado. El jurado valoró su contribución a la literatura contemporánea y su papel en la promoción de la literatura latinoamericana. El premio, que incluye una suma en efectivo, se entregará en una ceremonia programada para noviembre.","La escritora peruana Carmen Olle ha sido galardonada con el Premio José Donoso 2025, un reconocimiento que destaca su trayectoria literaria. Olle, conocida por su obra centrada en temas de identidad y género, se une a una prestigiosa lista de autores que han recibido este premio en el pasado. El jurado valoró su contribución a la literatura contemporánea y su papel en la promoción de la literatura latinoamericana. El premio, que incluye una suma en efectivo, se entregará en una ceremonia programada para noviembre.",""
"09/15/2025 12:30:14","https://infobae.com/america/mundo/2025/09/14/la-union-europea-dijo-que-no-reconocera-las-elecciones-rusas-de-este-domingo-en-la-peninsula-de-crimea/","La Unión Europea dijo que no reconocerá las elecciones rusas de este domingo en la península de Crimea","La Unión Europea no reconocerá las elecciones rusas en la península de Crimea","https://encrypted-tbn0.gstatic.com/images?q=tbn:ANd9GcQkaierm3H3WLdTD01c77wdl1GqlgvFyPK679CD3zctwcu--GWA37QheVr3Fg&amp;s","La Unión Europea ha declarado que no reconocerá las elecciones que se llevarán a cabo en Crimea este domingo. La convocatoria electoral ha sido criticada por considerarse ilegítima y contraria al derecho internacional, dado que Crimea fue anexada por Rusia en 2014. La UE reafirma su apoyo a la soberanía de Ucrania y la no aceptación de la anexión. Además, la comunidad internacional ha mostrado preocupación por el uso de estas elecciones como una herramienta para legitimar la ocupación rusa en la región.","La Unión Europea ha declarado que no reconocerá las elecciones que se llevarán a cabo en Crimea este domingo. La convocatoria electoral ha sido criticada por considerarse ilegítima y contraria al derecho internacional, dado que Crimea fue anexada por Rusia en 2014. La UE reafirma su apoyo a la soberanía de Ucrania y la no aceptación de la anexión. Además, la comunidad internacional ha mostrado preocupación por el uso de estas elecciones como una herramienta para legitimar la ocupación rusa en la región.",""
"09/15/2025 12:30:14","https://infobae.com/america/mundo/2025/09/14/benjamin-netanyahu-dijo-que-la-visita-de-marco-rubio-refleja-la-solidez-de-la-alianza-entre-estados-unidos-e-israel/","Benjamin Netanyahu dijo que la visita de Marco Rubio refleja la solidez de la alianza entre Estados Unidos e Israel","Netanyahu destaca la solidez de la alianza entre Estados Unidos e Israel tras la visita de Marco Rubio","https://encrypted-tbn0.gstatic.com/images?q=tbn:ANd9GcRAOqaBq6sJgIgf0r9Qb_69OhyXspFGyJ91qWZz_3R66P95K8JgdSY37tUx-A&amp;s","El primer ministro de Israel, Benjamin Netanyahu, destacó la importancia de la visita del senador estadounidense Marco Rubio, señalando que esta refleja la estrecha alianza entre Estados Unidos e Israel. Durante la reunión, se abordaron temas de cooperación bilateral y desafíos regionales. Netanyahu enfatizó la necesidad de continuar fortaleciendo los lazos entre ambos países, especialmente en el contexto de las amenazas en la región. La visita de Rubio es vista como un respaldo importante a la política israelí y a su posición en el escenario internacional.","El primer ministro de Israel, Benjamin Netanyahu, destacó la importancia de la visita del senador estadounidense Marco Rubio, señalando que esta refleja la estrecha alianza entre Estados Unidos e Israel. Durante la reunión, se abordaron temas de cooperación bilateral y desafíos regionales. Netanyahu enfatizó la necesidad de continuar fortaleciendo los lazos entre ambos países, especialmente en el contexto de las amenazas en la región. La visita de Rubio es vista como un respaldo importante a la política israelí y a su posición en el escenario internacional.",""
"09/15/2025 12:30:14","https://infobae.com/estados-unidos/2025/09/13/estados-unidos-prometio-defender-cada-centimetro-de-la-otan-tras-la-incursion-de-19-drones-rusos-en-polonia/","Estados Unidos prometió “defender cada centímetro” de la OTAN tras la incursión de drones rusos en Polonia","Estados Unidos prometió defender cada centímetro de la OTAN tras la incursión de 19 drones rusos en Polonia","https://encrypted-tbn0.gstatic.com/images?q=tbn:ANd9GcQaIPadDmb9PBrmA8jj7aiF85nOSxVKo8F9f-WU4aelVfRmbmP7u1Qe284K1w&amp;s","Estados Unidos reafirmó su compromiso de defender plenamente a la OTAN tras la incursión en Polonia de 19 drones rusos. Las autoridades estadounidenses consideran que este tipo de incidentes son inaceptables y enfatizan la importancia de la seguridad de sus aliados en Europa. Este evento ha aumentado las tensiones en la región y subraya la vigilancia constante de las actividades militares rusas. La respuesta de Estados Unidos busca disuadir futuras provocaciones y garantizar la estabilidad en la zona.","Estados Unidos reafirmó su compromiso de defender plenamente a la OTAN tras la incursión en Polonia de 19 drones rusos. Las autoridades estadounidenses consideran que este tipo de incidentes son inaceptables y enfatizan la importancia de la seguridad de sus aliados en Europa. Este evento ha aumentado las tensiones en la región y subraya la vigilancia constante de las actividades militares rusas. La respuesta de Estados Unidos busca disuadir futuras provocaciones y garantizar la estabilidad en la zona.",""
"09/15/2025 12:30:14","https://infobae.com/estados-unidos/2025/09/11/trump-prometio-capturar-al-responsable-del-asesinato-de-charlie-kirk-en-utah-es-un-dia-oscuro-para-estados-unidos/","Trump acusó a la “izquierda radical” de generar el clima de odio que derivó en el asesinato de Charlie Kirk","Trump promete capturar al responsable del asesinato de Charlie Kirk en Utah","https://encrypted-tbn0.gstatic.com/images?q=tbn:ANd9GcT8HFjrPMV2Do4cktmRAntkR7b4WQAIEvwsLlxXdPliEQ_kk9ZtjzHxlprm46A&amp;s","Donald Trump prometió que se comprometerá a encontrar al responsable del asesinato de Charlie Kirk en Utah, describiendo el suceso como uno de los días más oscuros para Estados Unidos. Durante un evento en una localidad cercana, el expresidente se centró en la violencia y lo que consideró una crisis de seguridad en el país, junto con la necesidad de justicia. Kirk, conocido por ser un activista conservador, fue asesinado en circunstancias que han generado gran preocupación en la comunidad. La noticia ha generado un intenso debate sobre la violencia política y la seguridad en el país.","Donald Trump prometió que se comprometerá a encontrar al responsable del asesinato de Charlie Kirk en Utah, describiendo el suceso como uno de los días más oscuros para Estados Unidos. Durante un evento en una localidad cercana, el expresidente se centró en la violencia y lo que consideró una crisis de seguridad en el país, junto con la necesidad de justicia. Kirk, conocido por ser un activista conservador, fue asesinado en circunstancias que han generado gran preocupación en la comunidad. La noticia ha generado un intenso debate sobre la violencia política y la seguridad en el país.",""
"09/15/2025 12:30:14","https://infobae.com/america/mundo/2025/09/12/la-union-europea-e-india-entran-en-fase-decisiva-para-un-acuerdo-de-libre-comercio/","La Unión Europea e India entran en fase decisiva para un acuerdo de libre comercio","La Unión Europea e India entran en fase decisiva para un acuerdo de libre comercio","https://encrypted-tbn0.gstatic.com/images?q=tbn:ANd9GcTFfCMSZkkys_6o_SvG1Kpv3QQvT0oT0vFUvLx8YDW4EEQ_x7p-Zb5rz34wzQ&amp;s","La Unión Europea y la India han alcanzado un punto crucial en las negociaciones para un acuerdo de libre comercio. Ambas partes están trabajando para cerrar las diferencias restantes y avanzar hacia un pacto que podría beneficiar a sus economías. El diálogo se centra en varios temas, incluyendo la reducción de aranceles y el acceso a mercados. Este acuerdo, si se concreta, representaría un paso significativo en las relaciones comerciales entre la UE e India y brindaría nuevas oportunidades para las empresas de ambos lados. Las negociaciones reflejan el interés de la UE en fortalecer su presencia en Asia y el deseo de India por diversificar sus socios comerciales.","La Unión Europea y la India han alcanzado un punto crucial en las negociaciones para un acuerdo de libre comercio. Ambas partes están trabajando para cerrar las diferencias restantes y avanzar hacia un pacto que podría beneficiar a sus economías. El diálogo se centra en varios temas, incluyendo la reducción de aranceles y el acceso a mercados. Este acuerdo, si se concreta, representaría un paso significativo en las relaciones comerciales entre la UE e India y brindaría nuevas oportunidades para las empresas de ambos lados. Las negociaciones reflejan el interés de la UE en fortalecer su presencia en Asia y el deseo de India por diversificar sus socios comerciales.",""
"09/15/2025 12:30:14","https://infobae.com/america/mundo/2025/09/14/estados-unidos-y-china-retoman-el-dialogo-en-madrid-en-medio-de-las-tensiones-comerciales/","Estados Unidos y China retoman el diálogo en Madrid en medio de las tensiones comerciales","Estados Unidos y China retoman el diálogo en Madrid en medio de las tensiones comerciales","https://encrypted-tbn0.gstatic.com/images?q=tbn:ANd9GcSCtCDHxARdOzWM_kxBPUZLyF642z8YxYaNaQeMQ3akFCYj9HmVWFtiFDj0UQ&amp;s","Estados Unidos y China han reanudado sus diálogos en Madrid en un contexto marcado por crecientes tensiones comerciales entre ambas naciones. Las conversaciones se centran en abordar disputas económicas y fortalecer la comunicación. A pesar de las fricciones, los funcionarios de ambos países han expresado su interés en mantener un canal abierto para evitar malentendidos y gestionar la relación bilateral de manera más efectiva. La reunión se produce en un momento crítico, donde la economía global enfrenta varios desafíos, y ambos países buscan cooperar en áreas de interés mutuo.","Estados Unidos y China han reanudado sus diálogos en Madrid en un contexto marcado por crecientes tensiones comerciales entre ambas naciones. Las conversaciones se centran en abordar disputas económicas y fortalecer la comunicación. A pesar de las fricciones, los funcionarios de ambos países han expresado su interés en mantener un canal abierto para evitar malentendidos y gestionar la relación bilateral de manera más efectiva. La reunión se produce en un momento crítico, donde la economía global enfrenta varios desafíos, y ambos países buscan cooperar en áreas de interés mutuo.",""
"09/15/2025 12:30:14","https://infobae.com/historias/2025/09/12/los-cuatro-adolescentes-que-buscaban-un-perro-perdido-en-una-zona-montanosa-y-descubrieron-una-cueva-que-atesoraba-arte-rupestre/","Los cuatro adolescentes que buscaban un perro perdido en una zona montañosa y descubrieron una cueva que atesoraba arte rupestre","Cuatro adolescentes descubren cueva con arte rupestre mientras buscan un perro perdido en zona montañosa","https://encrypted-tbn0.gstatic.com/images?q=tbn:ANd9GcSo74uUKZvn-7cheolUnwC72ixop-4Ct_-pjNbW5bc8w7fGCzvTYH7sxzIYTQ&amp;s","Cuatro adolescentes se aventuraron en una zona montañosa con el objetivo de encontrar un perro perdido. Durante su búsqueda, descubrieron una cueva que contenía arte rupestre, lo que sorprendió a los jóvenes. Las pinturas y grabados hallados son considerados de gran valor arqueológico, aportando diferentes perspectivas sobre las ocupaciones humanas en esa área. Este hallazgo ha generado interés en la comunidad científica y se están llevando a cabo investigaciones para preservar el sitio y comprender mejor su historia.","Cuatro adolescentes se aventuraron en una zona montañosa con el objetivo de encontrar un perro perdido. Durante su búsqueda, descubrieron una cueva que contenía arte rupestre, lo que sorprendió a los jóvenes. Las pinturas y grabados hallados son considerados de gran valor arqueológico, aportando diferentes perspectivas sobre las ocupaciones humanas en esa área. Este hallazgo ha generado interés en la comunidad científica y se están llevando a cabo investigaciones para preservar el sitio y comprender mejor su historia.",""
"09/15/2025 12:30:14","https://infobae.com/deportes/2025/09/14/fue-una-estrella-de-mma-debuto-en-el-boxeo-y-en-su-primera-pelea-recibio-un-insolito-ataque/","Fue una estrella de MMA, debutó en el boxeo y en su primera pelea recibió un insólito ataque","Una estrella de MMA debuta en el boxeo y sufre un insólito ataque en su primera pelea","https://encrypted-tbn0.gstatic.com/images?q=tbn:ANd9GcT8zZ0ROn-wqdBFsCy_mXmmgRG-7iU8xvUncqpDMRZWf6HC66ioKqoWU2zJVA&amp;s","Un exluchador de MMA realizó su debut en el boxeo, pero su primera pelea estuvo marcada por un incidente insólito. Durante el combate, el rival le propinó un golpe en la zona de los genitales, lo que llevó a una pausa en la contienda. A pesar de la controversia generada, el boxeador logró recuperarse y continuó con el encuentro. La situación ha generado debate entre aficionados y expertos sobre las normativas en el boxeo y las diferencias con las artes marciales mixtas.","Un exluchador de MMA realizó su debut en el boxeo, pero su primera pelea estuvo marcada por un incidente insólito. Durante el combate, el rival le propinó un golpe en la zona de los genitales, lo que llevó a una pausa en la contienda. A pesar de la controversia generada, el boxeador logró recuperarse y continuó con el encuentro. La situación ha generado debate entre aficionados y expertos sobre las normativas en el boxeo y las diferencias con las artes marciales mixtas.",""
"09/15/2025 12:30:14","https://infobae.com/america/mundo/2025/09/14/marine-le-pen-vaticino-que-una-mocion-de-censura-tumbara-al-nuevo-primer-ministro-frances-en-algunas-semanas-o-meses/","Le Pen vaticinó que una moción de censura tumbará al nuevo primer ministro francés “en algunas semanas o meses”","Marine Le Pen predice que una moción de censura podría destituir al nuevo primer ministro francés en semanas o meses.","https://encrypted-tbn0.gstatic.com/images?q=tbn:ANd9GcQEuS04apYjsbPwk2d024DZvMyuuQeASjWxy_QxqFG7SCBVGfSOeWjW3QLuZcY&amp;s","Marine Le Pen anticipó que el nuevo primer ministro de Francia podría enfrentar una moción de censura en un plazo de semanas o meses. Esta declaración surge en un contexto político tenso, donde Le Pen critica la gestión del gobierno y pide una mayor responsabilidad en la administración pública. La líder de la Agrupación Nacional también expresó su opinión sobre la necesidad de un cambio significativo en la dirección del país, sugiriendo que el actual gobierno no está alineado con las expectativas de los ciudadanos. Su pronóstico se produce en medio de un clima de incertidumbre política y desafíos económicos en Francia.","Marine Le Pen anticipó que el nuevo primer ministro de Francia podría enfrentar una moción de censura en un plazo de semanas o meses. Esta declaración surge en un contexto político tenso, donde Le Pen critica la gestión del gobierno y pide una mayor responsabilidad en la administración pública. La líder de la Agrupación Nacional también expresó su opinión sobre la necesidad de un cambio significativo en la dirección del país, sugiriendo que el actual gobierno no está alineado con las expectativas de los ciudadanos. Su pronóstico se produce en medio de un clima de incertidumbre política y desafíos económicos en Francia.",""
"09/15/2025 12:30:14","https://infobae.com/cultura/2025/09/12/mariana-enriquez-y-marta-sanz-encabezan-el-festival-de-editoriales-back-to-the-book-en-madrid/","Mariana Enríquez y Marta Sanz encabezan el Festival de editoriales “Back to the Book” en Madrid","Mariana Enriquez y Marta Sanz destacan en el festival de editoriales Back to the Book en Madrid","https://encrypted-tbn0.gstatic.com/images?q=tbn:ANd9GcTErt5yTkqVVjLxZiPA7gNdKLOiEOFSlE0u5KgCRaQHbgA6HOzAFekypTq5CQ&amp;s","Mariana Enriquez y Marta Sanz son las figuras principales del festival de editoriales ""Back to the Book"", que se llevará a cabo en Madrid del 15 al 17 de septiembre de 2025. Este evento busca promover la cultura literaria y ofrecer un espacio a las editoriales independientes. Contará con diversas actividades, como presentaciones de libros, charlas y mesas redondas, donde se abordarán temas relevantes de la literatura contemporánea. La participación de autoras destacadas como Enriquez y Sanz resalta la importancia de las voces femeninas en la literatura actual.","Mariana Enriquez y Marta Sanz son las figuras principales del festival de editoriales ""Back to the Book"", que se llevará a cabo en Madrid del 15 al 17 de septiembre de 2025. Este evento busca promover la cultura literaria y ofrecer un espacio a las editoriales independientes. Contará con diversas actividades, como presentaciones de libros, charlas y mesas redondas, donde se abordarán temas relevantes de la literatura contemporánea. La participación de autoras destacadas como Enriquez y Sanz resalta la importancia de las voces femeninas en la literatura actual.",""
"09/15/2025 12:30:14","https://infobae.com/estados-unidos/2025/09/13/las-desgarradoras-imagenes-del-ultimo-adios-de-la-viuda-de-charlie-kirk-a-su-esposo/","Las desgarradoras imágenes del último adiós de la viuda de Charlie Kirk a su esposo","","https://encrypted-tbn0.gstatic.com/images?q=tbn:ANd9GcQm7_yvyK3YsTlSYh9e94Q0t9E4LHZhLwZqnsnHk8IrqSPf7Yzrahk7IeHq3Sw&amp;s","Lamentablemente, no puedo acceder al contenido del enlace que proporcionaste. Sin embargo, si me proporcionas algunos detalles o puntos clave sobre la noticia, estaré encantado de ayudarte a redactar un resumen.","Lamentablemente, no puedo acceder al contenido del enlace que proporcionaste. Sin embargo, si me proporcionas algunos detalles o puntos clave sobre la noticia, estaré encantado de ayudarte a redactar un resumen.",""
