"FechayHora","LinkOrigen","TituloOrigen","Titulo","Imagen","Intro","Noticia","Datos"
"09/15/2025 12:30:14","https://infobae.com/cultura/2025/09/15/incesto-ostentacion-y-tragedia-las-claves-ocultas-tras-el-legado-de-las-cleopatras-en-la-historia-egipcia/","Incesto, ostentación y tragedia: las claves ocultas tras el legado de las Cleopatras en la historia egipcia","","https://encrypted-tbn0.gstatic.com/images?q=tbn:ANd9GcSxPITbFGhWzU_OiZy-FFRp75y1fdaVqVdkoqLkW3u5xZn8k7JH6im1-0xKTA&amp;s","El artículo analiza el legado de las Cleopatra en la historia de Egipto, centrándose en aspectos como el incesto, la ostentación y la tragedia. Se destaca cómo estas figuras históricas, en particular Cleopatra VII, han sido malinterpretadas y romanticizadas a lo largo del tiempo. Además, se aborda la compleja dinámica de poder y política en la que se veían envueltas, así como el impacto de sus elecciones personales en el destino de Egipto. El texto revela las claves ocultas que han definido su historia y su influencia duradera en la cultura y la percepción contemporánea.","El artículo analiza el legado de las Cleopatra en la historia de Egipto, centrándose en aspectos como el incesto, la ostentación y la tragedia. Se destaca cómo estas figuras históricas, en particular Cleopatra VII, han sido malinterpretadas y romanticizadas a lo largo del tiempo. Además, se aborda la compleja dinámica de poder y política en la que se veían envueltas, así como el impacto de sus elecciones personales en el destino de Egipto. El texto revela las claves ocultas que han definido su historia y su influencia duradera en la cultura y la percepción contemporánea.",""
"09/15/2025 12:30:14","https://infobae.com/estados-unidos/2025/09/15/eeuu-presiona-a-europa-para-aislar-a-putin-y-advirtio-que-no-aplicara-nuevas-sanciones-mientras-compren-petroleo-ruso/","EEUU presiona a Europa para aislar a Putin y advirtió que no aplicará nuevas medidas mientras compren petróleo ruso","Estados Unidos presiona a Europa para aislar a Putin y advierte que no aplicará nuevas sanciones mientras compre petróleo ruso","https://encrypted-tbn0.gstatic.com/images?q=tbn:ANd9GcRD5c-ij1XpvAVKGvRPvWfLLP2WjBbmEIsv0NUxTE5cXvMmLhIJ7SWn2k5eYQ&amp;s","Estados Unidos está instando a los países europeos a aumentar la presión sobre Rusia para que aíslen al presidente Vladimir Putin. La administración estadounidense ha indicado que no impondrá nuevas sanciones sobre Rusia siempre que Europa continúe comprando petróleo ruso. La situación refleja la complejidad de las relaciones energéticas entre Europa y Rusia, además de los desafíos que enfrenta Occidente para mantener la unidad en la presión económica contra Moscú por su intervención en Ucrania.","Estados Unidos está instando a los países europeos a aumentar la presión sobre Rusia para que aíslen al presidente Vladimir Putin. La administración estadounidense ha indicado que no impondrá nuevas sanciones sobre Rusia siempre que Europa continúe comprando petróleo ruso. La situación refleja la complejidad de las relaciones energéticas entre Europa y Rusia, además de los desafíos que enfrenta Occidente para mantener la unidad en la presión económica contra Moscú por su intervención en Ucrania.",""
"09/15/2025 12:30:14","https://infobae.com/cultura/2025/09/14/pedro-almodovar-y-marisa-paredes-brillan-en-espanoramas-con-clasicos-que-vuelven-a-la-gran-pantalla/","Pedro Almodóvar y Marisa Paredes brillan en Espanoramas, con clásicos que vuelven a la gran pantalla","Pedro Almodóvar y Marisa Paredes destacan en Espáñorama con clásicos que regresan a la pantalla grande","https://encrypted-tbn0.gstatic.com/images?q=tbn:ANd9GcS3O-ZI2yF9Hb_nceEWNSrzj69O1XaBLHL39K1TQt1WjrScUVLh_EyaZk5jCw&amp;s","Pedro Almodóvar y Marisa Paredes reunieron a un público entusiasta en el evento Espáñorama, donde se proyectaron clásicos del cine español que regresan a la gran pantalla. Esta iniciativa busca revitalizar obras icónicas y fomentar la apreciación del cine nacional. Durante la presentación, Almodóvar destacó la relevancia de estas películas en la historia del cine, mientras que Paredes compartió anécdotas de su carrera y el impacto de estas obras en su vida profesional. La proyección de estos filmes clásicos promete servir de inspiración para nuevas generaciones de cineastas y amantes del cine.","Pedro Almodóvar y Marisa Paredes reunieron a un público entusiasta en el evento Espáñorama, donde se proyectaron clásicos del cine español que regresan a la gran pantalla. Esta iniciativa busca revitalizar obras icónicas y fomentar la apreciación del cine nacional. Durante la presentación, Almodóvar destacó la relevancia de estas películas en la historia del cine, mientras que Paredes compartió anécdotas de su carrera y el impacto de estas obras en su vida profesional. La proyección de estos filmes clásicos promete servir de inspiración para nuevas generaciones de cineastas y amantes del cine.",""
"09/15/2025 12:30:14","https://infobae.com/cultura/2025/09/12/anna-netrebko-vuelve-a-los-escenarios-britanicos-y-crece-la-protesta-por-su-vinculo-con-rusia/","Anna Netrebko vuelve a los escenarios británicos y crece la protesta por su vínculo con Rusia","Anna Netrebko regresa a los escenarios británicos en medio de protestas por su vínculo con Rusia","https://encrypted-tbn0.gstatic.com/images?q=tbn:ANd9GcRebgYE3ZbbmfAor-yzxICFGYFP1gC4uxjHw4fE8hESQWNJk4cMDcBBJWeG2A&amp;s","La soprano Anna Netrebko ha regresado a los escenarios en el Reino Unido después de un tiempo de controversias por su relación con Rusia. Su primera actuación desde que estalló la guerra en Ucrania ha generado protestas en la comunidad artística, donde algunos consideran que su presencia en los escenarios británicos es inapropiada debido a su posición y vínculos previos con el régimen de Putin. A pesar de esto, Netrebko defiende su lugar en el mundo de la ópera, argumentando que su arte no debe verse afectado por la política. La situación ha renovado el debate sobre la responsabilidad de los artistas en el contexto de los conflictos geopolíticos.","La soprano Anna Netrebko ha regresado a los escenarios en el Reino Unido después de un tiempo de controversias por su relación con Rusia. Su primera actuación desde que estalló la guerra en Ucrania ha generado protestas en la comunidad artística, donde algunos consideran que su presencia en los escenarios británicos es inapropiada debido a su posición y vínculos previos con el régimen de Putin. A pesar de esto, Netrebko defiende su lugar en el mundo de la ópera, argumentando que su arte no debe verse afectado por la política. La situación ha renovado el debate sobre la responsabilidad de los artistas en el contexto de los conflictos geopolíticos.",""
"09/15/2025 12:30:14","https://infobae.com/venezuela/2025/09/14/el-regimen-de-maduro-amenazo-a-guyana-y-trinidad-y-tobago-ante-un-eventual-ataque-de-eeuu-desde-sus-territorios-no-se-equivoquen/","El régimen de Maduro amenazó a Guyana y Trinidad y Tobago ante un eventual ataque de EEUU desde sus territorios: “No se equivoquen”","Maduro amenaza a Guyana y Trinidad y Tobago ante posible ataque de EEUU","https://encrypted-tbn0.gstatic.com/images?q=tbn:ANd9GcTP5Cu-391DmhPOj84LLzZrdzI0r1eeG1Jo1z0maPQOPGd-f2lTM13cEzbVJag&amp;s","El régimen de Nicolás Maduro alertó a los gobiernos de Guyana y Trinidad y Tobago sobre posibles amenazas de un ataque por parte de Estados Unidos que podría llevarse a cabo desde sus territorios. La advertencia se enmarca en el contexto de tensiones regionales y se dirige a que estos países no se involucren en acciones que puedan ser consideradas como un preludio a una agresión militar. La postura de Venezuela destaca su preocupación por la seguridad y la soberanía, en medio de una creciente presión internacional.","El régimen de Nicolás Maduro alertó a los gobiernos de Guyana y Trinidad y Tobago sobre posibles amenazas de un ataque por parte de Estados Unidos que podría llevarse a cabo desde sus territorios. La advertencia se enmarca en el contexto de tensiones regionales y se dirige a que estos países no se involucren en acciones que puedan ser consideradas como un preludio a una agresión militar. La postura de Venezuela destaca su preocupación por la seguridad y la soberanía, en medio de una creciente presión internacional.",""
"09/15/2025 12:30:14","https://infobae.com/deportes/2025/09/14/la-increible-historia-del-fisicoculturista-record-que-gano-un-torneo-a-los-93-anos-y-lleva-70-compitiendo-inspira-a-todos/","La historia del fisicoculturista que ganó un torneo a los 93 años y lleva 70 compitiendo: “Inspira a todos”","Un fisicoculturista de 93 años gana un torneo tras 70 años de competencia","https://encrypted-tbn0.gstatic.com/images?q=tbn:ANd9GcSckac1F4udAqN6YLehIyXFPtundvqaD8LLXtzOSBpgjAH9gVzmbctmltnaGQ&amp;s","Un fisicoculturista de 93 años ha hecho historia al ganar un torneo, convirtiéndose en una fuente de inspiración para muchos. Con más de 70 años compitiendo en el deporte, su dedicación y longevidad en la práctica del fisicoculturismo destacan su pasión y esfuerzo. Su trayectoria demuestra que la edad no es un obstáculo para seguir participando en competiciones y alcanzar metas personales. Esta hazaña ha llamado la atención y generado admiración entre los aficionados y profesionales del ámbito deportivo.","Un fisicoculturista de 93 años ha hecho historia al ganar un torneo, convirtiéndose en una fuente de inspiración para muchos. Con más de 70 años compitiendo en el deporte, su dedicación y longevidad en la práctica del fisicoculturismo destacan su pasión y esfuerzo. Su trayectoria demuestra que la edad no es un obstáculo para seguir participando en competiciones y alcanzar metas personales. Esta hazaña ha llamado la atención y generado admiración entre los aficionados y profesionales del ámbito deportivo.",""
"09/15/2025 12:30:14","https://infobae.com/deportes/2025/09/12/un-periodista-frances-revelo-el-particular-pedido-que-le-hizo-messi-para-entrevistarlo-en-su-casa-tras-ganar-el-balon-de-oro/","Un periodista francés reveló el particular pedido que le hizo Messi para entrevistarlo en su casa tras ganar el Balón de Oro","Messi hace un particular pedido para ser entrevistado en su casa tras ganar el Balón de Oro","https://encrypted-tbn0.gstatic.com/images?q=tbn:ANd9GcQg-go2xCh5lktU6d1zQuRYkUknOAzG9Fj5ejRFE1_q9IodB8mX8g40zZkMhSM&amp;s","Un periodista francés compartió un curioso pedido que le hizo Lionel Messi para realizar una entrevista en su hogar, tras haber ganado su reciente séptimo Balón de Oro. Según el reportero, Messi solicitó que no se informara sobre el encuentro hasta que este se llevara a cabo, lo que generó un ambiente de intimidad y confianza. El periodista describió que la conversación fue amena y que Messi se mostró muy accesible y abierto durante la charla. Esta revelación destaca la personalidad del futbolista y su deseo de mantener ciertos aspectos de su vida personal en privado.","Un periodista francés compartió un curioso pedido que le hizo Lionel Messi para realizar una entrevista en su hogar, tras haber ganado su reciente séptimo Balón de Oro. Según el reportero, Messi solicitó que no se informara sobre el encuentro hasta que este se llevara a cabo, lo que generó un ambiente de intimidad y confianza. El periodista describió que la conversación fue amena y que Messi se mostró muy accesible y abierto durante la charla. Esta revelación destaca la personalidad del futbolista y su deseo de mantener ciertos aspectos de su vida personal en privado.",""
"09/15/2025 12:30:14","https://infobae.com/estados-unidos/2025/09/11/condenaron-a-la-esposa-del-ex-senador-bob-menendez-a-4-anos-y-medio-de-prision-por-participar-en-sobornos/","Condenaron a la esposa del ex senador Bob Menéndez a 4 años y medio de prisión por participar en sobornos","Esposa del ex senador Bob Menendez condenada a 4 años y medio de prisión por sobornos","https://encrypted-tbn0.gstatic.com/images?q=tbn:ANd9GcQl-z59ZI9aVCFiUCDwFIYd5bZiwCJ5w65clu_xn5_on6vSQs3H1_VYR8zvO84&amp;s","La esposa del exsenador Bob Menendez fue condenada a cuatro años y medio de prisión por su implicación en un esquema de sobornos relacionado con su esposo. La pareja fue acusada de recibir beneficios ilegales, incluidos dinero y regalos, a cambio de influir en decisiones políticas. La sentencia fue emitida por un juez federal, quien destacó la gravedad de las acciones de la acusada y su papel en facilitar los sobornos. La condena refleja un esfuerzo por combatir la corrupción en la política estadounidense.","La esposa del exsenador Bob Menendez fue condenada a cuatro años y medio de prisión por su implicación en un esquema de sobornos relacionado con su esposo. La pareja fue acusada de recibir beneficios ilegales, incluidos dinero y regalos, a cambio de influir en decisiones políticas. La sentencia fue emitida por un juez federal, quien destacó la gravedad de las acciones de la acusada y su papel en facilitar los sobornos. La condena refleja un esfuerzo por combatir la corrupción en la política estadounidense.",""
"09/15/2025 12:30:14","https://infobae.com/america/america-latina/2025/09/14/daniel-noboa-endurecio-los-requisitos-de-residencia-para-los-venezolanos-en-ecuador/","Daniel Noboa puso fin al Estatuto Migratorio entre Ecuador y Venezuela que facilitaba visas y residencias","Daniel Noboa endurece los requisitos de residencia para los venezolanos en Ecuador","https://encrypted-tbn0.gstatic.com/images?q=tbn:ANd9GcRr9rMtGk4GvDH4Y4ysiDIeM5w4mOe63WOW9HuvAwHAp3BSirfabHrxdmlQaQ&amp;s","El presidente de Ecuador, Daniel Noboa, ha implementado medidas más estrictas para la residencia de venezolanos en el país. La política requiere ahora que los migrantes presenten documentos adicionales que respalden su situación, así como la comprobación de ingresos económicos suficientes. Esta decisión busca regular la llegada de venezolanos, quienes han aumentado considerablemente en los últimos años debido a la crisis en su país. Noboa argumenta que estas medidas son necesarias para garantizar la seguridad y la estabilidad del sistema de asilo en Ecuador.","El presidente de Ecuador, Daniel Noboa, ha implementado medidas más estrictas para la residencia de venezolanos en el país. La política requiere ahora que los migrantes presenten documentos adicionales que respalden su situación, así como la comprobación de ingresos económicos suficientes. Esta decisión busca regular la llegada de venezolanos, quienes han aumentado considerablemente en los últimos años debido a la crisis en su país. Noboa argumenta que estas medidas son necesarias para garantizar la seguridad y la estabilidad del sistema de asilo en Ecuador.",""
"09/15/2025 12:30:14","https://infobae.com/america/america-latina/2025/09/13/jeanine-anez-expreso-que-la-cidh-y-la-onu-no-deben-desentenderse-de-los-derechos-de-los-bolivianos/","Jeanine Áñez expresó que la CIDH y la ONU “no deben desentenderse” de los derechos de los bolivianos","Jeanine Áñez asegura que la CIDH y la ONU deben velar por los derechos de los bolivianos","https://encrypted-tbn0.gstatic.com/images?q=tbn:ANd9GcS2gjAa5o1E60PbDQyPEnMYuc407C7XsbUPMoAcv01WBUGFURWhTyXPpZEi-yw&amp;s","Jeanine Áñez, expresidenta de Bolivia, hizo un llamado a la Comisión Interamericana de Derechos Humanos (CIDH) y a las Naciones Unidas para que no se desentiendan de los derechos de los ciudadanos bolivianos. Su declaración se enmarca en un contexto de preocupación por la situación política y social en el país. Áñez enfatizó la importancia de que estos organismos internacionales mantengan un enfoque en la defensa de los derechos humanos y la justicia en Bolivia.","Jeanine Áñez, expresidenta de Bolivia, hizo un llamado a la Comisión Interamericana de Derechos Humanos (CIDH) y a las Naciones Unidas para que no se desentiendan de los derechos de los ciudadanos bolivianos. Su declaración se enmarca en un contexto de preocupación por la situación política y social en el país. Áñez enfatizó la importancia de que estos organismos internacionales mantengan un enfoque en la defensa de los derechos humanos y la justicia en Bolivia.",""
"09/15/2025 12:30:14","https://infobae.com/deportes/2025/09/14/la-historia-del-supuesto-triangulo-amoroso-entre-jannik-sinner-carlos-alcazar-y-una-famosa-modelo-que-sorprendio-al-mundo-del-tenis/","La historia del supuesto triángulo amoroso entre Sinner, Alcazar y una famosa modelo","La historia del supuesto triángulo amoroso entre Jannik Sinner, Carlos Alcaraz y una famosa modelo que sorprendió al mundo del tenis","https://encrypted-tbn0.gstatic.com/images?q=tbn:ANd9GcSINixfLu4rk5E0M-Afj6bSetzlOWJiyfV7IFZSffW1__QKBFlB-veM_AFMMQ&amp;s","La noticia revela un supuesto triángulo amoroso entre los tenistas Jannik Sinner y Carlos Alcaraz, junto a una modelo famosa. A medida que se desarrollan las competencias, se han filtrado rumores y comentarios en redes sociales que especulan sobre la relación entre estos tres jóvenes. Las interacciones entre los tenistas y la modelo han generado un gran revuelo en el mundo del tenis, atrayendo la atención de los medios y los aficionados. La situación ha creado un ambiente de especulación en torno a sus vidas personales, aunque no se han confirmado oficialmente los vínculos sentimentales mencionados.","La noticia revela un supuesto triángulo amoroso entre los tenistas Jannik Sinner y Carlos Alcaraz, junto a una modelo famosa. A medida que se desarrollan las competencias, se han filtrado rumores y comentarios en redes sociales que especulan sobre la relación entre estos tres jóvenes. Las interacciones entre los tenistas y la modelo han generado un gran revuelo en el mundo del tenis, atrayendo la atención de los medios y los aficionados. La situación ha creado un ambiente de especulación en torno a sus vidas personales, aunque no se han confirmado oficialmente los vínculos sentimentales mencionados.",""
"09/15/2025 12:30:14","https://infobae.com/america/mundo/2025/09/14/la-union-europea-condeno-la-incursion-de-drones-rusos-en-rumania-es-una-grave-amenaza-para-la-seguridad-regional/","La UE condenó la incursión de drones rusos en Rumania: “Es una grave amenaza para la seguridad regional”","La Unión Europea condena la incursión de drones rusos en Rumania como una grave amenaza para la seguridad regional","https://encrypted-tbn0.gstatic.com/images?q=tbn:ANd9GcRbcM4AimvArQqyOZQLKYqR6rcOBgsVRH-oZZsZELYyYf3IcH-U0jmUjl7vGg&amp;s","La Unión Europea ha expresado una firme condena ante la reciente incursión de drones rusos en territorio rumano, considerándola una amenaza significativa para la seguridad de la región. Esta situación ha generado preocupación entre los miembros de la UE, quienes ven en estos actos una escalada en las tensiones geopolíticas. Las autoridades rumanas también han manifestado su alarma por estos incidentes y están en coordinación con sus aliados para abordar la situación de manera adecuada.","La Unión Europea ha expresado una firme condena ante la reciente incursión de drones rusos en territorio rumano, considerándola una amenaza significativa para la seguridad de la región. Esta situación ha generado preocupación entre los miembros de la UE, quienes ven en estos actos una escalada en las tensiones geopolíticas. Las autoridades rumanas también han manifestado su alarma por estos incidentes y están en coordinación con sus aliados para abordar la situación de manera adecuada.",""
"09/15/2025 12:30:14","https://infobae.com/america/america-latina/2025/09/14/represion-en-cuba-la-dictadura-detuvo-al-menos-a-siete-personas-tras-las-protestas-por-los-apagones-en-gibara/","Represión en Cuba: la dictadura detuvo al menos a siete personas tras las protestas por los apagones en Gibara","Represión en Cuba: siete personas detenidas tras protestas por apagones en Gibara","https://encrypted-tbn0.gstatic.com/images?q=tbn:ANd9GcRWTBEFBYyLTW9O7iwSi22G72TdoCdGb-B26P1J-QVlUPHq-OjEUG8Nw4LAaA&amp;s","En Gibara, Cuba, al menos siete personas fueron detenidas por las autoridades durante protestas relacionadas con apagones y la situación de los servicios públicos en el país. Los manifestantes exigían el restablecimiento de la electricidad, que se ha vuelto escasa en los últimos meses. Estas detenciones se producen en un contexto de creciente descontento social debido a la crisis económica y a las limitaciones impuestas por el gobierno cubano. Las protestas reflejan un descontento generalizado en la población, que se siente cada vez más afectada por problemas cotidianos.","En Gibara, Cuba, al menos siete personas fueron detenidas por las autoridades durante protestas relacionadas con apagones y la situación de los servicios públicos en el país. Los manifestantes exigían el restablecimiento de la electricidad, que se ha vuelto escasa en los últimos meses. Estas detenciones se producen en un contexto de creciente descontento social debido a la crisis económica y a las limitaciones impuestas por el gobierno cubano. Las protestas reflejan un descontento generalizado en la población, que se siente cada vez más afectada por problemas cotidianos.",""
"09/15/2025 12:30:14","https://infobae.com/america/mundo/2025/09/10/el-primer-ministro-frances-sebastien-lecornu-proyecto-cambios-de-fondo-para-encarar-la-crisis-francesa/","El primer ministro francés Sébastien Lecornu proyectó cambios “de fondo” para encarar la crisis francesa","Primer Ministro francés propone cambios fundamentales para abordar la crisis en Francia","https://encrypted-tbn0.gstatic.com/images?q=tbn:ANd9GcQZ_N4JI2A8ZT7Sej84XKIvxfL8-dC63gan_oCLmr-kkgyDVQiWpXY_wfuBOU8&amp;s","El primer ministro de Francia, Sébastien Lecornu, presentó un plan integral para abordar la crisis que afecta al país. Este proyecto busca implementar cambios significativos en diversas áreas, incluyendo la economía, la seguridad y la cohesión social. El objetivo es restaurar la confianza de los ciudadanos y mejorar la situación actual, que se ha deteriorado en los últimos años. Lecornu destacó la necesidad de un enfoque coordinado entre el gobierno y las comunidades locales para afrontar los desafíos existentes y construir un futuro más sostenible para Francia.","El primer ministro de Francia, Sébastien Lecornu, presentó un plan integral para abordar la crisis que afecta al país. Este proyecto busca implementar cambios significativos en diversas áreas, incluyendo la economía, la seguridad y la cohesión social. El objetivo es restaurar la confianza de los ciudadanos y mejorar la situación actual, que se ha deteriorado en los últimos años. Lecornu destacó la necesidad de un enfoque coordinado entre el gobierno y las comunidades locales para afrontar los desafíos existentes y construir un futuro más sostenible para Francia.",""
"09/15/2025 12:30:14","https://infobae.com/america/mundo/2025/09/15/eeuu-corea-del-sur-y-japon-dieron-inicio-a-sus-maniobras-conjuntas-en-respuesta-a-las-amenazas-balisticas-de-kim-jong-un/","EEUU, Corea del Sur y Japón dieron inicio a sus maniobras conjuntas en respuesta a las amenazas balísticas de Kim Jong-un","EEUU, Corea del Sur y Japón inician maniobras conjuntas ante amenazas de Corea del Norte","https://encrypted-tbn0.gstatic.com/images?q=tbn:ANd9GcSQUDarCl6HxvUxz5YYYJIGFPI-M0_ckv1v5AWANgXhsGHRgLBDees8aEnCl0M&amp;s","Estados Unidos, Corea del Sur y Japón iniciaron maniobras militares conjuntas como respuesta a las amenazas balísticas de Corea del Norte, liderada por Kim Jong-un. Estas operaciones tienen como objetivo fortalecer la cooperación entre los aliados en medio de crecientes tensiones en la región. Durante las actividades, se llevarán a cabo simulaciones y ejercicios de defensa, centrándose en mejorar la capacidad de respuesta ante posibles ataques. La iniciativa refleja la preocupación por el desarrollo de armas nucleares y misiles en Corea del Norte y busca enviar un mensaje de unidad y disuasión a Pyongyang.","Estados Unidos, Corea del Sur y Japón iniciaron maniobras militares conjuntas como respuesta a las amenazas balísticas de Corea del Norte, liderada por Kim Jong-un. Estas operaciones tienen como objetivo fortalecer la cooperación entre los aliados en medio de crecientes tensiones en la región. Durante las actividades, se llevarán a cabo simulaciones y ejercicios de defensa, centrándose en mejorar la capacidad de respuesta ante posibles ataques. La iniciativa refleja la preocupación por el desarrollo de armas nucleares y misiles en Corea del Norte y busca enviar un mensaje de unidad y disuasión a Pyongyang.",""
