"FechayHora","LinkOrigen","TituloOrigen","Titulo","Imagen","Intro","Noticia","Datos"
"10/02/2025 18:00:09","https://infobae.com/estados-unidos/2025/10/01/trump-afronta-el-cuarto-cierre-de-gobierno-como-presidente-de-estados-unidos-que-paso-en-los-tres-casos-previos/","Trump afronta el cuarto cierre de gobierno como presidente de EEUU: qué pasó en los casos previos","Trump enfrenta su cuarto cierre de gobierno como presidente de Estados Unidos","https://encrypted-tbn0.gstatic.com/images?q=tbn:ANd9GcRwi5xr5jkhkxBX9hHV3aRy1h35xMXWiX2nRKAdHT9WRRtY7aY2ydKsrrN74Q&amp;s","Donald Trump se enfrenta a un cuarto cierre del gobierno en su papel como presidente de Estados Unidos. En este contexto, se hace un repaso de los tres cierres anteriores, destacando las circunstancias que llevaron a cada uno de ellos y las consecuencias que tuvieron. Estos cierres se vieron influidos por desacuerdos políticos sobre el presupuesto y políticas clave, generando impacto en diversos sectores y servicios gubernamentales. A medida que se acerca la fecha límite para aprobar el financiamiento gubernamental, las tensiones en el Congreso aumentan, lo que podría llevar a una nueva parálisis en la administración federal.","Donald Trump se enfrenta a un cuarto cierre del gobierno en su papel como presidente de Estados Unidos. En este contexto, se hace un repaso de los tres cierres anteriores, destacando las circunstancias que llevaron a cada uno de ellos y las consecuencias que tuvieron. Estos cierres se vieron influidos por desacuerdos políticos sobre el presupuesto y políticas clave, generando impacto en diversos sectores y servicios gubernamentales. A medida que se acerca la fecha límite para aprobar el financiamiento gubernamental, las tensiones en el Congreso aumentan, lo que podría llevar a una nueva parálisis en la administración federal.",""
"10/02/2025 18:00:09","https://infobae.com/venezuela/2025/09/30/que-implica-el-decreto-de-conmocion-en-venezuela-que-otorga-poderes-especiales-al-dictador-nicolas-maduro/","Qué implica el decreto de conmoción en Venezuela que otorga poderes especiales al dictador Nicolás Maduro","Decreto de conmoción en Venezuela otorga poderes especiales a Nicolás Maduro","https://encrypted-tbn0.gstatic.com/images?q=tbn:ANd9GcS4lRgOwX_9aQYLKvryGVy1Vj_cS-k8KU6tPfp9K4ILBtcAWjmwM1tV9Zu310Y&amp;s","El decreto de conmoción en Venezuela, promulgado por Nicolás Maduro, concede al mandatario poderes especiales para enfrentar la crisis en el país. Este acto permite la implementación de medidas extraordinarias en diversas áreas, incluyendo seguridad y economía, desdibujando el marco constitucional. La decisión ha generado preocupación entre opositores y expertos, quienes advierten sobre el riesgo de abusos de poder y una mayor represión. El contexto de crisis profunda en Venezuela, que incluye una severa crisis humanitaria y migratoria, agrava las implicaciones de este decreto, que podría intensificar la polarización en el país.","El decreto de conmoción en Venezuela, promulgado por Nicolás Maduro, concede al mandatario poderes especiales para enfrentar la crisis en el país. Este acto permite la implementación de medidas extraordinarias en diversas áreas, incluyendo seguridad y economía, desdibujando el marco constitucional. La decisión ha generado preocupación entre opositores y expertos, quienes advierten sobre el riesgo de abusos de poder y una mayor represión. El contexto de crisis profunda en Venezuela, que incluye una severa crisis humanitaria y migratoria, agrava las implicaciones de este decreto, que podría intensificar la polarización en el país.",""
"10/02/2025 18:00:09","https://infobae.com/america/america-latina/2025/10/01/el-canciller-de-brasil-aclaro-que-lula-da-silva-negociara-aranceles-con-donald-trump/","El canciller de Brasil aclaró que Lula Da Silva negociará aranceles con Donald Trump","Canciller de Brasil confirma que Lula da Silva negociará aranceles con Donald Trump","https://encrypted-tbn0.gstatic.com/images?q=tbn:ANd9GcSkJFCp5JAueQAXLYWWc_6HEGcZQbXvYF9X56JopCk4pcXaL9BQMvERd_v0mQ&amp;s","El canciller de Brasil, Mauro Vieira, confirmó que el presidente Luiz Inácio Lula da Silva tendrá como tarea negociar aranceles comerciales con el expresidente de Estados Unidos, Donald Trump. Esta decisión se da en el marco de una serie de discusiones sobre comercio entre Brasil y Estados Unidos, con el objetivo de fortalecer las relaciones económicas entre ambos países. Vieira también destacó la importancia de la colaboración bilateral en diversas áreas.","El canciller de Brasil, Mauro Vieira, confirmó que el presidente Luiz Inácio Lula da Silva tendrá como tarea negociar aranceles comerciales con el expresidente de Estados Unidos, Donald Trump. Esta decisión se da en el marco de una serie de discusiones sobre comercio entre Brasil y Estados Unidos, con el objetivo de fortalecer las relaciones económicas entre ambos países. Vieira también destacó la importancia de la colaboración bilateral en diversas áreas.",""
"10/02/2025 18:00:09","https://infobae.com/estados-unidos/2025/10/01/la-corte-suprema-de-estados-unidos-permite-a-lisa-cook-seguir-en-la-reserva-federal/","La Corte Suprema de Estados Unidos permite a Lisa Cook seguir en la Reserva Federal","La Corte Suprema de Estados Unidos permite a Lisa Cook seguir en la Reserva Federal","https://encrypted-tbn0.gstatic.com/images?q=tbn:ANd9GcS4AazHBGEdBMM60T7yY9fRW3zzHBDvNcjgnw1hJJeYVD6xP0_7EHGsq7-GbQ&amp;s","La Corte Suprema de Estados Unidos ha decidido permitir que Lisa Cook continúe en su puesto en la Reserva Federal. La decisión se produce en el contexto de un desafío legal que cuestionaba su nombramiento. Cook, que se desempeña como gobernadora de la Reserva Federal, es la primera mujer negra en ocupar este cargo. Su permanencia en la institución es considerada clave, especialmente en un periodo de creciente incertidumbre económica y desafíos monetarios. La resolución de la Corte reafirma la importancia de su rol en la formulación de políticas económicas en el país.","La Corte Suprema de Estados Unidos ha decidido permitir que Lisa Cook continúe en su puesto en la Reserva Federal. La decisión se produce en el contexto de un desafío legal que cuestionaba su nombramiento. Cook, que se desempeña como gobernadora de la Reserva Federal, es la primera mujer negra en ocupar este cargo. Su permanencia en la institución es considerada clave, especialmente en un periodo de creciente incertidumbre económica y desafíos monetarios. La resolución de la Corte reafirma la importancia de su rol en la formulación de políticas económicas en el país.",""
"10/02/2025 18:00:09","https://infobae.com/salud/2025/10/02/siete-errores-frecuentes-al-hacer-ejercicio-que-cometen-los-mayores-de-60-anos-y-como-evitarlos/","Siete errores frecuentes al hacer ejercicio que cometen los mayores de 60 años y cómo evitarlos","Siete errores frecuentes al hacer ejercicio que cometen los mayores de 60 años y cómo evitarlos","https://encrypted-tbn0.gstatic.com/images?q=tbn:ANd9GcRAdiF_-ZSGjEtMPFVG1L5BNJP1JuBD_in0pRbXAyNWD75ZAeI3cW-fO-GqKA&amp;s","Un artículo destaca errores comunes en la práctica de ejercicio entre personas mayores de 60 años y ofrece consejos para evitarlos. Se menciona que muchos suelen sobrecargar su cuerpo, descuidar el calentamiento, realizar ejercicios inapropiados o no modificar su rutina con el tiempo. Además, se identifica la falta de atención a la postura y no escuchar al cuerpo como factores que pueden provocar lesiones. El texto enfatiza la importancia de adoptar un enfoque adecuado y gradual en el ejercicio para optimizar la salud y prevenir daños en esta etapa de la vida.","Un artículo destaca errores comunes en la práctica de ejercicio entre personas mayores de 60 años y ofrece consejos para evitarlos. Se menciona que muchos suelen sobrecargar su cuerpo, descuidar el calentamiento, realizar ejercicios inapropiados o no modificar su rutina con el tiempo. Además, se identifica la falta de atención a la postura y no escuchar al cuerpo como factores que pueden provocar lesiones. El texto enfatiza la importancia de adoptar un enfoque adecuado y gradual en el ejercicio para optimizar la salud y prevenir daños en esta etapa de la vida.",""
"10/02/2025 18:00:09","https://infobae.com/america/mundo/2025/09/30/evo-morales-fue-la-causa-de-la-derrota-en-las-elecciones-luis-arce-acuso-a-su-ex-aliado-de-pactar-con-la-derecha-y-destruir-su-gobierno/","“Evo Morales fue la causa de la derrota en las elecciones”: Luis Arce acusó a su ex aliado de pactar con la derecha y destruir su gobierno","Luis Arce culpa a Evo Morales de la derrota electoral y lo acusa de pactar con la derecha","https://encrypted-tbn0.gstatic.com/images?q=tbn:ANd9GcTlnv8A-nTG5x408lz7OQNE9lQOSQIdpl5ePjAbFexlbr3IjoUJAZZwKYzV5Q&amp;s","Luis Arce, presidente de Bolivia, ha acusado a Evo Morales, ex aliado y ex presidente, de haber contribuido a su derrota electoral. Arce señaló que Morales pactó con la oposición y que sus acciones destruyeron el gobierno del Movimiento al Socialismo (MAS). Estas declaraciones se producen en un contexto electoral complicado para Arce, quien enfrenta críticas y la presión de líderes opositores dentro de su propio partido. La situación refleja tensiones internas en el MAS y la complicidad percibida entre Morales y la derecha política en el país.","Luis Arce, presidente de Bolivia, ha acusado a Evo Morales, ex aliado y ex presidente, de haber contribuido a su derrota electoral. Arce señaló que Morales pactó con la oposición y que sus acciones destruyeron el gobierno del Movimiento al Socialismo (MAS). Estas declaraciones se producen en un contexto electoral complicado para Arce, quien enfrenta críticas y la presión de líderes opositores dentro de su propio partido. La situación refleja tensiones internas en el MAS y la complicidad percibida entre Morales y la derecha política en el país.",""
"10/02/2025 18:00:09","https://infobae.com/estados-unidos/2025/09/30/donald-trump-advirtio-que-probablemente-habra-un-cierre-del-gobierno-de-estados-unidos-desde-esta-medianoche/","Donald Trump advirtió que “probablemente habrá un cierre” del gobierno de Estados Unidos desde esta medianoche","Trump advierte sobre posible cierre del gobierno de Estados Unidos desde esta medianoche","https://encrypted-tbn0.gstatic.com/images?q=tbn:ANd9GcQPR3bLK_c8MH2PeeS9TS8jCrqm-FWI0hnv4qXI-LgxwqVapzZhyJdQqvYzUNs&amp;s","Donald Trump advirtió que es probable que se produzca un cierre del gobierno de Estados Unidos. Esta situación podría ocurrir a partir de la medianoche, si no se logra un acuerdo en el Congreso sobre el financiamiento del gobierno. Las diferencias entre demócratas y republicanos complican las negociaciones. Trump instó a los legisladores a trabajar juntos para evitar este escenario, que podría afectar a muchos servicios gubernamentales y programas.","Donald Trump advirtió que es probable que se produzca un cierre del gobierno de Estados Unidos. Esta situación podría ocurrir a partir de la medianoche, si no se logra un acuerdo en el Congreso sobre el financiamiento del gobierno. Las diferencias entre demócratas y republicanos complican las negociaciones. Trump instó a los legisladores a trabajar juntos para evitar este escenario, que podría afectar a muchos servicios gubernamentales y programas.",""
"10/02/2025 18:00:09","https://infobae.com/america/mundo/2025/09/27/kim-jong-un-ordeno-que-todos-los-recursos-de-corea-del-norte-sean-destinados-a-su-programa-nuclear/","Kim Jong-un ordenó que todos los recursos de Corea del Norte sean destinados a su programa nuclear","Kim Jong-un ordena destinar todos los recursos de Corea del Norte a su programa nuclear","https://encrypted-tbn0.gstatic.com/images?q=tbn:ANd9GcRSha9rXap4D37JGEJTGEzcMppL5Frvo5hy8SHeAvcs_DDlvHDKIMwn6VXb4Q&amp;s","Kim Jong-un ha ordenado que todos los recursos de Corea del Norte se destinen exclusivamente al desarrollo de su programa nuclear. Esta decisión se enmarca en un contexto de creciente tensión y desafíos económicos en el país. Se anticipa que esta medida intensificará las ya existentes preocupaciones internacionales sobre la proliferación nuclear y las ambiciones bélicas de Corea del Norte.","Kim Jong-un ha ordenado que todos los recursos de Corea del Norte se destinen exclusivamente al desarrollo de su programa nuclear. Esta decisión se enmarca en un contexto de creciente tensión y desafíos económicos en el país. Se anticipa que esta medida intensificará las ya existentes preocupaciones internacionales sobre la proliferación nuclear y las ambiciones bélicas de Corea del Norte.",""
"10/02/2025 18:00:09","https://infobae.com/estados-unidos/2025/09/30/donald-trump-dijo-que-estados-unidos-le-lleva-25-anos-de-ventaja-a-rusia-y-china-en-tecnologia-nuclear/","Donald Trump dijo que Estados Unidos le lleva 25 años de ventaja a Rusia y China en tecnología nuclear","Donald Trump asegura que Estados Unidos tiene 25 años de ventaja sobre Rusia y China en tecnología nuclear","https://encrypted-tbn0.gstatic.com/images?q=tbn:ANd9GcRhyFhYZJFQiT8jtktNC8QiHa2R08n_xVo9-V-pz-2AH0XxNjg-nxxuGNrCdQ&amp;s","Donald Trump afirmó que Estados Unidos tiene una ventaja de 25 años sobre Rusia y China en el ámbito de la tecnología nuclear. Durante un discurso, el ex presidente resaltó la importancia de mantener y fortalecer esta superioridad tecnológica en un contexto global de creciente competencia. Según Trump, la inversión en innovación es esencial para asegurar la seguridad nacional y el dominio estadounidense en el campo militar y tecnológico.","Donald Trump afirmó que Estados Unidos tiene una ventaja de 25 años sobre Rusia y China en el ámbito de la tecnología nuclear. Durante un discurso, el ex presidente resaltó la importancia de mantener y fortalecer esta superioridad tecnológica en un contexto global de creciente competencia. Según Trump, la inversión en innovación es esencial para asegurar la seguridad nacional y el dominio estadounidense en el campo militar y tecnológico.",""
"10/02/2025 18:00:09","https://infobae.com/america/mundo/2025/10/02/macron-y-starmer-instaron-a-europa-a-incrementar-la-presion-sobre-la-flota-fantasma-rusa-para-frenar-su-avance/","Macron y Starmer instaron a Europa a incrementar la presión sobre la flota fantasma rusa para frenar su avance","Macron y Starmer piden a Europa aumentar presión sobre flota fantasma rusa","https://encrypted-tbn0.gstatic.com/images?q=tbn:ANd9GcSLUHoAmQ2RjXGYWTWuBgXac_JGI62O8EQQmQZfTgT46NC8NPzfuKBJrhn2bIo&amp;s","El presidente de Francia, Emmanuel Macron, y el líder del Partido Laborista del Reino Unido, Keir Starmer, han hecho un llamado a Europa para intensificar la presión sobre la flota de pesca rusa, acusada de operaciones ilegales en aguas europeas. Durante una reunión en Londres, ambos dirigentes expresaron su preocupación por el aumento de esta flota fantasma, que está impactando negativamente en las poblaciones de peces y la economía pesquera europea. Subrayaron la necesidad urgente de una respuesta coordinada a nivel europeo para proteger los recursos marinos y asegurar la sostenibilidad del sector pesquero.","El presidente de Francia, Emmanuel Macron, y el líder del Partido Laborista del Reino Unido, Keir Starmer, han hecho un llamado a Europa para intensificar la presión sobre la flota de pesca rusa, acusada de operaciones ilegales en aguas europeas. Durante una reunión en Londres, ambos dirigentes expresaron su preocupación por el aumento de esta flota fantasma, que está impactando negativamente en las poblaciones de peces y la economía pesquera europea. Subrayaron la necesidad urgente de una respuesta coordinada a nivel europeo para proteger los recursos marinos y asegurar la sostenibilidad del sector pesquero.",""
"10/02/2025 18:00:09","https://infobae.com/america/mundo/2025/10/01/donald-trump-y-xi-jinping-se-reuniran-este-mes-en-corea-del-sur-el-comercio-de-soja-sera-un-tema-clave/","Donald Trump y Xi Jinping se reunirán este mes en Corea del Sur: el comercio de soja será un tema clave","Donald Trump y Xi Jinping se reunirán en Corea del Sur con el comercio de soja como tema clave","https://encrypted-tbn0.gstatic.com/images?q=tbn:ANd9GcSfJJLX4w7KLyzcJ6ZC7FX_mg6P_aDuXRCj509EgjuyIxpuB6KaCebIX13Pag&amp;s","Donald Trump y Xi Jinping se reunirán este mes en Corea del Sur, en un encuentro que abordará diversos temas, entre ellos el comercio de soja. Esta reunión está programada en un momento clave para las relaciones comerciales entre Estados Unidos y China, donde la producción y exportación de soja se ha convertido en un asunto relevante en las negociaciones bilaterales. Ambos líderes buscarán avanzar en acuerdos que beneficien a sus respectivas economías.","Donald Trump y Xi Jinping se reunirán este mes en Corea del Sur, en un encuentro que abordará diversos temas, entre ellos el comercio de soja. Esta reunión está programada en un momento clave para las relaciones comerciales entre Estados Unidos y China, donde la producción y exportación de soja se ha convertido en un asunto relevante en las negociaciones bilaterales. Ambos líderes buscarán avanzar en acuerdos que beneficien a sus respectivas economías.",""
"10/02/2025 18:00:09","https://infobae.com/america/mundo/2025/10/01/el-senado-de-estados-unidos-rechazo-un-plan-republicano-para-sacar-al-pais-de-la-paralisis-presupuestaria/","Cierre del Gobierno: el Senado de Estados Unidos rechazó dos propuestas para salir de la parálisis presupuestaria","Senado de Estados Unidos rechaza plan republicano para salir de la parálisis presupuestaria","https://encrypted-tbn0.gstatic.com/images?q=tbn:ANd9GcTC3lcmULKfh-LHfJMGfM_TSDCTruOYKbVv3T3vMu4NlITClEs7RDaGojVUiEY&amp;s","El Senado de Estados Unidos rechazó un plan presentado por los republicanos para resolver la crisis de paralización presupuestaria que enfrenta el país. La propuesta buscaba financiar diversas áreas del gobierno, pero no obtuvo el apoyo necesario. Esta situación genera preocupación sobre el impacto a largo plazo en los servicios gubernamentales y la economía del país, así como sobre la posibilidad de un cierre del gobierno si no se alcanza un acuerdo en el futuro cercano. Los líderes de ambos partidos continúan en discusiones, pero las diferencias persisten.","El Senado de Estados Unidos rechazó un plan presentado por los republicanos para resolver la crisis de paralización presupuestaria que enfrenta el país. La propuesta buscaba financiar diversas áreas del gobierno, pero no obtuvo el apoyo necesario. Esta situación genera preocupación sobre el impacto a largo plazo en los servicios gubernamentales y la economía del país, así como sobre la posibilidad de un cierre del gobierno si no se alcanza un acuerdo en el futuro cercano. Los líderes de ambos partidos continúan en discusiones, pero las diferencias persisten.",""
"10/02/2025 18:00:09","https://infobae.com/deportes/2025/10/02/dieron-a-conocer-como-se-repartira-la-herencia-de-franz-beckenbauer-millones-de-euros-multiples-propiedades-y-un-plan-anti-conflictos/","Dieron a conocer cómo se repartirá la herencia de Franz Beckenbauer: millones de euros, múltiples propiedades y un plan anti conflictos","Herencia de Franz Beckenbauer: millones de euros, propiedades y un plan anti conflictos","https://encrypted-tbn0.gstatic.com/images?q=tbn:ANd9GcTM3qW1kVgLw1LOm871eItT5_EVuyyaH0SLp13kM-cFPB3xTNZpW-hyAcrrzQ&amp;s","La herencia de Franz Beckenbauer, el reconocido exfutbolista y entrenador, se ha dado a conocer recientemente. Se estima que su fortuna asciende a millones de euros, junto con diversas propiedades a su nombre. Para evitar conflictos entre sus herederos, Beckenbauer ha diseñado un plan que establece claramente la distribución de sus bienes. Este enfoque busca facilitar una división equitativa y minimizar disputas familiares en el futuro.","La herencia de Franz Beckenbauer, el reconocido exfutbolista y entrenador, se ha dado a conocer recientemente. Se estima que su fortuna asciende a millones de euros, junto con diversas propiedades a su nombre. Para evitar conflictos entre sus herederos, Beckenbauer ha diseñado un plan que establece claramente la distribución de sus bienes. Este enfoque busca facilitar una división equitativa y minimizar disputas familiares en el futuro.",""
"10/02/2025 18:00:09","https://infobae.com/america/mundo/2025/10/02/enveneno-a-tres-familiares-de-su-esposo-y-ahora-apelara-su-condena-el-caso-de-la-mujer-de-los-hongos-que-conmociona-australia/","Envenenó a tres familiares de su esposo y ahora apelará su condena: el caso de la “mujer de los hongos” que conmociona Australia","","https://encrypted-tbn0.gstatic.com/images?q=tbn:ANd9GcTOlfdVsZsjJRmJOrHH31mNZLImPix28T2HFcVxflIJlFfWNseMGFkmLAilhA&amp;s","","",""
"10/02/2025 18:00:09","https://infobae.com/america/mundo/2025/10/02/dinamarca-pidio-a-la-ue-acelerar-el-rearme-y-la-modernizacion-militar-ante-la-amenaza-de-una-guerra-hibrida-rusa/","Dinamarca pidió a la UE acelerar el rearme y la modernización militar ante la amenaza de una guerra híbrida rusa","Dinamarca solicita a la UE acelerar rearme y modernización militar ante amenaza de guerra híbrida rusa","https://encrypted-tbn0.gstatic.com/images?q=tbn:ANd9GcTOLD5bduU0cKel2N4du2BsFE3f78z3H6W6oVyFEy4QixV6us5HmfoL-Yld2gs&amp;s","Dinamarca ha instado a la Unión Europea a acelerar el proceso de rearme y modernización militar en respuesta a la creciente amenaza de una guerra híbrida por parte de Rusia. El gobierno danés destaca la necesidad de una mayor colaboración entre los países europeos para fortalecer la defensa y afrontar los retos de seguridad que plantea el actual contexto geopolítico. Esta solicitud se enmarca en un llamado más amplio para que la UE refuerce su capacidad de respuesta ante posibles agresiones y conflictos derivados de tácticas no convencionales.","Dinamarca ha instado a la Unión Europea a acelerar el proceso de rearme y modernización militar en respuesta a la creciente amenaza de una guerra híbrida por parte de Rusia. El gobierno danés destaca la necesidad de una mayor colaboración entre los países europeos para fortalecer la defensa y afrontar los retos de seguridad que plantea el actual contexto geopolítico. Esta solicitud se enmarca en un llamado más amplio para que la UE refuerce su capacidad de respuesta ante posibles agresiones y conflictos derivados de tácticas no convencionales.",""
"10/02/2025 18:00:09","https://infobae.com/america/mundo/2025/10/02/la-fiscalia-europea-denuncio-una-invasion-de-organizaciones-criminales-chinas-en-varios-paises-del-bloque/","La Fiscalía Europea denunció una “invasión” de organizaciones criminales chinas en países del bloque","La Fiscalía Europea denuncia una invasión de organizaciones criminales chinas en varios países del bloque","https://encrypted-tbn0.gstatic.com/images?q=tbn:ANd9GcQoRYvn9_X0J76S2bUB9q8VYqVwS-g7iCrHT56X-v9iJaZ72pGc7vvikONNrQ&amp;s","La Fiscalía Europea ha alertado sobre una creciente infiltración de organizaciones criminales chinas en varios países de la Unión Europea. Este fenómeno se ha intensificado en varias áreas criminales, incluyendo el tráfico de drogas y el blanqueo de capitales. Las autoridades han señalado que estas organizaciones operan con estructuras altamente organizadas, utilizando tecnologías avanzadas para facilitar sus actividades delictivas. Además, se ha observado una colaboración entre grupos criminales chinos y redes locales, lo que complica aún más la situación y requiere una respuesta coordinada por parte de los estados miembros de la UE.","La Fiscalía Europea ha alertado sobre una creciente infiltración de organizaciones criminales chinas en varios países de la Unión Europea. Este fenómeno se ha intensificado en varias áreas criminales, incluyendo el tráfico de drogas y el blanqueo de capitales. Las autoridades han señalado que estas organizaciones operan con estructuras altamente organizadas, utilizando tecnologías avanzadas para facilitar sus actividades delictivas. Además, se ha observado una colaboración entre grupos criminales chinos y redes locales, lo que complica aún más la situación y requiere una respuesta coordinada por parte de los estados miembros de la UE.",""
"10/02/2025 18:00:09","https://infobae.com/deportes/2025/10/02/video-la-batalla-campal-entre-ultras-del-napoli-y-el-sporting-de-lisboa-en-la-previa-del-partido-por-la-champions-league/","La batalla campal entre ultras del Napoli y el Sporting de Lisboa en la previa del partido por la Champions League","Batalla campal entre ultras del Napoli y el Sporting de Lisboa en la previa del partido de Champions League","https://encrypted-tbn0.gstatic.com/images?q=tbn:ANd9GcR17QZc6Qsi-MADLYIWmS1Ggk0WsiV-TSmiPI_7TcsQ7r_e7quwX-uNgQQp9yI&amp;s","Se produjo un enfrentamiento violento entre ultras del Napoli y del Sporting de Lisboa en los alrededores del estadio en la previa de un partido de la fase de grupos de la Champions League. Los incidentes estallaron entre los seguidores de ambos clubes, resultando en enfrentamientos que fueron captados en video. La situación generó preocupación por la seguridad y provocó la intervención de las autoridades para restaurar el orden.","Se produjo un enfrentamiento violento entre ultras del Napoli y del Sporting de Lisboa en los alrededores del estadio en la previa de un partido de la fase de grupos de la Champions League. Los incidentes estallaron entre los seguidores de ambos clubes, resultando en enfrentamientos que fueron captados en video. La situación generó preocupación por la seguridad y provocó la intervención de las autoridades para restaurar el orden.",""
