"FechayHora","LinkOrigen","TituloOrigen","Titulo","Imagen","Intro","Noticia","Datos"
"10/02/2025 18:00:09","https://infobae.com/america/mundo/2025/10/02/la-embajada-de-israel-y-lideres-mundiales-condenaron-el-ataque-terrorista-en-la-sinagoga-de-manchester/","La embajada de Israel y líderes mundiales condenaron el ataque terrorista en la sinagoga","Embajada de Israel y líderes mundiales condenan ataque terrorista en sinagoga de Manchester","https://encrypted-tbn0.gstatic.com/images?q=tbn:ANd9GcTW9S4cPXRDlXpPJSZpqfc2T3jGC2XiICNXuuPFBo2eq62TtYgj8Xy1bbz78Q&amp;s","La Embajada de Israel y varios líderes mundiales expresaron su condena tras el ataque terrorista ocurrido en una sinagoga de Manchester. El acto de violencia se produjo durante un servicio religioso, dejando a los asistentes en estado de shock. Las autoridades locales han iniciado una investigación para esclarecer los hechos y determinar la naturaleza del ataque. Diferentes organizaciones y figuras políticas han manifestado su solidaridad con la comunidad judía y han llamado a combatir el antisemitismo y la violencia extremista en todas sus formas.","La Embajada de Israel y varios líderes mundiales expresaron su condena tras el ataque terrorista ocurrido en una sinagoga de Manchester. El acto de violencia se produjo durante un servicio religioso, dejando a los asistentes en estado de shock. Las autoridades locales han iniciado una investigación para esclarecer los hechos y determinar la naturaleza del ataque. Diferentes organizaciones y figuras políticas han manifestado su solidaridad con la comunidad judía y han llamado a combatir el antisemitismo y la violencia extremista en todas sus formas.",""
"10/02/2025 18:00:09","https://infobae.com/venezuela/2025/10/02/diosdado-cabello-dijo-que-hubo-189-eventos-sismicos-en-la-ultima-semana-en-venezuela-aunque-nadie-los-sintio/","Cabello dijo que hubo 189 “eventos sísmicos” en la última semana en Venezuela, aunque nadie los sintió","Diosdado Cabello informa sobre 189 eventos sísmicos en Venezuela sin que la población los sienta","https://encrypted-tbn0.gstatic.com/images?q=tbn:ANd9GcT8OoVm_ZmCGZUXgEvz_pzbmFo97CxTIpoCqL_uzIja-mWbTbeKS6c5mUXwRTs&amp;s","Diosdado Cabello, vicepresidente del Partido Socialista Unido de Venezuela, informó que se registraron 189 eventos sísmicos en el país durante la última semana. A pesar de este significativo número de sismos, afirmó que la población no ha sentido ninguno de ellos. Cabello destacó que la actividad sísmica es normal en la región, y mencionó que las autoridades están atentas ante este fenómeno natural.","Diosdado Cabello, vicepresidente del Partido Socialista Unido de Venezuela, informó que se registraron 189 eventos sísmicos en el país durante la última semana. A pesar de este significativo número de sismos, afirmó que la población no ha sentido ninguno de ellos. Cabello destacó que la actividad sísmica es normal en la región, y mencionó que las autoridades están atentas ante este fenómeno natural.",""
"10/02/2025 18:00:09","https://infobae.com/america/america-latina/2025/10/02/correos-filtrados-revelaron-un-puente-aereo-entre-venezuela-y-belice-con-drogas-rumbo-a-estados-unidos/","Correos filtrados revelaron un “puente aéreo” narco entre Venezuela y Belice con destino final en Estados Unidos","Correos filtrados revelan un puente aéreo entre Venezuela y Belice con drogas rumbo a Estados Unidos","https://encrypted-tbn0.gstatic.com/images?q=tbn:ANd9GcQa_Xf3m7Aab_Izul07wn1C24-sbGg-i95nAYDQzsKU95731R67XVTAn1V3QSU&amp;s","Correos filtrados han puesto al descubierto una operación de tráfico de drogas que conecta Venezuela y Belice, con el objetivo de enviar estupefacientes a Estados Unidos. Estos correos, que revelan la comunicación entre narcotraficantes, indican que el camino de la droga involucra la utilización de aviones para facilitar el transporte. La información sugiere una sofisticada red de distribución que se beneficia de la ubicación geográfica de las naciones involucradas. Las autoridades están alertas ante esta situación, que representa un desafío significativo en la lucha contra el narcotráfico en la región.","Correos filtrados han puesto al descubierto una operación de tráfico de drogas que conecta Venezuela y Belice, con el objetivo de enviar estupefacientes a Estados Unidos. Estos correos, que revelan la comunicación entre narcotraficantes, indican que el camino de la droga involucra la utilización de aviones para facilitar el transporte. La información sugiere una sofisticada red de distribución que se beneficia de la ubicación geográfica de las naciones involucradas. Las autoridades están alertas ante esta situación, que representa un desafío significativo en la lucha contra el narcotráfico en la región.",""
"10/02/2025 18:00:09","https://infobae.com/deportes/2025/10/02/que-necesita-mclaren-para-consagrarse-campeon-del-campeonato-de-constructores-de-la-formula-1-en-el-gran-premio-de-singapur/","Qué necesita McLaren para consagrarse campeón del Campeonato de Constructores de la Fórmula 1 en el Gran Premio de Singapur","McLaren busca el campeonato de constructores en el Gran Premio de Singapur","https://encrypted-tbn0.gstatic.com/images?q=tbn:ANd9GcSbnqU4zwMhhyJ_67jz7v3Cu7WguYY2rkOs_fw0MlpqNBtim37mdvFjd1Iuksk&amp;s","McLaren se encuentra en una posición favorable para competir por el campeonato de constructores de Fórmula 1 en el Gran Premio de Singapur. El equipo debe aprovechar al máximo su rendimiento actual y mantener la consistencia en sus resultados. Para alcanzar el título, es crucial que los pilotos logren posiciones altas en la clasificación y eviten errores durante la carrera. Además, la estrategia de pit stops y la elección adecuada de neumáticos serán determinantes. La competencia cercana con otros equipos como Red Bull y Ferrari también influirá en sus posibilidades de éxito en este fin de semana.","McLaren se encuentra en una posición favorable para competir por el campeonato de constructores de Fórmula 1 en el Gran Premio de Singapur. El equipo debe aprovechar al máximo su rendimiento actual y mantener la consistencia en sus resultados. Para alcanzar el título, es crucial que los pilotos logren posiciones altas en la clasificación y eviten errores durante la carrera. Además, la estrategia de pit stops y la elección adecuada de neumáticos serán determinantes. La competencia cercana con otros equipos como Red Bull y Ferrari también influirá en sus posibilidades de éxito en este fin de semana.",""
"10/02/2025 18:00:09","https://infobae.com/cultura/2025/10/01/cierran-una-mega-muestra-de-dali-en-italia-eran-obras-falsas/","Cierran una mega muestra de Dalí en Italia: eran obras falsas","Cierre de una mega muestra de Dalí en Italia por exhibir obras falsas","https://encrypted-tbn0.gstatic.com/images?q=tbn:ANd9GcSeiPWBI0j7Lm0stWnYegRCe9U_3i7VinCfvpacosywU3sSmJv4AzH6RCsTJQ&amp;s","Una importante exposición de obras de Salvador Dalí en Italia fue clausurada debido a la revelación de que las piezas exhibidas eran falsificaciones. La muestra, que había generado gran interés, había sido inaugurada en una galería en Roma, pero las autoridades intervinieron tras recibir informes que cuestionaban la autenticidad de las obras. Las investigaciones apuntaron a la presentación de piezas que no eran originales del artista surrealista. La situación ha generado debates sobre la veracidad en las exposiciones de arte y la importancia de verificar la autenticidad de las obras.","Una importante exposición de obras de Salvador Dalí en Italia fue clausurada debido a la revelación de que las piezas exhibidas eran falsificaciones. La muestra, que había generado gran interés, había sido inaugurada en una galería en Roma, pero las autoridades intervinieron tras recibir informes que cuestionaban la autenticidad de las obras. Las investigaciones apuntaron a la presentación de piezas que no eran originales del artista surrealista. La situación ha generado debates sobre la veracidad en las exposiciones de arte y la importancia de verificar la autenticidad de las obras.",""
"10/02/2025 18:00:09","https://infobae.com/estados-unidos/2025/10/01/estados-unidos-deporto-a-una-ex-jueza-cubana-acusada-de-sentenciar-a-manifestantes-en-la-isla/","Estados Unidos deportó a una ex jueza cubana acusada de sentenciar a manifestantes en la isla","Estados Unidos deportó a una ex jueza cubana acusada de sentenciar a manifestantes en la isla","https://encrypted-tbn0.gstatic.com/images?q=tbn:ANd9GcRHn9Rkr1Tf350dM6Qze8fCl4rlGkIolljQUkVSiMDHvHmJbMAmSQg6b7jh-0E&amp;s","Una ex jueza cubana fue deportada de Estados Unidos luego de ser acusada de este cargo al haber sentenciado a protestantes en Cuba durante las manifestaciones del 11 de julio de 2021. La mujer había llegado a Estados Unidos en 2022 y buscaba asilo, pero las autoridades migratorias determinaron que había participado en violaciones de derechos humanos. En su papel como jueza en la isla, se le imputó responsabilidad en el enjuiciamiento y condena de manifestantes que protestaban contra el gobierno cubano. La medida tomada por Estados Unidos busca enviar un mensaje en contra de la impunidad por violaciones de derechos humanos en Cuba.","Una ex jueza cubana fue deportada de Estados Unidos luego de ser acusada de este cargo al haber sentenciado a protestantes en Cuba durante las manifestaciones del 11 de julio de 2021. La mujer había llegado a Estados Unidos en 2022 y buscaba asilo, pero las autoridades migratorias determinaron que había participado en violaciones de derechos humanos. En su papel como jueza en la isla, se le imputó responsabilidad en el enjuiciamiento y condena de manifestantes que protestaban contra el gobierno cubano. La medida tomada por Estados Unidos busca enviar un mensaje en contra de la impunidad por violaciones de derechos humanos en Cuba.",""
"10/02/2025 18:00:09","https://infobae.com/america/mundo/2025/10/01/el-g7-avanza-con-su-plan-para-endurecer-sanciones-contra-el-petroleo-ruso/","El G7 avanza con su plan para endurecer sanciones contra el petróleo ruso","G7 avanza en su plan para endurecer sanciones contra el petróleo ruso","https://encrypted-tbn0.gstatic.com/images?q=tbn:ANd9GcRpyYbUCkxeQOOyrlMvfAzQOSGeHi6OC8fWlpm0aJsvnzu_K91dTLnXJl5NDw&amp;s","El G7 ha avanzado en su estrategia para endurecer las sanciones contra el petróleo ruso, un esfuerzo destinado a debilitar la economía de Rusia tras su invasión de Ucrania. Los líderes del grupo discuten la implementación de un tope de precios más bajo para las importaciones de petróleo ruso, además de explorar nuevas medidas para limitar las exportaciones de productos relacionados con la energía. Estas acciones buscan reducir significativamente los ingresos que Rusia obtiene de sus exportaciones de petróleo y, al mismo tiempo, minimizar el impacto en los mercados energéticos globales.","El G7 ha avanzado en su estrategia para endurecer las sanciones contra el petróleo ruso, un esfuerzo destinado a debilitar la economía de Rusia tras su invasión de Ucrania. Los líderes del grupo discuten la implementación de un tope de precios más bajo para las importaciones de petróleo ruso, además de explorar nuevas medidas para limitar las exportaciones de productos relacionados con la energía. Estas acciones buscan reducir significativamente los ingresos que Rusia obtiene de sus exportaciones de petróleo y, al mismo tiempo, minimizar el impacto en los mercados energéticos globales.",""
"10/02/2025 18:00:09","https://infobae.com/america/mundo/2025/10/02/ascendio-a-72-la-cifra-de-muertos-tras-el-potente-terremoto-de-magnitud-69-que-sacudio-filipinas/","Ascendió a 72 la cifra de muertos tras el potente terremoto de magnitud 6,9 que sacudió Filipinas","Ascendió a 72 la cifra de muertos tras el potente terremoto de magnitud 6.9 que sacudió Filipinas","https://encrypted-tbn0.gstatic.com/images?q=tbn:ANd9GcRDP-WVOPpJFYDNIufimUSoO0v0DRVhKI3UulbpcTTqGhFi791Y8vLG1jWiZT8&amp;s","Un fuerte terremoto de magnitud 6.9 ha sacudido Filipinas, causando la muerte de al menos 72 personas y dejando a muchas más heridas. Las autoridades reportan daños significativos en la infraestructura, incluyendo edificios colapsados y carreteras afectadas. Equipos de rescate están operando en las áreas más impactadas para buscar sobrevivientes y brindar asistencia a los afectados. La alarma sísmica se activó en varias regiones, y se han registrado numerosas réplicas desde el evento inicial. El gobierno local ha declarado estado de emergencia para facilitar la ayuda.","Un fuerte terremoto de magnitud 6.9 ha sacudido Filipinas, causando la muerte de al menos 72 personas y dejando a muchas más heridas. Las autoridades reportan daños significativos en la infraestructura, incluyendo edificios colapsados y carreteras afectadas. Equipos de rescate están operando en las áreas más impactadas para buscar sobrevivientes y brindar asistencia a los afectados. La alarma sísmica se activó en varias regiones, y se han registrado numerosas réplicas desde el evento inicial. El gobierno local ha declarado estado de emergencia para facilitar la ayuda.",""
"10/02/2025 18:00:09","https://infobae.com/america/mundo/2025/10/02/la-justicia-de-corea-del-sur-le-nego-la-libertad-condicional-al-expresidente-yoon-suk-yeol/","La Justicia de Corea del Sur le negó la libertad condicional al expresidente Yoon Suk Yeol","La justicia de Corea del Sur niega la libertad condicional al expresidente Yoon Suk-yeol","https://encrypted-tbn0.gstatic.com/images?q=tbn:ANd9GcQeDFV6LUJ9K46zrOZ55R8LuQ7rNOraBkyrSbn-BcaIus_9jICb0vDS1x4YUQ&amp;s","La justicia de Corea del Sur ha rechazado la solicitud de libertad condicional del expresidente Yoon Suk-yeol, quien se encuentra cumpliendo una condena por corrupción. El tribunal argumentó que el exmandatario no mostró remordimiento por sus actos y que la gravedad de sus crímenes no justifica la concesión de este beneficio. La decisión ha generado reacciones en el país, donde Yoon enfrenta una serie de acusaciones y su futuro político permanece incierto.","La justicia de Corea del Sur ha rechazado la solicitud de libertad condicional del expresidente Yoon Suk-yeol, quien se encuentra cumpliendo una condena por corrupción. El tribunal argumentó que el exmandatario no mostró remordimiento por sus actos y que la gravedad de sus crímenes no justifica la concesión de este beneficio. La decisión ha generado reacciones en el país, donde Yoon enfrenta una serie de acusaciones y su futuro político permanece incierto.",""
"10/02/2025 18:00:09","https://infobae.com/america/mundo/2025/10/02/israel-confirmo-el-traslado-de-los-activistas-de-la-flotilla-humanitaria-a-su-territorio-para-deportarlos-a-europa/","Israel confirmó el traslado de los activistas de la Flotilla humanitaria a su territorio para deportarlos a Europa","Israel confirma el traslado de activistas de la flotilla humanitaria para ser deportados a Europa","https://encrypted-tbn0.gstatic.com/images?q=tbn:ANd9GcQXIlovsNP8U5mQKrGwbvB4--ZBakd9n8c6t5xFGbFipnIN990PE_Nvl21wruw&amp;s","Israel ha llevado a cabo el traslado de activistas que formaban parte de una flotilla humanitaria hacia su territorio. La intención del gobierno israelí es deportar a estos individuos hacia Europa. Este movimiento se produce en el contexto de tensiones entre Israel y los organizadores de la flotilla, quienes buscan llamar la atención sobre la situación en Gaza. La deportación de los activistas ha suscitado críticas y preocupaciones sobre los derechos humanos.","Israel ha llevado a cabo el traslado de activistas que formaban parte de una flotilla humanitaria hacia su territorio. La intención del gobierno israelí es deportar a estos individuos hacia Europa. Este movimiento se produce en el contexto de tensiones entre Israel y los organizadores de la flotilla, quienes buscan llamar la atención sobre la situación en Gaza. La deportación de los activistas ha suscitado críticas y preocupaciones sobre los derechos humanos.",""
"10/02/2025 18:00:09","https://infobae.com/deportes/2025/09/27/magistral-actuacion-de-max-verstappen-en-nurburgring-gano-en-su-debut-en-una-carrera-de-resistencia/","Magistral actuación de Max Verstappen en Nürburgring: ganó en su debut en una carrera de resistencia","Max Verstappen triunfa en su debut en una carrera de resistencia en Nürburgring","https://encrypted-tbn0.gstatic.com/images?q=tbn:ANd9GcQJogVpJZQKlTUibsVz2PwuPxO_2-kFhKra6tA_N3O_bXamQV4DqQSJPHbVpw&amp;s","Max Verstappen tuvo una destacada actuación en su debut en una carrera de resistencia en Nürburgring, donde logró la victoria. El piloto, conocido por su éxito en la Fórmula 1, demostró su habilidad y competitividad al adaptarse rápidamente a este nuevo formato de competencia. Esta carrera marcó un hito en la carrera de Verstappen, quien acumuló experiencia en un tipo de evento diferente al que usualmente participa. Con esta victoria, se reafirma su talento y capacidad para sobresalir en diversas modalidades deportivas.","Max Verstappen tuvo una destacada actuación en su debut en una carrera de resistencia en Nürburgring, donde logró la victoria. El piloto, conocido por su éxito en la Fórmula 1, demostró su habilidad y competitividad al adaptarse rápidamente a este nuevo formato de competencia. Esta carrera marcó un hito en la carrera de Verstappen, quien acumuló experiencia en un tipo de evento diferente al que usualmente participa. Con esta victoria, se reafirma su talento y capacidad para sobresalir en diversas modalidades deportivas.",""
"10/02/2025 18:00:09","https://infobae.com/deportes/2025/10/02/lo-vendieron-por-79-millones-a-la-premier-y-una-leyenda-de-alemania-lo-destrozo-los-felicito-por-encontrar-un-idiota-que-pagara-tanto/","Lo vendieron por 79 millones a la Premier y una leyenda de Alemania lo destrozó: “Los felicito por encontrar un idiota que pagara tanto”","Leyenda alemana critica la venta de futbolista por 79 millones a la Premier League","https://encrypted-tbn0.gstatic.com/images?q=tbn:ANd9GcRw0NhPsFG8-nHHOrPoGl_wREn0hfCpacHuDoYkC1sxJcqgUSeeuXC_zwhbyQ&amp;s","La noticia informa sobre la venta de un jugador por 79 millones de euros a un club de la Premier League, lo que generó críticas por su elevado precio. Una figura reconocida en la historia del fútbol alemán cuestionó la transacción y se refirió de forma sarcástica al comprador, sugiriendo que había encontrado a alguien dispuesto a pagar tal suma. Estas declaraciones resaltan las tensiones en el mercado de transferencias y el debate sobre los valores inflados en el fútbol actual.","La noticia informa sobre la venta de un jugador por 79 millones de euros a un club de la Premier League, lo que generó críticas por su elevado precio. Una figura reconocida en la historia del fútbol alemán cuestionó la transacción y se refirió de forma sarcástica al comprador, sugiriendo que había encontrado a alguien dispuesto a pagar tal suma. Estas declaraciones resaltan las tensiones en el mercado de transferencias y el debate sobre los valores inflados en el fútbol actual.",""
"10/02/2025 18:00:09","https://infobae.com/estados-unidos/2025/10/02/dos-aviones-colisionaron-durante-maniobras-en-pista-en-el-aeropuerto-laguardia-de-nueva-york/","Dos aviones colisionaron mientras rodaban por la pista del aeropuerto LaGuardia en Nueva York","Dos aviones colisionaron durante maniobras en el aeropuerto LaGuardia de Nueva York","https://encrypted-tbn0.gstatic.com/images?q=tbn:ANd9GcT9kJ5F4F0JHd5G2LjDjSOh-FPR0EQicET_9kNNbaNWqzPprKZA7Kj_BOYqxQ&amp;s","Dos aviones colisionaron en la pista del aeropuerto LaGuardia de Nueva York durante maniobras de aterrizaje y despegue. El incidente involucró un vuelo de American Airlines y otro de otra aerolínea, aunque no se registraron heridos graves. Las autoridades están investigando las causas del accidente y se ha informado que la situación provocó retrasos en las operaciones del aeropuerto. Las operaciones normales se reanudaron poco después del incidente.","Dos aviones colisionaron en la pista del aeropuerto LaGuardia de Nueva York durante maniobras de aterrizaje y despegue. El incidente involucró un vuelo de American Airlines y otro de otra aerolínea, aunque no se registraron heridos graves. Las autoridades están investigando las causas del accidente y se ha informado que la situación provocó retrasos en las operaciones del aeropuerto. Las operaciones normales se reanudaron poco después del incidente.",""
"10/02/2025 18:00:09","https://infobae.com/america/mundo/2025/10/01/un-telefono-en-el-regazo-de-trump-y-una-carta-la-casa-blanca-mostro-el-momento-de-la-disculpa-de-netanyahu-a-qatar/","Un teléfono en el regazo de Trump y una carta: la Casa Blanca mostró la disculpa de Netanyahu a Qatar","Disculpa de Netanyahu a Qatar revelada en carta dirigida a la Casa Blanca","https://encrypted-tbn0.gstatic.com/images?q=tbn:ANd9GcQDiRKUf1iLBDGNR8_WzZjxigQFvZlmCCBGGQugrgYQBZ3W4MuS7CNzH_JsseU&amp;s","El primer ministro israelí, Benjamin Netanyahu, se disculpó ante Catar en una conversación con el expresidente estadounidense Donald Trump. En este encuentro, Netanyahu admitió que la situación en Gaza era complicada y reconoció problemas en las relaciones entre Israel y Catar, especialmente debido a la crisis humanitaria. La disculpa se produce en un contexto de tensiones en la región, y Catar ha sido un importante mediador en la situación de conflicto en Gaza.","El primer ministro israelí, Benjamin Netanyahu, se disculpó ante Catar en una conversación con el expresidente estadounidense Donald Trump. En este encuentro, Netanyahu admitió que la situación en Gaza era complicada y reconoció problemas en las relaciones entre Israel y Catar, especialmente debido a la crisis humanitaria. La disculpa se produce en un contexto de tensiones en la región, y Catar ha sido un importante mediador en la situación de conflicto en Gaza.",""
"10/02/2025 18:00:09","https://infobae.com/deportes/2025/10/01/la-ingenieria-detras-del-deseo-de-red-bull-de-volver-a-contar-con-albon-el-efecto-rebote-que-podria-tener-en-colapinto/","La ingeniería detrás del deseo de Red Bull de volver a contar con Albon","La ingeniería detrás del deseo de Red Bull de volver a contar con Albon y el efecto rebote que podría tener en Colapinto","https://encrypted-tbn0.gstatic.com/images?q=tbn:ANd9GcSrc4jPFRu-YTApgkSuiJd2DrhVTE8h99Ru18XR2en-30kLaVsqqdUe370RsA&amp;s","La noticia aborda los planes de Red Bull Racing para reincorporar a Alexander Albon, quien ha demostrado un rendimiento sólido en su carrera. La escudería está considerando este movimiento por varias razones, incluyendo el deseo de contar con un piloto que se adapte bien a su estilo de equipo y pueda contribuir al desarrollo de su coche.

Además, se menciona el impacto que esta decisión podría tener en el futuro de otros pilotos, como Franco Colapinto, quien es parte de las categorías de desarrollo de la escudería. La reestructuración de la alineación de pilotos en Red Bull podría influir en la carrera de Colapinto y en su proyección dentro de la Fórmula 1.","La noticia aborda los planes de Red Bull Racing para reincorporar a Alexander Albon, quien ha demostrado un rendimiento sólido en su carrera. La escudería está considerando este movimiento por varias razones, incluyendo el deseo de contar con un piloto que se adapte bien a su estilo de equipo y pueda contribuir al desarrollo de su coche.

Además, se menciona el impacto que esta decisión podría tener en el futuro de otros pilotos, como Franco Colapinto, quien es parte de las categorías de desarrollo de la escudería. La reestructuración de la alineación de pilotos en Red Bull podría influir en la carrera de Colapinto y en su proyección dentro de la Fórmula 1.",""
"10/02/2025 18:00:09","https://infobae.com/america/mundo/2025/10/01/marco-rubio-pidio-el-rapido-despliegue-de-la-nueva-mision-internacional-contra-las-pandillas-en-haiti/","Marco Rubio pidió el “rápido despliegue” de la nueva misión internacional contra las pandillas en Haití","Marco Rubio solicita despliegue urgente de misión internacional contra pandillas en Haití","https://encrypted-tbn0.gstatic.com/images?q=tbn:ANd9GcRPwIODa8OxQgjmz68F4m5iGc92AXcuEkGEwjmwE2OfWETa2AL3LNvmLpJtYDk&amp;s","El senador Marco Rubio solicitó la rápida implementación de una nueva misión internacional destinada a combatir la creciente violencia de las pandillas en Haití. Esta afirmación se produce en un contexto donde la inseguridad y el caos han aumentado de manera alarmante, afectando gravemente a la población y dificultando la entrega de ayuda humanitaria. Rubio subrayó la urgencia de la situación, señalando que Haití necesita apoyos internacionales de manera inmediata para restaurar la estabilidad y seguridad en el país.","El senador Marco Rubio solicitó la rápida implementación de una nueva misión internacional destinada a combatir la creciente violencia de las pandillas en Haití. Esta afirmación se produce en un contexto donde la inseguridad y el caos han aumentado de manera alarmante, afectando gravemente a la población y dificultando la entrega de ayuda humanitaria. Rubio subrayó la urgencia de la situación, señalando que Haití necesita apoyos internacionales de manera inmediata para restaurar la estabilidad y seguridad en el país.",""
