"FechayHora","LinkOrigen","TituloOrigen","Titulo","Imagen","Intro","Noticia","Datos"
"09/11/2025 11:25:43","https://infobae.com/america/america-latina/2025/09/11/estados-unidos-responsabilizo-al-regimen-de-daniel-ortega-por-la-desaparicion-del-medico-yerri-estrada-en-nicaragua/","Estados Unidos responsabilizó al régimen de Daniel Ortega por la desaparición del médico Yerri Estrada en Nicaragua","Estados Unidos responsabiliza al régimen de Daniel Ortega por la desaparición del médico Yerri Estrada en Nicaragua","https://encrypted-tbn0.gstatic.com/images?q=tbn:ANd9GcTRyFJvGSL-Q5f6ynLRcIXfE0LmQJRjYLHIMPqZSU-Y3indtyMdUFcj6HjhGT8&amp;s","Estados Unidos culpó al régimen de Daniel Ortega por la desaparición del médico Yerri Estrada en Nicaragua. La situación ha generado preocupación tanto en el ámbito local como internacional, ya que Estrada es un reconocido médico y activista. La administración estadounidense exigió la liberación inmediata del médico y condenó la represión continua de los derechos humanos en el país centroamericano. Esta desaparición se suma a un patrón de ataques contra opositores y críticos del gobierno de Ortega.","Estados Unidos culpó al régimen de Daniel Ortega por la desaparición del médico Yerri Estrada en Nicaragua. La situación ha generado preocupación tanto en el ámbito local como internacional, ya que Estrada es un reconocido médico y activista. La administración estadounidense exigió la liberación inmediata del médico y condenó la represión continua de los derechos humanos en el país centroamericano. Esta desaparición se suma a un patrón de ataques contra opositores y críticos del gobierno de Ortega.",
"09/11/2025 11:25:43","https://infobae.com/estados-unidos/2025/09/11/trump-prometio-capturar-al-responsable-del-asesinato-de-charlie-kirk-en-utah-es-un-dia-oscuro-para-estados-unidos/","Trump acusó a la “izquierda radical” de generar el clima de odio que derivó en el asesinato de Charlie Kirk","Trump promete capturar al responsable del asesinato de Charlie Kirk en Utah","https://encrypted-tbn0.gstatic.com/images?q=tbn:ANd9GcT8HFjrPMV2Do4cktmRAntkR7b4WQAIEvwsLlxXdPliEQ_kk9ZtjzHxlprm46A&amp;s","Donald Trump prometió que se comprometerá a encontrar al responsable del asesinato de Charlie Kirk en Utah, describiendo el suceso como uno de los días más oscuros para Estados Unidos. Durante un evento en una localidad cercana, el expresidente se centró en la violencia y lo que consideró una crisis de seguridad en el país, junto con la necesidad de justicia. Kirk, conocido por ser un activista conservador, fue asesinado en circunstancias que han generado gran preocupación en la comunidad. La noticia ha generado un intenso debate sobre la violencia política y la seguridad en el país.","Donald Trump prometió que se comprometerá a encontrar al responsable del asesinato de Charlie Kirk en Utah, describiendo el suceso como uno de los días más oscuros para Estados Unidos. Durante un evento en una localidad cercana, el expresidente se centró en la violencia y lo que consideró una crisis de seguridad en el país, junto con la necesidad de justicia. Kirk, conocido por ser un activista conservador, fue asesinado en circunstancias que han generado gran preocupación en la comunidad. La noticia ha generado un intenso debate sobre la violencia política y la seguridad en el país.",""
"09/11/2025 11:25:43","https://infobae.com/salud/ciencia/2025/09/10/un-test-de-la-sangre-puede-detectar-cancer-de-cabeza-y-cuello-hasta-10-anos-antes-de-los-sintomas/","Un test de la sangre puede detectar cáncer de cabeza y cuello hasta 10 años antes de los síntomas","Un test de sangre puede detectar cáncer de cabeza y cuello hasta 10 años antes de los síntomas","https://encrypted-tbn0.gstatic.com/images?q=tbn:ANd9GcQINFBY1dxwHruKcBdRl_QfItjR9gCiWOLDwK2pNJhO_-LzOuPrC8w5U-DVrw&amp;s","Un nuevo análisis de sangre ha mostrado la capacidad de detectar cáncer de cabeza y cuello hasta diez años antes de la aparición de síntomas clínicos. Este avance se basa en la identificación de biomarcadores en la sangre que están asociados con el desarrollo de este tipo de cáncer. La investigación sugiere que este test podría permitir un diagnóstico más temprano, lo que podría mejorar significativamente las tasas de supervivencia. El estudio se realizó en una población de riesgo y los hallazgos apuntan a un futuro en el que se puedan implementar pruebas rutinarias para la detección precoz de esta enfermedad.","Un nuevo análisis de sangre ha mostrado la capacidad de detectar cáncer de cabeza y cuello hasta diez años antes de la aparición de síntomas clínicos. Este avance se basa en la identificación de biomarcadores en la sangre que están asociados con el desarrollo de este tipo de cáncer. La investigación sugiere que este test podría permitir un diagnóstico más temprano, lo que podría mejorar significativamente las tasas de supervivencia. El estudio se realizó en una población de riesgo y los hallazgos apuntan a un futuro en el que se puedan implementar pruebas rutinarias para la detección precoz de esta enfermedad.",""
"09/11/2025 11:25:43","https://infobae.com/deportes/2025/09/10/la-emocion-no-me-permite-seguir-el-conmovedor-relato-de-un-periodista-boliviano-tras-la-clasificacion-al-repechaje-mundialista/","“La emoción no me permite seguir”: el conmovedor relato de un periodista boliviano tras la clasificación al repechaje mundialista","Emocionante relato de un periodista boliviano tras la clasificación al repechaje mundialista","https://encrypted-tbn0.gstatic.com/images?q=tbn:ANd9GcTTBvjqPfjSUTl0Z7tfJ1yLPA6lwO6FSmA-xgcMAvZfEMU_hceq_5amSMj_vp4&amp;s","Un periodista boliviano expresó su intensa emoción tras la clasificación de la selección nacional al repechaje para el Mundial. En su relato, destacó la pasión y el esfuerzo del equipo durante las eliminatorias, así como el impacto que este logro tiene en el país. La victoria fue recibida con gran júbilo por parte de los aficionados, quienes ven esto como una oportunidad histórica. La emoción del periodista reflejó la conexión profunda entre el deporte y la identidad nacional boliviana.","Un periodista boliviano expresó su intensa emoción tras la clasificación de la selección nacional al repechaje para el Mundial. En su relato, destacó la pasión y el esfuerzo del equipo durante las eliminatorias, así como el impacto que este logro tiene en el país. La victoria fue recibida con gran júbilo por parte de los aficionados, quienes ven esto como una oportunidad histórica. La emoción del periodista reflejó la conexión profunda entre el deporte y la identidad nacional boliviana.",""
"09/11/2025 11:25:43","https://infobae.com/deportes/2025/09/10/la-singular-metafora-de-gustavo-alfaro-para-defender-a-galarza-fonda-de-las-criticas-de-los-hinchas-de-river/","La singular metáfora de Gustavo Alfaro para defender a Galarza Fonda de las críticas de los hinchas de River","Gustavo Alfaro defiende a Galarza Fonda ante las críticas de los hinchas de River con una singular metáfora","https://encrypted-tbn0.gstatic.com/images?q=tbn:ANd9GcTaXySDHYOOsQhSrNGnVuDiMZl1aQXyAFhCXqEycchWTwF-5J8TxWzcFrowwnk&amp;s","Gustavo Alfaro, entrenador de Gimnasia, defendió al arquero Rodrigo Galarza ante las críticas de los hinchas de River Plate tras el partido amistoso en el que el equipo enfrentó a la reserva de los millonarios. Alfaro utilizó una metáfora relacionada con un amigo que tiene un negocio de empanadas que no ha tenido éxito. Según Alfaro, Galarza ha enfrentado una situación similar, dando a entender que, aunque no siempre tiene el apoyo que necesita, su desempeño tiene el potencial de mejorar. El técnico destacó la importancia de respaldar a los jugadores en momentos difíciles y argumentó que Galarza está trabajando para superar sus dificultades.","Gustavo Alfaro, entrenador de Gimnasia, defendió al arquero Rodrigo Galarza ante las críticas de los hinchas de River Plate tras el partido amistoso en el que el equipo enfrentó a la reserva de los millonarios. Alfaro utilizó una metáfora relacionada con un amigo que tiene un negocio de empanadas que no ha tenido éxito. Según Alfaro, Galarza ha enfrentado una situación similar, dando a entender que, aunque no siempre tiene el apoyo que necesita, su desempeño tiene el potencial de mejorar. El técnico destacó la importancia de respaldar a los jugadores en momentos difíciles y argumentó que Galarza está trabajando para superar sus dificultades.",""
"09/11/2025 11:25:43","https://infobae.com/deportes/2025/09/10/un-ex-mecanico-de-red-bull-revelo-cuanto-cobran-por-trabajar-en-los-boxes-de-la-formula-1/","Un ex mecánico de Red Bull reveló cuánto cobran por trabajar en los boxes de la Fórmula 1","Revelan los salarios en los boxes de la Fórmula 1 según un exmecánico de Red Bull.","https://encrypted-tbn0.gstatic.com/images?q=tbn:ANd9GcQiRUaKg7v-GXvtmJReKQ2YBmiVuaozgsGnv_dlnUju9E3WMjqt0154F5KiGHw&amp;s","Un exmecánico de Red Bull compartió detalles sobre los salarios en los pits de la Fórmula 1. Según su experiencia, los ingresos pueden variar según el puesto y la escudería, con márgenes que van de cifras modestas hasta salarios considerables para roles más especializados. La alta presión y dedicación requerida en este entorno se contrastan con las recompensas económicas, lo que hace que trabajar en las boxes sea una opción atractiva para muchos profesionales del automovilismo.","Un exmecánico de Red Bull compartió detalles sobre los salarios en los pits de la Fórmula 1. Según su experiencia, los ingresos pueden variar según el puesto y la escudería, con márgenes que van de cifras modestas hasta salarios considerables para roles más especializados. La alta presión y dedicación requerida en este entorno se contrastan con las recompensas económicas, lo que hace que trabajar en las boxes sea una opción atractiva para muchos profesionales del automovilismo.",""
"09/11/2025 11:25:43","https://infobae.com/estados-unidos/2025/09/11/el-jefe-del-pentagono-advirtio-a-nicolas-maduro-por-el-despliegue-militar-en-el-caribe-la-pelota-esta-en-su-cancha/","El jefe del Pentágono advirtió a Nicolás Maduro por el despliegue militar en el Caribe: “La pelota está en su cancha”","El jefe del Pentágono advirtió a Nicolás Maduro por el despliegue militar en el Caribe","https://encrypted-tbn0.gstatic.com/images?q=tbn:ANd9GcQ2S8--E0pqqF6r_uCSe7aFstTY7LynzD4tdVE7lihrq7lQB_C-hlIsUZPOA2A&amp;s","El secretario de Defensa de Estados Unidos, Lloyd Austin, advirtió a Nicolás Maduro sobre el reciente despliegue militar en el Caribe. Durante un evento en la Escuela de Guerra del Ejército en Fort Leavenworth, Austin enfatizó que la acción militar en la región podría tener consecuencias negativas, y que la ""pelota está en la cancha de Maduro"" en relación con esta situación. Esta declaración refleja la preocupación de EE. UU. por las tensiones en el área y la militarización por parte del gobierno venezolano.","El secretario de Defensa de Estados Unidos, Lloyd Austin, advirtió a Nicolás Maduro sobre el reciente despliegue militar en el Caribe. Durante un evento en la Escuela de Guerra del Ejército en Fort Leavenworth, Austin enfatizó que la acción militar en la región podría tener consecuencias negativas, y que la ""pelota está en la cancha de Maduro"" en relación con esta situación. Esta declaración refleja la preocupación de EE. UU. por las tensiones en el área y la militarización por parte del gobierno venezolano.",""
"09/11/2025 11:25:43","https://infobae.com/america/mundo/2025/09/09/el-video-del-momento-del-ataque-selectivo-de-israel-contra-la-cupula-de-hamas-en-doha/","El video del momento del ataque selectivo de Israel contra la cúpula de Hamas en Doha","El video del momento del ataque selectivo de Israel contra la cúpula de Hamas en Doha","https://encrypted-tbn0.gstatic.com/images?q=tbn:ANd9GcS3m9MxNzpMQ2inIBQZRUu_-bkUoGsPS3P6TVm5U6tP_TUbFICdDWKgFa23tg&amp;s","En el video del ataque selectivo de Israel contra la cúpula de Hamas en Doha, se muestra el momento en que un misil impacta en un edificio de la ciudad. El ataque fue llevado a cabo como represalia a los recientes lanzamientos de cohetes desde la Franja de Gaza hacia territorio israelí.","En el video del ataque selectivo de Israel contra la cúpula de Hamas en Doha, se muestra el momento en que un misil impacta en un edificio de la ciudad. El ataque fue llevado a cabo como represalia a los recientes lanzamientos de cohetes desde la Franja de Gaza hacia territorio israelí.",""
"09/11/2025 11:25:43","https://infobae.com/america/mundo/2025/09/10/sushila-karki-expresidenta-del-tribunal-supremo-en-nepal-es-la-elegida-de-los-manifestantes-para-encabezar-el-gobierno-interino-tras-la-renuncia-del-primer-ministro/","Sushila Karki, expresidenta del Tribunal Supremo en Nepal, es la elegida de los manifestantes para encabezar el gobierno interino tras la renuncia del primer ministro","Sushila Karki, ex presidenta del Tribunal Supremo de Nepal, es elegida por los manifestantes para liderar el gobierno interino tras la renuncia del primer ministro","https://encrypted-tbn0.gstatic.com/images?q=tbn:ANd9GcS7nOqmc-pGTsXX9pUymtvEJhePuTXs3YTFNst_UQezupOEQr4i8v0IWcUV0T4&amp;s","Sushila Karki, quien se desempeñó como presidenta del Tribunal Supremo de Nepal, ha sido elegida por los manifestantes para liderar el gobierno provisional tras la renuncia del primer ministro. La situación política en el país se ha visto marcada por protestas que exigieron cambios en el liderazgo tras la salida del primer ministro. Karki es vista como una figura que podría aportar estabilidad en este periodo de incertidumbre política.","Sushila Karki, quien se desempeñó como presidenta del Tribunal Supremo de Nepal, ha sido elegida por los manifestantes para liderar el gobierno provisional tras la renuncia del primer ministro. La situación política en el país se ha visto marcada por protestas que exigieron cambios en el liderazgo tras la salida del primer ministro. Karki es vista como una figura que podría aportar estabilidad en este periodo de incertidumbre política.",""
"09/11/2025 11:25:43","https://infobae.com/deportes/2025/09/10/el-arbitro-mas-polemico-de-la-premier-league-fue-acusado-de-filmar-un-video-indecente-de-un-menor/","El árbitro más polémico de la Premier League fue acusado de filmar un “video indecente” de un menor","","https://encrypted-tbn0.gstatic.com/images?q=tbn:ANd9GcSum4R4GFytAxBKmOxbYUE-sfLeA4_hOgrOzcKlSYFICT-BoGYame7a0X1tm5k&amp;s","El árbitro de la Premier League ha sido acusado de grabar un video inapropiado que involucra a un menor. La denuncia ha generado un gran revuelo en el ámbito deportivo y mediático, considerando que el árbitro es una figura pública conocida por su controversial carrera en el fútbol. La situación está siendo investigada por las autoridades competentes, y se espera que se tomen acciones según el desarrollo de la investigación. La noticia ha suscitado reacciones diversas entre aficionados y profesionales del deporte.","El árbitro de la Premier League ha sido acusado de grabar un video inapropiado que involucra a un menor. La denuncia ha generado un gran revuelo en el ámbito deportivo y mediático, considerando que el árbitro es una figura pública conocida por su controversial carrera en el fútbol. La situación está siendo investigada por las autoridades competentes, y se espera que se tomen acciones según el desarrollo de la investigación. La noticia ha suscitado reacciones diversas entre aficionados y profesionales del deporte.",""
"09/11/2025 11:25:43","https://infobae.com/america/mundo/2025/09/10/zelensky-exigio-un-escudo-aereo-europeo-tras-las-incursiones-de-drones-rusos-en-polonia/","Zelensky exigió un “escudo aéreo europeo” tras las incursiones de drones rusos en Polonia","Zelensky exigió un escudo aéreo europeo tras incursiones de drones rusos en Polonia","https://encrypted-tbn0.gstatic.com/images?q=tbn:ANd9GcTUrCPvlAagKRNAX0MI3tyajJbtd7MJFTlrRNzd9FLfgU4XISkcCeSiUfqVjzA&amp;s","El presidente de Ucrania, Volodímir Zelensky, solicitó la creación de un escudo aéreo europeo tras los recientes ataques con drones rusos en Polonia. Durante su intervención en una cumbre de líderes europeos, Zelensky destacó la necesidad de reforzar la defensa aérea en la región ante el incremento de las amenazas aéreas. Esta petición se produce en el contexto de la creciente preocupación por la seguridad en Europa y la necesidad de una respuesta coordinada frente a la agresión rusa.","El presidente de Ucrania, Volodímir Zelensky, solicitó la creación de un escudo aéreo europeo tras los recientes ataques con drones rusos en Polonia. Durante su intervención en una cumbre de líderes europeos, Zelensky destacó la necesidad de reforzar la defensa aérea en la región ante el incremento de las amenazas aéreas. Esta petición se produce en el contexto de la creciente preocupación por la seguridad en Europa y la necesidad de una respuesta coordinada frente a la agresión rusa.",""
"09/11/2025 11:25:43","https://infobae.com/estados-unidos/2025/09/10/murio-charlie-kirk-el-activista-conservador-de-estados-unidos-que-recibio-un-disparo-durante-un-evento-en-utah/","Murió Charlie Kirk, el activista conservador de EEUU que recibió un disparo durante un evento en Utah","Murió Charlie Kirk, el activista conservador de Estados Unidos que recibió un disparo durante un evento en Utah","https://encrypted-tbn0.gstatic.com/images?q=tbn:ANd9GcTmViIm7-AgjZ8HeZlZEfmQU-gQNceYs5oMy100EnyOo1jJT3gzf45LnNrMWmM&amp;s","Charlie Kirk, un conocido activista conservador en Estados Unidos, falleció tras recibir un disparo durante un evento en Utah. El incidente ocurrió mientras Kirk participaba en una actividad pública, lo que ha generado preocupación en torno a la seguridad de figuras políticas. Las autoridades están investigando el suceso para esclarecer las circunstancias del ataque. Kirk era reconocido por su labor en la difusión de ideas conservadoras y había sido una figura influyente en el ámbito político.","Charlie Kirk, un conocido activista conservador en Estados Unidos, falleció tras recibir un disparo durante un evento en Utah. El incidente ocurrió mientras Kirk participaba en una actividad pública, lo que ha generado preocupación en torno a la seguridad de figuras políticas. Las autoridades están investigando el suceso para esclarecer las circunstancias del ataque. Kirk era reconocido por su labor en la difusión de ideas conservadoras y había sido una figura influyente en el ámbito político.",""
"09/11/2025 11:25:43","https://infobae.com/deportes/2025/09/09/los-lujos-de-la-promesa-de-racing-que-brilla-en-el-mundial-de-clubes-juvenil-y-en-europa-comparan-con-maradona/","Los lujos de la promesa de Racing que brilla en el Mundial de Clubes Juvenil y en Europa comparan con Maradona","Los lujos de la promesa de Racing que brilla en el Mundial de Clubes juvenil y en Europa comparan con Maradona","https://encrypted-tbn0.gstatic.com/images?q=tbn:ANd9GcSoY5udr_ccVbIsT-uBi381NGxlHibTo8dWwiujy1GBqJAk-I830QUvI1pS7kU&amp;s","Un joven jugador de Racing se encuentra brillando en el Mundial de Clubes juvenil y en Europa, siendo comparado con Maradona por sus habilidades en el campo. Este talentoso futbolista ha llamado la atención por su gran desempeño y se destaca por sus lujos en el terreno de juego.","Un joven jugador de Racing se encuentra brillando en el Mundial de Clubes juvenil y en Europa, siendo comparado con Maradona por sus habilidades en el campo. Este talentoso futbolista ha llamado la atención por su gran desempeño y se destaca por sus lujos en el terreno de juego.",""
"09/11/2025 11:25:43","https://infobae.com/america/mundo/2025/09/10/el-primer-ministro-frances-sebastien-lecornu-proyecto-cambios-de-fondo-para-encarar-la-crisis-francesa/","El primer ministro francés Sébastien Lecornu proyectó cambios “de fondo” para encarar la crisis francesa","Primer Ministro francés propone cambios fundamentales para abordar la crisis en Francia","https://encrypted-tbn0.gstatic.com/images?q=tbn:ANd9GcQZ_N4JI2A8ZT7Sej84XKIvxfL8-dC63gan_oCLmr-kkgyDVQiWpXY_wfuBOU8&amp;s","El primer ministro de Francia, Sébastien Lecornu, presentó un plan integral para abordar la crisis que afecta al país. Este proyecto busca implementar cambios significativos en diversas áreas, incluyendo la economía, la seguridad y la cohesión social. El objetivo es restaurar la confianza de los ciudadanos y mejorar la situación actual, que se ha deteriorado en los últimos años. Lecornu destacó la necesidad de un enfoque coordinado entre el gobierno y las comunidades locales para afrontar los desafíos existentes y construir un futuro más sostenible para Francia.","El primer ministro de Francia, Sébastien Lecornu, presentó un plan integral para abordar la crisis que afecta al país. Este proyecto busca implementar cambios significativos en diversas áreas, incluyendo la economía, la seguridad y la cohesión social. El objetivo es restaurar la confianza de los ciudadanos y mejorar la situación actual, que se ha deteriorado en los últimos años. Lecornu destacó la necesidad de un enfoque coordinado entre el gobierno y las comunidades locales para afrontar los desafíos existentes y construir un futuro más sostenible para Francia.",""
"09/11/2025 11:25:43","https://infobae.com/deportes/2025/09/09/el-incomodo-error-de-aryna-sabalenka-en-medio-de-una-entrevista-con-carlos-alcaraz-podemos-cortar-esto/","El incómodo error de Aryna Sabalenka en medio de una entrevista con Carlos Alcaraz: “¿Podemos cortar esto?&quot;","El incómodo error de Aryna Sabalenka en medio de una entrevista con Carlos Alcaraz: ¿Podemos cortar esto?","https://encrypted-tbn0.gstatic.com/images?q=tbn:ANd9GcTxCiKzNA0n3Ivm4VlzLuX2GcX3QseyKkje2YpLh0Ig4Ny5pQI3Bm7yqQRBE2Q&amp;s","En medio de una entrevista con Carlos Alcaraz, la tenista Aryna Sabalenka cometió un error al confundirlo con Rafael Nadal. La jugadora bielorrusa se disculpó rápidamente por la confusión, y ambos deportistas continuaron con la entrevista sin mayores inconvenientes.","En medio de una entrevista con Carlos Alcaraz, la tenista Aryna Sabalenka cometió un error al confundirlo con Rafael Nadal. La jugadora bielorrusa se disculpó rápidamente por la confusión, y ambos deportistas continuaron con la entrevista sin mayores inconvenientes.",""
"09/11/2025 11:25:43","https://infobae.com/america/mundo/2025/09/10/polonia-confirmo-que-una-casa-fue-danada-por-los-drones-rusos-y-hallo-restos-de-siete-aeronaves-interceptadas/","Polonia confirmó que una casa fue dañada por los drones rusos y halló restos de siete aeronaves interceptadas","Polonia confirma daños en una casa por drones rusos y halla restos de siete aeronaves interceptadas","https://encrypted-tbn0.gstatic.com/images?q=tbn:ANd9GcQH_8ss6f6aL5z76NE5zMB7egLUO1Ky6V4Vqu7pFKb3rc4zBiPuK1mfvKRS26c&amp;s","Polonia ha reportado daños en una casa debido a la caída de restos de drones rusos en su territorio. Autoridades polacas confirmaron que se hallaron fragmentos de siete aeronaves no tripuladas que fueron interceptadas en su espacio aéreo. Este incidente resalta la creciente tensión en la región y la amenaza de los enfrentamientos relacionados con el conflicto en Ucrania.","Polonia ha reportado daños en una casa debido a la caída de restos de drones rusos en su territorio. Autoridades polacas confirmaron que se hallaron fragmentos de siete aeronaves no tripuladas que fueron interceptadas en su espacio aéreo. Este incidente resalta la creciente tensión en la región y la amenaza de los enfrentamientos relacionados con el conflicto en Ucrania.",""
"09/11/2025 11:25:43","https://infobae.com/america/mundo/2025/09/10/israel-intensifico-su-ofensiva-contra-los-huties-lanzo-otro-ataque-con-drones-contra-yemen/","Israel intensificó su ofensiva contra los hutíes: lanzó otro ataque con drones","Israel intensifica su ofensiva contra los hutíes con ataque de drones en Yemen","https://encrypted-tbn0.gstatic.com/images?q=tbn:ANd9GcR_1yfjY-LrYNdPousgFfUoD0sTa4myEpHZ2hM2tmcCPn11RhnN5gBB8N436g&amp;s","Israel ha intensificado su ofensiva en Yemen, llevando a cabo un nuevo ataque con drones contra los hutíes. Esta operación se produjo en el contexto de un conflicto más amplio en la región y refleja el compromiso de Israel de atacar a grupos que considera amenazantes. Aunque no se han reportado detalles específicos sobre las bajas o daños causados por el ataque, las autoridades israelíes han señalado que continuarán con sus acciones militares en respuesta a lo que consideran actividades hostiles por parte de los hutíes.","Israel ha intensificado su ofensiva en Yemen, llevando a cabo un nuevo ataque con drones contra los hutíes. Esta operación se produjo en el contexto de un conflicto más amplio en la región y refleja el compromiso de Israel de atacar a grupos que considera amenazantes. Aunque no se han reportado detalles específicos sobre las bajas o daños causados por el ataque, las autoridades israelíes han señalado que continuarán con sus acciones militares en respuesta a lo que consideran actividades hostiles por parte de los hutíes.",""
