"FechayHora","LinkOrigen","TituloOrigen","Titulo","Imagen","Intro","Noticia","Datos"
"10/02/2025 18:00:09","https://infobae.com/america/mundo/2025/10/02/el-gabinete-de-papua-nueva-guinea-aprobo-el-tratado-de-defensa-con-australia-que-pone-limites-la-influencia-de-china/","El Gabinete de Papúa Nueva Guinea aprobó el tratado de defensa con Australia que pone límites la influencia de China","El gabinete de Papua Nueva Guinea aprobó el tratado de defensa con Australia que pone límites a la influencia de China","https://encrypted-tbn0.gstatic.com/images?q=tbn:ANd9GcQaAsznbIQF2lSRP5pG_nQJL7PI369u0dGJIXmbcFI1yt9Es5KKDTt3vGnIKQ&amp;s","El gabinete de Papua Nueva Guinea aprobó un tratado de defensa con Australia, que tiene como objetivo limitar la influencia de China en la región. Este acuerdo permitirá una mayor cooperación militar entre ambos países y facilitará la presencia de fuerzas australianas en territorio papú. La decisión se enmarca en un contexto geopolítico en el que Australia busca fortalecer su seguridad y contrarrestar el creciente poder de Pekín en el Pacífico. Las autoridades papúes consideran que el acuerdo fortalecerá su soberanía y brindará beneficios de seguridad a largo plazo.","El gabinete de Papua Nueva Guinea aprobó un tratado de defensa con Australia, que tiene como objetivo limitar la influencia de China en la región. Este acuerdo permitirá una mayor cooperación militar entre ambos países y facilitará la presencia de fuerzas australianas en territorio papú. La decisión se enmarca en un contexto geopolítico en el que Australia busca fortalecer su seguridad y contrarrestar el creciente poder de Pekín en el Pacífico. Las autoridades papúes consideran que el acuerdo fortalecerá su soberanía y brindará beneficios de seguridad a largo plazo.",""
"10/02/2025 18:00:09","https://infobae.com/deportes/2025/09/30/fracturas-declaraciones-cruzadas-y-polemica-las-secuelas-que-dejo-la-batalla-campal-durante-una-pelea-de-boxeo-en-brasil/","Fracturas, declaraciones cruzadas y polémica: las secuelas que dejó la batalla campal durante una pelea de boxeo en Brasil","Fracturas y polémica tras la batalla campal en una pelea de boxeo en Brasil","https://encrypted-tbn0.gstatic.com/images?q=tbn:ANd9GcQBV-DGt9wmaqmtHWTey2IneXxYwd16POAKB-Bs9n4SVPtoKBYtgJAvkjSl5-4&amp;s","En Brasil, una pelea de boxeo terminó en una violenta confrontación entre los asistentes, lo que derivó en una batalla campal en el recinto. El incidente ocasionó múltiples fracturas y lesiones entre los involucrados. Alexander Zócalo, un boxeador que participó en el evento, declaró sobre los hechos, generando controversia sobre el manejo de la situación por parte de los organizadores. Policías tuvieron que intervenir para controlar el desorden. Este episodio ha suscitado un intenso debate sobre la seguridad en eventos deportivos y la responsabilidad de los promotores. La noticia destaca las consecuencias de la violencia en el deporte y las repercusiones sociales que pueden tener situaciones similares.","En Brasil, una pelea de boxeo terminó en una violenta confrontación entre los asistentes, lo que derivó en una batalla campal en el recinto. El incidente ocasionó múltiples fracturas y lesiones entre los involucrados. Alexander Zócalo, un boxeador que participó en el evento, declaró sobre los hechos, generando controversia sobre el manejo de la situación por parte de los organizadores. Policías tuvieron que intervenir para controlar el desorden. Este episodio ha suscitado un intenso debate sobre la seguridad en eventos deportivos y la responsabilidad de los promotores. La noticia destaca las consecuencias de la violencia en el deporte y las repercusiones sociales que pueden tener situaciones similares.",""
"10/02/2025 18:00:09","https://infobae.com/estados-unidos/2025/10/02/eeuu-desplegara-agentes-migratorios-durante-la-actuacion-de-bad-bunny-en-el-super-bowl-2026/","EEUU desplegará agentes migratorios durante la actuación de Bad Bunny en el Super Bowl 2026","Estados Unidos desplegará agentes migratorios durante la actuación de Bad Bunny en el Super Bowl 2026","https://encrypted-tbn0.gstatic.com/images?q=tbn:ANd9GcSAq4dGuX9cVy-PquCSjVlmldf3M_mQzJM2DPU3ghT2oo0h-GsDo59a7z2osic&amp;s","Estados Unidos planea desplegar agentes migratorios durante la actuación de Bad Bunny en el Super Bowl 2026. Este anuncio refleja una medida del gobierno para abordar la situación migratoria, especialmente en un evento de gran trascendencia. Las autoridades han señalado que su objetivo es asegurar el cumplimiento de las leyes migratorias. El despliegue se considera necesario debido al alto perfil del evento, que atrae a una gran audiencia y podría presentar desafíos en términos de seguridad y control migratorio.","Estados Unidos planea desplegar agentes migratorios durante la actuación de Bad Bunny en el Super Bowl 2026. Este anuncio refleja una medida del gobierno para abordar la situación migratoria, especialmente en un evento de gran trascendencia. Las autoridades han señalado que su objetivo es asegurar el cumplimiento de las leyes migratorias. El despliegue se considera necesario debido al alto perfil del evento, que atrae a una gran audiencia y podría presentar desafíos en términos de seguridad y control migratorio.",""
"10/02/2025 18:00:09","https://infobae.com/deportes/2025/10/02/la-fifa-presentara-el-balon-oficial-del-mundial-2026-todas-las-pelotas-que-se-usaron-y-su-impactante-evolucion-desde-1930/","La FIFA presentará el balón oficial del Mundial 2026: la evolución de las pelotas utilizadas en el torneo","La FIFA presentará el balón oficial del Mundial 2026 y su evolución desde 1930","https://encrypted-tbn0.gstatic.com/images?q=tbn:ANd9GcS-9GUDiFBQsP83MWk-0L7WqMODIOJsEWBQFJBGM9RwMaFuANEPW4ebmcGzgw&amp;s","La FIFA está por presentar el balón oficial para el Mundial 2026, continuando una tradición que data desde el primer torneo en 1930. A lo largo de la historia, los balones han evolucionado en diseño y tecnología. En esta presentación, se destacará cómo cada balón ha reflejado los avances técnicos y estéticos en el deporte. La noticia también ofrece un repaso de los distintos balones utilizados en cada Copa del Mundo y cómo su desarrollo ha influido en el juego.","La FIFA está por presentar el balón oficial para el Mundial 2026, continuando una tradición que data desde el primer torneo en 1930. A lo largo de la historia, los balones han evolucionado en diseño y tecnología. En esta presentación, se destacará cómo cada balón ha reflejado los avances técnicos y estéticos en el deporte. La noticia también ofrece un repaso de los distintos balones utilizados en cada Copa del Mundo y cómo su desarrollo ha influido en el juego.",""
"10/02/2025 18:00:09","https://infobae.com/venezuela/2025/10/02/maduro-inauguro-la-navidad-lanzando-fuegos-artificiales-desde-el-helicoide-el-principal-centro-de-torturas-de-venezuela/","Maduro inauguró la Navidad lanzando fuegos artificiales desde El Helicoide, el principal centro de torturas de Venezuela","","https://encrypted-tbn0.gstatic.com/images?q=tbn:ANd9GcRh6aYW8k1lDyKAQsYjswo21X1GbgE4D7g5XkksLnswbg3cdlb_d1liY5BfmA&amp;s","Nicolás Maduro celebró el inicio de la temporada navideña en Venezuela con un evento que incluyó un espectáculo de fuegos artificiales desde El Helicoide, un edificio conocido por ser un centro de detención y torturas del régimen venezolano. La ocasión fue utilizada por el mandatario para exhibir un mensaje de optimismo a pesar de la grave crisis económica y social que atraviesa el país. Este evento generó controversia dada la reputación del lugar y las condiciones en las que viven muchos ciudadanos venezolanos.","Nicolás Maduro celebró el inicio de la temporada navideña en Venezuela con un evento que incluyó un espectáculo de fuegos artificiales desde El Helicoide, un edificio conocido por ser un centro de detención y torturas del régimen venezolano. La ocasión fue utilizada por el mandatario para exhibir un mensaje de optimismo a pesar de la grave crisis económica y social que atraviesa el país. Este evento generó controversia dada la reputación del lugar y las condiciones en las que viven muchos ciudadanos venezolanos.",""
"10/02/2025 18:00:09","https://infobae.com/america/mundo/2025/10/02/rescatistas-en-indonesia-descartaron-hallar-con-vida-a-los-casi-60-desaparecidos-bajo-la-escuela-colapsada-en-java/","Rescatistas en Indonesia descartaron hallar con vida a los casi 60 desaparecidos bajo la escuela colapsada en Java","Rescatistas en Indonesia descartan hallar con vida a los casi 60 desaparecidos bajo la escuela colapsada en Java","https://encrypted-tbn0.gstatic.com/images?q=tbn:ANd9GcSqPTrsDZ5cZDZgcup-ohZzZKdZGjUPI5H8sBMUZ6pG2TAdk1mN-k2kP3IeGw&amp;s","Los rescatistas en Indonesia han dejado de buscar sobrevivientes entre los desaparecidos tras el colapso de una escuela en Java, donde se estima que casi 60 personas se encuentran bajo los escombros. Las autoridades han señalado que las posibilidades de encontrar a alguien con vida son extremadamente bajas debido al tiempo transcurrido desde el incidente. Las operaciones de rescate se han enfrentado a obstáculos, incluyendo la inestabilidad del terreno y el riesgo de más derrumbes. La tragedia ha generado preocupación en la comunidad local y ha llevado a un llamado a mejorar la seguridad en las infraestructuras escolares.","Los rescatistas en Indonesia han dejado de buscar sobrevivientes entre los desaparecidos tras el colapso de una escuela en Java, donde se estima que casi 60 personas se encuentran bajo los escombros. Las autoridades han señalado que las posibilidades de encontrar a alguien con vida son extremadamente bajas debido al tiempo transcurrido desde el incidente. Las operaciones de rescate se han enfrentado a obstáculos, incluyendo la inestabilidad del terreno y el riesgo de más derrumbes. La tragedia ha generado preocupación en la comunidad local y ha llevado a un llamado a mejorar la seguridad en las infraestructuras escolares.",""
"10/02/2025 18:00:09","https://infobae.com/deportes/2025/10/02/marruecos-vencio-2-1-a-brasil-y-puso-en-riesgo-su-clasificacion-todos-los-goles-de-la-fecha-en-el-mundial-sub-20/","Marruecos venció 2-1 a Brasil y puso en riesgo su clasificación: todos los goles de la fecha en el Mundial Sub 20","Marruecos venció 2-1 a Brasil y puso en riesgo su clasificación","https://encrypted-tbn0.gstatic.com/images?q=tbn:ANd9GcTxMLEEvZTgXNUpCWWTLfKCpa6qeB15tfERl6chjlyyKQEnBAX2owjlRpRXqw&amp;s","En un partido disputado en la Copa Mundial Sub-20, Marruecos consiguió una victoria significativa al vencer a Brasil 2-1. Con este resultado, Marruecos complicó la clasificación del equipo brasileño en el torneo. En el encuentro, los goles de Marruecos fueron determinantes para instancias futuras en la competición, mientras que Brasil se enfrenta a la presión de asegurar su pase en los próximos partidos. La victoria marroquí resalta la competitividad del torneo y el potencial del equipo africano.","En un partido disputado en la Copa Mundial Sub-20, Marruecos consiguió una victoria significativa al vencer a Brasil 2-1. Con este resultado, Marruecos complicó la clasificación del equipo brasileño en el torneo. En el encuentro, los goles de Marruecos fueron determinantes para instancias futuras en la competición, mientras que Brasil se enfrenta a la presión de asegurar su pase en los próximos partidos. La victoria marroquí resalta la competitividad del torneo y el potencial del equipo africano.",""
"10/02/2025 18:00:09","https://infobae.com/america/mundo/2025/10/02/el-g7-y-la-ue-celebraron-el-restablecimiento-de-sanciones-de-la-onu-contra-iran-por-su-programa-nuclear/","El G7 y la UE celebraron el restablecimiento de sanciones de la ONU contra Irán por su programa nuclear","G7 y UE celebran restablecimiento de sanciones de la ONU contra Irán por su programa nuclear","https://encrypted-tbn0.gstatic.com/images?q=tbn:ANd9GcTxIO-b8VHCOcTB-yIANRCBo03EnMzZ82DzHFGEWbRrqg5aINsgdkyOosj3LA&amp;s","El G7 y la Unión Europea celebraron la reinstauración de las sanciones de la ONU contra Irán debido a su programa nuclear. Este restablecimiento busca presionar al país para que cumpla con los acuerdos internacionales y frene su desarrollo nuclear. Las potencias occidentales expresaron su preocupación por las acciones de Irán y subrayaron la importancia de mantener una postura firme en el esfuerzo por la estabilidad en la región. La medida refleja un intento de unir a la comunidad internacional contra las amenazas nucleares.","El G7 y la Unión Europea celebraron la reinstauración de las sanciones de la ONU contra Irán debido a su programa nuclear. Este restablecimiento busca presionar al país para que cumpla con los acuerdos internacionales y frene su desarrollo nuclear. Las potencias occidentales expresaron su preocupación por las acciones de Irán y subrayaron la importancia de mantener una postura firme en el esfuerzo por la estabilidad en la región. La medida refleja un intento de unir a la comunidad internacional contra las amenazas nucleares.",""
"10/02/2025 18:00:09","https://infobae.com/america/america-latina/2025/10/02/la-onu-cifro-en-16000-los-muertos-por-la-violencia-de-las-bandas-en-haiti-desde-2022/","La ONU cifró en 16.000 los muertos por la violencia de las bandas en Haití desde 2022","ONU cifra en 16000 los muertos por la violencia de las bandas en Haití desde 2022","https://encrypted-tbn0.gstatic.com/images?q=tbn:ANd9GcSqEgwBQloyMh-S-dAYC3EzuCGYy_iavrZs5RwdltQCvWgTKR5ZgSFiT9D9sA&amp;s","La ONU reportó que desde 2022, la violencia de las bandas en Haití ha causado alrededor de 16,000 muertes. La situación ha generado un grave deterioro en la seguridad y ha llevado a una crisis humanitaria en el país. Las bandas armadas han tomado el control de grandes partes de la capital, Puerto Príncipe, enfrentándose entre sí y afectando a la población civil. La ONU ha pedido una intervención internacional para ayudar a restaurar el orden y proporcionar asistencia humanitaria a quienes la necesitan.","La ONU reportó que desde 2022, la violencia de las bandas en Haití ha causado alrededor de 16,000 muertes. La situación ha generado un grave deterioro en la seguridad y ha llevado a una crisis humanitaria en el país. Las bandas armadas han tomado el control de grandes partes de la capital, Puerto Príncipe, enfrentándose entre sí y afectando a la población civil. La ONU ha pedido una intervención internacional para ayudar a restaurar el orden y proporcionar asistencia humanitaria a quienes la necesitan.",""
"10/02/2025 18:00:09","https://infobae.com/america/america-latina/2025/10/02/estados-unidos-confirmo-que-le-nego-visas-a-funcionarios-del-regimen-cubano-por-razones-de-seguridad-nacional/","EEUU confirmó que le negó visas a funcionarios del régimen cubano por razones de seguridad nacional","Estados Unidos negó visas a funcionarios del régimen cubano por razones de seguridad nacional","https://encrypted-tbn0.gstatic.com/images?q=tbn:ANd9GcQ4j2pTonSMLGd7vpGt9uGMP1tBQ5bW5YHgGvPkWJcjPxjS7FbzZ1Ex2yI4Sik&amp;s","Estados Unidos ha confirmado que ha denegado visas a funcionarios del régimen cubano, citando razones de seguridad nacional. Esta decisión se enmarca en la política estadounidense hacia Cuba y refleja preocupaciones sobre la conducta de algunos funcionarios del gobierno cubano. La medida se produce en un contexto de tensiones entre ambos países, donde la administración estadounidense busca mantener una postura firme frente a acciones que considera perjudiciales para la seguridad regional.","Estados Unidos ha confirmado que ha denegado visas a funcionarios del régimen cubano, citando razones de seguridad nacional. Esta decisión se enmarca en la política estadounidense hacia Cuba y refleja preocupaciones sobre la conducta de algunos funcionarios del gobierno cubano. La medida se produce en un contexto de tensiones entre ambos países, donde la administración estadounidense busca mantener una postura firme frente a acciones que considera perjudiciales para la seguridad regional.",""
"10/02/2025 18:00:09","https://infobae.com/america/america-latina/2025/10/01/freddy-superlano-lleva-14-meses-detenido-y-en-aislamiento-oposicion-denuncia-secuestro-politico-en-venezuela/","Freddy Superlano lleva 14 meses detenido y en aislamiento: oposición denuncia secuestro político en Venezuela","Freddy Superlano lleva 14 meses detenido y en aislamiento, oposición denuncia secuestro político en Venezuela","https://encrypted-tbn0.gstatic.com/images?q=tbn:ANd9GcQS9naoeprwUq2k7h9ZTtBip27_7d9g4Q8L9nKzxZTd6Jh5DxQPTZusoRLa6gs&amp;s","Freddy Superlano, opositor venezolano, lleva 14 meses detenido y en condiciones de aislamiento. La oposición y organizaciones de derechos humanos han denunciado este hecho como un caso de secuestro político por parte del gobierno de Nicolás Maduro. Superlano fue capturado el 22 de julio de 2022 y, según informes, su situación ha sido caracterizada por la falta de atención médica adecuada y el incumplimiento de los procesos legales correspondientes. La comunidad internacional continúa expresando preocupación por la violación a los derechos humanos en Venezuela.","Freddy Superlano, opositor venezolano, lleva 14 meses detenido y en condiciones de aislamiento. La oposición y organizaciones de derechos humanos han denunciado este hecho como un caso de secuestro político por parte del gobierno de Nicolás Maduro. Superlano fue capturado el 22 de julio de 2022 y, según informes, su situación ha sido caracterizada por la falta de atención médica adecuada y el incumplimiento de los procesos legales correspondientes. La comunidad internacional continúa expresando preocupación por la violación a los derechos humanos en Venezuela.",""
"10/02/2025 18:00:09","https://infobae.com/america/mundo/2025/09/30/el-escandalo-de-espionaje-que-sacude-a-la-extrema-derecha-alemana-condenaron-al-ex-asesor-de-un-eurodiputado-de-afd-por-espiar-para-china/","El escándalo de espionaje que sacude a la extrema derecha alemana: condenaron al ex asesor de un eurodiputado de Afd por espiar para China","Escándalo de espionaje sacude a la extrema derecha alemana por condena a ex asesor de eurodiputado de AfD por espiar para China","https://encrypted-tbn0.gstatic.com/images?q=tbn:ANd9GcTgeLJKq6uAsjPOuHV9sWKum2Uw6XcdEelFnAkNOuyZ9KIjg4PmlRusoxzwLA&amp;s","Un exasesor del eurodiputado de la Alternativa para Alemania (AfD) ha sido condenado por espionaje en favor de China. La sentencia se produce en medio de un escándalo que ha exacerbadado las tensiones dentro de la extrema derecha alemana. La investigación reveló que el exasesor había estado recopilando información relevante para los intereses chinos, lo que ha generado preocupaciones sobre la influencia extranjera en la política alemana. Este caso ha llevado a cuestionar la integridad y la conducta de algunos miembros del AfD, que ya se enfrentan a diversas acusaciones relacionadas con sus vínculos y posturas políticas.","Un exasesor del eurodiputado de la Alternativa para Alemania (AfD) ha sido condenado por espionaje en favor de China. La sentencia se produce en medio de un escándalo que ha exacerbadado las tensiones dentro de la extrema derecha alemana. La investigación reveló que el exasesor había estado recopilando información relevante para los intereses chinos, lo que ha generado preocupaciones sobre la influencia extranjera en la política alemana. Este caso ha llevado a cuestionar la integridad y la conducta de algunos miembros del AfD, que ya se enfrentan a diversas acusaciones relacionadas con sus vínculos y posturas políticas.",""
"10/02/2025 18:00:09","https://infobae.com/america/mundo/2025/09/29/el-vicepresidente-vance-confirmo-que-estados-unidos-evalua-enviar-misiles-de-largo-alcance-tomahawk-a-ucrania/","El vicepresidente Vance confirmó que Estados Unidos evalúa enviar misiles de largo alcance Tomahawk a Ucrania","Estados Unidos evalúa enviar misiles de largo alcance Tomahawk a Ucrania","https://encrypted-tbn0.gstatic.com/images?q=tbn:ANd9GcQHm9fdgOdl_8TeX4Xb3A0hB3UNkQ0-Wvfwx6F2sFLVWXV3-k9JCz1O9mHz-Q&amp;s","El vicepresidente de Estados Unidos, Kamala Harris, anunció que el país está evaluando la posibilidad de enviar misiles de largo alcance Tomahawk a Ucrania. Esta medida surge en el contexto del apoyo militar continuo de EE. UU. a Ucrania en su enfrentamiento con las fuerzas rusas. Harris destacó la importancia de fortalecer la capacidad de defensa de Ucrania y reafirmó el compromiso de Estados Unidos con la soberanía y la integridad territorial del país europeo.","El vicepresidente de Estados Unidos, Kamala Harris, anunció que el país está evaluando la posibilidad de enviar misiles de largo alcance Tomahawk a Ucrania. Esta medida surge en el contexto del apoyo militar continuo de EE. UU. a Ucrania en su enfrentamiento con las fuerzas rusas. Harris destacó la importancia de fortalecer la capacidad de defensa de Ucrania y reafirmó el compromiso de Estados Unidos con la soberanía y la integridad territorial del país europeo.",""
"10/02/2025 18:00:09","https://infobae.com/estados-unidos/2025/10/01/cierre-del-gobierno-de-eeuu-el-conflicto-politico-que-paralizo-el-aparato-federal-y-amenaza-con-profundizar-la-crisis/","Cierre del gobierno en EEUU: el conflicto político que paralizó el aparato federal y amenaza con profundizar la crisis","Cierre del gobierno de EE.UU. conflicto político paraliza el aparato federal y profundiza la crisis","https://encrypted-tbn0.gstatic.com/images?q=tbn:ANd9GcRefCluDWuvLB6LuJ-Qo-W8_QpAJvRAmvkHXMhI4ZNsI4vc22bHLfJI7ihUWSc&amp;s","El cierre del gobierno de Estados Unidos ha generado un estancamiento en el funcionamiento de numerosas agencias federales. Este acontecimiento es consecuencia de un desacuerdo político profundo que ha surgido entre los partidos, lo que ha llevado a la paralización de servicios públicos y la suspensión de actividades no esenciales. El conflicto político refleja tensiones en torno al presupuesto y las prioridades fiscales, lo que a su vez agrava la crisis económica y social en el país. Las repercusiones del cierre se sienten especialmente en servicios estatales y funciones gubernamentales críticas, creando incertidumbre para millones de ciudadanos.","El cierre del gobierno de Estados Unidos ha generado un estancamiento en el funcionamiento de numerosas agencias federales. Este acontecimiento es consecuencia de un desacuerdo político profundo que ha surgido entre los partidos, lo que ha llevado a la paralización de servicios públicos y la suspensión de actividades no esenciales. El conflicto político refleja tensiones en torno al presupuesto y las prioridades fiscales, lo que a su vez agrava la crisis económica y social en el país. Las repercusiones del cierre se sienten especialmente en servicios estatales y funciones gubernamentales críticas, creando incertidumbre para millones de ciudadanos.",""
"10/02/2025 18:00:09","https://infobae.com/venezuela/2025/10/02/las-imagenes-de-la-fiesta-decretada-por-maduro-a-dos-meses-de-fin-de-ano-venezuela-huele-a-navidad/","Las imágenes de la fiesta decretada por Maduro a dos meses de fin de año: “Venezuela huele a Navidad”","Fiesta decretada por Maduro anticipa la llegada de la Navidad en Venezuela","https://encrypted-tbn0.gstatic.com/images?q=tbn:ANd9GcTvHqFVP8v_l5PS-rRpN4lkVWYwOTlXoJQ4sTSGSYFgKjX8ec5eRp7AXtbsVg&amp;s","El presidente Nicolás Maduro declaró oficialmente una fiesta navideña en Venezuela, a solo dos meses de la celebración de diciembre. Dicho anuncio incluye actividades culturales y eventos festivos en todo el país, con el objetivo de elevar el ánimo de la población y fomentar la unidad entre los ciudadanos. A pesar de la difícil situación económica y social que enfrenta Venezuela, el gobierno busca promover el espíritu navideño como parte de su estrategia para conectar con la ciudadanía. Las festividades estarán marcadas por la música, el baile y la gastronomía típica de la temporada.","El presidente Nicolás Maduro declaró oficialmente una fiesta navideña en Venezuela, a solo dos meses de la celebración de diciembre. Dicho anuncio incluye actividades culturales y eventos festivos en todo el país, con el objetivo de elevar el ánimo de la población y fomentar la unidad entre los ciudadanos. A pesar de la difícil situación económica y social que enfrenta Venezuela, el gobierno busca promover el espíritu navideño como parte de su estrategia para conectar con la ciudadanía. Las festividades estarán marcadas por la música, el baile y la gastronomía típica de la temporada.",""
