"FechayHora","LinkOrigen","TituloOrigen","Titulo","Imagen","Intro","Noticia","Datos"
"09/23/2025 21:00:19","https://infobae.com/salud/2025/09/23/cansancio-cronico-senales-para-detectar-si-se-debe-a-la-falta-de-nutrientes-clave/","Cansancio crónico: señales para detectar si se debe a la falta de nutrientes clave","Cansancio crónico señales para detectar si se debe a la falta de nutrientes clave","https://encrypted-tbn0.gstatic.com/images?q=tbn:ANd9GcQgDyj3noAxiCJJOnC6dMjNC_6kgE0thFkV3HSWmis6GhLjnRoZWhIYcm_KnoI&amp;s","La noticia aborda el tema del cansancio crónico y su posible relación con deficiencias nutricionales. Se destaca que la falta de ciertos nutrientes esenciales, como hierro, vitamina D y vitamina B12, puede provocar síntomas de agotamiento extremo y fatiga persistente. Los expertos aconsejan prestar atención a varios signos que podrían indicar la necesidad de una evaluación nutricional y sugieren que realizar pruebas puede ser fundamental para identificar deficiencias. Además, se menciona la importancia de mantener una dieta equilibrada para evitar estos problemas y mejorar la energía general del organismo.","La noticia aborda el tema del cansancio crónico y su posible relación con deficiencias nutricionales. Se destaca que la falta de ciertos nutrientes esenciales, como hierro, vitamina D y vitamina B12, puede provocar síntomas de agotamiento extremo y fatiga persistente. Los expertos aconsejan prestar atención a varios signos que podrían indicar la necesidad de una evaluación nutricional y sugieren que realizar pruebas puede ser fundamental para identificar deficiencias. Además, se menciona la importancia de mantener una dieta equilibrada para evitar estos problemas y mejorar la energía general del organismo.",""
"09/23/2025 21:00:19","https://infobae.com/america/mundo/2025/09/23/por-que-dinamarca-no-derribo-los-drones-que-obligaron-a-cerrar-su-aeropuerto-y-desvio-a-decenas-de-aviones/","Por qué Dinamarca no derribó los drones que obligaron a desviar a los aviones y cerrar el aeropuerto","Dinamarca no derribó los drones que obligaron a cerrar su aeropuerto y desvió a decenas de aviones","https://encrypted-tbn0.gstatic.com/images?q=tbn:ANd9GcRHBeXHaW1tXZX7EzKQcGBPgY7hskEcqAfeSe5zioKnZ5oV9fM47ukq8TVWJbU&amp;s","Un grupo de drones provocó el cierre temporal del aeropuerto de Copenhague y forzó el desvío de varios vuelos. A pesar de la interrupción en la operación aérea, las autoridades danesas decidieron no derribar los drones debido a la dificultad para identificarlos y la posibilidad de un accidente. El evento generó debate sobre la seguridad en el espacio aéreo y la necesidad de mejorar las medidas contra el uso no autorizado de drones. Las fuerzas de seguridad continúan investigando la situación y recomiendan precaución ante posibles incidentes similares en el futuro.","Un grupo de drones provocó el cierre temporal del aeropuerto de Copenhague y forzó el desvío de varios vuelos. A pesar de la interrupción en la operación aérea, las autoridades danesas decidieron no derribar los drones debido a la dificultad para identificarlos y la posibilidad de un accidente. El evento generó debate sobre la seguridad en el espacio aéreo y la necesidad de mejorar las medidas contra el uso no autorizado de drones. Las fuerzas de seguridad continúan investigando la situación y recomiendan precaución ante posibles incidentes similares en el futuro.",""
"09/23/2025 21:00:19","https://infobae.com/america/mundo/2025/09/23/ryan-routh-intento-apunalarse-con-un-boligrafo-tras-ser-hallado-culpable-de-planear-el-asesinato-de-trump-en-2024/","Ryan Routh intentó apuñalarse con un bolígrafo tras ser hallado culpable de planear el asesinato de Trump en 2024","","https://encrypted-tbn0.gstatic.com/images?q=tbn:ANd9GcTQRCOq9w2Wy-5MtkJwrCHbGq1ydMsdYgy7OLqzLAHLjX2d0Ae-OK4ud76mMDQ&amp;s","Ryan Routh fue declarado culpable de planear el asesinato del expresidente Donald Trump durante la campaña presidencial de 2024. Tras conocer el veredicto, Routh intentó autolesionarse utilizando un bolígrafo en la sala del tribunal. Su conducta alarmó a los presentes y fue rápidamente controlado por las autoridades judiciales. Routh enfrenta una posible sentencia de más de 10 años de prisión debido a la gravedad de los cargos en su contra.","Ryan Routh fue declarado culpable de planear el asesinato del expresidente Donald Trump durante la campaña presidencial de 2024. Tras conocer el veredicto, Routh intentó autolesionarse utilizando un bolígrafo en la sala del tribunal. Su conducta alarmó a los presentes y fue rápidamente controlado por las autoridades judiciales. Routh enfrenta una posible sentencia de más de 10 años de prisión debido a la gravedad de los cargos en su contra.",""
"09/23/2025 21:00:19","https://infobae.com/venezuela/2025/09/22/la-ue-y-los-paises-latinoamericanos-condenaron-la-represion-exacerbada-en-venezuela-tras-el-informe-de-la-onu/","La UE y los países latinoamericanos condenaron la “represión exacerbada” en Venezuela tras el informe de la ONU","UE y países latinoamericanos condenan la represión exacerbada en Venezuela tras informe de la ONU","https://encrypted-tbn0.gstatic.com/images?q=tbn:ANd9GcRvNyvjGuopqz283Fo8oz2h2hz2q0wupqrwyLYj7TjuzOhLHRb8fLLLyOkU9w&amp;s","La Unión Europea y varios países de América Latina han expresado su rechazo a la represión intensificada en Venezuela, en respuesta a un informe reciente de la ONU que documenta violaciones de derechos humanos en el país. Las naciones condenaron las acciones del gobierno venezolano y pidieron un cese inmediato de la represión y el respeto al estado de derecho, además de exigir la liberación de presos políticos. La comunidad internacional menciona que estas violaciones no pueden quedar impunes y reafirma la necesidad de un diálogo inclusivo para abordar la crisis en Venezuela.","La Unión Europea y varios países de América Latina han expresado su rechazo a la represión intensificada en Venezuela, en respuesta a un informe reciente de la ONU que documenta violaciones de derechos humanos en el país. Las naciones condenaron las acciones del gobierno venezolano y pidieron un cese inmediato de la represión y el respeto al estado de derecho, además de exigir la liberación de presos políticos. La comunidad internacional menciona que estas violaciones no pueden quedar impunes y reafirma la necesidad de un diálogo inclusivo para abordar la crisis en Venezuela.",""
"09/23/2025 21:00:19","https://infobae.com/america/mundo/2025/09/23/quienes-hablaran-en-la-asamblea-general-de-la-onu-y-cuales-seran-los-temas-clave-del-foro-global/","Quiénes hablarán en la Asamblea General de la ONU y cuáles serán los temas clave del foro global","Asamblea General de la ONU: Oradores y Temas Clave en el Foro Global","https://encrypted-tbn0.gstatic.com/images?q=tbn:ANd9GcRx_KZjpgkxP2VkMZ8DZg3Ubp52Ask4RS2i1_cXFV8KCh5IzwvROJSVLfwFPgg&amp;s","En la Asamblea General de la ONU, que se llevará a cabo en Nueva York, se espera la participación de varios líderes mundiales que abordarán temas cruciales como el desarrollo sostenible, la paz y la seguridad, así como la lucha contra el cambio climático. Durante el evento, se discutirán los avances y desafíos en estos ámbitos, con un enfoque especial en la implementación de los Objetivos de Desarrollo Sostenible y la promoción de una recuperación inclusiva tras la pandemia. La reunión también servirá como plataforma para que los países presenten sus propuestas y compromisos en materia de gobernanza global y cooperación internacional.","En la Asamblea General de la ONU, que se llevará a cabo en Nueva York, se espera la participación de varios líderes mundiales que abordarán temas cruciales como el desarrollo sostenible, la paz y la seguridad, así como la lucha contra el cambio climático. Durante el evento, se discutirán los avances y desafíos en estos ámbitos, con un enfoque especial en la implementación de los Objetivos de Desarrollo Sostenible y la promoción de una recuperación inclusiva tras la pandemia. La reunión también servirá como plataforma para que los países presenten sus propuestas y compromisos en materia de gobernanza global y cooperación internacional.",""
"09/23/2025 21:00:19","https://infobae.com/historias/2025/09/22/un-disparo-fallido-y-una-contadora-que-fue-informante-del-fbi-pense-que-matar-al-presidente-podia-desencadenar-una-revolucion/","Un disparo fallido y una contadora que fue informante del FBI: “Pensé que matar al presidente podía desencadenar una revolución”","Un disparo fallido y una contadora informante del FBI en un intento de derrocar al presidente","https://encrypted-tbn0.gstatic.com/images?q=tbn:ANd9GcTUubF69NM2IF9U1SwPI76mGwrKFdXNxNT98ez1ox_Pt6lu9797CyOb45-_pSA&amp;s","Una contadora que actuó como informante del FBI relata su experiencia tras un intento fallido de asesinato del presidente. En su declaración, menciona que había considerado que un acto tan radical podría provocar un levantamiento popular. A lo largo de su relato, describe el contexto en el que se produjeron estos incidentes y las emociones que la impulsaron a involucrarse en tales acciones. La noticia destaca su papel como informante y las repercusiones de sus decisiones en la sociedad y en su vida personal.","Una contadora que actuó como informante del FBI relata su experiencia tras un intento fallido de asesinato del presidente. En su declaración, menciona que había considerado que un acto tan radical podría provocar un levantamiento popular. A lo largo de su relato, describe el contexto en el que se produjeron estos incidentes y las emociones que la impulsaron a involucrarse en tales acciones. La noticia destaca su papel como informante y las repercusiones de sus decisiones en la sociedad y en su vida personal.",""
"09/23/2025 21:00:19","https://infobae.com/estados-unidos/2025/09/23/bill-gates-revelo-como-la-inteligencia-artificial-cambiara-el-futuro-de-la-salud-en-las-regiones-mas-vulnerables/","Bill Gates reveló cómo la IA cambiará el futuro de la salud en las regiones más vulnerables","Bill Gates revela cómo la inteligencia artificial cambiará el futuro de la salud en las regiones más vulnerables","https://encrypted-tbn0.gstatic.com/images?q=tbn:ANd9GcSnjoMWLMfBvtgWY9p39oibH926vEhH7teZly5gYm_JHWIZ3paqaF6TvRxvR5E&amp;s","Bill Gates expuso su visión sobre el impacto de la inteligencia artificial en el ámbito de la salud, especialmente en las áreas más vulnerables del mundo. Durante su intervención, enfatizó cómo esta tecnología puede mejorar el acceso a servicios médicos, optimizar diagnósticos y tratamientos, y fomentar la investigación en enfermedades desatendidas. Gates subrayó que, si se implementa adecuadamente, la inteligencia artificial puede transformar significativamente la atención sanitaria en comunidades que históricamente han enfrentado dificultades para acceder a los cuidados necesarios.","Bill Gates expuso su visión sobre el impacto de la inteligencia artificial en el ámbito de la salud, especialmente en las áreas más vulnerables del mundo. Durante su intervención, enfatizó cómo esta tecnología puede mejorar el acceso a servicios médicos, optimizar diagnósticos y tratamientos, y fomentar la investigación en enfermedades desatendidas. Gates subrayó que, si se implementa adecuadamente, la inteligencia artificial puede transformar significativamente la atención sanitaria en comunidades que históricamente han enfrentado dificultades para acceder a los cuidados necesarios.",""
"09/23/2025 21:00:19","https://infobae.com/deportes/2025/09/22/una-figura-de-la-formula-1-revelo-que-estuvo-al-limite-y-analizo-no-correr-el-gp-de-azerbaiyan-por-una-enfermedad/","Una figura de la Fórmula 1 reveló que “estuvo al límite” y analizó no correr el GP de Azerbaiyán por una enfermedad","Una figura de la Fórmula 1 reveló que estuvo al límite y analizó no correr el GP de Azerbaiyán por una enfermedad","https://encrypted-tbn0.gstatic.com/images?q=tbn:ANd9GcSuXnKdIjww0Dj8AL6Y1gUvGU4EwRmShnGh_nW4BIlV_TjS2ezsNtUTyhjLMA&amp;s","Una figura destacada de la Fórmula 1 compartió su experiencia cercana a no participar en el Gran Premio de Azerbaiyán debido a problemas de salud. La situación llegó al límite, lo que generó preocupaciones sobre su bienestar y la posibilidad de no correr. El piloto analizó los retos que enfrentó y la importancia de cuidar su salud en un deporte de alta exigencia. A pesar de las dificultades, se mostró decidido a seguir compitiendo en futuras carreras.","Una figura destacada de la Fórmula 1 compartió su experiencia cercana a no participar en el Gran Premio de Azerbaiyán debido a problemas de salud. La situación llegó al límite, lo que generó preocupaciones sobre su bienestar y la posibilidad de no correr. El piloto analizó los retos que enfrentó y la importancia de cuidar su salud en un deporte de alta exigencia. A pesar de las dificultades, se mostró decidido a seguir compitiendo en futuras carreras.",""
"09/23/2025 21:00:19","https://infobae.com/america/mundo/2025/09/23/eeuu-japon-y-corea-del-sur-advirtieron-sobre-las-acciones-desestabilizadoras-del-regimen-chino-alrededor-de-taiwan/","EEUU, Japón y Corea del Sur advirtieron que China realiza acciones desestabilizadoras alrededor de Taiwán","Estados Unidos, Japón y Corea del Sur advierten sobre las acciones desestabilizadoras del régimen chino alrededor de Taiwán","https://encrypted-tbn0.gstatic.com/images?q=tbn:ANd9GcQR0-kgGOvnrSMO0B-PhTiG8WKPohUvqWsJ6xezbSSHZpJ0gRBITwanypVGZLQ&amp;s","Estados Unidos, Japón y Corea del Sur expresaron su preocupación por las acciones desestabilizadoras del régimen chino en torno a Taiwán. Los líderes de estos tres países se reunieron para discutir la creciente tensión en la región y reafirmaron su compromiso con la paz y la estabilidad en el área del Indo-Pacífico. Además, enfatizaron la importancia de mantener un enfoque conjunto para enfrentar los desafíos que plantea China, especialmente en el contexto de sus actividades militares y políticas en Taiwán. Esta declaración subraya la cooperación entre las naciones para contrarrestar cualquier intento de alterar el equilibrio de fuerzas en la región.","Estados Unidos, Japón y Corea del Sur expresaron su preocupación por las acciones desestabilizadoras del régimen chino en torno a Taiwán. Los líderes de estos tres países se reunieron para discutir la creciente tensión en la región y reafirmaron su compromiso con la paz y la estabilidad en el área del Indo-Pacífico. Además, enfatizaron la importancia de mantener un enfoque conjunto para enfrentar los desafíos que plantea China, especialmente en el contexto de sus actividades militares y políticas en Taiwán. Esta declaración subraya la cooperación entre las naciones para contrarrestar cualquier intento de alterar el equilibrio de fuerzas en la región.",""
"09/23/2025 21:00:19","https://infobae.com/america/mundo/2025/09/23/la-onu-denuncio-la-tortura-sistematica-contra-civiles-ucranianos-detenidos-en-zonas-ocupadas-por-rusia/","La ONU denunció la tortura sistemática contra civiles ucranianos detenidos en zonas ocupadas por Rusia","La ONU denunció la tortura sistemática contra civiles ucranianos detenidos en zonas ocupadas por Rusia","https://encrypted-tbn0.gstatic.com/images?q=tbn:ANd9GcSH0GVn2_IYWYhCQIGtMakPxtdD-eFNP-dp_NYiAWsu8r2ZDAnnjwuAAuKowA&amp;s","","",""
"09/23/2025 21:00:19","https://infobae.com/america/mundo/2025/09/13/trump-exigio-a-los-paises-de-la-otan-dejar-de-comprar-petroleo-ruso-antes-de-que-eeuu-imponga-nuevas-sanciones-a-moscu/","Trump exigió a los países de la OTAN dejar de comprar petróleo ruso antes de que EEUU imponga nuevas sanciones a Moscú","Trump pidió a la OTAN que detenga compras de petróleo ruso antes de nuevas sanciones de EE.UU.","https://encrypted-tbn0.gstatic.com/images?q=tbn:ANd9GcR7JDm3pXonbMveMwPw_Zz8AU7RPeURC1sgm7dMJSqaGDG3Y-Wh8N-4KQnno6g&amp;s","Donald Trump instó a las naciones de la OTAN a cesar la compra de petróleo ruso antes de que Estados Unidos implemente nuevas sanciones contra Moscú. Esta medida busca aumentar la presión sobre Rusia debido a su agresión en Ucrania. La propuesta de Trump se enmarca en un esfuerzo más amplio por parte de Estados Unidos y sus aliados para reducir la dependencia energética de Rusia y al mismo tiempo debilitar su economía.","Donald Trump instó a las naciones de la OTAN a cesar la compra de petróleo ruso antes de que Estados Unidos implemente nuevas sanciones contra Moscú. Esta medida busca aumentar la presión sobre Rusia debido a su agresión en Ucrania. La propuesta de Trump se enmarca en un esfuerzo más amplio por parte de Estados Unidos y sus aliados para reducir la dependencia energética de Rusia y al mismo tiempo debilitar su economía.",""
"09/23/2025 21:00:19","https://infobae.com/america/mundo/2025/09/21/donald-trump-insto-a-afganistan-a-que-devuelva-la-base-aerea-de-bagram-a-estados-unidos/","El régimen talibán desafía a Trump y rechaza un posible acuerdo para devolver la base aérea de Bagram en Afganistán","Donald Trump instó a Afganistán a devolver la base aérea de Bagram a Estados Unidos","https://encrypted-tbn0.gstatic.com/images?q=tbn:ANd9GcSsckG8THhwrhAvAbyXFprb3j2_rbUphe9HWgap3TdMEN5V_7NQugU709JXuw&amp;s","Donald Trump instó a Afganistán a devolver a Estados Unidos el control de la base aérea de Bagram, un lugar estratégico que fue utilizado por las fuerzas estadounidenses antes de su retirada del país. Durante un evento en un mitin, el expresidente argumentó que la base debería ser entregada nuevamente a Estados Unidos, señalando que su recuperación podría ser beneficiosa para el país. Esta afirmación se produce en un contexto donde el enfoque de Trump está en resaltar su administración y la decisión anterior de retirar tropas de Afganistán, la cual fue criticada por varios sectores.","Donald Trump instó a Afganistán a devolver a Estados Unidos el control de la base aérea de Bagram, un lugar estratégico que fue utilizado por las fuerzas estadounidenses antes de su retirada del país. Durante un evento en un mitin, el expresidente argumentó que la base debería ser entregada nuevamente a Estados Unidos, señalando que su recuperación podría ser beneficiosa para el país. Esta afirmación se produce en un contexto donde el enfoque de Trump está en resaltar su administración y la decisión anterior de retirar tropas de Afganistán, la cual fue criticada por varios sectores.",""
"09/23/2025 21:00:19","https://infobae.com/cultura/2025/09/21/un-video-inedito-de-nirvana-en-tijuana-sale-a-la-luz-tras-35-anos-y-sera-subastado/","Un video inédito de Nirvana en Tijuana sale a la luz tras 35 años y será subastado","","https://encrypted-tbn0.gstatic.com/images?q=tbn:ANd9GcSUzBB-asJEbgLTsgBdF0FOB3QKS75GXJkomln8NUuuz-4pbPvYlwaMvCMo6A&amp;s","Un video inédito de Nirvana grabado en 1989 durante un concierto en Tijuana ha salido a la luz después de 35 años y será subastado. La grabación fue realizada por un espectador en el evento, donde la banda desempeñó un papel en la escena musical emergente. La subasta está programada para llevarse a cabo en noviembre y se espera generar un gran interés por parte de coleccionistas y fanáticos de la música. La aparición de esta grabación destaca la importancia histórica de Nirvana en el rock y la cultura musical de su época.","Un video inédito de Nirvana grabado en 1989 durante un concierto en Tijuana ha salido a la luz después de 35 años y será subastado. La grabación fue realizada por un espectador en el evento, donde la banda desempeñó un papel en la escena musical emergente. La subasta está programada para llevarse a cabo en noviembre y se espera generar un gran interés por parte de coleccionistas y fanáticos de la música. La aparición de esta grabación destaca la importancia histórica de Nirvana en el rock y la cultura musical de su época.",""
"09/23/2025 21:00:19","https://infobae.com/estados-unidos/2025/09/20/california-prohibe-que-la-mayor-parte-de-las-fuerzas-de-seguridad-se-cubran-el-rostro-durante-los-operativos/","California prohíbe que la mayor parte de las fuerzas de seguridad se cubran el rostro durante los operativos","California prohíbe que la mayoría de las fuerzas de seguridad se cubran el rostro durante operativos","https://encrypted-tbn0.gstatic.com/images?q=tbn:ANd9GcT0MoFyxXVRxatTK_rIEeAU9vuVWq4KgWv1_2GB4363EoQ-5KfgA5uZT7t38Q&amp;s","California ha implementado una nueva normativa que prohíbe a la mayoría de las fuerzas de seguridad cubrirse el rostro durante las operaciones. Esta medida busca aumentar la transparencia y la rendición de cuentas en la actuación policial. Sin embargo, algunas excepciones se mantienen para situaciones que involucren amenazas inminentes o cuando la protección de la identidad de los agentes sea necesaria. Esta decisión refleja un esfuerzo por mejorar la confianza entre la comunidad y las autoridades.","California ha implementado una nueva normativa que prohíbe a la mayoría de las fuerzas de seguridad cubrirse el rostro durante las operaciones. Esta medida busca aumentar la transparencia y la rendición de cuentas en la actuación policial. Sin embargo, algunas excepciones se mantienen para situaciones que involucren amenazas inminentes o cuando la protección de la identidad de los agentes sea necesaria. Esta decisión refleja un esfuerzo por mejorar la confianza entre la comunidad y las autoridades.",""
"09/23/2025 21:00:19","https://infobae.com/america/america-latina/2025/09/18/la-defensa-de-jeanine-anez-pedira-la-absolucion-tras-el-rechazo-del-supremo-a-su-primera-apelacion/","La defensa de Jeanine Áñez pedirá la absolución tras el rechazo del Supremo a su primera apelación","Defensa de Jeanine Áñez solicitará absolución tras rechazo del Supremo a su apelación","https://encrypted-tbn0.gstatic.com/images?q=tbn:ANd9GcTGscQe624UB30CHd9N7pmu__PyBCgTFdM_Oo0txkiyXoIxE4cQ-3nEZ7nsuw&amp;s","El abogado de Jeanine Áñez, ex presidenta interina de Bolivia, anunció que solicitará su absolución tras el rechazo de la Corte Suprema a su primera apelación. Áñez cumple una condena de diez años por el caso de la ""autoproclamación"" y su defensa argumenta que el juicio fue irregular y careció de garantías. El equipo legal está preparando una nueva apelación que será presentada ante la misma corte. La situación ha generado un debate sobre la judicialización de la política en el país y se han expresado posturas tanto a favor como en contra de la detención de Áñez.","El abogado de Jeanine Áñez, ex presidenta interina de Bolivia, anunció que solicitará su absolución tras el rechazo de la Corte Suprema a su primera apelación. Áñez cumple una condena de diez años por el caso de la ""autoproclamación"" y su defensa argumenta que el juicio fue irregular y careció de garantías. El equipo legal está preparando una nueva apelación que será presentada ante la misma corte. La situación ha generado un debate sobre la judicialización de la política en el país y se han expresado posturas tanto a favor como en contra de la detención de Áñez.",""
"09/23/2025 21:00:19","https://infobae.com/america/mundo/2025/09/22/nvidia-invertira-usd-100000-millones-en-openai-para-desarrollar-centro-de-datos/","Nvidia invertirá USD 100.000 millones en OpenAI para desarrollar centro de datos","Nvidia invertirá 100 mil millones de dólares en OpenAI para desarrollar centro de datos","https://encrypted-tbn0.gstatic.com/images?q=tbn:ANd9GcRumNUBP3muU5qO8D6M3YMiWE_E6gfYpIpGZ3MBeUpZbn9BCY9vfl6yX3TMNAg&amp;s","NVIDIA anunció su intención de invertir 100,000 millones de dólares en OpenAI para el desarrollo de un centro de datos avanzado. Este proyecto busca fortalecer la infraestructura tecnológica necesaria para el avance de la inteligencia artificial. La inversión refleja el creciente interés de NVIDIA en el sector de la IA, así como su compromiso de apoyar a OpenAI en la expansión de sus capacidades y recursos. La colaboración entre ambas empresas podría acelerar la investigación y el desarrollo de nuevas aplicaciones en el campo de la inteligencia artificial.","NVIDIA anunció su intención de invertir 100,000 millones de dólares en OpenAI para el desarrollo de un centro de datos avanzado. Este proyecto busca fortalecer la infraestructura tecnológica necesaria para el avance de la inteligencia artificial. La inversión refleja el creciente interés de NVIDIA en el sector de la IA, así como su compromiso de apoyar a OpenAI en la expansión de sus capacidades y recursos. La colaboración entre ambas empresas podría acelerar la investigación y el desarrollo de nuevas aplicaciones en el campo de la inteligencia artificial.",""
