"FechayHora","LinkOrigen","TituloOrigen","Titulo","Imagen","Intro","Noticia","Datos"
"09/23/2025 21:00:19","https://infobae.com/america/mundo/2025/09/22/estados-unidos-prometio-defender-cada-centimetro-de-la-otan-frente-a-la-escalada-de-incursiones-rusas/","Estados Unidos prometió defender “cada centímetro” de la OTAN frente a la escalada de incursiones rusas","Estados Unidos se compromete a defender cada centímetro de la OTAN ante las incursiones rusas","https://encrypted-tbn0.gstatic.com/images?q=tbn:ANd9GcTfffH47ZrzCfPlImEoBQIo2UF7eZOLN8_UrC0GRuE3uCAvm2-AY1kGFlfhHew&amp;s","Estados Unidos reafirmó su compromiso de defender cada parte de la OTAN en respuesta a un aumento de las incursiones rusas. En una reciente reunión de altos funcionarios en Bruselas, se hizo hincapié en la importancia de la unidad entre los aliados ante las amenazas percibidas. El secretario de Defensa de Estados Unidos subrayó que cualquier ataque contra un miembro de la OTAN sería considerado como un ataque contra todos, lo que demuestra la determinación de Washington de garantizar la seguridad colectiva. Esta declaración busca disuadir a Rusia y reafirmar la fortaleza de la alianza en medio de crecientes tensiones en Europa.","Estados Unidos reafirmó su compromiso de defender cada parte de la OTAN en respuesta a un aumento de las incursiones rusas. En una reciente reunión de altos funcionarios en Bruselas, se hizo hincapié en la importancia de la unidad entre los aliados ante las amenazas percibidas. El secretario de Defensa de Estados Unidos subrayó que cualquier ataque contra un miembro de la OTAN sería considerado como un ataque contra todos, lo que demuestra la determinación de Washington de garantizar la seguridad colectiva. Esta declaración busca disuadir a Rusia y reafirmar la fortaleza de la alianza en medio de crecientes tensiones en Europa.",""
"09/23/2025 21:00:19","https://infobae.com/venezuela/2025/09/16/donald-trump-anuncio-que-estados-unidos-destruyo-una-tercera-lancha-narco-proveniente-de-venezuela-dejen-de-enviarnos-drogas/","Trump anunció que EEUU destruyó una tercera lancha narco proveniente de Venezuela: “Dejen de enviarnos drogas”","Estados Unidos destruye una tercera lancha narco proveniente de Venezuela, según Donald Trump","https://encrypted-tbn0.gstatic.com/images?q=tbn:ANd9GcSs3QOOAv_eUZqb2soluC2oDGt1k_FdWRs5TXaCnOJilpbpcVArB6mmHtXFgJM&amp;s","Donald Trump anunció la destrucción de una tercera embarcación vinculada al tráfico de drogas que provenía de Venezuela. Durante un evento, el expresidente de Estados Unidos destacó las acciones de la Guardia Costera, enfatizando que el país no tolerará el envío de drogas desde Venezuela. Trump instó a las autoridades venezolanas a cesar estas actividades ilícitas, resaltando la importancia de la colaboración internacional para combatir el narcotráfico.","Donald Trump anunció la destrucción de una tercera embarcación vinculada al tráfico de drogas que provenía de Venezuela. Durante un evento, el expresidente de Estados Unidos destacó las acciones de la Guardia Costera, enfatizando que el país no tolerará el envío de drogas desde Venezuela. Trump instó a las autoridades venezolanas a cesar estas actividades ilícitas, resaltando la importancia de la colaboración internacional para combatir el narcotráfico.",""
"09/23/2025 21:00:19","https://infobae.com/america/ciencia-america/2025/09/23/las-impactantes-imagenes-desde-el-espacio-del-supertifon-ragasa-que-sacude-filipinas-y-el-sur-de-china/","Las impactantes imágenes desde el espacio del supertifón Ragasa, que sacude Filipinas y el sur de China","Impactantes imágenes desde el espacio del supertifón Ragasa que sacude Filipinas y el sur de China","https://encrypted-tbn0.gstatic.com/images?q=tbn:ANd9GcR72SQiJP67lzu19j89GLVraImWMYeUG_h1tjR18svMjddDM1ZF8F8p80Wb5eM&amp;s","Un potente supertifón llamado Ragasa está afectando Filipinas y el sur de China, provocando vientos intensos y lluvias torrenciales. Las imágenes satelitales muestran la magnitud del fenómeno, que ha generado advertencias de evacuación y ha dejado a miles de personas en riesgo. Las autoridades están en alerta máxima para mitigar los daños y garantizar la seguridad de la población en las áreas impactadas. Se espera que el tifón continúe su trayectoria, lo que podría intensificar aún más sus efectos destructivos en la región.","Un potente supertifón llamado Ragasa está afectando Filipinas y el sur de China, provocando vientos intensos y lluvias torrenciales. Las imágenes satelitales muestran la magnitud del fenómeno, que ha generado advertencias de evacuación y ha dejado a miles de personas en riesgo. Las autoridades están en alerta máxima para mitigar los daños y garantizar la seguridad de la población en las áreas impactadas. Se espera que el tifón continúe su trayectoria, lo que podría intensificar aún más sus efectos destructivos en la región.",""
"09/23/2025 21:00:19","https://infobae.com/deportes/2025/09/22/las-impactantes-revelaciones-de-la-investigacion-sobre-la-tragica-muerte-de-una-estrella-del-rugby/","Las impactantes revelaciones de la investigación sobre la trágica muerte de una estrella del rugby","Impactantes revelaciones de la investigación sobre la trágica muerte de una estrella del rugby","https://encrypted-tbn0.gstatic.com/images?q=tbn:ANd9GcSWYTqLsDsNsZzVBj7f9kpuwnyGU-YL9jXKoE5ORM2Dfo9CbCQndh0milvJQPw&amp;s","Una investigación sobre la muerte de una estrella del rugby ha revelado detalles impactantes. El jugador, que había alcanzado la fama en el deporte, sufrió un trágico accidente que llevó a una serie de revelaciones sobre su estado de salud previo al incidente. Se descubrió que el deportista padecía de problemas médicos significativos que no fueron atendidos adecuadamente, lo que generó preocupación sobre los cuidados que reciben los atletas profesionales. Además, el informe sugiere que estos problemas pudieron haber influido en el desenlace fatídico. La noticia ha abierto un debate sobre la salud y seguridad de los jugadores en el rugby y otros deportes de contacto.","Una investigación sobre la muerte de una estrella del rugby ha revelado detalles impactantes. El jugador, que había alcanzado la fama en el deporte, sufrió un trágico accidente que llevó a una serie de revelaciones sobre su estado de salud previo al incidente. Se descubrió que el deportista padecía de problemas médicos significativos que no fueron atendidos adecuadamente, lo que generó preocupación sobre los cuidados que reciben los atletas profesionales. Además, el informe sugiere que estos problemas pudieron haber influido en el desenlace fatídico. La noticia ha abierto un debate sobre la salud y seguridad de los jugadores en el rugby y otros deportes de contacto.",""
"09/23/2025 21:00:19","https://infobae.com/deportes/2025/09/22/lando-norris-confirmo-su-relacion-con-la-modelo-magui-corceiro-es-alguien-con-quien-puedo-ser-yo-mismo/","Lando Norris confirmó su relación con la modelo Magui Corceiro: “Es alguien con quien puedo ser yo mismo”","Lando Norris confirma su relación con la modelo Magui Corceiro","https://encrypted-tbn0.gstatic.com/images?q=tbn:ANd9GcTuZElS435C2ywytEdp6QY0RfkX1IdBuGOTBryNc4ouoSmgO-UDFU62Z5f6uW4&amp;s","Lando Norris, piloto de Fórmula 1, ha confirmado su relación con la modelo Magui Corceiro. En una entrevista, Norris describió a Corceiro como alguien con quien se siente cómodo siendo él mismo. La pareja ha generado atención mediática, y el piloto también mencionó la importancia de su apoyo en su vida personal y profesional.","Lando Norris, piloto de Fórmula 1, ha confirmado su relación con la modelo Magui Corceiro. En una entrevista, Norris describió a Corceiro como alguien con quien se siente cómodo siendo él mismo. La pareja ha generado atención mediática, y el piloto también mencionó la importancia de su apoyo en su vida personal y profesional.",""
"09/23/2025 21:00:19","https://infobae.com/venezuela/2025/09/20/trump-advirtio-a-la-dictadura-de-maduro-que-sufrira-un-precio-incalculable-si-no-acepta-el-retorno-de-los-presos-venezolanos-en-eeuu/","Trump advirtió que la dictadura de Maduro sufrirá un “precio incalculable” si no recibe a los presos venezolanos en EEUU","Trump advierte a la dictadura de Maduro sobre las consecuencias por la negativa a aceptar el retorno de los presos venezolanos en EE.UU.","https://encrypted-tbn0.gstatic.com/images?q=tbn:ANd9GcT5CFuAXJ_FtY4-PtPtCuPQ0znTnPbBF-iZRBIxlF-alx5dfU2URQmouCPF-g&amp;s","El expresidente de Estados Unidos, Donald Trump, advirtió al gobierno de Nicolás Maduro sobre las consecuencias que enfrentará si no acepta el regreso de los venezolanos presos en EE.UU. Esta declaración se da en un contexto de tensiones políticas entre ambos países, donde Trump destacó que el costo de rechazar dicha propuesta sería elevado e indefinido para el régimen venezolano. La advertencia se produce en un momento crítico de la relación entre Venezuela y Estados Unidos, marcada por sanciones y la situación de derechos humanos en el país sudamericano.","El expresidente de Estados Unidos, Donald Trump, advirtió al gobierno de Nicolás Maduro sobre las consecuencias que enfrentará si no acepta el regreso de los venezolanos presos en EE.UU. Esta declaración se da en un contexto de tensiones políticas entre ambos países, donde Trump destacó que el costo de rechazar dicha propuesta sería elevado e indefinido para el régimen venezolano. La advertencia se produce en un momento crítico de la relación entre Venezuela y Estados Unidos, marcada por sanciones y la situación de derechos humanos en el país sudamericano.",""
"09/23/2025 21:00:19","https://infobae.com/america/mundo/2025/09/19/iron-beam-el-laser-que-ya-usa-israel-y-que-cambiara-la-economia-de-la-guerra/","Iron Beam, el láser que ya usa Israel y que cambiará la economía de la guerra","Iron Beam, el láser que ya usa Israel y cambiará la economía de la guerra","https://encrypted-tbn0.gstatic.com/images?q=tbn:ANd9GcRV2pFPIyzQSLD3VzbmuGYjC9t2GZHIsg9yFQtTKK9FJ3kiHKzxauShNIN3fpI&amp;s","Israel ha comenzado a utilizar un sistema láser de defensa llamado Iron Beam, diseñado para interceptar amenazas aéreas como cohetes y drones a un costo significativamente menor que los sistemas de defensa tradicionales. Este sistema, que complementa las defensas existentes como el Iron Dome, permite a las fuerzas israelíes neutralizar ataques de manera más eficiente y económica. Iron Beam es capaz de destruir objetivos en pleno vuelo, marcando un cambio importante en la estrategia militar del país. La adopción de esta tecnología no solo tiene repercusiones en la seguridad nacional, sino que también podría influir en la economía de la guerra, dado su potencial para reducir costos operativos y aumentar la eficacia en el campo de batalla.","Israel ha comenzado a utilizar un sistema láser de defensa llamado Iron Beam, diseñado para interceptar amenazas aéreas como cohetes y drones a un costo significativamente menor que los sistemas de defensa tradicionales. Este sistema, que complementa las defensas existentes como el Iron Dome, permite a las fuerzas israelíes neutralizar ataques de manera más eficiente y económica. Iron Beam es capaz de destruir objetivos en pleno vuelo, marcando un cambio importante en la estrategia militar del país. La adopción de esta tecnología no solo tiene repercusiones en la seguridad nacional, sino que también podría influir en la economía de la guerra, dado su potencial para reducir costos operativos y aumentar la eficacia en el campo de batalla.",""
"09/23/2025 21:00:19","https://infobae.com/deportes/2025/09/22/los-mejores-memes-del-balon-de-oro-que-dembele-le-gano-a-lamine-yamal-las-reacciones-de-nicki-nicole-messi-y-mbappe/","Los mejores memes del Balón de Oro que Dembélé le ganó a Lamine Yamal: las “reacciones” de Nicki Nicole, Messi y Mbappé","Los mejores memes del Balón de Oro que Dembélé le ganó a Lamine Yamal","https://encrypted-tbn0.gstatic.com/images?q=tbn:ANd9GcQQUYw9A9VqbmbkVPH-VlodyjVcZNZ5qqQqesTRIR8tO4d_572MIemRkJJNeL8&amp;s","El artículo destaca las reacciones y los mejores memes generados tras la entrega del Balón de Oro, en la que Ousmane Dembélé se llevó el premio a mejor jugador, superando a Lamine Yamal. Las reacciones en redes sociales fueron diversas, incluyendo las de celebridades como Nicki Nicole, y futbolistas como Lionel Messi y Kylian Mbappé. El evento generó una ola de creatividad y humor en la comunidad en línea, que se reflejó en los memes que circulaban junto a las reacciones de los involucrados.","El artículo destaca las reacciones y los mejores memes generados tras la entrega del Balón de Oro, en la que Ousmane Dembélé se llevó el premio a mejor jugador, superando a Lamine Yamal. Las reacciones en redes sociales fueron diversas, incluyendo las de celebridades como Nicki Nicole, y futbolistas como Lionel Messi y Kylian Mbappé. El evento generó una ola de creatividad y humor en la comunidad en línea, que se reflejó en los memes que circulaban junto a las reacciones de los involucrados.",""
"09/23/2025 21:00:19","https://infobae.com/america/mundo/2025/09/18/estados-unidos-y-el-reino-unido-firmaron-una-historica-alianza-nuclear-y-tecnologica-invertiran-205-mil-millones-de-dolares/","EEUU y el Reino Unido firmaron una histórica alianza nuclear y tecnológica: invertirán 205 mil millones de dólares","Estados Unidos y Reino Unido firman histórica alianza nuclear y tecnológica con inversión de 205 mil millones de dólares","https://encrypted-tbn0.gstatic.com/images?q=tbn:ANd9GcQGtQ1R66WtgnRGXuv1bphQNUC83RCge3wfdXgOAH0h53tQn1-br4GGISkStYM&amp;s","Estados Unidos y el Reino Unido han establecido una nueva colaboración significativa centrada en tecnologías nucleares y de defensa, la cual incluye una inversión de 205 mil millones de dólares. Esta alianza busca fortalecer las capacidades militares y reforzar la seguridad en un contexto internacional cada vez más complejo. Los líderes de ambos países han resaltado la importancia de esta asociación a largo plazo, que también se extiende a áreas como la inteligencia y la investigación tecnológica. La cooperación tiene como objetivo enfrentar desafíos globales y consolidar la influencia de ambos países en el ámbito geopolítico.","Estados Unidos y el Reino Unido han establecido una nueva colaboración significativa centrada en tecnologías nucleares y de defensa, la cual incluye una inversión de 205 mil millones de dólares. Esta alianza busca fortalecer las capacidades militares y reforzar la seguridad en un contexto internacional cada vez más complejo. Los líderes de ambos países han resaltado la importancia de esta asociación a largo plazo, que también se extiende a áreas como la inteligencia y la investigación tecnológica. La cooperación tiene como objetivo enfrentar desafíos globales y consolidar la influencia de ambos países en el ámbito geopolítico.",""
"09/23/2025 21:00:19","https://infobae.com/venezuela/2025/09/23/human-rights-watch-advirtio-que-decenas-de-presos-politicos-en-venezuela-acumulan-meses-incomunicados/","Human Rights Watch advirtió que decenas de presos políticos en Venezuela acumulan meses incomunicados","Human Rights Watch advierte que decenas de presos políticos en Venezuela acumulan meses incomunicados","https://encrypted-tbn0.gstatic.com/images?q=tbn:ANd9GcQIXLDl_1Fu7K8CQozXnaeMITXd2pFW0bhVWxEK6fQM2O6MUzK2Eij2WLIehzc&amp;s","Human Rights Watch alertó sobre la situación de decenas de presos políticos en Venezuela, quienes llevan varios meses en condiciones de incomunicación. La organización destacó que estas detenciones arbitrarias son parte de una estrategia del gobierno para silenciar la oposición y violar los derechos humanos. La falta de contacto con sus familias y defensores legales agrava el sufrimiento de estos detenidos, que enfrentan condiciones inhumanas en los centros de detención. La denuncia coincide con el contexto de represión política en el país, donde la libertad de expresión y los derechos fundamentales están seriamente comprometidos.","Human Rights Watch alertó sobre la situación de decenas de presos políticos en Venezuela, quienes llevan varios meses en condiciones de incomunicación. La organización destacó que estas detenciones arbitrarias son parte de una estrategia del gobierno para silenciar la oposición y violar los derechos humanos. La falta de contacto con sus familias y defensores legales agrava el sufrimiento de estos detenidos, que enfrentan condiciones inhumanas en los centros de detención. La denuncia coincide con el contexto de represión política en el país, donde la libertad de expresión y los derechos fundamentales están seriamente comprometidos.",""
"09/23/2025 21:00:19","https://infobae.com/america/mundo/2025/09/23/la-80-asamblea-general-de-la-onu-inicia-su-debate-anual-con-la-atencion-puesta-en-gaza-y-el-reconocimiento-de-palestina/","La Asamblea de la ONU inicia su debate con la atención puesta en Gaza y el reconocimiento de Palestina","La 80ª Asamblea General de la ONU inicia su debate anual con la atención puesta en Gaza y el reconocimiento de Palestina","https://encrypted-tbn0.gstatic.com/images?q=tbn:ANd9GcTASe2O2tykWc0i6mWu7e4t_t5Bc8ACFqfMWnrpF0lLR9XvCERzk4Nb588yvQ&amp;s","La 80ª Asamblea General de la ONU ha comenzado su debate anual, centrándose en la situación en Gaza y el reconocimiento del Estado palestino. La atención se dirige hacia las tensiones en Medio Oriente, especialmente tras el aumento de conflictos en la región. Los líderes mundiales están llamados a discutir temas como la paz, la seguridad y los derechos humanos, con el objetivo de encontrar soluciones a las crisis actuales. La comunidad internacional se mantiene atenta a cómo estos debates influirán en los esfuerzos por alcanzar una resolución al conflicto israelí-palestino.","La 80ª Asamblea General de la ONU ha comenzado su debate anual, centrándose en la situación en Gaza y el reconocimiento del Estado palestino. La atención se dirige hacia las tensiones en Medio Oriente, especialmente tras el aumento de conflictos en la región. Los líderes mundiales están llamados a discutir temas como la paz, la seguridad y los derechos humanos, con el objetivo de encontrar soluciones a las crisis actuales. La comunidad internacional se mantiene atenta a cómo estos debates influirán en los esfuerzos por alcanzar una resolución al conflicto israelí-palestino.",""
"09/23/2025 21:00:19","https://infobae.com/venezuela/2025/09/23/primero-justicia-exigio-la-libertad-de-juan-pablo-guanipa-tras-cuatro-meses-de-detencion/","Primero Justicia exigió la libertad de Juan Pablo Guanipa tras cuatro meses de detención","Primero Justicia exigió la libertad de Juan Pablo Guanipa tras cuatro meses de detención","https://encrypted-tbn0.gstatic.com/images?q=tbn:ANd9GcT4qfgloDGiugd0J4d0c-d07cYfGHGFoiFf0QtIcaRY3qWzhzZaspx4LzzBOQ&amp;s","El partido Primero Justicia solicitó la liberación de Juan Pablo Guanipa, quien ha estado detenido durante cuatro meses. La situación fue denunciada por sus compañeros de partido, quienes consideran que su encarcelamiento es un acto de persecución política. La organización política reafirmó su compromiso con la lucha por los derechos humanos y la libertad en el país, y exigió el respeto a la vida y la integridad de Guanipa.","El partido Primero Justicia solicitó la liberación de Juan Pablo Guanipa, quien ha estado detenido durante cuatro meses. La situación fue denunciada por sus compañeros de partido, quienes consideran que su encarcelamiento es un acto de persecución política. La organización política reafirmó su compromiso con la lucha por los derechos humanos y la libertad en el país, y exigió el respeto a la vida y la integridad de Guanipa.",""
"09/23/2025 21:00:19","https://infobae.com/deportes/2025/09/23/la-reaccion-de-una-luchadora-al-quebrarse-el-brazo-mientras-estrangulaba-a-una-rival-en-una-pelea-de-mma/","La reacción de una luchadora tras quebrarse el brazo mientras estrangulaba a una rival en una pelea de MMA","","https://encrypted-tbn0.gstatic.com/images?q=tbn:ANd9GcQPjrmWbjnZ4VoYhG88qDQGtNV6Rpj2Q1DG2lXOPQQ9mkRiIzCwozS41djz4A&amp;s","En un evento de artes marciales mixtas, una luchadora sufrió una grave lesión al fracturarse el brazo mientras intentaba someter a su oponente con un estrangulamiento. A pesar del dolor, su reacción fue desafiante y continuó manteniendo la presión en su rival. La situación generó preocupación entre los espectadores y en las redes sociales, donde se discutió la peligrosidad de este tipo de deportes. La luchadora fue atendida rápidamente, y la pelea fue detenida tras la lesión.","En un evento de artes marciales mixtas, una luchadora sufrió una grave lesión al fracturarse el brazo mientras intentaba someter a su oponente con un estrangulamiento. A pesar del dolor, su reacción fue desafiante y continuó manteniendo la presión en su rival. La situación generó preocupación entre los espectadores y en las redes sociales, donde se discutió la peligrosidad de este tipo de deportes. La luchadora fue atendida rápidamente, y la pelea fue detenida tras la lesión.",""
"09/23/2025 21:00:19","https://infobae.com/deportes/2025/09/22/el-gesto-antideportivo-en-un-partido-de-futbol-americano-que-genero-conmocion-un-jugador-se-lanzo-encima-de-su-rival-y-lo-fracturo/","El gesto antideportivo en un partido de fútbol americano: fractura y conmoción","Jugador de fútbol americano fractura a su rival con un gesto antideportivo","https://encrypted-tbn0.gstatic.com/images?q=tbn:ANd9GcTMFX4IJCGqO3N7KTCSSf4JNr4fmEsfQeyS_5n9LUTqo8sIsQWihe0HP5nHtug&amp;s","En un reciente partido de fútbol americano, se produjo un incidente alarmante cuando un jugador se lanzó de manera violenta sobre su oponente, lo que resultó en una fractura para este último. La acción, considerada antideportiva, ha generado gran conmoción en la comunidad deportiva. La jugada fue capturada en video y ha suscitado reacciones de indignación y debate sobre la seguridad en el deporte. Las instituciones del fútbol americano están revisando las implicaciones de este tipo de comportamientos en el campo, destacando la necesidad de garantizar la integridad de los jugadores.","En un reciente partido de fútbol americano, se produjo un incidente alarmante cuando un jugador se lanzó de manera violenta sobre su oponente, lo que resultó en una fractura para este último. La acción, considerada antideportiva, ha generado gran conmoción en la comunidad deportiva. La jugada fue capturada en video y ha suscitado reacciones de indignación y debate sobre la seguridad en el deporte. Las instituciones del fútbol americano están revisando las implicaciones de este tipo de comportamientos en el campo, destacando la necesidad de garantizar la integridad de los jugadores.",""
"09/23/2025 21:00:19","https://infobae.com/america/america-latina/2025/09/22/la-corte-constitucional-de-ecuador-evaluara-el-referendo-impulsado-por-noboa-para-convocar-una-asamblea-constituyente/","La Corte Constitucional de Ecuador evaluará el referendo impulsado por Noboa para convocar una Asamblea Constituyente","Corte Constitucional de Ecuador evaluará referendo impulsado por Noboa para convocar una asamblea constituyente","https://encrypted-tbn0.gstatic.com/images?q=tbn:ANd9GcTefbm1qb76wQfbjSybIuoS5NelsTZ6zkERl9dj7mSsA7PyLF1QaYTtjscbMN0&amp;s","La Corte Constitucional de Ecuador comenzará a analizar un referendo promovido por el presidente Daniel Noboa, que busca la convocatoria de una asamblea constituyente. Esta iniciativa tiene como objetivo reformar la Constitución, y la Corte debe determinar la legalidad del referendo antes de que sea sometido a votación. Noboa ha manifestado su deseo de realizar cambios significativos en el país, lo que ha generado diversas opiniones entre la ciudadanía y los distintos sectores políticos. La decisión de la Corte es crucial para avanzar con la propuesta.","La Corte Constitucional de Ecuador comenzará a analizar un referendo promovido por el presidente Daniel Noboa, que busca la convocatoria de una asamblea constituyente. Esta iniciativa tiene como objetivo reformar la Constitución, y la Corte debe determinar la legalidad del referendo antes de que sea sometido a votación. Noboa ha manifestado su deseo de realizar cambios significativos en el país, lo que ha generado diversas opiniones entre la ciudadanía y los distintos sectores políticos. La decisión de la Corte es crucial para avanzar con la propuesta.",""
