"FechayHora","LinkOrigen","TituloOrigen","Titulo","Imagen","Intro","Noticia","Datos"
"09/07/2025 16:00:08","https://infobae.com/venezuela/2025/09/05/maduro-amenazo-con-una-lucha-armada-si-estados-unidos-ataca-a-venezuela/","Maduro amenazó con una “lucha armada” si Estados Unidos ataca a Venezuela","Maduro amenazó con una lucha armada si Estados Unidos ataca a Venezuela.","https://encrypted-tbn0.gstatic.com/images?q=tbn:ANd9GcTmdedcQKO8Ny4kojeKNSR34Xz6aXr8jmO0x-Yf7IoFlg6Xtsf2jYtvWpYYO90&amp;s","El presidente de Venezuela, Nicolás Maduro, amenazó con una posible lucha armada si Estados Unidos llegara a atacar a su país. La advertencia se dio en el marco de una serie de ejercicios militares realizados en respuesta a una supuesta amenaza por parte de la nación norteamericana.","El presidente de Venezuela, Nicolás Maduro, amenazó con una posible lucha armada si Estados Unidos llegara a atacar a su país. La advertencia se dio en el marco de una serie de ejercicios militares realizados en respuesta a una supuesta amenaza por parte de la nación norteamericana.",""
"09/07/2025 16:00:08","https://infobae.com/america/mundo/2025/09/07/el-primer-ministro-japones-shigeru-ishiba-anuncio-su-renuncia-un-dia-antes-de-la-votacion-de-censura-en-su-partido/","El primer ministro japonés anunció su renuncia un día antes de la votación de censura en su partido","El primer ministro japonés Shigeru Ishiba anunció su renuncia un día antes de la votación de censura en su partido","https://encrypted-tbn0.gstatic.com/images?q=tbn:ANd9GcSQnAiIQLheKm3fGMCdg041VtM-NtRR4Omnzyd1L1YlSEuJXBzJZ_WPJ7Hf2u4&amp;s","El primer ministro de Japón, Shigeru Ishiba, anunció su renuncia un día antes de la votación de censura en su partido. La decisión de renunciar se dio en medio de una crisis política provocada por desacuerdos en el partido. Ishiba comunicó su renuncia en una conferencia de prensa y expresó su deseo de que su salida ayude a restaurar la unidad dentro del partido.","El primer ministro de Japón, Shigeru Ishiba, anunció su renuncia un día antes de la votación de censura en su partido. La decisión de renunciar se dio en medio de una crisis política provocada por desacuerdos en el partido. Ishiba comunicó su renuncia en una conferencia de prensa y expresó su deseo de que su salida ayude a restaurar la unidad dentro del partido.",""
"09/07/2025 16:00:08","https://infobae.com/america/mundo/2025/09/07/el-mensaje-de-leon-xiv-a-los-jovenes-en-la-canonizacion-de-carlo-acutis-hagan-de-su-vida-una-obra-maestra/","El mensaje de León XIV a los jóvenes en la canonización de Carlo Acutis: “Hagan de su vida una obra maestra”","El mensaje de León XIV a los jóvenes en la canonización de Carlo Acutis: ""Hagan de su vida una obra maestra""","https://encrypted-tbn0.gstatic.com/images?q=tbn:ANd9GcTnVohZqCK4g2H7aI4IGgqY8WQgq88Ikr_VNZZvb6eb9weXHi-LcC1h2aNiLQ&amp;s","El mensaje de León XIV a los jóvenes en la canonización de Carlo Acutis fue ""hagan de su vida una obra maestra"". El Papa destacó el ejemplo de Carlo Acutis, un joven italiano fallecido a los 15 años que había sido conocido por su devoción a la Eucaristía y su uso de la tecnología para difundir la fe. La canonización de Acutis tuvo lugar en Asís, Italia, y León XIV instó a los jóvenes a seguir su ejemplo de amor a Dios y al prójimo.","El mensaje de León XIV a los jóvenes en la canonización de Carlo Acutis fue ""hagan de su vida una obra maestra"". El Papa destacó el ejemplo de Carlo Acutis, un joven italiano fallecido a los 15 años que había sido conocido por su devoción a la Eucaristía y su uso de la tecnología para difundir la fe. La canonización de Acutis tuvo lugar en Asís, Italia, y León XIV instó a los jóvenes a seguir su ejemplo de amor a Dios y al prójimo.",""
"09/07/2025 16:00:08","https://infobae.com/america/mundo/2025/09/06/catastroficos-aludes-en-sudan-recuperaron-mas-de-370-cadaveres-pero-temen-que-sean-mas-de-mil-las-victimas/","Catastróficos aludes en Sudán: recuperaron más de 370 cadáveres pero temen que sean más de mil las víctimas","Catastróficos aludes en Sudán recuperaron más de 370 cadáveres pero temen que sean más de mil las víctimas","https://encrypted-tbn0.gstatic.com/images?q=tbn:ANd9GcTB_uWTczQipjZWcagGG4H8ZPKoexBmBmZzElLE_78ESFLMSlvQQHAtzpBh3Q&amp;s","En Sudán, catastróficos aludes han dejado más de 370 cadáveres recuperados hasta el momento, pero se teme que las víctimas podrían superar las mil personas. Los deslizamientos de tierra fueron causados por las fuertes lluvias en la región. Las autoridades continúan con las tareas de rescate y búsqueda de sobrevivientes en medio de la devastación.","En Sudán, catastróficos aludes han dejado más de 370 cadáveres recuperados hasta el momento, pero se teme que las víctimas podrían superar las mil personas. Los deslizamientos de tierra fueron causados por las fuertes lluvias en la región. Las autoridades continúan con las tareas de rescate y búsqueda de sobrevivientes en medio de la devastación.",""
"09/07/2025 16:00:08","https://infobae.com/america/mundo/2025/09/06/el-ultimo-adios-a-giorgio-armani-miles-de-admiradores-despediran-al-icono-de-la-moda-en-milan-durante-el-fin-de-semana/","El último adiós a Giorgio Armani: miles de admiradores despedirán al ícono de la moda en Milán durante el fin de semana","El último adiós a Giorgio Armani: miles de admiradores despedirán al ícono de la moda en Milán durante el fin de semana","https://encrypted-tbn0.gstatic.com/images?q=tbn:ANd9GcSKn2Mnyxp_9YvGd7w2JD5oLbq4Q8fqRpbOmR1OEzHmsMbreRjBXtN5WHm1Mck&amp;s","En Milán, miles de admiradores se despedirán del icónico diseñador de moda Giorgio Armani durante el fin de semana. La noticia de su fallecimiento ha conmocionado al mundo de la moda, y se espera que su funeral sea un evento de gran magnitud para honrar su legado en la industria.","En Milán, miles de admiradores se despedirán del icónico diseñador de moda Giorgio Armani durante el fin de semana. La noticia de su fallecimiento ha conmocionado al mundo de la moda, y se espera que su funeral sea un evento de gran magnitud para honrar su legado en la industria.",""
"09/07/2025 16:00:08","https://infobae.com/deportes/2025/09/07/hizo-un-gesto-su-rival-lo-encerro-y-protagonizo-un-dramatico-accidente-la-peligrosa-maniobra-en-una-carrera-de-karting-que-recorre-el-mundo/","Hizo un gesto, su rival lo encerró y protagonizó un dramático accidente: la peligrosa maniobra en una carrera de karting","Hizo un gesto su rival, lo encerró y protagonizó un dramático accidente: la peligrosa maniobra en una carrera de karting que recorre el mundo","https://encrypted-tbn0.gstatic.com/images?q=tbn:ANd9GcSk_XjKaAbkHHfQyTwm_vUjjaFEMf9X7oBujKnAsWwltvWQRGJbHPBVABsmU_Y&amp;s","En una carrera de karting, un piloto realizó un gesto hacia su rival, quien lo cerró durante la competencia, provocando un dramático accidente. La peligrosa maniobra se volvió viral en redes sociales y generó debate sobre la conducta en las pistas de carreras.","En una carrera de karting, un piloto realizó un gesto hacia su rival, quien lo cerró durante la competencia, provocando un dramático accidente. La peligrosa maniobra se volvió viral en redes sociales y generó debate sobre la conducta en las pistas de carreras.",""
"09/07/2025 16:00:08","https://infobae.com/america/mundo/2025/09/07/el-kremlin-se-burla-de-la-diplomacia-fuerte-condena-de-europa-tras-el-mayor-bombardeo-ruso-contra-ucrania-desde-el-inicio-de-la-guerra/","“El Kremlin se burla de la diplomacia”: fuerte condena de Europa tras el mayor bombardeo ruso contra Ucrania desde el inicio de la guerra","El Kremlin se burla de la diplomacia: fuerte condena de Europa tras el mayor bombardeo ruso contra Ucrania desde el inicio de la guerra","https://encrypted-tbn0.gstatic.com/images?q=tbn:ANd9GcT8UhcM7qD57Ot0sGpZt4eKuoCy6-lYfQq38y25fXuoPeRaq57QkyQ1xFgyMg&amp;s","El Kremlin llevó a cabo un importante bombardeo contra Ucrania, lo que generó una fuerte condena por parte de Europa. Se trata del ataque más grande desde el inicio de la guerra en la región. La acción ha sido considerada una provocación que pone en riesgo la paz y la estabilidad en la zona.","El Kremlin llevó a cabo un importante bombardeo contra Ucrania, lo que generó una fuerte condena por parte de Europa. Se trata del ataque más grande desde el inicio de la guerra en la región. La acción ha sido considerada una provocación que pone en riesgo la paz y la estabilidad en la zona.",""
"09/07/2025 16:00:08","https://infobae.com/america/mundo/2025/09/06/tension-en-el-pacifico-buques-de-guerra-de-australia-y-canada-cruzaron-el-estrecho-de-taiwan-y-el-regimen-chino-desplego-un-operativo-de-vigilancia/","Buques de guerra de Australia y Canadá cruzaron el estrecho de Taiwán y el régimen chino desplegó un operativo de vigilancia","Tensión en el Pacífico: Buques de guerra de Australia y Canadá cruzaron el Estrecho de Taiwán y el régimen chino desplegó un operativo de vigilancia","https://encrypted-tbn0.gstatic.com/images?q=tbn:ANd9GcQE19rvrHNh8WC-2gAKLtoPet5cr5rgAXtRWOtgPyVIhIgMwAQojlfTcVSgEJs&amp;s","Las tensiones en el Pacífico aumentaron cuando buques de guerra de Australia y Canadá cruzaron el Estrecho de Taiwán, provocando una respuesta de vigilancia por parte del régimen chino.","Las tensiones en el Pacífico aumentaron cuando buques de guerra de Australia y Canadá cruzaron el Estrecho de Taiwán, provocando una respuesta de vigilancia por parte del régimen chino.",""
"09/07/2025 16:00:08","https://infobae.com/america/america-latina/2025/09/05/el-supremo-tribunal-de-brasil-sumo-un-dia-de-sesiones-en-el-juicio-a-bolsonaro-por-intento-de-golpe-de-estado/","El Supremo Tribunal de Brasil sumó un día de sesiones en el juicio a Bolsonaro por intento de golpe de Estado","El Supremo Tribunal de Brasil sumó un día de sesiones en el juicio a Bolsonaro por intento de golpe de estado","https://encrypted-tbn0.gstatic.com/images?q=tbn:ANd9GcT8jSlsUzVYJCZhCNrHR0VP5ThRgae1gc2rKsrKX1iGoN8MHjYIXBlvLQfHhr0&amp;s","El Supremo Tribunal de Brasil añadió un día más de sesiones al juicio contra Jair Bolsonaro por intento de golpe de Estado. La decisión se tomó para dar más tiempo a las partes involucradas en el caso. El presidente de Brasil está siendo investigado por supuestamente intentar involucrar a las Fuerzas Armadas en un golpe de Estado para evitar la destitución a raíz de las protestas en su contra.","El Supremo Tribunal de Brasil añadió un día más de sesiones al juicio contra Jair Bolsonaro por intento de golpe de Estado. La decisión se tomó para dar más tiempo a las partes involucradas en el caso. El presidente de Brasil está siendo investigado por supuestamente intentar involucrar a las Fuerzas Armadas en un golpe de Estado para evitar la destitución a raíz de las protestas en su contra.",""
"09/07/2025 16:00:08","https://infobae.com/deportes/2025/09/06/max-verstappen-hizo-historia-en-monza-y-logro-la-vuelta-mas-rapida-de-la-formula-1/","Max Verstappen hizo historia en Monza y logró la vuelta más rápida de la Fórmula 1","Max Verstappen hizo historia en Monza y logró la vuelta más rápida de la Fórmula 1.","https://encrypted-tbn0.gstatic.com/images?q=tbn:ANd9GcSePEbSCIBgKAL95QEnLTX3Bptgh-QJWk_nl1uRTGpDIQ3gfGlQQscUFvbEGw&amp;s","En el Gran Premio de Italia en Monza, Max Verstappen hizo historia al lograr la vuelta más rápida de la Fórmula 1. El piloto de Red Bull demostró su habilidad y destreza al marcar un nuevo récord en el circuito. Su desempeño en la pista lo llevó a obtener un logro impresionante en la competición automovilística de alto nivel.","En el Gran Premio de Italia en Monza, Max Verstappen hizo historia al lograr la vuelta más rápida de la Fórmula 1. El piloto de Red Bull demostró su habilidad y destreza al marcar un nuevo récord en el circuito. Su desempeño en la pista lo llevó a obtener un logro impresionante en la competición automovilística de alto nivel.",""
"09/07/2025 16:00:08","https://infobae.com/america/mundo/2025/09/04/lideres-europeos-hablaron-con-trump-y-garantizaron-la-seguridad-de-ucrania-ante-los-ataques-de-putin/","Líderes europeos hablaron con Trump y garantizaron la seguridad de Ucrania ante los ataques de Putin","Líderes europeos garantizaron la seguridad de Ucrania ante los ataques de Putin","https://encrypted-tbn0.gstatic.com/images?q=tbn:ANd9GcSUTL1-2oK2y5z3WRGPAObN257uxvILrGeDgqNrPycR4g7Q9NIO3BnyiCIqSw&amp;s","Líderes europeos hablaron con Trump y garantizaron la seguridad de Ucrania ante los ataques de Putin. En la llamada telefónica, acordaron fortalecer la cooperación para defender a Ucrania de la agresión rusa. También se comprometieron a mantener la presión sobre Moscú para respetar la integridad territorial de Ucrania.","Líderes europeos hablaron con Trump y garantizaron la seguridad de Ucrania ante los ataques de Putin. En la llamada telefónica, acordaron fortalecer la cooperación para defender a Ucrania de la agresión rusa. También se comprometieron a mantener la presión sobre Moscú para respetar la integridad territorial de Ucrania.",""
"09/07/2025 16:00:08","https://infobae.com/deportes/2025/09/07/franco-colapinto-largara-desde-el-puesto-17-el-gran-premio-de-italia-de-la-formula-1-todo-lo-que-hay-que-saber/","Gran Premio de Italia de la Fórmula 1: Max Verstappen saldrá desde la pole en Monza","Franco Colapinto largará desde el puesto 17 el Gran Premio de Italia de la Fórmula 1: todo lo que hay que saber.","https://encrypted-tbn0.gstatic.com/images?q=tbn:ANd9GcS_ZgzIhx0rDv1eYDZmxSPfWOgyTun4KZnlCrBn6V59cY5zpoLglapwHTMW1g&amp;s","Franco Colapinto largará desde el puesto 17 en el Gran Premio de Italia de la Fórmula 1. El piloto argentino debutará en la máxima categoría del automovilismo en el circuito de Monza. Colapinto se encuentra en la escudería italiana HRT y buscará sumar puntos en esta carrera.","Franco Colapinto largará desde el puesto 17 en el Gran Premio de Italia de la Fórmula 1. El piloto argentino debutará en la máxima categoría del automovilismo en el circuito de Monza. Colapinto se encuentra en la escudería italiana HRT y buscará sumar puntos en esta carrera.",""
"09/07/2025 16:00:08","https://infobae.com/deportes/2025/09/06/crisis-en-palmeiras-a-dias-de-jugar-con-river-por-la-libertadores-de-la-controvertida-actitud-del-dt-al-cruce-con-la-presidenta/","Crisis en Palmeiras a días de jugar con River por la Libertadores: de la controvertida actitud del DT al cruce con la presidenta","Crisis en Palmeiras a días de jugar con River por la Libertadores: la controvertida actitud del DT al cruce con la presidenta.","https://encrypted-tbn0.gstatic.com/images?q=tbn:ANd9GcRSDJ0ZK_aLAelWqE7AIQ21mCKRzFqB2GjJxDj4-AJz2zzh4RL4RNBUFePRbA&amp;s","El club Palmeiras enfrenta una crisis días antes de jugar contra River Plate en la Copa Libertadores. El director técnico del equipo ha generado controversia por su actitud y ha tenido un cruce con la presidenta del club. La situación interna del equipo brasileño es complicada en vísperas de un partido importante.","El club Palmeiras enfrenta una crisis días antes de jugar contra River Plate en la Copa Libertadores. El director técnico del equipo ha generado controversia por su actitud y ha tenido un cruce con la presidenta del club. La situación interna del equipo brasileño es complicada en vísperas de un partido importante.",""
"09/07/2025 16:00:08","https://infobae.com/america/mundo/2025/09/06/el-regimen-de-iran-ejecuto-a-un-hombre-acusado-de-atacar-a-la-policia-durante-las-protestas-por-el-asesinato-de-mahsa-amini/","El régimen de Irán ejecutó a un hombre acusado de atacar a la Policía durante las protestas por el asesinato de Mahsa Amini","El régimen de Irán ejecutó a un hombre acusado de atacar a la policía durante las protestas por el asesinato de Mahsa Amini","https://encrypted-tbn0.gstatic.com/images?q=tbn:ANd9GcQi6N7dkN1-3F-1-ZtYADFSosrWnvaW35T7ETEQfA7lSC7K77-d-jVkfpCtQw&amp;s","En Irán, el régimen ha ejecutado a un hombre acusado de atacar a la policía durante las protestas por el asesinato de Mahsa Amini. La ejecución se llevó a cabo pese a las críticas de organizaciones de derechos humanos. El hombre fue identificado como Heydar Ghorbani. Los hechos ocurrieron en la ciudad de Karaj, donde se desencadenaron manifestaciones tras la muerte de Amini a manos de la policía en julio.","En Irán, el régimen ha ejecutado a un hombre acusado de atacar a la policía durante las protestas por el asesinato de Mahsa Amini. La ejecución se llevó a cabo pese a las críticas de organizaciones de derechos humanos. El hombre fue identificado como Heydar Ghorbani. Los hechos ocurrieron en la ciudad de Karaj, donde se desencadenaron manifestaciones tras la muerte de Amini a manos de la policía en julio.",""
"09/07/2025 16:00:08","https://infobae.com/america/mundo/2025/09/06/miles-de-personas-protestaron-en-jerusalen-y-tel-aviv-para-exigir-un-acuerdo-que-libere-a-los-rehenes-en-gaza/","Miles de personas protestaron en Jerusalén y Tel Aviv para exigir un acuerdo que libere a los rehenes en Gaza","Miles de personas protestaron en Jerusalén y Tel Aviv para exigir un acuerdo que libere a los rehenes en Gaza","https://encrypted-tbn0.gstatic.com/images?q=tbn:ANd9GcQGselWy6k25Q2L5dCAENLozCvRIWRAlPFjbQ4dNDHCpdfX-ocJE0mnR7NJ8Q&amp;s","Miles de personas protestaron en Jerusalén y Tel Aviv exigiendo un acuerdo que libere a los rehenes en la Franja de Gaza. Las manifestaciones se llevaron a cabo en medio de la tensión en la región y en respuesta al reciente intercambio de disparos entre Israel y grupos armados palestinos en Gaza. Los manifestantes pidieron la liberación de dos ciudadanos israelíes que se encuentran cautivos en Gaza, así como la de los restos de dos soldados israelíes muertos en combate.","Miles de personas protestaron en Jerusalén y Tel Aviv exigiendo un acuerdo que libere a los rehenes en la Franja de Gaza. Las manifestaciones se llevaron a cabo en medio de la tensión en la región y en respuesta al reciente intercambio de disparos entre Israel y grupos armados palestinos en Gaza. Los manifestantes pidieron la liberación de dos ciudadanos israelíes que se encuentran cautivos en Gaza, así como la de los restos de dos soldados israelíes muertos en combate.",""
"09/07/2025 16:00:08","https://infobae.com/venezuela/2025/09/04/voluntad-popular-exigio-conocer-el-paradero-del-padre-de-un-activista-opositor-al-regimen-de-nicolas-maduro/","Voluntad Popular exigió conocer el paradero del padre de un activista opositor al régimen de Nicolás Maduro","Voluntad Popular exige conocer el paradero del padre de un activista opositor al régimen de Nicolás Maduro","https://encrypted-tbn0.gstatic.com/images?q=tbn:ANd9GcTcsDYFUFyLRqV-fXpv18wcsRk3KDQlp-ciRM6yWmM4eLYCsyG0yKiQxX2FkA&amp;s","En el enlace proporcionado se informa que el partido político Voluntad Popular ha exigido conocer el paradero del padre de un activista opositor al régimen de Nicolás Maduro en Venezuela. La solicitud se presenta en medio de la preocupación por la seguridad de los familiares de quienes se oponen al gobierno actual en el país.","En el enlace proporcionado se informa que el partido político Voluntad Popular ha exigido conocer el paradero del padre de un activista opositor al régimen de Nicolás Maduro en Venezuela. La solicitud se presenta en medio de la preocupación por la seguridad de los familiares de quienes se oponen al gobierno actual en el país.",""
"09/07/2025 16:00:08","https://infobae.com/america/mundo/2025/09/06/catolicos-de-la-comunidad-lgtbiq-realizaron-el-primer-gran-peregrinaje-al-vaticano-en-el-marco-del-jubileo/","Católicos de la comunidad LGTBIQ+ realizaron el primer gran peregrinaje al Vaticano en el marco del Jubileo","Católicos de la comunidad LGTBIQ realizan primer gran peregrinaje al Vaticano","https://encrypted-tbn0.gstatic.com/images?q=tbn:ANd9GcRzmxhJVhiU9fUSkMdiO979mIyBw67wmImWyEDfG3mDR2j6wC2gpSQIYJRCa5w&amp;s","Católicos de la comunidad LGTBIQ realizaron el primer gran peregrinaje al Vaticano en el marco del Jubileo. Una delegación de la comunidad LGTBIQ llegó al Vaticano para expresar su fe y solicitar un trato más inclusivo por parte de la iglesia católica. La peregrinación fue vista como un paso importante hacia la aceptación y el reconocimiento de la diversidad dentro de la iglesia.","Católicos de la comunidad LGTBIQ realizaron el primer gran peregrinaje al Vaticano en el marco del Jubileo. Una delegación de la comunidad LGTBIQ llegó al Vaticano para expresar su fe y solicitar un trato más inclusivo por parte de la iglesia católica. La peregrinación fue vista como un paso importante hacia la aceptación y el reconocimiento de la diversidad dentro de la iglesia.",""
"09/07/2025 16:00:08","https://infobae.com/cultura/2025/09/07/murio-gustavo-torner-maestro-de-la-abstraccion-espanola/","Murió Gustavo Torner, maestro de la abstracción española","Murió Gustavo Torner, maestro de la abstracción española","https://encrypted-tbn0.gstatic.com/images?q=tbn:ANd9GcQNBx72EYrf_r82mp1Mo5Q1xhXtr4O7F10-jTntpwiij_KrKZXkK7VnNUpUsg&amp;s","El reconocido artista español Gustavo Torner falleció a los 92 años. Conocido por ser un maestro de la abstracción, Torner dejó un legado importante en la escena artística de España. Su obra ha sido valorada y admirada tanto a nivel nacional como internacional.","El reconocido artista español Gustavo Torner falleció a los 92 años. Conocido por ser un maestro de la abstracción, Torner dejó un legado importante en la escena artística de España. Su obra ha sido valorada y admirada tanto a nivel nacional como internacional.",""
"09/07/2025 16:00:08","https://infobae.com/america/mundo/2025/09/05/la-union-europea-ratifico-su-decision-de-poner-fin-a-las-importaciones-de-petroleo-ruso-para-2028/","La Unión Europea ratificó su decisión de poner fin a las importaciones de petróleo ruso para 2028","La Unión Europea ratificó su decisión de poner fin a las importaciones de petróleo ruso para 2028","https://encrypted-tbn0.gstatic.com/images?q=tbn:ANd9GcRnIDmQlk2xFAeoNlMuQ_PWbm6xiTu4Io_am68gRqPr2aDuz9aip4sv_z3DBQ&amp;s","La Unión Europea confirmó su decisión de dejar de importar petróleo de Rusia para el año 2028. Esta medida busca reducir la dependencia energética del bloque de Moscú y fortalecer su seguridad energética.","La Unión Europea confirmó su decisión de dejar de importar petróleo de Rusia para el año 2028. Esta medida busca reducir la dependencia energética del bloque de Moscú y fortalecer su seguridad energética.",""
"09/07/2025 16:00:08","https://infobae.com/deportes/2025/09/06/debuto-en-la-ufc-por-una-baja-de-ultimo-momento-termino-en-silla-de-ruedas-y-lo-apodaron-el-peor-peleador-asi-quedo-su-pierna/","Debutó en la UFC por una baja de último momento, terminó en silla de ruedas y lo apodaron el “peor peleador”","""Debutó en la UFC por una baja de último momento, terminó en silla de ruedas y lo apodaron el peor peleador: así quedó su pierna""","https://encrypted-tbn0.gstatic.com/images?q=tbn:ANd9GcTLAAS-GcAM4MxsKRvXGQ0-gJ6l5TqKe0fEgG8pT_om93kFBST8ZZWyYUwRInc&amp;s","Un peleador debutó en la UFC como reemplazo de último momento y terminó en silla de ruedas debido a una grave lesión en su pierna. A raíz de este incidente, fue apodado como ""el peor peleador"".","Un peleador debutó en la UFC como reemplazo de último momento y terminó en silla de ruedas debido a una grave lesión en su pierna. A raíz de este incidente, fue apodado como ""el peor peleador"".",""
"09/07/2025 16:00:08","https://infobae.com/salud/2025/09/04/la-evolucion-de-la-dieta-ideal-que-se-consideraba-saludable-hace-50-anos-y-que-se-recomienda-hoy/","La evolución de la dieta ideal: qué se consideraba saludable hace 50 años y qué se recomienda hoy","La evolución de la dieta ideal: la que se consideraba saludable hace 50 años y la que se recomienda hoy","https://encrypted-tbn0.gstatic.com/images?q=tbn:ANd9GcSfl7ZiwPi7OS-U_k0Gdj-FKffFMS56TCqEWK638m_9sV_O8Xwo090wyH3ZRts&amp;s","La evolución de la dieta ideal considerada saludable ha cambiado en los últimos 50 años. Antes se creía que una dieta baja en grasas y alta en carbohidratos era la mejor opción, pero ahora se recomienda una dieta equilibrada que incluya grasas saludables, proteínas magras y carbohidratos complejos. La clave está en consumir alimentos frescos y evitar los ultraprocesados.","La evolución de la dieta ideal considerada saludable ha cambiado en los últimos 50 años. Antes se creía que una dieta baja en grasas y alta en carbohidratos era la mejor opción, pero ahora se recomienda una dieta equilibrada que incluya grasas saludables, proteínas magras y carbohidratos complejos. La clave está en consumir alimentos frescos y evitar los ultraprocesados.",""
"09/07/2025 16:00:08","https://infobae.com/america/mundo/2025/09/07/volodimir-zelensky-pidio-a-eeuu-imponer-nuevas-sanciones-a-rusia-tras-la-oleada-de-bombardeos-contra-ucrania/","Volodimir Zelensky pidió a EEUU imponer nuevas sanciones a Rusia tras la oleada de bombardeos contra Ucrania","Volodimir Zelensky pidió a EE.UU imponer nuevas sanciones a Rusia tras la oleada de bombardeos contra Ucrania","https://encrypted-tbn0.gstatic.com/images?q=tbn:ANd9GcQteKNeHCZaY-bYuWDVEMLfVSzyO7KNKurdOLSIfkf73dw_3FRDMU-W2Y8uL10&amp;s","El presidente de Ucrania, Volodimir Zelensky, ha solicitado a Estados Unidos imponer nuevas sanciones a Rusia. Esta petición se da luego de una oleada de bombardeos contra Ucrania.","El presidente de Ucrania, Volodimir Zelensky, ha solicitado a Estados Unidos imponer nuevas sanciones a Rusia. Esta petición se da luego de una oleada de bombardeos contra Ucrania.",""
