"FechayHora","LinkOrigen","TituloOrigen","Titulo","Imagen","Intro","Noticia","Datos"
"09/07/2025 16:00:08","https://infobae.com/tendencias/2025/09/06/dia-mundial-de-la-bacon-cuatro-recetas-para-disfrutar-este-clasico-de-la-escena-culinaria-global/","Día Mundial de la Bacon: cuatro recetas para disfrutar este clásico de la escena culinaria global","Día mundial de la bacon: Cuatro recetas para disfrutar este clásico de la escena culinaria global","https://encrypted-tbn0.gstatic.com/images?q=tbn:ANd9GcRfGGP0WOKvSJEwQecC-5sw1BaVnVVH0vvP6Ep7vPIoRkgS8CG0nTFCh7uW-A&amp;s","El Día Mundial del Bacon se celebra con cuatro recetas para disfrutar este clásico de la escena culinaria global. Las recetas incluyen opciones para todos los gustos, desde sándwiches hasta platos más elaborados como macarrones con queso y bacon. Un día especial para los amantes de esta delicia gastronómica.","El Día Mundial del Bacon se celebra con cuatro recetas para disfrutar este clásico de la escena culinaria global. Las recetas incluyen opciones para todos los gustos, desde sándwiches hasta platos más elaborados como macarrones con queso y bacon. Un día especial para los amantes de esta delicia gastronómica.",""
"09/07/2025 16:00:08","https://infobae.com/america/mundo/2025/09/07/rusia-lanzo-un-ataque-con-drones-y-misiles-en-kiev-hay-al-menos-dos-muertos-y-18-de-personas-heridas/","Rusia lanzó un ataque masivo con más de 800 drones y 13 misiles contra Ucrania: al menos dos muertos y decenas de heridos","Rusia lanzó un ataque con drones y misiles en Kiev: hay al menos dos muertos y 18 personas heridas","https://encrypted-tbn0.gstatic.com/images?q=tbn:ANd9GcQYsclWmdX0Ud8-BCwyAkEFZmYz1H363WN0Z4UmKGAB9YRrCi7QXRDEbgpQpd8&amp;s","En un ataque con drones y misiles lanzado por Rusia en Kiev, al menos dos personas han muerto y 18 han resultado heridas. La agresión ha generado preocupación y condena por parte de la comunidad internacional.","En un ataque con drones y misiles lanzado por Rusia en Kiev, al menos dos personas han muerto y 18 han resultado heridas. La agresión ha generado preocupación y condena por parte de la comunidad internacional.",""
"09/07/2025 16:00:08","https://infobae.com/salud/2025/09/05/que-pasa-si-como-los-hilitos-blancos-de-la-banana/","¿Qué pasa si como los “hilitos blancos” de la banana?","Qué pasa si como los hilitos blancos de la banana","https://encrypted-tbn0.gstatic.com/images?q=tbn:ANd9GcRsY7a8Kp01cA8kdOBvN2O9XK2dVF12bW4lBxH7jEhKkJAWQT6vi012Vc8orQ&amp;s","Un artículo reciente explora qué sucede si se consume los ""hilitos blancos"" de la banana. Estas fibras son conocidas como floema y no solo son seguras para comer, sino que también tienen beneficios para la salud, como la regulación del colesterol y la prevención de enfermedades cardiovasculares. Sin embargo, se aconseja consumirlas con moderación para evitar molestias digestivas.","Un artículo reciente explora qué sucede si se consume los ""hilitos blancos"" de la banana. Estas fibras son conocidas como floema y no solo son seguras para comer, sino que también tienen beneficios para la salud, como la regulación del colesterol y la prevención de enfermedades cardiovasculares. Sin embargo, se aconseja consumirlas con moderación para evitar molestias digestivas.",""
"09/07/2025 16:00:08","https://infobae.com/america/mundo/2025/09/07/el-papa-leon-xiv-canonizara-este-domingo-a-carlo-acutis-el-primer-santo-de-la-generacion-millennial/","El papa León XIV canonizó a Carlo Acutis, el primer santo de la generación millennial","El Papa León XIV canonizará este domingo a Carlo Acutis, el primer santo de la generación millennial.","https://encrypted-tbn0.gstatic.com/images?q=tbn:ANd9GcRMkMx1XSGWIjPoMFRAdoRQWJmh4M_FNCIEArPybIMVXnRnZmPZFfI99dnCFJk&amp;s","El Papa León XIV canonizará este domingo a Carlo Acutis, el primer santo de la generación millennial. Carlo Acutis fue un joven italiano fallecido a los 15 años en 2006, reconocido por su devoción a la Eucaristía y por difundir el mensaje de que ""todos nacemos originales, pero muchos mueren como fotocopias"".","El Papa León XIV canonizará este domingo a Carlo Acutis, el primer santo de la generación millennial. Carlo Acutis fue un joven italiano fallecido a los 15 años en 2006, reconocido por su devoción a la Eucaristía y por difundir el mensaje de que ""todos nacemos originales, pero muchos mueren como fotocopias"".",""
"09/07/2025 16:00:08","https://infobae.com/deportes/2025/09/07/la-polemica-orden-de-mclaren-en-medio-de-la-pelea-por-el-titulo-de-la-f1-entre-sus-pilotos-que-genero-la-burla-de-verstappen/","La polémica orden de McLaren en medio de la pelea de sus pilotos por el título de la F1 que generó la burla de Verstappen","La polémica orden de McLaren en medio de la pelea por el título de la F1 entre sus pilotos que generó la burla de Verstappen","https://encrypted-tbn0.gstatic.com/images?q=tbn:ANd9GcTv-KCKy6zIyXiPCr0KijbH3Gcm1s-xLLidtqBSLsl-mdRys_he4SEpK6cxtVs&amp;s","El equipo de Fórmula 1 McLaren emitió una polémica orden durante la última carrera, afectando la lucha por el título entre sus pilotos. La decisión generó burlas por parte de Max Verstappen, rival de la escudería, y sus seguidores.","El equipo de Fórmula 1 McLaren emitió una polémica orden durante la última carrera, afectando la lucha por el título entre sus pilotos. La decisión generó burlas por parte de Max Verstappen, rival de la escudería, y sus seguidores.",""
"09/07/2025 16:00:08","https://infobae.com/america/ciencia-america/2025/09/07/luna-de-sangre-2025-donde-es-posible-observar-el-eclipse-lunar-total-de-septiembre/","Luna de Sangre 2025: dónde es posible observar el eclipse lunar total de septiembre","Luna de sangre 2025: dónde es posible observar el eclipse lunar total de septiembre","https://encrypted-tbn0.gstatic.com/images?q=tbn:ANd9GcTD_umz2iFJQhUiE0_0Ro_9ZamtMrk_gZjdWtmAN1zrB7y_SCNrb1mqpe16wQ4&amp;s","Se aproxima un eclipse lunar total que podrá observarse en diferentes partes del mundo el próximo mes de septiembre. Este fenómeno se conoce como ""Luna de Sangre"" y podrá ser apreciado en su totalidad en regiones como África, Europa, América del Sur, Australia y Asia. Además, se espera que sea uno de los eventos astronómicos más destacados del año.","Se aproxima un eclipse lunar total que podrá observarse en diferentes partes del mundo el próximo mes de septiembre. Este fenómeno se conoce como ""Luna de Sangre"" y podrá ser apreciado en su totalidad en regiones como África, Europa, América del Sur, Australia y Asia. Además, se espera que sea uno de los eventos astronómicos más destacados del año.",""
"09/07/2025 16:00:08","https://infobae.com/deportes/2025/09/07/carlos-alcaraz-y-jannik-sinner-se-enfrentan-en-la-final-del-us-open/","Carlos Alcaraz y Jannik Sinner se enfrentan en la final del US Open","Carlos Alcaraz y Jannik Sinner se enfrentan en la final del US Open","https://encrypted-tbn0.gstatic.com/images?q=tbn:ANd9GcR4XfLDoio0PxSirn3QpER88f0sU7BrTDlQpvldUFe8YxPMwRkCWdUC4dXN4A&amp;s","En la final del Abierto de Estados Unidos, Carlos Alcaraz y Jannik Sinner se enfrentarán. Ambos tenistas han tenido un desempeño destacado en el torneo y se espera un emocionante duelo entre ellos.","En la final del Abierto de Estados Unidos, Carlos Alcaraz y Jannik Sinner se enfrentarán. Ambos tenistas han tenido un desempeño destacado en el torneo y se espera un emocionante duelo entre ellos.",""
"09/07/2025 16:00:08","https://infobae.com/venezuela/2025/09/07/la-dictadura-de-maduro-secuestro-a-cuatro-miembros-de-una-familia-venezolana-incluida-una-nina-de-2-anos/","La dictadura de Maduro secuestró a cuatro miembros de una familia venezolana, incluida una niña de 2 años","","https://encrypted-tbn0.gstatic.com/images?q=tbn:ANd9GcSktrK1MOX5_916FCmkxOUFykZcF7XO-jJQHHUNWt7c-9nBNEFKbC2dw84FjPM&amp;s","","",""
"09/07/2025 16:00:08","https://infobae.com/america/mundo/2025/09/07/nuevo-golpe-de-ucrania-a-la-infraestructura-energetica-de-rusia-destruyo-una-refineria-y-paralizo-un-oleoducto-estrategico/","Nuevo golpe de Ucrania a la infraestructura energética de Rusia: destruyó una refinería y paralizó un oleoducto estratégico","Nuevo golpe de Ucrania a la infraestructura energética de Rusia: destruyó una refinería y paralizó un oleoducto estratégico","https://encrypted-tbn0.gstatic.com/images?q=tbn:ANd9GcSc7qYiStBlPtdwV3eztw0QdLBywgCvp0gM-7dSomDA2F4zxsAF48E5npbBzw&amp;s","Ucrania atacó la infraestructura energética de Rusia destruyendo una refinería y paralizando un oleoducto estratégico. Este hecho ha aumentado las tensiones entre ambos países y ha generado preocupación sobre el suministro de energía en la región.","Ucrania atacó la infraestructura energética de Rusia destruyendo una refinería y paralizando un oleoducto estratégico. Este hecho ha aumentado las tensiones entre ambos países y ha generado preocupación sobre el suministro de energía en la región.",""
"09/07/2025 16:00:08","https://infobae.com/america/mundo/2025/09/06/emmanuel-macron-y-narendra-modi-coincidieron-en-la-importancia-de-alcanzar-una-paz-justa-y-duradera-en-ucrania/","Macron y Narendra Modi coincidieron en la importancia de alcanzar “una paz justa y duradera en Ucrania”","Emmanuel Macron y Narendra Modi coincidieron en la importancia de alcanzar una paz justa y duradera en Ucrania","https://encrypted-tbn0.gstatic.com/images?q=tbn:ANd9GcRycCf9wENHfHSMlH0JRrWhCBoDwk9_dFBzUQxXa27KAQHSjYJuoBuM7my-Ddw&amp;s","Emmanuel Macron y Narendra Modi coincidieron en la importancia de alcanzar una paz justa y duradera en Ucrania durante una reunión en la que discutieron sobre la crisis en el país europeo. Macron destacó la necesidad de un diálogo constructivo y la importancia de encontrar soluciones pacíficas a través de la vía diplomática, mientras que Modi expresó su apoyo a los esfuerzos de mediación en búsqueda de una paz sostenible en la región.","Emmanuel Macron y Narendra Modi coincidieron en la importancia de alcanzar una paz justa y duradera en Ucrania durante una reunión en la que discutieron sobre la crisis en el país europeo. Macron destacó la necesidad de un diálogo constructivo y la importancia de encontrar soluciones pacíficas a través de la vía diplomática, mientras que Modi expresó su apoyo a los esfuerzos de mediación en búsqueda de una paz sostenible en la región.",""
"09/07/2025 16:00:08","https://infobae.com/america/mundo/2025/09/06/el-ejercito-israeli-pidio-la-evacuacion-de-ciudad-de-gaza-antes-de-la-anunciada-ofensiva-terrestre/","El Ejército israelí pidió la evacuación de Ciudad de Gaza antes de la anunciada ofensiva terrestre","El Ejército israelí pidió la evacuación de Ciudad de Gaza antes de la anunciada ofensiva terrestre","https://encrypted-tbn0.gstatic.com/images?q=tbn:ANd9GcQBla0Hpl5ii8djmvvheBn7cv7ub2WkBh7UPP6zuunhhZNA2D4ET4sMQ4Bk1w&amp;s","El ejército israelí solicitó la evacuación de la ciudad de Gaza antes de lanzar una ofensiva terrestre. Esta petición se da en medio de la escalada de violencia en la región, con bombardeos continuos de ambos lados. Se espera que la situación se agrave en los próximos días.","El ejército israelí solicitó la evacuación de la ciudad de Gaza antes de lanzar una ofensiva terrestre. Esta petición se da en medio de la escalada de violencia en la región, con bombardeos continuos de ambos lados. Se espera que la situación se agrave en los próximos días.",""
"09/07/2025 16:00:08","https://infobae.com/deportes/2025/09/06/el-planteo-de-lautaro-martinez-antes-de-la-gala-del-balon-de-oro-estoy-entre-los-mejores-5-delanteros-del-mundo/","El planteo de Lautaro Martínez antes de la gala del Balón de Oro: “Estoy entre los mejores cinco delanteros”","El planteo de Lautaro Martínez antes de la gala del Balón de Oro: ""Estoy entre los mejores 5 delanteros del mundo""","https://encrypted-tbn0.gstatic.com/images?q=tbn:ANd9GcS7gXrnwjiZv243lWGcBx7I7Zjqac_Ea8GXxjtmgfGg9_125ZHBa1iyYMAtHQ&amp;s","El delantero argentino Lautaro Martínez expresó su confianza al afirmar que se considera uno de los cinco mejores delanteros del mundo. Sus declaraciones se dieron antes de la Gala del Balón de Oro.","El delantero argentino Lautaro Martínez expresó su confianza al afirmar que se considera uno de los cinco mejores delanteros del mundo. Sus declaraciones se dieron antes de la Gala del Balón de Oro.",""
"09/07/2025 16:00:08","https://infobae.com/america/mundo/2025/09/06/el-principe-hisahito-alcanzo-la-mayoria-de-edad-y-reavivo-el-debate-sobre-el-futuro-de-la-sucesion-en-la-dinastia-imperial-japonesa/","El príncipe Hisahito alcanzó la mayoría de edad y reavivó el debate sobre el futuro de la sucesión en la dinastía imperial japonesa","El príncipe Hisahito alcanzó la mayoría de edad y reavivó el debate sobre el futuro de la sucesión en la dinastía imperial japonesa","https://encrypted-tbn0.gstatic.com/images?q=tbn:ANd9GcQcBC0N3R0SBurJPdKpFp8KK7rIqS40qnq9J-0eLni5RqLNM683hIhv_6vSTQ&amp;s","El príncipe Hisahito alcanzó la mayoría de edad en la familia imperial japonesa, lo que ha reavivado el debate sobre la sucesión al trono. Hisahito es el único varón en la línea de sucesión, ya que las leyes actuales no permiten que las mujeres gobiernen en la familia imperial. Existen propuestas para cambiar esta regla y permitir que las mujeres también puedan ascender al trono en Japón.","El príncipe Hisahito alcanzó la mayoría de edad en la familia imperial japonesa, lo que ha reavivado el debate sobre la sucesión al trono. Hisahito es el único varón en la línea de sucesión, ya que las leyes actuales no permiten que las mujeres gobiernen en la familia imperial. Existen propuestas para cambiar esta regla y permitir que las mujeres también puedan ascender al trono en Japón.",""
"09/07/2025 16:00:08","https://infobae.com/venezuela/2025/09/07/la-hija-de-edmundo-gonzalez-urrutia-reclamo-publicamente-informacion-y-garantias-sobre-el-paradero-de-su-esposo-que-tras-242-dias-preso/","La hija de Edmundo González Urrutia reclamó públicamente información y garantías sobre el paradero de su esposo tras 242 días preso","La hija de Edmundo González Urrutia reclamó información y garantías sobre el paradero de su esposo, que tras 242 días preso","https://encrypted-tbn0.gstatic.com/images?q=tbn:ANd9GcTFt9jKMPfLpM17kuDSFSPsgjaP2U19UZhrg1GJWANaMiPFZHin3TCMO7_LZQE&amp;s","La hija de Edmundo González Urrutia hizo una solicitud pública de información y garantías sobre el paradero de su esposo, quien lleva 242 días detenido. La familia está preocupada por la falta de detalles acerca de la situación de su familiar.","La hija de Edmundo González Urrutia hizo una solicitud pública de información y garantías sobre el paradero de su esposo, quien lleva 242 días detenido. La familia está preocupada por la falta de detalles acerca de la situación de su familiar.",""
"09/07/2025 16:00:08","https://infobae.com/deportes/2025/09/05/luis-enrique-sufrio-un-accidente-tras-caerse-de-una-bicicleta-y-fue-hospitalizado-el-comunicado-del-psg/","Luis Enrique sufrió un accidente tras caerse de una bicicleta y fue hospitalizado: el comunicado del PSG","Luis Enrique sufrió un accidente tras caerse de una bicicleta y fue hospitalizado: el comunicado del PSG.","https://encrypted-tbn0.gstatic.com/images?q=tbn:ANd9GcSpOeV-TpHr0fcZycKHI79UEXbxxvD_IYucvZdsG0fsRuQ9KxQiXjkVurbjnNk&amp;s","El entrenador del Paris Saint-Germain, Luis Enrique, sufrió un accidente al caer de una bicicleta y tuvo que ser hospitalizado. El club emitió un comunicado confirmando el incidente y mencionando que está recibiendo atención médica. No se especificaron más detalles sobre su estado de salud.","El entrenador del Paris Saint-Germain, Luis Enrique, sufrió un accidente al caer de una bicicleta y tuvo que ser hospitalizado. El club emitió un comunicado confirmando el incidente y mencionando que está recibiendo atención médica. No se especificaron más detalles sobre su estado de salud.",""
"09/07/2025 16:00:08","https://infobae.com/america/mundo/2025/09/04/el-ejercito-israeli-aseguro-que-ya-controla-el-40-de-la-ciudad-de-gaza/","El ejército israelí aseguró que ya controla el 40% de la ciudad de Gaza","El ejército israelí aseguró que ya controla el 40% de la ciudad de Gaza","https://encrypted-tbn0.gstatic.com/images?q=tbn:ANd9GcTK9YFiCOGIHnPdxuVvAlk7Ti20K4mPjrN_C3-zw8HXqWIAKdNBgCsrvmG-GMI&amp;s","El Ejército Israelí informó que ha tomado el control del 40% de la ciudad de Gaza en medio de los enfrentamientos con los grupos armados. La ofensiva militar ha dejado al menos 34 muertos y decenas de heridos, mientras se intensifican los bombardeos en la zona.","El Ejército Israelí informó que ha tomado el control del 40% de la ciudad de Gaza en medio de los enfrentamientos con los grupos armados. La ofensiva militar ha dejado al menos 34 muertos y decenas de heridos, mientras se intensifican los bombardeos en la zona.",""
"09/07/2025 16:00:08","https://infobae.com/salud/ciencia/2025/09/04/cuales-son-los-tipos-de-edulcorantes-asociados-al-envejecimiento-cerebral/","Cuáles son los tipos de edulcorantes asociados al envejecimiento cerebral","Cuáles son los tipos de edulcorantes asociados al envejecimiento cerebral","https://encrypted-tbn0.gstatic.com/images?q=tbn:ANd9GcQGlOY_SvTLdTHRsxJtJkij_00gD9oieD5uKag3ooZBFumLDlTqcJVdE8snYw&amp;s","La noticia habla sobre los edulcorantes artificiales y su asociación con el envejecimiento cerebral. Según un estudio, el consumo de ciertos edulcorantes como el aspartame y la sacarina podrían tener efectos negativos en la salud del cerebro, especialmente en la capacidad cognitiva y la memoria. Se recomienda limitar el consumo de estos edulcorantes y optar por alternativas más naturales como la stevia.","La noticia habla sobre los edulcorantes artificiales y su asociación con el envejecimiento cerebral. Según un estudio, el consumo de ciertos edulcorantes como el aspartame y la sacarina podrían tener efectos negativos en la salud del cerebro, especialmente en la capacidad cognitiva y la memoria. Se recomienda limitar el consumo de estos edulcorantes y optar por alternativas más naturales como la stevia.",""
"09/07/2025 16:00:08","https://infobae.com/cultura/2025/09/05/david-bowie-sorprende-desde-el-mas-alla-con-un-musical-inedito-ambientado-en-el-siglo-xviii/","David Bowie sorprende desde el más allá con un musical inédito ambientado en el siglo XVIII","David Bowie sorprende desde el más allá con un musical inédito ambientado en el siglo XVIII","https://encrypted-tbn0.gstatic.com/images?q=tbn:ANd9GcRO2uegDOKJT0f4OW-PQzTsZQ-0I_DdzFdf0V68_OMlCVcFHxbFNDevahTta44&amp;s","El fallecido músico David Bowie sorprende desde el más allá con un musical inédito ambientado en el siglo XVIII. La obra, titulada ""Lazarus: The Musical"", se presentará en el King's Theatre de Edimburgo y contará con canciones originales del artista. El musical se centra en la historia de un hombre que busca la redención en medio de un ambiente oscuro y misterioso.","El fallecido músico David Bowie sorprende desde el más allá con un musical inédito ambientado en el siglo XVIII. La obra, titulada ""Lazarus: The Musical"", se presentará en el King's Theatre de Edimburgo y contará con canciones originales del artista. El musical se centra en la historia de un hombre que busca la redención en medio de un ambiente oscuro y misterioso.",""
"09/07/2025 16:00:08","https://infobae.com/entretenimiento/2025/09/04/zoe-kravitz-y-harry-styles-son-pareja-esto-revelo-una-fuente-cercana-a-las-celebridades/","¿Zoë Kravitz y Harry Styles son pareja? Esto reveló una fuente cercana a las celebridades","Zoe Kravitz y Harry Styles son pareja: esto reveló una fuente cercana a las celebridades","https://encrypted-tbn0.gstatic.com/images?q=tbn:ANd9GcSs8lkhsXhkQrL0qBly_N0Df5WJLMm1r9i3uZMdcoQ174Ox0PJQcOhX9vqTFWA&amp;s","Zoe Kravitz y Harry Styles son pareja, según reveló una fuente cercana a las celebridades. La noticia ha causado revuelo en redes sociales y ha generado gran expectativa entre los fans de ambos artistas.","Zoe Kravitz y Harry Styles son pareja, según reveló una fuente cercana a las celebridades. La noticia ha causado revuelo en redes sociales y ha generado gran expectativa entre los fans de ambos artistas.",""
"09/07/2025 16:00:08","https://infobae.com/america/america-latina/2025/09/05/un-tribunal-de-bolivia-ordeno-la-liberacion-de-jeanine-anez-por-la-violencia-en-sacaba-en-2019/","Un tribunal de Bolivia ordenó la liberación de Jeanine Áñez por el caso de la violencia en Sacaba en 2019","Un tribunal de Bolivia ordenó la liberación de Jeanine Añez por la violencia en Sacaba en 2019","https://encrypted-tbn0.gstatic.com/images?q=tbn:ANd9GcR5l8lojIY0gtnGOnYYxfHb52cwZSQQP17zZYOf0cuclvTekXU0wltpEM92Jdo&amp;s","Un tribunal en Bolivia ordenó la liberación de Jeanine Añez por su presunta participación en la violencia en Sacaba en 2019.","Un tribunal en Bolivia ordenó la liberación de Jeanine Añez por su presunta participación en la violencia en Sacaba en 2019.",""
"09/07/2025 16:00:08","https://infobae.com/america/mundo/2025/09/06/israel-anuncio-la-destruccion-de-un-rascacielos-en-ciudad-de-gaza-que-era-utilizado-por-el-grupo-terrorista-hamas/","Israel anunció la destrucción de un rascacielos en Ciudad de Gaza que era utilizado por el grupo terrorista Hamas","Israel anunció la destrucción de un rascacielos en Ciudad de Gaza utilizado por grupo terrorista Hamas","https://encrypted-tbn0.gstatic.com/images?q=tbn:ANd9GcR6r4rrpSzj-uJ_LRDobSjzUMYUKZ_uxmDD1LcRz6sKrKtZV3nCPJSlhHSkolo&amp;s","Israel anunció la destrucción de un rascacielos en la ciudad de Gaza que estaba siendo utilizado por el grupo terrorista Hamas. La decisión se tomó como medida de represalia tras el lanzamiento de cohetes desde la franja de Gaza hacia territorio israelí. El edificio albergaba oficinas de medios de comunicación y apartamentos residenciales.","Israel anunció la destrucción de un rascacielos en la ciudad de Gaza que estaba siendo utilizado por el grupo terrorista Hamas. La decisión se tomó como medida de represalia tras el lanzamiento de cohetes desde la franja de Gaza hacia territorio israelí. El edificio albergaba oficinas de medios de comunicación y apartamentos residenciales.",""
"09/07/2025 16:00:08","https://infobae.com/cultura/2025/09/05/los-tesoros-ocultos-de-wayne-shorter-salen-a-la-luz-en-la-biblioteca-para-las-artes-escenicas-de-nueva-york/","Los tesoros ocultos de Wayne Shorter salen a la luz en la Biblioteca para las Artes Escénicas de Nueva York","Los tesoros ocultos de Wayne Shorter salen a la luz en la Biblioteca para las Artes Escénicas de Nueva York.","https://encrypted-tbn0.gstatic.com/images?q=tbn:ANd9GcRPEYEUP9zDnVZrv5szYaqtGdUGafGR9El_WnIxm7r4GCjxPlqvQq5SwgoB_7o&amp;s","En la Biblioteca para las Artes Escénicas de Nueva York se revelaron los tesoros ocultos del reconocido músico Wayne Shorter, incluyendo partituras inéditas, cartas y fotografías. Estos documentos ofrecen una mirada única a la vida y carrera del legendario saxofonista de jazz, mostrando su proceso creativo y la influencia que ha tenido en la música contemporánea. Esta exposición permite a los fanáticos y estudiosos de la música adentrarse en el mundo de Shorter y apreciar su legado musical de una manera más profunda.","En la Biblioteca para las Artes Escénicas de Nueva York se revelaron los tesoros ocultos del reconocido músico Wayne Shorter, incluyendo partituras inéditas, cartas y fotografías. Estos documentos ofrecen una mirada única a la vida y carrera del legendario saxofonista de jazz, mostrando su proceso creativo y la influencia que ha tenido en la música contemporánea. Esta exposición permite a los fanáticos y estudiosos de la música adentrarse en el mundo de Shorter y apreciar su legado musical de una manera más profunda.",""
"09/07/2025 16:00:08","https://infobae.com/america/mundo/2025/09/07/severos-problemas-de-conectividad-en-asia-y-medio-oriente-por-cortes-de-cables-submarinos-en-el-mar-rojo/","Severos problemas de conectividad en Asia y Medio Oriente por cortes de cables submarinos en el Mar Rojo","Severos problemas de conectividad en Asia y Medio Oriente por cortes de cables submarinos en el Mar Rojo","https://encrypted-tbn0.gstatic.com/images?q=tbn:ANd9GcRMLj7MNcVNAe3Vo8Rp0N2fpzACDWuSqn7tHeEz1hIzYAFzB0WhzFGs1s5fQA&amp;s","Se reportan severos problemas de conectividad en Asia y Medio Oriente debido a cortes en cables submarinos en el Mar Rojo. Esta situación ha afectado a varios países de la región, provocando interrupciones en los servicios de internet y telecomunicaciones. Las autoridades trabajan para solucionar el inconveniente lo antes posible.","Se reportan severos problemas de conectividad en Asia y Medio Oriente debido a cortes en cables submarinos en el Mar Rojo. Esta situación ha afectado a varios países de la región, provocando interrupciones en los servicios de internet y telecomunicaciones. Las autoridades trabajan para solucionar el inconveniente lo antes posible.",""
