"FechayHora","LinkOrigen","TituloOrigen","Titulo","Imagen","Intro","Noticia","Datos"
"09/09/2025 18:15:35","https://infobae.com/deportes/2025/09/09/venezuela-y-bolivia-luchan-por-la-plaza-en-el-repechaje-para-ir-al-mundial-la-tabla-de-posiciones-y-todas-las-combinaciones/","Venezuela y Bolivia luchan por la plaza en el repechaje para ir al Mundial: la tabla de posiciones y todas las combinaciones","Venezuela y Bolivia luchan por la plaza en el repechaje para ir al Mundial: la tabla de posiciones y todas las combinaciones.","https://encrypted-tbn0.gstatic.com/images?q=tbn:ANd9GcRRj6o_IjFmtWgAd7u32aGZ2qMMwNHKb54TS-plhr_9c1E6XOebMAdd7K-dnPs&amp;s","Venezuela y Bolivia se enfrentan en un partido crucial para definir quién ocupará el puesto en el repechaje para el Mundial. Ambos equipos se encuentran en la parte baja de la tabla de posiciones y necesitan ganar para tener una oportunidad de clasificar. Las combinaciones de resultados son clave para determinar quién avanzará a la siguiente etapa de la competencia.","Venezuela y Bolivia se enfrentan en un partido crucial para definir quién ocupará el puesto en el repechaje para el Mundial. Ambos equipos se encuentran en la parte baja de la tabla de posiciones y necesitan ganar para tener una oportunidad de clasificar. Las combinaciones de resultados son clave para determinar quién avanzará a la siguiente etapa de la competencia.",""
"09/09/2025 18:15:35","https://infobae.com/estados-unidos/2025/09/09/donald-trump-no-apoyo-el-ataque-de-israel-contra-doha-qatar-es-un-aliado-y-amigo-de-estados-unidos/","Donald Trump no apoya el ataque de Israel contra Doha: “Qatar es un aliado y amigo de Estados Unidos”","Donald Trump no apoyó el ataque de Israel contra Doha: ""Qatar es un aliado y amigo de Estados Unidos""","https://encrypted-tbn0.gstatic.com/images?q=tbn:ANd9GcTS4RWyeAukPml_U0n7w5lJ0xP1MxOydjgGnRwD--m0ifonKGHtr0oKKovjdw&amp;s","El expresidente de Estados Unidos, Donald Trump, declaró que no apoyaba el ataque de Israel contra Doha, Qatar, argumentando que considera a Qatar como un aliado y amigo de su país. Trump expresó su preocupación por la situación y destacó la importancia de mantener una buena relación con Qatar.","El expresidente de Estados Unidos, Donald Trump, declaró que no apoyaba el ataque de Israel contra Doha, Qatar, argumentando que considera a Qatar como un aliado y amigo de su país. Trump expresó su preocupación por la situación y destacó la importancia de mantener una buena relación con Qatar.",""
"09/09/2025 18:15:35","https://infobae.com/deportes/2025/09/08/el-video-del-fuerte-comunicado-del-plantel-de-independiente-tras-la-descalificacion-de-la-copa-sudamericana-dolor-e-injusticia/","El video del fuerte comunicado del plantel de Independiente tras la descalificación de la Copa Sudamericana: “Dolor e injusticia”","El fuerte comunicado del plantel de Independiente tras la descalificación de la Copa Sudamericana: dolor e injusticia","https://encrypted-tbn0.gstatic.com/images?q=tbn:ANd9GcRSQSJ11I1NMT_FY-YPGjbRnG1ykYL0N36iIavs-XivDA6JABlOWEJP8HDE8I8&amp;s","El plantel de Independiente emitió un comunicado en respuesta a su descalificación de la Copa Sudamericana, expresando su dolor e indignación por lo que consideran una injusticia. El equipo mostró su desacuerdo con la decisión y defendió su integridad y la transparencia de su proceso deportivo.","El plantel de Independiente emitió un comunicado en respuesta a su descalificación de la Copa Sudamericana, expresando su dolor e indignación por lo que consideran una injusticia. El equipo mostró su desacuerdo con la decisión y defendió su integridad y la transparencia de su proceso deportivo.",""
"09/09/2025 18:15:35","https://infobae.com/estados-unidos/2025/09/08/operativos-contra-los-carteles-en-el-caribe-el-pentagono-prepara-el-despliegue-de-cazas-f-35-en-puerto-rico/","Operativos contra los cárteles en el Caribe: el Pentágono prepara el despliegue de cazas F-35 en Puerto Rico","Operativos contra los carteles en el Caribe: el Pentágono prepara el despliegue de cazas F-35 en Puerto Rico","https://encrypted-tbn0.gstatic.com/images?q=tbn:ANd9GcRDaTb07kQ_ROG7tikHd5m8P6hex60UkKEjQVZ4fhTw2wYWWC-O8oPRVkP2K-Q&amp;s","El Pentágono planea desplegar cazas F-35 en Puerto Rico como parte de operativos contra carteles en el Caribe.Esta medida se toma en medio de la creciente presencia de carteles de droga en la región, con el objetivo de fortalecer la lucha contra el narcotráfico en el área.","El Pentágono planea desplegar cazas F-35 en Puerto Rico como parte de operativos contra carteles en el Caribe.Esta medida se toma en medio de la creciente presencia de carteles de droga en la región, con el objetivo de fortalecer la lucha contra el narcotráfico en el área.",""
"09/09/2025 18:15:35","https://infobae.com/america/mundo/2025/09/08/quienes-eran-las-victimas-del-atentado-terrorista-en-un-estacion-autobus-de-jerusalen/","Quiénes eran las víctimas del atentado terrorista en una estación de autobuses de Jerusalén","Quiénes eran las víctimas del atentado terrorista en un estación de autobús de Jerusalén","https://encrypted-tbn0.gstatic.com/images?q=tbn:ANd9GcRVUKRKlR6aJG0EwxQax-1i2wsWPvwRck37i3n2Vxh9rsw9YCzAfGHjv7Y8f7g&amp;s","En un atentado terrorista en una estación de autobús en Jerusalén, Israel, varias personas resultaron muertas o heridas. Entre las víctimas se encontraban ciudadanos israelíes y extranjeros. El ataque generó conmoción en la región y se investigan las circunstancias del mismo.","En un atentado terrorista en una estación de autobús en Jerusalén, Israel, varias personas resultaron muertas o heridas. Entre las víctimas se encontraban ciudadanos israelíes y extranjeros. El ataque generó conmoción en la región y se investigan las circunstancias del mismo.",""
"09/09/2025 18:15:35","https://infobae.com/economia/2025/09/08/a-la-espera-del-iphone-17-liviano-que-podria-pasar-con-el-precio-de-las-acciones-de-apple-y-su-valor-de-mercado/","A la espera del iPhone 17 “liviano”: ¿qué podría pasar con el precio de las acciones de Apple y su valor de mercado?","A la espera del iPhone 17 liviano: ¿qué podría pasar con el precio de las acciones de Apple y su valor de mercado?","https://encrypted-tbn0.gstatic.com/images?q=tbn:ANd9GcRhga3cygFqwcCoIlR57uszV2I5kF0WoFDjHtFKyR74cTn8YYMkT2XWSfvZFg&amp;s","Apple se prepara para el lanzamiento del iPhone 17, un dispositivo más liviano y con nuevas funcionalidades. Se espera que este lanzamiento tenga un impacto en el precio de las acciones de la empresa y en su valor de mercado. Los analistas predicen que las acciones de Apple podrían subir en caso de una buena aceptación del nuevo producto, lo que impulsaría su valor en el mercado.","Apple se prepara para el lanzamiento del iPhone 17, un dispositivo más liviano y con nuevas funcionalidades. Se espera que este lanzamiento tenga un impacto en el precio de las acciones de la empresa y en su valor de mercado. Los analistas predicen que las acciones de Apple podrían subir en caso de una buena aceptación del nuevo producto, lo que impulsaría su valor en el mercado.",""
"09/09/2025 18:15:35","https://infobae.com/deportes/2025/09/08/miguel-russo-evoluciona-pero-todavia-no-se-sumo-a-los-entrenamientos-de-boca-los-motivos/","Miguel Russo evoluciona pero todavía no se sumó a los entrenamientos de Boca: los motivos","Miguel Russo evoluciona pero todavía no se sumó a los entrenamientos de Boca: los motivos","https://encrypted-tbn0.gstatic.com/images?q=tbn:ANd9GcS08vLH6vuN3ZaNVPL0sToeqOci7CTC2-POW8wl1LNDO08Nur3Pfh11agzfeKY&amp;s","El técnico de Boca Juniors, Miguel Russo, continúa evolucionando favorablemente en su proceso de recuperación, pero aún no ha podido sumarse a los entrenamientos del equipo por motivos que no han sido especificados.","El técnico de Boca Juniors, Miguel Russo, continúa evolucionando favorablemente en su proceso de recuperación, pero aún no ha podido sumarse a los entrenamientos del equipo por motivos que no han sido especificados.",""
"09/09/2025 18:15:35","https://infobae.com/espana/cultura/2025/09/09/dwayne-johnson-revela-que-su-cambio-de-peso-se-debe-a-otro-papel-que-esta-preparando-tengo-otra-oportunidad-para-transformarme/","Dwayne Johnson explicó el motivo de su cambio físico: “Tengo otra oportunidad para transformarme”","Dwayne Johnson revela que su cambio de peso se debe a otro papel que está preparando: ""Tengo otra oportunidad para transformarme""","https://encrypted-tbn0.gstatic.com/images?q=tbn:ANd9GcR0F5YSTPkM8bsDzza1FwgVQ3ozIGKFMSkCueJkQ1fNBGfAnjoZdU19AmLkTdQ&amp;s","Dwayne Johnson reveló que su cambio de peso se debe a un nuevo papel que está preparando. El actor compartió en redes sociales que está trabajando en un proyecto que le ofrece la oportunidad de transformarse físicamente una vez más. Aunque no reveló detalles específicos sobre el personaje o la producción, dejó en claro que se encuentra comprometido con su preparación para este nuevo desafío.","Dwayne Johnson reveló que su cambio de peso se debe a un nuevo papel que está preparando. El actor compartió en redes sociales que está trabajando en un proyecto que le ofrece la oportunidad de transformarse físicamente una vez más. Aunque no reveló detalles específicos sobre el personaje o la producción, dejó en claro que se encuentra comprometido con su preparación para este nuevo desafío.",""
"09/09/2025 18:15:35","https://infobae.com/deportes/2025/09/05/bayer-leverkusen-echo-a-su-peor-entrenador-despues-de-tres-partidos-y-pagara-una-millonaria-indemnizacion/","Bayer Leverkusen echó a su “peor entrenador” después de tres partidos y pagará una millonaria indemnización","Bayer Leverkusen despide a su peor entrenador tras tres partidos y pagará millonaria indemnización","https://encrypted-tbn0.gstatic.com/images?q=tbn:ANd9GcQLUfW9dCKUKMzFo6j1qmW0gUg-UC50wqHoZOj8sCmXDcmgaa7RmQEB_OorSA&amp;s","El Bayer Leverkusen despidió a su peor entrenador después de tres partidos y deberá pagar una millonaria indemnización. El club alemán decidió prescindir de los servicios del técnico tras los malos resultados obtenidos en el inicio de la temporada.","El Bayer Leverkusen despidió a su peor entrenador después de tres partidos y deberá pagar una millonaria indemnización. El club alemán decidió prescindir de los servicios del técnico tras los malos resultados obtenidos en el inicio de la temporada.",""
"09/09/2025 18:15:35","https://infobae.com/deportes/2025/09/08/el-gesto-en-un-partido-de-beisbol-que-genero-repudio-una-fanatica-se-quedo-con-una-pelota-que-un-padre-le-habia-regalado-a-su-hijo/","Repudio en un partido de béisbol: una fanática se quedó con la pelota que un padre le regalaba a su hijo","El gesto en un partido de béisbol que generó repudio: una fanática se quedó con una pelota que un padre le había regalado a su hijo","https://encrypted-tbn0.gstatic.com/images?q=tbn:ANd9GcQziLwjYl3JlGu3hpHEb3k5Yiv3KCBqmTCWQvfnT6R6kIkE9uBJSOQPZqx8pQ&amp;s","En un partido de béisbol, una fanática se quedó con una pelota que un padre le había regalado a su hijo. El gesto generó repudio por parte de los espectadores y usuarios en las redes sociales. La mujer decidió quedarse con la pelota a pesar de las súplicas del padre para que se la devolviera. La situación fue captada por las cámaras y se viralizó rápidamente en Internet.","En un partido de béisbol, una fanática se quedó con una pelota que un padre le había regalado a su hijo. El gesto generó repudio por parte de los espectadores y usuarios en las redes sociales. La mujer decidió quedarse con la pelota a pesar de las súplicas del padre para que se la devolviera. La situación fue captada por las cámaras y se viralizó rápidamente en Internet.",""
"09/09/2025 18:15:35","https://infobae.com/deportes/2025/09/09/el-lapidario-analisis-de-una-leyenda-de-la-seleccion-alemana-estamos-a-anos-luz-de-poder-hablar-de-ganar-la-copa-del-mundo/","El lapidario análisis de una leyenda de la selección alemana: “Estamos a años luz de poder hablar de ganar la Copa del Mundo”","El lapidario análisis de una leyenda de la selección alemana: estamos a años luz de poder hablar de ganar la Copa del Mundo","https://encrypted-tbn0.gstatic.com/images?q=tbn:ANd9GcTdUrBp0klmGkEyHfrlE-X09st-PU05On5lRFg5CuwVLXQhxEmJIlmtXZo5mv8&amp;s","La leyenda de la selección alemana expresó que el equipo está lejos de poder ganar la Copa del Mundo. Señaló la falta de calidad de los jugadores y la necesidad de cambiar la mentalidad en el fútbol alemán.","La leyenda de la selección alemana expresó que el equipo está lejos de poder ganar la Copa del Mundo. Señaló la falta de calidad de los jugadores y la necesidad de cambiar la mentalidad en el fútbol alemán.",""
"09/09/2025 18:15:35","https://infobae.com/deportes/2025/09/09/venezuela-recibira-a-colombia-con-la-ilusion-de-garantizar-su-lugar-en-el-repechaje-de-las-eliminatorias-hora-tv-y-formaciones/","Venezuela recibirá a Colombia con la ilusión de garantizar su lugar en el repechaje","Venezuela recibirá a Colombia con la ilusión de garantizar su lugar en el repechaje de las eliminatorias: hora, TV y formaciones","https://encrypted-tbn0.gstatic.com/images?q=tbn:ANd9GcSlOIovC2Ct_GSSC6OH_8K3w2U-a-D0JT4hbVLIGQjnqa6sdTGuUHADQgqu5g&amp;s","En un partido crucial para ambos equipos, Venezuela se enfrentará a Colombia con la esperanza de asegurar su lugar en el repechaje de las eliminatorias. El encuentro se llevará a cabo en el Estadio Polideportivo de Pueblo Nuevo, en San Cristóbal. Venezuela buscará sumar puntos para avanzar en su camino hacia el Mundial, mientras que Colombia buscará una victoria que le permita acercarse a la clasificación directa. El partido será transmitido por televisión y ya se conocen las formaciones de ambos equipos.","En un partido crucial para ambos equipos, Venezuela se enfrentará a Colombia con la esperanza de asegurar su lugar en el repechaje de las eliminatorias. El encuentro se llevará a cabo en el Estadio Polideportivo de Pueblo Nuevo, en San Cristóbal. Venezuela buscará sumar puntos para avanzar en su camino hacia el Mundial, mientras que Colombia buscará una victoria que le permita acercarse a la clasificación directa. El partido será transmitido por televisión y ya se conocen las formaciones de ambos equipos.",""
"09/09/2025 18:15:35","https://infobae.com/politica/2025/09/09/axel-kicillof-el-lio-financiero-que-hay-hace-un-tiempo-en-argentina-es-todo-de-milei/","Axel Kicillof: “El lío financiero que hay hace un tiempo en Argentina es todo de Milei”","Axel Kicillof: el lío financiero que hay hace un tiempo en Argentina es todo de Milei","https://encrypted-tbn0.gstatic.com/images?q=tbn:ANd9GcTsSaPkrZN5ADFSWQVXaPV2geVgylL4VOWABbGzJNV2HUnhocZMgMkq1gMk_qA&amp;s","Axel Kicillof se refirió a la situación financiera en Argentina y atribuyó el conflicto a José Luis Espert y su equipo económico. El actual gobernador de la provincia de Buenos Aires mencionó que el desbarajuste económico se debe a las políticas implementadas por Espert y que la responsabilidad de la crisis recae en ellos.","Axel Kicillof se refirió a la situación financiera en Argentina y atribuyó el conflicto a José Luis Espert y su equipo económico. El actual gobernador de la provincia de Buenos Aires mencionó que el desbarajuste económico se debe a las políticas implementadas por Espert y que la responsabilidad de la crisis recae en ellos.",""
"09/09/2025 18:15:35","https://infobae.com/educacion/2025/09/09/carolina-gonzalez-cuando-hablamos-de-transformacion-digital-es-inevitable-hablar-de-educacion/","Carolina González: &quot;Cuando hablamos de transformación digital es inevitable hablar de educación&quot;","Carolina González: cuando hablamos de transformación digital es inevitable hablar de educación.","https://encrypted-tbn0.gstatic.com/images?q=tbn:ANd9GcQoGVFMHPmbXsasqjqQkaFjcVNMeycPWyDTAhbu_Qe_1KAfiGAqQjMcKSqcZWw&amp;s","El artículo hace énfasis en la importancia de la transformación digital en la educación, resaltando la necesidad de adaptar los métodos de enseñanza a las nuevas tecnologías. Carolina González, experta en innovación educativa, enfatiza la importancia de incorporar la digitalización en todos los niveles educativos para preparar a los estudiantes para el futuro. Se destaca la necesidad de integrar herramientas digitales en el aula y capacitar a los docentes en su uso para mejorar la calidad de la educación.","El artículo hace énfasis en la importancia de la transformación digital en la educación, resaltando la necesidad de adaptar los métodos de enseñanza a las nuevas tecnologías. Carolina González, experta en innovación educativa, enfatiza la importancia de incorporar la digitalización en todos los niveles educativos para preparar a los estudiantes para el futuro. Se destaca la necesidad de integrar herramientas digitales en el aula y capacitar a los docentes en su uso para mejorar la calidad de la educación.",""
"09/09/2025 18:15:35","https://infobae.com/deportes/2025/09/09/dolor-en-el-futbol-por-la-muerte-de-carlos-silva-el-ex-arquero-de-boca-juniors-que-fue-ayudante-de-campo-de-menotti-en-rosario-central/","Dolor en el fútbol por la muerte de Carlos Silva, el ex arquero de Boca que fue ayudante de campo de Menotti","Dolor en el fútbol por la muerte de Carlos Silva, el ex arquero de Boca Juniors que fue ayudante de campo de Menotti en Rosario Central","https://encrypted-tbn0.gstatic.com/images?q=tbn:ANd9GcTmOzndGkGZOsIz20UjfVd7lmtxZcJPYiLv51qsPrXdByBPc6LXq2mWufoHplk&amp;s","El ex arquero de Boca Juniors, Carlos Silva, falleció recientemente, causando conmoción en el mundo del fútbol. Silva también se desempeñó como ayudante de campo de Menotti en Rosario Central. Su muerte dejó un profundo dolor en la comunidad futbolística.","El ex arquero de Boca Juniors, Carlos Silva, falleció recientemente, causando conmoción en el mundo del fútbol. Silva también se desempeñó como ayudante de campo de Menotti en Rosario Central. Su muerte dejó un profundo dolor en la comunidad futbolística.",""
"09/09/2025 18:15:35","https://infobae.com/cultura/2025/09/09/eduardo-costantini-distinguido-como-personalidad-emerita-de-la-cultura/","Eduardo Costantini fue distinguido como Personalidad Emérita de la Cultura","Eduardo Costantini distinguido como Personalidad Emérita de la Cultura","https://encrypted-tbn0.gstatic.com/images?q=tbn:ANd9GcRoihp041M65cTYWFv6Ap73xLBQQHdzpdKXlEXpzfoHnZd72L1DJRpHpQIZeA&amp;s","El empresario y coleccionista de arte argentino Eduardo Costantini fue distinguido como Personalidad Emérita de la Cultura. La distinción se realizó en el marco del Día Nacional del Empresario Teatral, en reconocimiento a su trayectoria y contribución al mundo de la cultura. Costantini es conocido por fundar el Museo de Arte Latinoamericano de Buenos Aires (MALBA) y por su pasión por el arte y la creatividad.","El empresario y coleccionista de arte argentino Eduardo Costantini fue distinguido como Personalidad Emérita de la Cultura. La distinción se realizó en el marco del Día Nacional del Empresario Teatral, en reconocimiento a su trayectoria y contribución al mundo de la cultura. Costantini es conocido por fundar el Museo de Arte Latinoamericano de Buenos Aires (MALBA) y por su pasión por el arte y la creatividad.",""
"09/09/2025 18:15:35","https://infobae.com/politica/2025/09/08/los-decanos-de-la-uba-le-pidieron-al-gobierno-que-no-vete-la-ley-de-financiamiento-universitario/","Los decanos de la UBA le pidieron al Gobierno que no vete la ley de financiamiento universitario","Los decanos de la UBA piden al gobierno que no vete la ley de financiamiento universitario.","https://encrypted-tbn0.gstatic.com/images?q=tbn:ANd9GcRWFe2KAnfcUPHDTuYS43A-utnm3q6HlFSjHGJ-6NOFbaRT6NO3Lj5L_QK7N58&amp;s","Los decanos de la Universidad de Buenos Aires solicitaron al gobierno que no vete la ley de financiamiento universitario. Esta ley busca restablecer el financiamiento perdido durante el gobierno anterior y garantizar la continuidad de las actividades académicas. Los decanos expresaron su preocupación por el impacto negativo que tendría un posible veto presidencial en la educación universitaria.","Los decanos de la Universidad de Buenos Aires solicitaron al gobierno que no vete la ley de financiamiento universitario. Esta ley busca restablecer el financiamiento perdido durante el gobierno anterior y garantizar la continuidad de las actividades académicas. Los decanos expresaron su preocupación por el impacto negativo que tendría un posible veto presidencial en la educación universitaria.",""
"09/09/2025 18:15:35","https://infobae.com/america/mundo/2025/09/08/elecciones-en-noruega-los-partidos-de-izquierda-y-los-ecologistas-ganan-por-un-estrecho-margen/","Elecciones en Noruega: los partidos de izquierda y los ecologistas ganan por un estrecho margen","Elecciones en Noruega: Los partidos de izquierda y los ecologistas ganan por un estrecho margen.","https://encrypted-tbn0.gstatic.com/images?q=tbn:ANd9GcRMXyuTw57yCHFSAzioGeoYWHyAS4NHfXAl4NXmr-KFdlIr7QvucbdRHxUXgIs&amp;s","En las elecciones en Noruega, los partidos de izquierda y los ecologistas lograron una victoria por un estrecho margen. El Partido Laborista se convirtió en el más grande en el Parlamento, seguido por el Partido Conservador. Este resultado refleja un cambio en la política del país hacia posturas más progresistas y preocupación por temas ambientales.","En las elecciones en Noruega, los partidos de izquierda y los ecologistas lograron una victoria por un estrecho margen. El Partido Laborista se convirtió en el más grande en el Parlamento, seguido por el Partido Conservador. Este resultado refleja un cambio en la política del país hacia posturas más progresistas y preocupación por temas ambientales.",""
"09/09/2025 18:15:35","https://infobae.com/revista-chacra/2025/09/09/europa-y-el-mercosur-un-poco-mas-cerca/","Europa y el Mercosur, un poco más cerca","Europa y el Mercosur un poco más cerca","https://encrypted-tbn0.gstatic.com/images?q=tbn:ANd9GcQT3EpEGOpNTFtn68Plz9Ce9I1_VeN_lfaqjOVANkpxIEmI-ERSLVPFI_J9Tg&amp;s","Europa y el Mercosur están cerca de llegar a un acuerdo comercial después de varios años de negociaciones. Ambas partes han avanzado en las conversaciones y se espera que pronto se firme un acuerdo que beneficiaría a los sectores económicos de ambas regiones. La Unión Europea es uno de los principales mercados de exportación para el Mercosur, por lo que este acuerdo representaría una gran oportunidad de crecimiento para los países del bloque sudamericano.","Europa y el Mercosur están cerca de llegar a un acuerdo comercial después de varios años de negociaciones. Ambas partes han avanzado en las conversaciones y se espera que pronto se firme un acuerdo que beneficiaría a los sectores económicos de ambas regiones. La Unión Europea es uno de los principales mercados de exportación para el Mercosur, por lo que este acuerdo representaría una gran oportunidad de crecimiento para los países del bloque sudamericano.",""
"09/09/2025 18:15:35","https://infobae.com/economia/2025/09/09/la-argentina-con-la-expectativa-de-empleo-mas-baja-del-mundo-que-sectores-muestran-senales-de-repunte-y-cuales-no/","La Argentina, con la expectativa de empleo más baja del mundo: qué sectores muestran señales de repunte y cuáles no","La Argentina con la expectativa de empleo más baja del mundo: ¿Qué sectores muestran señales de repunte y cuáles no?","https://encrypted-tbn0.gstatic.com/images?q=tbn:ANd9GcSU3zt8fnriF03y71_1hrZNjGOK5sMtNHMpK8q6UYr4IBvU-R-G-yJPmXTT37E&amp;s","La Argentina se encuentra con la expectativa de empleo más baja del mundo, con sectores que muestran señales de repunte y otros que no. Esto se debe a la crisis económica que ha afectado al país, provocando la pérdida de puestos de trabajo en varios sectores. Sin embargo, hay indicios de recuperación en áreas como la construcción, la industria manufacturera y el agro, mientras que el comercio, la hotelería y los servicios personales continúan en una situación complicada.","La Argentina se encuentra con la expectativa de empleo más baja del mundo, con sectores que muestran señales de repunte y otros que no. Esto se debe a la crisis económica que ha afectado al país, provocando la pérdida de puestos de trabajo en varios sectores. Sin embargo, hay indicios de recuperación en áreas como la construcción, la industria manufacturera y el agro, mientras que el comercio, la hotelería y los servicios personales continúan en una situación complicada.",""
"09/09/2025 18:15:35","https://infobae.com/politica/2025/09/09/ernesto-sanz-hoy-el-gobierno-debe-empezar-de-cero-porque-nunca-practico-el-dialogo-sincero/","Ernesto Sanz: “Hoy el Gobierno debe empezar de cero porque nunca practicó el diálogo sincero”","Ernesto Sanz: ""Hoy el gobierno debe empezar de cero porque nunca practicó el diálogo sincero""","https://encrypted-tbn0.gstatic.com/images?q=tbn:ANd9GcRE3Hb_MfcUrCz1Uf5ec9r2C4GpQ3cs4KsByE26G20Ok_pMvpO7julP0pqnz1I&amp;s","El exsenador Ernesto Sanz expresó que el gobierno actual debe empezar de cero porque no practicó el diálogo sincero. Además, criticó la falta de consenso en la gestión del presidente.","El exsenador Ernesto Sanz expresó que el gobierno actual debe empezar de cero porque no practicó el diálogo sincero. Además, criticó la falta de consenso en la gestión del presidente.",""
