"FechayHora","LinkOrigen","TituloOrigen","Titulo","Imagen","Intro","Noticia","Datos"
"09/09/2025 18:15:35","https://infobae.com/inhouse/2025/09/08/chapadmalal-que-ofrece-este-destino-natural-ubicado-a-pocos-minutos-de-mar-del-plata/","Chapadmalal: qué ofrece este destino natural ubicado a pocos minutos de Mar del Plata","Chapadmalal: qué ofrece este destino natural ubicado a pocos minutos de Mar del Plata","https://encrypted-tbn0.gstatic.com/images?q=tbn:ANd9GcSbJcy8LMwVeDqbRv-kjq9wWQ2Zf1DEJciUnt8nfLRnvRMA2p5tJaFGo4rcfA&amp;s","En Chapadmalal, un destino natural ubicado a pocos minutos de Mar del Plata, se encuentra una amplia oferta turística con playas extensas, tranquilidad y paisajes naturales. Entre sus atractivos se destacan actividades al aire libre como surf, pesca, senderismo y avistaje de aves. Además, cuenta con opciones gastronómicas y alojamientos para disfrutar de una estadía tranquila y en contacto con la naturaleza.","En Chapadmalal, un destino natural ubicado a pocos minutos de Mar del Plata, se encuentra una amplia oferta turística con playas extensas, tranquilidad y paisajes naturales. Entre sus atractivos se destacan actividades al aire libre como surf, pesca, senderismo y avistaje de aves. Además, cuenta con opciones gastronómicas y alojamientos para disfrutar de una estadía tranquila y en contacto con la naturaleza.",""
"09/09/2025 18:15:35","https://infobae.com/sociedad/2025/09/09/como-saber-si-tu-pasaporte-tiene-fallas-y-que-hay-que-hacer-para-cambiarlo/","Cómo saber si tu pasaporte tiene fallas y qué hay que hacer para cambiarlo","Cómo saber si tu pasaporte tiene fallas y qué hacer para cambiarlo","https://encrypted-tbn0.gstatic.com/images?q=tbn:ANd9GcRwSIx-SgynqwFaho-m3zKIwzhKMlGSZPJysyE4kOd5mhqixOLmsmLBB9dn8w&amp;s","El artículo explica cómo detectar fallas en tu pasaporte y qué hacer en caso de necesitar cambiarlo. Entre los problemas más comunes se encuentran manchas de agua, rasguños, dobleces o deterioro de la información personal. Se recomienda revisar siempre la validez y el estado del documento para evitar contratiempos en futuros viajes.","El artículo explica cómo detectar fallas en tu pasaporte y qué hacer en caso de necesitar cambiarlo. Entre los problemas más comunes se encuentran manchas de agua, rasguños, dobleces o deterioro de la información personal. Se recomienda revisar siempre la validez y el estado del documento para evitar contratiempos en futuros viajes.",""
"09/09/2025 18:15:35","https://infobae.com/deportes/2025/09/09/pierde-el-pelo-pero-no-las-manas-el-impactante-gol-de-tiro-libre-de-ronaldinho-a-los-45-anos/","“Pierde el pelo, pero no las mañas”: el impactante gol de tiro libre de Ronaldinho a los 45 años","Pierde el pelo pero no las mañas: el impactante gol de tiro libre de Ronaldinho a los 45 años","https://encrypted-tbn0.gstatic.com/images?q=tbn:ANd9GcSoY5udr_ccVbIsT-uBi381NGxlHibTo8dWwiujy1GBqJAk-I830QUvI1pS7kU&amp;s","El ex futbolista brasileño Ronaldinho, a sus 45 años, sorprendió al mundo con un increíble gol de tiro libre en un partido amistoso. A pesar de haber perdido su cabello, demostró que sigue conservando su habilidad y maestría en el campo de juego.","El ex futbolista brasileño Ronaldinho, a sus 45 años, sorprendió al mundo con un increíble gol de tiro libre en un partido amistoso. A pesar de haber perdido su cabello, demostró que sigue conservando su habilidad y maestría en el campo de juego.",""
"09/09/2025 18:15:35","https://infobae.com/america/mundo/2025/09/09/una-filtracion-revelo-los-negocios-privados-de-boris-johnson-tras-su-mandato/","Una filtración reveló los negocios privados de Boris Johnson tras su mandato","Una filtracion reveló los negocios privados de Boris Johnson tras su mandato","https://encrypted-tbn0.gstatic.com/images?q=tbn:ANd9GcSvkxV6fm1LTXgeaZQcsoWU3b7UioJ5g_p16pu4Grl7pkuv2DvDMDuwGdyCg3U&amp;s","Un reporte recientemente filtrado reveló los negocios privados del ex primer ministro británico Boris Johnson después de su mandato. Se descubrió que Johnson había estado trabajando como asesor de una empresa de tecnología financiera y había recibido un pago de 230.000 libras esterlinas por un discurso. Estas revelaciones han generado controversia y cuestionamientos sobre posibles conflictos de interés.","Un reporte recientemente filtrado reveló los negocios privados del ex primer ministro británico Boris Johnson después de su mandato. Se descubrió que Johnson había estado trabajando como asesor de una empresa de tecnología financiera y había recibido un pago de 230.000 libras esterlinas por un discurso. Estas revelaciones han generado controversia y cuestionamientos sobre posibles conflictos de interés.",""
"09/09/2025 18:15:35","https://infobae.com/cultura/2025/09/09/la-nueva-obra-de-banksy-sera-retirada-surge-el-dilema-entre-proteccion-patrimonial-y-libertad-de-expresion/","La nueva obra de Banksy será retirada: surge el dilema entre protección patrimonial y libertad de expresión","La nueva obra de Banksy será retirada: surge el dilema entre protección patrimonial y libertad de expresión","https://encrypted-tbn0.gstatic.com/images?q=tbn:ANd9GcSqNZ_DBoVKifDVVjf0tcBUJP-2IL2a_JKo0Ef56YkYbAeM6G5izklL-2D6ZKE&amp;s","En una nueva obra de Banksy se desata un dilema entre la protección patrimonial y la libertad de expresión. La obra en cuestión será retirada por las autoridades, generando debate en torno a si se debe preservar como patrimonio cultural o respetar la expresión artística del artista callejero.","En una nueva obra de Banksy se desata un dilema entre la protección patrimonial y la libertad de expresión. La obra en cuestión será retirada por las autoridades, generando debate en torno a si se debe preservar como patrimonio cultural o respetar la expresión artística del artista callejero.",""
"09/09/2025 18:15:35","https://infobae.com/deportes/2025/09/09/la-decision-de-carlo-ancelotti-en-la-seleccion-de-brasil-que-desato-la-polemica-en-espana/","La decisión de Carlo Ancelotti en la selección de Brasil que desató la polémica en España","La decisión de Carlo Ancelotti en la selección de Brasil que desató la polémica en España","https://encrypted-tbn0.gstatic.com/images?q=tbn:ANd9GcTzmVJSreqZGVQb9cUtlVLNva_yEEvTEbI9OTcSXqGkXRA0GyhqWLskgrlljA&amp;s","La decisión de Carlo Ancelotti en la selección de Brasil ha generado polémica en España. El entrenador italiano ha dejado fuera de la convocatoria a varios jugadores españoles, lo que ha generado controversia en el país. Ancelotti ha sido criticado por su elección, pero defiende su decisión.","La decisión de Carlo Ancelotti en la selección de Brasil ha generado polémica en España. El entrenador italiano ha dejado fuera de la convocatoria a varios jugadores españoles, lo que ha generado controversia en el país. Ancelotti ha sido criticado por su elección, pero defiende su decisión.",""
"09/09/2025 18:15:35","https://infobae.com/educacion/2025/09/09/carlos-andres-perez-la-educacion-del-futuro-tiene-que-ser-mas-personalizada-y-permitir-al-estudiante-mayor-autonomia/","Carlos Andrés Pérez: &quot;La educación del futuro tiene que ser más personalizada y permitir al estudiante mayor autonomía&quot;","Carlos Andrés Pérez: La educación del futuro tiene que ser más personalizada y permitir al estudiante mayor autonomía","https://encrypted-tbn0.gstatic.com/images?q=tbn:ANd9GcTst1K1TMUAM73bNgIED57bOoSqOKaOxWgZ024Z3gUR1hWX0RRilem3H8lJzQ&amp;s","En la noticia se destaca la importancia de la educación personalizada y con mayor autonomía para los estudiantes en el futuro. Carlos Andrés Pérez subraya que es fundamental adaptar los métodos educativos a las necesidades individuales de cada alumno, permitiéndoles desarrollar sus habilidades y potencial al máximo. Se resalta la necesidad de brindar herramientas que fomenten la autonomía de los estudiantes, preparándolos para enfrentar los desafíos del mundo actual y lograr un mejor aprendizaje.","En la noticia se destaca la importancia de la educación personalizada y con mayor autonomía para los estudiantes en el futuro. Carlos Andrés Pérez subraya que es fundamental adaptar los métodos educativos a las necesidades individuales de cada alumno, permitiéndoles desarrollar sus habilidades y potencial al máximo. Se resalta la necesidad de brindar herramientas que fomenten la autonomía de los estudiantes, preparándolos para enfrentar los desafíos del mundo actual y lograr un mejor aprendizaje.",""
"09/09/2025 18:15:35","https://infobae.com/deportes/2025/09/09/sin-messi-argentina-visita-a-ecuador-por-la-ultima-fecha-de-las-eliminatorias-2026-hora-tv-y-posibles-formaciones/","Sin Messi, Argentina visita a Ecuador: hora, TV y posibles formaciones","Argentina visita a Ecuador por la última fecha de las Eliminatorias 2026: hora, TV y posibles formaciones","https://encrypted-tbn0.gstatic.com/images?q=tbn:ANd9GcTou64fFMpMPsPto009_HvrAm9TDyMOIcgt0Am0LFAuU_gnOp_LmqlNBXHrdJ4&amp;s","La selección argentina de fútbol se enfrentará a Ecuador en la última fecha de las eliminatorias para el Mundial de 2026, sin la presencia de Lionel Messi. El partido se jugará en Ecuador y se podrá ver por televisión. Ambos equipos están en busca de la clasificación para el próximo mundial, por lo que se espera un encuentro disputado.","La selección argentina de fútbol se enfrentará a Ecuador en la última fecha de las eliminatorias para el Mundial de 2026, sin la presencia de Lionel Messi. El partido se jugará en Ecuador y se podrá ver por televisión. Ambos equipos están en busca de la clasificación para el próximo mundial, por lo que se espera un encuentro disputado.",""
"09/09/2025 18:15:35","https://infobae.com/movant/2025/09/08/el-comercio-entre-argentina-y-brasil-mostro-un-crecimiento-y-reflejo-un-mayor-desafio-logistico/","El comercio entre Argentina y Brasil mostró un crecimiento y reflejó un mayor reto logístico","El comercio entre Argentina y Brasil mostró un crecimiento y reflejó un mayor desafío logístico","https://encrypted-tbn0.gstatic.com/images?q=tbn:ANd9GcRk7hVtTyrGC6kfYDJxoTYsd-2b2feaBF160vJ2w9ArSdtn6gNf5E5Gp9AkPg&amp;s","El comercio entre Argentina y Brasil ha experimentado un crecimiento significativo, lo cual ha generado un desafío logístico mayor para ambos países. Esta situación se ha visto reflejada en un aumento en la demanda de servicios de transporte terrestre, aéreo y marítimo, lo que plantea la necesidad de optimizar las infraestructuras y los procesos logísticos para garantizar la eficiencia en el intercambio comercial entre ambas naciones.","El comercio entre Argentina y Brasil ha experimentado un crecimiento significativo, lo cual ha generado un desafío logístico mayor para ambos países. Esta situación se ha visto reflejada en un aumento en la demanda de servicios de transporte terrestre, aéreo y marítimo, lo que plantea la necesidad de optimizar las infraestructuras y los procesos logísticos para garantizar la eficiencia en el intercambio comercial entre ambas naciones.",""
"09/09/2025 18:15:35","https://infobae.com/estados-unidos/2025/09/08/las-acciones-suben-despues-de-que-wall-street-coquetea-con-otro-record/","Las acciones subieron en Wall Street en el comienzo de una semana clave: el Nasdaq marcó un nuevo máximo histórico","Las acciones suben después de que Wall Street coquetea con otro récord","https://encrypted-tbn0.gstatic.com/images?q=tbn:ANd9GcTvQW6uEy86Dqxf3NZAXrLHGTIB-XBI8dTT4KFLIBhALRXHbXo9MUlh3TCFke0&amp;s","En Wall Street, las acciones subieron luego de que se registrara un nuevo récord en el mercado. Los principales índices bursátiles cerraron con ganancias, mostrando una tendencia positiva en la jornada. Esta situación se dio después de varios días de volatilidad en el mercado financiero.","En Wall Street, las acciones subieron luego de que se registrara un nuevo récord en el mercado. Los principales índices bursátiles cerraron con ganancias, mostrando una tendencia positiva en la jornada. Esta situación se dio después de varios días de volatilidad en el mercado financiero.",""
"09/09/2025 18:15:35","https://infobae.com/salud/ciencia/2025/09/09/reducir-el-consumo-de-cafeina-modifica-la-calidad-del-sueno-cual-es-la-causa/","Reducir el consumo de cafeína modifica la calidad del sueño: cuál es la causa","Reducir el consumo de cafeína modifica la calidad del sueño: ¿cuál es la causa?","https://encrypted-tbn0.gstatic.com/images?q=tbn:ANd9GcTdE7Uv4nDoFGToFoR7imN8dEgRJaF7D447LDYzuLvhmg3PVS6bxLUjQtQbcII&amp;s","Un estudio reveló que reducir el consumo de cafeína puede alterar la calidad del sueño. Investigadores descubrieron que las personas que consumen menos cafeína tienden a dormir más tiempo, con un sueño más profundo y menos interrupciones nocturnas. Esto se debe a que la cafeína afecta los ritmos circadianos y la producción de adenosina en el cerebro, lo que puede alterar el ciclo del sueño.","Un estudio reveló que reducir el consumo de cafeína puede alterar la calidad del sueño. Investigadores descubrieron que las personas que consumen menos cafeína tienden a dormir más tiempo, con un sueño más profundo y menos interrupciones nocturnas. Esto se debe a que la cafeína afecta los ritmos circadianos y la producción de adenosina en el cerebro, lo que puede alterar el ciclo del sueño.",""
"09/09/2025 18:15:35","https://infobae.com/politica/2025/09/09/mahiques-fue-reelecto-como-presidente-de-la-asociacion-internacional-de-fiscales/","Mahiques fue reelecto como presidente de la Asociación Internacional de Fiscales","Mahiques fue reelegido como presidente de la Asociación Internacional de Fiscales","https://encrypted-tbn0.gstatic.com/images?q=tbn:ANd9GcS5w1KRLkvG0K50xm2oIKnMGsuHxgliXDt2dJDDcrFmwaWChE-xiu7wHRpcBg&amp;s","La noticia informa que Mahiques ha sido reelegido como presidente de la Asociación Internacional de Fiscales en una votación unánime durante la asamblea general celebrada en Europa. Mahiques es el primer argentino en ocupar este cargo, y se compromete a seguir trabajando en la lucha contra el crimen organizado y la corrupción a nivel internacional.","La noticia informa que Mahiques ha sido reelegido como presidente de la Asociación Internacional de Fiscales en una votación unánime durante la asamblea general celebrada en Europa. Mahiques es el primer argentino en ocupar este cargo, y se compromete a seguir trabajando en la lucha contra el crimen organizado y la corrupción a nivel internacional.",""
"09/09/2025 18:15:35","https://infobae.com/cultura/2025/09/09/el-violin-de-ingres-la-foto-mas-cara-de-la-historia-se-suman-a-la-coleccion-del-met-de-nueva-york/","“El violín de Ingres” de Man Ray, la foto más cara de la historia, se suma al acervo del Met de Nueva York","El violín de Ingres: la foto más cara de la historia se suman a la colección del Met de Nueva York","https://encrypted-tbn0.gstatic.com/images?q=tbn:ANd9GcRv7grTo_kQj3MU7JMUWHYKxFUUNNsUKJ3NmcZBLEmb5v8N3enWDo2RvSDDrQ&amp;s","El famoso violín ""El Ingres"" se convirtió en la fotografía más cara de la historia al sumarse a la colección del Museo Metropolitano de Arte de Nueva York. La imagen fue adquirida por una suma millonaria en una subasta, consolidando su posición como una de las fotografías más icónicas del mundo del arte.","El famoso violín ""El Ingres"" se convirtió en la fotografía más cara de la historia al sumarse a la colección del Museo Metropolitano de Arte de Nueva York. La imagen fue adquirida por una suma millonaria en una subasta, consolidando su posición como una de las fotografías más icónicas del mundo del arte.",""
"09/09/2025 18:15:35","https://infobae.com/deportes/2025/09/09/cuando-y-a-que-hora-juega-argentina-vs-ecuador-por-las-eliminatorias-al-mundial-2026-y-como-verlo-en-vivo/","Cuándo y a qué hora juega Argentina vs Ecuador por las Eliminatorias al Mundial 2026 y cómo verlo en vivo","Cuándo y a qué hora juega Argentina vs Ecuador por las eliminatorias al Mundial 2026 y cómo verlo en vivo","https://encrypted-tbn0.gstatic.com/images?q=tbn:ANd9GcTBc-HyI4Qv67roSaEgw18ooT-WIbZXH37vZ11xmuYtlfRNHPIrI0WeQmfdBA&amp;s","Argentina se enfrentará a Ecuador en un partido de las eliminatorias al Mundial 2026 el próximo domingo. El encuentro se llevará a cabo a las 20:00 hs y será transmitido en vivo por diversos medios.","Argentina se enfrentará a Ecuador en un partido de las eliminatorias al Mundial 2026 el próximo domingo. El encuentro se llevará a cabo a las 20:00 hs y será transmitido en vivo por diversos medios.",""
"09/09/2025 18:15:35","https://infobae.com/tendencias/2025/09/09/como-eliminar-los-acaros-de-casa-facilmente-lo-que-hay-que-saber/","¿Cómo eliminar los ácaros de casa fácilmente? Lo que hay que saber","Cómo eliminar los ácaros de casa fácilmente: lo que hay que saber.","https://encrypted-tbn0.gstatic.com/images?q=tbn:ANd9GcQ2w5icC4GrHHWWIYr5SLc2fq238kirB21PRpoAw_qX9NHLlw0Jw3UCUWT3fg&amp;s","El artículo ofrece consejos para eliminar los ácaros del hogar de manera efectiva. Entre las recomendaciones se incluye mantener la casa limpia, lavar la ropa de cama con regularidad, controlar la humedad y utilizar fundas anti-ácaros en colchones y almohadas. Además, se sugiere aspirar los muebles y alfombras de forma frecuente, así como ventilar la casa para reducir la presencia de estos microorganismos.","El artículo ofrece consejos para eliminar los ácaros del hogar de manera efectiva. Entre las recomendaciones se incluye mantener la casa limpia, lavar la ropa de cama con regularidad, controlar la humedad y utilizar fundas anti-ácaros en colchones y almohadas. Además, se sugiere aspirar los muebles y alfombras de forma frecuente, así como ventilar la casa para reducir la presencia de estos microorganismos.",""
"09/09/2025 18:15:35","https://infobae.com/revista-chacra/2025/09/09/mani-biotecnologia-para-enfrentar-al-carbon-y-acelerar-el-mejoramiento-genetico/","Maní: biotecnología para enfrentar al carbón y acelerar el mejoramiento genético","Maní: biotecnología para enfrentar al carbón y acelerar el mejoramiento genético.","https://encrypted-tbn0.gstatic.com/images?q=tbn:ANd9GcQLPCKMreNgW68kga7QsJ-K2iGJqChWK9vjCv25u3mDswo5Yii0rpH6qgFZk94&amp;s","El artículo habla sobre el uso de la biotecnología en el cultivo de maní para combatir enfermedades como el carbón, así como para acelerar el proceso de mejoramiento genético de la planta. Esta tecnología ha demostrado ser efectiva en la creación de variedades más resistentes y productivas, lo que beneficia a los agricultores y a la industria en general.","El artículo habla sobre el uso de la biotecnología en el cultivo de maní para combatir enfermedades como el carbón, así como para acelerar el proceso de mejoramiento genético de la planta. Esta tecnología ha demostrado ser efectiva en la creación de variedades más resistentes y productivas, lo que beneficia a los agricultores y a la industria en general.",""
"09/09/2025 18:15:35","https://infobae.com/deportes/2025/09/09/la-mirada-de-frana-sobre-el-campeon-del-us-open-para-nosotros-horacio-es-uno-de-nuestros-lideres/","La mirada de Frana sobre el campeón del US Open: &quot;Para nosotros Horacio es uno de nuestros líderes&quot;","La mirada de Frana sobre el campeón del US Open: ""Para nosotros, Horacio es uno de nuestros líderes""","https://encrypted-tbn0.gstatic.com/images?q=tbn:ANd9GcQRQyiauAryQrv9c2Cgn9Arsn_j9ySRsKP--_Ej_wuJFm5Ss8rZMxtWxqcgXA&amp;s","En una entrevista reciente, Guillermo Frana elogió a Horacio Zeballos por su destacado desempeño como campeón del US Open. Frana destacó que Zeballos es uno de los líderes del equipo argentino de tenis y resaltó su dedicación y compromiso en cada partido.","En una entrevista reciente, Guillermo Frana elogió a Horacio Zeballos por su destacado desempeño como campeón del US Open. Frana destacó que Zeballos es uno de los líderes del equipo argentino de tenis y resaltó su dedicación y compromiso en cada partido.",""
"09/09/2025 18:15:35","https://infobae.com/sociedad/policiales/2025/09/09/peleo-con-un-cliente-por-un-trabajo-y-comenzo-a-disparar-al-aire-frente-a-un-shopping-de-rosario/","Peleó con un cliente por un trabajo y comenzó a disparar al aire frente a un shopping de Rosario","","https://encrypted-tbn0.gstatic.com/images?q=tbn:ANd9GcQzFU_oCkMB8TBtIyAG_SKjLmXK5hu8hZCu0G8AgPifUsqFBceTFnI08uhKBw&amp;s","En un shopping de Rosario, un hombre peleó con un cliente por un trabajo y comenzó a disparar al aire. El suceso provocó pánico entre los transeúntes, pero afortunadamente no hubo heridos. La policía logró detener al agresor y secuestró un arma de fuego que llevaba consigo. La situación se solucionó sin mayores consecuencias gracias a la rápida intervención de las autoridades.","En un shopping de Rosario, un hombre peleó con un cliente por un trabajo y comenzó a disparar al aire. El suceso provocó pánico entre los transeúntes, pero afortunadamente no hubo heridos. La policía logró detener al agresor y secuestró un arma de fuego que llevaba consigo. La situación se solucionó sin mayores consecuencias gracias a la rápida intervención de las autoridades.",""
"09/09/2025 18:15:35","https://infobae.com/venezuela/2025/09/09/en-medio-de-la-presion-militar-de-eeuu-el-dictador-nicolas-maduro-decreto-el-inicio-anticipado-de-la-navidad-en-venezuela/","En medio de la presión militar de EEUU, el dictador Nicolás Maduro decretó el inicio anticipado de la Navidad en Venezuela","En medio de la presión militar de EE.UU., el dictador Nicolás Maduro decretó el inicio anticipado de la Navidad en Venezuela","https://encrypted-tbn0.gstatic.com/images?q=tbn:ANd9GcTzPHwRl24-wxlpkYpQXgY8wnD6sFy0f362fDUjvmRrJ-3BM9x7jZhnU500Pg&amp;s","El dictador Nicolás Maduro decretó el inicio anticipado de la Navidad en Venezuela en medio de la presión militar de Estados Unidos. Esta medida busca adelantar la temporada navideña para impulsar la economía del país, que enfrenta una severa crisis.","El dictador Nicolás Maduro decretó el inicio anticipado de la Navidad en Venezuela en medio de la presión militar de Estados Unidos. Esta medida busca adelantar la temporada navideña para impulsar la economía del país, que enfrenta una severa crisis.",""
"09/09/2025 18:15:35","https://infobae.com/cultura/2025/09/09/entre-la-novela-y-la-neurociencia-presentaron-vendran-por-ti-en-la-feria-del-libro-de-rawson/","Entre la novela y la neurociencia: presentaron “Vendrán por ti” en la Feria del Libro de Rawson","Entre la novela y la neurociencia: presentaron ""Vendrán por ti"" en la Feria del Libro de Rawson.","https://encrypted-tbn0.gstatic.com/images?q=tbn:ANd9GcR4o-UYoLCoECXAaGvbBRAFEZ1wL_JhDojUlXHkzy3ImIIpPoXXkx4C_GDcmQw&amp;s","En la Feria del Libro de Rawson se presentó la novela ""Vendrán por ti"", la cual aborda la temática de la neurociencia. El autor de la obra explica que la trama se centra en un neurocientífico que descubre una manera de detectar a criminales a través del análisis de sus cerebros. Este evento tuvo lugar en el marco de las actividades culturales de la feria, donde se destacó la importancia de la literatura y la ciencia en la sociedad actual.","En la Feria del Libro de Rawson se presentó la novela ""Vendrán por ti"", la cual aborda la temática de la neurociencia. El autor de la obra explica que la trama se centra en un neurocientífico que descubre una manera de detectar a criminales a través del análisis de sus cerebros. Este evento tuvo lugar en el marco de las actividades culturales de la feria, donde se destacó la importancia de la literatura y la ciencia en la sociedad actual.",""
"09/09/2025 18:15:35","https://infobae.com/america/mundo/2025/09/09/el-video-del-momento-del-ataque-selectivo-de-israel-contra-la-cupula-de-hamas-en-doha/","El video del momento del ataque selectivo de Israel contra la cúpula de Hamas en Doha","El video del momento del ataque selectivo de Israel contra la cúpula de Hamas en Doha","https://encrypted-tbn0.gstatic.com/images?q=tbn:ANd9GcS3m9MxNzpMQ2inIBQZRUu_-bkUoGsPS3P6TVm5U6tP_TUbFICdDWKgFa23tg&amp;s","En el video del ataque selectivo de Israel contra la cúpula de Hamas en Doha, se muestra el momento en que un misil impacta en un edificio de la ciudad. El ataque fue llevado a cabo como represalia a los recientes lanzamientos de cohetes desde la Franja de Gaza hacia territorio israelí.","En el video del ataque selectivo de Israel contra la cúpula de Hamas en Doha, se muestra el momento en que un misil impacta en un edificio de la ciudad. El ataque fue llevado a cabo como represalia a los recientes lanzamientos de cohetes desde la Franja de Gaza hacia territorio israelí.",""
"09/09/2025 18:15:35","https://infobae.com/revista-chacra/2025/09/09/se-acerca-un-fin-de-semana-veraniego-con-temperaturas-de-hasta-35-c/","Se acerca un fin de semana veraniego, con temperaturas de hasta 35 °C","Se acerca un fin de semana veraniego con temperaturas de hasta 35 ºC","https://encrypted-tbn0.gstatic.com/images?q=tbn:ANd9GcQ6biL38vZCGHaUprg_kKWuO7ULZdQo1GQtZij4VsfmhYkkBD-7mhhufuvEMg&amp;s","El fin de semana se espera que las temperaturas alcancen hasta los 35°C en varias regiones, lo que indica un clima veraniego.","El fin de semana se espera que las temperaturas alcancen hasta los 35°C en varias regiones, lo que indica un clima veraniego.",""
