"FechayHora","LinkOrigen","TituloOrigen","Titulo","Imagen","Intro","Noticia","Datos"
"09/11/2025 11:25:43","https://infobae.com/america/mundo/2025/09/10/propaganda-sin-limites-el-regimen-de-kim-jong-un-convierte-a-sus-soldados-caidos-en-ucrania-en-herramientas-de-control/","Propaganda sin límites: el régimen de Kim Jong-un convierte a sus soldados caídos en Ucrania en herramientas de control","Propaganda sin límites del régimen de Kim Jong Un utiliza a soldados caídos en Ucrania como herramientas de control","https://encrypted-tbn0.gstatic.com/images?q=tbn:ANd9GcQi0V-2wIiFXyHQsn4Lr3LcVfQwzyupHBJo75vCp_uXGOgvKXVEZhwadS1YSoM&amp;s","El régimen de Kim Jong-un está utilizando la propaganda en torno a sus soldados fallecidos en Ucrania como una herramienta de control. La dictadura norcoreana presenta a estos soldados como héroes en un esfuerzo por fortalecer el apoyo al régimen y desviar la atención de las dificultades internas del país. Los medios estatales destacan sus supuestas hazañas en el conflicto, lo que busca enardecer el patriotismo y la lealtad hacia el liderazgo de Kim. Esta estrategia también se enmarca en el contexto de las tensiones diplomáticas y el aislamiento internacional de Corea del Norte.","El régimen de Kim Jong-un está utilizando la propaganda en torno a sus soldados fallecidos en Ucrania como una herramienta de control. La dictadura norcoreana presenta a estos soldados como héroes en un esfuerzo por fortalecer el apoyo al régimen y desviar la atención de las dificultades internas del país. Los medios estatales destacan sus supuestas hazañas en el conflicto, lo que busca enardecer el patriotismo y la lealtad hacia el liderazgo de Kim. Esta estrategia también se enmarca en el contexto de las tensiones diplomáticas y el aislamiento internacional de Corea del Norte.",""
"09/11/2025 11:25:43","https://infobae.com/salud/2025/09/10/el-mapa-global-de-la-desnutricion-infantil-por-primera-vez-hay-mas-ninos-obesos-que-con-bajo-peso-segun-unicef/","El mapa global de la obesidad infantil: por primera vez hay más niños con sobrepeso que desnutridos","El mapa global de la desnutrición infantil revela que hay más niños obesos que con bajo peso según UNICEF","https://encrypted-tbn0.gstatic.com/images?q=tbn:ANd9GcTFXBt003djKRL68v1gz3OSR9WAtDk3U7oLF3HqEaBGOAWsgAnDJGLM_8gZoPM&amp;s","Un informe de UNICEF revela que, por primera vez, el número de niños obesos ha superado al de aquellos con desnutrición en todo el mundo. Según el estudio, aproximadamente 90 millones de niños son obesos, mientras que 75 millones padecen desnutrición aguda. Este cambio en las tendencias muestra un creciente desafío global relacionado con la alimentación y la salud infantil. La crisis alimentaria y el impacto de la pandemia de COVID-19 han exacerbado la situación, dejando a muchos niños sin acceso a una nutrición adecuada. Expertos enfatizan la necesidad de abordar ambos problemas de manera urgente y coordinada.","Un informe de UNICEF revela que, por primera vez, el número de niños obesos ha superado al de aquellos con desnutrición en todo el mundo. Según el estudio, aproximadamente 90 millones de niños son obesos, mientras que 75 millones padecen desnutrición aguda. Este cambio en las tendencias muestra un creciente desafío global relacionado con la alimentación y la salud infantil. La crisis alimentaria y el impacto de la pandemia de COVID-19 han exacerbado la situación, dejando a muchos niños sin acceso a una nutrición adecuada. Expertos enfatizan la necesidad de abordar ambos problemas de manera urgente y coordinada.",""
"09/11/2025 11:25:43","https://infobae.com/america/mundo/2025/09/11/el-ejercito-israeli-intercepto-un-misil-lanzado-por-los-rebeldes-huties-desde-yemen/","El Ejército israelí interceptó un misil lanzado por los rebeldes hutíes desde Yemen","El ejército israelí intercepta un misil lanzado por los rebeldes hutíes desde Yemen","https://encrypted-tbn0.gstatic.com/images?q=tbn:ANd9GcRAHYCj-5cHOsHLJM6PdZUNi7E8pGhelGeQQqHlS6RdKdeVLDkzZeYaZb2Okgs&amp;s","El ejército israelí interceptó un misil disparado por los rebeldes hutíes desde Yemen. Este incidente se enmarca dentro del conflicto regional que involucra a grupos armados y tensiones diplomáticas. La interceptación se produjo en un momento de aumento de las hostilidades en la región, destacando la capacidad de respuesta de Israel ante amenazas externas. No se reportaron daños ni víctimas a causa del ataque.","El ejército israelí interceptó un misil disparado por los rebeldes hutíes desde Yemen. Este incidente se enmarca dentro del conflicto regional que involucra a grupos armados y tensiones diplomáticas. La interceptación se produjo en un momento de aumento de las hostilidades en la región, destacando la capacidad de respuesta de Israel ante amenazas externas. No se reportaron daños ni víctimas a causa del ataque.",""
"09/11/2025 11:25:43","https://infobae.com/deportes/2025/09/10/la-emocion-del-arquero-lampe-tras-el-pase-de-bolivia-al-repechaje-por-un-lugar-en-el-mundial-2026-no-tengo-lagrimas-de-todo-lo-que-llore/","La emoción del arquero de Bolivia: “No tengo lágrimas de todo lo que lloré”","La emoción del arquero Lampe tras el pase de Bolivia al repechaje por un lugar en el Mundial 2026: ""No tengo lágrimas de todo lo que lloré""","https://encrypted-tbn0.gstatic.com/images?q=tbn:ANd9GcSs4sCThRyHNCnSGjnE2aW9puBkBtZ_wiUJzAzUEO74-DHTwtK3dcjCbYSeiJE&amp;s","El arquero Carlos Lampe expresó su emoción al lograr el pase de Bolivia al repechaje por un lugar en el Mundial 2026. Aseguró haber llorado tanto que ya no le quedaban lágrimas.","El arquero Carlos Lampe expresó su emoción al lograr el pase de Bolivia al repechaje por un lugar en el Mundial 2026. Aseguró haber llorado tanto que ya no le quedaban lágrimas.",""
"09/11/2025 11:25:43","https://infobae.com/deportes/2025/09/10/la-intimidad-de-mbappe-contada-por-su-familia-su-descarnada-reaccion-tras-la-final-perdida-ante-argentina-y-por-que-no-tiene-novia/","La intimidad de Mbappé, contada por su familia: su descarnada reacción tras la final perdida ante Argentina y por qué no tiene novia","La intimidad de Mbappé contada por su familia y su reacción tras la final perdida ante Argentina","https://encrypted-tbn0.gstatic.com/images?q=tbn:ANd9GcSz3yJ3WyMNHOTRkIVEK-2TnTUDyyoXV_GzRkbpKKBcm9tZGwh4Y6h51FpX1ts&amp;s","La familia de Kylian Mbappé comparte detalles sobre su vida personal y su reacción tras perder la final del Mundial contra Argentina. Se destaca su intensa dedicación al fútbol y el impacto emocional que tuvo la derrota en él. Además, se menciona la decisión del jugador de no tener actualmente una relación romántica, lo que refleja su enfoque en su carrera deportiva y sus objetivos profesionales. La historia trata de resaltar la intimidad del futbolista y su entorno familiar, así como su compromiso con el deporte.","La familia de Kylian Mbappé comparte detalles sobre su vida personal y su reacción tras perder la final del Mundial contra Argentina. Se destaca su intensa dedicación al fútbol y el impacto emocional que tuvo la derrota en él. Además, se menciona la decisión del jugador de no tener actualmente una relación romántica, lo que refleja su enfoque en su carrera deportiva y sus objetivos profesionales. La historia trata de resaltar la intimidad del futbolista y su entorno familiar, así como su compromiso con el deporte.",""
"09/11/2025 11:25:43","https://infobae.com/america/america-latina/2025/09/09/investigan-al-presidente-de-bolivia-luis-arce-por-abandono-de-mujer-embarazada/","Investigan al presidente de Bolivia Luis Arce por abandono de mujer embarazada","Investigan al presidente de Bolivia Luis Arce por abandono de mujer embarazada","https://encrypted-tbn0.gstatic.com/images?q=tbn:ANd9GcQPszqQjHZfrIBN59Ni5H0yVJ2N8ak_VwowlTJuL0QjtAXbH3VTl3p86YwgGA&amp;s","El presidente de Bolivia, Luis Arce, está siendo investigado por presuntamente abandonar a una mujer embarazada. La denuncia fue presentada por la supuesta víctima, quien asegura que el mandatario no le brindó ningún tipo de apoyo durante su embarazo. La fiscalía boliviana ha iniciado las averiguaciones correspondientes para esclarecer los hechos.","El presidente de Bolivia, Luis Arce, está siendo investigado por presuntamente abandonar a una mujer embarazada. La denuncia fue presentada por la supuesta víctima, quien asegura que el mandatario no le brindó ningún tipo de apoyo durante su embarazo. La fiscalía boliviana ha iniciado las averiguaciones correspondientes para esclarecer los hechos.",""
"09/11/2025 11:25:43","https://infobae.com/america/america-latina/2025/09/09/la-ong-foro-penal-informo-que-el-numero-de-presos-politicos-en-venezuela-asciende-a-823-personas/","La ONG Foro Penal informó que el número de presos políticos en Venezuela asciende a 823 personas","La ONG Foro Penal informó que el número de presos políticos en Venezuela asciende a 823 personas","https://encrypted-tbn0.gstatic.com/images?q=tbn:ANd9GcQygddlZoo3KKr0n1WFr8bcvyayXTBveiJnd1W4KE_IvrF9KzmOMisdTc4eNg&amp;s","Según la ONG Foro Penal, el número de presos políticos en Venezuela ha llegado a 823 personas. Esta cifra incluye a aquellos detenidos por razones políticas, como opositores al gobierno de Nicolás Maduro. La organización mencionó que esta cantidad ha aumentado en comparación con años anteriores, lo que evidencia la situación de represión en el país.","Según la ONG Foro Penal, el número de presos políticos en Venezuela ha llegado a 823 personas. Esta cifra incluye a aquellos detenidos por razones políticas, como opositores al gobierno de Nicolás Maduro. La organización mencionó que esta cantidad ha aumentado en comparación con años anteriores, lo que evidencia la situación de represión en el país.",""
"09/11/2025 11:25:43","https://infobae.com/america/mundo/2025/09/09/marine-le-pen-cuestiono-el-nombramiento-de-sebastien-lecornu-como-premier-frances-es-el-ultimo-cartucho-del-macronismo/","Marine Le Pen cuestionó el nombramiento de Sébastien Lecornu como premier francés: “Es el último cartucho del macronismo”","Marine Le Pen cuestiona el nombramiento de Sébastien Lecornu como primer ministro francés","https://encrypted-tbn0.gstatic.com/images?q=tbn:ANd9GcRPPBpojGHLcErWzUZn2GB3tHNlHWQOQAL6rPZsBiO8Iy5HDaK4wAnB-0QONg&amp;s","La líder de extrema derecha Marine Le Pen cuestionó el nombramiento de Sébastien Lecornu como primer ministro francés, acusándolo de ser el ""último cartucho del macronismo"". Le Pen critica la falta de experiencia política de Lecornu y lo considera una estrategia desesperada del presidente francés Emmanuel Macron para mantenerse en el poder.","La líder de extrema derecha Marine Le Pen cuestionó el nombramiento de Sébastien Lecornu como primer ministro francés, acusándolo de ser el ""último cartucho del macronismo"". Le Pen critica la falta de experiencia política de Lecornu y lo considera una estrategia desesperada del presidente francés Emmanuel Macron para mantenerse en el poder.",""
"09/11/2025 11:25:43","https://infobae.com/venezuela/2025/09/09/en-medio-de-la-presion-militar-de-eeuu-el-dictador-nicolas-maduro-decreto-el-inicio-anticipado-de-la-navidad-en-venezuela/","En medio de la presión militar de EEUU, el dictador Nicolás Maduro decretó el inicio anticipado de la Navidad en Venezuela","En medio de la presión militar de EE.UU., el dictador Nicolás Maduro decretó el inicio anticipado de la Navidad en Venezuela","https://encrypted-tbn0.gstatic.com/images?q=tbn:ANd9GcTzPHwRl24-wxlpkYpQXgY8wnD6sFy0f362fDUjvmRrJ-3BM9x7jZhnU500Pg&amp;s","El dictador Nicolás Maduro decretó el inicio anticipado de la Navidad en Venezuela en medio de la presión militar de Estados Unidos. Esta medida busca adelantar la temporada navideña para impulsar la economía del país, que enfrenta una severa crisis.","El dictador Nicolás Maduro decretó el inicio anticipado de la Navidad en Venezuela en medio de la presión militar de Estados Unidos. Esta medida busca adelantar la temporada navideña para impulsar la economía del país, que enfrenta una severa crisis.",""
"09/11/2025 11:25:43","https://infobae.com/venezuela/2025/09/11/el-parlamento-europeo-aprobo-una-resolucion-que-pide-a-la-ue-incluir-al-cartel-de-los-soles-en-su-lista-de-organizaciones-terroristas/","El Parlamento Europeo aprobó una resolución que pide declarar al Cartel de los Soles como organización terrorista","Parlamento Europeo aprueba resolución para incluir al Cartel de los Soles en la lista de organizaciones terroristas de la UE","https://encrypted-tbn0.gstatic.com/images?q=tbn:ANd9GcQ0NVYrd-_mb8Px97G_l7FglW6-AHyRimb6cR9_2qTlgJOCTIjfl2AR3_ee-T0&amp;s","El Parlamento Europeo aprobó una resolución que solicita a la Unión Europea considerar al Cartel de los Soles como una organización terrorista. Esta decisión responde a las crecientes preocupaciones sobre el narcotráfico y la corrupción en Venezuela. La medida busca intensificar la presión sobre el régimen de Nicolás Maduro y sus aliados, quienes están involucrados en actividades delictivas y violaciones de derechos humanos. Con esta resolución, se busca también aumentar la cooperación internacional para enfrentar el crimen organizado en la región.","El Parlamento Europeo aprobó una resolución que solicita a la Unión Europea considerar al Cartel de los Soles como una organización terrorista. Esta decisión responde a las crecientes preocupaciones sobre el narcotráfico y la corrupción en Venezuela. La medida busca intensificar la presión sobre el régimen de Nicolás Maduro y sus aliados, quienes están involucrados en actividades delictivas y violaciones de derechos humanos. Con esta resolución, se busca también aumentar la cooperación internacional para enfrentar el crimen organizado en la región.",""
"09/11/2025 11:25:43","https://infobae.com/america/mundo/2025/09/10/el-consejo-de-seguridad-de-la-onu-convoco-a-una-sesion-de-emergencia-tras-el-ataque-israeli-a-la-cupula-de-hamas-en-qatar/","El Consejo de Seguridad de la ONU se reunirá hoy para discutir el ataque israelí a la cúpula de Hamas en Qatar","El Consejo de Seguridad de la ONU convocó a sesión de emergencia tras ataque israelí a cúpula de Hamas en Qatar","https://encrypted-tbn0.gstatic.com/images?q=tbn:ANd9GcQPCZlLYDLM6zoa6H4JDW37m6UU_IULxTqFN9gng2UM5SBnTAKU7ZqKonCGX4k&amp;s","El Consejo de Seguridad de la ONU convocó a una sesión de emergencia luego del ataque israelí a la cúpula de Hamas en Qatar. La reunión fue convocada para discutir la situación y buscar soluciones a la crisis desencadenada por el ataque.","El Consejo de Seguridad de la ONU convocó a una sesión de emergencia luego del ataque israelí a la cúpula de Hamas en Qatar. La reunión fue convocada para discutir la situación y buscar soluciones a la crisis desencadenada por el ataque.",""
"09/11/2025 11:25:43","https://infobae.com/deportes/2025/09/11/los-rumores-de-romance-entre-carlos-alcaraz-y-la-reconocida-modelo-brooks-nader-que-dan-hablar-en-europa/","Toda Europa habla del posible romance entre Carlos Alcaraz y la reconocida modelo Brooks Nader","Rumores de romance entre Carlos Alcaraz y la modelo Brooks Nader generan especulaciones en Europa","https://encrypted-tbn0.gstatic.com/images?q=tbn:ANd9GcTZmyPYxXU6C-mGFnHrpmvAHTvcwhJhsgBy5ljsBbeh3o7wBGG9BnYTiwBaz50&amp;s","Carlos Alcaraz, el joven tenista español, está en el centro de rumores sobre una posible relación con la modelo Brooks Nader. La atención hacia esta supuesta conexión ha crecido en Europa, especialmente después de que ambos compartieran contenido en redes sociales que alimenta las especulaciones. Aunque no se ha confirmado oficialmente ningún romance, las interacciones entre Alcaraz y Nader han generado gran interés en los medios y entre los seguidores de ambos.","Carlos Alcaraz, el joven tenista español, está en el centro de rumores sobre una posible relación con la modelo Brooks Nader. La atención hacia esta supuesta conexión ha crecido en Europa, especialmente después de que ambos compartieran contenido en redes sociales que alimenta las especulaciones. Aunque no se ha confirmado oficialmente ningún romance, las interacciones entre Alcaraz y Nader han generado gran interés en los medios y entre los seguidores de ambos.",""
"09/11/2025 11:25:43","https://infobae.com/deportes/2025/09/10/las-fogosas-imagenes-de-jude-bellingham-y-la-modelo-ashlyn-castro-en-las-playas-de-cerdena/","Las fogosas imágenes de Jude Bellingham y la modelo Ashlyn Castro en las playas de Cerdeña","Jude Bellingham y la modelo Ashlyn Castro disfrutan de su romance en las playas de Cerdeña","https://encrypted-tbn0.gstatic.com/images?q=tbn:ANd9GcRqfqsLH5teDO3g4cphY_UvYz1uyJ9jJ4WUYa7M3D4UUJEBZJ-gHvlcsdUZrP8&amp;s","Jude Bellingham, futbolista destacado del Real Madrid, fue fotografiado en la isla de Cerdeña junto a la modelo Ashlyn Castro. Las imágenes mostraron a la pareja disfrutando de un día de playa, generando atención en las redes sociales y los medios. La relación entre los dos ha captado el interés del público, en medio de la exitosa carrera deportiva de Bellingham en la liga española.","Jude Bellingham, futbolista destacado del Real Madrid, fue fotografiado en la isla de Cerdeña junto a la modelo Ashlyn Castro. Las imágenes mostraron a la pareja disfrutando de un día de playa, generando atención en las redes sociales y los medios. La relación entre los dos ha captado el interés del público, en medio de la exitosa carrera deportiva de Bellingham en la liga española.",""
"09/11/2025 11:25:43","https://infobae.com/america/mundo/2025/09/10/la-presidenta-maia-sandu-advirtio-que-rusia-libra-una-guerra-hibrida-sin-precedentes-para-influir-en-las-elecciones-de-moldavia/","La presidenta Maia Sandu advirtió que Rusia libra una “guerra híbrida sin precedentes” para influir en las elecciones de Moldavia","Maia Sandu advierte sobre guerra híbrida de Rusia para influir en elecciones de Moldavia","https://encrypted-tbn0.gstatic.com/images?q=tbn:ANd9GcRK9IWXlsNrKZbzsxUn46dwPNrPGmCkc7VIRcLOzbtkvbjS-VgHwFoJrZqKNQ&amp;s","La presidenta de Moldavia, Maia Sandu, alertó sobre una guerra híbrida sin precedentes que Rusia está llevando a cabo para influir en las próximas elecciones en su país. Sandu destacó que esta campaña de desinformación y manipulación busca desestabilizar a Moldavia y afectar la soberanía nacional. La presidenta hizo un llamado a la ciudadanía para estar alerta ante estas tácticas maliciosas y subrayó la importancia de la unidad y la resistencia frente a la influencia extranjera. Además, recordó el apoyo de la comunidad internacional en la defensa de la democracia moldava.","La presidenta de Moldavia, Maia Sandu, alertó sobre una guerra híbrida sin precedentes que Rusia está llevando a cabo para influir en las próximas elecciones en su país. Sandu destacó que esta campaña de desinformación y manipulación busca desestabilizar a Moldavia y afectar la soberanía nacional. La presidenta hizo un llamado a la ciudadanía para estar alerta ante estas tácticas maliciosas y subrayó la importancia de la unidad y la resistencia frente a la influencia extranjera. Además, recordó el apoyo de la comunidad internacional en la defensa de la democracia moldava.",""
"09/11/2025 11:25:43","https://infobae.com/deportes/2025/09/10/el-record-historico-que-logro-lionel-messi-en-estas-eliminatorias-sus-impactantes-numeros/","El récord histórico que logró Lionel Messi en estas Eliminatorias: sus impactantes números","El récord histórico que logró Lionel Messi en estas eliminatorias: sus impactantes números","https://encrypted-tbn0.gstatic.com/images?q=tbn:ANd9GcSqG5sXhpPLvU9ZoBF2bgT3JvX9-XMX1I75EUaBeo6G9vwDS69GcElWz6GURw&amp;s","Lionel Messi ha logrado un récord histórico durante las eliminatorias de la Copa del Mundo. Con sus impresionantes números, se convierte en el jugador con más participaciones en la competición. Messi ha demostrado una vez más su calidad y liderazgo en el fútbol mundial.","Lionel Messi ha logrado un récord histórico durante las eliminatorias de la Copa del Mundo. Con sus impresionantes números, se convierte en el jugador con más participaciones en la competición. Messi ha demostrado una vez más su calidad y liderazgo en el fútbol mundial.",""
"09/11/2025 11:25:43","https://infobae.com/tecno/2025/09/10/nick-bostrom-el-filosofo-preferido-de-musk-y-gates-la-ia-y-el-futuro-de-la-humanidad/","Nick Bostrom, el filósofo preferido de Musk y Gates: la IA y el futuro de la humanidad","Nick Bostrom y su visión sobre la IA y el futuro de la humanidad","https://encrypted-tbn0.gstatic.com/images?q=tbn:ANd9GcTT7JIa_6UKNIrzDVLArieLquIPHPalDjd42EKf5YJ4IK3T5IjoMMKXOqApLwk&amp;s","Nick Bostrom, un reconocido filósofo, se ha convertido en una figura influyente en el debate sobre la inteligencia artificial (IA) y su impacto en el futuro de la humanidad. Su trabajo ha sido alabado por líderes tecnológicos como Elon Musk y Bill Gates, quienes comparten su preocupación por los riesgos asociados con el desarrollo descontrolado de la IA. Bostrom advierte que la creación de máquinas inteligentes podría llevar a consecuencias catastróficas si no se implementan adecuadas regulaciones y estudios. Además, discute la necesidad de garantizar que la evolución de la IA se realice de manera segura y ética, alineando sus objetivos con los valores humanos. Su enfoque ha generado tanto apoyo como críticas, lo que subraya la complejidad del tema.","Nick Bostrom, un reconocido filósofo, se ha convertido en una figura influyente en el debate sobre la inteligencia artificial (IA) y su impacto en el futuro de la humanidad. Su trabajo ha sido alabado por líderes tecnológicos como Elon Musk y Bill Gates, quienes comparten su preocupación por los riesgos asociados con el desarrollo descontrolado de la IA. Bostrom advierte que la creación de máquinas inteligentes podría llevar a consecuencias catastróficas si no se implementan adecuadas regulaciones y estudios. Además, discute la necesidad de garantizar que la evolución de la IA se realice de manera segura y ética, alineando sus objetivos con los valores humanos. Su enfoque ha generado tanto apoyo como críticas, lo que subraya la complejidad del tema.",""
"09/11/2025 11:25:43","https://infobae.com/cultura/2025/09/10/tras-4-siglos-reaparecio-un-cuadro-de-rubens-en-paris/","Tras 4 siglos, reapareció un cuadro de Rubens en París","Reaparece un cuadro de Rubens en París tras 4 siglos de ausencia","https://encrypted-tbn0.gstatic.com/images?q=tbn:ANd9GcQDE3ilBVT6TsyIUn39wIAEFWbBLyq7hpoxH_KQ-kSJjcnhmtocnKkC3u0inA&amp;s","Un cuadro perdido de Peter Paul Rubens, titulado ""La adoración de los pastores"", ha sido redescubierto en París después de cuatro siglos. Este hallazgo se produjo en el marco de un inventario realizado por una cristalería en el barrio de Saint-Germain-des-Prés. El cuadro, que había estado en manos de una familia desde el siglo XVII, ha sido confirmado por expertos como una obra auténtica del maestro flamenco. Se espera que la pintura sea subastada, y su valor se estima en varios millones de euros, lo que resalta su importancia artística y cultural.","Un cuadro perdido de Peter Paul Rubens, titulado ""La adoración de los pastores"", ha sido redescubierto en París después de cuatro siglos. Este hallazgo se produjo en el marco de un inventario realizado por una cristalería en el barrio de Saint-Germain-des-Prés. El cuadro, que había estado en manos de una familia desde el siglo XVII, ha sido confirmado por expertos como una obra auténtica del maestro flamenco. Se espera que la pintura sea subastada, y su valor se estima en varios millones de euros, lo que resalta su importancia artística y cultural.",""
"09/11/2025 11:25:43","https://infobae.com/america/mundo/2025/09/10/las-guerras-de-las-que-nadie-habla-mas-de-80-muertos-en-un-ataque-de-una-milicia-afiliada-al-estado-islamico-en-el-congo/","Las guerras de las que nadie habla: más de 80 muertos en un ataque de una milicia afiliada al ISIS","","https://encrypted-tbn0.gstatic.com/images?q=tbn:ANd9GcQx5ChyZnjCQ7kHE-0Hd0v976DZrH2iu8FI-pNsJ4JtbfqSR345IXyjK3TJxPo&amp;s","","",""
"09/11/2025 11:25:43","https://infobae.com/deportes/2025/09/10/las-18-selecciones-que-ya-se-clasificaron-al-mundial-2026-y-los-paises-que-deberan-disputar-el-repechaje-con-bolivia/","Las 18 selecciones que ya se clasificaron al Mundial y los países que deberán disputar el Repechaje","Las 18 selecciones clasificadas al Mundial 2026 y los países que jugarán el repechaje con Bolivia","https://encrypted-tbn0.gstatic.com/images?q=tbn:ANd9GcQLX8etlW9h0xF-pPMN8ZN5Tk1_55wbmnMehhlcAEnb-pwRW7y5ahPparxN9w&amp;s","La noticia informa sobre las selecciones nacionales que ya han asegurado su lugar en el Mundial de Fútbol 2026, destacando que un total de 18 equipos han logrado clasificar. Además, se menciona que Bolivia tendrá que participar en un repechaje para intentar conseguir su acceso al torneo. Se detallan los equipos que ya están clasificados y se presenta un panorama sobre las naciones que deberán enfrentarse en el repechaje, resaltando la importancia de estas eliminatorias en el camino hacia el Mundial.","La noticia informa sobre las selecciones nacionales que ya han asegurado su lugar en el Mundial de Fútbol 2026, destacando que un total de 18 equipos han logrado clasificar. Además, se menciona que Bolivia tendrá que participar en un repechaje para intentar conseguir su acceso al torneo. Se detallan los equipos que ya están clasificados y se presenta un panorama sobre las naciones que deberán enfrentarse en el repechaje, resaltando la importancia de estas eliminatorias en el camino hacia el Mundial.",""
