"FechayHora","LinkOrigen","TituloOrigen","Titulo","Imagen","Intro","Noticia","Datos"
"09/13/2025 18:45:08","https://infobae.com/america/mundo/2025/09/13/centinela-oriental-polonia-confirmo-el-inicio-de-la-iniciativa-militar-de-la-otan-en-su-flanco-oriental-para-hacer-frente-a-la-amenaza-rusa/","“Centinela oriental“: Polonia confirmó el inicio de la iniciativa militar de la OTAN en su flanco oriental para hacer frente a la amenaza rusa","Polonia confirma el inicio de la iniciativa militar de la OTAN en su flanco oriental para hacer frente a la amenaza rusa","https://encrypted-tbn0.gstatic.com/images?q=tbn:ANd9GcR0mSGc-4C32uNyKmGxVsy4LBt7uFpxy8qTB6Ae39ifRpn0ZAqaJO3wEvTJJGQ&amp;s","Polonia ha confirmado el inicio de una nueva iniciativa militar de la OTAN en su flanco oriental, conocida como Centinela Oriental. Esta operación tiene como objetivo fortalecer la defensa ante posibles amenazas rusas en la región. La decisión responde a la creciente preocupación por la seguridad en Europa del Este, y busca reforzar la presencia militar aliada en países fronterizos con Rusia. La OTAN destacó la importancia de esta iniciativa para garantizar la estabilidad y la protección de sus estados miembros frente a cualquier agresión externa.","Polonia ha confirmado el inicio de una nueva iniciativa militar de la OTAN en su flanco oriental, conocida como Centinela Oriental. Esta operación tiene como objetivo fortalecer la defensa ante posibles amenazas rusas en la región. La decisión responde a la creciente preocupación por la seguridad en Europa del Este, y busca reforzar la presencia militar aliada en países fronterizos con Rusia. La OTAN destacó la importancia de esta iniciativa para garantizar la estabilidad y la protección de sus estados miembros frente a cualquier agresión externa.",""
"09/13/2025 18:45:08","https://infobae.com/deportes/2025/09/10/la-dura-critica-de-un-historico-de-uruguay-a-bielsa-por-la-polemica-de-los-cambios-ante-chile-me-duele-si-soy-jugador/","La dura crítica de un histórico de Uruguay a Bielsa por la polémica de los cambios ante Chile","La dura crítica de un histórico de Uruguay a Bielsa por la polémica de los cambios ante Chile","https://encrypted-tbn0.gstatic.com/images?q=tbn:ANd9GcRO5Ji-E1Doi7yUam5_IPtItXvJ-J-eKaqv-ZHCUILY1CTxWoEl4bUt71enbp0&amp;s","La noticia destaca la crítica de un histórico del fútbol uruguayo hacia el director técnico Marcelo Bielsa, tras los polémicos cambios realizados en la selección durante el partido contra Chile. El exjugador expresó su desagrado y preocupación, enfatizando que decisiones como estas pueden afectar negativamente a los futbolistas. Su comentario refleja el malestar de algunos sectores frente a la gestión táctica del entrenador en momentos clave del encuentro.","La noticia destaca la crítica de un histórico del fútbol uruguayo hacia el director técnico Marcelo Bielsa, tras los polémicos cambios realizados en la selección durante el partido contra Chile. El exjugador expresó su desagrado y preocupación, enfatizando que decisiones como estas pueden afectar negativamente a los futbolistas. Su comentario refleja el malestar de algunos sectores frente a la gestión táctica del entrenador en momentos clave del encuentro.",""
"09/13/2025 18:45:08","https://infobae.com/america/mundo/2025/09/11/la-justicia-de-sudan-del-sur-acuso-al-vicepresidente-riek-machar-de-crimenes-de-lesa-humanidad-y-terrorismo/","La justicia de Sudán del Sur acusó al vicepresidente Riek Machar de crímenes de lesa humanidad y terrorismo","La justicia de Sudán del Sur acusa al vicepresidente Riek Machar de crímenes de lesa humanidad y terrorismo","https://encrypted-tbn0.gstatic.com/images?q=tbn:ANd9GcQb8DBNtccJBaPs_mPc7wcXRdjVx_nTKxfK9FDcTodgLD-sZ-Q1fqCzWUbzeQ&amp;s","La justicia de Sudán del Sur ha acusado al vicepresidente Riek Machar de cometer crímenes de lesa humanidad y actos de terrorismo. Esta acusación se produce en un contexto de creciente tensión y violencia en el país. Machar, quien ha sido una figura clave en la política sursudanesa, enfrenta serias imputaciones relacionadas con su papel en el conflicto armado que ha asolado a la nación desde su independencia en 2011. Las autoridades judiciales están llevando a cabo investigaciones para esclarecer los hechos y buscar justicia por las atrocidades cometidas.","La justicia de Sudán del Sur ha acusado al vicepresidente Riek Machar de cometer crímenes de lesa humanidad y actos de terrorismo. Esta acusación se produce en un contexto de creciente tensión y violencia en el país. Machar, quien ha sido una figura clave en la política sursudanesa, enfrenta serias imputaciones relacionadas con su papel en el conflicto armado que ha asolado a la nación desde su independencia en 2011. Las autoridades judiciales están llevando a cabo investigaciones para esclarecer los hechos y buscar justicia por las atrocidades cometidas.",""
"09/13/2025 18:45:08","https://infobae.com/america/mundo/2025/09/13/erdogan-intensifica-la-persecucion-contra-la-oposicion-en-turquia-detuvieron-a-otro-alcalde-socialdemocrata-en-estambul/","Erdogan intensifica la persecución contra la oposición en Turquía: detuvieron a otro alcalde en Estambul","Erdogan intensifica la persecución contra la oposición en Turquía con la detención de un alcalde socialdemócrata en Estambul","https://encrypted-tbn0.gstatic.com/images?q=tbn:ANd9GcQejA3prFMn4E-L3QUN60XXTVBYAD42hkPWM8_jmaZbvwGnWRJWWp-Gnw5kmw&amp;s","El presidente de Turquía, Recep Tayyip Erdoğan, ha intensificado la represión contra la oposición, con la reciente detención de un alcalde socialdemócrata en Estambul. Esta acción forma parte de un patrón más amplio de persecución política dirigido especialmente contra figuras de la oposición en el país. La situación ha generado preocupaciones sobre la libertad política y la democracia en Turquía, en un contexto donde las críticas hacia el gobierno están en aumento.","El presidente de Turquía, Recep Tayyip Erdoğan, ha intensificado la represión contra la oposición, con la reciente detención de un alcalde socialdemócrata en Estambul. Esta acción forma parte de un patrón más amplio de persecución política dirigido especialmente contra figuras de la oposición en el país. La situación ha generado preocupaciones sobre la libertad política y la democracia en Turquía, en un contexto donde las críticas hacia el gobierno están en aumento.",""
"09/13/2025 18:45:08","https://infobae.com/america/mundo/2025/09/13/el-g7-planea-imponer-nuevas-sanciones-economicas-contra-contra-paises-que-consideran-que-posibilitan-la-guerra-de-rusia-en-ucrania/","El G7 planea imponer nuevas sanciones económicas contra países que considera que “posibilitan” la guerra","G7 planea imponer nuevas sanciones económicas contra países que facilitan la guerra de Rusia en Ucrania","https://encrypted-tbn0.gstatic.com/images?q=tbn:ANd9GcTHy0aPK4OAzI9qAuQrzTRuwzVrNp6XGcYcOMRcaM1b7WGfKrIwrUltYhP8uHo&amp;s","El G7 ha decidido implementar nuevas sanciones económicas dirigidas a países que, según su evaluación, están facilitando la guerra de Rusia en Ucrania. Este movimiento forma parte de un esfuerzo por aumentar la presión sobre Moscú y a quienes lo apoyan en el conflicto. Las potencias del G7 buscan limitar el acceso de estos países a recursos y tecnologías que podrían ser utilizados para sostener el esfuerzo bélico de Rusia. Este enfoque refleja la creciente preocupación por la prolongación del conflicto y el impacto que tiene en la seguridad global.","El G7 ha decidido implementar nuevas sanciones económicas dirigidas a países que, según su evaluación, están facilitando la guerra de Rusia en Ucrania. Este movimiento forma parte de un esfuerzo por aumentar la presión sobre Moscú y a quienes lo apoyan en el conflicto. Las potencias del G7 buscan limitar el acceso de estos países a recursos y tecnologías que podrían ser utilizados para sostener el esfuerzo bélico de Rusia. Este enfoque refleja la creciente preocupación por la prolongación del conflicto y el impacto que tiene en la seguridad global.",""
"09/13/2025 18:45:08","https://infobae.com/america/mundo/2025/09/12/la-onu-publico-un-informe-sobre-derechos-humanos-en-corea-del-norte-ninguna-otra-poblacion-sufre-tantas-restricciones/","La ONU publicó un informe sobre Derechos Humanos en Corea del Norte: “Ninguna otra población sufre tantas restricciones”","Informe de la ONU resalta las severas restricciones a los derechos humanos en Corea del Norte","https://encrypted-tbn0.gstatic.com/images?q=tbn:ANd9GcTlLAWBB2_D_pw07zSCELgWfFMFWtm5aCv9yMz8BWBJjkZm2jfnXzGDRCE1HQ&amp;s","La ONU publicó un informe que denuncia las graves violaciones a los derechos humanos en Corea del Norte, destacando que la población enfrenta severas restricciones en su vida diaria. El documento detalla la represión política, la falta de libertad de expresión, y el control estricto del gobierno sobre la vida personal de los ciudadanos. El informe también subraya la situación de los presos políticos y las condiciones extremas en las cárceles. La ONU instó a la comunidad internacional a prestar atención a esta crisis humanitaria y a presionar al régimen norcoreano para que mejore la situación de los derechos humanos en el país.","La ONU publicó un informe que denuncia las graves violaciones a los derechos humanos en Corea del Norte, destacando que la población enfrenta severas restricciones en su vida diaria. El documento detalla la represión política, la falta de libertad de expresión, y el control estricto del gobierno sobre la vida personal de los ciudadanos. El informe también subraya la situación de los presos políticos y las condiciones extremas en las cárceles. La ONU instó a la comunidad internacional a prestar atención a esta crisis humanitaria y a presionar al régimen norcoreano para que mejore la situación de los derechos humanos en el país.",""
"09/13/2025 18:45:08","https://infobae.com/america/mundo/2025/09/12/la-otan-acuso-a-rusia-de-coordinar-un-ataque-deliberado-en-polonia-para-provocar-una-reaccion/","La OTAN acusó a Rusia de coordinar un ataque deliberado en Polonia para “provocar” una reacción","OTAN acusa a Rusia de coordinar ataque deliberado en Polonia para provocar reacción","https://encrypted-tbn0.gstatic.com/images?q=tbn:ANd9GcSPCrJRo80p4TT2sFyi_tWqXD2XthnrsNAQlO9CxFGHLNPGILrJizydy-wTZpc&amp;s","La OTAN ha señalado que Rusia estaría detrás de un ataque coordinado en Polonia, con el objetivo de provocar una respuesta internacional. Este acto se interpreta como parte de una estrategia más amplia por parte de Moscú para desestabilizar la región y desafiar la seguridad europea. Las autoridades de la OTAN han expresado su preocupación y han instado a los países miembros a estar alertas ante posibles agresiones. La situación genera tensiones en el contexto de la política de defensa colectiva y la cooperación entre los aliados.","La OTAN ha señalado que Rusia estaría detrás de un ataque coordinado en Polonia, con el objetivo de provocar una respuesta internacional. Este acto se interpreta como parte de una estrategia más amplia por parte de Moscú para desestabilizar la región y desafiar la seguridad europea. Las autoridades de la OTAN han expresado su preocupación y han instado a los países miembros a estar alertas ante posibles agresiones. La situación genera tensiones en el contexto de la política de defensa colectiva y la cooperación entre los aliados.",""
"09/13/2025 18:45:08","https://infobae.com/america/america-latina/2025/09/13/muhammad-ibrahim-candidato-del-caricom-al-iica-impulsa-la-movilizacion-de-fondos-para-la-seguridad-alimentaria-en-centroamerica/","Muhammad Ibrahim, candidato del CARICOM al IICA, solicita fondos para la seguridad alimentaria en Centroamérica","Muhammad Ibrahim, candidato del Caricom al IICA, impulsa la movilización de fondos para la seguridad alimentaria en Centroamérica","https://encrypted-tbn0.gstatic.com/images?q=tbn:ANd9GcSV-kEhqQI0rONMOMZ0OS-UKKAbHvpmXUmKa2ikoFcmyBc3BrindEYaNkKw2Q&amp;s","Muhammad Ibrahim ha sido presentado como el candidato del CARICOM para dirigir el Instituto Interamericano de Cooperación para la Agricultura (IICA). Su enfoque principal se centra en la búsqueda de financiamiento destinado a la seguridad alimentaria en Centroamérica. Ibrahim ha subrayado la importancia de movilizar fondos para abordar los desafíos alimentarios que enfrenta la región, enfatizando que se requiere un esfuerzo conjunto entre gobiernos, organizaciones internacionales y el sector privado para asegurar un futuro sostenible y resiliente en la agricultura.","Muhammad Ibrahim ha sido presentado como el candidato del CARICOM para dirigir el Instituto Interamericano de Cooperación para la Agricultura (IICA). Su enfoque principal se centra en la búsqueda de financiamiento destinado a la seguridad alimentaria en Centroamérica. Ibrahim ha subrayado la importancia de movilizar fondos para abordar los desafíos alimentarios que enfrenta la región, enfatizando que se requiere un esfuerzo conjunto entre gobiernos, organizaciones internacionales y el sector privado para asegurar un futuro sostenible y resiliente en la agricultura.",""
"09/13/2025 18:45:08","https://infobae.com/estados-unidos/2025/09/11/trump-califico-de-muy-sorprendente-la-condena-de-bolsonaro-por-conspiracion-golpista/","Trump calificó de “muy sorprendente” la condena de Bolsonaro por conspiración golpista","Trump considera sorprendente la condena de Bolsonaro por conspiración golpista","https://encrypted-tbn0.gstatic.com/images?q=tbn:ANd9GcQnZCBydPJXSHrHTBolaT-pL9qGkzAq_3tTO1QmUvlVBb2ZD7OJQdehDv8XAQ&amp;s","Donald Trump reaccionó a la condena del expresidente brasileño Jair Bolsonaro por intentar un golpe de Estado, describiéndola como sorprendente. La sentencia se basó en la conspiración para desestabilizar el sistema democrático durante la transición de gobierno en Brasil. Bolsonaro, quien se encuentra en los Estados Unidos, enfrenta serios cargos tras el asalto a los edificios gubernamentales en Brasilia en enero de 2023. Trump defendió a Bolsonaro, afirmando que su intención era luchar por lo que él considera injusticias en el proceso electoral brasileño. La situación ha generado un debate sobre la legitimidad de las acciones políticas de ambos líderes.","Donald Trump reaccionó a la condena del expresidente brasileño Jair Bolsonaro por intentar un golpe de Estado, describiéndola como sorprendente. La sentencia se basó en la conspiración para desestabilizar el sistema democrático durante la transición de gobierno en Brasil. Bolsonaro, quien se encuentra en los Estados Unidos, enfrenta serios cargos tras el asalto a los edificios gubernamentales en Brasilia en enero de 2023. Trump defendió a Bolsonaro, afirmando que su intención era luchar por lo que él considera injusticias en el proceso electoral brasileño. La situación ha generado un debate sobre la legitimidad de las acciones políticas de ambos líderes.",""
"09/13/2025 18:45:08","https://infobae.com/virales/2025/09/13/la-reaccion-de-una-joven-que-olvido-desactivar-la-ubicacion-y-fue-acusada-de-infidelidad-se-volvio-viral-en-tiktok/","La reacción de una joven que olvidó desactivar la ubicación y fue acusada de infidelidad se volvió viral en TikTok","Joven olvidó desactivar la ubicación y fue acusada de infidelidad en TikTok","https://encrypted-tbn0.gstatic.com/images?q=tbn:ANd9GcRYTVPxiL3vG9dQbioqibAK6KJc2Hykpn1O3SnZ-bc0qJxCO92F9111_ISLBOM&amp;s","Una joven se volvió viral en TikTok después de compartir su experiencia de haber sido acusada de infidelidad por su pareja. El incidente ocurrió porque olvidó desactivar la ubicación en su dispositivo móvil, lo que llevó a su pareja a pensar que estaba en un lugar diferente al que realmente se encontraba. Este malentendido generó una discusión entre ambos, resaltando las tensiones que pueden surgir en las relaciones por el uso de la tecnología. La situación provocó reacciones diversas entre los usuarios de la red social, quienes comentaron sobre la importancia de la confianza en las relaciones.","Una joven se volvió viral en TikTok después de compartir su experiencia de haber sido acusada de infidelidad por su pareja. El incidente ocurrió porque olvidó desactivar la ubicación en su dispositivo móvil, lo que llevó a su pareja a pensar que estaba en un lugar diferente al que realmente se encontraba. Este malentendido generó una discusión entre ambos, resaltando las tensiones que pueden surgir en las relaciones por el uso de la tecnología. La situación provocó reacciones diversas entre los usuarios de la red social, quienes comentaron sobre la importancia de la confianza en las relaciones.",""
"09/13/2025 18:45:08","https://infobae.com/venezuela/2025/09/13/maria-corina-machado-afirmo-que-llego-el-momento-de-la-liberacion-de-venezuela-y-dijo-que-luego-sera-el-turno-de-cuba-y-nicaragua/","María Corina Machado afirmó que “llegó el momento” de la liberación de Venezuela y dijo que luego será el turno de Cuba y Nicaragua","María Corina Machado anunció que llegó el momento de la liberación de Venezuela y se refirió a Cuba y Nicaragua.","https://encrypted-tbn0.gstatic.com/images?q=tbn:ANd9GcTAfTQFLTsmuLkY0Y1M0JewB2ABn8HWseaZSBlOH4LjzbAL6hdqbgnWlg7N7g&amp;s","María Corina Machado, líder política venezolana, declaró que ha llegado el momento de la liberación de Venezuela y subrayó que, tras este proceso, será el turno de Cuba y Nicaragua. En un evento en Caracas, Machado expresó su compromiso con la lucha por la libertad en la región y criticó las dictaduras en estos países. Su mensaje se enmarca en un contexto de creciente descontento en Venezuela, donde busca consolidar apoyo entre las fuerzas opuestas al gobierno actual.","María Corina Machado, líder política venezolana, declaró que ha llegado el momento de la liberación de Venezuela y subrayó que, tras este proceso, será el turno de Cuba y Nicaragua. En un evento en Caracas, Machado expresó su compromiso con la lucha por la libertad en la región y criticó las dictaduras en estos países. Su mensaje se enmarca en un contexto de creciente descontento en Venezuela, donde busca consolidar apoyo entre las fuerzas opuestas al gobierno actual.",""
"09/13/2025 18:45:08","https://infobae.com/deportes/2025/09/11/el-ida-y-vuelta-en-redes-de-alexis-mac-allister-y-piero-hincapie-luego-del-tenso-cruce-en-argentina-ecuador/","El ida y vuelta en redes de Alexis Mac Allister y Piero Hincapié luego del tenso cruce en Argentina-Ecuador","El cruce entre Alexis Mac Allister y Piero Hincapié en el partido Argentina-Ecuador genera controversia en redes sociales","https://encrypted-tbn0.gstatic.com/images?q=tbn:ANd9GcREfrUHu88Q-_0T3b2sz4QndxmgsqA4fOXsIP6saZyFUcKf73ObymSKkEVkm5I&amp;s","En un reciente partido entre Argentina y Ecuador, se generó un intenso cruce entre los futbolistas Alexis Mac Allister y Piero Hincapié. La situación se originó tras un choque entre ambos jugadores, lo que llevó a una discusión que captó la atención en las redes sociales. Tras el encuentro, ambos futbolistas intercambiaron mensajes en sus plataformas, disculpándose y aclarando la situación. Este intercambio tuvo un gran impacto en las redes, donde los aficionados comentaron sobre la tensión y la camaradería que se evidenció después del incidente.","En un reciente partido entre Argentina y Ecuador, se generó un intenso cruce entre los futbolistas Alexis Mac Allister y Piero Hincapié. La situación se originó tras un choque entre ambos jugadores, lo que llevó a una discusión que captó la atención en las redes sociales. Tras el encuentro, ambos futbolistas intercambiaron mensajes en sus plataformas, disculpándose y aclarando la situación. Este intercambio tuvo un gran impacto en las redes, donde los aficionados comentaron sobre la tensión y la camaradería que se evidenció después del incidente.",""
"09/13/2025 18:45:08","https://infobae.com/america/mundo/2025/09/12/el-regimen-de-china-probo-su-nuevo-portaaviones-en-el-estrecho-de-taiwan-pero-dice-que-no-tuvo-un-objetivo-especifico/","El régimen de China probó su nuevo portaaviones en el estrecho de Taiwán, pero dice que no tuvo un “objetivo específico”","China prueba su nuevo portaaviones en el estrecho de Taiwán sin un objetivo específico","https://encrypted-tbn0.gstatic.com/images?q=tbn:ANd9GcSn8ihxkquLAfeZuT8BCqnl1XBehlzxyukgLEvYecinzRLIVKLD_fhBst9fyw&amp;s","El régimen chino realizó pruebas de su nuevo portaaviones en el estrecho de Taiwán. A pesar de la importancia estratégica de esta región, las autoridades chinas afirmaron que las maniobras no tenían un objetivo específico. El despliegue del portaaviones se produce en un contexto de tensiones entre China y Taiwán, y refleja la creciente capacidad militar de Beijing en la zona.","El régimen chino realizó pruebas de su nuevo portaaviones en el estrecho de Taiwán. A pesar de la importancia estratégica de esta región, las autoridades chinas afirmaron que las maniobras no tenían un objetivo específico. El despliegue del portaaviones se produce en un contexto de tensiones entre China y Taiwán, y refleja la creciente capacidad militar de Beijing en la zona.",""
"09/13/2025 18:45:08","https://infobae.com/america/mundo/2025/09/09/con-el-voto-del-magistrado-flavio-dino-ya-son-dos-los-jueces-que-respaldan-la-condena-contra-bolsonaro/","Con el voto del magistrado Flávio Dino, ya son dos los jueces que respaldan la condena contra Bolsonaro","Con el voto del magistrado Flavio, ya son dos los jueces que respaldan la condena contra Bolsonaro","https://encrypted-tbn0.gstatic.com/images?q=tbn:ANd9GcQ9C_ojgPab2i3Vvs4sgzVUUihlHNIWy5D-QRQiVOARkur6oIFNT9ZGwyNGZWQ&amp;s","En una decisión dividida, el magistrado Flavio Dino se sumó al respaldo de la condena contra Jair Bolsonaro. Con esta nueva votación, ya son dos los jueces que apoyan la sentencia en su contra.","En una decisión dividida, el magistrado Flavio Dino se sumó al respaldo de la condena contra Jair Bolsonaro. Con esta nueva votación, ya son dos los jueces que apoyan la sentencia en su contra.",""
"09/13/2025 18:45:08","https://infobae.com/america/mundo/2025/09/12/albania-nombro-a-la-inteligencia-artificial-diella-como-ministra-contra-la-corrupcion-no-tiene-intereses-personales-ni-vinculos-politicos/","Albania nombró a la inteligencia artificial Diella como ministra contra la corrupción: “No tiene intereses personales”","Albania nombra a la inteligencia artificial Diella como ministra contra la corrupción","https://encrypted-tbn0.gstatic.com/images?q=tbn:ANd9GcRJqNG014HJdeEilhvx0GXwLb8nbzE2AydCs1ZKWLUz36XrdNtc19TRx9DRb0c&amp;s","Albania ha nombrado a Diella, una inteligencia artificial, como ministra contra la corrupción. Este inusual nombramiento busca abordar el problema de la corrupción en el país, ya que la IA no tiene intereses personales ni vínculos políticos, lo que se considera una ventaja para actuar de manera imparcial. Este movimiento refleja un enfoque innovador del gobierno al intentar utilizar la tecnología para combatir prácticas corruptas y mejorar la transparencia en la administración pública.","Albania ha nombrado a Diella, una inteligencia artificial, como ministra contra la corrupción. Este inusual nombramiento busca abordar el problema de la corrupción en el país, ya que la IA no tiene intereses personales ni vínculos políticos, lo que se considera una ventaja para actuar de manera imparcial. Este movimiento refleja un enfoque innovador del gobierno al intentar utilizar la tecnología para combatir prácticas corruptas y mejorar la transparencia en la administración pública.",""
"09/13/2025 18:45:08","https://infobae.com/america/america-latina/2025/09/11/el-supremo-tribunal-de-brasil-formo-una-mayoria-para-condenar-a-jair-bolsonaro/","El Supremo Tribunal de Brasil formó una mayoría para condenar a Jair Bolsonaro","Supremo Tribunal de Brasil forma mayoría para condenar a Jair Bolsonaro","https://encrypted-tbn0.gstatic.com/images?q=tbn:ANd9GcRwqrZtJ9sHaudxTOegqegTWN8mAYCiecsqkVhXYU6UEbSZCWkaVG5-LzEyx3c&amp;s","El Supremo Tribunal Federal de Brasil ha formado una mayoría para condenar al expresidente Jair Bolsonaro debido a su participación en la difusión de noticias falsas relacionadas con el sistema electoral del país. Esta decisión se enmarca en un juicio sobre la supuesta campaña de desinformación que Bolsonaro llevó a cabo, la cual busca deslegitimar el proceso electoral de 2022. La corte examina la gravedad de las declaraciones del exmandatario y su impacto en la confianza pública hacia las instituciones democráticas. La condena podría tener repercusiones significativas en la carrera política de Bolsonaro y su futuro en la vida pública brasileña.","El Supremo Tribunal Federal de Brasil ha formado una mayoría para condenar al expresidente Jair Bolsonaro debido a su participación en la difusión de noticias falsas relacionadas con el sistema electoral del país. Esta decisión se enmarca en un juicio sobre la supuesta campaña de desinformación que Bolsonaro llevó a cabo, la cual busca deslegitimar el proceso electoral de 2022. La corte examina la gravedad de las declaraciones del exmandatario y su impacto en la confianza pública hacia las instituciones democráticas. La condena podría tener repercusiones significativas en la carrera política de Bolsonaro y su futuro en la vida pública brasileña.",""
