"FechayHora","LinkOrigen","TituloOrigen","Titulo","Imagen","Intro","Noticia","Datos"
"09/11/2025 11:25:43","https://infobae.com/deportes/2025/09/10/la-dura-critica-de-un-historico-de-uruguay-a-bielsa-por-la-polemica-de-los-cambios-ante-chile-me-duele-si-soy-jugador/","La dura crítica de un histórico de Uruguay a Bielsa por la polémica de los cambios ante Chile","La dura crítica de un histórico de Uruguay a Bielsa por la polémica de los cambios ante Chile","https://encrypted-tbn0.gstatic.com/images?q=tbn:ANd9GcRO5Ji-E1Doi7yUam5_IPtItXvJ-J-eKaqv-ZHCUILY1CTxWoEl4bUt71enbp0&amp;s","La noticia destaca la crítica de un histórico del fútbol uruguayo hacia el director técnico Marcelo Bielsa, tras los polémicos cambios realizados en la selección durante el partido contra Chile. El exjugador expresó su desagrado y preocupación, enfatizando que decisiones como estas pueden afectar negativamente a los futbolistas. Su comentario refleja el malestar de algunos sectores frente a la gestión táctica del entrenador en momentos clave del encuentro.","La noticia destaca la crítica de un histórico del fútbol uruguayo hacia el director técnico Marcelo Bielsa, tras los polémicos cambios realizados en la selección durante el partido contra Chile. El exjugador expresó su desagrado y preocupación, enfatizando que decisiones como estas pueden afectar negativamente a los futbolistas. Su comentario refleja el malestar de algunos sectores frente a la gestión táctica del entrenador en momentos clave del encuentro.",""
"09/11/2025 11:25:43","https://infobae.com/estados-unidos/2025/09/11/el-fbi-recupero-el-arma-homicida-y-analiza-videos-del-asesino-de-charlie-kirk-parece-ser-de-edad-universitaria/","El FBI recuperó el arma homicida y analiza videos del asesino de Charlie Kirk: “Parece ser de edad universitaria”","FBI recupera arma homicida y analiza videos del asesino de Charlie Kirk","https://encrypted-tbn0.gstatic.com/images?q=tbn:ANd9GcTy14NzM4aStJi_-XFfErJSxI-DEBUTeNY5MjKSP_6S_xaz5V492dUUl2IzzA&amp;s","El FBI ha recuperado el arma utilizada en el homicidio de Charlie Kirk y está analizando videos relacionados con el ataque. Se ha identificado al sospechoso, quien aparenta ser un estudiante universitario. Las autoridades continúan investigando el caso para esclarecer los detalles del crimen y la motivación detrás del mismo.","El FBI ha recuperado el arma utilizada en el homicidio de Charlie Kirk y está analizando videos relacionados con el ataque. Se ha identificado al sospechoso, quien aparenta ser un estudiante universitario. Las autoridades continúan investigando el caso para esclarecer los detalles del crimen y la motivación detrás del mismo.",""
"09/11/2025 11:25:43","https://infobae.com/america/mundo/2025/09/11/corea-del-sur-afirmo-que-kim-jong-un-prepara-el-camino-para-que-su-hija-ju-ae-herede-el-poder-en-la-dictadura-norcoreana/","Corea del Sur afirmó que Kim Jong Un prepara el camino para que su hija Ju Ae herede el poder en la dictadura norcoreana","Kim Jong-un prepara a su hija Ju-ae para heredar el poder en Corea del Norte","https://encrypted-tbn0.gstatic.com/images?q=tbn:ANd9GcTkVhMV2uqOR66FIBx1OQlsUxvzm-6v6dl1cXbNDPJSWlXiMwcSSuaJpU7krIA&amp;s","Corea del Sur ha afirmado que Kim Jong-un está preparando el camino para que su hija Ju-ae herede el liderazgo de Corea del Norte. Según el análisis de Seúl, la presencia de Ju-ae en eventos oficiales y su inclusión en temas de gran relevancia política indican que Kim está estableciendo su legado y fortaleciendo la figura de su descendencia. Este movimiento se interpreta como un intento de consolidar el poder en la familia Kim a largo plazo, lo que marca un cambio notable en la sucesión política del régimen norcoreano.","Corea del Sur ha afirmado que Kim Jong-un está preparando el camino para que su hija Ju-ae herede el liderazgo de Corea del Norte. Según el análisis de Seúl, la presencia de Ju-ae en eventos oficiales y su inclusión en temas de gran relevancia política indican que Kim está estableciendo su legado y fortaleciendo la figura de su descendencia. Este movimiento se interpreta como un intento de consolidar el poder en la familia Kim a largo plazo, lo que marca un cambio notable en la sucesión política del régimen norcoreano.",""
"09/11/2025 11:25:43","https://infobae.com/cultura/2025/09/10/las-memorias-de-gisele-pelicot-se-publicaran-en-2026-y-seran-un-mensaje-de-esperanza/","Las memorias de Gisèle Pelicot se publicarán en 2026 y serán “un mensaje de esperanza”","Las memorias de Gisele Pelicot se publicarán en 2026 y serán un mensaje de esperanza","https://encrypted-tbn0.gstatic.com/images?q=tbn:ANd9GcSPfdAKDMuRAo_yiQeG2g0bUEeGhLs9_MENFfVUSrJ6MjyRyFXL6g6Q5NVkZ4g&amp;s","Las memorias de Gisele Pelicot se publicarán en 2026 y se espera que transmitan un mensaje de esperanza. La obra abordará experiencias significativas de su vida y buscará inspirar a los lectores. Este anuncio ha generado gran expectativa entre los seguidores de Pelicot y la comunidad literaria en general.","Las memorias de Gisele Pelicot se publicarán en 2026 y se espera que transmitan un mensaje de esperanza. La obra abordará experiencias significativas de su vida y buscará inspirar a los lectores. Este anuncio ha generado gran expectativa entre los seguidores de Pelicot y la comunidad literaria en general.",""
"09/11/2025 11:25:43","https://infobae.com/america/mundo/2025/09/09/el-reino-unido-descarta-un-rescate-financiero-del-fondo-monetario-internacional-tras-debate-en-el-parlamento/","El Reino Unido descarta un rescate financiero del Fondo Monetario Internacional tras debate en el Parlamento","Reino Unido descarta rescate financiero del Fondo Monetario Internacional tras debate parlamentario","https://encrypted-tbn0.gstatic.com/images?q=tbn:ANd9GcRk4f6_AJckhinqXk5TIBd27vWagpoLRFbNjX_KBvwM_pu-MfBMhDMZkbUjpw&amp;s","El gobierno del Reino Unido descartó la posibilidad de solicitar un rescate financiero al Fondo Monetario Internacional tras un debate en el Parlamento. El ministro de Finanzas enfatizó que el país tiene los recursos necesarios para manejar su situación económica actual. La discusión se centró en las preocupaciones sobre la economía británica, incluyendo el aumento de la inflación y los retos fiscales. A pesar de estos problemas, el gobierno confía en poder estabilizar la economía sin necesidad de ayuda externa.","El gobierno del Reino Unido descartó la posibilidad de solicitar un rescate financiero al Fondo Monetario Internacional tras un debate en el Parlamento. El ministro de Finanzas enfatizó que el país tiene los recursos necesarios para manejar su situación económica actual. La discusión se centró en las preocupaciones sobre la economía británica, incluyendo el aumento de la inflación y los retos fiscales. A pesar de estos problemas, el gobierno confía en poder estabilizar la economía sin necesidad de ayuda externa.",""
"09/11/2025 11:25:43","https://infobae.com/america/mundo/2025/09/09/el-brazo-armado-de-hamas-se-atribuyo-la-responsabilidad-del-atentado-a-tiros-en-jerusalen/","El brazo armado de Hamas se atribuyó la responsabilidad del atentado a tiros en Jerusalén","","https://encrypted-tbn0.gstatic.com/images?q=tbn:ANd9GcQi1Rx4FFQRy6iiRN_J71C51cx8J4MUHn3SoN3z2VQDn764jVcqRv-tx6369Q&amp;s","","",""
"09/11/2025 11:25:43","https://infobae.com/venezuela/2025/09/11/nueva-amenaza-de-diosdado-cabello-a-estados-unidos-estamos-preparados-para-cualquier-guerra-prolongada/","Nueva amenaza de Diosdado Cabello a Estados Unidos: “Estamos preparados para cualquier guerra prolongada”","Diosdado Cabello advierte a Estados Unidos sobre preparación para guerra prolongada","https://encrypted-tbn0.gstatic.com/images?q=tbn:ANd9GcSBRVE9fXpZC54WE4M9cW8v6oNg5pU7RHbuluogE7JGq5Vdc-uWOZe5jpuuNA&amp;s","Diosdado Cabello, alto líder del oficialismo venezolano, emitió una advertencia a Estados Unidos respecto a una posible guerra prolongada. En un evento público, afirmó que Venezuela está lista para enfrentar cualquier confrontación militar y destacó el apoyo de las Fuerzas Armadas Nacionales. Cabello subrayó el compromiso del país con su defensa y la soberanía, asegurando que el pueblo venezolano no se dejará intimidar por amenazas externas. Esta declaración marca un tono agresivo en las relaciones entre Venezuela y Estados Unidos, en el contexto de tensiones políticas y económicas.","Diosdado Cabello, alto líder del oficialismo venezolano, emitió una advertencia a Estados Unidos respecto a una posible guerra prolongada. En un evento público, afirmó que Venezuela está lista para enfrentar cualquier confrontación militar y destacó el apoyo de las Fuerzas Armadas Nacionales. Cabello subrayó el compromiso del país con su defensa y la soberanía, asegurando que el pueblo venezolano no se dejará intimidar por amenazas externas. Esta declaración marca un tono agresivo en las relaciones entre Venezuela y Estados Unidos, en el contexto de tensiones políticas y económicas.",""
"09/11/2025 11:25:43","https://infobae.com/america/mundo/2025/09/10/las-acciones-de-oracle-subieron-casi-40-por-la-prevision-de-crecimiento-vinculado-a-inteligencia-artificial/","Las acciones de Oracle subieron casi 40% por la previsión de crecimiento vinculado a inteligencia artificial","Acciones de Oracle aumentan casi 40 por ciento por previsión de crecimiento en inteligencia artificial","https://encrypted-tbn0.gstatic.com/images?q=tbn:ANd9GcTqvPgLlKbso3h2JclMSfJ5QAA6ZPM721jjYXOKPo4tCRhSqIH_tVZRDRZXBA&amp;s","Las acciones de Oracle experimentaron un aumento cercano al 40% tras la divulgación de previsiones de crecimiento relacionadas con inteligencia artificial. La empresa destacó el potencial de sus productos de AI para mejorar la productividad y el rendimiento de diversas industrias. Este incremento en el valor de las acciones se debe a las expectativas del mercado sobre la integración de estas tecnologías en sus servicios. Además, el firme interés en soluciones de inteligencia artificial ha llevado a los inversionistas a mostrar un renovado optimismo hacia la compañía.","Las acciones de Oracle experimentaron un aumento cercano al 40% tras la divulgación de previsiones de crecimiento relacionadas con inteligencia artificial. La empresa destacó el potencial de sus productos de AI para mejorar la productividad y el rendimiento de diversas industrias. Este incremento en el valor de las acciones se debe a las expectativas del mercado sobre la integración de estas tecnologías en sus servicios. Además, el firme interés en soluciones de inteligencia artificial ha llevado a los inversionistas a mostrar un renovado optimismo hacia la compañía.",""
"09/11/2025 11:25:43","https://infobae.com/venezuela/2025/09/10/voluntad-popular-exigio-conocer-el-sitio-de-reclusion-de-su-activista-jose-riera-preso-desde-hace-45-dias/","Voluntad Popular exigió conocer el sitio de reclusión de su activista José Riera, preso desde hace 45 días","Voluntad Popular exige conocer el sitio de reclusión de su activista José Riera, preso desde hace 45 días","https://encrypted-tbn0.gstatic.com/images?q=tbn:ANd9GcRq2-Rdmp5r-1yTpyxcRa1F1fIERf_yQjjzCdrbAahEjVLq8b7nmPeZDBXqPg&amp;s","La organización política Voluntad Popular solicitó información sobre el paradero de su activista José Riera, quien lleva 45 días detenido. La petición se realiza en medio de preocupaciones sobre su bienestar y las condiciones de su reclusión. La detención se produjo sin que se revelara oficialmente el lugar donde se encuentra, lo que ha generado un llamado a las autoridades para garantizar la transparencia en el proceso y el respeto a los derechos humanos. La situación de Riera ha suscitado el respaldo de varios sectores que exigen su liberación y un tratamiento justo.","La organización política Voluntad Popular solicitó información sobre el paradero de su activista José Riera, quien lleva 45 días detenido. La petición se realiza en medio de preocupaciones sobre su bienestar y las condiciones de su reclusión. La detención se produjo sin que se revelara oficialmente el lugar donde se encuentra, lo que ha generado un llamado a las autoridades para garantizar la transparencia en el proceso y el respeto a los derechos humanos. La situación de Riera ha suscitado el respaldo de varios sectores que exigen su liberación y un tratamiento justo.",""
"09/11/2025 11:25:43","https://infobae.com/america/ciencia-america/2025/09/10/cientificos-detectaron-cuales-son-los-factores-vocales-que-hacen-brillar-a-un-cantante-de-opera/","Científicos detectaron cuáles son los factores vocales que hacen brillar a un cantante de ópera","Científicos identifican los factores vocales que destacan a los cantantes de ópera","https://encrypted-tbn0.gstatic.com/images?q=tbn:ANd9GcSx1HEX65adJO34jbNJvOeA4Xujl3syPqqTl1L0AoB-v1j5Rv7ilP9sB7SS6Q&amp;s","Investigadores han analizado los factores vocales que contribuyen al éxito de los cantantes de ópera. A través de estudios de grabaciones y evaluaciones de expertos, se identificaron características clave en la producción de sonido y la técnica vocal que marcan la diferencia en la calidad de la interpretación. Los resultados muestran que elementos como la proyección de la voz, el timbre y la técnica de respiración son determinantes para destacar en este género musical. La investigación resalta la complejidad del canto operístico y podría ofrecer nuevas perspectivas para la formación de cantantes.","Investigadores han analizado los factores vocales que contribuyen al éxito de los cantantes de ópera. A través de estudios de grabaciones y evaluaciones de expertos, se identificaron características clave en la producción de sonido y la técnica vocal que marcan la diferencia en la calidad de la interpretación. Los resultados muestran que elementos como la proyección de la voz, el timbre y la técnica de respiración son determinantes para destacar en este género musical. La investigación resalta la complejidad del canto operístico y podría ofrecer nuevas perspectivas para la formación de cantantes.",""
"09/11/2025 11:25:43","https://infobae.com/america/america-latina/2025/09/10/las-exportaciones-de-cafe-brasileno-a-estados-unidos-se-hundieron-un-46-en-agosto-por-los-aranceles-de-trump/","Las exportaciones de café brasileño a Estados Unidos se hundieron un 46% en agosto por los aranceles de Trump","Las exportaciones de café brasileño a Estados Unidos cayeron un 46% en agosto por los aranceles de Trump","https://encrypted-tbn0.gstatic.com/images?q=tbn:ANd9GcTKK-cz67sJD2c2mMSAxNrRxpHiffB3oEk2Ufn83S65KjelMFM_EJYMjptEfQ&amp;s","Las exportaciones de café brasileño a Estados Unidos cayeron un 46% en agosto, impactadas por los aranceles impuestos por la administración de Donald Trump. Esta situación ha generado preocupación en el sector cafetalero de Brasil, que depende significativamente del mercado estadounidense. Los productores están enfrentando desafíos debido a las barreras arancelarias, lo que podría afectar la rentabilidad de la industria en el país.","Las exportaciones de café brasileño a Estados Unidos cayeron un 46% en agosto, impactadas por los aranceles impuestos por la administración de Donald Trump. Esta situación ha generado preocupación en el sector cafetalero de Brasil, que depende significativamente del mercado estadounidense. Los productores están enfrentando desafíos debido a las barreras arancelarias, lo que podría afectar la rentabilidad de la industria en el país.",""
"09/11/2025 11:25:43","https://infobae.com/america/mundo/2025/09/10/marco-rubio-y-el-canciller-chino-wang-yi-conversaron-por-telefono-tras-su-encuentro-en-malasia/","Marco Rubio y el canciller chino Wang Yi conversaron por teléfono tras su encuentro en Malasia","Marco Rubio y el canciller chino Wang Yi dialogan tras su encuentro en Malasia","https://encrypted-tbn0.gstatic.com/images?q=tbn:ANd9GcQDqJeJVIS_xraIOsJZ_rwdy1CSAG-4BaauzFZCgQoz85Bp38GRgYwlQfHL-A&amp;s","Marco Rubio y el canciller chino Wang Yi mantuvieron una conversación telefónica después de su encuentro en Malasia. Durante la charla, se discutieron temas relevantes en la relación bilateral y se abordaron preocupaciones mutuas sobre la situación geopolítica actual. Ambas partes subrayaron la importancia de mantener un canal de comunicación abierto para gestionar tensiones y fortalecer el diálogo entre Estados Unidos y China.","Marco Rubio y el canciller chino Wang Yi mantuvieron una conversación telefónica después de su encuentro en Malasia. Durante la charla, se discutieron temas relevantes en la relación bilateral y se abordaron preocupaciones mutuas sobre la situación geopolítica actual. Ambas partes subrayaron la importancia de mantener un canal de comunicación abierto para gestionar tensiones y fortalecer el diálogo entre Estados Unidos y China.",""
"09/11/2025 11:25:43","https://infobae.com/america/mundo/2025/09/10/las-primeras-imagenes-de-los-drones-rusos-que-derribo-polonia-sobre-su-espacio-aereo/","Las primeras imágenes de los drones rusos que derribó Polonia sobre su espacio aéreo","Las primeras imágenes de los drones rusos derribados por Polonia","https://encrypted-tbn0.gstatic.com/images?q=tbn:ANd9GcT2vYs_FO_jyF6HG7y_J8XisjzAWWE5rkQP3liXG_X_Jif_5SqMHMDQDUbyx7E&amp;s","En el enlace proporcionado se pueden ver las primeras imágenes de los drones rusos que fueron derribados por Polonia en su espacio aéreo. Los drones fueron interceptados el sábado por la noche cerca de la frontera con Bielorrusia. Las autoridades polacas confirmaron el incidente y aseguraron que los drones venían de Rusia. Aún se desconoce la razón por la que los drones cruzaron la frontera.","En el enlace proporcionado se pueden ver las primeras imágenes de los drones rusos que fueron derribados por Polonia en su espacio aéreo. Los drones fueron interceptados el sábado por la noche cerca de la frontera con Bielorrusia. Las autoridades polacas confirmaron el incidente y aseguraron que los drones venían de Rusia. Aún se desconoce la razón por la que los drones cruzaron la frontera.",""
"09/11/2025 11:25:43","https://infobae.com/estados-unidos/2025/09/10/una-jueza-de-eeuu-bloqueo-temporalmente-la-destitucion-de-lisa-cook-de-la-reserva-federal-ordenada-por-trump/","Una jueza de EEUU bloqueó temporalmente la destitución de Lisa Cook de la Reserva Federal ordenada por Trump","Una jueza de EEUU bloqueo temporalmente la destitucion de Lisa Cook de la Reserva Federal ordenada por Trump.","https://encrypted-tbn0.gstatic.com/images?q=tbn:ANd9GcQ3A_G6n-domjdinJSjFwgwN10hESv8j5nNl5xtN_LS_hG04LFyDhbuIQWONg&amp;s","Una jueza en Estados Unidos bloqueó temporalmente la destitución de Lisa Cook de la Reserva Federal, la cual fue ordenada por Trump. La decisión permite que Cook siga en su cargo hasta que se pueda resolver la situación de manera definitiva.","Una jueza en Estados Unidos bloqueó temporalmente la destitución de Lisa Cook de la Reserva Federal, la cual fue ordenada por Trump. La decisión permite que Cook siga en su cargo hasta que se pueda resolver la situación de manera definitiva.",""
"09/11/2025 11:25:43","https://infobae.com/america/mundo/2025/09/11/filipinas-rechazo-el-plan-del-regimen-chino-de-crear-una-reserva-natural-en-aguas-disputadas-del-mar-meridional/","Filipinas rechazó el plan del régimen chino de crear una reserva natural en aguas disputadas del mar Meridional","Filipinas rechaza plan de China para crear reserva natural en aguas disputadas del Mar Meridional","https://encrypted-tbn0.gstatic.com/images?q=tbn:ANd9GcR2ZWPfFYw3em48ts0yPGWeKc4sLwbfBn6JuDLwI64GoPi1hQr135-7HuAJ1cA&amp;s","Filipinas ha rechazado la propuesta de China para crear una reserva natural en aguas en disputa del Mar Meridional. El gobierno filipino argumenta que el plan infringe su soberanía y los derechos marítimos en la región. Esta decisión refleja las tensiones en el área, donde varios países tienen reclamaciones territoriales solapadas. Las autoridades filipinas han expresado su compromiso de proteger sus intereses en el mar, reafirmando su postura frente a las iniciativas chinas y buscando fortalecer su posición ante la comunidad internacional.","Filipinas ha rechazado la propuesta de China para crear una reserva natural en aguas en disputa del Mar Meridional. El gobierno filipino argumenta que el plan infringe su soberanía y los derechos marítimos en la región. Esta decisión refleja las tensiones en el área, donde varios países tienen reclamaciones territoriales solapadas. Las autoridades filipinas han expresado su compromiso de proteger sus intereses en el mar, reafirmando su postura frente a las iniciativas chinas y buscando fortalecer su posición ante la comunidad internacional.",""
"09/11/2025 11:25:43","https://infobae.com/historias/2025/09/11/la-caida-de-la-primera-estrella-de-hollywood-en-ganar-un-millon-de-dolares-y-el-caso-de-violacion-y-muerte-en-el-que-quedo-envuelto/","La caída de la primera estrella de Hollywood en ganar un millón de dólares y el caso de violación y muerte en el que quedó envuelto","La caída de la primera estrella de Hollywood en ganar un millón de dólares y el caso de violación y muerte que la involucró","https://encrypted-tbn0.gstatic.com/images?q=tbn:ANd9GcSSYl3b3PVGLrc8B4w-0DruRyt6lVEugXWlI5ULrYqkRl6cH3iXNShLWr4LEg&amp;s","La noticia aborda el escándalo que rodea a una figura destacada de Hollywood, quien fue la primera estrella en recibir un millón de dólares por una película. Su carrera, sin embargo, se vio truncada por un caso de violación y asesinato, que ha generado conmoción y debate en la industria del cine. A medida que se desvelan los detalles del caso, se examinan las implicancias que este incidente ha tenido en la percepción pública y la reputación de los involucrados, así como el impacto en su legado profesional.","La noticia aborda el escándalo que rodea a una figura destacada de Hollywood, quien fue la primera estrella en recibir un millón de dólares por una película. Su carrera, sin embargo, se vio truncada por un caso de violación y asesinato, que ha generado conmoción y debate en la industria del cine. A medida que se desvelan los detalles del caso, se examinan las implicancias que este incidente ha tenido en la percepción pública y la reputación de los involucrados, así como el impacto en su legado profesional.",""
"09/11/2025 11:25:43","https://infobae.com/estados-unidos/2025/09/11/estos-son-los-lideres-de-estados-unidos-que-han-sido-blanco-de-la-violencia-politica-en-la-ultima-decada/","Estos son los líderes de Estados Unidos que han sido blanco de la violencia política en la última década","Líderes de Estados Unidos blanco de la violencia política en la última década","https://encrypted-tbn0.gstatic.com/images?q=tbn:ANd9GcRPHEUv1zH8zJRbz0J6r-9WSPEot6TMWAWvE-BSn9OFgN49TnWlolSzvHQUmg&amp;s","El artículo de Infobae aborda la violencia política en Estados Unidos, destacando varios líderes que han sido objetivo de agresiones en la última década. Se mencionan ataques físicos y amenazas que han afectado a figuras públicas en la política, reflejando un ambiente de creciente tensión y división. El informe también resalta el contexto en el que se han producido estos hechos, incluyendo factores como el extremismo político y el uso de redes sociales para incitar la violencia. Además, se citan ejemplos concretos de incidentes que han marcado este periodo y se analiza la repercusión que esta violencia tiene en la democracia y la participación política.","El artículo de Infobae aborda la violencia política en Estados Unidos, destacando varios líderes que han sido objetivo de agresiones en la última década. Se mencionan ataques físicos y amenazas que han afectado a figuras públicas en la política, reflejando un ambiente de creciente tensión y división. El informe también resalta el contexto en el que se han producido estos hechos, incluyendo factores como el extremismo político y el uso de redes sociales para incitar la violencia. Además, se citan ejemplos concretos de incidentes que han marcado este periodo y se analiza la repercusión que esta violencia tiene en la democracia y la participación política.",""
"09/11/2025 11:25:43","https://infobae.com/america/mundo/2025/09/10/el-impactante-video-de-como-quedo-el-hotel-hilton-de-katmandu-tras-las-protestas-que-derrocaron-al-gobierno-en-nepal/","El impactante video de cómo quedó el hotel Hilton de Katmandú tras las protestas que derrocaron al gobierno en Nepal","Impactante video muestra el estado del hotel Hilton de Katmandú tras protestas que derrocaron al gobierno en Nepal","https://encrypted-tbn0.gstatic.com/images?q=tbn:ANd9GcTEDbfWwqZmrsaQIkrKaprIgJ97f-Q561XEZjIUyIFF-aMJVR7pwfrcfYCLtAI&amp;s","Un video reciente muestra los daños significativos en el hotel Hilton de Katmandú, Nepal, tras las protestas que llevaron a la destitución del gobierno. Las manifestaciones estallaron como respuesta a la crisis política y económica en el país. El video revela las condiciones deterioradas del hotel, reflejando la agitación social y el impacto de los disturbios en la infraestructura local. Las protestas han generado un amplio descontento entre la población, que clama por cambios en la gestión del gobierno.","Un video reciente muestra los daños significativos en el hotel Hilton de Katmandú, Nepal, tras las protestas que llevaron a la destitución del gobierno. Las manifestaciones estallaron como respuesta a la crisis política y económica en el país. El video revela las condiciones deterioradas del hotel, reflejando la agitación social y el impacto de los disturbios en la infraestructura local. Las protestas han generado un amplio descontento entre la población, que clama por cambios en la gestión del gobierno.",""
