"FechayHora","LinkOrigen","TituloOrigen","Titulo","Imagen","Intro","Noticia","Datos"
"08/12/2025 16:14:25","https://infobae.com/america/mundo/2025/08/12/la-ue-advirtio-que-putin-pretende-retrasar-las-sanciones-en-la-cumbre-de-alaska-solo-busca-y-una-fotografia-diplomatica-con-trump/","La UE advirtió que Putin pretende retrasar las sanciones en la cumbre de Alaska: “Solo busca una foto con Trump”","Se consultó el Titulo a la IA","https://encrypted-tbn0.gstatic.com/images?q=tbn:ANd9GcS6ZVnMuA7VeGmtmtCXiwllBrv26-2Jg2vAx-YVTCp8_66am9fYrA7-so2yzg&amp;s","Se consultó la Nota a la IA","Se consultó la Nota a la IA","Se consultó el Datos a la IA"
"08/12/2025 16:14:25","https://infobae.com/america/mundo/2025/08/11/finlandia-acuso-por-sabotaje-a-tres-tripulantes-de-un-petrolero-vinculado-a-rusia/","Finlandia acusó por sabotaje a tres tripulantes de un petrolero vinculado a Rusia","Se consultó el Titulo a la IA","https://encrypted-tbn0.gstatic.com/images?q=tbn:ANd9GcT7WmFh3G6JIiFazOgXSuKY2hjp4Ol_QZIAlKDVUmWFfqXvyBVUaHqw6BrwL68&amp;s","Se consultó la Nota a la IA","Se consultó la Nota a la IA","Se consultó el Datos a la IA"
"08/12/2025 16:14:25","https://infobae.com/america/mundo/2025/08/11/el-presidente-de-israel-califico-de-grave-y-peligroso-error-el-reconocimiento-de-australia-a-palestina/","El presidente de Israel calificó de “grave y peligroso error” el reconocimiento de Australia a Palestina","Se consultó el Titulo a la IA","https://encrypted-tbn0.gstatic.com/images?q=tbn:ANd9GcTaVtzgQ1ybPTjOkCIKaJ1cbElHtnqHfQus_e0xksq2MlUTqoaBK-G03Fg1jvI&amp;s","Se consultó la Nota a la IA","Se consultó la Nota a la IA","Se consultó el Datos a la IA"
"08/12/2025 16:14:26","https://infobae.com/america/america-latina/2025/08/11/crisis-en-cuba-el-peso-alcanza-un-minimo-historico-mientras-la-dolarizacion-gana-terreno-en-la-isla/","Crisis en Cuba: el peso alcanza un mínimo histórico mientras la dolarización gana terreno en la isla","Se consultó el Titulo a la IA","https://encrypted-tbn0.gstatic.com/images?q=tbn:ANd9GcS1ijT2AHs_6Ilne_5ACAdPOjzBGeeJApSAVrYaQkLb-akRme0oqiQp4Y1mUps&amp;s","Se consultó la Nota a la IA","Se consultó la Nota a la IA","Se consultó el Datos a la IA"
"08/12/2025 16:14:26","https://infobae.com/entretenimiento/2025/08/12/taylor-swift-anuncio-el-lanzamiento-de-the-life-of-a-showgirl-su-nuevo-album-de-estudio/","Taylor Swift anunció el lanzamiento de “The Life of a Showgirl”, su nuevo álbum de estudio","Se consultó el Titulo a la IA","https://encrypted-tbn0.gstatic.com/images?q=tbn:ANd9GcQZiAI1xgGs1KKqm7TplhqjjkN16VMlJlTwpN5v_rAGJB53zgSDwDNoa_pGMYM&amp;s","Se consultó la Nota a la IA","Se consultó la Nota a la IA","Se consultó el Datos a la IA"
"08/12/2025 16:14:26","https://infobae.com/deportes/2025/08/11/la-conmebol-confirmo-el-estadio-donde-se-jugara-la-final-de-la-libertadores-2025/","La Conmebol confirmó el estadio donde se jugará la final de la Libertadores 2025","Se consultó el Titulo a la IA","https://encrypted-tbn0.gstatic.com/images?q=tbn:ANd9GcR1eZo5zL3LfIQ98K5PdC7xaxFD8HKNVWPgaruOIOESmmVSmE5_-PEgYoXSsA&amp;s","Se consultó la Nota a la IA","Se consultó la Nota a la IA","Se consultó el Datos a la IA"
"08/12/2025 16:14:27","https://infobae.com/deportes/2025/08/12/es-la-nueva-gran-promesa-del-futbol-mundial-y-dejo-tendido-en-el-cesped-a-gabriel-heinze-en-la-practica/","Es la nueva gran promesa del fútbol mundial y dejó tendido en el césped a Gabriel Heinze en la práctica","Se consultó el Titulo a la IA","https://encrypted-tbn0.gstatic.com/images?q=tbn:ANd9GcQUfUKn5gx1rywF3H09ZnQpLU9W6rdx1jaRkwSmxU4pN4sOr2Sk_lP3jRyIBA&amp;s","Se consultó la Nota a la IA","Se consultó la Nota a la IA","Se consultó el Datos a la IA"
"08/12/2025 16:14:27","https://infobae.com/deportes/2025/08/11/susto-en-el-masters-1000-de-cincinnati-un-tenista-se-desplomo-y-debio-abandonar-el-partido/","Susto en el Masters 1000 de Cincinnati: un tenista se desplomó y debió abandonar el partido","Se consultó el Titulo a la IA","https://encrypted-tbn0.gstatic.com/images?q=tbn:ANd9GcSGOi_-bmusVnyp0lRRpr7VXvKtfh74SHQWuU3p4fX0pazFfLf8qcdw-89EoZk&amp;s","Se consultó la Nota a la IA","Se consultó la Nota a la IA","Se consultó el Datos a la IA"
"08/12/2025 16:14:27","https://infobae.com/deportes/2025/08/12/murio-el-atleta-mattia-debertolis-tras-colapsar-durante-una-prueba-de-orientacion-en-los-juegos-mundiales-en-china/","Murió el atleta Mattia Debertolis tras colapsar durante una prueba de orientación en los Juegos Mundiales en China","Se consultó el Titulo a la IA","https://encrypted-tbn0.gstatic.com/images?q=tbn:ANd9GcSUxgkKhFE_RgDT5jjv-RjG1LOAY8wVxFn8lGeR1N9JnIKCw-hQRIP_v2dBM7g&amp;s","Se consultó la Nota a la IA","Se consultó la Nota a la IA","Se consultó el Datos a la IA"
"08/12/2025 16:14:27","https://infobae.com/america/america-latina/2025/08/11/jorge-quiroga-denuncio-que-el-gobierno-de-luis-arce-impidio-el-aterrizaje-de-su-avion-en-tarija-es-irresponsable/","Jorge Quiroga denunció que el gobierno de Luis Arce impidió el aterrizaje de su avión en Tarija: “Es irresponsable”","Se consultó el Titulo a la IA","https://encrypted-tbn0.gstatic.com/images?q=tbn:ANd9GcShRkSyyOf71He7mcvrp2Fz2XtjsA7a8NsV1yXycZ5sgj_xXbpu3hdq68wktg&amp;s","Se consultó la Nota a la IA","Se consultó la Nota a la IA","Se consultó el Datos a la IA"
"08/12/2025 16:14:28","https://infobae.com/america/america-latina/2025/08/12/quienes-son-los-tres-candidatos-que-podrian-redefinir-el-rumbo-politico-de-bolivia/","Quiénes son los tres candidatos que podrían redefinir el rumbo político de Bolivia","Se consultó el Titulo a la IA","https://encrypted-tbn0.gstatic.com/images?q=tbn:ANd9GcSTZMFAi4KsVuZXnvxly4sQ_UjmB9YWnnpH4jhQyqCgtf6wGSYsmvG_Uoqx0nA&amp;s","Se consultó la Nota a la IA","Se consultó la Nota a la IA","Se consultó el Datos a la IA"
"08/12/2025 16:14:28","https://infobae.com/estados-unidos/2025/08/11/wall-street-cerro-con-perdidas-a-la-espera-del-informe-sobre-la-inflacion/","Wall Street cerró con pérdidas a la espera del informe sobre la inflación","Se consultó el Titulo a la IA","https://encrypted-tbn0.gstatic.com/images?q=tbn:ANd9GcRZTdDf5N6EHr8f3gqsApRu-0B49fpRhTHLhmbKSq_sM8HdDlSV74VL5N8E9Q&amp;s","Se consultó la Nota a la IA","Se consultó la Nota a la IA","Se consultó el Datos a la IA"
"08/12/2025 16:14:28","https://infobae.com/america/mundo/2025/08/11/donald-trump-aseguro-que-las-negociaciones-con-china-avanzan-antes-de-que-expire-la-tregua-arancelaria/","Donald Trump extendió por otros 90 días la tregua arancelaria con China","Se consultó el Titulo a la IA","https://encrypted-tbn0.gstatic.com/images?q=tbn:ANd9GcTJpSpyzqOHQOpQAG3VUZFaOyNOWS9Co_ELX_bdb-s-7bTQIYb5uOi07WXoyQ&amp;s","Se consultó la Nota a la IA","Se consultó la Nota a la IA","Se consultó el Datos a la IA"
"08/12/2025 16:14:29","https://infobae.com/america/mundo/2025/08/12/los-mercados-asiaticos-reaccionaron-con-alzas-tras-la-prorroga-arancelaria-de-90-dias-entre-estados-unidos-y-china/","Los mercados asiáticos reaccionaron con alzas tras la prórroga arancelaria entre Estados Unidos y China","Se consultó el Titulo a la IA","https://encrypted-tbn0.gstatic.com/images?q=tbn:ANd9GcQa_acETrtopIt7kBlZ0gDEj0y6r2WBY5notargVCwjrH3vm3ahFGPeUp6-foo&amp;s","Se consultó la Nota a la IA","Se consultó la Nota a la IA","Se consultó el Datos a la IA"
"08/12/2025 16:14:29","https://infobae.com/venezuela/2025/08/12/el-regimen-de-maduro-redoblo-sus-amenazas-contra-guyana-por-el-esequibo-mas-temprano-que-tarde-lo-vamos-a-recuperar/","El régimen de Maduro redobló sus amenazas contra Guyana por el territorio Esequibo: “Lo vamos a recuperar”","Se consultó el Titulo a la IA","https://encrypted-tbn0.gstatic.com/images?q=tbn:ANd9GcTHsuSsxoBIj1rElNyh12MvpKrgMwWrtKpy6zELm5Nb8hU9LGJgGamIcrWHMvk&amp;s","Se consultó la Nota a la IA","Se consultó la Nota a la IA","Se consultó el Datos a la IA"
"08/12/2025 16:14:29","https://infobae.com/estados-unidos/2025/08/12/eeuu-anticipa-nuevas-medidas-contra-el-dictador-nicolas-maduro-y-llama-a-los-venezolanos-a-alzarse-y-reclamar-su-libertad/","EEUU anticipa nuevas medidas contra el dictador Nicolás Maduro y llama a los venezolanos a “alzarse y reclamar su libertad”","Se consultó el Titulo a la IA","https://encrypted-tbn0.gstatic.com/images?q=tbn:ANd9GcSjhu9fw2-UhVqj9h9vDWj7UDRKxc50N42b9w5Iz_Lwkbrt_oKdYzsss3zYDGs&amp;s","Se consultó la Nota a la IA","Se consultó la Nota a la IA","Se consultó el Datos a la IA"
"08/12/2025 16:14:30","https://infobae.com/deportes/2025/08/11/terror-en-el-mundial-sub-20-de-waterpolo-femenino-un-partido-se-interrumpio-por-una-balacera/","Terror en el Mundial Sub 20 de waterpolo femenino: un partido se interrumpió por una balacera","Se consultó el Titulo a la IA","https://encrypted-tbn0.gstatic.com/images?q=tbn:ANd9GcTIf9cp45ABiKDaMezpSW3Mwre-0oTksvlvxGTW9CU_0I5eEK72CeNg9Odj4Q&amp;s","Se consultó la Nota a la IA","Se consultó la Nota a la IA","Se consultó el Datos a la IA"
"08/12/2025 16:14:30","https://infobae.com/america/mundo/2025/08/11/el-fondo-soberano-de-noruega-vende-una-quinta-parte-de-sus-participaciones-en-empresas-israelies/","El fondo soberano de Noruega vende una quinta parte de sus participaciones en empresas israelíes","Se consultó el Titulo a la IA","https://encrypted-tbn0.gstatic.com/images?q=tbn:ANd9GcRfTWGBif1WDtoNa4pWbK2XcEzTo62f0SuUq5MDYCtpDqgjzSEUUXprylwufyo&amp;s","Se consultó la Nota a la IA","Se consultó la Nota a la IA","Se consultó el Datos a la IA"
"08/12/2025 16:14:31","https://infobae.com/america/mundo/2025/08/12/europa-acelera-la-expansion-de-sus-fabricas-de-armas-ante-la-amenaza-rusa/","Europa acelera la expansión de sus fábricas de armas ante la amenaza rusa","Se consultó el Titulo a la IA","https://encrypted-tbn0.gstatic.com/images?q=tbn:ANd9GcQ6mUdCtlNA64OD97cky41od-6RlHZTBf1hW7TLAFxTq1oPlSlFpz_z8IqI4A&amp;s","Se consultó la Nota a la IA","Se consultó la Nota a la IA","Se consultó el Datos a la IA"
"08/12/2025 16:14:31","https://infobae.com/america/mundo/2025/08/12/como-actuan-las-redes-chinas-que-impulsan-la-mineria-ilegal-de-oro-en-asia-africa-y-sudamerica/","Cómo actúan las redes chinas que impulsan la minería ilegal de oro en Asia, África y Sudamérica","Se consultó el Titulo a la IA","https://encrypted-tbn0.gstatic.com/images?q=tbn:ANd9GcRAaLTxKwi0DXyel0b1hstY8QcD41KYLqQQOvgdxA03q64PpDIjuyTrEI_zQbw&amp;s","Se consultó la Nota a la IA","Se consultó la Nota a la IA","Se consultó el Datos a la IA"
"08/12/2025 16:14:31","https://infobae.com/estados-unidos/2025/08/12/la-inflacion-al-consumidor-en-estados-unidos-se-mantuvo-en-el-27-en-julio/","La inflación al consumidor en Estados Unidos se mantuvo en el 2,7% en julio","Se consultó el Titulo a la IA","https://encrypted-tbn0.gstatic.com/images?q=tbn:ANd9GcTF5JVd52uoJMkYbDaFedRvouFVa23NR8mPAqJqGvwjC70B5bCbumkY9BsO_hw&amp;s","Se consultó la Nota a la IA","Se consultó la Nota a la IA","Se consultó el Datos a la IA"
"08/12/2025 16:14:32","https://infobae.com/america/mundo/2025/08/12/un-destructor-de-7500-toneladas-la-torpeza-de-encerrar-a-un-patrullero-y-la-humillacion-de-la-armada-china/","Un destructor de 7.500 toneladas, la torpeza de encerrar a un patrullero y la humillación de la Armada china","Se consultó el Titulo a la IA","https://encrypted-tbn0.gstatic.com/images?q=tbn:ANd9GcSDT8tQHwcgGu4c2l-KNgTo2mez8qTa_E1uQnOJreK-38T53K1kWUeMLwuhEoE&amp;s","Se consultó la Nota a la IA","Se consultó la Nota a la IA","Se consultó el Datos a la IA"
"08/12/2025 16:14:32","https://infobae.com/venezuela/2025/08/12/maria-corina-machado-y-edmundo-gonzalez-urrutia-expresaron-su-dolor-por-la-muerte-del-senador-colombiano-miguel-uribe/","María Corina Machado y Edmundo González Urrutia expresaron su dolor por la muerte del senador colombiano Miguel Uribe","Se consultó el Titulo a la IA","https://encrypted-tbn0.gstatic.com/images?q=tbn:ANd9GcSbGJLsc4g87Ha7El0_qlXJlq84cp4cf2jzoUSeStZl8xhXg-Bgirl9JhGkcw&amp;s","Se consultó la Nota a la IA","Se consultó la Nota a la IA","Se consultó el Datos a la IA"
"08/12/2025 16:14:33","https://infobae.com/america/mundo/2025/08/12/israel-desmantelo-decenas-de-tuneles-de-hamas-en-gaza-como-parte-de-la-operacion-carros-de-gedeon/","Israel desmanteló decenas de túneles de Hamas en Gaza como parte de la operación “Carros de Gedeón”","Se consultó el Titulo a la IA","https://encrypted-tbn0.gstatic.com/images?q=tbn:ANd9GcRFG7Ae2E3r7lK_dE8jfF8jb3Em13rhLGJoHXJBy6RVQh_N6tzvIkTQZMMdF8Q&amp;s","Se consultó la Nota a la IA","Se consultó la Nota a la IA","Se consultó el Datos a la IA"
"08/12/2025 16:14:33","https://infobae.com/america/america-latina/2025/08/12/lula-y-xi-jinping-acordaron-ampliar-su-cooperacion-pese-a-las-advertencias-de-eeuu-sobre-las-practicas-desleales-de-beijing/","Lula y Xi Jinping acordaron ampliar su cooperación pese a las advertencias de EEUU sobre las prácticas desleales de China","Se consultó el Titulo a la IA","https://encrypted-tbn0.gstatic.com/images?q=tbn:ANd9GcRRi4m_QFl52AkqwFKFKkdQnmAET3tzjl_D516jW70IkOovi2KZvTDPPtLZZHs&amp;s","Se consultó la Nota a la IA","Se consultó la Nota a la IA","Se consultó el Datos a la IA"
"08/12/2025 16:14:33","https://infobae.com/america/mundo/2025/08/11/la-union-europea-insto-a-israel-a-permitir-el-ingreso-de-mas-ayuda-humanitaria-en-gaza/","La Unión Europea instó a Israel a permitir el ingreso de más ayuda humanitaria en Gaza","Se consultó el Titulo a la IA","https://encrypted-tbn0.gstatic.com/images?q=tbn:ANd9GcR6FYG5qae3NAPe6gCKnY6X7vudjVqPa9U2BVsaKjMHpupRchJsT4J-DpIoGg&amp;s","Se consultó la Nota a la IA","Se consultó la Nota a la IA","Se consultó el Datos a la IA"
"08/12/2025 16:14:33","https://infobae.com/america/mundo/2025/08/11/el-ejercito-de-corea-del-sur-se-redujo-un-20-en-seis-anos-tras-una-fuerte-caida-de-la-poblacion-masculina/","El Ejército de Corea del Sur se redujo un 20% en seis años tras una fuerte caída de la población masculina","Se consultó el Titulo a la IA","https://encrypted-tbn0.gstatic.com/images?q=tbn:ANd9GcSOXhZ5DG_vF-poiqZvszgAo8nUT37fxaTEx2QlpU157MKd3abVtMnG_loTw8c&amp;s","Se consultó la Nota a la IA","Se consultó la Nota a la IA","Se consultó el Datos a la IA"
"08/12/2025 16:14:34","https://infobae.com/america/mundo/2025/08/12/the-wall-street-journal-que-esta-en-juego-en-la-cumbre-de-alaska/","The Wall Street Journal: qué está en juego en la cumbre de Alaska","Se consultó el Titulo a la IA","https://encrypted-tbn0.gstatic.com/images?q=tbn:ANd9GcQ0wChsC4oT4PTg9RPy0pngAW_5KXAyrrH7KamFT5kWENssuhThfIVIGsnVgHo&amp;s","Se consultó la Nota a la IA","Se consultó la Nota a la IA","Se consultó el Datos a la IA"
"08/12/2025 16:14:34","https://infobae.com/america/mundo/2025/08/12/la-ue-condiciono-el-dialogo-sobre-ucrania-a-un-alto-el-fuego-ruso-y-respaldo-el-derecho-de-kiev-a-decidir-su-futuro/","La UE condicionó el diálogo sobre Ucrania a un alto el fuego ruso y respaldó el derecho de Kiev a decidir su futuro","Se consultó el Titulo a la IA","https://encrypted-tbn0.gstatic.com/images?q=tbn:ANd9GcQlfxg3q88SOnXcmcBpuneXcBwAcQMNqbdIaGyKnYHxEnwrm_3jV0GhKBc9Og&amp;s","Se consultó la Nota a la IA","Se consultó la Nota a la IA","Se consultó el Datos a la IA"
"08/12/2025 16:14:34","https://infobae.com/deportes/2025/08/12/luka-doncic-dio-detalles-de-su-impactante-transformacion-fisica-y-revelo-cuantos-kilos-bajo-soy-muy-competitivo/","Luka Doncic dio detalles de su impactante transformación física y reveló cuántos kilos bajó: “Soy muy competitivo”","Se consultó el Titulo a la IA","https://encrypted-tbn0.gstatic.com/images?q=tbn:ANd9GcTTDFRoYMWp5ZiU4vlFCNzixktuAI7TA6jJaBi9Z03Qbcnlc077kj0oYajHLIA&amp;s","Se consultó la Nota a la IA","Se consultó la Nota a la IA","Se consultó el Datos a la IA"
"08/12/2025 16:14:35","https://infobae.com/america/mundo/2025/08/11/estados-unidos-insistio-en-que-influencia-de-china-en-el-canal-de-panama-amenaza-la-seguridad-global/","Estados Unidos insistió en que influencia de China en el Canal de Panamá “amenaza la seguridad global”","Se consultó el Titulo a la IA","https://encrypted-tbn0.gstatic.com/images?q=tbn:ANd9GcRLMO826Jz2sb4eaylvC_mDsv4JupEAAJbc4Nm_zR6wZuwS4QGSCD4UOyfFz_I&amp;s","Se consultó la Nota a la IA","Se consultó la Nota a la IA","Se consultó el Datos a la IA"
"08/12/2025 16:14:35","https://infobae.com/america/mundo/2025/08/11/como-kim-ju-ae-paso-de-la-mano-de-su-padre-a-la-primera-fila-del-poder-en-corea-del-norte/","Cómo Kim Ju-ae pasó de la mano de su padre a la primera fila del poder en Corea del Norte","Se consultó el Titulo a la IA","https://encrypted-tbn0.gstatic.com/images?q=tbn:ANd9GcSqcoXyuFqYUsa4i2oDus1YY8Ho30jfbRVpqItpxkQLm6jHPBD9vSMx7MtEKMM&amp;s","Se consultó la Nota a la IA","Se consultó la Nota a la IA","Se consultó el Datos a la IA"
"08/12/2025 16:14:35","https://infobae.com/america/mundo/2025/08/12/nueva-amenaza-de-kim-jong-un-el-ejercito-norcoreano-efectuo-disparos-de-artilleria-cerca-de-la-frontera-con-corea-del-sur/","Nueva amenaza de Kim Jong-un: el Ejército norcoreano efectuó disparos de artillería cerca de la frontera con Corea del Sur","Se consultó el Titulo a la IA","https://encrypted-tbn0.gstatic.com/images?q=tbn:ANd9GcRQ195ThkRsppRQbW4cMs41dnUgS5o8LzcrTMS9Id7BMzMGcBiH_ocMg58iKHw&amp;s","Se consultó la Nota a la IA","Se consultó la Nota a la IA","Se consultó el Datos a la IA"
"08/12/2025 16:14:36","https://infobae.com/america/america-latina/2025/08/12/ataque-armado-en-ecuador-sicarios-con-indumentaria-militar-asesinaron-a-seis-personas-en-plena-via-publica/","Ataque armado en Ecuador: sicarios con indumentaria militar asesinaron a seis personas en plena vía pública","Se consultó el Titulo a la IA","https://encrypted-tbn0.gstatic.com/images?q=tbn:ANd9GcQVHQDsc6fjJ-ZH2G6_B7Wf6tX2J0VRGSWP0Z5uS7Cteu-XgZH2FibuLVGin_E&amp;s","Se consultó la Nota a la IA","Se consultó la Nota a la IA","Se consultó el Datos a la IA"
