"Fecha","Tipo","Descripcion"
"1297","EfemerideEvento","Batalla del Puente de Stirling: Escoceses liderados conjuntamente por William Wallace y Andrew Moray derrotan a los ingleses."
"1226","EfemerideEvento","La primera instancia registrada de la práctica católica de la adoración eucarística perpetua comienza formalmente en Aviñón, Francia."
"1185","EfemerideEvento","Isaac II Angelos mata a Stephen Hagiochristophorites y luego apela al pueblo, lo que resulta en la revuelta que depone a Andronikos I Komnenos y coloca a Isaac en el trono del Imperio Bizantino."
"600","EfemerideNacimientos","Yuknoom Ch'een II, gobernante maya"
"1993","EfemerideNacimientos","Farrah Moan, reina drag estadounidense y artista."
"1992","EfemerideNacimientos","Jonathan Adams, lanzador de disco inglés."
"Wilson Flagg, American admiral (b. 1938)","EfemerideFallecimientos","Jonathan Adams, lanzador de disco inglés."
"Timothy Maude, American general (b. 1947)","EfemerideFallecimientos","Jonathan Adams, lanzador de disco inglés."
"Ronald Paul Bucca, American fire marshal (b. 1954)","EfemerideFallecimientos","Jonathan Adams, lanzador de disco inglés."